tweetid,author_id,text,created_at,geo,retweets,replies,likes,quote_count,lang,conversation_id,context_annotations,entities,attachments,possibly_sensitive,withheld,reply_settings,source
1521655062656868352,1417587809502826500,"ESTÁTISTICAS: O Roblox já perdeu mais de 90% dos jogadores desde o ínicio da queda! 

O Roblox contava com 3,3 milhões de pessoas jogando há 2 horas atrás, e esse número já caiu para 55.536!

Site: https://t.co/9MhcKbirBb https://t.co/5cmTde1bv7",2022-05-04 00:56:52+00:00,,8,7,39,0,pt,1521655062656868352,"[{'domain': {'id': '71', 'name': 'Video Game', 'description': 'A video game like Overwatch'}, 'entity': {'id': '1088118927580774400', 'name': 'Roblox', 'description': 'Roblox'}}]","{'urls': [{'start': 198, 'end': 221, 'url': 'https://t.co/9MhcKbirBb', 'expanded_url': 'https://v3.rtrack.live/landing', 'display_url': 'v3.rtrack.live/landing', 'status': 200, 'title': 'The definitive free Roblox analytics service, tracking millions of games | RTrack', 'description': ""Search for some games or use the game sorts to find games! They'll show up here so you can find them later. RTrack's mission is to create the tools Roblox developers need to get valuable insights into their games and players. This starts with analytics, providing minute by minute data on player counts, sessions, playtime and more to millions of games, no matter their size. RTrack's free tier allows developers big and small to leverage RTrack's basic tools and insights to make data-driven decisions on"", 'unwound_url': 'https://v3.rtrack.live/landing'}, {'start': 222, 'end': 245, 'url': 'https://t.co/5cmTde1bv7', 'expanded_url': 'https://twitter.com/Roblox_RTC_BR/status/1521655062656868352/photo/1', 'display_url': 'pic.twitter.com/5cmTde1bv7', 'media_key': '3_1521654961360228352'}]}",{'media_keys': ['3_1521654961360228352']},False,,everyone,Twitter Web App
1521560311358230531,2850532049,lets lower the roblox stock,2022-05-03 18:40:22+00:00,,207,249,7075,6,en,1521553803086024704,"[{'domain': {'id': '71', 'name': 'Video Game', 'description': 'A video game like Overwatch'}, 'entity': {'id': '1088118927580774400', 'name': 'Roblox', 'description': 'Roblox'}}]",,,False,,everyone,Twitter Web App
1521541685947383808,1363962658739879938,@enderwii @Bestie_Buddies Your opinion is wrong,2022-05-03 17:26:21+00:00,,0,3,0,0,en,1520625261758230529,[],"{'mentions': [{'start': 0, 'end': 9, 'username': 'enderwii', 'id': '1161034263476789249'}, {'start': 10, 'end': 25, 'username': 'Bestie_Buddies', 'id': '1359738127938580484'}]}",,False,,everyone,Twitter for iPhone
1521193832007618561,984854848460828672,"Para celebrar el Día del Niño en México el pasado sábado, Roblox sacó un objeto virtual gratis. Obtén tu Luchador campéon ya, antes de que se retire del ring el 8 de mayo 😃. https://t.co/jvSRrhaTTe https://t.co/ApbSKh8A8O",2022-05-02 18:24:06+00:00,,26,69,408,1,es,1521193832007618561,"[{'domain': {'id': '29', 'name': 'Events [Entity Service]', 'description': 'Entity Service related Events domain'}, 'entity': {'id': '1465690254975766530', 'name': ""Children's Day""}}, {'domain': {'id': '71', 'name': 'Video Game', 'description': 'A video game like Overwatch'}, 'entity': {'id': '1088118927580774400', 'name': 'Roblox', 'description': 'Roblox'}}, {'domain': {'id': '119', 'name': 'Holiday', 'description': 'Holidays like Christmas or Halloween'}, 'entity': {'id': '1465690254975766530', 'name': ""Children's Day""}}, {'domain': {'id': '29', 'name': 'Events [Entity Service]', 'description': 'Entity Service related Events domain'}, 'entity': {'id': '1518672034812743681', 'name': '5月5日はこどもの日 🎏'}}]","{'annotations': [{'start': 17, 'end': 28, 'probability': 0.7042, 'type': 'Other', 'normalized_text': 'Día del Niño'}, {'start': 33, 'end': 38, 'probability': 0.9426, 'type': 'Place', 'normalized_text': 'México'}, {'start': 58, 'end': 63, 'probability': 0.578, 'type': 'Organization', 'normalized_text': 'Roblox'}], 'urls': [{'start': 174, 'end': 197, 'url': 'https://t.co/jvSRrhaTTe', 'expanded_url': 'https://www.roblox.com/catalog/9071739482/Luchador-Champion', 'display_url': 'roblox.com/catalog/907173…', 'status': 200, 'title': 'Luchador Champion - Roblox', 'description': 'Roblox is a global platform that brings people together through play.', 'unwound_url': 'https://www.roblox.com/catalog/9071739482/Luchador-Champion'}, {'start': 198, 'end': 221, 'url': 'https://t.co/ApbSKh8A8O', 'expanded_url': 'https://twitter.com/RobloxEspanol/status/1521193832007618561/photo/1', 'display_url': 'pic.twitter.com/ApbSKh8A8O', 'media_key': '3_1521193788047126529'}]}",{'media_keys': ['3_1521193788047126529']},False,,everyone,Twitter Web App
1521541705375399941,1337570368442281986,@JustinGamerYT1 @Roblox no https://t.co/ebWUyHj2vh,2022-05-03 17:26:26+00:00,,0,3,2,0,und,1521159568562147329,"[{'domain': {'id': '71', 'name': 'Video Game', 'description': 'A video game like Overwatch'}, 'entity': {'id': '1088118927580774400', 'name': 'Roblox', 'description': 'Roblox'}}]","{'urls': [{'start': 27, 'end': 50, 'url': 'https://t.co/ebWUyHj2vh', 'expanded_url': 'https://twitter.com/davilokoio2/status/1521541705375399941/video/1', 'display_url': 'pic.twitter.com/ebWUyHj2vh', 'media_key': '7_1521541678615650306'}], 'mentions': [{'start': 16, 'end': 23, 'username': 'Roblox', 'id': '16745055'}]}",{'media_keys': ['7_1521541678615650306']},False,,everyone,Twitter for Android
1521664553884557315,1277425768075853824,#RobloxDown roblox players beating up robloxs ass when roblox is down: https://t.co/EPTfocVPph,2022-05-04 01:34:35+00:00,,10,29,231,2,en,1521664553884557315,"[{'domain': {'id': '71', 'name': 'Video Game', 'description': 'A video game like Overwatch'}, 'entity': {'id': '1088118927580774400', 'name': 'Roblox', 'description': 'Roblox'}}]","{'hashtags': [{'start': 0, 'end': 11, 'tag': 'RobloxDown'}], 'urls': [{'start': 71, 'end': 94, 'url': 'https://t.co/EPTfocVPph', 'expanded_url': 'https://twitter.com/aminekittygirl/status/1521664553884557315/video/1', 'display_url': 'pic.twitter.com/EPTfocVPph', 'media_key': '7_1521664517201178624'}]}",{'media_keys': ['7_1521664517201178624']},True,,everyone,Twitter Web App
1521632135626596353,1505126119590219780,@Roblox Roblox my acount is hacked https://t.co/ruk6XVbIIP,2022-05-03 23:25:46+00:00,,3,63,73,1,en,1521159568562147329,"[{'domain': {'id': '71', 'name': 'Video Game', 'description': 'A video game like Overwatch'}, 'entity': {'id': '1088118927580774400', 'name': 'Roblox', 'description': 'Roblox'}}]","{'urls': [{'start': 35, 'end': 58, 'url': 'https://t.co/ruk6XVbIIP', 'expanded_url': 'https://twitter.com/Mrzxc13/status/1521632135626596353/photo/1', 'display_url': 'pic.twitter.com/ruk6XVbIIP', 'media_key': '3_1521632133269307394'}], 'mentions': [{'start': 0, 'end': 7, 'username': 'Roblox', 'id': '16745055'}]}",{'media_keys': ['3_1521632133269307394']},False,,everyone,Twitter for Android
1520432900851838978,16745055,The Song Breaker Awards are going live on Roblox at 10AM PST! Celebrate a year in music with host @bretmanrock headliners @lizzo and @whoisgayle special guest @MeganPlays and fans around the world: https://t.co/y83wU0nFtx https://t.co/Zu8sjuXyiI,2022-04-30 16:00:26+00:00,,96,494,1822,31,en,1520432900851838978,"[{'domain': {'id': '10', 'name': 'Person', 'description': 'Named people in the world like Nelson Mandela'}, 'entity': {'id': '1117789006916243456', 'name': 'Lizzo', 'description': 'American rapper'}}, {'domain': {'id': '10', 'name': 'Person', 'description': 'Named people in the world like Nelson Mandela'}, 'entity': {'id': '1141044727136940032', 'name': 'Bretman Rock', 'description': 'Bretman Rock'}}, {'domain': {'id': '54', 'name': 'Musician', 'description': 'A musician in the world, like Adele or Bob Dylan'}, 'entity': {'id': '1117789006916243456', 'name': 'Lizzo', 'description': 'American rapper'}}, {'domain': {'id': '55', 'name': 'Music Genre', 'description': 'A category for a musical style, like Pop, Rock, or Rap'}, 'entity': {'id': '810937888334487552', 'name': 'Rap', 'description': 'Hip-Hop/Rap'}}, {'domain': {'id': '71', 'name': 'Video Game', 'description': 'A video game like Overwatch'}, 'entity': {'id': '1088118927580774400', 'name': 'Roblox', 'description': 'Roblox'}}, {'domain': {'id': '120', 'name': 'Digital Creator', 'description': 'Influencers who create content on digital platforms'}, 'entity': {'id': '1141044727136940032', 'name': 'Bretman Rock', 'description': 'Bretman Rock'}}]","{'annotations': [{'start': 0, 'end': 22, 'probability': 0.5789, 'type': 'Other', 'normalized_text': 'The Song Breaker Awards'}, {'start': 42, 'end': 47, 'probability': 0.3885, 'type': 'Product', 'normalized_text': 'Roblox'}], 'urls': [{'start': 198, 'end': 221, 'url': 'https://t.co/y83wU0nFtx', 'expanded_url': 'https://rblx.co/songbreakerawards', 'display_url': 'rblx.co/songbreakerawa…', 'status': 200, 'title': 'Explore the Song Breaker World', 'description': 'You’re invited to the Logitech Song Breaker Awards, the first music awards show in the metaverse! Join Bretman Rock, MeganPlays, Shroud and Jaden Smith to celebrate groundbreaking creators like Walker Hayes and Cost n’ Mayor who are shaping pop music today through dance challenges, memes and trends shared on TikTok and YouTube. Watch Lizzo’s debut performance on Roblox with her new song “Special” and get up close with GAYLE, who will be performing her Billboard no. 1 hit “abcde-forget-u.” The award show', 'unwound_url': 'https://www.roblox.com/songbreakerawards'}, {'start': 222, 'end': 245, 'url': 'https://t.co/Zu8sjuXyiI', 'expanded_url': 'https://twitter.com/Roblox/status/1520432900851838978/photo/1', 'display_url': 'pic.twitter.com/Zu8sjuXyiI', 'media_key': '3_1520432895814422529'}], 'mentions': [{'start': 98, 'end': 110, 'username': 'bretmanrock', 'id': '291547392'}, {'start': 122, 'end': 128, 'username': 'lizzo', 'id': '323417384'}, {'start': 133, 'end': 144, 'username': 'whoisgayle', 'id': '1098295826424713216'}, {'start': 159, 'end': 170, 'username': 'MeganPlays', 'id': '2586443965'}]}",{'media_keys': ['3_1520432895814422529']},False,,everyone,Hootsuite Inc.
1521671467297132547,1227400589363097601,@yM0on_ @Roblox @RYU9DREAM caiu o server justo no dia que a gente vai jogar,2022-05-04 02:02:03+00:00,,0,2,1,0,pt,1521645255967318016,"[{'domain': {'id': '71', 'name': 'Video Game', 'description': 'A video game like Overwatch'}, 'entity': {'id': '1088118927580774400', 'name': 'Roblox', 'description': 'Roblox'}}]","{'mentions': [{'start': 0, 'end': 7, 'username': 'yM0on_', 'id': '1264376185833902082'}, {'start': 8, 'end': 15, 'username': 'Roblox', 'id': '16745055'}, {'start': 16, 'end': 26, 'username': 'RYU9DREAM', 'id': '1164231223507599360'}]}",,False,,everyone,Twitter for iPhone
1521680644019048449,1434281164953591810,@NoticiasUgc Por favor que no vuelva a suceder lo mismo😩,2022-05-04 02:38:31+00:00,,0,1,0,0,es,1521679440945635328,[],"{'mentions': [{'start': 0, 'end': 12, 'username': 'NoticiasUgc', 'id': '1360224426529329155'}]}",,False,,everyone,Twitter for Android
1521679891107762181,1102772383071387648,"oh hey. i grew up, but so did denis https://t.co/R3NfN1nWlR",2022-05-04 02:35:32+00:00,,5,13,178,0,en,1521679891107762181,[],"{'annotations': [{'start': 30, 'end': 34, 'probability': 0.65, 'type': 'Person', 'normalized_text': 'denis'}], 'urls': [{'start': 36, 'end': 59, 'url': 'https://t.co/R3NfN1nWlR', 'expanded_url': 'https://twitter.com/ItsAmmon/status/1521679891107762181/photo/1', 'display_url': 'pic.twitter.com/R3NfN1nWlR', 'media_key': '3_1521679740431527936'}, {'start': 36, 'end': 59, 'url': 'https://t.co/R3NfN1nWlR', 'expanded_url': 'https://twitter.com/ItsAmmon/status/1521679891107762181/photo/1', 'display_url': 'pic.twitter.com/R3NfN1nWlR', 'media_key': '3_1521679802603761664'}]}","{'media_keys': ['3_1521679740431527936', '3_1521679802603761664']}",False,,everyone,Twitter Web App
1521669949986533376,823752711753469952,"@infobae Wakala, procedo a desinstalar roblox :v",2022-05-04 01:56:01+00:00,,0,7,1,2,ca,1521540498695065600,"[{'domain': {'id': '46', 'name': 'Brand Category', 'description': 'Categories within Brand Verticals that narrow down the scope of Brands'}, 'entity': {'id': '781974596157181956', 'name': 'Online Site'}}, {'domain': {'id': '47', 'name': 'Brand', 'description': 'Brands and Companies'}, 'entity': {'id': '1108424811208835078', 'name': 'Infobae', 'description': 'Infobae'}}, {'domain': {'id': '71', 'name': 'Video Game', 'description': 'A video game like Overwatch'}, 'entity': {'id': '1088118927580774400', 'name': 'Roblox', 'description': 'Roblox'}}]","{'mentions': [{'start': 0, 'end': 8, 'username': 'infobae', 'id': '69416519'}]}",,False,,everyone,Twitter Web App
1521655361832464391,1441149665085313027,When roblox is down and roblox users think they got hacked or banned #RobloxDown https://t.co/4rU39SGC5f,2022-05-04 00:58:03+00:00,,211,174,3220,35,en,1521655361832464391,"[{'domain': {'id': '71', 'name': 'Video Game', 'description': 'A video game like Overwatch'}, 'entity': {'id': '1088118927580774400', 'name': 'Roblox', 'description': 'Roblox'}}]","{'hashtags': [{'start': 69, 'end': 80, 'tag': 'RobloxDown'}], 'urls': [{'start': 81, 'end': 104, 'url': 'https://t.co/4rU39SGC5f', 'expanded_url': 'https://twitter.com/Isaacno14/status/1521655361832464391/video/1', 'display_url': 'pic.twitter.com/4rU39SGC5f', 'media_key': '7_1521655349970935812'}]}",{'media_keys': ['7_1521655349970935812']},False,,everyone,Twitter for iPad
1521597057303121920,16745055,@Spotify @soundtrap @discord Queen SUNMI! So excited to have you on Roblox! 🥰,2022-05-03 21:06:23+00:00,,37,465,544,11,en,1521449221261602817,"[{'domain': {'id': '45', 'name': 'Brand Vertical', 'description': 'Top level entities that describe a Brands industry'}, 'entity': {'id': '781974597310615553', 'name': 'Entertainment'}}, {'domain': {'id': '46', 'name': 'Brand Category', 'description': 'Categories within Brand Verticals that narrow down the scope of Brands'}, 'entity': {'id': '781974597222535168', 'name': 'Online Services'}}, {'domain': {'id': '47', 'name': 'Brand', 'description': 'Brands and Companies'}, 'entity': {'id': '10040276669', 'name': 'Spotify'}}, {'domain': {'id': '47', 'name': 'Brand', 'description': 'Brands and Companies'}, 'entity': {'id': '1168499224297656321', 'name': 'Discord'}}, {'domain': {'id': '67', 'name': 'Interests and Hobbies', 'description': 'Interests, opinions, and behaviors of individuals, groups, or cultures; like Speciality Cooking or Theme Parks'}, 'entity': {'id': '1288826829634035714', 'name': 'Backstage'}}, {'domain': {'id': '71', 'name': 'Video Game', 'description': 'A video game like Overwatch'}, 'entity': {'id': '1088118927580774400', 'name': 'Roblox', 'description': 'Roblox'}}, {'domain': {'id': '165', 'name': 'Technology', 'description': 'for individual and types of technology, e.g., food technology, 3D printing'}, 'entity': {'id': '1196446161223028736', 'name': 'Social media'}}]","{'annotations': [{'start': 29, 'end': 39, 'probability': 0.829, 'type': 'Person', 'normalized_text': 'Queen SUNMI'}, {'start': 68, 'end': 73, 'probability': 0.4973, 'type': 'Product', 'normalized_text': 'Roblox'}], 'mentions': [{'start': 0, 'end': 8, 'username': 'Spotify', 'id': '17230018'}, {'start': 9, 'end': 19, 'username': 'soundtrap', 'id': '882321548'}, {'start': 20, 'end': 28, 'username': 'discord', 'id': '3065618342'}]}",,False,,everyone,Twitter Web App
1521648307679940608,1255111848518651904,roblox still down for anyone else? https://t.co/pL6s70wZy5,2022-05-04 00:30:02+00:00,,143,1206,3731,23,en,1521648307679940608,"[{'domain': {'id': '71', 'name': 'Video Game', 'description': 'A video game like Overwatch'}, 'entity': {'id': '1088118927580774400', 'name': 'Roblox', 'description': 'Roblox'}}]","{'urls': [{'start': 35, 'end': 58, 'url': 'https://t.co/pL6s70wZy5', 'expanded_url': 'https://twitter.com/chizeled_/status/1521648307679940608/photo/1', 'display_url': 'pic.twitter.com/pL6s70wZy5', 'media_key': '3_1521648298595164160'}]}",{'media_keys': ['3_1521648298595164160']},False,,everyone,Twitter Web App
1521680428465364992,1463866111854845955,@Donixfr have u ever played tower of hell 🤭,2022-05-04 02:37:40+00:00,,0,5,4,0,en,1521677971895074817,[],"{'mentions': [{'start': 0, 'end': 8, 'username': 'Donixfr', 'id': '1492003723110985764'}]}",,False,,everyone,Twitter for iPhone
1521501947714539523,1199001259904307207,"Welcome to #Roblox Spotify Island. 🎶 Meet your favorite artists, play with sounds, and more. The possibilities are endless!

Link: https://t.co/HztLAteVgZ https://t.co/uHr2DAFMFM",2022-05-03 14:48:27+00:00,,38,36,422,2,en,1521501947714539523,"[{'domain': {'id': '45', 'name': 'Brand Vertical', 'description': 'Top level entities that describe a Brands industry'}, 'entity': {'id': '781974597310615553', 'name': 'Entertainment'}}, {'domain': {'id': '46', 'name': 'Brand Category', 'description': 'Categories within Brand Verticals that narrow down the scope of Brands'}, 'entity': {'id': '781974597222535168', 'name': 'Online Services'}}, {'domain': {'id': '47', 'name': 'Brand', 'description': 'Brands and Companies'}, 'entity': {'id': '10040276669', 'name': 'Spotify'}}, {'domain': {'id': '67', 'name': 'Interests and Hobbies', 'description': 'Interests, opinions, and behaviors of individuals, groups, or cultures; like Speciality Cooking or Theme Parks'}, 'entity': {'id': '1288826829634035714', 'name': 'Backstage'}}, {'domain': {'id': '71', 'name': 'Video Game', 'description': 'A video game like Overwatch'}, 'entity': {'id': '1088118927580774400', 'name': 'Roblox', 'description': 'Roblox'}}]","{'annotations': [{'start': 19, 'end': 32, 'probability': 0.3436, 'type': 'Product', 'normalized_text': 'Spotify Island'}], 'hashtags': [{'start': 11, 'end': 18, 'tag': 'Roblox'}], 'urls': [{'start': 131, 'end': 154, 'url': 'https://t.co/HztLAteVgZ', 'expanded_url': 'https://www.roblox.com/games/8209480473/Spotify-Island', 'display_url': 'roblox.com/games/82094804…', 'images': [{'url': 'https://pbs.twimg.com/news_img/1539716087390019592/GLYMsOb5?format=jpg&name=orig', 'width': 498, 'height': 280}, {'url': 'https://pbs.twimg.com/news_img/1539716087390019592/GLYMsOb5?format=jpg&name=150x150', 'width': 150, 'height': 150}], 'status': 200, 'title': 'Spotify Island', 'description': 'Check out Spotify Island. It’s one of the millions of unique, user-generated 3D experiences created on Roblox. SUNMI IS HERE! 🦋 Visit SUNMI in K-Park! Get her in-game items and complete her brand-new scavenger hunt! The Butterfly Wings - SUNMI will be available for free when you jump through the K-Park portal until Monday night 12am PST. We are working on a solution to compensate everyone who has already bought the wings. 🌴 Welcome to Spotify Island. Your next adventure awaits! 👨\u200d🎤 Meet your favorite artists! 🎵 Play with sounds! 🧭 Explore quests! 🦋 Collect special merch! 🥰 Have fun and be kind! ✨ The possibilities are endless! Like reward goal! 10K Likes = Double XP! ⭐ 20K Likes = Promo code: SPOTIFY20K 30K Likes = Promo code: SPOTIFY30K Next reward at 40K likes!', 'unwound_url': 'https://www.roblox.com/games/8209480473/Spotify-Island'}, {'start': 155, 'end': 178, 'url': 'https://t.co/uHr2DAFMFM', 'expanded_url': 'https://twitter.com/RBXNews_/status/1521501947714539523/photo/1', 'display_url': 'pic.twitter.com/uHr2DAFMFM', 'media_key': '3_1521501937375526914'}]}",{'media_keys': ['3_1521501937375526914']},False,,everyone,Twitter Web App
1521679656390324225,1137502408437895168,@NoticiasUgc Aguante noticias roblox pa,2022-05-04 02:34:36+00:00,,0,1,4,0,es,1521679440945635328,"[{'domain': {'id': '71', 'name': 'Video Game', 'description': 'A video game like Overwatch'}, 'entity': {'id': '1088118927580774400', 'name': 'Roblox', 'description': 'Roblox'}}]","{'mentions': [{'start': 0, 'end': 12, 'username': 'NoticiasUgc', 'id': '1360224426529329155'}]}",,False,,everyone,Twitter for iPhone
1521679196405313536,1448022758261248009,@ALEXSAN92918837 @Roblox_RTC_BR Perguntei se você conseguiu recuperar sua conta do roblox kkk,2022-05-04 02:32:46+00:00,,1,1,1,0,pt,1464385991758819360,"[{'domain': {'id': '71', 'name': 'Video Game', 'description': 'A video game like Overwatch'}, 'entity': {'id': '1088118927580774400', 'name': 'Roblox', 'description': 'Roblox'}}]","{'mentions': [{'start': 0, 'end': 16, 'username': 'ALEXSAN92918837', 'id': '1387759114869256204'}, {'start': 17, 'end': 31, 'username': 'Roblox_RTC_BR', 'id': '1417587809502826500'}]}",,False,,everyone,Twitter for Android
1521680182905614339,1419555174394310657,"oal, k tal gente?
como ha ido su día? UwU https://t.co/dJMQlWlEMo",2022-05-04 02:36:41+00:00,,0,1,1,0,es,1521680182905614339,[],"{'urls': [{'start': 42, 'end': 65, 'url': 'https://t.co/dJMQlWlEMo', 'expanded_url': 'https://twitter.com/KlyzRandom/status/1521680182905614339/photo/1', 'display_url': 'pic.twitter.com/dJMQlWlEMo', 'media_key': '3_1521680180431011840'}]}",{'media_keys': ['3_1521680180431011840']},False,,everyone,Twitter for Android
1521608209068441601,1325939060439920647,"@AlbertsStuff Those bozos got taken down, now we need to #FreeFloppa",2022-05-03 21:50:41+00:00,,24,84,444,3,en,1521553803086024704,[],"{'hashtags': [{'start': 57, 'end': 68, 'tag': 'FreeFloppa'}], 'mentions': [{'start': 0, 'end': 13, 'username': 'AlbertsStuff', 'id': '2850532049'}]}",,False,,everyone,Twitter Web App
1521649737191018498,1410824710644973570,Roblox players going crazy when Roblox is down #RobloxDown https://t.co/vxtdOtuKtm,2022-05-04 00:35:42+00:00,,882,529,11251,104,en,1521649737191018498,"[{'domain': {'id': '71', 'name': 'Video Game', 'description': 'A video game like Overwatch'}, 'entity': {'id': '1088118927580774400', 'name': 'Roblox', 'description': 'Roblox'}}]","{'annotations': [{'start': 0, 'end': 5, 'probability': 0.5066, 'type': 'Organization', 'normalized_text': 'Roblox'}, {'start': 32, 'end': 37, 'probability': 0.3296, 'type': 'Product', 'normalized_text': 'Roblox'}], 'hashtags': [{'start': 47, 'end': 58, 'tag': 'RobloxDown'}], 'urls': [{'start': 59, 'end': 82, 'url': 'https://t.co/vxtdOtuKtm', 'expanded_url': 'https://twitter.com/Angel06952066/status/1521649737191018498/photo/1', 'display_url': 'pic.twitter.com/vxtdOtuKtm', 'media_key': '3_1521649465651773440'}]}",{'media_keys': ['3_1521649465651773440']},False,,everyone,Twitter Web App
1521627037181612032,1056053249470541824,"⚠️OUTAGE⚠️: Roblox is currently down at the moment. Not only are experiences failing to load, but studio is also failing to load as well. Our team will update you with further information.",2022-05-03 23:05:30+00:00,,428,1291,6967,83,en,1521627037181612032,"[{'domain': {'id': '71', 'name': 'Video Game', 'description': 'A video game like Overwatch'}, 'entity': {'id': '1088118927580774400', 'name': 'Roblox', 'description': 'Roblox'}}]","{'annotations': [{'start': 12, 'end': 17, 'probability': 0.3525, 'type': 'Organization', 'normalized_text': 'Roblox'}]}",,False,,everyone,Twitter Web App
1521680370223271939,1341212001184473089,@gatonecio_ he looks like hes in roblox,2022-05-04 02:37:26+00:00,,0,1,1,0,en,1521679939992436737,"[{'domain': {'id': '71', 'name': 'Video Game', 'description': 'A video game like Overwatch'}, 'entity': {'id': '1088118927580774400', 'name': 'Roblox', 'description': 'Roblox'}}]",,,False,,everyone,Twitter for Android
1518643458944249857,1235005904325611521,@Roblox Make better pants or I’m quitting,2022-04-25 17:29:50+00:00,,0,12,94,0,en,1518643330833272833,"[{'domain': {'id': '71', 'name': 'Video Game', 'description': 'A video game like Overwatch'}, 'entity': {'id': '1088118927580774400', 'name': 'Roblox', 'description': 'Roblox'}}]","{'mentions': [{'start': 0, 'end': 7, 'username': 'Roblox', 'id': '16745055'}]}",,False,,everyone,Twitter for iPhone
1521678456622362625,1429687662512910339,@Gabbyrblx_dev but the 10k might be the total youve ever earned,2022-05-04 02:29:50+00:00,,0,4,0,0,en,1521671159309209600,[],"{'mentions': [{'start': 0, 'end': 14, 'username': 'Gabbyrblx_dev', 'id': '1432557835733266433'}]}",,False,,everyone,Twitter Web App
1521644968783544321,1483040613780312069,@playz3051 True https://t.co/neyfA6hD1p,2022-05-04 00:16:46+00:00,,0,2,2,0,en,1521643194630475776,[],"{'urls': [{'start': 16, 'end': 39, 'url': 'https://t.co/neyfA6hD1p', 'expanded_url': 'https://twitter.com/NoraKarlo/status/1521644968783544321/photo/1', 'display_url': 'pic.twitter.com/neyfA6hD1p', 'media_key': '3_1521644965671346176'}], 'mentions': [{'start': 0, 'end': 10, 'username': 'playz3051', 'id': '1386152538743795712'}]}",{'media_keys': ['3_1521644965671346176']},False,,everyone,Twitter for Android
1521675600510865409,1894642398,Is Roblox down? I can’t get on,2022-05-04 02:18:29+00:00,,24,271,528,0,en,1521675600510865409,"[{'domain': {'id': '71', 'name': 'Video Game', 'description': 'A video game like Overwatch'}, 'entity': {'id': '1088118927580774400', 'name': 'Roblox', 'description': 'Roblox'}}]","{'annotations': [{'start': 3, 'end': 8, 'probability': 0.3842, 'type': 'Product', 'normalized_text': 'Roblox'}]}",,False,,everyone,Twitter for iPhone
1521680148768116737,1407385274884235266,@Allina_Parsons @Roblog_ Oh moça eu tbm,2022-05-04 02:36:33+00:00,,0,1,1,0,pt,1521673985741795328,[],"{'mentions': [{'start': 0, 'end': 15, 'username': 'Allina_Parsons', 'id': '1421524037113720839'}, {'start': 16, 'end': 24, 'username': 'Roblog_', 'id': '1425933854733393926'}]}",,False,,everyone,Twitter for Android
