tweetid,author_id,text,created_at,geo,retweets,replies,likes,quote_count,lang,conversation_id,context_annotations,entities,attachments,possibly_sensitive,withheld,reply_settings,source
1521189138690621440,1310688804441817088,"I love how this YouTuber can get their fans to harass Olix to the point of his video getting dislike bombed until he privates it, just for calling him out. While people dogpilled me for defending myself on twitter. Fucking hypocrites. https://t.co/ORsUGeIzBp",2022-05-02 18:05:27+00:00,,6,83,85,2,en,1521189138690621440,[],"{'annotations': [{'start': 16, 'end': 23, 'probability': 0.4153, 'type': 'Person', 'normalized_text': 'YouTuber'}, {'start': 54, 'end': 57, 'probability': 0.8717, 'type': 'Person', 'normalized_text': 'Olix'}, {'start': 206, 'end': 212, 'probability': 0.7347, 'type': 'Product', 'normalized_text': 'twitter'}], 'urls': [{'start': 235, 'end': 258, 'url': 'https://t.co/ORsUGeIzBp', 'expanded_url': 'https://twitter.com/Parlo_ROBLOX/status/1521189138690621440/photo/1', 'display_url': 'pic.twitter.com/ORsUGeIzBp', 'media_key': '3_1521188883060379655'}]}",{'media_keys': ['3_1521188883060379655']},False,,everyone,Twitter Web App
1521154130944966659,1107567306840907776,"looking to buy an art commision i need it done asap tho ?
willing to pay in robux extra for speed &lt;3
dm me or comment examples and prices &lt;3

-Boy art -

#robloxart #roblox",2022-05-02 15:46:21+00:00,,2,5,8,0,en,1521154130944966659,"[{'domain': {'id': '71', 'name': 'Video Game', 'description': 'A video game like Overwatch'}, 'entity': {'id': '1088118927580774400', 'name': 'Roblox', 'description': 'Roblox'}}]","{'hashtags': [{'start': 160, 'end': 170, 'tag': 'robloxart'}, {'start': 171, 'end': 178, 'tag': 'roblox'}]}",,False,,everyone,Twitter Web App
1521194701566713859,1441776006826586114,@status_orange @OrangeBloxie @Parlo_ROBLOX Deep down I’m sure he has a real reason why he hates them,2022-05-02 18:27:33+00:00,,0,1,0,0,en,1521189138690621440,[],"{'mentions': [{'start': 0, 'end': 14, 'username': 'status_orange', 'id': '1509904423698542596'}, {'start': 15, 'end': 28, 'username': 'OrangeBloxie', 'id': '1498361491162120202'}, {'start': 29, 'end': 42, 'username': 'Parlo_ROBLOX', 'id': '1310688804441817088'}]}",,False,,everyone,Twitter Web App
1521194672089092096,1509904423698542596,@Parlo_ROBLOX 30 replies hit,2022-05-02 18:27:26+00:00,,1,1,1,0,en,1521189138690621440,[],"{'mentions': [{'start': 0, 'end': 13, 'username': 'Parlo_ROBLOX', 'id': '1310688804441817088'}]}",,False,,everyone,Twitter for Android
1521159568562147329,16745055,"For uptown. For downtown. For your avatar, no matter what size and shape it is. Available now: https://t.co/NaI3ENWTbw https://t.co/xFrs99Fint",2022-05-02 16:07:57+00:00,,211,3023,4524,45,en,1521159568562147329,"[{'domain': {'id': '71', 'name': 'Video Game', 'description': 'A video game like Overwatch'}, 'entity': {'id': '1088118927580774400', 'name': 'Roblox', 'description': 'Roblox'}}]","{'urls': [{'start': 95, 'end': 118, 'url': 'https://t.co/NaI3ENWTbw', 'expanded_url': 'https://rblx.co/shorts', 'display_url': 'rblx.co/shorts', 'images': [{'url': 'https://pbs.twimg.com/news_img/1538678570985197568/2tviCHKw?format=jpg&name=orig', 'width': 1200, 'height': 630}, {'url': 'https://pbs.twimg.com/news_img/1538678570985197568/2tviCHKw?format=jpg&name=150x150', 'width': 150, 'height': 150}], 'status': 200, 'title': 'Roblox', 'description': 'Customize your avatar with a never-ending variety of clothing options, accessories, gear, and more!', 'unwound_url': 'https://www.roblox.com/catalog?Category=3&Subcategory=63&CreatorID=1&SortType=3'}, {'start': 119, 'end': 142, 'url': 'https://t.co/xFrs99Fint', 'expanded_url': 'https://twitter.com/Roblox/status/1521159568562147329/video/1', 'display_url': 'pic.twitter.com/xFrs99Fint', 'media_key': '7_1521158682746056705'}]}",{'media_keys': ['7_1521158682746056705']},False,,everyone,Twitter Web App
1520993481451352065,1266319994524180481,No goddamn way did someone find me on roblox to ask for a sequel to teiyb. Theres no goddamn way,2022-05-02 05:07:59+00:00,,0,5,10,0,en,1520993481451352065,"[{'domain': {'id': '71', 'name': 'Video Game', 'description': 'A video game like Overwatch'}, 'entity': {'id': '1088118927580774400', 'name': 'Roblox', 'description': 'Roblox'}}]","{'annotations': [{'start': 38, 'end': 43, 'probability': 0.4287, 'type': 'Product', 'normalized_text': 'roblox'}]}",,False,,everyone,Twitter for iPhone
1521195343614038023,399404516,"⏸ First Op you pause on, you have to play in your next game.*

*This post is legally binding. https://t.co/5DlubuWVIS",2022-05-02 18:30:07+00:00,,526,404,3338,78,en,1521195343614038023,"[{'domain': {'id': '45', 'name': 'Brand Vertical', 'description': 'Top level entities that describe a Brands industry'}, 'entity': {'id': '781974597310615553', 'name': 'Entertainment'}}, {'domain': {'id': '46', 'name': 'Brand Category', 'description': 'Categories within Brand Verticals that narrow down the scope of Brands'}, 'entity': {'id': '781974597218340864', 'name': 'Video Games'}}, {'domain': {'id': '71', 'name': 'Video Game', 'description': 'A video game like Overwatch'}, 'entity': {'id': '10041743455', 'name': ""Tom Clancy's Rainbow Six"", 'description': 'This entity includes all conversation about the franchise, as well as any individual installments in the series, if applicable.\t\t\t'}}]","{'urls': [{'start': 94, 'end': 117, 'url': 'https://t.co/5DlubuWVIS', 'expanded_url': 'https://twitter.com/Rainbow6Game/status/1521195343614038023/photo/1', 'display_url': 'pic.twitter.com/5DlubuWVIS', 'media_key': '16_1521195315872903169'}]}",{'media_keys': ['16_1521195315872903169']},False,,everyone,Sprinklr
1521194527217922050,1353055196352442368,@justtkamy SUA MAE AQUELA GOSTOSA,2022-05-02 18:26:52+00:00,,0,1,0,0,pt,1521182433156210691,[],"{'mentions': [{'start': 0, 'end': 10, 'username': 'justtkamy', 'id': '1401038207991660545'}]}",,False,,everyone,Twitter Web App
1521193728999895040,1212466262619541504,"@Garfieldisdoc @VarsityGamingTV My income is so inconsistent (cause I upload inconsistent and hardly stream) and it's something I'm really sorting out this summer. Changing the content up, streaming more and just working harder. Y'all have been an inspiration for that",2022-05-02 18:23:42+00:00,,0,1,6,0,en,1521190372378091520,[],"{'mentions': [{'start': 0, 'end': 14, 'username': 'Garfieldisdoc', 'id': '1104147200706142208'}, {'start': 15, 'end': 31, 'username': 'VarsityGamingTV', 'id': '730417841606934528'}]}",,False,,everyone,Twitter Web App
1521175350713237506,777600041900965889,"Yall ever just wanna make something but you don't wanna put in the effort? 

I feel like that all the time, motivation is weird man lol. 
Anyone got any tips for committing to ideas? We should share a few in the replies and help each other out. 🥰",2022-05-02 17:10:40+00:00,,0,12,31,0,en,1521175350713237506,[],,,False,,everyone,Twitter Web App
1521193194670596097,1421045033533313024,@rie_playz i- how do i pop up on anyone’s screen 😃,2022-05-02 18:21:34+00:00,,0,1,0,0,en,1521165323570860032,[],,,False,,everyone,Twitter for iPad
1521190864592293891,44196397,"the elusive beauty of imperfection

侘寂",2022-05-02 18:12:19+00:00,,29876,23753,422474,3109,en,1521190864592293891,"[{'domain': {'id': '10', 'name': 'Person', 'description': 'Named people in the world like Nelson Mandela'}, 'entity': {'id': '808713037230157824', 'name': 'Elon Musk', 'description': 'Elon Musk'}}, {'domain': {'id': '65', 'name': 'Interests and Hobbies Vertical', 'description': 'Top level interests and hobbies groupings, like Food or Travel'}, 'entity': {'id': '781974596148793345', 'name': 'Business & finance'}}, {'domain': {'id': '66', 'name': 'Interests and Hobbies Category', 'description': 'A grouping of interests and hobbies entities, like Novelty Food or Destinations'}, 'entity': {'id': '857878777191211008', 'name': 'Leadership', 'description': 'Leadership'}}, {'domain': {'id': '30', 'name': 'Entities [Entity Service]', 'description': 'Entity Service top level domain, every item that is in Entity Service should be in this domain'}, 'entity': {'id': '857879456773357569', 'name': 'Technology', 'description': 'Technology'}}]",,,False,,everyone,Twitter for iPhone
1521194314541457408,838491626976776194,"@Its_Doge5 @Josman_Rblx @EpicStudios5 @iSMasterRoblox1 No. Una opinión es decir ""ah si ok concierto feo"" y listo. No lo que haces, como el presumir ""hay es que el evento es en general y se puede hacer en blender 😇🥰😍🥰😍🥰🥰😍😍😍"" .

Simplemente si tu eres ""tan profesional"" y tienes UN PRESUPUESTO, hazlo tu. https://t.co/30PhrGDK57",2022-05-02 18:26:01+00:00,,0,1,0,0,es,1520961847348051969,[],"{'mentions': [{'start': 0, 'end': 10, 'username': 'Its_Doge5', 'id': '1076157791323201537'}, {'start': 11, 'end': 23, 'username': 'Josman_Rblx', 'id': '1284603120027344897'}, {'start': 24, 'end': 37, 'username': 'EpicStudios5', 'id': '1224454397683544064'}, {'start': 38, 'end': 54, 'username': 'iSMasterRoblox1', 'id': '1408591006870745094'}], 'urls': [{'start': 303, 'end': 326, 'url': 'https://t.co/30PhrGDK57', 'expanded_url': 'https://twitter.com/RadioCutoRBX/status/1521194314541457408/photo/1', 'display_url': 'pic.twitter.com/30PhrGDK57', 'media_key': '3_1521193744481067008'}, {'start': 303, 'end': 326, 'url': 'https://t.co/30PhrGDK57', 'expanded_url': 'https://twitter.com/RadioCutoRBX/status/1521194314541457408/photo/1', 'display_url': 'pic.twitter.com/30PhrGDK57', 'media_key': '3_1521193939981815809'}]}","{'media_keys': ['3_1521193744481067008', '3_1521193939981815809']}",False,,everyone,Twitter Web App
1520863712906821632,1310688804441817088,"does this scamming, egocentric, narcissistic, man-child have anything better to do, rather than scrape for twitter likes off of a twitter drama regarding me. what a loser. You blocked me, i blocked you, stop stalking by tweets bozo. https://t.co/sWB0QBnXE2",2022-05-01 20:32:20+00:00,,3,83,71,4,en,1520863712906821632,"[{'domain': {'id': '46', 'name': 'Brand Category', 'description': 'Categories within Brand Verticals that narrow down the scope of Brands'}, 'entity': {'id': '781974596752842752', 'name': 'Services'}}, {'domain': {'id': '47', 'name': 'Brand', 'description': 'Brands and Companies'}, 'entity': {'id': '10045225402', 'name': 'Twitter'}}]","{'annotations': [{'start': 107, 'end': 113, 'probability': 0.865, 'type': 'Product', 'normalized_text': 'twitter'}, {'start': 130, 'end': 136, 'probability': 0.7971, 'type': 'Product', 'normalized_text': 'twitter'}], 'urls': [{'start': 233, 'end': 256, 'url': 'https://t.co/sWB0QBnXE2', 'expanded_url': 'https://twitter.com/Parlo_ROBLOX/status/1520863712906821632/photo/1', 'display_url': 'pic.twitter.com/sWB0QBnXE2', 'media_key': '3_1520863705466085377'}]}",{'media_keys': ['3_1520863705466085377']},False,,everyone,Twitter Web App
1520625261758230529,1359738127938580484,"One has to go, what is it?

#Minecraft #GenshinImpact #amongus #roblox https://t.co/L1OijXB1Bc",2022-05-01 04:44:48+00:00,,28,647,411,25,en,1520625261758230529,"[{'domain': {'id': '45', 'name': 'Brand Vertical', 'description': 'Top level entities that describe a Brands industry'}, 'entity': {'id': '781974597310615553', 'name': 'Entertainment'}}, {'domain': {'id': '46', 'name': 'Brand Category', 'description': 'Categories within Brand Verticals that narrow down the scope of Brands'}, 'entity': {'id': '781974597218340864', 'name': 'Video Games'}}, {'domain': {'id': '71', 'name': 'Video Game', 'description': 'A video game like Overwatch'}, 'entity': {'id': '10043689888', 'name': 'Minecraft'}}, {'domain': {'id': '71', 'name': 'Video Game', 'description': 'A video game like Overwatch'}, 'entity': {'id': '1088118927580774400', 'name': 'Roblox', 'description': 'Roblox'}}, {'domain': {'id': '71', 'name': 'Video Game', 'description': 'A video game like Overwatch'}, 'entity': {'id': '1308398176978698241', 'name': 'Among Us'}}, {'domain': {'id': '71', 'name': 'Video Game', 'description': 'A video game like Overwatch'}, 'entity': {'id': '1310987643765678083', 'name': 'Genshin Impact'}}]","{'hashtags': [{'start': 28, 'end': 38, 'tag': 'Minecraft'}, {'start': 39, 'end': 53, 'tag': 'GenshinImpact'}, {'start': 54, 'end': 62, 'tag': 'amongus'}, {'start': 63, 'end': 70, 'tag': 'roblox'}], 'urls': [{'start': 71, 'end': 94, 'url': 'https://t.co/L1OijXB1Bc', 'expanded_url': 'https://twitter.com/Bestie_Buddies/status/1520625261758230529/photo/1', 'display_url': 'pic.twitter.com/L1OijXB1Bc', 'media_key': '3_1520625032786894848'}, {'start': 71, 'end': 94, 'url': 'https://t.co/L1OijXB1Bc', 'expanded_url': 'https://twitter.com/Bestie_Buddies/status/1520625261758230529/photo/1', 'display_url': 'pic.twitter.com/L1OijXB1Bc', 'media_key': '3_1520625032791162881'}, {'start': 71, 'end': 94, 'url': 'https://t.co/L1OijXB1Bc', 'expanded_url': 'https://twitter.com/Bestie_Buddies/status/1520625261758230529/photo/1', 'display_url': 'pic.twitter.com/L1OijXB1Bc', 'media_key': '3_1520625032786890753'}, {'start': 71, 'end': 94, 'url': 'https://t.co/L1OijXB1Bc', 'expanded_url': 'https://twitter.com/Bestie_Buddies/status/1520625261758230529/photo/1', 'display_url': 'pic.twitter.com/L1OijXB1Bc', 'media_key': '3_1520625033663565824'}]}","{'media_keys': ['3_1520625032786894848', '3_1520625032791162881', '3_1520625032786890753', '3_1520625033663565824']}",False,,everyone,Twitter Web App
1521193832007618561,984854848460828672,"Para celebrar el Día del Niño en México el pasado sábado, Roblox sacó un objeto virtual gratis. Obtén tu Luchador campéon ya, antes de que se retire del ring el 8 de mayo 😃. https://t.co/jvSRrhaTTe https://t.co/ApbSKh8A8O",2022-05-02 18:24:06+00:00,,26,69,408,1,es,1521193832007618561,"[{'domain': {'id': '29', 'name': 'Events [Entity Service]', 'description': 'Entity Service related Events domain'}, 'entity': {'id': '1465690254975766530', 'name': ""Children's Day""}}, {'domain': {'id': '71', 'name': 'Video Game', 'description': 'A video game like Overwatch'}, 'entity': {'id': '1088118927580774400', 'name': 'Roblox', 'description': 'Roblox'}}, {'domain': {'id': '119', 'name': 'Holiday', 'description': 'Holidays like Christmas or Halloween'}, 'entity': {'id': '1465690254975766530', 'name': ""Children's Day""}}, {'domain': {'id': '29', 'name': 'Events [Entity Service]', 'description': 'Entity Service related Events domain'}, 'entity': {'id': '1518672034812743681', 'name': '5月5日はこどもの日 🎏'}}]","{'annotations': [{'start': 17, 'end': 28, 'probability': 0.7042, 'type': 'Other', 'normalized_text': 'Día del Niño'}, {'start': 33, 'end': 38, 'probability': 0.9426, 'type': 'Place', 'normalized_text': 'México'}, {'start': 58, 'end': 63, 'probability': 0.578, 'type': 'Organization', 'normalized_text': 'Roblox'}], 'urls': [{'start': 174, 'end': 197, 'url': 'https://t.co/jvSRrhaTTe', 'expanded_url': 'https://www.roblox.com/catalog/9071739482/Luchador-Champion', 'display_url': 'roblox.com/catalog/907173…', 'status': 200, 'title': 'Luchador Champion - Roblox', 'description': 'Roblox is a global platform that brings people together through play.', 'unwound_url': 'https://www.roblox.com/catalog/9071739482/Luchador-Champion'}, {'start': 198, 'end': 221, 'url': 'https://t.co/ApbSKh8A8O', 'expanded_url': 'https://twitter.com/RobloxEspanol/status/1521193832007618561/photo/1', 'display_url': 'pic.twitter.com/ApbSKh8A8O', 'media_key': '3_1521193788047126529'}]}",{'media_keys': ['3_1521193788047126529']},False,,everyone,Twitter Web App
1520806521214574595,1056053249470541824,Raise a Floppa is now under review.. again. The game has had DMCA battles against someone who allegedly wants to copy the game from the original owner. The game has been struggling to stay up.,2022-05-01 16:45:04+00:00,,88,229,2170,21,en,1520806521214574595,[],"{'annotations': [{'start': 8, 'end': 13, 'probability': 0.3489, 'type': 'Person', 'normalized_text': 'Floppa'}, {'start': 61, 'end': 64, 'probability': 0.4783, 'type': 'Organization', 'normalized_text': 'DMCA'}]}",,False,,everyone,Twitter for iPhone
1521194761956167680,1345154361626865665,"@RealSlayer10 @FrevvYoutube @Parlo_ROBLOX who you defending in this situation tho?
ppl ratio on da wrong comment alot",2022-05-02 18:27:48+00:00,,0,1,0,0,en,1520112958961074176,[],"{'mentions': [{'start': 0, 'end': 13, 'username': 'RealSlayer10', 'id': '1450701957459447811'}, {'start': 14, 'end': 27, 'username': 'FrevvYoutube', 'id': '1351199523520077824'}, {'start': 28, 'end': 41, 'username': 'Parlo_ROBLOX', 'id': '1310688804441817088'}]}",,False,,everyone,Twitter Web App
1521194490924572672,1450701957459447811,@FrevvYoutube @EmberzP @Parlo_ROBLOX Ratio.,2022-05-02 18:26:43+00:00,,0,1,2,1,en,1520112958961074176,[],"{'mentions': [{'start': 0, 'end': 13, 'username': 'FrevvYoutube', 'id': '1351199523520077824'}, {'start': 14, 'end': 22, 'username': 'EmberzP', 'id': '1345154361626865665'}, {'start': 23, 'end': 36, 'username': 'Parlo_ROBLOX', 'id': '1310688804441817088'}]}",,False,,everyone,Twitter Web App
1521194255808618496,1509904423698542596,@Flashy57004555 @OrangeBloxie @Parlo_ROBLOX he hates the rtc for np reason,2022-05-02 18:25:47+00:00,,0,1,0,0,en,1521189138690621440,[],"{'mentions': [{'start': 0, 'end': 15, 'username': 'Flashy57004555', 'id': '1441776006826586114'}, {'start': 16, 'end': 29, 'username': 'OrangeBloxie', 'id': '1498361491162120202'}, {'start': 30, 'end': 43, 'username': 'Parlo_ROBLOX', 'id': '1310688804441817088'}]}",,False,,everyone,Twitter for Android
1463218500453998597,1360282716869165057,"@Roblox @Roblox please help me my account was hacked and has been saying threats, assaults, and hacking games all of this was not me and I been wondering when this madness will stop and when will I get my account back",2021-11-23 18:50:50+00:00,,0,10,2,0,en,783103216217165824,"[{'domain': {'id': '71', 'name': 'Video Game', 'description': 'A video game like Overwatch'}, 'entity': {'id': '1088118927580774400', 'name': 'Roblox', 'description': 'Roblox'}}]","{'mentions': [{'start': 0, 'end': 7, 'username': 'Roblox', 'id': '16745055'}, {'start': 8, 'end': 15, 'username': 'Roblox', 'id': '16745055'}]}",,False,,everyone,Twitter for Android
1521137789324124160,1518628000891228161,i’m making luke’s diner &amp; apartment in roblox,2022-05-02 14:41:25+00:00,,0,1,0,0,en,1521137789324124160,"[{'domain': {'id': '71', 'name': 'Video Game', 'description': 'A video game like Overwatch'}, 'entity': {'id': '1088118927580774400', 'name': 'Roblox', 'description': 'Roblox'}}]","{'annotations': [{'start': 11, 'end': 14, 'probability': 0.6635, 'type': 'Person', 'normalized_text': 'luke'}]}",,False,,everyone,Twitter for iPhone
1520763841344425985,439751895,What is this? https://t.co/AaRa4G7jr9,2022-05-01 13:55:28+00:00,,0,0,0,1,en,1520763841344425985,[],"{'urls': [{'start': 14, 'end': 37, 'url': 'https://t.co/AaRa4G7jr9', 'expanded_url': 'https://twitter.com/btett28/status/1520763841344425985/photo/1', 'display_url': 'pic.twitter.com/AaRa4G7jr9', 'media_key': '3_1520763836701286401'}]}",{'media_keys': ['3_1520763836701286401']},False,,everyone,Twitter Web App
1521146684788588549,1417587809502826500,PERGUNTA DO DIA: Quando você começou a jogar Roblox?,2022-05-02 15:16:45+00:00,,5,133,65,0,pt,1521146684788588549,"[{'domain': {'id': '71', 'name': 'Video Game', 'description': 'A video game like Overwatch'}, 'entity': {'id': '1088118927580774400', 'name': 'Roblox', 'description': 'Roblox'}}]",,,False,,everyone,Twitter Web App
1520769023952429056,1288507114671857665,"@Parlo_ROBLOX Like wtf u guys just same as Jellybeans hater, doxxed her and make her mentally abused. HE'S A MINOR. Not proctecting parlo but u guys need sum normal pills rn. https://t.co/dRz5OrqDYg",2022-05-01 14:16:04+00:00,,0,2,2,0,en,1520482038628950016,[],"{'mentions': [{'start': 0, 'end': 13, 'username': 'Parlo_ROBLOX', 'id': '1310688804441817088'}], 'urls': [{'start': 175, 'end': 198, 'url': 'https://t.co/dRz5OrqDYg', 'expanded_url': 'https://twitter.com/GoldenKnightFly/status/1520769023952429056/photo/1', 'display_url': 'pic.twitter.com/dRz5OrqDYg', 'media_key': '3_1520769009536610304'}]}",{'media_keys': ['3_1520769009536610304']},False,,everyone,Twitter Web App
1520476540898795523,1351199523520077824,"@EmberzP @Parlo_ROBLOX That was YOUR argument, not mine.",2022-04-30 18:53:51+00:00,,0,2,1,0,en,1520112958961074176,[],"{'mentions': [{'start': 0, 'end': 8, 'username': 'EmberzP', 'id': '1345154361626865665'}, {'start': 9, 'end': 22, 'username': 'Parlo_ROBLOX', 'id': '1310688804441817088'}]}",,False,,everyone,Twitter Web App
1520767268422098946,1324836609741725696,"Roblox just deleted Bedwars! 

Your first emoji is your reaction",2022-05-01 14:09:05+00:00,,12,795,406,5,en,1520767268422098946,"[{'domain': {'id': '71', 'name': 'Video Game', 'description': 'A video game like Overwatch'}, 'entity': {'id': '1088118927580774400', 'name': 'Roblox', 'description': 'Roblox'}}]",,,False,,everyone,Twitter Web App
1521193335981027331,1310688804441817088,@OrangeBloxie https://t.co/eilZegi226,2022-05-02 18:22:08+00:00,,0,2,0,0,qme,1521189138690621440,[],"{'mentions': [{'start': 0, 'end': 13, 'username': 'OrangeBloxie', 'id': '1498361491162120202'}], 'urls': [{'start': 14, 'end': 37, 'url': 'https://t.co/eilZegi226', 'expanded_url': 'https://www.youtube.com/watch?v=lKb2Mh6VfxU', 'display_url': 'youtube.com/watch?v=lKb2Mh…', 'images': [{'url': 'https://pbs.twimg.com/news_img/1521052568411070469/nBZYHZvW?format=jpg&name=orig', 'width': 1280, 'height': 720}, {'url': 'https://pbs.twimg.com/news_img/1521052568411070469/nBZYHZvW?format=jpg&name=150x150', 'width': 150, 'height': 150}], 'status': 200, 'title': 'Taking Out the TRASH (aka Olix) in Garbage Collector Simulator!', 'description': ""Some cringe youtubers and 5 year olds got mad that I trolled Digito by stealing his thumbnail one time (even though I've been stolen dozens of times), and a ..."", 'unwound_url': 'https://www.youtube.com/watch?v=lKb2Mh6VfxU'}]}",,False,,everyone,Twitter Web App
1521017923057319936,1300315441693208581,please tell me this is so true 💀 https://t.co/iSPVeu4Zhd,2022-05-02 06:45:06+00:00,,3,15,50,1,en,1521017923057319936,[],"{'urls': [{'start': 33, 'end': 56, 'url': 'https://t.co/iSPVeu4Zhd', 'expanded_url': 'https://twitter.com/DragonPlayz_RIP/status/1521017923057319936/photo/1', 'display_url': 'pic.twitter.com/iSPVeu4Zhd', 'media_key': '3_1521017920465170435'}]}",{'media_keys': ['3_1521017920465170435']},False,,everyone,Twitter for Android
1521193619096547330,1441776006826586114,"@OrangeBloxie @Parlo_ROBLOX I’m sorry, why the hell do you care about how nice I am to him your just a hater stay out",2022-05-02 18:23:15+00:00,,0,2,0,0,en,1521189138690621440,[],"{'mentions': [{'start': 0, 'end': 13, 'username': 'OrangeBloxie', 'id': '1498361491162120202'}, {'start': 14, 'end': 27, 'username': 'Parlo_ROBLOX', 'id': '1310688804441817088'}]}",,False,,everyone,Twitter Web App
1520112958961074176,1310688804441817088,"I refuse to ever apologise to people like this who continue to insult me, after a large portion of people have harassed me for hours on end in the past few days. RTC Double standard. People call me out for it, when they do the EXACT same. Then they bring up the power dynamic... https://t.co/e2jzyHTIdz",2022-04-29 18:49:06+00:00,,6,45,60,2,en,1520112958961074176,[],"{'urls': [{'start': 279, 'end': 302, 'url': 'https://t.co/e2jzyHTIdz', 'expanded_url': 'https://twitter.com/Parlo_ROBLOX/status/1520112958961074176/photo/1', 'display_url': 'pic.twitter.com/e2jzyHTIdz', 'media_key': '3_1520112651795406848'}]}",{'media_keys': ['3_1520112651795406848']},False,,everyone,Twitter Web App
1521157606177312769,1432473159018717197,"@z0mpup @finnish_idiot @softkamii @D1zzyTrent @Roblox The same thing happened to me :(, isn't it a kind of suspension of voice chat? I haven't received any warning because of that. I activated it and everything worked fine a few days ago. I can't hear others or turn on my microphone because I see this red sign. https://t.co/HEYPTByLQL",2022-05-02 16:00:09+00:00,,0,4,3,0,en,1457862778530803718,"[{'domain': {'id': '71', 'name': 'Video Game', 'description': 'A video game like Overwatch'}, 'entity': {'id': '1088118927580774400', 'name': 'Roblox', 'description': 'Roblox'}}]","{'mentions': [{'start': 0, 'end': 7, 'username': 'z0mpup', 'id': '1143621093032435713'}, {'start': 8, 'end': 22, 'username': 'finnish_idiot', 'id': '1201041113706123264'}, {'start': 23, 'end': 33, 'username': 'softkamii', 'id': '1424477080310501382'}, {'start': 34, 'end': 45, 'username': 'D1zzyTrent', 'id': '1351031574947618824'}, {'start': 46, 'end': 53, 'username': 'Roblox', 'id': '16745055'}], 'urls': [{'start': 313, 'end': 336, 'url': 'https://t.co/HEYPTByLQL', 'expanded_url': 'https://twitter.com/kithstrawbkitty/status/1521157606177312769/photo/1', 'display_url': 'pic.twitter.com/HEYPTByLQL', 'media_key': '3_1521157602373214209'}]}",{'media_keys': ['3_1521157602373214209']},False,,everyone,Twitter for Android
1521193907605880833,1512882214203281409,"@Inferno_Plumber inferno i swear to Executable M, soon enough we'll get every single game genre with EXEs",2022-05-02 18:24:24+00:00,,0,1,1,0,en,1521193616236027905,[],"{'mentions': [{'start': 0, 'end': 16, 'username': 'Inferno_Plumber', 'id': '1343311303281172482'}], 'annotations': [{'start': 36, 'end': 47, 'probability': 0.2779, 'type': 'Organization', 'normalized_text': 'Executable M'}]}",,False,,everyone,TweetDeck
