tweetid,author_id,text,created_at,geo,retweets,replies,likes,quote_count,lang,conversation_id,context_annotations,entities,attachments,possibly_sensitive,withheld,reply_settings,source
1515713445479563278,1444403845312962561,"Just announced the alpha release of Team Wars, enjoy it:
https://t.co/g2eNpWAtbA",2022-04-17 15:27:00+00:00,,0,0,3,1,en,1515713445479563278,[],"{'annotations': [{'start': 36, 'end': 44, 'probability': 0.6771, 'type': 'Other', 'normalized_text': 'Team Wars'}], 'urls': [{'start': 57, 'end': 80, 'url': 'https://t.co/g2eNpWAtbA', 'expanded_url': 'https://www.roblox.com/games/1348673468/TeamWars-Alpha', 'display_url': 'roblox.com/games/13486734…', 'images': [{'url': 'https://pbs.twimg.com/news_img/1515713445735411720/QHpPYbyK?format=jpg&name=orig', 'width': 498, 'height': 280}, {'url': 'https://pbs.twimg.com/news_img/1515713445735411720/QHpPYbyK?format=jpg&name=150x150', 'width': 150, 'height': 150}], 'status': 200, 'title': 'TeamWars☄️ (Alpha)', 'description': 'Check out TeamWars☄️ (Alpha). It’s one of the millions of unique, user-generated 3D experiences created on Roblox. ☄️Hello everyone☄️ I am happy to announce the launch of TeamWars in Alpha state for now, you will see how the map changes over time these are the things you will find: -🏢a lot of buildings🏙️ -🕵️\u200d♂️secret hidden🕵️\u200d♂️ -2 Bases 🔵🔴 -a lot of roads 🛣️ -Guns🔫 -Vehicles🚗 Play and enjoy it😎, and remember to follow me on twetter to know more about whats coming ino the game😀', 'unwound_url': 'https://www.roblox.com/games/1348673468/TeamWars-Alpha'}]}",,False,,everyone,Twitter Web App
1515206120826183681,135295059,"This needs to go viral!!
God bless this man and his son... https://t.co/R2LM0oRAn7",2022-04-16 05:51:05+00:00,,6930,1205,17006,1677,en,1515206120826183681,[],"{'annotations': [{'start': 25, 'end': 27, 'probability': 0.5799, 'type': 'Other', 'normalized_text': 'God'}], 'urls': [{'start': 59, 'end': 82, 'url': 'https://t.co/R2LM0oRAn7', 'expanded_url': 'https://twitter.com/HenshawKate/status/1515206120826183681/video/1', 'display_url': 'pic.twitter.com/R2LM0oRAn7', 'media_key': '7_1515206054212259841'}]}",{'media_keys': ['7_1515206054212259841']},False,,everyone,Twitter for Android
1515721148377542663,1249190849067524096,"Dangerous 😳
#oc #art #roblox https://t.co/BudAvUG7PS",2022-04-17 15:57:37+00:00,,0,4,9,0,fr,1515721148377542663,"[{'domain': {'id': '65', 'name': 'Interests and Hobbies Vertical', 'description': 'Top level interests and hobbies groupings, like Food or Travel'}, 'entity': {'id': '1280550787207147521', 'name': 'Arts & culture'}}, {'domain': {'id': '66', 'name': 'Interests and Hobbies Category', 'description': 'A grouping of interests and hobbies entities, like Novelty Food or Destinations'}, 'entity': {'id': '1046577790353428480', 'name': 'Visual arts', 'description': 'Visual Arts'}}, {'domain': {'id': '71', 'name': 'Video Game', 'description': 'A video game like Overwatch'}, 'entity': {'id': '1088118927580774400', 'name': 'Roblox', 'description': 'Roblox'}}]","{'urls': [{'start': 29, 'end': 52, 'url': 'https://t.co/BudAvUG7PS', 'expanded_url': 'https://twitter.com/dabermango/status/1515721148377542663/video/1', 'display_url': 'pic.twitter.com/BudAvUG7PS', 'media_key': '7_1515721006165512200'}], 'hashtags': [{'start': 12, 'end': 15, 'tag': 'oc'}, {'start': 16, 'end': 20, 'tag': 'art'}, {'start': 21, 'end': 28, 'tag': 'roblox'}]}",{'media_keys': ['7_1515721006165512200']},False,,everyone,Twitter for Android
1515720523178602497,937494062935949312,Got my sister a Roblox card for Easter and she told me she can go in ‘DA HOOD’ now lmao wtf is roblox,2022-04-17 15:55:08+00:00,,0,2,2,0,en,1515720523178602497,"[{'domain': {'id': '29', 'name': 'Events [Entity Service]', 'description': 'Entity Service related Events domain'}, 'entity': {'id': '1372917575357591554', 'name': 'Easter', 'description': 'this entity for all conversations for Easter all year '}}, {'domain': {'id': '71', 'name': 'Video Game', 'description': 'A video game like Overwatch'}, 'entity': {'id': '1088118927580774400', 'name': 'Roblox', 'description': 'Roblox'}}, {'domain': {'id': '119', 'name': 'Holiday', 'description': 'Holidays like Christmas or Halloween'}, 'entity': {'id': '1372917575357591554', 'name': 'Easter', 'description': 'this entity for all conversations for Easter all year '}}]","{'annotations': [{'start': 16, 'end': 21, 'probability': 0.5617, 'type': 'Product', 'normalized_text': 'Roblox'}, {'start': 70, 'end': 76, 'probability': 0.4563, 'type': 'Other', 'normalized_text': 'DA HOOD'}]}",,False,,everyone,Twitter for iPhone
1515721748821458949,425871040,"An explosive return! How egg-citing🥚

Hop in and hunt for the unvaulted Egg Launcher. https://t.co/6HiJNfGxBP",2022-04-17 16:00:00+00:00,,329,422,6678,30,en,1515721748821458949,"[{'domain': {'id': '71', 'name': 'Video Game', 'description': 'A video game like Overwatch'}, 'entity': {'id': '974285387987169280', 'name': 'Fortnite', 'description': 'This entity includes all conversation about the franchise, as well as any individual installments in the series, if applicable.\t\t\t'}}]","{'urls': [{'start': 86, 'end': 109, 'url': 'https://t.co/6HiJNfGxBP', 'expanded_url': 'https://twitter.com/FortniteGame/status/1515721748821458949/photo/1', 'display_url': 'pic.twitter.com/6HiJNfGxBP', 'media_key': '3_1514288960628944897'}]}",{'media_keys': ['3_1514288960628944897']},False,,everyone,Twitter Media Studio
1515355095919206400,1538127854,Tomorrow is the day https://t.co/XKKzVnVVPP,2022-04-16 15:43:03+00:00,,2,3,45,1,en,1515355095919206400,[],"{'urls': [{'start': 20, 'end': 43, 'url': 'https://t.co/XKKzVnVVPP', 'expanded_url': 'https://twitter.com/XxMakio/status/1515355095919206400/photo/1', 'display_url': 'pic.twitter.com/XKKzVnVVPP', 'media_key': '3_1515355092542709776'}]}",{'media_keys': ['3_1515355092542709776']},False,,everyone,Twitter Web App
1515718606218481674,1490939552214650880,what games do y'all play???,2022-04-17 15:47:31+00:00,,0,1,1,0,en,1515718606218481674,[],,,False,,everyone,Twitter for Android
1515440485929824262,1071938981389045765,"🚑 EMS AI Calls are out on ER:LC! 

https://t.co/3hDyWTWt6S

#roblox",2022-04-16 21:22:22+00:00,,23,54,327,3,en,1515440485929824262,"[{'domain': {'id': '71', 'name': 'Video Game', 'description': 'A video game like Overwatch'}, 'entity': {'id': '1088118927580774400', 'name': 'Roblox', 'description': 'Roblox'}}]","{'urls': [{'start': 35, 'end': 58, 'url': 'https://t.co/3hDyWTWt6S', 'expanded_url': 'https://youtu.be/hy0YbTGgL6c', 'display_url': 'youtu.be/hy0YbTGgL6c', 'status': 200, 'title': 'EMS AI Calls! | ER:LC Update', 'description': 'Emergency Response: Liberty County is excited to introduce AI EMS Calls!Check it out on Roblox: https://www.roblox.com/games/2534724415/Emergency-Response-Li...', 'unwound_url': 'https://www.youtube.com/watch?v=hy0YbTGgL6c&feature=youtu.be'}], 'hashtags': [{'start': 60, 'end': 67, 'tag': 'roblox'}]}",,False,,everyone,Twitter for iPhone
1515721475390677002,1056053249470541824,"THE EASTER EVENT IN TDS IS AVAILABLE TO PLAY RIGHT NOW! You need to progress through a series of maps with wave based survival. The setting is a farm, and you must defend it from an ARMY! The duck army includes a variety of enemies, ranging from ducks with catapults &amp; MEGA DUCK!",2022-04-17 15:58:55+00:00,,11,13,453,1,en,1515721475390677002,"[{'domain': {'id': '29', 'name': 'Events [Entity Service]', 'description': 'Entity Service related Events domain'}, 'entity': {'id': '1372917575357591554', 'name': 'Easter', 'description': 'this entity for all conversations for Easter all year '}}, {'domain': {'id': '119', 'name': 'Holiday', 'description': 'Holidays like Christmas or Halloween'}, 'entity': {'id': '1372917575357591554', 'name': 'Easter', 'description': 'this entity for all conversations for Easter all year '}}]",,,False,,everyone,Twitter Web App
1515573388735037442,1137738847696166912,"#Roblox #YouTube #RoPets #royalehigh #Adoptmetrades #OverlookRP All My Peeps!! 

Happy Easter! 🐣 

🐾Enjoy the Day! https://t.co/N0O39hBkKF",2022-04-17 06:10:28+00:00,,0,5,20,1,en,1515573388735037442,"[{'domain': {'id': '29', 'name': 'Events [Entity Service]', 'description': 'Entity Service related Events domain'}, 'entity': {'id': '1372917575357591554', 'name': 'Easter', 'description': 'this entity for all conversations for Easter all year '}}, {'domain': {'id': '71', 'name': 'Video Game', 'description': 'A video game like Overwatch'}, 'entity': {'id': '1088118927580774400', 'name': 'Roblox', 'description': 'Roblox'}}, {'domain': {'id': '71', 'name': 'Video Game', 'description': 'A video game like Overwatch'}, 'entity': {'id': '1229416301245763584', 'name': 'Adopt Me'}}, {'domain': {'id': '71', 'name': 'Video Game', 'description': 'A video game like Overwatch'}, 'entity': {'id': '1230882318224510978', 'name': 'Royale High'}}, {'domain': {'id': '119', 'name': 'Holiday', 'description': 'Holidays like Christmas or Halloween'}, 'entity': {'id': '1372917575357591554', 'name': 'Easter', 'description': 'this entity for all conversations for Easter all year '}}, {'domain': {'id': '165', 'name': 'Technology', 'description': 'for individual and types of technology, e.g., food technology, 3D printing'}, 'entity': {'id': '1196446161223028736', 'name': 'Social media'}}, {'domain': {'id': '46', 'name': 'Brand Category', 'description': 'Categories within Brand Verticals that narrow down the scope of Brands'}, 'entity': {'id': '781974596752842752', 'name': 'Services'}}, {'domain': {'id': '47', 'name': 'Brand', 'description': 'Brands and Companies'}, 'entity': {'id': '10029382357', 'name': 'YouTube'}}, {'domain': {'id': '29', 'name': 'Events [Entity Service]', 'description': 'Entity Service related Events domain'}, 'entity': {'id': '1506086002208636930', 'name': '4月17日はイースター', 'description': '4月17日は、キリスト教でイエス・キリストが復活した日とされるイースターです。このモーメントは自動でツイートを掲載しています。'}}]","{'urls': [{'start': 115, 'end': 138, 'url': 'https://t.co/N0O39hBkKF', 'expanded_url': 'https://twitter.com/misty97593389/status/1515573388735037442/photo/1', 'display_url': 'pic.twitter.com/N0O39hBkKF', 'media_key': '16_1515573248347586563'}], 'hashtags': [{'start': 0, 'end': 7, 'tag': 'Roblox'}, {'start': 8, 'end': 16, 'tag': 'YouTube'}, {'start': 17, 'end': 24, 'tag': 'RoPets'}, {'start': 25, 'end': 36, 'tag': 'royalehigh'}, {'start': 37, 'end': 51, 'tag': 'Adoptmetrades'}, {'start': 52, 'end': 63, 'tag': 'OverlookRP'}]}",{'media_keys': ['16_1515573248347586563']},False,,everyone,Twitter for iPhone
1515678629279469571,1360768505855963136,"im feeling sappy n nostalgic, so for every like this gets, ill share a sweet memory i clearly remember",2022-04-17 13:08:39+00:00,,0,22,18,0,en,1515678629279469571,[],,,False,,everyone,Twitter for Android
1515667036625682438,1396861946390097925,"@VerdegayThiago Vai sim, pois a maioria dos jogos da Sony e todos os lançamentos não estarão no serviço. E criança geralmente curte mais Minecraft, Roblox e Fortnite. Além do Game Pass ser mais barato.",2022-04-17 12:22:35+00:00,,0,1,1,0,pt,1515519774826106880,"[{'domain': {'id': '45', 'name': 'Brand Vertical', 'description': 'Top level entities that describe a Brands industry'}, 'entity': {'id': '781974597310615553', 'name': 'Entertainment'}}, {'domain': {'id': '46', 'name': 'Brand Category', 'description': 'Categories within Brand Verticals that narrow down the scope of Brands'}, 'entity': {'id': '781974597218340864', 'name': 'Video Games'}}, {'domain': {'id': '48', 'name': 'Product', 'description': 'Products created by Brands.  Examples: Ford Explorer, Apple iPhone.'}, 'entity': {'id': '1425921713150201858', 'name': 'Xbox Game Pass'}}, {'domain': {'id': '48', 'name': 'Product', 'description': 'Products created by Brands.  Examples: Ford Explorer, Apple iPhone.'}, 'entity': {'id': '1507408751136968705', 'name': 'PlayStation Plus'}}, {'domain': {'id': '71', 'name': 'Video Game', 'description': 'A video game like Overwatch'}, 'entity': {'id': '10043689888', 'name': 'Minecraft'}}, {'domain': {'id': '71', 'name': 'Video Game', 'description': 'A video game like Overwatch'}, 'entity': {'id': '974285387987169280', 'name': 'Fortnite', 'description': 'This entity includes all conversation about the franchise, as well as any individual installments in the series, if applicable.\t\t\t'}}, {'domain': {'id': '71', 'name': 'Video Game', 'description': 'A video game like Overwatch'}, 'entity': {'id': '1088118927580774400', 'name': 'Roblox', 'description': 'Roblox'}}, {'domain': {'id': '45', 'name': 'Brand Vertical', 'description': 'Top level entities that describe a Brands industry'}, 'entity': {'id': '781974597310615553', 'name': 'Entertainment'}}, {'domain': {'id': '46', 'name': 'Brand Category', 'description': 'Categories within Brand Verticals that narrow down the scope of Brands'}, 'entity': {'id': '781974597218340864', 'name': 'Video Games'}}, {'domain': {'id': '47', 'name': 'Brand', 'description': 'Brands and Companies'}, 'entity': {'id': '10026738409', 'name': 'Sony'}}, {'domain': {'id': '47', 'name': 'Brand', 'description': 'Brands and Companies'}, 'entity': {'id': '10027048851', 'name': 'Xbox'}}, {'domain': {'id': '79', 'name': 'Video Game Hardware', 'description': 'Video Game Hardware'}, 'entity': {'id': '10027048851', 'name': 'Xbox'}}]","{'annotations': [{'start': 53, 'end': 56, 'probability': 0.7249, 'type': 'Organization', 'normalized_text': 'Sony'}], 'mentions': [{'start': 0, 'end': 15, 'username': 'VerdegayThiago', 'id': '1479253051940687878'}]}",,False,,everyone,Twitter for iPhone
1515720886703296517,1045112112962568192,"@heycosmonaut like for how much effort i put into my fucking Gmod/3d arts.. they barely get noticed, and they are sooo ""HIGH QUALITY!""  yet.. they get nothing... ;-; https://t.co/b0E1ij2luh",2022-04-17 15:56:34+00:00,,0,2,1,0,en,1515717363714383875,"[{'domain': {'id': '71', 'name': 'Video Game', 'description': 'A video game like Overwatch'}, 'entity': {'id': '856565516432850944', 'name': ""Garry's Mod"", 'description': 'This entity includes all conversation about the franchise, as well as any individual installments in the series, if applicable.\t\t\t'}}]","{'mentions': [{'start': 0, 'end': 13, 'username': 'heycosmonaut', 'id': '1303588999227875329'}], 'urls': [{'start': 166, 'end': 189, 'url': 'https://t.co/b0E1ij2luh', 'expanded_url': 'https://twitter.com/BlazeT0rnado/status/1515720886703296517/photo/1', 'display_url': 'pic.twitter.com/b0E1ij2luh', 'media_key': '3_1515720757539708939'}, {'start': 166, 'end': 189, 'url': 'https://t.co/b0E1ij2luh', 'expanded_url': 'https://twitter.com/BlazeT0rnado/status/1515720886703296517/photo/1', 'display_url': 'pic.twitter.com/b0E1ij2luh', 'media_key': '3_1515720774572822531'}, {'start': 166, 'end': 189, 'url': 'https://t.co/b0E1ij2luh', 'expanded_url': 'https://twitter.com/BlazeT0rnado/status/1515720886703296517/photo/1', 'display_url': 'pic.twitter.com/b0E1ij2luh', 'media_key': '3_1515720786740494336'}, {'start': 166, 'end': 189, 'url': 'https://t.co/b0E1ij2luh', 'expanded_url': 'https://twitter.com/BlazeT0rnado/status/1515720886703296517/photo/1', 'display_url': 'pic.twitter.com/b0E1ij2luh', 'media_key': '3_1515720859259969542'}]}","{'media_keys': ['3_1515720757539708939', '3_1515720774572822531', '3_1515720786740494336', '3_1515720859259969542']}",False,,everyone,Twitter Web App
1515684509269827592,1056053249470541824,Happy Easter to all our friends who celebrate 🐣,2022-04-17 13:32:01+00:00,,49,51,860,2,en,1515684509269827592,"[{'domain': {'id': '29', 'name': 'Events [Entity Service]', 'description': 'Entity Service related Events domain'}, 'entity': {'id': '1372917575357591554', 'name': 'Easter', 'description': 'this entity for all conversations for Easter all year '}}, {'domain': {'id': '119', 'name': 'Holiday', 'description': 'Holidays like Christmas or Halloween'}, 'entity': {'id': '1372917575357591554', 'name': 'Easter', 'description': 'this entity for all conversations for Easter all year '}}, {'domain': {'id': '29', 'name': 'Events [Entity Service]', 'description': 'Entity Service related Events domain'}, 'entity': {'id': '1506086002208636930', 'name': '4月17日はイースター', 'description': '4月17日は、キリスト教でイエス・キリストが復活した日とされるイースターです。このモーメントは自動でツイートを掲載しています。'}}]",,,False,,everyone,Twitter for iPhone
1515427160902803457,1408677557411717121,BREAKING NEWS: Roblox Is Being Shut Down #RIP https://t.co/YGafnbaDID,2022-04-16 20:29:25+00:00,,745,4230,12090,202,en,1515427160902803457,"[{'domain': {'id': '71', 'name': 'Video Game', 'description': 'A video game like Overwatch'}, 'entity': {'id': '1088118927580774400', 'name': 'Roblox', 'description': 'Roblox'}}]","{'urls': [{'start': 46, 'end': 69, 'url': 'https://t.co/YGafnbaDID', 'expanded_url': 'https://twitter.com/Rolbox_RTC/status/1515427160902803457/photo/1', 'display_url': 'pic.twitter.com/YGafnbaDID', 'media_key': '3_1515427155634757641'}], 'hashtags': [{'start': 41, 'end': 45, 'tag': 'RIP'}]}",{'media_keys': ['3_1515427155634757641']},False,,everyone,Twitter for iPhone
1515158371749744640,1451797452709789697,name a cringe youtuber in 3 seconds,2022-04-16 02:41:20+00:00,,53,1222,503,4,en,1515158371749744640,[],,,False,,everyone,Twitter Web App
1512133583812628480,3368231362,"Its been a whole year since joining @untamed_planet ! Here's some of the environment work I have created for it's social game!
#RobloxDev #Roblox https://t.co/UsaIq1F4B0",2022-04-07 18:21:55+00:00,,26,17,311,1,en,1512133583812628480,"[{'domain': {'id': '71', 'name': 'Video Game', 'description': 'A video game like Overwatch'}, 'entity': {'id': '1088118927580774400', 'name': 'Roblox', 'description': 'Roblox'}}]","{'mentions': [{'start': 36, 'end': 51, 'username': 'untamed_planet', 'id': '1514381639568306178'}], 'urls': [{'start': 146, 'end': 169, 'url': 'https://t.co/UsaIq1F4B0', 'expanded_url': 'https://twitter.com/xJenny_Beanx/status/1512133583812628480/photo/1', 'display_url': 'pic.twitter.com/UsaIq1F4B0', 'media_key': '3_1512132461530169353'}, {'start': 146, 'end': 169, 'url': 'https://t.co/UsaIq1F4B0', 'expanded_url': 'https://twitter.com/xJenny_Beanx/status/1512133583812628480/photo/1', 'display_url': 'pic.twitter.com/UsaIq1F4B0', 'media_key': '3_1512132461546852362'}, {'start': 146, 'end': 169, 'url': 'https://t.co/UsaIq1F4B0', 'expanded_url': 'https://twitter.com/xJenny_Beanx/status/1512133583812628480/photo/1', 'display_url': 'pic.twitter.com/UsaIq1F4B0', 'media_key': '3_1512132521642840065'}, {'start': 146, 'end': 169, 'url': 'https://t.co/UsaIq1F4B0', 'expanded_url': 'https://twitter.com/xJenny_Beanx/status/1512133583812628480/photo/1', 'display_url': 'pic.twitter.com/UsaIq1F4B0', 'media_key': '3_1512133459866750984'}], 'hashtags': [{'start': 127, 'end': 137, 'tag': 'RobloxDev'}, {'start': 138, 'end': 145, 'tag': 'Roblox'}]}","{'media_keys': ['3_1512132461530169353', '3_1512132461546852362', '3_1512132521642840065', '3_1512133459866750984']}",False,,everyone,Twitter Web App
1515717363714383875,1303588999227875329,BYE I JUST REACHED 1M VIEWS FOR THIS STUPID FUCKING VIDEO https://t.co/mnbTiGTRMS,2022-04-17 15:42:34+00:00,,0,2,3,0,en,1515717363714383875,[],"{'urls': [{'start': 58, 'end': 81, 'url': 'https://t.co/mnbTiGTRMS', 'expanded_url': 'https://twitter.com/heycosmonaut/status/1515717363714383875/photo/1', 'display_url': 'pic.twitter.com/mnbTiGTRMS', 'media_key': '3_1515717359444672525'}]}",{'media_keys': ['3_1515717359444672525']},False,,everyone,Twitter for iPhone
1515589356618383360,1457977201358680065,"genshin pc players, what do you use when you sprint? right click or shift button?",2022-04-17 07:13:55+00:00,,15,166,1134,157,en,1515589356618383360,"[{'domain': {'id': '71', 'name': 'Video Game', 'description': 'A video game like Overwatch'}, 'entity': {'id': '1310987643765678083', 'name': 'Genshin Impact'}}, {'domain': {'id': '46', 'name': 'Brand Category', 'description': 'Categories within Brand Verticals that narrow down the scope of Brands'}, 'entity': {'id': '781974596165640192', 'name': 'Telco'}}, {'domain': {'id': '47', 'name': 'Brand', 'description': 'Brands and Companies'}, 'entity': {'id': '10026319210', 'name': 'Sprint'}}, {'domain': {'id': '30', 'name': 'Entities [Entity Service]', 'description': 'Entity Service top level domain, every item that is in Entity Service should be in this domain'}, 'entity': {'id': '848920371311001600', 'name': 'Technology', 'description': 'Technology and computing'}}, {'domain': {'id': '30', 'name': 'Entities [Entity Service]', 'description': 'Entity Service top level domain, every item that is in Entity Service should be in this domain'}, 'entity': {'id': '848985956778561538', 'name': 'Mobile', 'description': 'Mobile'}}]",,,False,,everyone,Twitter Web App
1512973394467303425,1375331774671155203,"100 ROBUX GIVEAWAY
- follow me + @MeeniEnnie 
- like and retweet",2022-04-10 01:59:01+00:00,,120,93,131,40,en,1512973394467303425,[],"{'mentions': [{'start': 33, 'end': 44, 'username': 'MeeniEnnie', 'id': '1334268021414658048'}]}",,False,,everyone,Twitter for iPad
1514749940051849216,1271883908582223872,"☆*:.｡. SELLING #roblox ACCOUNT.｡.:*☆🧚🏻‍♀️

 °°・ #robux only・°°

 「INCLUDES」 
・ #egghunt 2018/2019 egg hats
・mostly good stuff in #royalehigh
・offsale #beastmode face
・about 500 pages of #badges

❣️not trading first❣️

🙅🏽‍♀️if not interested #retweet 🙅🏽‍♀️

🖤pictures below🖤 https://t.co/F8qiP8pUDY",2022-04-14 23:38:23+00:00,,10,5,8,2,en,1514749940051849216,"[{'domain': {'id': '29', 'name': 'Events [Entity Service]', 'description': 'Entity Service related Events domain'}, 'entity': {'id': '1372917575357591554', 'name': 'Easter', 'description': 'this entity for all conversations for Easter all year '}}, {'domain': {'id': '71', 'name': 'Video Game', 'description': 'A video game like Overwatch'}, 'entity': {'id': '1088118927580774400', 'name': 'Roblox', 'description': 'Roblox'}}, {'domain': {'id': '71', 'name': 'Video Game', 'description': 'A video game like Overwatch'}, 'entity': {'id': '1230882318224510978', 'name': 'Royale High'}}, {'domain': {'id': '119', 'name': 'Holiday', 'description': 'Holidays like Christmas or Halloween'}, 'entity': {'id': '1372917575357591554', 'name': 'Easter', 'description': 'this entity for all conversations for Easter all year '}}]","{'urls': [{'start': 274, 'end': 297, 'url': 'https://t.co/F8qiP8pUDY', 'expanded_url': 'https://twitter.com/c2miIa/status/1514749940051849216/photo/1', 'display_url': 'pic.twitter.com/F8qiP8pUDY', 'media_key': '3_1514749936406999056'}, {'start': 274, 'end': 297, 'url': 'https://t.co/F8qiP8pUDY', 'expanded_url': 'https://twitter.com/c2miIa/status/1514749940051849216/photo/1', 'display_url': 'pic.twitter.com/F8qiP8pUDY', 'media_key': '3_1514749936419581976'}, {'start': 274, 'end': 297, 'url': 'https://t.co/F8qiP8pUDY', 'expanded_url': 'https://twitter.com/c2miIa/status/1514749940051849216/photo/1', 'display_url': 'pic.twitter.com/F8qiP8pUDY', 'media_key': '3_1514749936612519956'}, {'start': 274, 'end': 297, 'url': 'https://t.co/F8qiP8pUDY', 'expanded_url': 'https://twitter.com/c2miIa/status/1514749940051849216/photo/1', 'display_url': 'pic.twitter.com/F8qiP8pUDY', 'media_key': '3_1514749937472311296'}], 'hashtags': [{'start': 15, 'end': 22, 'tag': 'roblox'}, {'start': 48, 'end': 54, 'tag': 'robux'}, {'start': 79, 'end': 87, 'tag': 'egghunt'}, {'start': 129, 'end': 140, 'tag': 'royalehigh'}, {'start': 150, 'end': 160, 'tag': 'beastmode'}, {'start': 186, 'end': 193, 'tag': 'badges'}, {'start': 241, 'end': 249, 'tag': 'retweet'}]}","{'media_keys': ['3_1514749936406999056', '3_1514749936419581976', '3_1514749936612519956', '3_1514749937472311296']}",False,,everyone,Twitter for iPhone
1515718947190226944,1431271092631441411,"How i discovered Jailbreak in 2017: so once upon a time aaryav started roblox in 2016 and was a big fan of prison life, he was addicted to playing it. A year later, av found Jailbreak in the homepage, av tried it. And found that it was like prison life but seemed remastered. Cool",2022-04-17 15:48:52+00:00,,0,2,1,0,en,1515718947190226944,"[{'domain': {'id': '71', 'name': 'Video Game', 'description': 'A video game like Overwatch'}, 'entity': {'id': '1088118927580774400', 'name': 'Roblox', 'description': 'Roblox'}}]","{'annotations': [{'start': 17, 'end': 25, 'probability': 0.8303, 'type': 'Product', 'normalized_text': 'Jailbreak'}, {'start': 174, 'end': 182, 'probability': 0.7393, 'type': 'Product', 'normalized_text': 'Jailbreak'}]}",,False,,everyone,Twitter Web App
1515719274979016706,1484959712688971780,"@LeaksEvents @Roblog_ @Roblox_RTC Alguém sabe como ganha moedas fácil no mapa, já usei todos os códigos ativos, mais ainda falta 6 mil moedas para comprar 2 manobras, uma de 4 mil e outra de 2 mil.",2022-04-17 15:50:10+00:00,,0,1,2,0,pt,1515718627252654083,[],"{'mentions': [{'start': 0, 'end': 12, 'username': 'LeaksEvents', 'id': '1422163374339727363'}, {'start': 13, 'end': 21, 'username': 'Roblog_', 'id': '1425933854733393926'}, {'start': 22, 'end': 33, 'username': 'Roblox_RTC', 'id': '1056053249470541824'}]}",,False,,everyone,Twitter for Android
1513157602833698816,1069006874811363328,Retweet this,2022-04-10 14:11:00+00:00,,662,188,388,15,en,1513157602833698816,[],,,False,,everyone,Twitter Web App
1515395368090931200,1251677662810042371,How much Robux is on your account?,2022-04-16 18:23:05+00:00,,115,2712,943,8,en,1515395368090931200,[],"{'annotations': [{'start': 9, 'end': 13, 'probability': 0.2921, 'type': 'Person', 'normalized_text': 'Robux'}]}",,False,,everyone,Twitter for iPhone
