tweetid,author_id,text,created_at,geo,retweets,replies,likes,quote_count,lang,conversation_id,context_annotations,entities,attachments,possibly_sensitive,withheld,reply_settings,source
1522648480874827776,1439275001375432706,"So, @Roblox. While you're bringing back old items to become limited, how about throwing in some boomer items as well?
Could you even imagine the value those paintball trophies could pull? That's assuming any would enter circulation to begin with. #roblox https://t.co/AhHC8oHl5v",2022-05-06 18:44:21+00:00,,2,10,46,0,en,1522648480874827776,"[{'domain': {'id': '11', 'name': 'Sport', 'description': 'Types of sports, like soccer and basketball'}, 'entity': {'id': '1282738451628953601', 'name': 'Extreme sports'}}, {'domain': {'id': '71', 'name': 'Video Game', 'description': 'A video game like Overwatch'}, 'entity': {'id': '1088118927580774400', 'name': 'Roblox', 'description': 'Roblox'}}]","{'mentions': [{'start': 4, 'end': 11, 'username': 'Roblox', 'id': '16745055'}], 'hashtags': [{'start': 247, 'end': 254, 'tag': 'roblox'}], 'urls': [{'start': 255, 'end': 278, 'url': 'https://t.co/AhHC8oHl5v', 'expanded_url': 'https://twitter.com/FuturaRBLX/status/1522648480874827776/photo/1', 'display_url': 'pic.twitter.com/AhHC8oHl5v', 'media_key': '3_1522648064334319616'}]}",{'media_keys': ['3_1522648064334319616']},False,,everyone,Twitter Web App
1522937633294499841,1056053249470541824,What's up?,2022-05-07 13:53:21+00:00,,32,374,1296,8,en,1522937633294499841,[],,,False,,everyone,Twitter Web App
1522916139860475906,1216059288961060866,@BrokenBoneRBLX When can we play it?,2022-05-07 12:27:56+00:00,,0,1,0,0,en,1522659362015264768,[],"{'mentions': [{'start': 0, 'end': 15, 'username': 'BrokenBoneRBLX', 'id': '718229354245943297'}]}",,False,,everyone,Twitter Web App
1522938311572135937,1289560616370409479,"@Moshinate @Roblox_RTC Ellie. Along the way, they meet a talking dog named Dug (Peterson), and encounter a giant bird named Kevin, who is being hunted by the explorer Charles Muntz (Plummer).",2022-05-07 13:56:02+00:00,,0,1,11,0,en,1522937633294499841,[],"{'mentions': [{'start': 0, 'end': 10, 'username': 'Moshinate', 'id': '3226213488'}, {'start': 11, 'end': 22, 'username': 'Roblox_RTC', 'id': '1056053249470541824'}], 'annotations': [{'start': 23, 'end': 27, 'probability': 0.981, 'type': 'Person', 'normalized_text': 'Ellie'}, {'start': 75, 'end': 77, 'probability': 0.5367, 'type': 'Person', 'normalized_text': 'Dug'}, {'start': 80, 'end': 87, 'probability': 0.7, 'type': 'Person', 'normalized_text': 'Peterson'}, {'start': 124, 'end': 128, 'probability': 0.9613, 'type': 'Person', 'normalized_text': 'Kevin'}, {'start': 167, 'end': 179, 'probability': 0.9434, 'type': 'Person', 'normalized_text': 'Charles Muntz'}]}",,False,,everyone,Twitter Web App
1522668061899333632,1056053249470541824,"Roblox has UPDATED THE penguin package and players are UPSET 😡

Popular YouTubers such as Flamingo use the outfit and their outfits are now ruined with feathers 😔

What do you think? https://t.co/H1qj1ikEBP",2022-05-06 20:02:10+00:00,,412,743,11427,117,en,1522668061899333632,"[{'domain': {'id': '71', 'name': 'Video Game', 'description': 'A video game like Overwatch'}, 'entity': {'id': '1088118927580774400', 'name': 'Roblox', 'description': 'Roblox'}}]","{'urls': [{'start': 183, 'end': 206, 'url': 'https://t.co/H1qj1ikEBP', 'expanded_url': 'https://twitter.com/Roblox_RTC/status/1522668061899333632/photo/1', 'display_url': 'pic.twitter.com/H1qj1ikEBP', 'media_key': '3_1522668058866765827'}, {'start': 183, 'end': 206, 'url': 'https://t.co/H1qj1ikEBP', 'expanded_url': 'https://twitter.com/Roblox_RTC/status/1522668061899333632/photo/1', 'display_url': 'pic.twitter.com/H1qj1ikEBP', 'media_key': '3_1522668058871013379'}], 'annotations': [{'start': 0, 'end': 5, 'probability': 0.4729, 'type': 'Organization', 'normalized_text': 'Roblox'}]}","{'media_keys': ['3_1522668058866765827', '3_1522668058871013379']}",False,,everyone,Twitter for iPhone
1522937618538930183,1459839343636459525,@MrNightfoxx Hi im subbed and I have no pets worth any value.This would really help.Keep up the good work man!,2022-05-07 13:53:17+00:00,,0,1,0,0,en,1450210103609733122,[],"{'mentions': [{'start': 0, 'end': 12, 'username': 'MrNightfoxx', 'id': '2996211503'}]}",,False,,everyone,Twitter for Android
1522862519756500998,1255447000516104194,@BrokenBoneRBLX Game link?,2022-05-07 08:54:52+00:00,,0,1,0,0,en,1522659362015264768,[],"{'mentions': [{'start': 0, 'end': 15, 'username': 'BrokenBoneRBLX', 'id': '718229354245943297'}]}",,False,,everyone,Twitter for Android
1522938293448491009,1289560616370409479,"@Moshinate @Roblox_RTC - e voices of Ed Asner, Christopher Plummer, Jordan Nagai, and Bob Peterson. The film centers on elderly widower Carl Fredricksen (Asner) and Wilderness Explorer Russell (Nagai), who go on a journey to South America in order to fulfill a promise that Carl made to his late wife -",2022-05-07 13:55:58+00:00,,0,1,21,0,en,1522937633294499841,"[{'domain': {'id': '10', 'name': 'Person', 'description': 'Named people in the world like Nelson Mandela'}, 'entity': {'id': '946514787193602048', 'name': 'Christopher Plummer', 'description': 'Christopher Plummer'}}, {'domain': {'id': '10', 'name': 'Person', 'description': 'Named people in the world like Nelson Mandela'}, 'entity': {'id': '1070725237476483074', 'name': 'Ed Asner', 'description': 'American film, television, stage, and voice actor and former president of the Screen Actors Guild'}}, {'domain': {'id': '10', 'name': 'Person', 'description': 'Named people in the world like Nelson Mandela'}, 'entity': {'id': '1070726536263753728', 'name': 'Bob Peterson', 'description': 'American actor, writer and director'}}, {'domain': {'id': '56', 'name': 'Actor', 'description': 'An actor or actress in the world, like Kate Winslet or Leonardo DiCaprio'}, 'entity': {'id': '946514787193602048', 'name': 'Christopher Plummer', 'description': 'Christopher Plummer'}}, {'domain': {'id': '56', 'name': 'Actor', 'description': 'An actor or actress in the world, like Kate Winslet or Leonardo DiCaprio'}, 'entity': {'id': '1070725237476483074', 'name': 'Ed Asner', 'description': 'American film, television, stage, and voice actor and former president of the Screen Actors Guild'}}, {'domain': {'id': '56', 'name': 'Actor', 'description': 'An actor or actress in the world, like Kate Winslet or Leonardo DiCaprio'}, 'entity': {'id': '1070726536263753728', 'name': 'Bob Peterson', 'description': 'American actor, writer and director'}}]","{'mentions': [{'start': 0, 'end': 10, 'username': 'Moshinate', 'id': '3226213488'}, {'start': 11, 'end': 22, 'username': 'Roblox_RTC', 'id': '1056053249470541824'}], 'annotations': [{'start': 37, 'end': 44, 'probability': 0.9311, 'type': 'Person', 'normalized_text': 'Ed Asner'}, {'start': 47, 'end': 65, 'probability': 0.9833, 'type': 'Person', 'normalized_text': 'Christopher Plummer'}, {'start': 68, 'end': 79, 'probability': 0.9593, 'type': 'Person', 'normalized_text': 'Jordan Nagai'}, {'start': 86, 'end': 97, 'probability': 0.9937, 'type': 'Person', 'normalized_text': 'Bob Peterson'}, {'start': 136, 'end': 151, 'probability': 0.9715, 'type': 'Person', 'normalized_text': 'Carl Fredricksen'}, {'start': 225, 'end': 237, 'probability': 0.9512, 'type': 'Place', 'normalized_text': 'South America'}, {'start': 274, 'end': 277, 'probability': 0.9852, 'type': 'Person', 'normalized_text': 'Carl'}]}",,False,,everyone,Twitter Web App
1522937938476216320,3226213488,"@Roblox_RTC Up is a 2009 American computer-animated film produced by Pixar Animation Studios and released by Walt Disney Pictures. The film was directed by Pete Docter, who wrote the screenplay with co-director Bob Peterson, based on a story by Docter, Peterson, and Tom McCarthy. It stars th",2022-05-07 13:54:34+00:00,,1,3,45,0,en,1522937633294499841,"[{'domain': {'id': '10', 'name': 'Person', 'description': 'Named people in the world like Nelson Mandela'}, 'entity': {'id': '1070726536263753728', 'name': 'Bob Peterson', 'description': 'American actor, writer and director'}}, {'domain': {'id': '45', 'name': 'Brand Vertical', 'description': 'Top level entities that describe a Brands industry'}, 'entity': {'id': '781974597310615553', 'name': 'Entertainment'}}, {'domain': {'id': '46', 'name': 'Brand Category', 'description': 'Categories within Brand Verticals that narrow down the scope of Brands'}, 'entity': {'id': '781974597105094656', 'name': 'TV/Movies Related'}}, {'domain': {'id': '47', 'name': 'Brand', 'description': 'Brands and Companies'}, 'entity': {'id': '1270143733195915264', 'name': 'Pixar'}}, {'domain': {'id': '47', 'name': 'Brand', 'description': 'Brands and Companies'}, 'entity': {'id': '1286636589653741568', 'name': 'Walt Disney Pictures'}}, {'domain': {'id': '56', 'name': 'Actor', 'description': 'An actor or actress in the world, like Kate Winslet or Leonardo DiCaprio'}, 'entity': {'id': '1070726536263753728', 'name': 'Bob Peterson', 'description': 'American actor, writer and director'}}, {'domain': {'id': '65', 'name': 'Interests and Hobbies Vertical', 'description': 'Top level interests and hobbies groupings, like Food or Travel'}, 'entity': {'id': '1280550787207147521', 'name': 'Arts & culture'}}, {'domain': {'id': '45', 'name': 'Brand Vertical', 'description': 'Top level entities that describe a Brands industry'}, 'entity': {'id': '781974597310615553', 'name': 'Entertainment'}}, {'domain': {'id': '46', 'name': 'Brand Category', 'description': 'Categories within Brand Verticals that narrow down the scope of Brands'}, 'entity': {'id': '781974597105094656', 'name': 'TV/Movies Related'}}, {'domain': {'id': '47', 'name': 'Brand', 'description': 'Brands and Companies'}, 'entity': {'id': '10037284711', 'name': 'Disney'}}, {'domain': {'id': '66', 'name': 'Interests and Hobbies Category', 'description': 'A grouping of interests and hobbies entities, like Novelty Food or Destinations'}, 'entity': {'id': '847869900274016260', 'name': 'Screenwriting', 'description': 'Screenwriting'}}, {'domain': {'id': '67', 'name': 'Interests and Hobbies', 'description': 'Interests, opinions, and behaviors of individuals, groups, or cultures; like Speciality Cooking or Theme Parks'}, 'entity': {'id': '1242509106230878208', 'name': 'Filmmaking'}}, {'domain': {'id': '87', 'name': 'Movie Genre', 'description': 'A movie genre like Action'}, 'entity': {'id': '856976559529263104', 'name': 'Animated films', 'description': 'Animation'}}]","{'mentions': [{'start': 0, 'end': 11, 'username': 'Roblox_RTC', 'id': '1056053249470541824'}], 'annotations': [{'start': 69, 'end': 91, 'probability': 0.3972, 'type': 'Other', 'normalized_text': 'Pixar Animation Studios'}, {'start': 109, 'end': 119, 'probability': 0.4172, 'type': 'Person', 'normalized_text': 'Walt Disney'}, {'start': 156, 'end': 166, 'probability': 0.9971, 'type': 'Person', 'normalized_text': 'Pete Docter'}, {'start': 211, 'end': 222, 'probability': 0.9729, 'type': 'Person', 'normalized_text': 'Bob Peterson'}, {'start': 245, 'end': 250, 'probability': 0.9684, 'type': 'Person', 'normalized_text': 'Docter'}, {'start': 253, 'end': 260, 'probability': 0.926, 'type': 'Person', 'normalized_text': 'Peterson'}, {'start': 267, 'end': 278, 'probability': 0.9964, 'type': 'Person', 'normalized_text': 'Tom McCarthy'}]}",,False,,everyone,Twitter Web App
1522916469402648576,1178309303939338240,@Thelmagined_X @strawbys_x @Roblox_Gamer20 @FN_Assist @FortniteGame @kitsunexkitsu @Dreowings Does it matter? You fa- Farman,2022-05-07 12:29:15+00:00,,0,1,0,0,en,1522576923796197376,"[{'domain': {'id': '71', 'name': 'Video Game', 'description': 'A video game like Overwatch'}, 'entity': {'id': '974285387987169280', 'name': 'Fortnite', 'description': 'This entity includes all conversation about the franchise, as well as any individual installments in the series, if applicable.\t\t\t'}}]","{'mentions': [{'start': 0, 'end': 14, 'username': 'Thelmagined_X', 'id': '1484271704364961801'}, {'start': 15, 'end': 26, 'username': 'strawbys_x', 'id': '1177684176675463169'}, {'start': 27, 'end': 42, 'username': 'Roblox_Gamer20', 'id': '1440674789165715464'}, {'start': 43, 'end': 53, 'username': 'FN_Assist', 'id': '985168092203569152'}, {'start': 54, 'end': 67, 'username': 'FortniteGame', 'id': '425871040'}, {'start': 68, 'end': 82, 'username': 'kitsunexkitsu', 'id': '1243157572187754498'}, {'start': 83, 'end': 93, 'username': 'Dreowings', 'id': '1143201465932156928'}]}",,False,,everyone,Twitter for iPhone
1522762446003478531,1041136006383259649,PETITION TO BRING BACK STATUS'S ON @Roblox https://t.co/hXmLDzV8J4,2022-05-07 02:17:13+00:00,,112,74,1601,8,en,1522762446003478531,"[{'domain': {'id': '71', 'name': 'Video Game', 'description': 'A video game like Overwatch'}, 'entity': {'id': '1088118927580774400', 'name': 'Roblox', 'description': 'Roblox'}}]","{'mentions': [{'start': 35, 'end': 42, 'username': 'Roblox', 'id': '16745055'}], 'urls': [{'start': 43, 'end': 66, 'url': 'https://t.co/hXmLDzV8J4', 'expanded_url': 'https://twitter.com/EuyphRBLX/status/1522762446003478531/photo/1', 'display_url': 'pic.twitter.com/hXmLDzV8J4', 'media_key': '3_1522762385077018624'}]}",{'media_keys': ['3_1522762385077018624']},False,,everyone,Twitter Web App
1522935072038473733,1426188245637996547,@RBLXTradingNews @Roblox_RTC They should make metaverse valk limited cuz many people dont have robux to get a limited,2022-05-07 13:43:10+00:00,,0,10,15,1,en,1522921681135804417,"[{'domain': {'id': '30', 'name': 'Entities [Entity Service]', 'description': 'Entity Service top level domain, every item that is in Entity Service should be in this domain'}, 'entity': {'id': '848920371311001600', 'name': 'Technology', 'description': 'Technology and computing'}}, {'domain': {'id': '165', 'name': 'Technology', 'description': 'for individual and types of technology, e.g., food technology, 3D printing'}, 'entity': {'id': '848920371311001600', 'name': 'Technology', 'description': 'Technology and computing'}}]","{'mentions': [{'start': 0, 'end': 16, 'username': 'RBLXTradingNews', 'id': '1299880772338421762'}, {'start': 17, 'end': 28, 'username': 'Roblox_RTC', 'id': '1056053249470541824'}]}",,False,,everyone,Twitter for Android
1522585889649659908,1505565463719206923,"how much robux do you need ?
limit:- 4k https://t.co/JEbLkRBFFa",2022-05-06 14:35:39+00:00,,984,3309,1626,34,en,1522585889649659908,[],"{'urls': [{'start': 40, 'end': 63, 'url': 'https://t.co/JEbLkRBFFa', 'expanded_url': 'https://twitter.com/nnnotclara/status/1522585889649659908/photo/1', 'display_url': 'pic.twitter.com/JEbLkRBFFa', 'media_key': '3_1522585886172479488'}]}",{'media_keys': ['3_1522585886172479488']},False,,mentionedUsers,Twitter for Android
1522937212295340034,1522935240825712641,Bon les gars après mûre réflexion j'ai décidé de revenir sur Twitter ce compte est provisoire en attendant que le main reviens @TheBourgnaque  @Hemine__  @VisteeqzAka  @_Yoshaft_  @eewazmi_  @KWGamingDBL  @RyugaIdeki  go refollow et rt svp,2022-05-07 13:51:40+00:00,,4,4,10,2,fr,1522937212295340034,"[{'domain': {'id': '46', 'name': 'Brand Category', 'description': 'Categories within Brand Verticals that narrow down the scope of Brands'}, 'entity': {'id': '781974596752842752', 'name': 'Services'}}, {'domain': {'id': '47', 'name': 'Brand', 'description': 'Brands and Companies'}, 'entity': {'id': '10045225402', 'name': 'Twitter'}}]","{'mentions': [{'start': 127, 'end': 141, 'username': 'TheBourgnaque', 'id': '1085310886468816896'}, {'start': 143, 'end': 152, 'username': 'Hemine__', 'id': '1481343431066767364'}, {'start': 154, 'end': 166, 'username': 'VisteeqzAka', 'id': '1491877790400106501'}, {'start': 168, 'end': 178, 'username': '_Yoshaft_', 'id': '1478814367298764801'}, {'start': 180, 'end': 189, 'username': 'eewazmi_', 'id': '1257240975535112192'}, {'start': 191, 'end': 203, 'username': 'KWGamingDBL', 'id': '1511267413811212292'}, {'start': 205, 'end': 216, 'username': 'RyugaIdeki', 'id': '1854110984'}]}",,False,,everyone,Twitter for Android
1522916355368013825,1178309303939338240,@Thelmagined_X @strawbys_x @Roblox_Gamer20 @FN_Assist @FortniteGame @kitsunexkitsu @Dreowings https://t.co/UnHzHWVDnB,2022-05-07 12:28:48+00:00,,0,1,0,0,qme,1522576923796197376,"[{'domain': {'id': '71', 'name': 'Video Game', 'description': 'A video game like Overwatch'}, 'entity': {'id': '974285387987169280', 'name': 'Fortnite', 'description': 'This entity includes all conversation about the franchise, as well as any individual installments in the series, if applicable.\t\t\t'}}]","{'mentions': [{'start': 15, 'end': 26, 'username': 'strawbys_x', 'id': '1177684176675463169'}, {'start': 27, 'end': 42, 'username': 'Roblox_Gamer20', 'id': '1440674789165715464'}, {'start': 43, 'end': 53, 'username': 'FN_Assist', 'id': '985168092203569152'}, {'start': 54, 'end': 67, 'username': 'FortniteGame', 'id': '425871040'}, {'start': 68, 'end': 82, 'username': 'kitsunexkitsu', 'id': '1243157572187754498'}, {'start': 83, 'end': 93, 'username': 'Dreowings', 'id': '1143201465932156928'}], 'urls': [{'start': 94, 'end': 117, 'url': 'https://t.co/UnHzHWVDnB', 'expanded_url': 'https://twitter.com/quanzoow/status/1522916355368013825/photo/1', 'display_url': 'pic.twitter.com/UnHzHWVDnB', 'media_key': '16_1522916342025920512'}]}",{'media_keys': ['16_1522916342025920512']},False,,everyone,Twitter for iPhone
1522937868255207424,1417587809502826500,@RoBloxyNews_ @Roblog_ they are already gone,2022-05-07 13:54:17+00:00,,0,1,2,0,en,1522935243459776514,[],"{'mentions': [{'start': 0, 'end': 13, 'username': 'RoBloxyNews_', 'id': '1452405514730709002'}, {'start': 14, 'end': 22, 'username': 'Roblog_', 'id': '1425933854733393926'}]}",,False,,everyone,Twitter for Android
1522703619660910595,1463092215538847752,"Todos meus amigos estão namorando
E eu não.... https://t.co/d7GBbet2g7",2022-05-06 22:23:28+00:00,,5,20,53,2,pt,1522703619660910595,[],"{'urls': [{'start': 47, 'end': 70, 'url': 'https://t.co/d7GBbet2g7', 'expanded_url': 'https://twitter.com/Laylayaab/status/1522703619660910595/photo/1', 'display_url': 'pic.twitter.com/d7GBbet2g7', 'media_key': '3_1522703617429590022'}]}",{'media_keys': ['3_1522703617429590022']},False,,everyone,Twitter for Android
1522934302681358337,492675779,drop pl diamond ml yang bisa qris #zonauang,2022-05-07 13:40:07+00:00,,0,18,0,2,in,1522934302681358337,[],"{'hashtags': [{'start': 34, 'end': 43, 'tag': 'zonauang'}]}",,False,,everyone,Twitter for Android
1522937841692528641,1492579111851769858,@glamorous_ari21 @OLittleroyale @LLcomicsRBX AYO BLOOM FROM WINX???,2022-05-07 13:54:10+00:00,,0,1,0,0,en,1522362731248115712,[],"{'mentions': [{'start': 32, 'end': 44, 'username': 'LLcomicsRBX', 'id': '1201925130387111936'}], 'annotations': [{'start': 60, 'end': 63, 'probability': 0.3517, 'type': 'Organization', 'normalized_text': 'WINX'}]}",,False,,everyone,Twitter Web App
