tweetid,author_id,text,created_at,geo,retweets,replies,likes,quote_count,lang,conversation_id,context_annotations,entities,attachments,possibly_sensitive,withheld,reply_settings,source
1517324326915223572,197316503,@MTorriero You can stake them and earn them!,2022-04-22 02:08:04+00:00,,0,1,0,0,en,1517299886777061377,[],"{'mentions': [{'start': 0, 'end': 10, 'username': 'MTorriero', 'id': '220391148'}]}",,False,,everyone,Twitter for iPhone
1517325446387576835,1385006572213002250,why are my shoulders so big,2022-04-22 02:12:31+00:00,,0,1,1,0,en,1517325446387576835,[],,,False,,everyone,Twitter for iPhone
1517325930519166976,1502177636269047809,@Roblox @Roblox Fix the Error 286 i cant play even tho my storage is not full,2022-04-22 02:14:27+00:00,,0,1,1,0,en,1516910351740067840,"[{'domain': {'id': '71', 'name': 'Video Game', 'description': 'A video game like Overwatch'}, 'entity': {'id': '1088118927580774400', 'name': 'Roblox', 'description': 'Roblox'}}]","{'mentions': [{'start': 0, 'end': 7, 'username': 'Roblox', 'id': '16745055'}, {'start': 8, 'end': 15, 'username': 'Roblox', 'id': '16745055'}]}",,False,,everyone,Twitter for iPhone
1516929967669534723,18927441,"Kim Kardashian threatened to sue Roblox after a game claiming to offer an unreleased sex tape appeared, and her six-year-old son saw the ad. Her response? ""I have all the time, all the money, and all the resources to burn them all to the f**king ground."" https://t.co/LNomN3XpQ4 https://t.co/r53baPBJJg",2022-04-21 00:01:02+00:00,,2143,1436,28444,2947,en,1516929967669534723,"[{'domain': {'id': '10', 'name': 'Person', 'description': 'Named people in the world like Nelson Mandela'}, 'entity': {'id': '806570121959383040', 'name': 'Kim Kardashian', 'description': 'Kim Kardashian'}}, {'domain': {'id': '46', 'name': 'Brand Category', 'description': 'Categories within Brand Verticals that narrow down the scope of Brands'}, 'entity': {'id': '781974596157181956', 'name': 'Online Site'}}, {'domain': {'id': '47', 'name': 'Brand', 'description': 'Brands and Companies'}, 'entity': {'id': '1106638172182597632', 'name': 'IGN'}}, {'domain': {'id': '58', 'name': 'Entertainment Personality', 'description': 'An entertainment personality in the world, like Anderson Cooper or Miranda Sings'}, 'entity': {'id': '806570121959383040', 'name': 'Kim Kardashian', 'description': 'Kim Kardashian'}}, {'domain': {'id': '71', 'name': 'Video Game', 'description': 'A video game like Overwatch'}, 'entity': {'id': '1088118927580774400', 'name': 'Roblox', 'description': 'Roblox'}}]","{'urls': [{'start': 255, 'end': 278, 'url': 'https://t.co/LNomN3XpQ4', 'expanded_url': 'https://bit.ly/3v2D5Ko', 'display_url': 'bit.ly/3v2D5Ko'}, {'start': 279, 'end': 302, 'url': 'https://t.co/r53baPBJJg', 'expanded_url': 'https://twitter.com/IGN/status/1516929967669534723/photo/1', 'display_url': 'pic.twitter.com/r53baPBJJg', 'media_key': '3_1516929961965330432'}], 'annotations': [{'start': 0, 'end': 13, 'probability': 0.9924, 'type': 'Person', 'normalized_text': 'Kim Kardashian'}, {'start': 33, 'end': 38, 'probability': 0.3564, 'type': 'Organization', 'normalized_text': 'Roblox'}]}",{'media_keys': ['3_1516929961965330432']},False,,everyone,Sprout Social
1517324398289731587,2185713181,I sleep. What recent news/topics/tweets/videos y’all want me to talk about tomorrow? https://t.co/8M2uydpyCr,2022-04-22 02:08:21+00:00,,9,166,519,0,en,1517324398289731587,"[{'domain': {'id': '46', 'name': 'Brand Category', 'description': 'Categories within Brand Verticals that narrow down the scope of Brands'}, 'entity': {'id': '781974596752842752', 'name': 'Services'}}, {'domain': {'id': '47', 'name': 'Brand', 'description': 'Brands and Companies'}, 'entity': {'id': '10045225402', 'name': 'Twitter'}}]","{'urls': [{'start': 85, 'end': 108, 'url': 'https://t.co/8M2uydpyCr', 'expanded_url': 'https://twitter.com/InfernoOmni/status/1517324398289731587/photo/1', 'display_url': 'pic.twitter.com/8M2uydpyCr', 'media_key': '3_1517324395945078784'}]}",{'media_keys': ['3_1517324395945078784']},True,,everyone,Twitter for iPhone
1517274590107496450,858065622097436672,"🍰 Today, 5 years ago, we released a game called #Jailbreak.

We hoped a few @Roblox players would show up. We knew we had a great game but we didn't know how great. The game released to record numbers and blew our minds!

To all of our fans &amp; players, THANK YOU!❤️
Happy 5 Years!",2022-04-21 22:50:26+00:00,,316,457,3617,34,en,1517274590107496450,"[{'domain': {'id': '71', 'name': 'Video Game', 'description': 'A video game like Overwatch'}, 'entity': {'id': '1088118927580774400', 'name': 'Roblox', 'description': 'Roblox'}}]","{'mentions': [{'start': 76, 'end': 83, 'username': 'Roblox', 'id': '16745055'}], 'hashtags': [{'start': 48, 'end': 58, 'tag': 'Jailbreak'}]}",,False,,everyone,Twitter Web App
1516910351740067840,16745055,"Whoever you are on Roblox, this puffer jacket comes in your size. Match with any look you want to create a style of your own: https://t.co/nNxda3j0KB https://t.co/RakqDRKgIR",2022-04-20 22:43:05+00:00,,197,1138,4167,28,en,1516910351740067840,"[{'domain': {'id': '71', 'name': 'Video Game', 'description': 'A video game like Overwatch'}, 'entity': {'id': '1088118927580774400', 'name': 'Roblox', 'description': 'Roblox'}}]","{'urls': [{'start': 126, 'end': 149, 'url': 'https://t.co/nNxda3j0KB', 'expanded_url': 'https://rblx.co/puffer-jackets', 'display_url': 'rblx.co/puffer-jackets', 'images': [{'url': 'https://pbs.twimg.com/news_img/1521760632814530560/mlwwGbux?format=jpg&name=orig', 'width': 1200, 'height': 630}, {'url': 'https://pbs.twimg.com/news_img/1521760632814530560/mlwwGbux?format=jpg&name=150x150', 'width': 150, 'height': 150}], 'status': 200, 'title': 'Roblox', 'description': 'Customize your avatar with a never-ending variety of clothing options, accessories, gear, and more!', 'unwound_url': 'https://www.roblox.com/catalog?Keyword=puffer&Category=1'}, {'start': 150, 'end': 173, 'url': 'https://t.co/RakqDRKgIR', 'expanded_url': 'https://twitter.com/Roblox/status/1516910351740067840/photo/1', 'display_url': 'pic.twitter.com/RakqDRKgIR', 'media_key': '3_1516910263642910720'}], 'annotations': [{'start': 19, 'end': 24, 'probability': 0.6263, 'type': 'Product', 'normalized_text': 'Roblox'}]}",{'media_keys': ['3_1516910263642910720']},False,,everyone,Twitter Web App
1517212298586181632,719254445448495104,I miss old roblox https://t.co/sjv9Mo0bb3,2022-04-21 18:42:55+00:00,,12592,1103,147417,907,en,1517212298586181632,"[{'domain': {'id': '71', 'name': 'Video Game', 'description': 'A video game like Overwatch'}, 'entity': {'id': '1088118927580774400', 'name': 'Roblox', 'description': 'Roblox'}}]","{'urls': [{'start': 18, 'end': 41, 'url': 'https://t.co/sjv9Mo0bb3', 'expanded_url': 'https://twitter.com/bigwanger12/status/1517212298586181632/photo/1', 'display_url': 'pic.twitter.com/sjv9Mo0bb3', 'media_key': '3_1517212295532711936'}]}",{'media_keys': ['3_1517212295532711936']},False,,everyone,Twitter for iPhone
1517107305757954048,1235763373611999232,Can We Go NOOB to PRO to HACKER in WRAPPY RUN? (ALL LEVELS?!) Prezley https://t.co/qZBTw74iwH via @YouTube,2022-04-21 11:45:42+00:00,,1,3,6,0,en,1517107305757954048,[],"{'urls': [{'start': 70, 'end': 93, 'url': 'https://t.co/qZBTw74iwH', 'expanded_url': 'https://youtu.be/6QaUZhiZFOg', 'display_url': 'youtu.be/6QaUZhiZFOg'}], 'mentions': [{'start': 98, 'end': 106, 'username': 'YouTube', 'id': '10228272'}]}",,False,,everyone,Twitter Web App
1517252900812169217,1439117867853787136,@RN_Noticias1 No empiezen con sud mamadas de que le van a subir el precio a las cosas. NO MAMEN,2022-04-21 21:24:15+00:00,,0,1,0,0,es,1516907036637868032,[],"{'mentions': [{'start': 0, 'end': 13, 'username': 'RN_Noticias1', 'id': '1276153403501142017'}]}",,False,,everyone,Twitter for Android
1517325153927061504,2870187801,Mais de um milhão de votos por minuto?????????????,2022-04-22 02:11:21+00:00,,8,62,446,6,pt,1517325153927061504,[],,,False,,everyone,Twitter for Android
1517325179390730240,1290083428432584711,🚨 Mais de UM MILHÃO de votos por minuto! #BBB22,2022-04-22 02:11:27+00:00,,8,36,400,7,pt,1517325179390730240,"[{'domain': {'id': '3', 'name': 'TV Shows', 'description': 'Television shows from around the world'}, 'entity': {'id': '10028564156', 'name': 'Big Brother Brasil', 'description': 'Acompanhe abaixo os principais Tweets sobre o programa:'}}, {'domain': {'id': '4', 'name': 'TV Episodes', 'description': 'Television show episodes'}, 'entity': {'id': '1512735481426968577', 'name': 'Big Brother Brasil', 'description': 'Acompanhe abaixo os principais Tweets sobre o programa:'}}, {'domain': {'id': '29', 'name': 'Events [Entity Service]', 'description': 'Entity Service related Events domain'}, 'entity': {'id': '1512735481426968577', 'name': 'Big Brother Brasil', 'description': 'Acompanhe abaixo os principais Tweets sobre o programa:'}}, {'domain': {'id': '172', 'name': 'Global TV Show', 'description': 'For global/conceptual TV shows without localization.'}, 'entity': {'id': '1338927560911024128', 'name': 'Big Brother Brasil'}}]","{'hashtags': [{'start': 41, 'end': 47, 'tag': 'BBB22'}]}",,False,,everyone,Twitter Web App
1461603230190751748,1382914196438884354,"selling this twitter acc !!
looking for rhd/robux

minimum
rhd = 
at least 45k
robux = 
at least 50 robux (w/ tax)

If interested please dm",2021-11-19 07:52:20+00:00,,2,0,2,1,en,1461603230190751748,"[{'domain': {'id': '46', 'name': 'Brand Category', 'description': 'Categories within Brand Verticals that narrow down the scope of Brands'}, 'entity': {'id': '781974596752842752', 'name': 'Services'}}, {'domain': {'id': '47', 'name': 'Brand', 'description': 'Brands and Companies'}, 'entity': {'id': '10045225402', 'name': 'Twitter'}}]","{'annotations': [{'start': 13, 'end': 19, 'probability': 0.662, 'type': 'Product', 'normalized_text': 'twitter'}]}",,False,,everyone,Twitter Web App
1516726259631460364,1056053249470541824,"On Thursday at 1 pm PDT, the studio behind Roblox BedWars &amp; Roblox Islands (https://t.co/Eweb6RouXu) is releasing their brand new game. What do you think the game will be? 🤔✨ https://t.co/K2tRdDJBLz",2022-04-20 10:31:34+00:00,,43,144,774,12,en,1516726259631460364,"[{'domain': {'id': '71', 'name': 'Video Game', 'description': 'A video game like Overwatch'}, 'entity': {'id': '1088118927580774400', 'name': 'Roblox', 'description': 'Roblox'}}]","{'urls': [{'start': 80, 'end': 103, 'url': 'https://t.co/Eweb6RouXu', 'expanded_url': 'http://Easy.gg', 'display_url': 'Easy.gg', 'status': 200, 'title': 'Easy Games', 'unwound_url': 'https://easy.gg/'}, {'start': 179, 'end': 202, 'url': 'https://t.co/K2tRdDJBLz', 'expanded_url': 'https://twitter.com/Roblox_RTC/status/1516726259631460364/photo/1', 'display_url': 'pic.twitter.com/K2tRdDJBLz', 'media_key': '3_1516726255684669449'}, {'start': 179, 'end': 202, 'url': 'https://t.co/K2tRdDJBLz', 'expanded_url': 'https://twitter.com/Roblox_RTC/status/1516726259631460364/photo/1', 'display_url': 'pic.twitter.com/K2tRdDJBLz', 'media_key': '3_1516726255693045764'}], 'annotations': [{'start': 43, 'end': 73, 'probability': 0.3134, 'type': 'Other', 'normalized_text': 'Roblox BedWars & Roblox Islands'}]}","{'media_keys': ['3_1516726255684669449', '3_1516726255693045764']}",False,,everyone,Twitter for iPhone
1517280189671165957,1295043728458035202,I think this is the first time I’ve gotten dogpiled by the right 😂,2022-04-21 23:12:41+00:00,,0,27,326,0,en,1517280189671165957,[],,,False,,everyone,Twitter for iPad
1517191851274514441,1251677662810042371,"How much Robux have you
spent this week?",2022-04-21 17:21:40+00:00,,55,1236,611,2,en,1517191851274514441,[],,,False,,everyone,Twitter for iPhone
1517324973936979969,1238896149181992960,"@starsoldier18 That's why I've tried to promote #dogecoin being used on games kids play. 
No reason games like @FortniteGame , @Roblox , or @Minecraft couldn't use doge as a form of payment. 
But this is where followers comes in, I have less than 500 . So big accounts don't even ....",2022-04-22 02:10:38+00:00,,0,1,1,0,en,1517268165897728003,"[{'domain': {'id': '45', 'name': 'Brand Vertical', 'description': 'Top level entities that describe a Brands industry'}, 'entity': {'id': '781974597310615553', 'name': 'Entertainment'}}, {'domain': {'id': '46', 'name': 'Brand Category', 'description': 'Categories within Brand Verticals that narrow down the scope of Brands'}, 'entity': {'id': '781974597218340864', 'name': 'Video Games'}}, {'domain': {'id': '30', 'name': 'Entities [Entity Service]', 'description': 'Entity Service top level domain, every item that is in Entity Service should be in this domain'}, 'entity': {'id': '1139229372198469633', 'name': 'Dogecoin cryptocurrency'}}, {'domain': {'id': '66', 'name': 'Interests and Hobbies Category', 'description': 'A grouping of interests and hobbies entities, like Novelty Food or Destinations'}, 'entity': {'id': '913142676819648512', 'name': 'Cryptocurrencies', 'description': 'Cryptocurrency'}}, {'domain': {'id': '71', 'name': 'Video Game', 'description': 'A video game like Overwatch'}, 'entity': {'id': '10043689888', 'name': 'Minecraft'}}, {'domain': {'id': '71', 'name': 'Video Game', 'description': 'A video game like Overwatch'}, 'entity': {'id': '974285387987169280', 'name': 'Fortnite', 'description': 'This entity includes all conversation about the franchise, as well as any individual installments in the series, if applicable.\t\t\t'}}, {'domain': {'id': '71', 'name': 'Video Game', 'description': 'A video game like Overwatch'}, 'entity': {'id': '1088118927580774400', 'name': 'Roblox', 'description': 'Roblox'}}]","{'mentions': [{'start': 0, 'end': 14, 'username': 'starsoldier18', 'id': '1393883110207639561'}, {'start': 111, 'end': 124, 'username': 'FortniteGame', 'id': '425871040'}, {'start': 127, 'end': 134, 'username': 'Roblox', 'id': '16745055'}, {'start': 140, 'end': 150, 'username': 'Minecraft', 'id': '64565898'}], 'hashtags': [{'start': 48, 'end': 57, 'tag': 'dogecoin'}]}",,False,,everyone,Twitter for Android
1517275766202982400,1282097433703587840,"@badimo @Roblox A project that asimo and badcc thought would only last a couple months, but turned into half a decade, with still thousands online

Congrats on 5 years! Look at how it aged 😪 https://t.co/n79WNFeeua",2022-04-21 22:55:06+00:00,,10,15,161,0,en,1517274590107496450,"[{'domain': {'id': '71', 'name': 'Video Game', 'description': 'A video game like Overwatch'}, 'entity': {'id': '1088118927580774400', 'name': 'Roblox', 'description': 'Roblox'}}]","{'urls': [{'start': 191, 'end': 214, 'url': 'https://t.co/n79WNFeeua', 'expanded_url': 'https://twitter.com/P0larzation/status/1517275766202982400/photo/1', 'display_url': 'pic.twitter.com/n79WNFeeua', 'media_key': '3_1517275685106114562'}, {'start': 191, 'end': 214, 'url': 'https://t.co/n79WNFeeua', 'expanded_url': 'https://twitter.com/P0larzation/status/1517275766202982400/photo/1', 'display_url': 'pic.twitter.com/n79WNFeeua', 'media_key': '3_1517275706778079233'}], 'mentions': [{'start': 0, 'end': 7, 'username': 'badimo', 'id': '858065622097436672'}, {'start': 8, 'end': 15, 'username': 'Roblox', 'id': '16745055'}]}","{'media_keys': ['3_1517275685106114562', '3_1517275706778079233']}",True,,everyone,Twitter Web App
1517156211740708865,1894642398,What’s the first game you played in Roblox?,2022-04-21 15:00:02+00:00,,25,441,339,1,en,1517156211740708865,"[{'domain': {'id': '71', 'name': 'Video Game', 'description': 'A video game like Overwatch'}, 'entity': {'id': '1088118927580774400', 'name': 'Roblox', 'description': 'Roblox'}}]","{'annotations': [{'start': 36, 'end': 41, 'probability': 0.4055, 'type': 'Other', 'normalized_text': 'Roblox'}]}",,False,,everyone,Twitter Web App
1517034011964620800,1471414739880189955,imagine trying to explain this headline to someone from 2015 https://t.co/PoIHBM8dEo,2022-04-21 06:54:28+00:00,,6179,273,94544,126,en,1517034011964620800,"[{'domain': {'id': '10', 'name': 'Person', 'description': 'Named people in the world like Nelson Mandela'}, 'entity': {'id': '806570121959383040', 'name': 'Kim Kardashian', 'description': 'Kim Kardashian'}}, {'domain': {'id': '58', 'name': 'Entertainment Personality', 'description': 'An entertainment personality in the world, like Anderson Cooper or Miranda Sings'}, 'entity': {'id': '806570121959383040', 'name': 'Kim Kardashian', 'description': 'Kim Kardashian'}}, {'domain': {'id': '71', 'name': 'Video Game', 'description': 'A video game like Overwatch'}, 'entity': {'id': '1088118927580774400', 'name': 'Roblox', 'description': 'Roblox'}}]","{'urls': [{'start': 61, 'end': 84, 'url': 'https://t.co/PoIHBM8dEo', 'expanded_url': 'https://twitter.com/IGN/status/1516929967669534723', 'display_url': 'twitter.com/IGN/status/151…'}]}",,False,,everyone,Twitter for iPhone
1516929967669534723,18927441,"Kim Kardashian threatened to sue Roblox after a game claiming to offer an unreleased sex tape appeared, and her six-year-old son saw the ad. Her response? ""I have all the time, all the money, and all the resources to burn them all to the f**king ground."" https://t.co/LNomN3XpQ4 https://t.co/r53baPBJJg",2022-04-21 00:01:02+00:00,,2143,1436,28444,2947,en,1516929967669534723,"[{'domain': {'id': '10', 'name': 'Person', 'description': 'Named people in the world like Nelson Mandela'}, 'entity': {'id': '806570121959383040', 'name': 'Kim Kardashian', 'description': 'Kim Kardashian'}}, {'domain': {'id': '46', 'name': 'Brand Category', 'description': 'Categories within Brand Verticals that narrow down the scope of Brands'}, 'entity': {'id': '781974596157181956', 'name': 'Online Site'}}, {'domain': {'id': '47', 'name': 'Brand', 'description': 'Brands and Companies'}, 'entity': {'id': '1106638172182597632', 'name': 'IGN'}}, {'domain': {'id': '58', 'name': 'Entertainment Personality', 'description': 'An entertainment personality in the world, like Anderson Cooper or Miranda Sings'}, 'entity': {'id': '806570121959383040', 'name': 'Kim Kardashian', 'description': 'Kim Kardashian'}}, {'domain': {'id': '71', 'name': 'Video Game', 'description': 'A video game like Overwatch'}, 'entity': {'id': '1088118927580774400', 'name': 'Roblox', 'description': 'Roblox'}}]","{'urls': [{'start': 255, 'end': 278, 'url': 'https://t.co/LNomN3XpQ4', 'expanded_url': 'https://bit.ly/3v2D5Ko', 'display_url': 'bit.ly/3v2D5Ko', 'images': [{'url': 'https://pbs.twimg.com/news_img/1516777890146185226/odgrMuCY?format=jpg&name=orig', 'width': 1280, 'height': 720}, {'url': 'https://pbs.twimg.com/news_img/1516777890146185226/odgrMuCY?format=jpg&name=150x150', 'width': 150, 'height': 150}], 'status': 200, 'title': 'Kim Kardashian Threatened to Sue Roblox Over a Fake Sex Tape Game - IGN', 'description': 'Kim Kardashian threatened to sue Roblox after a game claiming to offer an unreleased sex tape appeared on the platform.', 'unwound_url': 'https://www.ign.com/articles/kim-kardashian-threatened-to-sue-roblox-over-a-fake-sex-tape-game'}, {'start': 279, 'end': 302, 'url': 'https://t.co/r53baPBJJg', 'expanded_url': 'https://twitter.com/IGN/status/1516929967669534723/photo/1', 'display_url': 'pic.twitter.com/r53baPBJJg', 'media_key': '3_1516929961965330432'}], 'annotations': [{'start': 0, 'end': 13, 'probability': 0.9924, 'type': 'Person', 'normalized_text': 'Kim Kardashian'}, {'start': 33, 'end': 38, 'probability': 0.3564, 'type': 'Organization', 'normalized_text': 'Roblox'}]}",{'media_keys': ['3_1516929961965330432']},False,,everyone,Sprout Social
1517307151160856576,1476096199652352002,@MeloBlox Is there a way to get unban in the game. I am one year to access discord. I got ban and have no time to even explain to the mods because  of the discord requirements that you have to be 13 while I'm 3 months away to access it. I got ban because they thought I exploited.,2022-04-22 00:59:49+00:00,,0,1,0,0,en,1514981544892456969,"[{'domain': {'id': '47', 'name': 'Brand', 'description': 'Brands and Companies'}, 'entity': {'id': '1168499224297656321', 'name': 'Discord'}}, {'domain': {'id': '79', 'name': 'Video Game Hardware', 'description': 'Video Game Hardware'}, 'entity': {'id': '1174432578503204864', 'name': 'PC gaming'}}, {'domain': {'id': '165', 'name': 'Technology', 'description': 'for individual and types of technology, e.g., food technology, 3D printing'}, 'entity': {'id': '1196446161223028736', 'name': 'Social media'}}]","{'mentions': [{'start': 0, 'end': 9, 'username': 'MeloBlox', 'id': '1298311317640622083'}]}",,False,,everyone,Twitter for Android
1516100015961296904,1452213777383010313,@Roblox @sonic_hedgehog all my work and my account got hacked,2022-04-18 17:03:06+00:00,,0,4,0,2,en,1515026236241850380,"[{'domain': {'id': '71', 'name': 'Video Game', 'description': 'A video game like Overwatch'}, 'entity': {'id': '1088118927580774400', 'name': 'Roblox', 'description': 'Roblox'}}, {'domain': {'id': '130', 'name': 'Multimedia Franchise', 'description': ""Franchises which span multiple forms of media like 'Harry Potter'""}, 'entity': {'id': '993952643209773057', 'name': 'Sonic the Hedgehog', 'description': 'This entity includes all conversation about the franchise, as well as any individual installments in the series, if applicable.\t\t\t\n\nNOTE: Stopped annotating in the Video Game domain (71) on 11/15/19. Moving forward, this entity will annotate to Multimedia Franchise domain (130) only.'}}]","{'mentions': [{'start': 0, 'end': 7, 'username': 'Roblox', 'id': '16745055'}, {'start': 8, 'end': 23, 'username': 'sonic_hedgehog', 'id': '19609162'}]}",,False,,everyone,Twitter Web App
1517318680962637825,1376342661125316611,@GoldenTempezt_ @badimo @Roblox Nice 👍 btw how do you get those video angles 👀👀👀,2022-04-22 01:45:38+00:00,,0,1,2,0,en,1517274590107496450,"[{'domain': {'id': '71', 'name': 'Video Game', 'description': 'A video game like Overwatch'}, 'entity': {'id': '1088118927580774400', 'name': 'Roblox', 'description': 'Roblox'}}]","{'mentions': [{'start': 0, 'end': 15, 'username': 'GoldenTempezt_', 'id': '1442560506875707393'}, {'start': 16, 'end': 23, 'username': 'badimo', 'id': '858065622097436672'}, {'start': 24, 'end': 31, 'username': 'Roblox', 'id': '16745055'}]}",,False,,everyone,Twitter for iPhone
1517291173131567106,1046403511305420800,Pr sxLhur vhu xt vhfuhwr,2022-04-21 23:56:20+00:00,,0,1,0,0,et,1517291173131567106,[],,,False,,everyone,Twitter for iPhone
1517318195790716935,1422163374339727363,@Roblox_RTC_BR Imagina eles tão fazendo tanta alteração pra lançar pra o Celular?,2022-04-22 01:43:42+00:00,,1,2,7,0,pt,1517317671070613505,[],"{'mentions': [{'start': 0, 'end': 14, 'username': 'Roblox_RTC_BR', 'id': '1417587809502826500'}]}",,False,,everyone,Twitter Web App
1517268165897728003,1393883110207639561,I don't understand people who no nothing about #cryptocurrecy. I'm talking about young people too. It's like they happy being slave to the system.,2022-04-21 22:24:54+00:00,,0,4,4,0,en,1517268165897728003,"[{'domain': {'id': '66', 'name': 'Interests and Hobbies Category', 'description': 'A grouping of interests and hobbies entities, like Novelty Food or Destinations'}, 'entity': {'id': '913142676819648512', 'name': 'Cryptocurrencies', 'description': 'Cryptocurrency'}}]","{'hashtags': [{'start': 47, 'end': 61, 'tag': 'cryptocurrecy'}]}",,False,,everyone,Twitter Web App
1515026236241850380,16745055,Anyone got any avatar accessories they'd like to recommend to @sonic_hedgehog? https://t.co/XxBNu7ju0i,2022-04-15 17:56:17+00:00,,167,1036,2785,14,en,1515026236241850380,[],"{'urls': [{'start': 79, 'end': 102, 'url': 'https://t.co/XxBNu7ju0i', 'expanded_url': 'https://twitter.com/VentureBeat/status/1514272343731814403', 'display_url': 'twitter.com/VentureBeat/st…'}], 'mentions': [{'start': 62, 'end': 77, 'username': 'sonic_hedgehog', 'id': '19609162'}]}",,False,,everyone,Twitter Web App
1504279871148773386,1121944379533533189,"VR MP7, UI redesign. I’m back and working on the Hellreaver campaign and ARES VR.
#RobloxVR #Roblox #RobloxDev https://t.co/j7B7XR7zOs",2022-03-17 02:14:04+00:00,,176,72,1438,62,en,1504279871148773386,"[{'domain': {'id': '71', 'name': 'Video Game', 'description': 'A video game like Overwatch'}, 'entity': {'id': '1088118927580774400', 'name': 'Roblox', 'description': 'Roblox'}}]","{'urls': [{'start': 111, 'end': 134, 'url': 'https://t.co/j7B7XR7zOs', 'expanded_url': 'https://twitter.com/PoptartNoahh/status/1504279871148773386/video/1', 'display_url': 'pic.twitter.com/j7B7XR7zOs', 'media_key': '7_1504279799510061056'}], 'annotations': [{'start': 0, 'end': 5, 'probability': 0.8361, 'type': 'Product', 'normalized_text': 'VR MP7'}, {'start': 73, 'end': 79, 'probability': 0.3648, 'type': 'Product', 'normalized_text': 'ARES VR'}], 'hashtags': [{'start': 82, 'end': 91, 'tag': 'RobloxVR'}, {'start': 92, 'end': 99, 'tag': 'Roblox'}, {'start': 100, 'end': 110, 'tag': 'RobloxDev'}]}",{'media_keys': ['7_1504279799510061056']},False,,everyone,Twitter for iPhone
1516533943981465609,1178530929326854146,"6 different winners will be picked. (1 winner of the HUGE Super Corgi and 5 people will win Exclusive Super Corgi pets.) Giveaway ends Friday, April 22nd @ Midnight! So make sure to enter before then! Good luck!
Winners will be announced here and in my discord server.",2022-04-19 21:47:22+00:00,,9,20,41,0,en,1516533941934637059,"[{'domain': {'id': '47', 'name': 'Brand', 'description': 'Brands and Companies'}, 'entity': {'id': '1168499224297656321', 'name': 'Discord'}}, {'domain': {'id': '165', 'name': 'Technology', 'description': 'for individual and types of technology, e.g., food technology, 3D printing'}, 'entity': {'id': '1196446161223028736', 'name': 'Social media'}}]","{'annotations': [{'start': 53, 'end': 68, 'probability': 0.2773, 'type': 'Other', 'normalized_text': 'HUGE Super Corgi'}]}",,False,,everyone,Twitter Web App
