tweetid,author_id,text,created_at,geo,retweets,replies,likes,quote_count,lang,conversation_id,context_annotations,entities,attachments,possibly_sensitive,withheld,reply_settings,source
1517320936952938497,1308842936864563201,@nnanzin Slk sem maldadi q situação feiaKKKKKKKLLL,2022-04-22 01:54:36+00:00,,0,1,1,0,pt,1517320654130974721,[],"{'mentions': [{'start': 0, 'end': 8, 'username': 'nnanzin', 'id': '1288379271891881984'}]}",,False,,everyone,Twitter for Android
1517319709552693249,948268575609024512,yeah i play roblox sometimes what about it,2022-04-22 01:49:43+00:00,,0,1,0,0,en,1517319659816685568,"[{'domain': {'id': '71', 'name': 'Video Game', 'description': 'A video game like Overwatch'}, 'entity': {'id': '1088118927580774400', 'name': 'Roblox', 'description': 'Roblox'}}]",,,False,,everyone,Twitter for iPhone
1513350972982308866,1416655252070170624,"Fortnite is a good game, so is Roblox, it's the little kids who take it too seriously that are bad about it. Except for the Season X Mech. That was bad. @Roblox @FortniteGame",2022-04-11 02:59:23+00:00,,0,1,0,0,en,1513350972982308866,"[{'domain': {'id': '71', 'name': 'Video Game', 'description': 'A video game like Overwatch'}, 'entity': {'id': '974285387987169280', 'name': 'Fortnite', 'description': 'This entity includes all conversation about the franchise, as well as any individual installments in the series, if applicable.\t\t\t'}}, {'domain': {'id': '71', 'name': 'Video Game', 'description': 'A video game like Overwatch'}, 'entity': {'id': '1088118927580774400', 'name': 'Roblox', 'description': 'Roblox'}}]","{'annotations': [{'start': 31, 'end': 36, 'probability': 0.3473, 'type': 'Product', 'normalized_text': 'Roblox'}], 'mentions': [{'start': 153, 'end': 160, 'username': 'Roblox', 'id': '16745055'}, {'start': 161, 'end': 174, 'username': 'FortniteGame', 'id': '425871040'}]}",,False,,everyone,Twitter for Android
1516897060275904518,901894986836279296,"The Truth in Advertising organization has filed a complaint against Roblox with the Federal Trade Commission, accusing the company of hosting ambiguous ""advergames"" through its sponsorships with brands like with Nike and Hyundai.

https://t.co/yEWQv2t4OJ https://t.co/7V1q3sSMha",2022-04-20 21:50:16+00:00,,29,26,429,5,en,1516897060275904518,"[{'domain': {'id': '71', 'name': 'Video Game', 'description': 'A video game like Overwatch'}, 'entity': {'id': '1088118927580774400', 'name': 'Roblox', 'description': 'Roblox'}}, {'domain': {'id': '45', 'name': 'Brand Vertical', 'description': 'Top level entities that describe a Brands industry'}, 'entity': {'id': '781972125171060736', 'name': 'Auto'}}, {'domain': {'id': '46', 'name': 'Brand Category', 'description': 'Categories within Brand Verticals that narrow down the scope of Brands'}, 'entity': {'id': '781972125179518977', 'name': 'Auto Manufacturer'}}, {'domain': {'id': '46', 'name': 'Brand Category', 'description': 'Categories within Brand Verticals that narrow down the scope of Brands'}, 'entity': {'id': '781974597176467456', 'name': 'Sports/Outdoor'}}, {'domain': {'id': '47', 'name': 'Brand', 'description': 'Brands and Companies'}, 'entity': {'id': '10026295039', 'name': 'Hyundai'}}, {'domain': {'id': '47', 'name': 'Brand', 'description': 'Brands and Companies'}, 'entity': {'id': '10026482869', 'name': 'Nike'}}, {'domain': {'id': '67', 'name': 'Interests and Hobbies', 'description': 'Interests, opinions, and behaviors of individuals, groups, or cultures; like Speciality Cooking or Theme Parks'}, 'entity': {'id': '839543390668673024', 'name': 'Fashion'}}]","{'urls': [{'start': 231, 'end': 254, 'url': 'https://t.co/yEWQv2t4OJ', 'expanded_url': 'https://adage.com/article/digital-marketing-ad-tech-news/roblox-accused-deceptive-marketing-complaint-ftc/2412326', 'display_url': 'adage.com/article/digita…', 'images': [{'url': 'https://pbs.twimg.com/news_img/1519767471774830592/e93JXyP_?format=jpg&name=orig', 'width': 1024, 'height': 512}, {'url': 'https://pbs.twimg.com/news_img/1519767471774830592/e93JXyP_?format=jpg&name=150x150', 'width': 150, 'height': 150}], 'status': 200, 'title': 'Roblox accused of deceptive marketing in complaint to FTC', 'description': 'Ad watchdog TINA claims the platform lacks sufficient guardrails to inform consumers.', 'unwound_url': 'https://adage.com/article/digital-marketing-ad-tech-news/roblox-accused-deceptive-marketing-complaint-ftc/2412326'}, {'start': 255, 'end': 278, 'url': 'https://t.co/7V1q3sSMha', 'expanded_url': 'https://twitter.com/Bloxy_News/status/1516897060275904518/photo/1', 'display_url': 'pic.twitter.com/7V1q3sSMha', 'media_key': '3_1516896778083205120'}], 'annotations': [{'start': 68, 'end': 73, 'probability': 0.5445, 'type': 'Organization', 'normalized_text': 'Roblox'}, {'start': 212, 'end': 215, 'probability': 0.657, 'type': 'Organization', 'normalized_text': 'Nike'}, {'start': 221, 'end': 227, 'probability': 0.4635, 'type': 'Organization', 'normalized_text': 'Hyundai'}]}",{'media_keys': ['3_1516896778083205120']},False,,everyone,Twitter Web App
1517319659816685568,948268575609024512,"if you play minecraft or roblox, i automatically love You",2022-04-22 01:49:31+00:00,,0,2,2,0,en,1517319659816685568,"[{'domain': {'id': '45', 'name': 'Brand Vertical', 'description': 'Top level entities that describe a Brands industry'}, 'entity': {'id': '781974597310615553', 'name': 'Entertainment'}}, {'domain': {'id': '46', 'name': 'Brand Category', 'description': 'Categories within Brand Verticals that narrow down the scope of Brands'}, 'entity': {'id': '781974597218340864', 'name': 'Video Games'}}, {'domain': {'id': '71', 'name': 'Video Game', 'description': 'A video game like Overwatch'}, 'entity': {'id': '10043689888', 'name': 'Minecraft'}}, {'domain': {'id': '71', 'name': 'Video Game', 'description': 'A video game like Overwatch'}, 'entity': {'id': '1088118927580774400', 'name': 'Roblox', 'description': 'Roblox'}}]","{'annotations': [{'start': 12, 'end': 20, 'probability': 0.6828, 'type': 'Product', 'normalized_text': 'minecraft'}]}",,False,,everyone,Twitter for iPhone
1517320150004891648,1013270704555298816,"@Roblox , you cannot be serious. I get banned because of the fact that I was defending myself because I was being attacked for my sexuality. And yet I get banned because of attacking a minority. It is clear to show who roblox favors... Explain. Will go in more detail if needed. https://t.co/ealK4i0Xh9",2022-04-22 01:51:28+00:00,,1,2,2,2,en,1517320150004891648,"[{'domain': {'id': '71', 'name': 'Video Game', 'description': 'A video game like Overwatch'}, 'entity': {'id': '1088118927580774400', 'name': 'Roblox', 'description': 'Roblox'}}]","{'urls': [{'start': 279, 'end': 302, 'url': 'https://t.co/ealK4i0Xh9', 'expanded_url': 'https://twitter.com/isuckatlifepurd/status/1517320150004891648/photo/1', 'display_url': 'pic.twitter.com/ealK4i0Xh9', 'media_key': '3_1517319520490164224'}], 'mentions': [{'start': 0, 'end': 7, 'username': 'Roblox', 'id': '16745055'}]}",{'media_keys': ['3_1517319520490164224']},False,,everyone,Twitter Web App
1517294326212173824,1149791882488295424,"@Eflogersquad @WonderWorksRB My iPad was bought, brand new, in 2020, also. I already said. It’s not my iPad. It’s a problem through Roblox.",2022-04-22 00:08:51+00:00,,0,1,0,0,en,1516833041213239298,"[{'domain': {'id': '47', 'name': 'Brand', 'description': 'Brands and Companies'}, 'entity': {'id': '10026364281', 'name': 'Apple'}}, {'domain': {'id': '48', 'name': 'Product', 'description': 'Products created by Brands.  Examples: Ford Explorer, Apple iPhone.'}, 'entity': {'id': '972153731067273222', 'name': 'Apple iPad', 'description': 'Apple iPad'}}, {'domain': {'id': '71', 'name': 'Video Game', 'description': 'A video game like Overwatch'}, 'entity': {'id': '1088118927580774400', 'name': 'Roblox', 'description': 'Roblox'}}]","{'annotations': [{'start': 32, 'end': 35, 'probability': 0.7478, 'type': 'Product', 'normalized_text': 'iPad'}, {'start': 103, 'end': 106, 'probability': 0.5937, 'type': 'Product', 'normalized_text': 'iPad'}, {'start': 132, 'end': 137, 'probability': 0.5308, 'type': 'Product', 'normalized_text': 'Roblox'}], 'mentions': [{'start': 0, 'end': 13, 'username': 'Eflogersquad', 'id': '1344318122006773760'}, {'start': 14, 'end': 28, 'username': 'WonderWorksRB', 'id': '1259271090603536384'}]}",,False,,everyone,Twitter for iPad
1517296086498562048,1490146739902427136,"@ampro86896160 naaahhh, i've uploaded a bunch of decals with foreign language for the past 7-8 years so i can't agree with that.",2022-04-22 00:15:51+00:00,,0,2,0,0,en,1515823202802585601,[],"{'mentions': [{'start': 0, 'end': 14, 'username': 'ampro86896160', 'id': '1440265917733040132'}]}",,False,,everyone,Twitter Web App
