tweetid,author_id,text,created_at,geo,retweets,replies,likes,quote_count,lang,conversation_id,context_annotations,entities,attachments,possibly_sensitive,withheld,reply_settings,source
1537916243079884806,1399120606499684354,PLEASE TIP IF YOU'D LIKE ILY IF YOU TIP,2022-06-17 21:53:00+00:00,,0,1,2,0,en,1537916236280963074,[],,,False,,everyone,Twitter Web App
1537888994121621504,1242496150206205958,"Phew im exhausted, i made 3 sets of collab faces today, i will put moons faces post on thread when they are done, and they look amazing so farrrr!! Stay tune for that!! This collab was also challenging since we only did 4 colors each faces and we swapped and this was mine https://t.co/mZZzw33cnu",2022-06-17 20:04:43+00:00,,0,1,4,0,en,1537888988908109824,[],"{'urls': [{'start': 273, 'end': 296, 'url': 'https://t.co/mZZzw33cnu', 'expanded_url': 'https://twitter.com/CLGT_/status/1537888994121621504/photo/1', 'display_url': 'pic.twitter.com/mZZzw33cnu', 'media_key': '3_1537888991554727936'}]}",{'media_keys': ['3_1537888991554727936']},False,,everyone,Twitter for Android
1537891468882219009,1485336890983305217,@Dark_Sinox Yeah just once I’m done with he other jars,2022-06-17 20:14:33+00:00,,0,1,0,0,en,1537714161039331333,[],"{'mentions': [{'start': 0, 'end': 11, 'username': 'Dark_Sinox', 'id': '1537589406743379977'}]}",,False,,everyone,Twitter for iPhone
1537911227359186948,1009156636957650946,@johdoh1999 @Dogemc1 @Roblox_RTC np,2022-06-17 21:33:04+00:00,,0,1,0,0,und,1537910140816355334,[],"{'mentions': [{'start': 0, 'end': 11, 'username': 'johdoh1999', 'id': '1380655452619423744'}, {'start': 12, 'end': 20, 'username': 'Dogemc1', 'id': '1369451588734050307'}, {'start': 21, 'end': 32, 'username': 'Roblox_RTC', 'id': '1056053249470541824'}]}",,False,,everyone,Twitter Web App
1536364016334999552,1056053249470541824,"🎓 Recently, Several Roblox Community Members have officially Graduated School!

Congratulations to graduates of the class of 2022. 🎉

Pick up a virtual graduation cap on the Roblox Avatar Shop Here:
https://t.co/wZjXq8ADLB https://t.co/mmChqqN0cE",2022-06-13 15:05:00+00:00,,61,134,1164,7,en,1536364016334999552,"[{'domain': {'id': '29', 'name': 'Events [Entity Service]', 'description': 'Entity Service related Events domain'}, 'entity': {'id': '1511323041464168451', 'name': 'Graduation 2022'}}, {'domain': {'id': '71', 'name': 'Video Game', 'description': 'A video game like Overwatch'}, 'entity': {'id': '1088118927580774400', 'name': 'Roblox', 'description': 'Roblox'}}]","{'annotations': [{'start': 176, 'end': 193, 'probability': 0.2762, 'type': 'Product', 'normalized_text': 'Roblox Avatar Shop'}], 'urls': [{'start': 199, 'end': 222, 'url': 'https://t.co/wZjXq8ADLB', 'expanded_url': 'https://tinyurl.com/roblox-grad', 'display_url': 'tinyurl.com/roblox-grad', 'status': 200, 'title': '2020 Graduation Cap - Roblox', 'description': 'Roblox is a global platform that brings people together through play.', 'unwound_url': 'https://www.roblox.com/catalog/5157683216/2020-Graduation-Cap?nl=true'}, {'start': 223, 'end': 246, 'url': 'https://t.co/mmChqqN0cE', 'expanded_url': 'https://twitter.com/Roblox_RTC/status/1536364016334999552/photo/1', 'display_url': 'pic.twitter.com/mmChqqN0cE', 'media_key': '3_1536117514513444864'}]}",{'media_keys': ['3_1536117514513444864']},False,,everyone,TweetDeck
1534999186755637248,16745055,Want a 🔥 look? The Iconic Suede Mix XXI Jacket by @PUMA is available for your avatar: https://t.co/k9KGGOMidt https://t.co/ZOLQhxV92I,2022-06-09 20:41:39+00:00,,222,1451,3661,78,en,1534999186755637248,"[{'domain': {'id': '71', 'name': 'Video Game', 'description': 'A video game like Overwatch'}, 'entity': {'id': '1088118927580774400', 'name': 'Roblox', 'description': 'Roblox'}}]","{'mentions': [{'start': 50, 'end': 55, 'username': 'PUMA', 'id': '50883209'}], 'annotations': [{'start': 16, 'end': 46, 'probability': 0.4872, 'type': 'Product', 'normalized_text': 'The Iconic Suede Mix XXI Jacket'}], 'urls': [{'start': 86, 'end': 109, 'url': 'https://t.co/k9KGGOMidt', 'expanded_url': 'https://rblx.co/suede-mid-xxi', 'display_url': 'rblx.co/suede-mid-xxi', 'status': 200, 'title': 'Suede Mid XXI Jacket - Roblox', 'description': 'Roblox is a global platform that brings people together through play.', 'unwound_url': 'https://www.roblox.com/catalog/9709371637/Suede-Mid-XXI-Jacket'}, {'start': 110, 'end': 133, 'url': 'https://t.co/ZOLQhxV92I', 'expanded_url': 'https://twitter.com/Roblox/status/1534999186755637248/video/1', 'display_url': 'pic.twitter.com/ZOLQhxV92I', 'media_key': '7_1534998661641293824'}]}",{'media_keys': ['7_1534998661641293824']},False,,everyone,Twitter Web App
1537915442378862592,1420143301617979393,"@prest4n 

Hey buddy nice game

Prepare for another attack  sometime next week. 

Not me, but the guys in the black market discord, apparently found 1-3 exploits. don't worry im sure you will patch them soon. 

don't believe me, they said next week Wednesday, so see you then.",2022-06-17 21:49:49+00:00,,0,2,0,0,en,1537915442378862592,"[{'domain': {'id': '47', 'name': 'Brand', 'description': 'Brands and Companies'}, 'entity': {'id': '1168499224297656321', 'name': 'Discord'}}, {'domain': {'id': '79', 'name': 'Video Game Hardware', 'description': 'Video Game Hardware'}, 'entity': {'id': '1174432578503204864', 'name': 'PC gaming'}}, {'domain': {'id': '165', 'name': 'Technology', 'description': 'for individual and types of technology, e.g., food technology, 3D printing'}, 'entity': {'id': '1196446161223028736', 'name': 'Social media'}}]","{'mentions': [{'start': 0, 'end': 8, 'username': 'prest4n', 'id': '758906947659673600'}]}",,False,,everyone,Twitter Web App
1537569136380813313,777280443020345344,"Apparently in the latest Minecraft snapshot (22w24a), there is now global chat moderation. So say if you say a slur in chat for example, you can get chat restricted regardless of what server you are on. Thoughts? https://t.co/jDTppzdghG",2022-06-16 22:53:43+00:00,,10,85,600,6,en,1537569136380813313,"[{'domain': {'id': '45', 'name': 'Brand Vertical', 'description': 'Top level entities that describe a Brands industry'}, 'entity': {'id': '781974597310615553', 'name': 'Entertainment'}}, {'domain': {'id': '46', 'name': 'Brand Category', 'description': 'Categories within Brand Verticals that narrow down the scope of Brands'}, 'entity': {'id': '781974597218340864', 'name': 'Video Games'}}, {'domain': {'id': '71', 'name': 'Video Game', 'description': 'A video game like Overwatch'}, 'entity': {'id': '10043689888', 'name': 'Minecraft'}}]","{'urls': [{'start': 213, 'end': 236, 'url': 'https://t.co/jDTppzdghG', 'expanded_url': 'https://twitter.com/inteledits/status/1537569136380813313/photo/1', 'display_url': 'pic.twitter.com/jDTppzdghG', 'media_key': '3_1537568466038730752'}]}",{'media_keys': ['3_1537568466038730752']},False,,everyone,Twitter Web App
1500119763107913737,1459877587258335234,@BlueDeveloper_ What happened,2022-03-05 14:43:17+00:00,,0,1,1,0,en,1480356895550492675,[],"{'mentions': [{'start': 0, 'end': 15, 'username': 'BlueDeveloper_', 'id': '1419711692636819456'}]}",,False,,everyone,Twitter Web App
1537912902216077312,3126968555,@tkmjinsoul pucha mi cachorrita:( alo mjr te falta roblox!! y bno cual quieres?,2022-06-17 21:39:43+00:00,,0,1,0,0,es,1537882703684505611,"[{'domain': {'id': '71', 'name': 'Video Game', 'description': 'A video game like Overwatch'}, 'entity': {'id': '1088118927580774400', 'name': 'Roblox', 'description': 'Roblox'}}]","{'mentions': [{'start': 0, 'end': 11, 'username': 'tkmjinsoul', 'id': '3060323486'}]}",,False,,everyone,Twitter for iPhone
1537621266206584832,804900700060848128,"i got tired of getting bullied for playing roblox so naturally i played it even more &amp; made some interesting unique bacon hair type vids on it

apparently when you do something impressive with what others think is dog water, they tend to like you more (or at least pretend to)",2022-06-17 02:20:52+00:00,,5,21,131,1,en,1537621266206584832,"[{'domain': {'id': '71', 'name': 'Video Game', 'description': 'A video game like Overwatch'}, 'entity': {'id': '1088118927580774400', 'name': 'Roblox', 'description': 'Roblox'}}]",,,False,,everyone,Twitter Web App
1537886595239378945,103012173,"👽✨ angels come join my concert at 7PM ET on @Roblox ✨👽
@samsungmobileus #TeamGalaxy #SamsungPartner
https://t.co/YsmX2koRtk https://t.co/GqhdoIn41R",2022-06-17 19:55:11+00:00,,186,107,2547,148,en,1537886595239378945,"[{'domain': {'id': '3', 'name': 'TV Shows', 'description': 'Television shows from around the world'}, 'entity': {'id': '10042894179', 'name': ""Team Galaxy : le collège de l'espace""}}, {'domain': {'id': '71', 'name': 'Video Game', 'description': 'A video game like Overwatch'}, 'entity': {'id': '1088118927580774400', 'name': 'Roblox', 'description': 'Roblox'}}, {'domain': {'id': '10', 'name': 'Person', 'description': 'Named people in the world like Nelson Mandela'}, 'entity': {'id': '885602209618051072', 'name': 'Charli XCX', 'description': 'CHARLI XCX'}}, {'domain': {'id': '47', 'name': 'Brand', 'description': 'Brands and Companies'}, 'entity': {'id': '10026364234', 'name': 'Samsung '}}, {'domain': {'id': '48', 'name': 'Product', 'description': 'Products created by Brands.  Examples: Ford Explorer, Apple iPhone.'}, 'entity': {'id': '10026331316', 'name': 'Samsung Mobile'}}, {'domain': {'id': '49', 'name': 'Product Version', 'description': ""The specific model or version of a product.  Examples: Audi A8, Ben & Jerry's Chocolate Chip Ice Cream""}, 'entity': {'id': '10041364617', 'name': 'Samsung Mobile US'}}, {'domain': {'id': '54', 'name': 'Musician', 'description': 'A musician in the world, like Adele or Bob Dylan'}, 'entity': {'id': '885602209618051072', 'name': 'Charli XCX', 'description': 'CHARLI XCX'}}, {'domain': {'id': '55', 'name': 'Music Genre', 'description': 'A category for a musical style, like Pop, Rock, or Rap'}, 'entity': {'id': '810938279801470977', 'name': 'Pop', 'description': 'Pop'}}, {'domain': {'id': '30', 'name': 'Entities [Entity Service]', 'description': 'Entity Service top level domain, every item that is in Entity Service should be in this domain'}, 'entity': {'id': '848920371311001600', 'name': 'Technology', 'description': 'Technology and computing'}}, {'domain': {'id': '66', 'name': 'Interests and Hobbies Category', 'description': 'A grouping of interests and hobbies entities, like Novelty Food or Destinations'}, 'entity': {'id': '848920700073123840', 'name': 'Cell Phones', 'description': 'Cell phones'}}, {'domain': {'id': '30', 'name': 'Entities [Entity Service]', 'description': 'Entity Service top level domain, every item that is in Entity Service should be in this domain'}, 'entity': {'id': '848985956778561538', 'name': 'Mobile', 'description': 'Mobile'}}]","{'mentions': [{'start': 44, 'end': 51, 'username': 'Roblox', 'id': '16745055'}, {'start': 55, 'end': 71, 'username': 'SamsungMobileUS', 'id': '14117843'}], 'urls': [{'start': 100, 'end': 123, 'url': 'https://t.co/YsmX2koRtk', 'expanded_url': 'http://roblox.com/superstargalaxy', 'display_url': 'roblox.com/superstargalaxy'}, {'start': 124, 'end': 147, 'url': 'https://t.co/GqhdoIn41R', 'expanded_url': 'https://twitter.com/charli_xcx/status/1537886595239378945/video/1', 'display_url': 'pic.twitter.com/GqhdoIn41R', 'media_key': '7_1537881631528062977'}], 'hashtags': [{'start': 72, 'end': 83, 'tag': 'TeamGalaxy'}, {'start': 84, 'end': 99, 'tag': 'SamsungPartner'}]}",{'media_keys': ['7_1537881631528062977']},False,,everyone,Twitter Web App
1537901506321559552,890890468988473346,Yo sigo sin verle el punto a NADA de esto https://t.co/322Zyy03oC,2022-06-17 20:54:26+00:00,,2,6,9,2,es,1537901506321559552,[],"{'urls': [{'start': 42, 'end': 65, 'url': 'https://t.co/322Zyy03oC', 'expanded_url': 'https://twitter.com/TechCrunch/status/1537899688585637889', 'display_url': 'twitter.com/TechCrunch/sta…'}]}",,False,,everyone,Twitter for Android
1537576462668079105,1439948078593855492,https://t.co/3NxzDy4VJm,2022-06-16 23:22:50+00:00,,171,48,2689,16,zxx,1537576462668079105,[],"{'urls': [{'start': 0, 'end': 23, 'url': 'https://t.co/3NxzDy4VJm', 'expanded_url': 'https://twitter.com/NoticiasXDD/status/1537576462668079105/photo/1', 'display_url': 'pic.twitter.com/3NxzDy4VJm', 'media_key': '3_1537576458914340875'}]}",{'media_keys': ['3_1537576458914340875']},False,,everyone,Twitter for Android
1537913781241622529,1347766170158571522,@Sixsam6766 @BlueMario300 @CorypheusGinge @Riddler_Khu what,2022-06-17 21:43:13+00:00,,0,1,1,0,en,1537890430310043648,[],"{'mentions': [{'start': 0, 'end': 11, 'username': 'Sixsam6766', 'id': '1426387276527980544'}, {'start': 12, 'end': 25, 'username': 'BlueMario300', 'id': '228120514'}, {'start': 26, 'end': 41, 'username': 'CorypheusGinge', 'id': '4451199039'}, {'start': 42, 'end': 54, 'username': 'Riddler_Khu', 'id': '926048258870296577'}]}",,False,,everyone,Twitter Web App
1537904144605859840,16745055,"The next step on Charli XCX's CRASH tour? Roblox...today.

Don't miss the virtual concert debut of @charli_xcx in Samsung's Superstar Galaxy. The show starts Friday at 4PM PST: https://t.co/7x21bYAmUj https://t.co/jL8dgD2FOe",2022-06-17 21:04:55+00:00,,170,844,1670,52,en,1537904144605859840,"[{'domain': {'id': '3', 'name': 'TV Shows', 'description': 'Television shows from around the world'}, 'entity': {'id': '10031713489', 'name': 'The Next Step'}}, {'domain': {'id': '47', 'name': 'Brand', 'description': 'Brands and Companies'}, 'entity': {'id': '1174344555111469057', 'name': 'Samsung Indonesia'}}, {'domain': {'id': '71', 'name': 'Video Game', 'description': 'A video game like Overwatch'}, 'entity': {'id': '1088118927580774400', 'name': 'Roblox', 'description': 'Roblox'}}, {'domain': {'id': '10', 'name': 'Person', 'description': 'Named people in the world like Nelson Mandela'}, 'entity': {'id': '885602209618051072', 'name': 'Charli XCX', 'description': 'CHARLI XCX'}}, {'domain': {'id': '47', 'name': 'Brand', 'description': 'Brands and Companies'}, 'entity': {'id': '10026364234', 'name': 'Samsung '}}, {'domain': {'id': '48', 'name': 'Product', 'description': 'Products created by Brands.  Examples: Ford Explorer, Apple iPhone.'}, 'entity': {'id': '10026230384', 'name': 'Samsung Galaxy'}}, {'domain': {'id': '48', 'name': 'Product', 'description': 'Products created by Brands.  Examples: Ford Explorer, Apple iPhone.'}, 'entity': {'id': '10026331316', 'name': 'Samsung Mobile'}}, {'domain': {'id': '48', 'name': 'Product', 'description': 'Products created by Brands.  Examples: Ford Explorer, Apple iPhone.'}, 'entity': {'id': '10045298641', 'name': 'Samsung USA'}}, {'domain': {'id': '49', 'name': 'Product Version', 'description': ""The specific model or version of a product.  Examples: Audi A8, Ben & Jerry's Chocolate Chip Ice Cream""}, 'entity': {'id': '10040464729', 'name': 'Samsung Mobile UK'}}, {'domain': {'id': '49', 'name': 'Product Version', 'description': ""The specific model or version of a product.  Examples: Audi A8, Ben & Jerry's Chocolate Chip Ice Cream""}, 'entity': {'id': '10041364617', 'name': 'Samsung Mobile US'}}, {'domain': {'id': '54', 'name': 'Musician', 'description': 'A musician in the world, like Adele or Bob Dylan'}, 'entity': {'id': '885602209618051072', 'name': 'Charli XCX', 'description': 'CHARLI XCX'}}, {'domain': {'id': '55', 'name': 'Music Genre', 'description': 'A category for a musical style, like Pop, Rock, or Rap'}, 'entity': {'id': '810938279801470977', 'name': 'Pop', 'description': 'Pop'}}, {'domain': {'id': '30', 'name': 'Entities [Entity Service]', 'description': 'Entity Service top level domain, every item that is in Entity Service should be in this domain'}, 'entity': {'id': '848920371311001600', 'name': 'Technology', 'description': 'Technology and computing'}}, {'domain': {'id': '66', 'name': 'Interests and Hobbies Category', 'description': 'A grouping of interests and hobbies entities, like Novelty Food or Destinations'}, 'entity': {'id': '848920700073123840', 'name': 'Cell Phones', 'description': 'Cell phones'}}, {'domain': {'id': '30', 'name': 'Entities [Entity Service]', 'description': 'Entity Service top level domain, every item that is in Entity Service should be in this domain'}, 'entity': {'id': '848985956778561538', 'name': 'Mobile', 'description': 'Mobile'}}]","{'mentions': [{'start': 99, 'end': 110, 'username': 'charli_xcx', 'id': '103012173'}], 'annotations': [{'start': 17, 'end': 26, 'probability': 0.3106, 'type': 'Person', 'normalized_text': 'Charli XCX'}, {'start': 114, 'end': 120, 'probability': 0.6338, 'type': 'Product', 'normalized_text': 'Samsung'}], 'urls': [{'start': 177, 'end': 200, 'url': 'https://t.co/7x21bYAmUj', 'expanded_url': 'https://rblx.co/SuperstarGalaxy', 'display_url': 'rblx.co/SuperstarGalaxy', 'images': [{'url': 'https://pbs.twimg.com/news_img/1537904189233213440/tSREOdVz?format=jpg&name=orig', 'width': 498, 'height': 280}, {'url': 'https://pbs.twimg.com/news_img/1537904189233213440/tSREOdVz?format=jpg&name=150x150', 'width': 150, 'height': 150}], 'status': 200, 'title': '[🔊 BOOMBOX UPDATE 🔊] Samsung Superstar Galaxy', 'description': 'Check out [🔊 BOOMBOX UPDATE 🔊] Samsung Superstar Galaxy. It’s one of the millions of unique, user-generated 3D experiences created on Roblox. [🔊 BOOMBOX UPDATE 🔊] Samsung Superstar Galaxy JUNE 10 UPDATE / ONE WEEK TIL CHARLI XCX TAKES THE SAMSUNG STAGE! 🏟 / GRAB THE BOOMBOX ACCESSORY 🔊/ PLAY THE NEW ASTEROID OBBY ☄️ / NEW SONGS 🎵 / IMPROVED DIFFICULTY + MORE! Ready to become the Galaxy’s greatest superstar? 💫 In Superstar Galaxy, you can dance along to your favorite Charli XCX songs, perform on stage for all your friends, and customize your look and stage props! Perfect your pop star persona now! There’s only one more week til you can take the stage with Charli XCX! STARTING JUNE 17 AT 7PM EST 🎤 Unlock exclusive Charli XCX items ⭐️ Earn Star Power to unlock new gear 🚀 Explore the Superstar space station 🏗 Customize your own pop star stage 💖 PERFORM YOUR HEART OUT NEW ZONES, SONGS, AND OUTFITS UNLOCKED EVERY WEEK! 🌆 CYBER CITY OUT NOW! 🎡 SUNFEST VALLEY OUT NOW! 👽 COSMIC W', 'unwound_url': 'https://www.roblox.com/games/9426082120/BOOMBOX-UPDATE-Samsung-Superstar-Galaxy'}, {'start': 201, 'end': 224, 'url': 'https://t.co/jL8dgD2FOe', 'expanded_url': 'https://twitter.com/Roblox/status/1537904144605859840/photo/1', 'display_url': 'pic.twitter.com/jL8dgD2FOe', 'media_key': '3_1537904030067724290'}]}",{'media_keys': ['3_1537904030067724290']},False,,everyone,Twitter Web App
1537914235253948416,1088250161434894336,"@Theo_TJ_Jordan It is no accident that they have chosen colors that appeal to children. Was she too young to understand the context, or was she trolling you?",2022-06-17 21:45:01+00:00,,0,1,10,0,en,1537870678648553476,[],"{'mentions': [{'start': 0, 'end': 15, 'username': 'Theo_TJ_Jordan', 'id': '1328422666198544385'}]}",,False,,everyone,Twitter Web App
1537914225669988354,1266115586305728512,@GamingPavlo Send me a 25 robux gamepass ill give ya some.,2022-06-17 21:44:59+00:00,,0,1,0,0,en,1537912887439548416,"[{'domain': {'id': '48', 'name': 'Product', 'description': 'Products created by Brands.  Examples: Ford Explorer, Apple iPhone.'}, 'entity': {'id': '1425921713150201858', 'name': 'Xbox Game Pass'}}, {'domain': {'id': '45', 'name': 'Brand Vertical', 'description': 'Top level entities that describe a Brands industry'}, 'entity': {'id': '781974597310615553', 'name': 'Entertainment'}}, {'domain': {'id': '46', 'name': 'Brand Category', 'description': 'Categories within Brand Verticals that narrow down the scope of Brands'}, 'entity': {'id': '781974597218340864', 'name': 'Video Games'}}, {'domain': {'id': '47', 'name': 'Brand', 'description': 'Brands and Companies'}, 'entity': {'id': '10027048851', 'name': 'Xbox'}}, {'domain': {'id': '79', 'name': 'Video Game Hardware', 'description': 'Video Game Hardware'}, 'entity': {'id': '10027048851', 'name': 'Xbox'}}]","{'mentions': [{'start': 0, 'end': 12, 'username': 'GamingPavlo', 'id': '1295373331781300226'}]}",,False,,everyone,Twitter for Android
1537821500920963073,1532280391154905089,"BREAKING NEWS: Roblox is banning all Furries, W or L?",2022-06-17 15:36:31+00:00,,10,75,94,4,en,1537821500920963073,"[{'domain': {'id': '66', 'name': 'Interests and Hobbies Category', 'description': 'A grouping of interests and hobbies entities, like Novelty Food or Destinations'}, 'entity': {'id': '1045058369852067840', 'name': 'Furries', 'description': 'This entity tracks all conversation related to furries & furry fandom. For a more heavily-curated, Topic-ready version, see Furry fandom (1514304215165796352). '}}, {'domain': {'id': '71', 'name': 'Video Game', 'description': 'A video game like Overwatch'}, 'entity': {'id': '1088118927580774400', 'name': 'Roblox', 'description': 'Roblox'}}]","{'annotations': [{'start': 15, 'end': 20, 'probability': 0.3872, 'type': 'Organization', 'normalized_text': 'Roblox'}]}",,False,,everyone,TweetDeck
1537903001158885376,1461914614208339972,This raygun slaps https://t.co/wO19SKeyc0,2022-06-17 21:00:22+00:00,,0,2,3,0,en,1537903001158885376,[],"{'urls': [{'start': 18, 'end': 41, 'url': 'https://t.co/wO19SKeyc0', 'expanded_url': 'https://twitter.com/lammy_not/status/1537903001158885376/video/1', 'display_url': 'pic.twitter.com/wO19SKeyc0', 'media_key': '7_1537902792886476802'}]}",{'media_keys': ['7_1537902792886476802']},False,,everyone,Twitter for Android
1537914146460553217,1299880772338421762,"My favorite item, ""Gucci GG ####### Bag ###""! https://t.co/sNNGlqhaIH",2022-06-17 21:44:40+00:00,,20,34,441,2,en,1537914146460553217,"[{'domain': {'id': '46', 'name': 'Brand Category', 'description': 'Categories within Brand Verticals that narrow down the scope of Brands'}, 'entity': {'id': '781974596807299072', 'name': 'Apparel/Accessories'}}, {'domain': {'id': '47', 'name': 'Brand', 'description': 'Brands and Companies'}, 'entity': {'id': '1266401847104827392', 'name': 'Gucci'}}, {'domain': {'id': '65', 'name': 'Interests and Hobbies Vertical', 'description': 'Top level interests and hobbies groupings, like Food or Travel'}, 'entity': {'id': '1256236649253449729', 'name': 'Fashion & beauty'}}, {'domain': {'id': '67', 'name': 'Interests and Hobbies', 'description': 'Interests, opinions, and behaviors of individuals, groups, or cultures; like Speciality Cooking or Theme Parks'}, 'entity': {'id': '839543390668673024', 'name': 'Fashion'}}]","{'annotations': [{'start': 19, 'end': 26, 'probability': 0.4082, 'type': 'Product', 'normalized_text': 'Gucci GG'}], 'urls': [{'start': 46, 'end': 69, 'url': 'https://t.co/sNNGlqhaIH', 'expanded_url': 'https://twitter.com/RBLXTradingNews/status/1537914146460553217/photo/1', 'display_url': 'pic.twitter.com/sNNGlqhaIH', 'media_key': '3_1537914109487767563'}]}",{'media_keys': ['3_1537914109487767563']},False,,everyone,Twitter Web App
1537876983316549632,863689794,#ad Charli XCX Concert is LIVE TODAY! Hang out at the concert here: (https://t.co/Rsu1002Esa) You can usa all the cool accessories and emotes while you party! https://t.co/4z6rY5egFh,2022-06-17 19:16:59+00:00,,1,17,127,0,en,1537876983316549632,"[{'domain': {'id': '10', 'name': 'Person', 'description': 'Named people in the world like Nelson Mandela'}, 'entity': {'id': '885602209618051072', 'name': 'Charli XCX', 'description': 'CHARLI XCX'}}, {'domain': {'id': '54', 'name': 'Musician', 'description': 'A musician in the world, like Adele or Bob Dylan'}, 'entity': {'id': '885602209618051072', 'name': 'Charli XCX', 'description': 'CHARLI XCX'}}, {'domain': {'id': '55', 'name': 'Music Genre', 'description': 'A category for a musical style, like Pop, Rock, or Rap'}, 'entity': {'id': '810938279801470977', 'name': 'Pop', 'description': 'Pop'}}]","{'annotations': [{'start': 4, 'end': 21, 'probability': 0.2644, 'type': 'Other', 'normalized_text': 'Charli XCX Concert'}], 'urls': [{'start': 69, 'end': 92, 'url': 'https://t.co/Rsu1002Esa', 'expanded_url': 'https://bit.ly/superstargalaxy', 'display_url': 'bit.ly/superstargalaxy', 'status': 200, 'unwound_url': 'https://www.roblox.com/superstargalaxy?utm_medium=CPM&utm_campaign=Samsung+Superstar+Galaxy'}, {'start': 159, 'end': 182, 'url': 'https://t.co/4z6rY5egFh', 'expanded_url': 'https://twitter.com/russotalks/status/1537876983316549632/photo/1', 'display_url': 'pic.twitter.com/4z6rY5egFh', 'media_key': '3_1537876929436536832'}], 'hashtags': [{'start': 0, 'end': 3, 'tag': 'ad'}]}",{'media_keys': ['3_1537876929436536832']},False,,everyone,Twitter Web App
1537734286425530370,1356794881071603712,rt this if you're taller than a roblox character https://t.co/dJ6Uz4EeH4,2022-06-17 09:49:58+00:00,,289,94,334,7,en,1537734286425530370,"[{'domain': {'id': '71', 'name': 'Video Game', 'description': 'A video game like Overwatch'}, 'entity': {'id': '1088118927580774400', 'name': 'Roblox', 'description': 'Roblox'}}]","{'urls': [{'start': 49, 'end': 72, 'url': 'https://t.co/dJ6Uz4EeH4', 'expanded_url': 'https://twitter.com/hartpwints/status/1537734286425530370/photo/1', 'display_url': 'pic.twitter.com/dJ6Uz4EeH4', 'media_key': '3_1537734284328374274'}]}",{'media_keys': ['3_1537734284328374274']},False,,everyone,Twitter for Android
1536821520739074048,1190454874741166081,"100 robux
2 winners- 50 each

Rules
Follow me
Retweet

Extras
Tag a friend
Follow @.TrixiePlays_Alt",2022-06-14 21:22:57+00:00,,77,65,79,2,en,1536821520739074048,[],,,False,,mentionedUsers,Twitter for Android
1537911845457043459,1480450507877629955,@psychoticpolly cabeça quadrada?,2022-06-17 21:35:31+00:00,,0,1,0,0,pt,1537903262233268225,[],"{'mentions': [{'start': 0, 'end': 15, 'username': 'psychoticpolly', 'id': '1464239373285797888'}]}",,False,,everyone,Twitter for Android
