tweetid,author_id,text,created_at,geo,retweets,replies,likes,quote_count,lang,conversation_id,context_annotations,entities,attachments,possibly_sensitive,withheld,reply_settings,source
1521522722660134912,33540700,pick a dating app for Jon,2022-05-03 16:11:00+00:00,,1331,2315,35821,682,en,1521522722660134912,"[{'domain': {'id': '130', 'name': 'Multimedia Franchise', 'description': ""Franchises which span multiple forms of media like 'Harry Potter'""}, 'entity': {'id': '1455317623877476358', 'name': 'Garfield'}}]","{'annotations': [{'start': 22, 'end': 24, 'probability': 0.9454, 'type': 'Person', 'normalized_text': 'Jon'}]}",,False,,everyone,Sprinklr
1521728064987688960,16745055,"Hi everyone, we are aware that some of you are having issues accessing Roblox. Our team is actively working on it. Thanks for your patience",2022-05-04 05:46:57+00:00,,4060,14667,47269,1017,en,1521728064987688960,"[{'domain': {'id': '71', 'name': 'Video Game', 'description': 'A video game like Overwatch'}, 'entity': {'id': '1088118927580774400', 'name': 'Roblox', 'description': 'Roblox'}}]","{'annotations': [{'start': 71, 'end': 76, 'probability': 0.3595, 'type': 'Product', 'normalized_text': 'Roblox'}]}",,False,,everyone,Twitter Web App
1521805326995329025,1443207317990756353,@Roblox I was trying to play bed wars and suddenly this got happend and then I want to join I can't I was like im freak out because I thought I got hacked or banned the whole time it's just a little down so please fix it fast I can't stand playing roblox this night I will die https://t.co/kFhU2AGZI6,2022-05-04 10:53:58+00:00,,0,18,23,0,en,1521728064987688960,"[{'domain': {'id': '71', 'name': 'Video Game', 'description': 'A video game like Overwatch'}, 'entity': {'id': '1088118927580774400', 'name': 'Roblox', 'description': 'Roblox'}}]","{'urls': [{'start': 277, 'end': 300, 'url': 'https://t.co/kFhU2AGZI6', 'expanded_url': 'https://twitter.com/riwiyana/status/1521805326995329025/photo/1', 'display_url': 'pic.twitter.com/kFhU2AGZI6', 'media_key': '3_1521805323895738369'}], 'mentions': [{'start': 0, 'end': 7, 'username': 'Roblox', 'id': '16745055'}]}",{'media_keys': ['3_1521805323895738369']},False,,everyone,Twitter for Android
1521823249587339264,1410123318028603392,i was ia for 3 days what did i miss 😭,2022-05-04 12:05:11+00:00,,0,9,2,0,en,1521823249587339264,[],,,False,,everyone,Twitter for Android
1521820119638462465,1417587809502826500,Ta voltando!!,2022-05-04 11:52:45+00:00,,0,8,22,0,pt,1521807837063749632,[],,,False,,everyone,Twitter for Android
1521804782972899328,758906947659673600,used to hate roblox going down but now i enjoy it,2022-05-04 10:51:48+00:00,,163,1004,3509,18,en,1521804782972899328,"[{'domain': {'id': '71', 'name': 'Video Game', 'description': 'A video game like Overwatch'}, 'entity': {'id': '1088118927580774400', 'name': 'Roblox', 'description': 'Roblox'}}]",,,False,,everyone,Twitter Web App
1521761033274241024,1408340269087535104,Roblox has been having issues for almost 9 hours now. #RobloxDown,2022-05-04 07:57:57+00:00,,180,412,2906,33,en,1521761033274241024,"[{'domain': {'id': '71', 'name': 'Video Game', 'description': 'A video game like Overwatch'}, 'entity': {'id': '1088118927580774400', 'name': 'Roblox', 'description': 'Roblox'}}]","{'annotations': [{'start': 0, 'end': 5, 'probability': 0.4092, 'type': 'Organization', 'normalized_text': 'Roblox'}], 'hashtags': [{'start': 54, 'end': 65, 'tag': 'RobloxDown'}]}",,False,,everyone,Twitter for iPhone
1521807738317066240,44196397,I dunno … seems kinda fungible,2022-05-04 11:03:33+00:00,,31225,35320,478112,5248,en,1521807738317066240,"[{'domain': {'id': '10', 'name': 'Person', 'description': 'Named people in the world like Nelson Mandela'}, 'entity': {'id': '808713037230157824', 'name': 'Elon Musk', 'description': 'Elon Musk'}}, {'domain': {'id': '65', 'name': 'Interests and Hobbies Vertical', 'description': 'Top level interests and hobbies groupings, like Food or Travel'}, 'entity': {'id': '781974596148793345', 'name': 'Business & finance'}}, {'domain': {'id': '66', 'name': 'Interests and Hobbies Category', 'description': 'A grouping of interests and hobbies entities, like Novelty Food or Destinations'}, 'entity': {'id': '857878777191211008', 'name': 'Leadership', 'description': 'Leadership'}}, {'domain': {'id': '30', 'name': 'Entities [Entity Service]', 'description': 'Entity Service top level domain, every item that is in Entity Service should be in this domain'}, 'entity': {'id': '857879456773357569', 'name': 'Technology', 'description': 'Technology'}}]",,,False,,everyone,Twitter for iPhone
1521799437588344833,3025674465,"Ok I’m awake. Is Roblox still down? If so, all day Roblox is down stream. 

GOOD MORNING!!!!",2022-05-04 10:30:34+00:00,,115,603,3736,7,en,1521799437588344833,"[{'domain': {'id': '71', 'name': 'Video Game', 'description': 'A video game like Overwatch'}, 'entity': {'id': '1088118927580774400', 'name': 'Roblox', 'description': 'Roblox'}}]","{'annotations': [{'start': 51, 'end': 56, 'probability': 0.4147, 'type': 'Other', 'normalized_text': 'Roblox'}]}",,False,,everyone,Twitter for iPhone
1521807489079160833,3025674465,"Woke up. Roblox is still down. They're still investigating. They have no idea why it's down. IT'S GO TIME. 🥵😭

LIVE in 30 MINUTES - https://t.co/3Ej5SdocSt
Begun, the Great Roblox Outage of 2022 has. https://t.co/fLebjoPk7e",2022-05-04 11:02:33+00:00,,99,292,2232,3,en,1521807489079160833,"[{'domain': {'id': '71', 'name': 'Video Game', 'description': 'A video game like Overwatch'}, 'entity': {'id': '1088118927580774400', 'name': 'Roblox', 'description': 'Roblox'}}]","{'urls': [{'start': 132, 'end': 155, 'url': 'https://t.co/3Ej5SdocSt', 'expanded_url': 'https://youtu.be/F-iNS4dfijU', 'display_url': 'youtu.be/F-iNS4dfijU', 'images': [{'url': 'https://pbs.twimg.com/news_img/1521807532913741824/feCzvWQU?format=jpg&name=orig', 'width': 1280, 'height': 720}, {'url': 'https://pbs.twimg.com/news_img/1521807532913741824/feCzvWQU?format=jpg&name=150x150', 'width': 150, 'height': 150}], 'status': 200, 'title': '🔴 ROBLOX IS DOWN!!! THIS IS REALLY BAD... (LIVE UPDATES) #RobloxDown', 'description': '💚 BECOME A MEMBER: https://www.youtube.com/kreekcraft/join🤑 DONATE HERE: https://streamelements.com/kreekcraft/tip👕 KREEKCRAFT MERCH: https://kreekshop.co...', 'unwound_url': 'https://www.youtube.com/watch?v=F-iNS4dfijU&feature=youtu.be'}, {'start': 200, 'end': 223, 'url': 'https://t.co/fLebjoPk7e', 'expanded_url': 'https://twitter.com/KreekCraft/status/1521807489079160833/photo/1', 'display_url': 'pic.twitter.com/fLebjoPk7e', 'media_key': '3_1521804975042707456'}]}",{'media_keys': ['3_1521804975042707456']},False,,everyone,Twitter Web App
1521708949526835206,888867384404176896,Roblox will be down another 3 days guys! xD,2022-05-04 04:31:00+00:00,,41,304,811,10,en,1521708949526835206,"[{'domain': {'id': '71', 'name': 'Video Game', 'description': 'A video game like Overwatch'}, 'entity': {'id': '1088118927580774400', 'name': 'Roblox', 'description': 'Roblox'}}]","{'annotations': [{'start': 0, 'end': 5, 'probability': 0.3243, 'type': 'Organization', 'normalized_text': 'Roblox'}]}",,False,,everyone,Twitter Web App
1521731292286619649,1056053249470541824,"Roblox is still down as of 2 am EST. We’ve closed our messages due to spam from confused players who didn't realize we aren't Roblox. We know its down, and we’ll give you updates as prompt as possible. Currently, many experiences &amp; pages don't load. 🔔",2022-05-04 05:59:47+00:00,,139,327,2850,14,en,1521731292286619649,"[{'domain': {'id': '71', 'name': 'Video Game', 'description': 'A video game like Overwatch'}, 'entity': {'id': '1088118927580774400', 'name': 'Roblox', 'description': 'Roblox'}}]",,,False,,everyone,Twitter for iPhone
1521807204072013835,1408340269087535104,"Some users are now able to access experiences again, let us know if you're able to access an experience! #RobloxDown",2022-05-04 11:01:25+00:00,,37,246,868,3,en,1521807204072013835,[],"{'hashtags': [{'start': 105, 'end': 116, 'tag': 'RobloxDown'}]}",,False,,everyone,TweetDeck
1521820326308552706,1186951008246730752,"@concodanomics Next it'll all become ""digital assets"" once the term crypto becomes too toxic",2022-05-04 11:53:34+00:00,,0,1,0,0,en,1521808105260134400,[],"{'mentions': [{'start': 0, 'end': 14, 'username': 'concodanomics', 'id': '1032371282116063235'}]}",,False,,everyone,Twitter Web App
1521824393084739585,1310688804441817088,@HeHeFunnyRock Have you seen your name? Hypocrite 🤣🤓,2022-05-04 12:09:44+00:00,,0,6,4,0,en,1521797700961943552,[],"{'mentions': [{'start': 0, 'end': 14, 'username': 'HeHeFunnyRock', 'id': '1502973838623092736'}]}",,False,,everyone,Twitter Web App
1521811901360926721,1486805802761351168,@Cyriellekeithw @tr_q12_ @Roblox Search for the game instead of recent games. Just let you know there might be low players or chat not working in some games .,2022-05-04 11:20:05+00:00,,0,1,0,0,en,1521728064987688960,"[{'domain': {'id': '71', 'name': 'Video Game', 'description': 'A video game like Overwatch'}, 'entity': {'id': '1088118927580774400', 'name': 'Roblox', 'description': 'Roblox'}}]","{'mentions': [{'start': 0, 'end': 15, 'username': 'Cyriellekeithw', 'id': '1492070118792503299'}, {'start': 16, 'end': 24, 'username': 'tr_q12_', 'id': '1328375016073916417'}, {'start': 25, 'end': 32, 'username': 'Roblox', 'id': '16745055'}]}",,False,,everyone,Twitter for iPhone
1513597387754856462,1374861579351691265,"The Divers may have dispatched you to secure safe passage through the layer, but it seems other forces have already arrived... https://t.co/MG74UsEZHQ",2022-04-11 19:18:33+00:00,,56,100,954,6,en,1513597387754856462,[],"{'urls': [{'start': 127, 'end': 150, 'url': 'https://t.co/MG74UsEZHQ', 'expanded_url': 'https://twitter.com/Deepwoken/status/1513597387754856462/photo/1', 'display_url': 'pic.twitter.com/MG74UsEZHQ', 'media_key': '3_1513595988992217088'}]}",{'media_keys': ['3_1513595988992217088']},False,,everyone,Twitter Web App
1521816317585932289,1385402068714676225,@Roblox_RTC Roblox players right now when roblox was back up again today: https://t.co/ciI74khQce,2022-05-04 11:37:38+00:00,,0,1,3,0,en,1521731292286619649,"[{'domain': {'id': '71', 'name': 'Video Game', 'description': 'A video game like Overwatch'}, 'entity': {'id': '1088118927580774400', 'name': 'Roblox', 'description': 'Roblox'}}]","{'urls': [{'start': 74, 'end': 97, 'url': 'https://t.co/ciI74khQce', 'expanded_url': 'https://twitter.com/mrcupkeyk/status/1521816317585932289/photo/1', 'display_url': 'pic.twitter.com/ciI74khQce', 'media_key': '16_1521816304726208512'}], 'mentions': [{'start': 0, 'end': 11, 'username': 'Roblox_RTC', 'id': '1056053249470541824'}]}",{'media_keys': ['16_1521816304726208512']},False,,everyone,Twitter Web App
1521822941473820673,1255111848518651904,"Just woke up, please tell me Roblox is still down",2022-05-04 12:03:58+00:00,,16,156,1022,2,en,1521822941473820673,"[{'domain': {'id': '71', 'name': 'Video Game', 'description': 'A video game like Overwatch'}, 'entity': {'id': '1088118927580774400', 'name': 'Roblox', 'description': 'Roblox'}}]","{'annotations': [{'start': 29, 'end': 34, 'probability': 0.4209, 'type': 'Product', 'normalized_text': 'Roblox'}]}",,False,,everyone,Twitter for iPhone
1521816590630932480,1324626400385536001,Why theres some people who simp this mf a little too hard https://t.co/NimzCI0dde,2022-05-04 11:38:43+00:00,,0,2,2,0,en,1521816590630932480,[],"{'urls': [{'start': 58, 'end': 81, 'url': 'https://t.co/NimzCI0dde', 'expanded_url': 'https://twitter.com/DanderPaws/status/1521816590630932480/photo/1', 'display_url': 'pic.twitter.com/NimzCI0dde', 'media_key': '3_1521816586713468928'}]}",{'media_keys': ['3_1521816586713468928']},False,,everyone,Twitter for Android
1521656755624857607,1437953992269647873,@runawaynisha i get the joke but thats not very nice,2022-05-04 01:03:36+00:00,,1,14,37,0,en,1521651858003173376,[],"{'mentions': [{'start': 0, 'end': 13, 'username': 'runawaynisha', 'id': '1384186741418905606'}]}",,False,,everyone,Twitter Web App
1521578305702428672,15753118,What's a Roblox game you wish was on Roblox front page with hundreds of thousands of players?,2022-05-03 19:51:52+00:00,,9,209,307,2,en,1521578305702428672,"[{'domain': {'id': '71', 'name': 'Video Game', 'description': 'A video game like Overwatch'}, 'entity': {'id': '1088118927580774400', 'name': 'Roblox', 'description': 'Roblox'}}]","{'annotations': [{'start': 37, 'end': 42, 'probability': 0.4073, 'type': 'Organization', 'normalized_text': 'Roblox'}]}",,False,,everyone,Twitter Web App
1519364525983617025,574032254,"✨INTO THE METAVERSE✨

What actually is the metaverse? Will it be like @readyplayerone or more like @Roblox?

In today's ATB, we talk with @areeve about all of the above: https://t.co/2B6fWwq3c6 https://t.co/J4vTwHGKHq",2022-04-27 17:15:06+00:00,,194,655,604,19,en,1519364525983617025,"[{'domain': {'id': '45', 'name': 'Brand Vertical', 'description': 'Top level entities that describe a Brands industry'}, 'entity': {'id': '781974596148793345', 'name': 'Business & finance'}}, {'domain': {'id': '46', 'name': 'Brand Category', 'description': 'Categories within Brand Verticals that narrow down the scope of Brands'}, 'entity': {'id': '781974596794716162', 'name': 'Financial services'}}, {'domain': {'id': '47', 'name': 'Brand', 'description': 'Brands and Companies'}, 'entity': {'id': '1370436971940642819', 'name': 'Coinbase'}}, {'domain': {'id': '65', 'name': 'Interests and Hobbies Vertical', 'description': 'Top level interests and hobbies groupings, like Food or Travel'}, 'entity': {'id': '781974596148793345', 'name': 'Business & finance'}}, {'domain': {'id': '30', 'name': 'Entities [Entity Service]', 'description': 'Entity Service top level domain, every item that is in Entity Service should be in this domain'}, 'entity': {'id': '848920371311001600', 'name': 'Technology', 'description': 'Technology and computing'}}, {'domain': {'id': '66', 'name': 'Interests and Hobbies Category', 'description': 'A grouping of interests and hobbies entities, like Novelty Food or Destinations'}, 'entity': {'id': '913142676819648512', 'name': 'Cryptocurrencies', 'description': 'Cryptocurrency'}}, {'domain': {'id': '71', 'name': 'Video Game', 'description': 'A video game like Overwatch'}, 'entity': {'id': '1088118927580774400', 'name': 'Roblox', 'description': 'Roblox'}}, {'domain': {'id': '165', 'name': 'Technology', 'description': 'for individual and types of technology, e.g., food technology, 3D printing'}, 'entity': {'id': '848920371311001600', 'name': 'Technology', 'description': 'Technology and computing'}}]","{'urls': [{'start': 170, 'end': 193, 'url': 'https://t.co/2B6fWwq3c6', 'expanded_url': 'https://youtu.be/UeCunGgS68w', 'display_url': 'youtu.be/UeCunGgS68w', 'images': [{'url': 'https://pbs.twimg.com/news_img/1519364528068186112/8nmr5ere?format=jpg&name=orig', 'width': 480, 'height': 360}, {'url': 'https://pbs.twimg.com/news_img/1519364528068186112/8nmr5ere?format=jpg&name=150x150', 'width': 150, 'height': 150}], 'status': 200, 'title': 'Around The Block Ep 21 - Seriously, what IS the metaverse? with Coinbase’s Alex Reeve', 'description': 'While the term, “metaverse” conjures images of a “Ready Player One” type virtual world, understanding what it actually is today, is a bit trickier. As you’ll...', 'unwound_url': 'https://www.youtube.com/watch?v=UeCunGgS68w&feature=youtu.be'}, {'start': 194, 'end': 217, 'url': 'https://t.co/J4vTwHGKHq', 'expanded_url': 'https://twitter.com/coinbase/status/1519364525983617025/video/1', 'display_url': 'pic.twitter.com/J4vTwHGKHq', 'media_key': '7_1519364168595349504'}], 'mentions': [{'start': 70, 'end': 85, 'username': 'readyplayerone', 'id': '705209963694587904'}, {'start': 99, 'end': 106, 'username': 'Roblox', 'id': '16745055'}, {'start': 138, 'end': 145, 'username': 'areeve', 'id': '25671820'}]}",{'media_keys': ['7_1519364168595349504']},False,,everyone,Twitter Web App
1521731498021322753,1367456335286079490,"@Roblox You made me shower for the first time after 2 months.
Quite an accomplishment https://t.co/dWGidcjrwp",2022-05-04 06:00:36+00:00,,7,12,561,0,en,1521728064987688960,"[{'domain': {'id': '71', 'name': 'Video Game', 'description': 'A video game like Overwatch'}, 'entity': {'id': '1088118927580774400', 'name': 'Roblox', 'description': 'Roblox'}}]","{'urls': [{'start': 86, 'end': 109, 'url': 'https://t.co/dWGidcjrwp', 'expanded_url': 'https://twitter.com/Blaze_IsMyUser/status/1521731498021322753/photo/1', 'display_url': 'pic.twitter.com/dWGidcjrwp', 'media_key': '3_1521731490697994240'}], 'mentions': [{'start': 0, 'end': 7, 'username': 'Roblox', 'id': '16745055'}]}",{'media_keys': ['3_1521731490697994240']},False,,everyone,Twitter Web App
1521729322179973120,901894986836279296,@Roblox https://t.co/MHqmS7AM3i,2022-05-04 05:51:57+00:00,,49,103,3789,1,qme,1521728064987688960,"[{'domain': {'id': '71', 'name': 'Video Game', 'description': 'A video game like Overwatch'}, 'entity': {'id': '1088118927580774400', 'name': 'Roblox', 'description': 'Roblox'}}]","{'urls': [{'start': 8, 'end': 31, 'url': 'https://t.co/MHqmS7AM3i', 'expanded_url': 'https://twitter.com/Bloxy_News/status/1521729322179973120/photo/1', 'display_url': 'pic.twitter.com/MHqmS7AM3i', 'media_key': '3_1521729304383557633'}], 'mentions': [{'start': 0, 'end': 7, 'username': 'Roblox', 'id': '16745055'}]}",{'media_keys': ['3_1521729304383557633']},False,,everyone,TweetDeck
1521824284464852994,1317837129268056064,@mikael_efefef Because of someone,2022-05-04 12:09:18+00:00,,0,1,1,0,en,1521824041396580354,[],"{'mentions': [{'start': 0, 'end': 14, 'username': 'mikael_efefef', 'id': '1444408869669773317'}]}",,False,,following,Twitter Web App
1521821731383480321,1427066429099020291,YO ROBLOX IS BACKK,2022-05-04 11:59:09+00:00,,0,4,2,0,en,1521821731383480321,"[{'domain': {'id': '71', 'name': 'Video Game', 'description': 'A video game like Overwatch'}, 'entity': {'id': '1088118927580774400', 'name': 'Roblox', 'description': 'Roblox'}}]",,,False,,everyone,Twitter Web App
1521822966622871552,1178728174026416129,this is the longest roblox has been down 😭 it’s been almost 13 hours #RobloxDown,2022-05-04 12:04:04+00:00,,0,1,0,0,en,1521822966622871552,"[{'domain': {'id': '71', 'name': 'Video Game', 'description': 'A video game like Overwatch'}, 'entity': {'id': '1088118927580774400', 'name': 'Roblox', 'description': 'Roblox'}}]","{'hashtags': [{'start': 69, 'end': 80, 'tag': 'RobloxDown'}]}",,False,,everyone,Twitter for iPhone
1521815177628422144,1056053249470541824,"Roblox seems to be slowly loading as of 7:30 AM EST, meaning games and pages are loading &amp; errors are in the progress of being fixed. We could see the site come back up completely soon. ✅",2022-05-04 11:33:06+00:00,,26,56,678,2,en,1521731292286619649,"[{'domain': {'id': '71', 'name': 'Video Game', 'description': 'A video game like Overwatch'}, 'entity': {'id': '1088118927580774400', 'name': 'Roblox', 'description': 'Roblox'}}]",,,False,,everyone,Twitter for iPhone
1521823862715224064,1510891808972189700,NAOCNSINCND ROBLOX IS FINALLY ALIVE OR WHAT,2022-05-04 12:07:37+00:00,,1,1,3,0,en,1521823862715224064,"[{'domain': {'id': '71', 'name': 'Video Game', 'description': 'A video game like Overwatch'}, 'entity': {'id': '1088118927580774400', 'name': 'Roblox', 'description': 'Roblox'}}]",,,False,,everyone,Twitter Web App
1521824048417853440,1323056968324571139,"I have tried emailing roblox but they don’t try to help at all I tried buying a digital roblox gift card and the All of a sudden the roblox servers crashed, I ended up getting charged but never got my code or my credit. I’m stuck and don’t know what to do can someone help @roblox",2022-05-04 12:08:21+00:00,,0,1,0,0,en,1521824048417853440,"[{'domain': {'id': '71', 'name': 'Video Game', 'description': 'A video game like Overwatch'}, 'entity': {'id': '1088118927580774400', 'name': 'Roblox', 'description': 'Roblox'}}]","{'mentions': [{'start': 273, 'end': 280, 'username': 'Roblox', 'id': '16745055'}]}",,False,,everyone,Twitter for iPhone
1521721629650399232,1119092775532634112,roblox https://t.co/vRyyCXWESi,2022-05-04 05:21:23+00:00,,400,160,6475,21,en,1521721629650399232,"[{'domain': {'id': '71', 'name': 'Video Game', 'description': 'A video game like Overwatch'}, 'entity': {'id': '1088118927580774400', 'name': 'Roblox', 'description': 'Roblox'}}]","{'urls': [{'start': 7, 'end': 30, 'url': 'https://t.co/vRyyCXWESi', 'expanded_url': 'https://twitter.com/M1A2_AbramsTank/status/1521721629650399232/photo/1', 'display_url': 'pic.twitter.com/vRyyCXWESi', 'media_key': '3_1521721585358581760'}]}",{'media_keys': ['3_1521721585358581760']},False,,everyone,Twitter Web App
