tweetid,author_id,text,created_at,geo,retweets,replies,likes,quote_count,lang,conversation_id,context_annotations,entities,attachments,possibly_sensitive,withheld,reply_settings,source
1521597057303121920,16745055,@Spotify @soundtrap @discord Queen SUNMI! So excited to have you on Roblox! 🥰,2022-05-03 21:06:23+00:00,,37,465,544,11,en,1521449221261602817,"[{'domain': {'id': '45', 'name': 'Brand Vertical', 'description': 'Top level entities that describe a Brands industry'}, 'entity': {'id': '781974597310615553', 'name': 'Entertainment'}}, {'domain': {'id': '46', 'name': 'Brand Category', 'description': 'Categories within Brand Verticals that narrow down the scope of Brands'}, 'entity': {'id': '781974597222535168', 'name': 'Online Services'}}, {'domain': {'id': '47', 'name': 'Brand', 'description': 'Brands and Companies'}, 'entity': {'id': '10040276669', 'name': 'Spotify'}}, {'domain': {'id': '47', 'name': 'Brand', 'description': 'Brands and Companies'}, 'entity': {'id': '1168499224297656321', 'name': 'Discord'}}, {'domain': {'id': '67', 'name': 'Interests and Hobbies', 'description': 'Interests, opinions, and behaviors of individuals, groups, or cultures; like Speciality Cooking or Theme Parks'}, 'entity': {'id': '1288826829634035714', 'name': 'Backstage'}}, {'domain': {'id': '71', 'name': 'Video Game', 'description': 'A video game like Overwatch'}, 'entity': {'id': '1088118927580774400', 'name': 'Roblox', 'description': 'Roblox'}}, {'domain': {'id': '165', 'name': 'Technology', 'description': 'for individual and types of technology, e.g., food technology, 3D printing'}, 'entity': {'id': '1196446161223028736', 'name': 'Social media'}}]","{'mentions': [{'start': 0, 'end': 8, 'username': 'Spotify', 'id': '17230018'}, {'start': 9, 'end': 19, 'username': 'soundtrap', 'id': '882321548'}, {'start': 20, 'end': 28, 'username': 'discord', 'id': '3065618342'}], 'annotations': [{'start': 29, 'end': 39, 'probability': 0.829, 'type': 'Person', 'normalized_text': 'Queen SUNMI'}, {'start': 68, 'end': 73, 'probability': 0.4973, 'type': 'Product', 'normalized_text': 'Roblox'}]}",,False,,everyone,Twitter Web App
1521591829883666432,891137271071723521,"- 💎45k #rhd giveaway! - 

- Follow @kyanmamas and @RoyaleV1xx with 🔔! 
- Like &amp; Retweet

* Extras below *",2022-05-03 20:45:36+00:00,,50,45,58,14,en,1521591829883666432,[],"{'hashtags': [{'start': 7, 'end': 11, 'tag': 'rhd'}], 'mentions': [{'start': 35, 'end': 45, 'username': 'kyanmamas', 'id': '891137271071723521'}, {'start': 50, 'end': 61, 'username': 'RoyaleV1xx', 'id': '1512866283381002241'}]}",,False,,mentionedUsers,Twitter for iPhone
1521577026922205185,1230226244446248962,@Parlo_ROBLOX https://t.co/DJXnScDW4M,2022-05-03 19:46:47+00:00,,0,1,10,0,qme,1521575187136794627,[],"{'mentions': [{'start': 0, 'end': 13, 'username': 'Parlo_ROBLOX', 'id': '1310688804441817088'}], 'urls': [{'start': 14, 'end': 37, 'url': 'https://t.co/DJXnScDW4M', 'expanded_url': 'https://twitter.com/FiImsGio/status/1521577026922205185/photo/1', 'display_url': 'pic.twitter.com/DJXnScDW4M', 'media_key': '3_1521577013617872896'}]}",{'media_keys': ['3_1521577013617872896']},False,,everyone,Twitter Web App
1521597807836250114,4361825126,"Imma tell you my mods for Left 4 Dead 2 lmao
The spitter is a McDonalds Cup
The Boomer is Wario
The Tank is Donkey Kong
The Jockey is Plankton
The Charger has the Bitconnect guy voice
The Smoker is Weegee
Pain Pills are Fanta cans
The grenade launcher is a pepsi Launcher",2022-05-03 21:09:21+00:00,,1,2,3,0,en,1521597807836250114,"[{'domain': {'id': '45', 'name': 'Brand Vertical', 'description': 'Top level entities that describe a Brands industry'}, 'entity': {'id': '781974596148793345', 'name': 'Business & finance'}}, {'domain': {'id': '45', 'name': 'Brand Vertical', 'description': 'Top level entities that describe a Brands industry'}, 'entity': {'id': '781974596161376261', 'name': 'Dining'}}, {'domain': {'id': '45', 'name': 'Brand Vertical', 'description': 'Top level entities that describe a Brands industry'}, 'entity': {'id': '781974596740190208', 'name': 'CPG'}}, {'domain': {'id': '46', 'name': 'Brand Category', 'description': 'Categories within Brand Verticals that narrow down the scope of Brands'}, 'entity': {'id': '781974596656304128', 'name': 'Beverage'}}, {'domain': {'id': '46', 'name': 'Brand Category', 'description': 'Categories within Brand Verticals that narrow down the scope of Brands'}, 'entity': {'id': '781974596794716162', 'name': 'Financial services'}}, {'domain': {'id': '46', 'name': 'Brand Category', 'description': 'Categories within Brand Verticals that narrow down the scope of Brands'}, 'entity': {'id': '781974597017083904', 'name': 'QSR'}}, {'domain': {'id': '47', 'name': 'Brand', 'description': 'Brands and Companies'}, 'entity': {'id': '10026288001', 'name': 'Pepsi'}}, {'domain': {'id': '47', 'name': 'Brand', 'description': 'Brands and Companies'}, 'entity': {'id': '10026319212', 'name': ""McDonald's""}}, {'domain': {'id': '47', 'name': 'Brand', 'description': 'Brands and Companies'}, 'entity': {'id': '1007353627789352961', 'name': 'BitConnect Cryptocurrency', 'description': 'BitConnect Cryptocurrency'}}, {'domain': {'id': '30', 'name': 'Entities [Entity Service]', 'description': 'Entity Service top level domain, every item that is in Entity Service should be in this domain'}, 'entity': {'id': '825047692124442624', 'name': 'Food', 'description': 'Food'}}, {'domain': {'id': '66', 'name': 'Interests and Hobbies Category', 'description': 'A grouping of interests and hobbies entities, like Novelty Food or Destinations'}, 'entity': {'id': '860133563332648963', 'name': 'Cuisines', 'description': 'Cuisines'}}, {'domain': {'id': '30', 'name': 'Entities [Entity Service]', 'description': 'Entity Service top level domain, every item that is in Entity Service should be in this domain'}, 'entity': {'id': '847865239886417922', 'name': 'Fast food Restaurants', 'description': 'Fast food'}}, {'domain': {'id': '67', 'name': 'Interests and Hobbies', 'description': 'Interests, opinions, and behaviors of individuals, groups, or cultures; like Speciality Cooking or Theme Parks'}, 'entity': {'id': '850143755873140737', 'name': 'Soda', 'description': 'Soda'}}, {'domain': {'id': '71', 'name': 'Video Game', 'description': 'A video game like Overwatch'}, 'entity': {'id': '854952148374663168', 'name': 'Super Mario', 'description': 'This entity includes all conversation about the franchise, as well as any individual installments in the series, if applicable.\t\t\t'}}, {'domain': {'id': '71', 'name': 'Video Game', 'description': 'A video game like Overwatch'}, 'entity': {'id': '1298331749252886528', 'name': 'Donkey Kong'}}, {'domain': {'id': '71', 'name': 'Video Game', 'description': 'A video game like Overwatch'}, 'entity': {'id': '1309562114822926336', 'name': 'Left 4 Dead'}}, {'domain': {'id': '45', 'name': 'Brand Vertical', 'description': 'Top level entities that describe a Brands industry'}, 'entity': {'id': '781974596161376261', 'name': 'Dining'}}, {'domain': {'id': '46', 'name': 'Brand Category', 'description': 'Categories within Brand Verticals that narrow down the scope of Brands'}, 'entity': {'id': '781974597017083904', 'name': 'QSR'}}, {'domain': {'id': '47', 'name': 'Brand', 'description': 'Brands and Companies'}, 'entity': {'id': '10026319212', 'name': ""McDonald's""}}, {'domain': {'id': '30', 'name': 'Entities [Entity Service]', 'description': 'Entity Service top level domain, every item that is in Entity Service should be in this domain'}, 'entity': {'id': '825047692124442624', 'name': 'Food', 'description': 'Food'}}, {'domain': {'id': '152', 'name': 'Food', 'description': 'Topics about food, like Donuts or Brunch'}, 'entity': {'id': '847865239886417922', 'name': 'Fast food Restaurants', 'description': 'Fast food'}}]",,,False,,everyone,Twitter Web App
1521556106346123264,1515258302883586052,"@logitechc Had so much fun at the 2nd
 annual #SongBreaker Awards this past weekend w/ @logitechc",2022-05-03 18:23:39+00:00,,0,2,2,0,en,1521556106346123264,[],"{'hashtags': [{'start': 46, 'end': 58, 'tag': 'SongBreaker'}], 'mentions': [{'start': 0, 'end': 10, 'username': 'logitechc', 'id': '1404912888377118721'}, {'start': 87, 'end': 97, 'username': 'logitechc', 'id': '1404912888377118721'}]}",,False,,everyone,Twitter for Android
1521452673010176002,17230018,"@Roblox @soundtrap @discord And lastly, a special #SpotifyIsland message from K-Pop star #SUNMI! 👀 https://t.co/jrp6JawnSU 🏝️ https://t.co/qJFK93TwAK",2022-05-03 11:32:39+00:00,,143,49,901,37,en,1521449221261602817,"[{'domain': {'id': '45', 'name': 'Brand Vertical', 'description': 'Top level entities that describe a Brands industry'}, 'entity': {'id': '781974597310615553', 'name': 'Entertainment'}}, {'domain': {'id': '46', 'name': 'Brand Category', 'description': 'Categories within Brand Verticals that narrow down the scope of Brands'}, 'entity': {'id': '781974597222535168', 'name': 'Online Services'}}, {'domain': {'id': '47', 'name': 'Brand', 'description': 'Brands and Companies'}, 'entity': {'id': '10040276669', 'name': 'Spotify'}}, {'domain': {'id': '47', 'name': 'Brand', 'description': 'Brands and Companies'}, 'entity': {'id': '1168499224297656321', 'name': 'Discord'}}, {'domain': {'id': '67', 'name': 'Interests and Hobbies', 'description': 'Interests, opinions, and behaviors of individuals, groups, or cultures; like Speciality Cooking or Theme Parks'}, 'entity': {'id': '1288826829634035714', 'name': 'Backstage'}}, {'domain': {'id': '71', 'name': 'Video Game', 'description': 'A video game like Overwatch'}, 'entity': {'id': '1088118927580774400', 'name': 'Roblox', 'description': 'Roblox'}}, {'domain': {'id': '165', 'name': 'Technology', 'description': 'for individual and types of technology, e.g., food technology, 3D printing'}, 'entity': {'id': '1196446161223028736', 'name': 'Social media'}}, {'domain': {'id': '55', 'name': 'Music Genre', 'description': 'A category for a musical style, like Pop, Rock, or Rap'}, 'entity': {'id': '888105153038958593', 'name': 'K-pop', 'description': 'K-Pop'}}]","{'hashtags': [{'start': 50, 'end': 64, 'tag': 'SpotifyIsland'}, {'start': 89, 'end': 95, 'tag': 'SUNMI'}], 'mentions': [{'start': 0, 'end': 7, 'username': 'Roblox', 'id': '16745055'}, {'start': 8, 'end': 18, 'username': 'soundtrap', 'id': '882321548'}, {'start': 19, 'end': 27, 'username': 'discord', 'id': '3065618342'}], 'annotations': [{'start': 78, 'end': 82, 'probability': 0.5989, 'type': 'Organization', 'normalized_text': 'K-Pop'}], 'urls': [{'start': 99, 'end': 122, 'url': 'https://t.co/jrp6JawnSU', 'expanded_url': 'http://roblox.com/spotify', 'display_url': 'roblox.com/spotify', 'status': 200, 'unwound_url': 'https://www.roblox.com/spotify'}, {'start': 126, 'end': 149, 'url': 'https://t.co/qJFK93TwAK', 'expanded_url': 'https://twitter.com/Spotify/status/1521452673010176002/video/1', 'display_url': 'pic.twitter.com/qJFK93TwAK', 'media_key': '7_1521452367568412673'}]}",{'media_keys': ['7_1521452367568412673']},False,,everyone,Twitter Web App
1521159568562147329,16745055,"For uptown. For downtown. For your avatar, no matter what size and shape it is. Available now: https://t.co/NaI3ENWTbw https://t.co/xFrs99Fint",2022-05-02 16:07:57+00:00,,211,3023,4524,45,en,1521159568562147329,"[{'domain': {'id': '71', 'name': 'Video Game', 'description': 'A video game like Overwatch'}, 'entity': {'id': '1088118927580774400', 'name': 'Roblox', 'description': 'Roblox'}}]","{'urls': [{'start': 95, 'end': 118, 'url': 'https://t.co/NaI3ENWTbw', 'expanded_url': 'https://rblx.co/shorts', 'display_url': 'rblx.co/shorts'}, {'start': 119, 'end': 142, 'url': 'https://t.co/xFrs99Fint', 'expanded_url': 'https://twitter.com/Roblox/status/1521159568562147329/video/1', 'display_url': 'pic.twitter.com/xFrs99Fint', 'media_key': '7_1521158682746056705'}]}",{'media_keys': ['7_1521158682746056705']},False,,everyone,Twitter Web App
1521160044477399042,1406866683625607171,"@Roblox Guys I know who don't  play roblox please unfollow roblox  beacuse is boreding  to see all these comments, and plus roblox is working hard on it so please stop it thanks!",2022-05-02 16:09:51+00:00,,0,7,9,0,en,1521159568562147329,"[{'domain': {'id': '71', 'name': 'Video Game', 'description': 'A video game like Overwatch'}, 'entity': {'id': '1088118927580774400', 'name': 'Roblox', 'description': 'Roblox'}}]","{'mentions': [{'start': 0, 'end': 7, 'username': 'Roblox', 'id': '16745055'}]}",,False,,everyone,Twitter for Android
1521577988835491841,1404485071747354630,kiero el bbl de min y amazon prime:3 https://t.co/SIpiEOB2He https://t.co/r9fVssdlK1,2022-05-03 19:50:36+00:00,,2,2,6,36,es,1521577988835491841,"[{'domain': {'id': '45', 'name': 'Brand Vertical', 'description': 'Top level entities that describe a Brands industry'}, 'entity': {'id': '781974596706635776', 'name': 'Retail'}}, {'domain': {'id': '46', 'name': 'Brand Category', 'description': 'Categories within Brand Verticals that narrow down the scope of Brands'}, 'entity': {'id': '783335558466506752', 'name': 'Online'}}, {'domain': {'id': '47', 'name': 'Brand', 'description': 'Brands and Companies'}, 'entity': {'id': '10026792024', 'name': 'Amazon'}}, {'domain': {'id': '48', 'name': 'Product', 'description': 'Products created by Brands.  Examples: Ford Explorer, Apple iPhone.'}, 'entity': {'id': '10046538542', 'name': 'Amazon Prime'}}]","{'urls': [{'start': 37, 'end': 60, 'url': 'https://t.co/SIpiEOB2He', 'expanded_url': 'https://twitter.com/knowncito/status/1521577988835491841/photo/1', 'display_url': 'pic.twitter.com/SIpiEOB2He', 'media_key': '3_1521577975350763522'}, {'start': 37, 'end': 60, 'url': 'https://t.co/SIpiEOB2He', 'expanded_url': 'https://twitter.com/knowncito/status/1521577988835491841/photo/1', 'display_url': 'pic.twitter.com/SIpiEOB2He', 'media_key': '3_1521577975342415872'}, {'start': 61, 'end': 84, 'url': 'https://t.co/r9fVssdlK1', 'expanded_url': 'https://t.co/r9fVssdlK1', 'display_url': 't.co/r9fVssdlK1'}]}","{'media_keys': ['3_1521577975350763522', '3_1521577975342415872']}",False,,everyone,Twitter for iPhone
1521597312690270210,1415669154120540165,eh k paso con skz y roblox,2022-05-03 21:07:23+00:00,,0,2,0,0,tl,1521597312690270210,"[{'domain': {'id': '71', 'name': 'Video Game', 'description': 'A video game like Overwatch'}, 'entity': {'id': '1088118927580774400', 'name': 'Roblox', 'description': 'Roblox'}}]",,,False,,everyone,Twitter for Android
1521596434340007939,1296543056540377091,"@FloatingGravs wait, what new limited? (sorry for asking.)",2022-05-03 21:03:54+00:00,,0,1,0,0,en,1521543574768209920,[],"{'mentions': [{'start': 0, 'end': 14, 'username': 'FloatingGravs', 'id': '1304028446406914054'}]}",,False,,everyone,Twitter for iPhone
1521592033009446919,1372439505169489921,"@SpokenMMV @SBRehydrated Oh, so you're saying that Nintendo has never deleted some fanworks (like fan games and such) kimd of like Paramount just did??",2022-05-03 20:46:25+00:00,,0,2,0,0,en,1521143896012562432,"[{'domain': {'id': '45', 'name': 'Brand Vertical', 'description': 'Top level entities that describe a Brands industry'}, 'entity': {'id': '781974597310615553', 'name': 'Entertainment'}}, {'domain': {'id': '46', 'name': 'Brand Category', 'description': 'Categories within Brand Verticals that narrow down the scope of Brands'}, 'entity': {'id': '781974597105094656', 'name': 'TV/Movies Related'}}, {'domain': {'id': '46', 'name': 'Brand Category', 'description': 'Categories within Brand Verticals that narrow down the scope of Brands'}, 'entity': {'id': '781974597218340864', 'name': 'Video Games'}}, {'domain': {'id': '47', 'name': 'Brand', 'description': 'Brands and Companies'}, 'entity': {'id': '10026713294', 'name': 'Nintendo'}}, {'domain': {'id': '47', 'name': 'Brand', 'description': 'Brands and Companies'}, 'entity': {'id': '1275938187529949185', 'name': 'Paramount'}}, {'domain': {'id': '78', 'name': 'Video Game Publisher', 'description': ""A Video Game Publisher like 'Activision'""}, 'entity': {'id': '10026713294', 'name': 'Nintendo'}}]","{'mentions': [{'start': 0, 'end': 10, 'username': 'SpokenMMV', 'id': '1502685744934051849'}, {'start': 11, 'end': 24, 'username': 'SBRehydrated', 'id': '1189983798160744448'}], 'annotations': [{'start': 51, 'end': 58, 'probability': 0.4861, 'type': 'Organization', 'normalized_text': 'Nintendo'}, {'start': 131, 'end': 139, 'probability': 0.4279, 'type': 'Organization', 'normalized_text': 'Paramount'}]}",,False,,everyone,Twitter for Android
1521568674116608001,1504853531794325505,"cómo les explico que soy stay +20 con trabajo, estudios, responsabilidades, deudas y aún así estoy buscando tutoriales de cómo descargar roblox solo por skz???????",2022-05-03 19:13:35+00:00,,402,97,4954,141,es,1521568674116608001,"[{'domain': {'id': '71', 'name': 'Video Game', 'description': 'A video game like Overwatch'}, 'entity': {'id': '1088118927580774400', 'name': 'Roblox', 'description': 'Roblox'}}]",,,False,,everyone,Twitter for Android
1521587951783796739,1250200453423431680,"quien para hablar, ver anime o hacer algo en general",2022-05-03 20:30:12+00:00,,0,7,16,0,es,1521587951783796739,"[{'domain': {'id': '65', 'name': 'Interests and Hobbies Vertical', 'description': 'Top level interests and hobbies groupings, like Food or Travel'}, 'entity': {'id': '839543165002506240', 'name': 'Anime'}}, {'domain': {'id': '65', 'name': 'Interests and Hobbies Vertical', 'description': 'Top level interests and hobbies groupings, like Food or Travel'}, 'entity': {'id': '1280550787207147521', 'name': 'Arts & culture'}}]",,,False,,everyone,Twitter for Android
1521583443553005573,1518748840173707270,"For a member of Congress, and someone who pretends to be for family and kids, Nancy Pelosi sure is a nasty woman purchasing stock of Roblox. It is a dangerous site for kids. It include games, including sex games, etc. you can’t tell me she isn’t part of the problem. https://t.co/fPdXp4CUpI",2022-05-03 20:12:17+00:00,,0,1,0,0,en,1521583443553005573,[],"{'annotations': [{'start': 78, 'end': 89, 'probability': 0.9925, 'type': 'Person', 'normalized_text': 'Nancy Pelosi'}, {'start': 133, 'end': 138, 'probability': 0.5413, 'type': 'Product', 'normalized_text': 'Roblox'}], 'urls': [{'start': 267, 'end': 290, 'url': 'https://t.co/fPdXp4CUpI', 'expanded_url': 'https://twitter.com/brenda_kreuzer/status/1521583443553005573/photo/1', 'display_url': 'pic.twitter.com/fPdXp4CUpI', 'media_key': '3_1521583422451462145'}, {'start': 267, 'end': 290, 'url': 'https://t.co/fPdXp4CUpI', 'expanded_url': 'https://twitter.com/brenda_kreuzer/status/1521583443553005573/photo/1', 'display_url': 'pic.twitter.com/fPdXp4CUpI', 'media_key': '3_1521583422459817985'}, {'start': 267, 'end': 290, 'url': 'https://t.co/fPdXp4CUpI', 'expanded_url': 'https://twitter.com/brenda_kreuzer/status/1521583443553005573/photo/1', 'display_url': 'pic.twitter.com/fPdXp4CUpI', 'media_key': '3_1521583422514335744'}]}","{'media_keys': ['3_1521583422451462145', '3_1521583422459817985', '3_1521583422514335744']}",False,,everyone,Twitter for iPhone
1521597446132060160,1503519255664508931,trading regular phoenix in adopt me for diamonds in royale high! I don’t offer &lt;3 i’ll go first depending on how many proofs you have although i’d prefer going after you since i’m in need of some myself.😨,2022-05-03 21:07:55+00:00,,0,0,1,1,en,1521597446132060160,"[{'domain': {'id': '29', 'name': 'Events [Entity Service]', 'description': 'Entity Service related Events domain'}, 'entity': {'id': '1517623051860414465', 'name': 'World Environment Day'}}, {'domain': {'id': '71', 'name': 'Video Game', 'description': 'A video game like Overwatch'}, 'entity': {'id': '1230882318224510978', 'name': 'Royale High'}}, {'domain': {'id': '156', 'name': 'Cities', 'description': 'Cities around the world'}, 'entity': {'id': '1012383668378132480', 'name': 'Phoenix', 'description': 'Phoenix'}}]",,,False,,everyone,Twitter for iPhone
1520799476079894531,1292701628525686784,"If you owned ROBLOX for 1 hour what would be the first thing you'd do?  ⏰

#Roblox https://t.co/7wIMhYyDx7",2022-05-01 16:17:04+00:00,,122,2402,3438,83,en,1520799476079894531,"[{'domain': {'id': '29', 'name': 'Events [Entity Service]', 'description': 'Entity Service related Events domain'}, 'entity': {'id': '1517623051860414465', 'name': 'World Environment Day'}}, {'domain': {'id': '71', 'name': 'Video Game', 'description': 'A video game like Overwatch'}, 'entity': {'id': '1088118927580774400', 'name': 'Roblox', 'description': 'Roblox'}}]","{'hashtags': [{'start': 75, 'end': 82, 'tag': 'Roblox'}], 'annotations': [{'start': 13, 'end': 18, 'probability': 0.3527, 'type': 'Product', 'normalized_text': 'ROBLOX'}], 'urls': [{'start': 83, 'end': 106, 'url': 'https://t.co/7wIMhYyDx7', 'expanded_url': 'https://twitter.com/Vamonoz4/status/1520799476079894531/photo/1', 'display_url': 'pic.twitter.com/7wIMhYyDx7', 'media_key': '3_1520799416579416066'}]}",{'media_keys': ['3_1520799416579416066']},False,,everyone,Twitter Web App
1521596009121517568,67294068,My kids just cashed out on Xbox 😡 finna ask like nothing happened but next time on they ass,2022-05-03 21:02:13+00:00,,0,1,0,0,en,1521596009121517568,"[{'domain': {'id': '45', 'name': 'Brand Vertical', 'description': 'Top level entities that describe a Brands industry'}, 'entity': {'id': '781974597310615553', 'name': 'Entertainment'}}, {'domain': {'id': '46', 'name': 'Brand Category', 'description': 'Categories within Brand Verticals that narrow down the scope of Brands'}, 'entity': {'id': '781974597218340864', 'name': 'Video Games'}}, {'domain': {'id': '47', 'name': 'Brand', 'description': 'Brands and Companies'}, 'entity': {'id': '10027048851', 'name': 'Xbox'}}, {'domain': {'id': '79', 'name': 'Video Game Hardware', 'description': 'Video Game Hardware'}, 'entity': {'id': '10027048851', 'name': 'Xbox'}}]","{'annotations': [{'start': 27, 'end': 30, 'probability': 0.9215, 'type': 'Product', 'normalized_text': 'Xbox'}]}",,False,,everyone,Twitter for iPhone
1521553803086024704,2850532049,Roblox is promoting an illegally stolen copy of a game they falsely banned $RBLX https://t.co/aty0imOEDz,2022-05-03 18:14:30+00:00,,541,359,11779,29,en,1521553803086024704,"[{'domain': {'id': '71', 'name': 'Video Game', 'description': 'A video game like Overwatch'}, 'entity': {'id': '1088118927580774400', 'name': 'Roblox', 'description': 'Roblox'}}]","{'cashtags': [{'start': 75, 'end': 80, 'tag': 'RBLX'}], 'annotations': [{'start': 0, 'end': 5, 'probability': 0.6129, 'type': 'Organization', 'normalized_text': 'Roblox'}], 'urls': [{'start': 81, 'end': 104, 'url': 'https://t.co/aty0imOEDz', 'expanded_url': 'https://twitter.com/AlbertsStuff/status/1521553803086024704/photo/1', 'display_url': 'pic.twitter.com/aty0imOEDz', 'media_key': '3_1521553668977352705'}]}",{'media_keys': ['3_1521553668977352705']},False,,everyone,Twitter Web App
1521597262547193857,1495476281567158275,@louispelolargoo ni idea pero mira https://t.co/dMkDSz3a8j,2022-05-03 21:07:11+00:00,,0,1,0,0,eu,1521596850180030464,"[{'domain': {'id': '10', 'name': 'Person', 'description': 'Named people in the world like Nelson Mandela'}, 'entity': {'id': '1062427352318173185', 'name': 'Stray Kids', 'description': 'Stray Kids (스트레이 키즈)'}}, {'domain': {'id': '45', 'name': 'Brand Vertical', 'description': 'Top level entities that describe a Brands industry'}, 'entity': {'id': '781974597310615553', 'name': 'Entertainment'}}, {'domain': {'id': '46', 'name': 'Brand Category', 'description': 'Categories within Brand Verticals that narrow down the scope of Brands'}, 'entity': {'id': '781974597222535168', 'name': 'Online Services'}}, {'domain': {'id': '47', 'name': 'Brand', 'description': 'Brands and Companies'}, 'entity': {'id': '10040276669', 'name': 'Spotify'}}, {'domain': {'id': '54', 'name': 'Musician', 'description': 'A musician in the world, like Adele or Bob Dylan'}, 'entity': {'id': '1062427352318173185', 'name': 'Stray Kids', 'description': 'Stray Kids (스트레이 키즈)'}}, {'domain': {'id': '55', 'name': 'Music Genre', 'description': 'A category for a musical style, like Pop, Rock, or Rap'}, 'entity': {'id': '888105153038958593', 'name': 'K-pop', 'description': 'K-Pop'}}, {'domain': {'id': '30', 'name': 'Entities [Entity Service]', 'description': 'Entity Service top level domain, every item that is in Entity Service should be in this domain'}, 'entity': {'id': '848920371311001600', 'name': 'Technology', 'description': 'Technology and computing'}}, {'domain': {'id': '67', 'name': 'Interests and Hobbies', 'description': 'Interests, opinions, and behaviors of individuals, groups, or cultures; like Speciality Cooking or Theme Parks'}, 'entity': {'id': '1288826829634035714', 'name': 'Backstage'}}, {'domain': {'id': '71', 'name': 'Video Game', 'description': 'A video game like Overwatch'}, 'entity': {'id': '1088118927580774400', 'name': 'Roblox', 'description': 'Roblox'}}, {'domain': {'id': '165', 'name': 'Technology', 'description': 'for individual and types of technology, e.g., food technology, 3D printing'}, 'entity': {'id': '848920371311001600', 'name': 'Technology', 'description': 'Technology and computing'}}]","{'mentions': [{'start': 0, 'end': 16, 'username': 'louispelolargoo', 'id': '1504290548361834496'}], 'urls': [{'start': 35, 'end': 58, 'url': 'https://t.co/dMkDSz3a8j', 'expanded_url': 'https://twitter.com/MusicWeek/status/1521470080462295043?t=SoI9M6mrkzfj-xG1QAYGag&s=19', 'display_url': 'twitter.com/MusicWeek/stat…'}]}",,False,,everyone,Twitter for Android
