tweetid,author_id,text,created_at,geo,retweets,replies,likes,quote_count,lang,conversation_id,context_annotations,entities,attachments,possibly_sensitive,withheld,reply_settings,source
1518079833577861120,1071938981389045765,"🔥 Like this tweet, reply with your Roblox username, and follow our Twitter for a chance to win 50,000 in-game cash! (3 winners, ends evening of 4/24)",2022-04-24 04:10:11+00:00,,62,559,858,1,en,1518079833577861120,"[{'domain': {'id': '71', 'name': 'Video Game', 'description': 'A video game like Overwatch'}, 'entity': {'id': '1088118927580774400', 'name': 'Roblox', 'description': 'Roblox'}}, {'domain': {'id': '46', 'name': 'Brand Category', 'description': 'Categories within Brand Verticals that narrow down the scope of Brands'}, 'entity': {'id': '781974596752842752', 'name': 'Services'}}, {'domain': {'id': '47', 'name': 'Brand', 'description': 'Brands and Companies'}, 'entity': {'id': '10045225402', 'name': 'Twitter'}}]","{'annotations': [{'start': 36, 'end': 41, 'probability': 0.7098, 'type': 'Product', 'normalized_text': 'Roblox'}, {'start': 68, 'end': 74, 'probability': 0.7998, 'type': 'Product', 'normalized_text': 'Twitter'}]}",,False,,everyone,Twitter for iPhone
1517993743567237122,1056053249470541824,"Roblox’s chief business officer, Craig Donato - has said the company MIGHT do NFTS &amp; integrate blockchain technology into the platforms future 📸 https://t.co/VA2mjHncaR",2022-04-23 22:28:06+00:00,,112,732,1937,300,en,1517993743567237122,"[{'domain': {'id': '46', 'name': 'Brand Category', 'description': 'Categories within Brand Verticals that narrow down the scope of Brands'}, 'entity': {'id': '781974596752842752', 'name': 'Services'}}, {'domain': {'id': '48', 'name': 'Product', 'description': 'Products created by Brands.  Examples: Ford Explorer, Apple iPhone.'}, 'entity': {'id': '1412579054855671809', 'name': 'Google Innovation'}}, {'domain': {'id': '30', 'name': 'Entities [Entity Service]', 'description': 'Entity Service top level domain, every item that is in Entity Service should be in this domain'}, 'entity': {'id': '857879456773357569', 'name': 'Technology', 'description': 'Technology'}}, {'domain': {'id': '66', 'name': 'Interests and Hobbies Category', 'description': 'A grouping of interests and hobbies entities, like Novelty Food or Destinations'}, 'entity': {'id': '913142676819648512', 'name': 'Cryptocurrencies', 'description': 'Cryptocurrency'}}, {'domain': {'id': '30', 'name': 'Entities [Entity Service]', 'description': 'Entity Service top level domain, every item that is in Entity Service should be in this domain'}, 'entity': {'id': '1001503516555337728', 'name': 'Blockchain', 'description': 'Blockchain'}}, {'domain': {'id': '71', 'name': 'Video Game', 'description': 'A video game like Overwatch'}, 'entity': {'id': '1088118927580774400', 'name': 'Roblox', 'description': 'Roblox'}}, {'domain': {'id': '30', 'name': 'Entities [Entity Service]', 'description': 'Entity Service top level domain, every item that is in Entity Service should be in this domain'}, 'entity': {'id': '857879456773357569', 'name': 'Technology', 'description': 'Technology'}}]","{'urls': [{'start': 149, 'end': 172, 'url': 'https://t.co/VA2mjHncaR', 'expanded_url': 'https://twitter.com/Roblox_RTC/status/1517993743567237122/photo/1', 'display_url': 'pic.twitter.com/VA2mjHncaR', 'media_key': '3_1517993740601806850'}, {'start': 149, 'end': 172, 'url': 'https://t.co/VA2mjHncaR', 'expanded_url': 'https://twitter.com/Roblox_RTC/status/1517993743567237122/photo/1', 'display_url': 'pic.twitter.com/VA2mjHncaR', 'media_key': '3_1517993740601806849'}], 'annotations': [{'start': 0, 'end': 5, 'probability': 0.6402, 'type': 'Organization', 'normalized_text': 'Roblox'}, {'start': 33, 'end': 44, 'probability': 0.9823, 'type': 'Person', 'normalized_text': 'Craig Donato'}]}","{'media_keys': ['3_1517993740601806850', '3_1517993740601806849']}",False,,everyone,Twitter for iPhone
1518228265344901120,1199001259904307207,Do you want to see NFTs on Roblox? 🤔👇,2022-04-24 14:00:00+00:00,,88,1875,2555,154,en,1518228265344901120,"[{'domain': {'id': '66', 'name': 'Interests and Hobbies Category', 'description': 'A grouping of interests and hobbies entities, like Novelty Food or Destinations'}, 'entity': {'id': '913142676819648512', 'name': 'Cryptocurrencies', 'description': 'Cryptocurrency'}}, {'domain': {'id': '71', 'name': 'Video Game', 'description': 'A video game like Overwatch'}, 'entity': {'id': '1088118927580774400', 'name': 'Roblox', 'description': 'Roblox'}}]","{'annotations': [{'start': 19, 'end': 22, 'probability': 0.6002, 'type': 'Person', 'normalized_text': 'NFTs'}, {'start': 27, 'end': 32, 'probability': 0.4867, 'type': 'Product', 'normalized_text': 'Roblox'}]}",,False,,everyone,Twitter Web App
1518167086484402176,888335292607889408,@penny__dk Μαλακα έχω ένα 10 χρόνο ένα 9 ένα 8 και μετά αλλά δύο 4 άσε με μην ανοίγεις πληγές,2022-04-24 09:56:54+00:00,,0,1,1,0,el,1518164727695872000,[],"{'mentions': [{'start': 0, 'end': 10, 'username': 'penny__dk', 'id': '1148608105380495360'}]}",,False,,everyone,Twitter for Android
1518068774703828993,1330950753507106816,"I don't play #Roblox much anymore, so LINK YOUR GAMEPASS/SHIRT! (1000 Robux Limit, buying 7) https://t.co/9x8qz2RhPs",2022-04-24 03:26:14+00:00,,131,1102,1562,7,en,1518068774703828993,"[{'domain': {'id': '48', 'name': 'Product', 'description': 'Products created by Brands.  Examples: Ford Explorer, Apple iPhone.'}, 'entity': {'id': '1425921713150201858', 'name': 'Xbox Game Pass'}}, {'domain': {'id': '71', 'name': 'Video Game', 'description': 'A video game like Overwatch'}, 'entity': {'id': '1088118927580774400', 'name': 'Roblox', 'description': 'Roblox'}}, {'domain': {'id': '45', 'name': 'Brand Vertical', 'description': 'Top level entities that describe a Brands industry'}, 'entity': {'id': '781974597310615553', 'name': 'Entertainment'}}, {'domain': {'id': '46', 'name': 'Brand Category', 'description': 'Categories within Brand Verticals that narrow down the scope of Brands'}, 'entity': {'id': '781974597218340864', 'name': 'Video Games'}}, {'domain': {'id': '47', 'name': 'Brand', 'description': 'Brands and Companies'}, 'entity': {'id': '10027048851', 'name': 'Xbox'}}, {'domain': {'id': '79', 'name': 'Video Game Hardware', 'description': 'Video Game Hardware'}, 'entity': {'id': '10027048851', 'name': 'Xbox'}}]","{'urls': [{'start': 93, 'end': 116, 'url': 'https://t.co/9x8qz2RhPs', 'expanded_url': 'https://twitter.com/RBXevents_/status/1518068774703828993/photo/1', 'display_url': 'pic.twitter.com/9x8qz2RhPs', 'media_key': '3_1518068313540075520'}], 'hashtags': [{'start': 13, 'end': 20, 'tag': 'Roblox'}]}",{'media_keys': ['3_1518068313540075520']},False,,everyone,Twitter Web App
1517630236598231040,826202021623640065,"EARTH DAY UPDATE!
🌎 12 new eco-friendly furniture pieces!
🐇 Easter theme taken down

Pets update has been delayed due to a Roblox bug. We are working with Roblox to have it fixed, and will announce a release date once it has been resolved!

https://t.co/x7rOckk7xp https://t.co/BJdopLsSW3",2022-04-22 22:23:39+00:00,,3,9,29,0,en,1517630236598231040,"[{'domain': {'id': '29', 'name': 'Events [Entity Service]', 'description': 'Entity Service related Events domain'}, 'entity': {'id': '1231938152383668224', 'name': 'Earth Day', 'description': 'This entity covers all conversations for all years for Earth Day'}}, {'domain': {'id': '29', 'name': 'Events [Entity Service]', 'description': 'Entity Service related Events domain'}, 'entity': {'id': '1372917575357591554', 'name': 'Easter', 'description': 'this entity for all conversations for Easter all year '}}, {'domain': {'id': '71', 'name': 'Video Game', 'description': 'A video game like Overwatch'}, 'entity': {'id': '1088118927580774400', 'name': 'Roblox', 'description': 'Roblox'}}, {'domain': {'id': '119', 'name': 'Holiday', 'description': 'Holidays like Christmas or Halloween'}, 'entity': {'id': '1231938152383668224', 'name': 'Earth Day', 'description': 'This entity covers all conversations for all years for Earth Day'}}, {'domain': {'id': '119', 'name': 'Holiday', 'description': 'Holidays like Christmas or Halloween'}, 'entity': {'id': '1372917575357591554', 'name': 'Easter', 'description': 'this entity for all conversations for Easter all year '}}, {'domain': {'id': '109', 'name': 'Reoccurring Trends', 'description': 'Twitter generated Trends that occur on a daily, weekly, monthly, or yearly basis'}, 'entity': {'id': '959193002810925056', 'name': 'Earth Day 2018', 'description': 'Earth Day 2018'}}]","{'urls': [{'start': 241, 'end': 264, 'url': 'https://t.co/x7rOckk7xp', 'expanded_url': 'http://playrhs.com', 'display_url': 'playrhs.com', 'images': [{'url': 'https://pbs.twimg.com/news_img/1541089072671821824/U98uyNch?format=jpg&name=orig', 'width': 498, 'height': 280}, {'url': 'https://pbs.twimg.com/news_img/1541089072671821824/U98uyNch?format=jpg&name=150x150', 'width': 150, 'height': 150}], 'status': 200, 'title': 'Robloxian High School', 'description': 'Check out Robloxian High School. It’s one of the millions of unique, user-generated 3D experiences created on Roblox. UPDATE JUNE 24TH: 💰 Earn Robux & Coins from OUTFIT SELLING! 💃 EMOTES menu redesign! Try out new emotes and sync your dances with others! 🚙 NIGHTLINE vehicle! 🐶 CORGI pet! 🏠 FRENCH COUNTRY house! WELCOME! 🎨 CREATE AWESOME AVATARS with free Roblox catalog access, limitless accessory tuning and body scaling! 🐹 CREATE AND PLAY AS YOUR PET! Dress up with avatar editor and control your favorite pets! [NEW!] 💰 SELL YOUR AVATARS FOR ROBUX and in-game currency 🏠 DESIGN DREAM HOMES! pick from 20+ houses, use hundreds of furniture pieces! 🚗 EXPAND YOUR CAR COLLECTION! drive & customize over 100 vehicles, bikes and boards! 🌎 BUILD YOUR WORLD by placing world props anywhere in Robloxia! 💡 Have feedback, suggestions or bug reports? Join us in our social links!', 'unwound_url': 'https://www.roblox.com/games/447452406/Robloxian-High-School?AssetId=447452406'}, {'start': 265, 'end': 288, 'url': 'https://t.co/BJdopLsSW3', 'expanded_url': 'https://twitter.com/RobloxianHS/status/1517630236598231040/photo/1', 'display_url': 'pic.twitter.com/BJdopLsSW3', 'media_key': '3_1517630164917579776'}], 'annotations': [{'start': 157, 'end': 162, 'probability': 0.3288, 'type': 'Organization', 'normalized_text': 'Roblox'}]}",{'media_keys': ['3_1517630164917579776']},False,,everyone,Twitter Web App
1518197946361290752,888867384404176896,"Comment your Roblox Display name!!

The best one gets BIG Robux &lt;3",2022-04-24 11:59:31+00:00,,84,1766,727,6,en,1518197946361290752,"[{'domain': {'id': '71', 'name': 'Video Game', 'description': 'A video game like Overwatch'}, 'entity': {'id': '1088118927580774400', 'name': 'Roblox', 'description': 'Roblox'}}]",,,False,,everyone,Twitter Web App
1517863422221766657,1071938981389045765,"💰The first few giveaways are beginning now! 

Like and follow our Twitter. Reply to this post with your favorite ER:LC update EVER to enter to win a $10 Roblox gift card! 

Also, https://t.co/9r9mU2foQI has another giveaway! Make sure you join!",2022-04-23 13:50:15+00:00,,94,695,898,4,en,1517863422221766657,"[{'domain': {'id': '71', 'name': 'Video Game', 'description': 'A video game like Overwatch'}, 'entity': {'id': '1088118927580774400', 'name': 'Roblox', 'description': 'Roblox'}}, {'domain': {'id': '46', 'name': 'Brand Category', 'description': 'Categories within Brand Verticals that narrow down the scope of Brands'}, 'entity': {'id': '781974596752842752', 'name': 'Services'}}, {'domain': {'id': '47', 'name': 'Brand', 'description': 'Brands and Companies'}, 'entity': {'id': '10045225402', 'name': 'Twitter'}}]","{'urls': [{'start': 179, 'end': 202, 'url': 'https://t.co/9r9mU2foQI', 'expanded_url': 'http://discord.gg/PRC', 'display_url': 'discord.gg/PRC', 'status': 200, 'title': 'Discord - A New Way to Chat with Friends & Communities', 'description': 'Discord is the easiest way to communicate over voice, video, and text. Chat, hang out, and stay close with your friends and communities.', 'unwound_url': 'https://discord.com/invite/PRC'}], 'annotations': [{'start': 67, 'end': 73, 'probability': 0.8248, 'type': 'Product', 'normalized_text': 'Twitter'}, {'start': 154, 'end': 159, 'probability': 0.4506, 'type': 'Product', 'normalized_text': 'Roblox'}]}",,False,,everyone,Twitter for iPhone
1518091218655215617,1417005593521311747,@korzieetv yuh,2022-04-24 04:55:25+00:00,,0,1,0,0,und,1518031726114533377,[],"{'mentions': [{'start': 0, 'end': 10, 'username': 'korzieetv', 'id': '1386666027728113666'}]}",,False,,everyone,Twitter Web App
1518182968300343298,1296125007408648195,"Hace 14 años, el 24 de abril de 2008, se agregó la función de marcar juegos, modelos y ropa como favoritos; se estrena nueva iluminación; se mejora el sistema de moderación, etc.",2022-04-24 11:00:00+00:00,,4,1,21,0,es,1518182968300343298,[],,,False,,everyone,Twitter Web App
1517981695722414080,1162732510507257856,"Where are my manners? Loomian Legacy, meet Doodle World. #LoomianLegacy #DoodleWorld https://t.co/6qMOSBfbgp",2022-04-23 21:40:13+00:00,,1,4,49,0,en,1517981695722414080,[],"{'urls': [{'start': 85, 'end': 108, 'url': 'https://t.co/6qMOSBfbgp', 'expanded_url': 'https://twitter.com/ItzBruniy/status/1517981695722414080/video/1', 'display_url': 'pic.twitter.com/6qMOSBfbgp', 'media_key': '7_1517981644996579329'}], 'hashtags': [{'start': 57, 'end': 71, 'tag': 'LoomianLegacy'}, {'start': 72, 'end': 84, 'tag': 'DoodleWorld'}]}",{'media_keys': ['7_1517981644996579329']},False,,everyone,Twitter Web App
1518198986171166721,1199001259904307207,"Chief Business Officer Craig Donato says #Roblox may implement #NFTs to the platform in the future. 👀

Article (@VentureBeat): https://t.co/viEyRtRnWY (via: @Roblox_RTC + @chris12902) https://t.co/MQNBxuiAXr",2022-04-24 12:03:39+00:00,,27,217,381,55,en,1518198986171166721,"[{'domain': {'id': '46', 'name': 'Brand Category', 'description': 'Categories within Brand Verticals that narrow down the scope of Brands'}, 'entity': {'id': '781974596157181956', 'name': 'Online Site'}}, {'domain': {'id': '47', 'name': 'Brand', 'description': 'Brands and Companies'}, 'entity': {'id': '1066423866354847745', 'name': 'VentureBeat', 'description': 'VentureBeat'}}, {'domain': {'id': '66', 'name': 'Interests and Hobbies Category', 'description': 'A grouping of interests and hobbies entities, like Novelty Food or Destinations'}, 'entity': {'id': '913142676819648512', 'name': 'Cryptocurrencies', 'description': 'Cryptocurrency'}}, {'domain': {'id': '71', 'name': 'Video Game', 'description': 'A video game like Overwatch'}, 'entity': {'id': '1088118927580774400', 'name': 'Roblox', 'description': 'Roblox'}}]","{'urls': [{'start': 127, 'end': 150, 'url': 'https://t.co/viEyRtRnWY', 'expanded_url': 'https://venturebeat.com/2022/04/23/craig-donato-interview-how-roblox-navigates-brands-ugc-and-the-metaverse/', 'display_url': 'venturebeat.com/2022/04/23/cra…'}, {'start': 184, 'end': 207, 'url': 'https://t.co/MQNBxuiAXr', 'expanded_url': 'https://twitter.com/RBXNews_/status/1518198986171166721/photo/1', 'display_url': 'pic.twitter.com/MQNBxuiAXr', 'media_key': '3_1518198834588966916'}, {'start': 184, 'end': 207, 'url': 'https://t.co/MQNBxuiAXr', 'expanded_url': 'https://twitter.com/RBXNews_/status/1518198986171166721/photo/1', 'display_url': 'pic.twitter.com/MQNBxuiAXr', 'media_key': '3_1518198885562433536'}], 'annotations': [{'start': 23, 'end': 34, 'probability': 0.9924, 'type': 'Person', 'normalized_text': 'Craig Donato'}], 'mentions': [{'start': 112, 'end': 124, 'username': 'VentureBeat', 'id': '60642052'}, {'start': 157, 'end': 168, 'username': 'Roblox_RTC', 'id': '1056053249470541824'}, {'start': 171, 'end': 182, 'username': 'chris12902', 'id': '1254513527664099333'}], 'hashtags': [{'start': 41, 'end': 48, 'tag': 'Roblox'}, {'start': 63, 'end': 68, 'tag': 'NFTs'}]}","{'media_keys': ['3_1518198834588966916', '3_1518198885562433536']}",False,,everyone,Twitter Web App
1408530831333892099,875875794689683457,"A picture can describe a thousand words, and hundreds of thousands of people!!!

Thanks @Roblox @robloxdevrel
 for sending us a physical copy of our #BloxyAward, and thank you to everyone who voted for us in the 8th Annual Bloxy Awards! https://t.co/QaaJKjwdAf",2021-06-25 21:01:34+00:00,,114,943,2753,12,en,1408530831333892099,"[{'domain': {'id': '71', 'name': 'Video Game', 'description': 'A video game like Overwatch'}, 'entity': {'id': '1088118927580774400', 'name': 'Roblox', 'description': 'Roblox'}}]","{'urls': [{'start': 237, 'end': 260, 'url': 'https://t.co/QaaJKjwdAf', 'expanded_url': 'https://twitter.com/BelowNatural/status/1408530831333892099/photo/1', 'display_url': 'pic.twitter.com/QaaJKjwdAf', 'media_key': '3_1408530696289796100'}, {'start': 237, 'end': 260, 'url': 'https://t.co/QaaJKjwdAf', 'expanded_url': 'https://twitter.com/BelowNatural/status/1408530831333892099/photo/1', 'display_url': 'pic.twitter.com/QaaJKjwdAf', 'media_key': '3_1408530776178802695'}], 'mentions': [{'start': 88, 'end': 95, 'username': 'Roblox', 'id': '16745055'}, {'start': 96, 'end': 109, 'username': 'robloxdevrel', 'id': '856650515874172928'}], 'hashtags': [{'start': 149, 'end': 160, 'tag': 'BloxyAward'}]}","{'media_keys': ['3_1408530696289796100', '3_1408530776178802695']}",False,,everyone,Twitter Web App
1517960766737231872,1280632147343216641,"Who wants a quick $5,000 Robux?",2022-04-23 20:17:03+00:00,,204,1800,1053,10,en,1517960766737231872,[],,,False,,everyone,Twitter Web App
1518202797086367744,1056053249470541824,"📍 My Hello Kitty Cafe, an official game by Sanrio &amp; @RockPandaGames , releases officially on Roblox, on April 25th, 4:30 PM PST. https://t.co/O2JWqRaXRq",2022-04-24 12:18:48+00:00,,237,231,2274,81,en,1518202797086367744,"[{'domain': {'id': '10', 'name': 'Person', 'description': 'Named people in the world like Nelson Mandela'}, 'entity': {'id': '1443277565393719296', 'name': 'Hello Kitty'}}, {'domain': {'id': '45', 'name': 'Brand Vertical', 'description': 'Top level entities that describe a Brands industry'}, 'entity': {'id': '781974596706635776', 'name': 'Retail'}}, {'domain': {'id': '46', 'name': 'Brand Category', 'description': 'Categories within Brand Verticals that narrow down the scope of Brands'}, 'entity': {'id': '781974597302296576', 'name': 'Specialty'}}, {'domain': {'id': '47', 'name': 'Brand', 'description': 'Brands and Companies'}, 'entity': {'id': '1038116841485303808', 'name': 'Sanrio', 'description': 'Sanrio (サンリオ)'}}, {'domain': {'id': '47', 'name': 'Brand', 'description': 'Brands and Companies'}, 'entity': {'id': '1443277565393719296', 'name': 'Hello Kitty'}}, {'domain': {'id': '65', 'name': 'Interests and Hobbies Vertical', 'description': 'Top level interests and hobbies groupings, like Food or Travel'}, 'entity': {'id': '834828264786898945', 'name': 'Drinks', 'description': 'Drinks'}}, {'domain': {'id': '66', 'name': 'Interests and Hobbies Category', 'description': 'A grouping of interests and hobbies entities, like Novelty Food or Destinations'}, 'entity': {'id': '834828445238431744', 'name': 'Generic Drinks', 'description': 'Generic Drinks'}}, {'domain': {'id': '67', 'name': 'Interests and Hobbies', 'description': 'Interests, opinions, and behaviors of individuals, groups, or cultures; like Speciality Cooking or Theme Parks'}, 'entity': {'id': '850442647088971776', 'name': 'Coffee', 'description': 'Coffee'}}, {'domain': {'id': '71', 'name': 'Video Game', 'description': 'A video game like Overwatch'}, 'entity': {'id': '1088118927580774400', 'name': 'Roblox', 'description': 'Roblox'}}, {'domain': {'id': '122', 'name': 'Fictional Character', 'description': 'A person or other being in a narrative work of art, like Tom Sawyer or Jon Snow'}, 'entity': {'id': '1443277565393719296', 'name': 'Hello Kitty'}}, {'domain': {'id': '65', 'name': 'Interests and Hobbies Vertical', 'description': 'Top level interests and hobbies groupings, like Food or Travel'}, 'entity': {'id': '834828264786898945', 'name': 'Drinks', 'description': 'Drinks'}}, {'domain': {'id': '66', 'name': 'Interests and Hobbies Category', 'description': 'A grouping of interests and hobbies entities, like Novelty Food or Destinations'}, 'entity': {'id': '834828445238431744', 'name': 'Generic Drinks', 'description': 'Generic Drinks'}}, {'domain': {'id': '67', 'name': 'Interests and Hobbies', 'description': 'Interests, opinions, and behaviors of individuals, groups, or cultures; like Speciality Cooking or Theme Parks'}, 'entity': {'id': '850442647088971776', 'name': 'Coffee', 'description': 'Coffee'}}]","{'urls': [{'start': 133, 'end': 156, 'url': 'https://t.co/O2JWqRaXRq', 'expanded_url': 'https://twitter.com/Roblox_RTC/status/1518202797086367744/photo/1', 'display_url': 'pic.twitter.com/O2JWqRaXRq', 'media_key': '3_1518202793957470210'}], 'annotations': [{'start': 12, 'end': 21, 'probability': 0.2269, 'type': 'Other', 'normalized_text': 'Kitty Cafe'}, {'start': 44, 'end': 49, 'probability': 0.682, 'type': 'Organization', 'normalized_text': 'Sanrio'}, {'start': 94, 'end': 99, 'probability': 0.3175, 'type': 'Other', 'normalized_text': 'Roblox'}], 'mentions': [{'start': 56, 'end': 71, 'username': 'RockPandaGames', 'id': '1327135818390114305'}]}",{'media_keys': ['3_1518202793957470210']},False,,everyone,Twitter for iPhone
1517935854383243265,1324836609741725696,"25$ Robux Card Giveaway on Roblox!

Like+Comment+Retweet to Enter https://t.co/xeuXGEMEjz",2022-04-23 18:38:04+00:00,,948,1342,1556,14,en,1517935854383243265,"[{'domain': {'id': '71', 'name': 'Video Game', 'description': 'A video game like Overwatch'}, 'entity': {'id': '1088118927580774400', 'name': 'Roblox', 'description': 'Roblox'}}]","{'urls': [{'start': 66, 'end': 89, 'url': 'https://t.co/xeuXGEMEjz', 'expanded_url': 'https://twitter.com/MLTGaming2/status/1517935854383243265/photo/1', 'display_url': 'pic.twitter.com/xeuXGEMEjz', 'media_key': '3_1517935656592412679'}], 'annotations': [{'start': 27, 'end': 32, 'probability': 0.4193, 'type': 'Product', 'normalized_text': 'Roblox'}]}",{'media_keys': ['3_1517935656592412679']},False,,everyone,Twitter Web App
1518214212178305025,1350723368018853888,"trading roblox acc:
spent 60k+
has two groups (188, 40)
has arachnid queen face
changed user 7 times
has 120 followers 
and has oa set, lvl 114, and Val20 halo in royale high",2022-04-24 13:04:09+00:00,,2,5,1,0,en,1518214212178305025,"[{'domain': {'id': '71', 'name': 'Video Game', 'description': 'A video game like Overwatch'}, 'entity': {'id': '1088118927580774400', 'name': 'Roblox', 'description': 'Roblox'}}, {'domain': {'id': '71', 'name': 'Video Game', 'description': 'A video game like Overwatch'}, 'entity': {'id': '1230882318224510978', 'name': 'Royale High'}}]",,,False,,everyone,Twitter Web App
1517187725417398273,1440838700250796036,"Giving away a baby griffon
Step 1 : Subscribe to me on twt
Step 2 : Subscribe to me on YouTube https://t.co/Se5otrKpUJ
Step 3 : Comment ur user and a pic of proof that u sub",2022-04-21 17:05:16+00:00,,0,1,3,2,en,1517187725417398273,[],"{'urls': [{'start': 95, 'end': 118, 'url': 'https://t.co/Se5otrKpUJ', 'expanded_url': 'https://youtube.com/channel/UCro6NfSYBLeY3YRsjXJNVMQ', 'display_url': 'youtube.com/channel/UCro6N…', 'images': [{'url': 'https://pbs.twimg.com/news_img/1517187768132198400/A524X1HK?format=jpg&name=orig', 'width': 900, 'height': 900}, {'url': 'https://pbs.twimg.com/news_img/1517187768132198400/A524X1HK?format=jpg&name=150x150', 'width': 150, 'height': 150}], 'status': 200, 'title': 'panda the friend of pets - roblox', 'description': 'Share your videos with friends, family, and the world', 'unwound_url': 'https://www.youtube.com/channel/UCro6NfSYBLeY3YRsjXJNVMQ'}], 'annotations': [{'start': 87, 'end': 93, 'probability': 0.5611, 'type': 'Product', 'normalized_text': 'YouTube'}]}",,False,,everyone,Twitter for iPad
