tweetid,author_id,text,created_at,geo,retweets,replies,likes,quote_count,lang,conversation_id,context_annotations,entities,attachments,possibly_sensitive,withheld,reply_settings,source
1534126730570436608,1101376954161229827,Buying your gamepasses! Comment Link! 💙,2022-06-07 10:54:49+00:00,,24,232,157,2,en,1534126641479155712,[],,,False,,everyone,Twitter for Android
1534173914825379842,425871040,"Time to rebuild Tilted, and this time you are the architect.

Design your own building to be constructed in the new Tilted Towers POI and get ready to submit your design once we open up submissions.

Read more: https://t.co/UhpnpTx40W https://t.co/9qin3GN2JM",2022-06-07 14:02:19+00:00,,1313,593,16873,212,en,1534173914825379842,"[{'domain': {'id': '71', 'name': 'Video Game', 'description': 'A video game like Overwatch'}, 'entity': {'id': '974285387987169280', 'name': 'Fortnite', 'description': 'This entity includes all conversation about the franchise, as well as any individual installments in the series, if applicable.\t\t\t'}}]","{'annotations': [{'start': 116, 'end': 128, 'probability': 0.3688, 'type': 'Organization', 'normalized_text': 'Tilted Towers'}], 'urls': [{'start': 211, 'end': 234, 'url': 'https://t.co/UhpnpTx40W', 'expanded_url': 'https://fn.gg/TheBlock2-0', 'display_url': 'fn.gg/TheBlock2-0'}, {'start': 235, 'end': 258, 'url': 'https://t.co/9qin3GN2JM', 'expanded_url': 'https://twitter.com/FortniteGame/status/1534173914825379842/photo/1', 'display_url': 'pic.twitter.com/9qin3GN2JM', 'media_key': '3_1534173849398521856'}]}",{'media_keys': ['3_1534173849398521856']},False,,everyone,Twitter Web App
1534172464250503169,1490784830140952580,"Okay so I have 319 robux, and I need 80 rbx to buy a kit in roblox bedwars 

What kit should I buy??

And if you wanna help me get 80 , you can buy these donations (I appreciate every donating u guys buy and I hope I buy some of ur donations as well)

Gamepass links are in thread",2022-06-07 13:56:33+00:00,,0,6,4,0,en,1534172464250503169,"[{'domain': {'id': '48', 'name': 'Product', 'description': 'Products created by Brands.  Examples: Ford Explorer, Apple iPhone.'}, 'entity': {'id': '1425921713150201858', 'name': 'Xbox Game Pass'}}, {'domain': {'id': '71', 'name': 'Video Game', 'description': 'A video game like Overwatch'}, 'entity': {'id': '1088118927580774400', 'name': 'Roblox', 'description': 'Roblox'}}, {'domain': {'id': '45', 'name': 'Brand Vertical', 'description': 'Top level entities that describe a Brands industry'}, 'entity': {'id': '781974597310615553', 'name': 'Entertainment'}}, {'domain': {'id': '46', 'name': 'Brand Category', 'description': 'Categories within Brand Verticals that narrow down the scope of Brands'}, 'entity': {'id': '781974597218340864', 'name': 'Video Games'}}, {'domain': {'id': '47', 'name': 'Brand', 'description': 'Brands and Companies'}, 'entity': {'id': '10027048851', 'name': 'Xbox'}}, {'domain': {'id': '79', 'name': 'Video Game Hardware', 'description': 'Video Game Hardware'}, 'entity': {'id': '10027048851', 'name': 'Xbox'}}]",,{'poll_ids': ['1534172463264833536']},False,,everyone,Twitter for Android
1534173805475598337,1452453867593945090,@model8197 No I’m a 2D game developer I use Xcode instead,2022-06-07 14:01:53+00:00,,0,1,0,0,en,1533480252239777792,[],"{'mentions': [{'start': 0, 'end': 10, 'username': 'model8197', 'id': '1251677662810042371'}], 'annotations': [{'start': 44, 'end': 48, 'probability': 0.6669, 'type': 'Product', 'normalized_text': 'Xcode'}]}",,False,,everyone,Twitter for iPad
1534126641479155712,1101376954161229827,Do you want robux?,2022-06-07 10:54:28+00:00,,177,1437,628,6,en,1534126641479155712,[],,,False,,everyone,Twitter for Android
1534164939954606080,1187366099655856128,걍 지금 스페 두 분 토크쇼 듣는 기분임 https://t.co/8iq0es6lri https://t.co/Y2sLqY75IU,2022-06-07 13:26:39+00:00,,3,3,8,0,ko,1534164939954606080,[],"{'urls': [{'start': 23, 'end': 46, 'url': 'https://t.co/8iq0es6lri', 'expanded_url': 'https://twitter.com/smoky_in_Roblox/status/1534164939954606080/photo/1', 'display_url': 'pic.twitter.com/8iq0es6lri', 'media_key': '3_1534164856051744768'}, {'start': 47, 'end': 70, 'url': 'https://t.co/Y2sLqY75IU', 'expanded_url': 'https://twitter.com/smoky_in_Roblox/status/1534162475238985728', 'display_url': 'twitter.com/smoky_in_Roblo…'}]}",{'media_keys': ['3_1534164856051744768']},False,,everyone,Twitter Web App
1533989071839965185,1291945442,"Tesla Cybertruck looks unreal 🤯 

Something straight out of Blade Runner

@elonmusk 

https://t.co/0JZ7ryRqav",2022-06-07 01:47:49+00:00,,7243,8453,99901,6210,en,1533989071839965185,"[{'domain': {'id': '86', 'name': 'Movie', 'description': 'A film like Rogue One: A Star Wars Story'}, 'entity': {'id': '1296906517027799040', 'name': 'Blade Runner', 'description': 'Entity about all the movies of the serie.'}}, {'domain': {'id': '87', 'name': 'Movie Genre', 'description': 'A movie genre like Action'}, 'entity': {'id': '856977093191647233', 'name': 'Sci-fi & fantasy films', 'description': 'Sci-fi and fantasy'}}, {'domain': {'id': '87', 'name': 'Movie Genre', 'description': 'A movie genre like Action'}, 'entity': {'id': '1273705270707843075', 'name': 'Thriller films'}}, {'domain': {'id': '10', 'name': 'Person', 'description': 'Named people in the world like Nelson Mandela'}, 'entity': {'id': '808713037230157824', 'name': 'Elon Musk', 'description': 'Elon Musk'}}, {'domain': {'id': '45', 'name': 'Brand Vertical', 'description': 'Top level entities that describe a Brands industry'}, 'entity': {'id': '781972125171060736', 'name': 'Auto'}}, {'domain': {'id': '46', 'name': 'Brand Category', 'description': 'Categories within Brand Verticals that narrow down the scope of Brands'}, 'entity': {'id': '781972125179518977', 'name': 'Auto Manufacturer'}}, {'domain': {'id': '47', 'name': 'Brand', 'description': 'Brands and Companies'}, 'entity': {'id': '10044199219', 'name': 'Tesla Motors'}}, {'domain': {'id': '65', 'name': 'Interests and Hobbies Vertical', 'description': 'Top level interests and hobbies groupings, like Food or Travel'}, 'entity': {'id': '781974596148793345', 'name': 'Business & finance'}}, {'domain': {'id': '65', 'name': 'Interests and Hobbies Vertical', 'description': 'Top level interests and hobbies groupings, like Food or Travel'}, 'entity': {'id': '847528391163092993', 'name': 'Automotive', 'description': 'Car culture'}}, {'domain': {'id': '66', 'name': 'Interests and Hobbies Category', 'description': 'A grouping of interests and hobbies entities, like Novelty Food or Destinations'}, 'entity': {'id': '847528576551337984', 'name': 'Hybrid and electric vehicles', 'description': 'Hybrid and electric vehicles'}}, {'domain': {'id': '66', 'name': 'Interests and Hobbies Category', 'description': 'A grouping of interests and hobbies entities, like Novelty Food or Destinations'}, 'entity': {'id': '847528646185070592', 'name': 'Luxury Cars', 'description': 'Luxury'}}, {'domain': {'id': '66', 'name': 'Interests and Hobbies Category', 'description': 'A grouping of interests and hobbies entities, like Novelty Food or Destinations'}, 'entity': {'id': '857878777191211008', 'name': 'Leadership', 'description': 'Leadership'}}, {'domain': {'id': '30', 'name': 'Entities [Entity Service]', 'description': 'Entity Service top level domain, every item that is in Entity Service should be in this domain'}, 'entity': {'id': '857879456773357569', 'name': 'Technology', 'description': 'Technology'}}]","{'mentions': [{'start': 74, 'end': 83, 'username': 'elonmusk', 'id': '44196397'}], 'annotations': [{'start': 0, 'end': 15, 'probability': 0.6604, 'type': 'Product', 'normalized_text': 'Tesla Cybertruck'}], 'urls': [{'start': 86, 'end': 109, 'url': 'https://t.co/0JZ7ryRqav', 'expanded_url': 'https://twitter.com/teslaownersSV/status/1533973140409200640/video/1', 'display_url': 'pic.twitter.com/0JZ7ryRqav', 'media_key': '7_1533973093474979840'}]}",{'media_keys': ['7_1533973093474979840']},False,,everyone,Twitter Web App
1534173968072347649,1252757803757793280,"@Roblox What is this? I have done all the support tips involved in this, it's still doing it https://t.co/4GzSuFLNci",2022-06-07 14:02:32+00:00,,0,1,0,0,en,1534173968072347649,"[{'domain': {'id': '71', 'name': 'Video Game', 'description': 'A video game like Overwatch'}, 'entity': {'id': '1088118927580774400', 'name': 'Roblox', 'description': 'Roblox'}}]","{'mentions': [{'start': 0, 'end': 7, 'username': 'Roblox', 'id': '16745055'}], 'urls': [{'start': 93, 'end': 116, 'url': 'https://t.co/4GzSuFLNci', 'expanded_url': 'https://twitter.com/theiceobsidian3/status/1534173968072347649/photo/1', 'display_url': 'pic.twitter.com/4GzSuFLNci', 'media_key': '3_1534173955539738624'}]}",{'media_keys': ['3_1534173955539738624']},False,,everyone,Twitter Web App
1533939004864745472,15753118,"This is bad... so apparently there's a script hackers are using in BedWars that will now ""auto report"" players to Roblox for harassment and exploiting if you say ""L hacker"" or ""imagine exploiting"", etc. to a hacker. Expect lots of victims of it. https://t.co/kdYPtAa2sl",2022-06-06 22:28:52+00:00,,152,285,1601,46,en,1533939004864745472,"[{'domain': {'id': '71', 'name': 'Video Game', 'description': 'A video game like Overwatch'}, 'entity': {'id': '1088118927580774400', 'name': 'Roblox', 'description': 'Roblox'}}]","{'annotations': [{'start': 114, 'end': 119, 'probability': 0.4173, 'type': 'Organization', 'normalized_text': 'Roblox'}], 'urls': [{'start': 246, 'end': 269, 'url': 'https://t.co/kdYPtAa2sl', 'expanded_url': 'https://twitter.com/darkviper/status/1533939004864745472/photo/1', 'display_url': 'pic.twitter.com/kdYPtAa2sl', 'media_key': '3_1533938557844221952'}]}",{'media_keys': ['3_1533938557844221952']},False,,everyone,Twitter Web App
1533608221331554308,1298803792423550976,"Okay, tell me you’re lgbtq+ without telling me you’re lgbtq+",2022-06-06 00:34:27+00:00,,99,1933,6391,703,en,1533608221331554308,[],,,False,,everyone,Twitter for iPhone
1532114239413813248,1410101969872588803,"Oh yeah I forgot to tell you guys that Cheeky v4 is cancelled. Sorry, but the mod just caused the team too much stress and its discord server was deleted.",2022-06-01 21:37:54+00:00,,9,7,30,4,en,1532114239413813248,"[{'domain': {'id': '47', 'name': 'Brand', 'description': 'Brands and Companies'}, 'entity': {'id': '1168499224297656321', 'name': 'Discord'}}, {'domain': {'id': '165', 'name': 'Technology', 'description': 'for individual and types of technology, e.g., food technology, 3D printing'}, 'entity': {'id': '1196446161223028736', 'name': 'Social media'}}]",,,False,,everyone,Twitter Web App
1534173645752324099,1532135507643142144,"@Shrimp_Teeth Twitter locks me out of my account.
Had Spilled Soda who wasn't able to see one of my Tweets (my mutual)
Bans you for making a alternative of your OC.

Roblox moderation right here everyone.",2022-06-07 14:01:15+00:00,,0,1,1,0,en,1534150743179010049,"[{'domain': {'id': '71', 'name': 'Video Game', 'description': 'A video game like Overwatch'}, 'entity': {'id': '1088118927580774400', 'name': 'Roblox', 'description': 'Roblox'}}, {'domain': {'id': '46', 'name': 'Brand Category', 'description': 'Categories within Brand Verticals that narrow down the scope of Brands'}, 'entity': {'id': '781974596752842752', 'name': 'Services'}}, {'domain': {'id': '47', 'name': 'Brand', 'description': 'Brands and Companies'}, 'entity': {'id': '10045225402', 'name': 'Twitter'}}]","{'mentions': [{'start': 0, 'end': 13, 'username': 'Shrimp_Teeth', 'id': '1306923565313331200'}]}",,False,,everyone,Twitter for Android
1527446153888821248,16745055,"In the upcoming experience Arcane Odyssey by @_vetex, ships can be customized from sails to hull to figurehead. How will your crew rule the seas? https://t.co/xvJHIm8qvs",2022-05-20 00:28:36+00:00,,306,1054,4307,25,en,1527446153888821248,"[{'domain': {'id': '71', 'name': 'Video Game', 'description': 'A video game like Overwatch'}, 'entity': {'id': '1088118927580774400', 'name': 'Roblox', 'description': 'Roblox'}}]","{'mentions': [{'start': 45, 'end': 52, 'username': '_vetex', 'id': '788941753369767936'}], 'annotations': [{'start': 27, 'end': 40, 'probability': 0.4286, 'type': 'Other', 'normalized_text': 'Arcane Odyssey'}], 'urls': [{'start': 146, 'end': 169, 'url': 'https://t.co/xvJHIm8qvs', 'expanded_url': 'https://twitter.com/Roblox/status/1527446153888821248/photo/1', 'display_url': 'pic.twitter.com/xvJHIm8qvs', 'media_key': '3_1527445846903599104'}]}",{'media_keys': ['3_1527445846903599104']},False,,everyone,Twitter Web App
1534167822645215233,1356590370902077441,"how was your day everyone? rate it to 1 out of 10 !

– one interesting answer can win 50 #robux must be following !",2022-06-07 13:38:07+00:00,,17,38,50,2,en,1534167822645215233,"[{'domain': {'id': '71', 'name': 'Video Game', 'description': 'A video game like Overwatch'}, 'entity': {'id': '1088118927580774400', 'name': 'Roblox', 'description': 'Roblox'}}]","{'hashtags': [{'start': 89, 'end': 95, 'tag': 'robux'}]}",,False,,mentionedUsers,Twitter for iPhone
1534172914202861573,1487495719485378562,@yokomiz0_0 Now I’m just concerned,2022-06-07 13:58:20+00:00,,0,1,0,0,en,1534172486316675072,[],"{'mentions': [{'start': 0, 'end': 11, 'username': 'yokomiz0_0', 'id': '1465573058958135299'}]}",,False,,everyone,Twitter Web App
1534172678759882754,1306923565313331200,@beans2_cheese YEAH APPARENTLY SO,2022-06-07 13:57:24+00:00,,0,1,1,0,en,1534150743179010049,[],"{'mentions': [{'start': 0, 'end': 14, 'username': 'beans2_cheese', 'id': '1532135507643142144'}]}",,False,,everyone,Twitter Web App
1534173254033743872,1514096104614342656,"@Fnafback_better @AviFunkin Used to play fnaf Roblox games allll the time
Then I didn't https://t.co/HAke7hRbyb",2022-06-07 13:59:41+00:00,,0,3,1,0,en,1533754159748599809,"[{'domain': {'id': '71', 'name': 'Video Game', 'description': 'A video game like Overwatch'}, 'entity': {'id': '856562205210198020', 'name': ""Five Nights at Freddy's"", 'description': 'This entity includes all conversation about the franchise, as well as any individual installments in the series, if applicable.\t\t\t'}}, {'domain': {'id': '71', 'name': 'Video Game', 'description': 'A video game like Overwatch'}, 'entity': {'id': '1088118927580774400', 'name': 'Roblox', 'description': 'Roblox'}}]","{'mentions': [{'start': 0, 'end': 16, 'username': 'Fnafback_better', 'id': '1467170688918249476'}, {'start': 17, 'end': 27, 'username': 'AviFunkin', 'id': '1512359464086691841'}], 'annotations': [{'start': 41, 'end': 51, 'probability': 0.4204, 'type': 'Other', 'normalized_text': 'fnaf Roblox'}], 'urls': [{'start': 88, 'end': 111, 'url': 'https://t.co/HAke7hRbyb', 'expanded_url': 'https://twitter.com/fnfkingdom/status/1534173254033743872/video/1', 'display_url': 'pic.twitter.com/HAke7hRbyb', 'media_key': '7_1534173247155187713'}]}",{'media_keys': ['7_1534173247155187713']},False,,everyone,Twitter for Android
1534019278046777344,1379556287659307009,"𝙳𝚘𝚍𝚘 𝚐𝚒𝚟𝚎𝚊𝚠𝚊𝚢!🌸💙

𝚁𝚞𝚕𝚎𝚜
𝙻𝚒𝚔𝚎
𝚁𝚝 𝚠 𝚝𝚊𝚐𝚜
𝙰𝚗𝚍 𝚏𝚘𝚕𝚕𝚘𝚠!

𝙽𝚘 𝚎𝚡𝚝𝚛𝚊𝚜 𝚐𝚘𝚘𝚍 𝚕𝚞𝚌𝚔 https://t.co/FjI95XT9bb",2022-06-07 03:47:51+00:00,,35,40,48,38,en,1534019278046777344,[],"{'urls': [{'start': 72, 'end': 95, 'url': 'https://t.co/FjI95XT9bb', 'expanded_url': 'https://twitter.com/Itz_amxy/status/1534019278046777344/photo/1', 'display_url': 'pic.twitter.com/FjI95XT9bb', 'media_key': '3_1534019263614296064'}]}",{'media_keys': ['3_1534019263614296064']},False,,everyone,Twitter for iPhone
1534163871501389824,1101376954161229827,When did you start playing Roblox?,2022-06-07 13:22:25+00:00,,22,386,199,1,en,1534163871501389824,"[{'domain': {'id': '71', 'name': 'Video Game', 'description': 'A video game like Overwatch'}, 'entity': {'id': '1088118927580774400', 'name': 'Roblox', 'description': 'Roblox'}}]","{'annotations': [{'start': 27, 'end': 32, 'probability': 0.4792, 'type': 'Product', 'normalized_text': 'Roblox'}]}",,False,,everyone,Twitter for Android
1533917610978443265,1148620012418211843,@badimo @Roblox Who wants my torpedo and arachnid for free.. 🤭,2022-06-06 21:03:51+00:00,,3,73,62,0,en,1533909401374818305,"[{'domain': {'id': '71', 'name': 'Video Game', 'description': 'A video game like Overwatch'}, 'entity': {'id': '1088118927580774400', 'name': 'Roblox', 'description': 'Roblox'}}]","{'mentions': [{'start': 0, 'end': 7, 'username': 'badimo', 'id': '858065622097436672'}, {'start': 8, 'end': 15, 'username': 'Roblox', 'id': '16745055'}]}",,False,,everyone,Twitter for iPhone
1534019580884094977,984846690908823553,"I feel so free not being tied to Apple devices. And yet my father-in-law reminds me weekly how I pay the ""Windows tax"". He's 100% Linux (suse) &amp; I'm jealous of that.

If I could run Roblox in Linux without weird hacks, I'd switch over.",2022-06-07 03:49:03+00:00,,1,8,65,0,en,1534019580884094977,"[{'domain': {'id': '46', 'name': 'Brand Category', 'description': 'Categories within Brand Verticals that narrow down the scope of Brands'}, 'entity': {'id': '781974596752842752', 'name': 'Services'}}, {'domain': {'id': '47', 'name': 'Brand', 'description': 'Brands and Companies'}, 'entity': {'id': '10026364281', 'name': 'Apple'}}, {'domain': {'id': '47', 'name': 'Brand', 'description': 'Brands and Companies'}, 'entity': {'id': '10027232467', 'name': 'Microsoft'}}, {'domain': {'id': '48', 'name': 'Product', 'description': 'Products created by Brands.  Examples: Ford Explorer, Apple iPhone.'}, 'entity': {'id': '10027604610', 'name': 'Microsoft Windows'}}, {'domain': {'id': '30', 'name': 'Entities [Entity Service]', 'description': 'Entity Service top level domain, every item that is in Entity Service should be in this domain'}, 'entity': {'id': '848920371311001600', 'name': 'Technology', 'description': 'Technology and computing'}}, {'domain': {'id': '71', 'name': 'Video Game', 'description': 'A video game like Overwatch'}, 'entity': {'id': '1088118927580774400', 'name': 'Roblox', 'description': 'Roblox'}}, {'domain': {'id': '30', 'name': 'Entities [Entity Service]', 'description': 'Entity Service top level domain, every item that is in Entity Service should be in this domain'}, 'entity': {'id': '848920371311001600', 'name': 'Technology', 'description': 'Technology and computing'}}, {'domain': {'id': '66', 'name': 'Interests and Hobbies Category', 'description': 'A grouping of interests and hobbies entities, like Novelty Food or Destinations'}, 'entity': {'id': '848959431836487680', 'name': 'Linux', 'description': 'Linux'}}]","{'annotations': [{'start': 33, 'end': 37, 'probability': 0.5447, 'type': 'Product', 'normalized_text': 'Apple'}, {'start': 182, 'end': 187, 'probability': 0.4295, 'type': 'Product', 'normalized_text': 'Roblox'}, {'start': 192, 'end': 196, 'probability': 0.6534, 'type': 'Product', 'normalized_text': 'Linux'}]}",,False,,everyone,Twitter for Android
1533914950476959747,1339814244636868608,"si m necesitan no estoy, estoy jugando roblox sola ahogandome en mi depresión escuchando harry's house",2022-06-06 20:53:17+00:00,,0,1,0,0,es,1533914950476959747,"[{'domain': {'id': '71', 'name': 'Video Game', 'description': 'A video game like Overwatch'}, 'entity': {'id': '1088118927580774400', 'name': 'Roblox', 'description': 'Roblox'}}]","{'annotations': [{'start': 89, 'end': 93, 'probability': 0.3748, 'type': 'Person', 'normalized_text': 'harry'}]}",,False,,everyone,Twitter for Android
1534005952277385217,1264910090169024514,"@asimo3089 @badimo @Roblox I like this idea but I don’t know about the Brulee, seems like a controversial topic, maybe replace it with another limited car? https://t.co/DsQcK7cnhZ",2022-06-07 02:54:54+00:00,,2,6,2,0,en,1533909401374818305,"[{'domain': {'id': '71', 'name': 'Video Game', 'description': 'A video game like Overwatch'}, 'entity': {'id': '1088118927580774400', 'name': 'Roblox', 'description': 'Roblox'}}]","{'mentions': [{'start': 0, 'end': 10, 'username': 'asimo3089', 'id': '204563745'}, {'start': 11, 'end': 18, 'username': 'badimo', 'id': '858065622097436672'}, {'start': 19, 'end': 26, 'username': 'Roblox', 'id': '16745055'}], 'urls': [{'start': 156, 'end': 179, 'url': 'https://t.co/DsQcK7cnhZ', 'expanded_url': 'https://twitter.com/BluePumpkinKid/status/1534005952277385217/photo/1', 'display_url': 'pic.twitter.com/DsQcK7cnhZ', 'media_key': '3_1534005944652537857'}]}",{'media_keys': ['3_1534005944652537857']},False,,everyone,Twitter for iPad
1534172778597076998,1467170688918249476,"@fnfkingdom @AviFunkin Yeah that game is good 

(Yeah lmao but Hey its funny )",2022-06-07 13:57:48+00:00,,0,1,1,0,en,1533754159748599809,[],"{'mentions': [{'start': 0, 'end': 11, 'username': 'fnfkingdom', 'id': '1514096104614342656'}, {'start': 12, 'end': 22, 'username': 'AviFunkin', 'id': '1512359464086691841'}]}",,False,,everyone,Twitter for Android
1534172305370533889,1486629951201689600,"50K #RHD GIVEAWAY!
• follow @valxqws 
• like and rt 

- hc in thread https://t.co/n3SMg0mxrN",2022-06-07 13:55:55+00:00,,87,61,94,25,en,1534172305370533889,[],"{'mentions': [{'start': 28, 'end': 36, 'username': 'valxqws', 'id': '1522785856087592961'}], 'hashtags': [{'start': 4, 'end': 8, 'tag': 'RHD'}], 'urls': [{'start': 69, 'end': 92, 'url': 'https://t.co/n3SMg0mxrN', 'expanded_url': 'https://twitter.com/luvhrejohn/status/1534172305370533889/photo/1', 'display_url': 'pic.twitter.com/n3SMg0mxrN', 'media_key': '3_1534172294356287488'}]}",{'media_keys': ['3_1534172294356287488']},False,,everyone,Twitter for iPhone
1533992891781361664,1441683833934385165,"♡ Adopt me giveaway! ♡

Check the picture below for the prize! Ends when I reach 850 subscribers!

🌈HOW TO ENTER:
☆Follow me, Like this post♥️ &amp; Retweet🔄
☆Sub to my YT with 🔔's

https://t.co/xlPsMhCSjb

✨NO EXTRAS✨
Goodluck!😊

#adoptme #roblox #robloxgiveaway #adoptmegw https://t.co/42beP47kaI",2022-06-07 02:03:00+00:00,,28,14,27,0,en,1533992891781361664,"[{'domain': {'id': '71', 'name': 'Video Game', 'description': 'A video game like Overwatch'}, 'entity': {'id': '1088118927580774400', 'name': 'Roblox', 'description': 'Roblox'}}, {'domain': {'id': '71', 'name': 'Video Game', 'description': 'A video game like Overwatch'}, 'entity': {'id': '1229416301245763584', 'name': 'Adopt Me'}}]","{'hashtags': [{'start': 231, 'end': 239, 'tag': 'adoptme'}, {'start': 240, 'end': 247, 'tag': 'roblox'}, {'start': 248, 'end': 263, 'tag': 'robloxgiveaway'}, {'start': 264, 'end': 274, 'tag': 'adoptmegw'}], 'urls': [{'start': 182, 'end': 205, 'url': 'https://t.co/xlPsMhCSjb', 'expanded_url': 'http://youtube.com/c/JazzyPlays', 'display_url': 'youtube.com/c/JazzyPlays'}, {'start': 275, 'end': 298, 'url': 'https://t.co/42beP47kaI', 'expanded_url': 'https://twitter.com/_jazzy_roblox_/status/1533992891781361664/photo/1', 'display_url': 'pic.twitter.com/42beP47kaI', 'media_key': '3_1533992871195705344'}]}",{'media_keys': ['3_1533992871195705344']},False,,everyone,Twitter Web App
1534142696985600000,1423118616061427713,👀👀 skz next? https://t.co/Eh2oASu7r1,2022-06-07 11:58:16+00:00,,0,2,0,0,en,1534142696985600000,"[{'domain': {'id': '71', 'name': 'Video Game', 'description': 'A video game like Overwatch'}, 'entity': {'id': '1088118927580774400', 'name': 'Roblox', 'description': 'Roblox'}}, {'domain': {'id': '55', 'name': 'Music Genre', 'description': 'A category for a musical style, like Pop, Rock, or Rap'}, 'entity': {'id': '888105153038958593', 'name': 'K-pop', 'description': 'K-Pop'}}, {'domain': {'id': '30', 'name': 'Entities [Entity Service]', 'description': 'Entity Service top level domain, every item that is in Entity Service should be in this domain'}, 'entity': {'id': '839159814991167489', 'name': 'Travel', 'description': 'Travel'}}, {'domain': {'id': '66', 'name': 'Interests and Hobbies Category', 'description': 'A grouping of interests and hobbies entities, like Novelty Food or Destinations'}, 'entity': {'id': '839160129752686593', 'name': 'General Travel', 'description': 'General Travel'}}, {'domain': {'id': '67', 'name': 'Interests and Hobbies', 'description': 'Interests, opinions, and behaviors of individuals, groups, or cultures; like Speciality Cooking or Theme Parks'}, 'entity': {'id': '839161975712067584', 'name': 'Travel Actions', 'description': 'This entity includes all conversations about travel and vacation.'}}]","{'urls': [{'start': 13, 'end': 36, 'url': 'https://t.co/Eh2oASu7r1', 'expanded_url': 'https://twitter.com/Spotify/status/1533946839321300993', 'display_url': 'twitter.com/Spotify/status…'}]}",,False,,everyone,Twitter for Android
