tweetid,author_id,text,created_at,geo,retweets,replies,likes,quote_count,lang,conversation_id,context_annotations,entities,attachments,possibly_sensitive,withheld,reply_settings,source
1515756478774362117,1310688804441817088,"I would like to extend my best wishes to all, even the haters and losers, on this special Easter day",2022-04-17 18:18:00+00:00,,2,9,54,0,en,1515756478774362117,"[{'domain': {'id': '29', 'name': 'Events [Entity Service]', 'description': 'Entity Service related Events domain'}, 'entity': {'id': '1372917575357591554', 'name': 'Easter', 'description': 'this entity for all conversations for Easter all year '}}, {'domain': {'id': '119', 'name': 'Holiday', 'description': 'Holidays like Christmas or Halloween'}, 'entity': {'id': '1372917575357591554', 'name': 'Easter', 'description': 'this entity for all conversations for Easter all year '}}]",,,False,,everyone,Twitter Web App
1522971884870119424,1515057867572846600,"A crazy thing just happened...

Both main devs @Craze_Croc and @Scottyjock1 have had a deadly Roblox Studio error as you can see below. @Roblox please fix this issue... https://t.co/CmhyNm81kC",2022-05-07 16:09:27+00:00,,1,1,4,0,en,1522971884870119424,"[{'domain': {'id': '71', 'name': 'Video Game', 'description': 'A video game like Overwatch'}, 'entity': {'id': '1088118927580774400', 'name': 'Roblox', 'description': 'Roblox'}}]","{'annotations': [{'start': 94, 'end': 106, 'probability': 0.3329, 'type': 'Other', 'normalized_text': 'Roblox Studio'}], 'urls': [{'start': 169, 'end': 192, 'url': 'https://t.co/CmhyNm81kC', 'expanded_url': 'https://twitter.com/TeamCrocGames/status/1522971884870119424/video/1', 'display_url': 'pic.twitter.com/CmhyNm81kC', 'media_key': '7_1522971803131559937'}], 'mentions': [{'start': 47, 'end': 58, 'username': 'Craze_Croc', 'id': '1476660488863948811'}, {'start': 63, 'end': 75, 'username': 'Scottyjock1', 'id': '1477323142112686084'}, {'start': 136, 'end': 143, 'username': 'Roblox', 'id': '16745055'}]}",{'media_keys': ['7_1522971803131559937']},False,,everyone,Twitter Web App
1522668061899333632,1056053249470541824,"Roblox has UPDATED THE penguin package and players are UPSET 😡

Popular YouTubers such as Flamingo use the outfit and their outfits are now ruined with feathers 😔

What do you think? https://t.co/H1qj1ikEBP",2022-05-06 20:02:10+00:00,,412,743,11427,117,en,1522668061899333632,"[{'domain': {'id': '71', 'name': 'Video Game', 'description': 'A video game like Overwatch'}, 'entity': {'id': '1088118927580774400', 'name': 'Roblox', 'description': 'Roblox'}}]","{'annotations': [{'start': 0, 'end': 5, 'probability': 0.4729, 'type': 'Organization', 'normalized_text': 'Roblox'}], 'urls': [{'start': 183, 'end': 206, 'url': 'https://t.co/H1qj1ikEBP', 'expanded_url': 'https://twitter.com/Roblox_RTC/status/1522668061899333632/photo/1', 'display_url': 'pic.twitter.com/H1qj1ikEBP', 'media_key': '3_1522668058866765827'}, {'start': 183, 'end': 206, 'url': 'https://t.co/H1qj1ikEBP', 'expanded_url': 'https://twitter.com/Roblox_RTC/status/1522668061899333632/photo/1', 'display_url': 'pic.twitter.com/H1qj1ikEBP', 'media_key': '3_1522668058871013379'}]}","{'media_keys': ['3_1522668058866765827', '3_1522668058871013379']}",False,,everyone,Twitter for iPhone
1515767139365531661,1310688804441817088,Just saw one of the worst documents ever made against me. Showing a plethora of quickly stitched out of context meme messages on the old (nuked) discord server. Deliberatly trying to spin a false narrative about me. INCLUDING old situations previously debunked before. Embarassing,2022-04-17 19:00:22+00:00,,6,18,54,1,en,1515767139365531661,"[{'domain': {'id': '47', 'name': 'Brand', 'description': 'Brands and Companies'}, 'entity': {'id': '1168499224297656321', 'name': 'Discord'}}, {'domain': {'id': '165', 'name': 'Technology', 'description': 'for individual and types of technology, e.g., food technology, 3D printing'}, 'entity': {'id': '1196446161223028736', 'name': 'Social media'}}]",,,False,,everyone,Twitter Web App
1522682091325902848,16745055,"How you wear them says a lot about you. But no matter what size and shape your avatar is, you'll wear these jeans well. Available now: https://t.co/7v25TLSvkr https://t.co/XHmiGJHLPf",2022-05-06 20:57:55+00:00,,162,1223,3623,36,en,1522682091325902848,"[{'domain': {'id': '65', 'name': 'Interests and Hobbies Vertical', 'description': 'Top level interests and hobbies groupings, like Food or Travel'}, 'entity': {'id': '844603730221707264', 'name': 'Fashion', 'description': 'Fashion'}}, {'domain': {'id': '67', 'name': 'Interests and Hobbies', 'description': 'Interests, opinions, and behaviors of individuals, groups, or cultures; like Speciality Cooking or Theme Parks'}, 'entity': {'id': '1006277139233103872', 'name': 'Behavior around fashion', 'description': 'Behavior around Fashion'}}, {'domain': {'id': '71', 'name': 'Video Game', 'description': 'A video game like Overwatch'}, 'entity': {'id': '1088118927580774400', 'name': 'Roblox', 'description': 'Roblox'}}]","{'urls': [{'start': 135, 'end': 158, 'url': 'https://t.co/7v25TLSvkr', 'expanded_url': 'https://rblx.co/pants', 'display_url': 'rblx.co/pants'}, {'start': 159, 'end': 182, 'url': 'https://t.co/XHmiGJHLPf', 'expanded_url': 'https://twitter.com/Roblox/status/1522682091325902848/photo/1', 'display_url': 'pic.twitter.com/XHmiGJHLPf', 'media_key': '3_1522681958383308800'}]}",{'media_keys': ['3_1522681958383308800']},False,,everyone,Twitter Web App
1522965477789741057,1209199140741242880,Just uploaded my last glitch build video. I'm not going to build or record any speed build videos. It was so much fun to do builds but it started to get so stressful such as the number of bucks I spent and saving up for them all felt like a must for me (read comments),2022-05-07 15:43:59+00:00,,5,2,40,2,en,1522965477789741057,[],,,False,,mentionedUsers,Twitter for iPhone
1522692426317668356,1221248920581550080,@AlbertsStuff @Roblox_RTC Albert we will have to do an Aztec ritual where you put us one by one on a stone and take our hearts out using a razor-sharp obsidian blade to pay respects for Cleetus! Then toss our lifeless bodies down the steps of the towering Flamingo temple that's how we can fix all of this!,2022-05-06 21:38:59+00:00,,1,3,54,0,en,1522668061899333632,[],"{'annotations': [{'start': 26, 'end': 31, 'probability': 0.5528, 'type': 'Person', 'normalized_text': 'Albert'}, {'start': 186, 'end': 192, 'probability': 0.2644, 'type': 'Person', 'normalized_text': 'Cleetus'}], 'mentions': [{'start': 0, 'end': 13, 'username': 'AlbertsStuff', 'id': '2850532049'}, {'start': 14, 'end': 25, 'username': 'Roblox_RTC', 'id': '1056053249470541824'}]}",,False,,everyone,Twitter for Android
1522969272338821122,3278122105,I GOT THIS ON THE XBOX LMFAOOOOOOOOOOO https://t.co/mkhNkU8QkD,2022-05-07 15:59:04+00:00,,0,4,16,0,en,1522969272338821122,"[{'domain': {'id': '45', 'name': 'Brand Vertical', 'description': 'Top level entities that describe a Brands industry'}, 'entity': {'id': '781974597310615553', 'name': 'Entertainment'}}, {'domain': {'id': '46', 'name': 'Brand Category', 'description': 'Categories within Brand Verticals that narrow down the scope of Brands'}, 'entity': {'id': '781974597218340864', 'name': 'Video Games'}}, {'domain': {'id': '47', 'name': 'Brand', 'description': 'Brands and Companies'}, 'entity': {'id': '10027048851', 'name': 'Xbox'}}, {'domain': {'id': '79', 'name': 'Video Game Hardware', 'description': 'Video Game Hardware'}, 'entity': {'id': '10027048851', 'name': 'Xbox'}}]","{'annotations': [{'start': 18, 'end': 21, 'probability': 0.6963, 'type': 'Product', 'normalized_text': 'XBOX'}], 'urls': [{'start': 39, 'end': 62, 'url': 'https://t.co/mkhNkU8QkD', 'expanded_url': 'https://twitter.com/getchell__/status/1522969272338821122/photo/1', 'display_url': 'pic.twitter.com/mkhNkU8QkD', 'media_key': '3_1522969249895092225'}]}",{'media_keys': ['3_1522969249895092225']},False,,everyone,Xbox One Social
1450210103609733122,2996211503,"Hi there! Thanks for checking out my Twitter! Here is where else I am on the Internet! 
🎥: https://t.co/3rCIzjWv2C
🎶: https://t.co/nNjtfbn45C 
📸: https://t.co/Kxwbkg13xU

Literally Everywhere Else (Discord, Roblox, Merch, Etc)
https://t.co/Nt3UwR8lSl https://t.co/ZcEf416c2B",2021-10-18 21:20:06+00:00,,45,387,886,3,en,1450210103609733122,"[{'domain': {'id': '46', 'name': 'Brand Category', 'description': 'Categories within Brand Verticals that narrow down the scope of Brands'}, 'entity': {'id': '781974596752842752', 'name': 'Services'}}, {'domain': {'id': '47', 'name': 'Brand', 'description': 'Brands and Companies'}, 'entity': {'id': '10045225402', 'name': 'Twitter'}}, {'domain': {'id': '47', 'name': 'Brand', 'description': 'Brands and Companies'}, 'entity': {'id': '1168499224297656321', 'name': 'Discord'}}, {'domain': {'id': '71', 'name': 'Video Game', 'description': 'A video game like Overwatch'}, 'entity': {'id': '1088118927580774400', 'name': 'Roblox', 'description': 'Roblox'}}]","{'annotations': [{'start': 37, 'end': 43, 'probability': 0.8145, 'type': 'Product', 'normalized_text': 'Twitter'}], 'urls': [{'start': 91, 'end': 114, 'url': 'https://t.co/3rCIzjWv2C', 'expanded_url': 'http://youtube.com/NightFoxx', 'display_url': 'youtube.com/NightFoxx', 'images': [{'url': 'https://pbs.twimg.com/news_img/1540693790469623809/XvLVpsz9?format=jpg&name=orig', 'width': 900, 'height': 900}, {'url': 'https://pbs.twimg.com/news_img/1540693790469623809/XvLVpsz9?format=jpg&name=150x150', 'width': 150, 'height': 150}], 'status': 200, 'title': 'NightFoxx', 'description': ""Subscribe for a taco! :) Hi, I'm NightFoxx. Nice to meet you! I make Roblox videos! Stay awhile! Accomplishments: - 500k in December of 2021 - Given away over 1 million robux on the channel - Given away 1,000s of items to players to help them succeed in the game they were playing - Got 2nd in the 2021 Roblox Traitor Tournament - Competed in MrBeast IRL Squid Game - Made videos with my kids (yes I'm a dad) - Trolled some of the biggest youtubers on the platform - All around fun guy - There's more... I just haven't thought of them yet."", 'unwound_url': 'https://www.youtube.com/NightFoxx'}, {'start': 118, 'end': 141, 'url': 'https://t.co/nNjtfbn45C', 'expanded_url': 'http://tiktok.com/@MrNightfoxx', 'display_url': 'tiktok.com/@MrNightfoxx'}, {'start': 146, 'end': 169, 'url': 'https://t.co/Kxwbkg13xU', 'expanded_url': 'http://instagram.com/MrNightFoxx', 'display_url': 'instagram.com/MrNightFoxx'}, {'start': 227, 'end': 250, 'url': 'https://t.co/Nt3UwR8lSl', 'expanded_url': 'http://solo.to/nightfoxx', 'display_url': 'solo.to/nightfoxx'}, {'start': 251, 'end': 274, 'url': 'https://t.co/ZcEf416c2B', 'expanded_url': 'https://twitter.com/MrNightfoxx/status/1450210103609733122/photo/1', 'display_url': 'pic.twitter.com/ZcEf416c2B', 'media_key': '16_1450210078934642689'}]}",{'media_keys': ['16_1450210078934642689']},False,,everyone,Twitter Web App
1521449221261602817,17230018,Pack your bags! This is your invite to #SpotifyIsland 🏝️ Scroll down for a tour or jump right in on @Roblox now 👉 https://t.co/jrp6JawnSU https://t.co/UBFYXf28BP,2022-05-03 11:18:56+00:00,,234,254,1999,87,en,1521449221261602817,"[{'domain': {'id': '45', 'name': 'Brand Vertical', 'description': 'Top level entities that describe a Brands industry'}, 'entity': {'id': '781974597310615553', 'name': 'Entertainment'}}, {'domain': {'id': '46', 'name': 'Brand Category', 'description': 'Categories within Brand Verticals that narrow down the scope of Brands'}, 'entity': {'id': '781974597222535168', 'name': 'Online Services'}}, {'domain': {'id': '47', 'name': 'Brand', 'description': 'Brands and Companies'}, 'entity': {'id': '10040276669', 'name': 'Spotify'}}, {'domain': {'id': '67', 'name': 'Interests and Hobbies', 'description': 'Interests, opinions, and behaviors of individuals, groups, or cultures; like Speciality Cooking or Theme Parks'}, 'entity': {'id': '1288826829634035714', 'name': 'Backstage'}}, {'domain': {'id': '71', 'name': 'Video Game', 'description': 'A video game like Overwatch'}, 'entity': {'id': '1088118927580774400', 'name': 'Roblox', 'description': 'Roblox'}}]","{'urls': [{'start': 114, 'end': 137, 'url': 'https://t.co/jrp6JawnSU', 'expanded_url': 'http://roblox.com/spotify', 'display_url': 'roblox.com/spotify'}, {'start': 138, 'end': 161, 'url': 'https://t.co/UBFYXf28BP', 'expanded_url': 'https://twitter.com/Spotify/status/1521449221261602817/photo/1', 'display_url': 'pic.twitter.com/UBFYXf28BP', 'media_key': '16_1521449008149024768'}], 'mentions': [{'start': 100, 'end': 107, 'username': 'Roblox', 'id': '16745055'}], 'hashtags': [{'start': 39, 'end': 53, 'tag': 'SpotifyIsland'}]}",{'media_keys': ['16_1521449008149024768']},False,,everyone,Twitter Web App
1517423976053624832,1310688804441817088,"LOL The ROBLOX scammer SlikSid, just made a video on his (most likely) alt channel called TheGamerKH, exposing me!!! 😭😭😭 https://t.co/Ixt5Dj0CUI",2022-04-22 08:44:02+00:00,,9,34,109,0,en,1517423976053624832,"[{'domain': {'id': '71', 'name': 'Video Game', 'description': 'A video game like Overwatch'}, 'entity': {'id': '1088118927580774400', 'name': 'Roblox', 'description': 'Roblox'}}]","{'annotations': [{'start': 23, 'end': 29, 'probability': 0.4696, 'type': 'Person', 'normalized_text': 'SlikSid'}, {'start': 90, 'end': 99, 'probability': 0.4895, 'type': 'Person', 'normalized_text': 'TheGamerKH'}], 'urls': [{'start': 121, 'end': 144, 'url': 'https://t.co/Ixt5Dj0CUI', 'expanded_url': 'https://twitter.com/Parlo_ROBLOX/status/1517423976053624832/photo/1', 'display_url': 'pic.twitter.com/Ixt5Dj0CUI', 'media_key': '3_1517423717403480064'}]}",{'media_keys': ['3_1517423717403480064']},False,,everyone,Twitter Web App
1522949069932482561,2996211503,"I bought so many Pet Simulator X plushies that I could bury myself alive with them. Best part is... I'm giving them all away! Go watch my latest vid!

https://t.co/uNaUsaQDUj https://t.co/TVQxUuCYQP",2022-05-07 14:38:47+00:00,,38,198,283,5,en,1522949069932482561,[],"{'annotations': [{'start': 17, 'end': 40, 'probability': 0.3723, 'type': 'Product', 'normalized_text': 'Pet Simulator X plushies'}], 'urls': [{'start': 151, 'end': 174, 'url': 'https://t.co/uNaUsaQDUj', 'expanded_url': 'https://youtube.com/nightfoxx', 'display_url': 'youtube.com/nightfoxx'}, {'start': 175, 'end': 198, 'url': 'https://t.co/TVQxUuCYQP', 'expanded_url': 'https://twitter.com/MrNightfoxx/status/1522949069932482561/photo/1', 'display_url': 'pic.twitter.com/TVQxUuCYQP', 'media_key': '3_1522949061330059264'}]}",{'media_keys': ['3_1522949061330059264']},False,,everyone,Twitter Web App
1522952442417401856,1398478331511726081,@PSXLeaksBr @Roblox_RTC_BR Quem que vai gastar 1000 reais em Xbox pra pegar esses personagens horríveis? Kkk,2022-05-07 14:52:12+00:00,,0,2,3,0,pt,1522937356361383936,"[{'domain': {'id': '45', 'name': 'Brand Vertical', 'description': 'Top level entities that describe a Brands industry'}, 'entity': {'id': '781974597310615553', 'name': 'Entertainment'}}, {'domain': {'id': '46', 'name': 'Brand Category', 'description': 'Categories within Brand Verticals that narrow down the scope of Brands'}, 'entity': {'id': '781974597218340864', 'name': 'Video Games'}}, {'domain': {'id': '47', 'name': 'Brand', 'description': 'Brands and Companies'}, 'entity': {'id': '10027048851', 'name': 'Xbox'}}, {'domain': {'id': '79', 'name': 'Video Game Hardware', 'description': 'Video Game Hardware'}, 'entity': {'id': '10027048851', 'name': 'Xbox'}}]","{'annotations': [{'start': 61, 'end': 64, 'probability': 0.8015, 'type': 'Product', 'normalized_text': 'Xbox'}], 'mentions': [{'start': 0, 'end': 11, 'username': 'PSXLeaksBr', 'id': '1463968253068419073'}, {'start': 12, 'end': 26, 'username': 'Roblox_RTC_BR', 'id': '1417587809502826500'}]}",,False,,everyone,Twitter for Android
1522610763042537475,16745055,"Bringing immersive, unique 3D environments to millions of daily users presents a singular technical challenge. In yesterday's #i3d2022 keynote, our Chief Scientist @CasualEffects breaks down how we've approached our global user-driven metaverse.

https://t.co/2MtDxqTXgm",2022-05-06 16:14:29+00:00,,69,269,1339,7,en,1522610763042537475,"[{'domain': {'id': '30', 'name': 'Entities [Entity Service]', 'description': 'Entity Service top level domain, every item that is in Entity Service should be in this domain'}, 'entity': {'id': '848920371311001600', 'name': 'Technology', 'description': 'Technology and computing'}}, {'domain': {'id': '71', 'name': 'Video Game', 'description': 'A video game like Overwatch'}, 'entity': {'id': '1088118927580774400', 'name': 'Roblox', 'description': 'Roblox'}}, {'domain': {'id': '165', 'name': 'Technology', 'description': 'for individual and types of technology, e.g., food technology, 3D printing'}, 'entity': {'id': '848920371311001600', 'name': 'Technology', 'description': 'Technology and computing'}}]","{'urls': [{'start': 247, 'end': 270, 'url': 'https://t.co/2MtDxqTXgm', 'expanded_url': 'https://youtu.be/P-wRgPe8sDs?t=1097', 'display_url': 'youtu.be/P-wRgPe8sDs?t=…'}], 'mentions': [{'start': 164, 'end': 178, 'username': 'CasualEffects', 'id': '455470163'}], 'hashtags': [{'start': 126, 'end': 134, 'tag': 'i3d2022'}]}",,False,,everyone,Twitter Web App
1522722106756243456,888867384404176896,"Roblox just banned you..

Your 1st emoji is your reaction..",2022-05-06 23:36:55+00:00,,187,7055,2972,65,en,1522722106756243456,"[{'domain': {'id': '71', 'name': 'Video Game', 'description': 'A video game like Overwatch'}, 'entity': {'id': '1088118927580774400', 'name': 'Roblox', 'description': 'Roblox'}}]",,,False,,everyone,Twitter for iPhone
1517928093444448256,1310688804441817088,"BROO Lisa Gaming ROBLOX got EXPOSED on DJ Cooks video and i was in it LOOL, crazy! https://t.co/da0MI3q6Fn",2022-04-23 18:07:13+00:00,,26,60,490,6,en,1517928093444448256,"[{'domain': {'id': '71', 'name': 'Video Game', 'description': 'A video game like Overwatch'}, 'entity': {'id': '1088118927580774400', 'name': 'Roblox', 'description': 'Roblox'}}]","{'annotations': [{'start': 5, 'end': 22, 'probability': 0.2221, 'type': 'Other', 'normalized_text': 'Lisa Gaming ROBLOX'}, {'start': 39, 'end': 46, 'probability': 0.6915, 'type': 'Person', 'normalized_text': 'DJ Cooks'}], 'urls': [{'start': 83, 'end': 106, 'url': 'https://t.co/da0MI3q6Fn', 'expanded_url': 'https://twitter.com/Parlo_ROBLOX/status/1517928093444448256/photo/1', 'display_url': 'pic.twitter.com/da0MI3q6Fn', 'media_key': '3_1517927977266429953'}]}",{'media_keys': ['3_1517927977266429953']},False,,everyone,Twitter Web App
1522960511461376001,1393785936614330369,@RosaIsDumb these https://t.co/DMuBNeRp7b,2022-05-07 15:24:15+00:00,,0,1,5,0,en,1522898080076472320,[],"{'urls': [{'start': 18, 'end': 41, 'url': 'https://t.co/DMuBNeRp7b', 'expanded_url': 'https://twitter.com/yuuguang/status/1522960511461376001/photo/1', 'display_url': 'pic.twitter.com/DMuBNeRp7b', 'media_key': '3_1522960508613447681'}], 'mentions': [{'start': 0, 'end': 11, 'username': 'RosaIsDumb', 'id': '1251658782544932866'}]}",{'media_keys': ['3_1522960508613447681']},False,,everyone,Twitter for Android
1522955287308607488,1157476262610444288,abt to buy robux and i pray to the gods above it takes it from my card and not my moms,2022-05-07 15:03:30+00:00,,0,2,2,0,en,1522955287308607488,[],,,False,,everyone,Twitter for iPhone
1522972895642796032,1498107424670195715,"@jjkpjm_ross Yo también, no se jugar roblox. 😔",2022-05-07 16:13:28+00:00,,0,1,0,0,es,1522964164691513345,"[{'domain': {'id': '71', 'name': 'Video Game', 'description': 'A video game like Overwatch'}, 'entity': {'id': '1088118927580774400', 'name': 'Roblox', 'description': 'Roblox'}}]","{'mentions': [{'start': 0, 'end': 12, 'username': 'jjkpjm_ross', 'id': '1343006471538302981'}]}",,False,,everyone,Twitter for Android
1522968347964411904,1448660985636548614,"If i get 123 Likes in 5 hours, @Fl4reH gives me robux. Could use some help here https://t.co/tGXQYo5mqI",2022-05-07 15:55:24+00:00,,23,16,367,6,en,1522968347964411904,[],"{'urls': [{'start': 80, 'end': 103, 'url': 'https://t.co/tGXQYo5mqI', 'expanded_url': 'https://twitter.com/Pix_Playz_/status/1522968347964411904/photo/1', 'display_url': 'pic.twitter.com/tGXQYo5mqI', 'media_key': '3_1522968224035344387'}], 'mentions': [{'start': 31, 'end': 38, 'username': 'Fl4reH', 'id': '1228768535314358272'}]}",{'media_keys': ['3_1522968224035344387']},False,,everyone,Twitter Web App
1522972893327806464,3031071234,"@yKawaiiJuiice2 Entendemos... Nesse caso, tente recuperar o acesso a sua conta seguindo os passos desse guia: https://t.co/iLrOZy5AW7. A gente recomenda q faça o teste através de um dispositivo/navegador conhecido, utilizado anteriormente para acessar a conta. Avisa se deu certo!",2022-05-07 16:13:27+00:00,,0,1,0,0,pt,1522954328998354945,"[{'domain': {'id': '165', 'name': 'Technology', 'description': 'for individual and types of technology, e.g., food technology, 3D printing'}, 'entity': {'id': '1196446161223028736', 'name': 'Social media'}}, {'domain': {'id': '46', 'name': 'Brand Category', 'description': 'Categories within Brand Verticals that narrow down the scope of Brands'}, 'entity': {'id': '781974596752842752', 'name': 'Services'}}, {'domain': {'id': '47', 'name': 'Brand', 'description': 'Brands and Companies'}, 'entity': {'id': '10029382357', 'name': 'YouTube'}}]","{'urls': [{'start': 110, 'end': 133, 'url': 'https://t.co/iLrOZy5AW7', 'expanded_url': 'http://yt.be/help/nr5L', 'display_url': 'yt.be/help/nr5L', 'status': 200, 'title': 'Sign in - Google Accounts', 'unwound_url': 'https://accounts.google.com/signin/v2/recoveryidentifier?flowName=GlifWebSignIn&flowEntry=ServiceLogin'}]}",,False,,everyone,Salesforce - Social Studio
1520428041482121216,1492181230065885184,There is no sound. Btw here's the full vid. Becareful peeps :/ https://t.co/bZhl1LlXPP,2022-04-30 15:41:07+00:00,,7276,19407,79824,845,en,1520428041482121216,[],"{'urls': [{'start': 63, 'end': 86, 'url': 'https://t.co/bZhl1LlXPP', 'expanded_url': 'https://twitter.com/Yo_nanay/status/1520428041482121216/video/1', 'display_url': 'pic.twitter.com/bZhl1LlXPP', 'media_key': '7_1520427594776080384'}]}",{'media_keys': ['7_1520427594776080384']},True,,everyone,Twitter for Android
1522596891368001536,1481807422209802241,"Whos this?

(Wrong answers only) https://t.co/T6xwV2jLR4",2022-05-06 15:19:22+00:00,,9,334,184,2,en,1522596891368001536,[],"{'urls': [{'start': 33, 'end': 56, 'url': 'https://t.co/T6xwV2jLR4', 'expanded_url': 'https://twitter.com/ZoobieYT/status/1522596891368001536/photo/1', 'display_url': 'pic.twitter.com/T6xwV2jLR4', 'media_key': '3_1522596871768018944'}]}",{'media_keys': ['3_1522596871768018944']},False,,everyone,Twitter Web App
1522929296599228417,1436657498920947714,"I'm losing interest in building, grinding, and yt. Not trying to be rude but honestly, I feel annoyed when people keep telling me to build for them. I already said it so many times. I feel like I wanna try something new! maybe like bloxburg? rh? Idk. I'll think about it",2022-05-07 13:20:13+00:00,,1,10,36,0,en,1522929296599228417,[],,,False,,everyone,Twitter Web App
1361596882133258242,945691909124530176,"Cat boy gets rammed by horse cock The Animation
#rr34 https://t.co/PocaQ2NW5s",2021-02-16 08:42:48+00:00,,707,105,6213,18,en,1361596882133258242,[],"{'urls': [{'start': 54, 'end': 77, 'url': 'https://t.co/PocaQ2NW5s', 'expanded_url': 'https://twitter.com/LaggyRR34/status/1361596882133258242/video/1', 'display_url': 'pic.twitter.com/PocaQ2NW5s', 'media_key': '7_1361595643077140484'}], 'hashtags': [{'start': 48, 'end': 53, 'tag': 'rr34'}]}",{'media_keys': ['7_1361595643077140484']},True,,mentionedUsers,Twitter Web App
1522972780102180864,1311368702563176449,@CheekyVisuals You shouldn’t need to say “not lowering” people are just cheap scapes for high quality things,2022-05-07 16:13:00+00:00,,0,1,2,0,en,1522687972726001664,[],"{'mentions': [{'start': 0, 'end': 14, 'username': 'CheekyVisuals', 'id': '2878896063'}]}",,False,,everyone,Twitter for iPhone
1522750096445693952,1375582340634845193,"Say ""the"" and let it autofill.",2022-05-07 01:28:08+00:00,,32,1139,704,45,en,1522750096445693952,[],,,False,,everyone,Twitter Web App
1522679364961193984,1129473457685651458,@Roblox_RTC what the fuck.,2022-05-06 20:47:05+00:00,,15,63,1264,2,en,1522668061899333632,[],"{'mentions': [{'start': 0, 'end': 11, 'username': 'Roblox_RTC', 'id': '1056053249470541824'}]}",,False,,everyone,Twitter Web App
1522971500051156992,1377343775870181379,@Itsyogirl_Neet If it’s not https://t.co/L0XReLPhfA then it’s a fake link.,2022-05-07 16:07:55+00:00,,0,2,3,2,en,1522951769256464385,[],"{'urls': [{'start': 28, 'end': 51, 'url': 'https://t.co/L0XReLPhfA', 'expanded_url': 'http://Roblox.com', 'display_url': 'Roblox.com', 'images': [{'url': 'https://pbs.twimg.com/news_img/1540468325502930946/3LvDqMbG?format=jpg&name=orig', 'width': 1200, 'height': 630}, {'url': 'https://pbs.twimg.com/news_img/1540468325502930946/3LvDqMbG?format=jpg&name=150x150', 'width': 150, 'height': 150}], 'status': 200, 'title': 'Roblox', 'description': 'Roblox is ushering in the next generation of entertainment. Imagine, create, and play together with millions of people across an infinite variety of immersive, user-generated 3D worlds.', 'unwound_url': 'https://www.roblox.com/'}], 'mentions': [{'start': 0, 'end': 15, 'username': 'Itsyogirl_Neet', 'id': '1453481821841371139'}]}",,False,,everyone,Twitter for iPad
