tweetid,author_id,text,created_at,geo,retweets,replies,likes,quote_count,lang,conversation_id,context_annotations,entities,attachments,possibly_sensitive,withheld,reply_settings,source
1518737167169769472,960654612666691585,i LOVE when girls have square faces ???????? so pretty and beautiful,2022-04-25 23:42:12+00:00,,0,1,1,0,en,1518737167169769472,[],,,False,,everyone,Twitter for iPhone
1518737472858910720,1514759414795829250,yo los compro por una página de ig q me los deposita en mi cuenta Bv https://t.co/4oFflO1WVs,2022-04-25 23:43:24+00:00,,0,1,0,0,es,1518737472858910720,[],"{'urls': [{'start': 69, 'end': 92, 'url': 'https://t.co/4oFflO1WVs', 'expanded_url': 'https://t.co/4oFflO1WVs', 'display_url': 't.co/4oFflO1WVs'}]}",,False,,everyone,Twitter for Android
1518736628763684866,2877924500,ok im making server,2022-04-25 23:40:03+00:00,,0,0,2,1,en,1518736628763684866,[],,,False,,everyone,Twitter Web App
1518467239497781248,1099440403432890368,ayo somethings wrong with my hotline https://t.co/86dBGRdHZr,2022-04-25 05:49:36+00:00,,426,19,2593,6,en,1518467239497781248,[],"{'urls': [{'start': 37, 'end': 60, 'url': 'https://t.co/86dBGRdHZr', 'expanded_url': 'https://twitter.com/fyre_bright/status/1518467239497781248/video/1', 'display_url': 'pic.twitter.com/86dBGRdHZr', 'media_key': '7_1518467130731077632'}]}",{'media_keys': ['7_1518467130731077632']},False,,everyone,Twitter Web App
1518736231919722496,1404485071747354630,k son robux https://t.co/7KOhv1ohh5,2022-04-25 23:38:29+00:00,,0,1,0,0,en,1518736231919722496,[],"{'urls': [{'start': 12, 'end': 35, 'url': 'https://t.co/7KOhv1ohh5', 'expanded_url': 'https://t.co/7KOhv1ohh5', 'display_url': 't.co/7KOhv1ohh5'}]}",,False,,everyone,Twitter for iPhone
1518632291622211585,1251677662810042371,"Guess the Roblox game
and win some Robux… https://t.co/XuvHBwyfmO",2022-04-25 16:45:27+00:00,,160,4188,1857,30,en,1518632291622211585,"[{'domain': {'id': '71', 'name': 'Video Game', 'description': 'A video game like Overwatch'}, 'entity': {'id': '1088118927580774400', 'name': 'Roblox', 'description': 'Roblox'}}]","{'urls': [{'start': 42, 'end': 65, 'url': 'https://t.co/XuvHBwyfmO', 'expanded_url': 'https://twitter.com/model8197/status/1518632291622211585/photo/1', 'display_url': 'pic.twitter.com/XuvHBwyfmO', 'media_key': '3_1518632287189016576'}], 'annotations': [{'start': 10, 'end': 15, 'probability': 0.4048, 'type': 'Product', 'normalized_text': 'Roblox'}]}",{'media_keys': ['3_1518632287189016576']},False,,everyone,Twitter for iPhone
1518732331154038790,1312156857193111564,@RELLGames Rell please buff the rarity for gen 3 I been grinding him for 6 hours and no drop this is torture 🥲,2022-04-25 23:22:59+00:00,,0,17,61,0,en,1518732083627233282,[],"{'mentions': [{'start': 0, 'end': 10, 'username': 'RELLGames', 'id': '1059865610530754561'}]}",,False,,everyone,Twitter for iPhone
1518736409787604994,4093077509,elon will not buy roblox stop asking,2022-04-25 23:39:11+00:00,,3,36,240,3,en,1518736409787604994,"[{'domain': {'id': '71', 'name': 'Video Game', 'description': 'A video game like Overwatch'}, 'entity': {'id': '1088118927580774400', 'name': 'Roblox', 'description': 'Roblox'}}]",,,False,,everyone,Twitter for iPhone
1518668363228229632,3025674465,"Elon Musk bought Twitter. It's now time for me to buy Roblox.

How much you want @Roblox",2022-04-25 19:08:47+00:00,,187,510,6868,16,en,1518668363228229632,"[{'domain': {'id': '71', 'name': 'Video Game', 'description': 'A video game like Overwatch'}, 'entity': {'id': '1088118927580774400', 'name': 'Roblox', 'description': 'Roblox'}}, {'domain': {'id': '10', 'name': 'Person', 'description': 'Named people in the world like Nelson Mandela'}, 'entity': {'id': '808713037230157824', 'name': 'Elon Musk', 'description': 'Elon Musk'}}, {'domain': {'id': '46', 'name': 'Brand Category', 'description': 'Categories within Brand Verticals that narrow down the scope of Brands'}, 'entity': {'id': '781974596752842752', 'name': 'Services'}}, {'domain': {'id': '47', 'name': 'Brand', 'description': 'Brands and Companies'}, 'entity': {'id': '10045225402', 'name': 'Twitter'}}, {'domain': {'id': '65', 'name': 'Interests and Hobbies Vertical', 'description': 'Top level interests and hobbies groupings, like Food or Travel'}, 'entity': {'id': '781974596148793345', 'name': 'Business & finance'}}, {'domain': {'id': '66', 'name': 'Interests and Hobbies Category', 'description': 'A grouping of interests and hobbies entities, like Novelty Food or Destinations'}, 'entity': {'id': '857878777191211008', 'name': 'Leadership', 'description': 'Leadership'}}, {'domain': {'id': '30', 'name': 'Entities [Entity Service]', 'description': 'Entity Service top level domain, every item that is in Entity Service should be in this domain'}, 'entity': {'id': '857879456773357569', 'name': 'Technology', 'description': 'Technology'}}]","{'annotations': [{'start': 0, 'end': 8, 'probability': 0.7195, 'type': 'Person', 'normalized_text': 'Elon Musk'}, {'start': 17, 'end': 23, 'probability': 0.6377, 'type': 'Product', 'normalized_text': 'Twitter'}, {'start': 54, 'end': 59, 'probability': 0.6471, 'type': 'Product', 'normalized_text': 'Roblox'}], 'mentions': [{'start': 81, 'end': 88, 'username': 'Roblox', 'id': '16745055'}]}",,False,,everyone,Twitter Web App
1518733996896624641,1309502762556649472,😐👍 just work on a Roblox news video on #Robloxs shity new update / trying to have more fun with the news videos,2022-04-25 23:29:36+00:00,,0,0,0,1,en,1518733996896624641,"[{'domain': {'id': '71', 'name': 'Video Game', 'description': 'A video game like Overwatch'}, 'entity': {'id': '1088118927580774400', 'name': 'Roblox', 'description': 'Roblox'}}]","{'annotations': [{'start': 20, 'end': 25, 'probability': 0.4505, 'type': 'Product', 'normalized_text': 'Roblox'}], 'hashtags': [{'start': 39, 'end': 47, 'tag': 'Robloxs'}]}",,False,,everyone,Twitter Web App
1518736166396346369,1360224426529329155,"🔴¡NOTICIAS! : Actualmente El Filtro de Chat Esta Roto en (My Hello Kitty Cafe)  Y Se Puede Decir Cosas inapropiadas.

📷@Roblox_RTC_BR https://t.co/HfwhvOBsHc https://t.co/Dv5tPAJbPJ",2022-04-25 23:38:13+00:00,,3,8,22,0,es,1518736166396346369,"[{'domain': {'id': '10', 'name': 'Person', 'description': 'Named people in the world like Nelson Mandela'}, 'entity': {'id': '1443277565393719296', 'name': 'Hello Kitty'}}, {'domain': {'id': '45', 'name': 'Brand Vertical', 'description': 'Top level entities that describe a Brands industry'}, 'entity': {'id': '781974596706635776', 'name': 'Retail'}}, {'domain': {'id': '46', 'name': 'Brand Category', 'description': 'Categories within Brand Verticals that narrow down the scope of Brands'}, 'entity': {'id': '781974597302296576', 'name': 'Specialty'}}, {'domain': {'id': '47', 'name': 'Brand', 'description': 'Brands and Companies'}, 'entity': {'id': '1038116841485303808', 'name': 'Sanrio', 'description': 'Sanrio (サンリオ)'}}, {'domain': {'id': '47', 'name': 'Brand', 'description': 'Brands and Companies'}, 'entity': {'id': '1443277565393719296', 'name': 'Hello Kitty'}}, {'domain': {'id': '65', 'name': 'Interests and Hobbies Vertical', 'description': 'Top level interests and hobbies groupings, like Food or Travel'}, 'entity': {'id': '834828264786898945', 'name': 'Drinks', 'description': 'Drinks'}}, {'domain': {'id': '66', 'name': 'Interests and Hobbies Category', 'description': 'A grouping of interests and hobbies entities, like Novelty Food or Destinations'}, 'entity': {'id': '834828445238431744', 'name': 'Generic Drinks', 'description': 'Generic Drinks'}}, {'domain': {'id': '67', 'name': 'Interests and Hobbies', 'description': 'Interests, opinions, and behaviors of individuals, groups, or cultures; like Speciality Cooking or Theme Parks'}, 'entity': {'id': '850442647088971776', 'name': 'Coffee', 'description': 'Coffee'}}, {'domain': {'id': '122', 'name': 'Fictional Character', 'description': 'A person or other being in a narrative work of art, like Tom Sawyer or Jon Snow'}, 'entity': {'id': '1443277565393719296', 'name': 'Hello Kitty'}}, {'domain': {'id': '65', 'name': 'Interests and Hobbies Vertical', 'description': 'Top level interests and hobbies groupings, like Food or Travel'}, 'entity': {'id': '834828264786898945', 'name': 'Drinks', 'description': 'Drinks'}}, {'domain': {'id': '66', 'name': 'Interests and Hobbies Category', 'description': 'A grouping of interests and hobbies entities, like Novelty Food or Destinations'}, 'entity': {'id': '834828445238431744', 'name': 'Generic Drinks', 'description': 'Generic Drinks'}}, {'domain': {'id': '67', 'name': 'Interests and Hobbies', 'description': 'Interests, opinions, and behaviors of individuals, groups, or cultures; like Speciality Cooking or Theme Parks'}, 'entity': {'id': '850442647088971776', 'name': 'Coffee', 'description': 'Coffee'}}]","{'urls': [{'start': 134, 'end': 157, 'url': 'https://t.co/HfwhvOBsHc', 'expanded_url': 'https://twitter.com/NoticiasUgc/status/1518736166396346369/photo/1', 'display_url': 'pic.twitter.com/HfwhvOBsHc', 'media_key': '3_1518735926729613314'}, {'start': 134, 'end': 157, 'url': 'https://t.co/HfwhvOBsHc', 'expanded_url': 'https://twitter.com/NoticiasUgc/status/1518736166396346369/photo/1', 'display_url': 'pic.twitter.com/HfwhvOBsHc', 'media_key': '3_1518735985579810816'}, {'start': 158, 'end': 181, 'url': 'https://t.co/Dv5tPAJbPJ', 'expanded_url': 'https://twitter.com/NoticiasUgc/status/1518723005651824642', 'display_url': 'twitter.com/NoticiasUgc/st…'}], 'annotations': [{'start': 40, 'end': 53, 'probability': 0.3657, 'type': 'Other', 'normalized_text': 'Chat Esta Roto'}, {'start': 59, 'end': 77, 'probability': 0.6273, 'type': 'Other', 'normalized_text': 'My Hello Kitty Cafe'}], 'mentions': [{'start': 119, 'end': 133, 'username': 'Roblox_RTC_BR', 'id': '1417587809502826500'}]}","{'media_keys': ['3_1518735926729613314', '3_1518735985579810816']}",False,,everyone,Twitter Web App
1518726553500274690,1327135818390114305,"Release:
It looks like Tiny Chum found out that the Hello Kitty Cafe is opening on Roblox and decided to join #HelloKitty to lend a helping hand!🎀🫠
#Roblox https://t.co/MJbVDGDL5p",2022-04-25 23:00:01+00:00,,11,19,189,3,en,1518726553500274690,"[{'domain': {'id': '10', 'name': 'Person', 'description': 'Named people in the world like Nelson Mandela'}, 'entity': {'id': '1443277565393719296', 'name': 'Hello Kitty'}}, {'domain': {'id': '47', 'name': 'Brand', 'description': 'Brands and Companies'}, 'entity': {'id': '1443277565393719296', 'name': 'Hello Kitty'}}, {'domain': {'id': '65', 'name': 'Interests and Hobbies Vertical', 'description': 'Top level interests and hobbies groupings, like Food or Travel'}, 'entity': {'id': '834828264786898945', 'name': 'Drinks', 'description': 'Drinks'}}, {'domain': {'id': '66', 'name': 'Interests and Hobbies Category', 'description': 'A grouping of interests and hobbies entities, like Novelty Food or Destinations'}, 'entity': {'id': '834828445238431744', 'name': 'Generic Drinks', 'description': 'Generic Drinks'}}, {'domain': {'id': '67', 'name': 'Interests and Hobbies', 'description': 'Interests, opinions, and behaviors of individuals, groups, or cultures; like Speciality Cooking or Theme Parks'}, 'entity': {'id': '850442647088971776', 'name': 'Coffee', 'description': 'Coffee'}}, {'domain': {'id': '71', 'name': 'Video Game', 'description': 'A video game like Overwatch'}, 'entity': {'id': '1088118927580774400', 'name': 'Roblox', 'description': 'Roblox'}}, {'domain': {'id': '122', 'name': 'Fictional Character', 'description': 'A person or other being in a narrative work of art, like Tom Sawyer or Jon Snow'}, 'entity': {'id': '1443277565393719296', 'name': 'Hello Kitty'}}, {'domain': {'id': '65', 'name': 'Interests and Hobbies Vertical', 'description': 'Top level interests and hobbies groupings, like Food or Travel'}, 'entity': {'id': '834828264786898945', 'name': 'Drinks', 'description': 'Drinks'}}, {'domain': {'id': '66', 'name': 'Interests and Hobbies Category', 'description': 'A grouping of interests and hobbies entities, like Novelty Food or Destinations'}, 'entity': {'id': '834828445238431744', 'name': 'Generic Drinks', 'description': 'Generic Drinks'}}, {'domain': {'id': '67', 'name': 'Interests and Hobbies', 'description': 'Interests, opinions, and behaviors of individuals, groups, or cultures; like Speciality Cooking or Theme Parks'}, 'entity': {'id': '850442647088971776', 'name': 'Coffee', 'description': 'Coffee'}}]","{'urls': [{'start': 156, 'end': 179, 'url': 'https://t.co/MJbVDGDL5p', 'expanded_url': 'https://twitter.com/RockPandaGames/status/1518726553500274690/photo/1', 'display_url': 'pic.twitter.com/MJbVDGDL5p', 'media_key': '3_1518430624398327812'}], 'annotations': [{'start': 23, 'end': 31, 'probability': 0.3615, 'type': 'Person', 'normalized_text': 'Tiny Chum'}, {'start': 52, 'end': 67, 'probability': 0.5186, 'type': 'Other', 'normalized_text': 'Hello Kitty Cafe'}, {'start': 83, 'end': 88, 'probability': 0.3232, 'type': 'Product', 'normalized_text': 'Roblox'}], 'hashtags': [{'start': 110, 'end': 121, 'tag': 'HelloKitty'}, {'start': 148, 'end': 155, 'tag': 'Roblox'}]}",{'media_keys': ['3_1518430624398327812']},False,,everyone,Twitter Web App
1518586878987018240,1281830614392610822,@daalahwastaken @Saulcava1 @plasma_node Honestly idek,2022-04-25 13:45:00+00:00,,0,1,0,0,en,1518487344122241025,[],"{'mentions': [{'start': 0, 'end': 15, 'username': 'daalahwastaken', 'id': '954044032749064193'}, {'start': 16, 'end': 26, 'username': 'Saulcava1', 'id': '1276056962992672768'}, {'start': 27, 'end': 39, 'username': 'plasma_node', 'id': '3266559582'}]}",,False,,everyone,Twitter for iPhone
1518714591274057730,1127098716207366144,Roblox 4 https://t.co/bzI8oAUMmG,2022-04-25 22:12:29+00:00,,1,2,10,0,en,1518714591274057730,"[{'domain': {'id': '71', 'name': 'Video Game', 'description': 'A video game like Overwatch'}, 'entity': {'id': '1088118927580774400', 'name': 'Roblox', 'description': 'Roblox'}}]","{'urls': [{'start': 9, 'end': 32, 'url': 'https://t.co/bzI8oAUMmG', 'expanded_url': 'https://twitter.com/EmpressMamaki/status/1518635379330539520', 'display_url': 'twitter.com/EmpressMamaki/…'}], 'annotations': [{'start': 0, 'end': 7, 'probability': 0.3251, 'type': 'Product', 'normalized_text': 'Roblox 4'}]}",,False,,everyone,Twitter for iPhone
1518479294653210624,1372909329842593798,i just bought a new laptop so i could play the sims 4 and minecraft,2022-04-25 06:37:30+00:00,,0,3,13,0,en,1518479294653210624,"[{'domain': {'id': '45', 'name': 'Brand Vertical', 'description': 'Top level entities that describe a Brands industry'}, 'entity': {'id': '781974597310615553', 'name': 'Entertainment'}}, {'domain': {'id': '46', 'name': 'Brand Category', 'description': 'Categories within Brand Verticals that narrow down the scope of Brands'}, 'entity': {'id': '781974597218340864', 'name': 'Video Games'}}, {'domain': {'id': '71', 'name': 'Video Game', 'description': 'A video game like Overwatch'}, 'entity': {'id': '10043689888', 'name': 'Minecraft'}}, {'domain': {'id': '71', 'name': 'Video Game', 'description': 'A video game like Overwatch'}, 'entity': {'id': '10046004953', 'name': 'The Sims', 'description': 'This entity includes all conversation about the franchise, as well as any individual installments in the series, if applicable. '}}]","{'annotations': [{'start': 47, 'end': 52, 'probability': 0.4363, 'type': 'Product', 'normalized_text': 'sims 4'}, {'start': 58, 'end': 66, 'probability': 0.4473, 'type': 'Product', 'normalized_text': 'minecraft'}]}",,False,,everyone,Twitter for iPhone
1518723691361849346,1347553999554310144,"hear me out, if every follower I have gave me one dollar... 
we couldn't buy twitter from elon but I could buy a very cool gaming PC",2022-04-25 22:48:39+00:00,,0,5,62,0,en,1518723691361849346,"[{'domain': {'id': '79', 'name': 'Video Game Hardware', 'description': 'Video Game Hardware'}, 'entity': {'id': '1174432578503204864', 'name': 'PC gaming'}}, {'domain': {'id': '46', 'name': 'Brand Category', 'description': 'Categories within Brand Verticals that narrow down the scope of Brands'}, 'entity': {'id': '781974596752842752', 'name': 'Services'}}, {'domain': {'id': '47', 'name': 'Brand', 'description': 'Brands and Companies'}, 'entity': {'id': '10045225402', 'name': 'Twitter'}}]","{'annotations': [{'start': 77, 'end': 83, 'probability': 0.6791, 'type': 'Product', 'normalized_text': 'twitter'}]}",,False,,everyone,Twitter for Android
1518696442763771904,1322022120197554176,@ItsAmmon My dead Grandma hacked my Roblox account my username is dhxdhcududxjdcjrucfjjcjr,2022-04-25 21:00:22+00:00,,0,10,11,0,en,1518410350307074048,"[{'domain': {'id': '71', 'name': 'Video Game', 'description': 'A video game like Overwatch'}, 'entity': {'id': '1088118927580774400', 'name': 'Roblox', 'description': 'Roblox'}}]","{'annotations': [{'start': 36, 'end': 41, 'probability': 0.675, 'type': 'Product', 'normalized_text': 'Roblox'}], 'mentions': [{'start': 0, 'end': 9, 'username': 'ItsAmmon', 'id': '1102772383071387648'}]}",,False,,everyone,Twitter for Android
1518708922835771398,1513684877983502339,@Roblox Roblox can I have my roblox account back it was FJHDHDJC and it got deleted for no reason can I please have that back I wanna try my pants with it,2022-04-25 21:49:58+00:00,,0,1,1,0,en,1518643330833272833,"[{'domain': {'id': '71', 'name': 'Video Game', 'description': 'A video game like Overwatch'}, 'entity': {'id': '1088118927580774400', 'name': 'Roblox', 'description': 'Roblox'}}]","{'mentions': [{'start': 0, 'end': 7, 'username': 'Roblox', 'id': '16745055'}]}",,False,,everyone,Twitter for Android
1518723928549593089,1005910726135898112,how much money to buy roblox,2022-04-25 22:49:35+00:00,,11,94,253,1,en,1518723928549593089,"[{'domain': {'id': '71', 'name': 'Video Game', 'description': 'A video game like Overwatch'}, 'entity': {'id': '1088118927580774400', 'name': 'Roblox', 'description': 'Roblox'}}]",,,False,,everyone,Twitter Web App
1518693430003740674,4409081543,when is elon musk going to buy roblox,2022-04-25 20:48:24+00:00,,57,157,1690,6,en,1518693430003740674,"[{'domain': {'id': '71', 'name': 'Video Game', 'description': 'A video game like Overwatch'}, 'entity': {'id': '1088118927580774400', 'name': 'Roblox', 'description': 'Roblox'}}, {'domain': {'id': '10', 'name': 'Person', 'description': 'Named people in the world like Nelson Mandela'}, 'entity': {'id': '808713037230157824', 'name': 'Elon Musk', 'description': 'Elon Musk'}}, {'domain': {'id': '65', 'name': 'Interests and Hobbies Vertical', 'description': 'Top level interests and hobbies groupings, like Food or Travel'}, 'entity': {'id': '781974596148793345', 'name': 'Business & finance'}}, {'domain': {'id': '66', 'name': 'Interests and Hobbies Category', 'description': 'A grouping of interests and hobbies entities, like Novelty Food or Destinations'}, 'entity': {'id': '857878777191211008', 'name': 'Leadership', 'description': 'Leadership'}}, {'domain': {'id': '30', 'name': 'Entities [Entity Service]', 'description': 'Entity Service top level domain, every item that is in Entity Service should be in this domain'}, 'entity': {'id': '857879456773357569', 'name': 'Technology', 'description': 'Technology'}}]","{'annotations': [{'start': 8, 'end': 16, 'probability': 0.5638, 'type': 'Person', 'normalized_text': 'elon musk'}]}",,False,,everyone,Twitter Web App
1518723005651824642,1360224426529329155,"🐱Sanrio

La Experiencias (My Hello Kitty Cafe) Ya Esta Abierto!

➤https://t.co/NCn4DRDuSw https://t.co/8mV3moX0lL https://t.co/RuE5SasoC9",2022-04-25 22:45:55+00:00,,3,2,28,1,es,1518723005651824642,"[{'domain': {'id': '10', 'name': 'Person', 'description': 'Named people in the world like Nelson Mandela'}, 'entity': {'id': '1443277565393719296', 'name': 'Hello Kitty'}}, {'domain': {'id': '45', 'name': 'Brand Vertical', 'description': 'Top level entities that describe a Brands industry'}, 'entity': {'id': '781974596706635776', 'name': 'Retail'}}, {'domain': {'id': '46', 'name': 'Brand Category', 'description': 'Categories within Brand Verticals that narrow down the scope of Brands'}, 'entity': {'id': '781974597302296576', 'name': 'Specialty'}}, {'domain': {'id': '47', 'name': 'Brand', 'description': 'Brands and Companies'}, 'entity': {'id': '1038116841485303808', 'name': 'Sanrio', 'description': 'Sanrio (サンリオ)'}}, {'domain': {'id': '47', 'name': 'Brand', 'description': 'Brands and Companies'}, 'entity': {'id': '1443277565393719296', 'name': 'Hello Kitty'}}, {'domain': {'id': '65', 'name': 'Interests and Hobbies Vertical', 'description': 'Top level interests and hobbies groupings, like Food or Travel'}, 'entity': {'id': '834828264786898945', 'name': 'Drinks', 'description': 'Drinks'}}, {'domain': {'id': '66', 'name': 'Interests and Hobbies Category', 'description': 'A grouping of interests and hobbies entities, like Novelty Food or Destinations'}, 'entity': {'id': '834828445238431744', 'name': 'Generic Drinks', 'description': 'Generic Drinks'}}, {'domain': {'id': '67', 'name': 'Interests and Hobbies', 'description': 'Interests, opinions, and behaviors of individuals, groups, or cultures; like Speciality Cooking or Theme Parks'}, 'entity': {'id': '850442647088971776', 'name': 'Coffee', 'description': 'Coffee'}}, {'domain': {'id': '122', 'name': 'Fictional Character', 'description': 'A person or other being in a narrative work of art, like Tom Sawyer or Jon Snow'}, 'entity': {'id': '1443277565393719296', 'name': 'Hello Kitty'}}, {'domain': {'id': '65', 'name': 'Interests and Hobbies Vertical', 'description': 'Top level interests and hobbies groupings, like Food or Travel'}, 'entity': {'id': '834828264786898945', 'name': 'Drinks', 'description': 'Drinks'}}, {'domain': {'id': '66', 'name': 'Interests and Hobbies Category', 'description': 'A grouping of interests and hobbies entities, like Novelty Food or Destinations'}, 'entity': {'id': '834828445238431744', 'name': 'Generic Drinks', 'description': 'Generic Drinks'}}, {'domain': {'id': '67', 'name': 'Interests and Hobbies', 'description': 'Interests, opinions, and behaviors of individuals, groups, or cultures; like Speciality Cooking or Theme Parks'}, 'entity': {'id': '850442647088971776', 'name': 'Coffee', 'description': 'Coffee'}}]","{'urls': [{'start': 66, 'end': 89, 'url': 'https://t.co/NCn4DRDuSw', 'expanded_url': 'https://www.roblox.com/games/9346039031/My-Hello-Kitty-Cafe', 'display_url': 'roblox.com/games/93460390…', 'images': [{'url': 'https://pbs.twimg.com/news_img/1539827529304997889/bnhUbb-4?format=jpg&name=orig', 'width': 498, 'height': 280}, {'url': 'https://pbs.twimg.com/news_img/1539827529304997889/bnhUbb-4?format=jpg&name=150x150', 'width': 150, 'height': 150}], 'status': 200, 'title': '[Update]My Hello Kitty Cafe', 'description': ""Check out [Update]My Hello Kitty Cafe. It’s one of the millions of unique, user-generated 3D experiences created on Roblox. Welcome to My Hello Kitty Cafe! Join @HelloKitty and Friends in a supercute world full of fun and sweet surprises. Create, manage, and decorate your very own Hello Kitty Cafe while with new friends along the way. 🚨UPDATE LOG🚨 -Add 7-day Father's Day event Find three mystery codes within the time limit combine them and earn a reward -Add PomPompurin Sofa and Coffee Table -Add PomPompurin Guidepost -Add designated production functions at the ordering counter -Add four types of outdoor flooring Optimization -Popularity boost provided by the equipment -Fix some bugs Follow us on Twitter and disd for all redemption codes! Like reward goal 20k likes Code:LIKEKITTYQD2 40k likes Code:LIKEKITTYED2 60k likes Code:LIKEKITTYGD2 80k likes Code:LIKEKITTYDD2 100k likes Code:LIKEKITTYFD2 150k likes Code:LIKEKITTYKD2 250k likes Code:LIKEKITTYXK2 350k likes Mystery Gift Join the "", 'unwound_url': 'https://www.roblox.com/games/9346039031/Pompompurin-My-Hello-Kitty-Cafe?AssetId=9346039031'}, {'start': 90, 'end': 113, 'url': 'https://t.co/8mV3moX0lL', 'expanded_url': 'https://twitter.com/NoticiasUgc/status/1518723005651824642/photo/1', 'display_url': 'pic.twitter.com/8mV3moX0lL', 'media_key': '3_1518722523168444418'}, {'start': 114, 'end': 137, 'url': 'https://t.co/RuE5SasoC9', 'expanded_url': 'https://twitter.com/NoticiasUgc/status/1518245656753803264', 'display_url': 'twitter.com/NoticiasUgc/st…'}], 'annotations': [{'start': 27, 'end': 45, 'probability': 0.3766, 'type': 'Other', 'normalized_text': 'My Hello Kitty Cafe'}]}",{'media_keys': ['3_1518722523168444418']},False,,everyone,Twitter Web App
1511439788720668674,1287263072332263424,@Roblox @hamulgg Fix the damn audios,2022-04-05 20:25:01+00:00,,0,2,0,0,en,1511408448977575940,"[{'domain': {'id': '71', 'name': 'Video Game', 'description': 'A video game like Overwatch'}, 'entity': {'id': '1088118927580774400', 'name': 'Roblox', 'description': 'Roblox'}}]","{'mentions': [{'start': 0, 'end': 7, 'username': 'Roblox', 'id': '16745055'}, {'start': 8, 'end': 16, 'username': 'hamulgg', 'id': '1179964847754117121'}]}",,False,,everyone,Twitter for iPhone
1511437479051767810,1502822274373722115,@Roblox @hamulgg Bring the audio’s back on roblox,2022-04-05 20:15:50+00:00,,0,2,2,0,en,1511408448977575940,"[{'domain': {'id': '71', 'name': 'Video Game', 'description': 'A video game like Overwatch'}, 'entity': {'id': '1088118927580774400', 'name': 'Roblox', 'description': 'Roblox'}}]","{'mentions': [{'start': 0, 'end': 7, 'username': 'Roblox', 'id': '16745055'}, {'start': 8, 'end': 16, 'username': 'hamulgg', 'id': '1179964847754117121'}]}",,False,,everyone,Twitter for iPhone
1518730897654177793,1315055635847929861,moots and non moots drop ur gps,2022-04-25 23:17:17+00:00,,0,7,8,0,en,1518730897654177793,"[{'domain': {'id': '67', 'name': 'Interests and Hobbies', 'description': 'Interests, opinions, and behaviors of individuals, groups, or cultures; like Speciality Cooking or Theme Parks'}, 'entity': {'id': '1037076248877395968', 'name': 'GPS and maps', 'description': 'GPS & Maps'}}]",,,False,,everyone,Twitter for iPhone
