tweetid,author_id,text,created_at,geo,retweets,replies,likes,quote_count,lang,conversation_id,context_annotations,entities,attachments,possibly_sensitive,withheld,reply_settings,source
1521626074374803456,1255790470237523968,Guys is Roblox crashing again or something?,2022-05-03 23:01:41+00:00,,5,68,308,1,en,1521626074374803456,"[{'domain': {'id': '71', 'name': 'Video Game', 'description': 'A video game like Overwatch'}, 'entity': {'id': '1088118927580774400', 'name': 'Roblox', 'description': 'Roblox'}}]","{'annotations': [{'start': 8, 'end': 13, 'probability': 0.4293, 'type': 'Product', 'normalized_text': 'Roblox'}]}",,False,,everyone,Twitter for Android
1521687972403646464,1476947320134529025,@starfieId_ Bro doing some hacker shit 😵,2022-05-04 03:07:38+00:00,,0,1,0,0,en,1521686386965118978,[],"{'mentions': [{'start': 0, 'end': 11, 'username': 'starfieId_', 'id': '1514016641851576323'}]}",,False,,everyone,Twitter Web App
1521690606166327297,1333257995443179521,"|| For reference, Taylor and I are making a Genya and Sanemi, but she just said

""I'm going to listen to music to think about a pinned tweet, probably work on a Sanemi account, and play hELLO KITTY CAFE!!""",2022-05-04 03:18:06+00:00,,1,1,1,0,en,1521690606166327297,"[{'domain': {'id': '10', 'name': 'Person', 'description': 'Named people in the world like Nelson Mandela'}, 'entity': {'id': '1443277565393719296', 'name': 'Hello Kitty'}}, {'domain': {'id': '47', 'name': 'Brand', 'description': 'Brands and Companies'}, 'entity': {'id': '1443277565393719296', 'name': 'Hello Kitty'}}, {'domain': {'id': '65', 'name': 'Interests and Hobbies Vertical', 'description': 'Top level interests and hobbies groupings, like Food or Travel'}, 'entity': {'id': '834828264786898945', 'name': 'Drinks', 'description': 'Drinks'}}, {'domain': {'id': '66', 'name': 'Interests and Hobbies Category', 'description': 'A grouping of interests and hobbies entities, like Novelty Food or Destinations'}, 'entity': {'id': '834828445238431744', 'name': 'Generic Drinks', 'description': 'Generic Drinks'}}, {'domain': {'id': '67', 'name': 'Interests and Hobbies', 'description': 'Interests, opinions, and behaviors of individuals, groups, or cultures; like Speciality Cooking or Theme Parks'}, 'entity': {'id': '850442647088971776', 'name': 'Coffee', 'description': 'Coffee'}}, {'domain': {'id': '122', 'name': 'Fictional Character', 'description': 'A person or other being in a narrative work of art, like Tom Sawyer or Jon Snow'}, 'entity': {'id': '1443277565393719296', 'name': 'Hello Kitty'}}, {'domain': {'id': '46', 'name': 'Brand Category', 'description': 'Categories within Brand Verticals that narrow down the scope of Brands'}, 'entity': {'id': '781974596752842752', 'name': 'Services'}}, {'domain': {'id': '47', 'name': 'Brand', 'description': 'Brands and Companies'}, 'entity': {'id': '10045225402', 'name': 'Twitter'}}, {'domain': {'id': '65', 'name': 'Interests and Hobbies Vertical', 'description': 'Top level interests and hobbies groupings, like Food or Travel'}, 'entity': {'id': '834828264786898945', 'name': 'Drinks', 'description': 'Drinks'}}, {'domain': {'id': '66', 'name': 'Interests and Hobbies Category', 'description': 'A grouping of interests and hobbies entities, like Novelty Food or Destinations'}, 'entity': {'id': '834828445238431744', 'name': 'Generic Drinks', 'description': 'Generic Drinks'}}, {'domain': {'id': '67', 'name': 'Interests and Hobbies', 'description': 'Interests, opinions, and behaviors of individuals, groups, or cultures; like Speciality Cooking or Theme Parks'}, 'entity': {'id': '850442647088971776', 'name': 'Coffee', 'description': 'Coffee'}}]","{'annotations': [{'start': 18, 'end': 23, 'probability': 0.9887, 'type': 'Person', 'normalized_text': 'Taylor'}, {'start': 44, 'end': 48, 'probability': 0.6971, 'type': 'Person', 'normalized_text': 'Genya'}, {'start': 54, 'end': 59, 'probability': 0.778, 'type': 'Person', 'normalized_text': 'Sanemi'}]}",,False,,everyone,Twitter for Android
1521677010141007872,1069006874811363328,Cursed number... 😱😱 https://t.co/KsQhSc5hqh,2022-05-04 02:24:05+00:00,,19,223,499,1,en,1521677010141007872,[],"{'urls': [{'start': 20, 'end': 43, 'url': 'https://t.co/KsQhSc5hqh', 'expanded_url': 'https://twitter.com/DigitoPlays/status/1521677010141007872/photo/1', 'display_url': 'pic.twitter.com/KsQhSc5hqh', 'media_key': '3_1521676964188155906'}]}",{'media_keys': ['3_1521676964188155906']},False,,everyone,Twitter Web App
1521627037181612032,1056053249470541824,"⚠️OUTAGE⚠️: Roblox is currently down at the moment. Not only are experiences failing to load, but studio is also failing to load as well. Our team will update you with further information.",2022-05-03 23:05:30+00:00,,428,1291,6967,83,en,1521627037181612032,"[{'domain': {'id': '71', 'name': 'Video Game', 'description': 'A video game like Overwatch'}, 'entity': {'id': '1088118927580774400', 'name': 'Roblox', 'description': 'Roblox'}}]","{'annotations': [{'start': 12, 'end': 17, 'probability': 0.3525, 'type': 'Organization', 'normalized_text': 'Roblox'}]}",,False,,everyone,Twitter Web App
1521594173580881926,1422163374339727363,"🏈NFL Tycoon

Para ganhar o ""NFL Draft Red Jacket"", é apenas você entrar no jogo.

Jogo:https://t.co/yeWmbXjtIV

#Roblox #NFLDraft #NFLDraft2022 #NFLTwitter #RobloxDev #Metaverse https://t.co/mlW9f4Uzcw",2022-05-03 20:54:55+00:00,,9,6,39,0,pt,1521594173580881926,"[{'domain': {'id': '3', 'name': 'TV Shows', 'description': 'Television shows from around the world'}, 'entity': {'id': '10000612773', 'name': 'NFL Football', 'description': 'Replays of classic NFL games.'}}, {'domain': {'id': '3', 'name': 'TV Shows', 'description': 'Television shows from around the world'}, 'entity': {'id': '10032425201', 'name': 'NFL Football'}}, {'domain': {'id': '3', 'name': 'TV Shows', 'description': 'Television shows from around the world'}, 'entity': {'id': '10033407327', 'name': 'Futebol NFL'}}, {'domain': {'id': '3', 'name': 'TV Shows', 'description': 'Television shows from around the world'}, 'entity': {'id': '10042261464', 'name': 'Fútbol Americano de la NFL'}}, {'domain': {'id': '6', 'name': 'Sports Event'}, 'entity': {'id': '1497206859823939591', 'name': '2022 NFL Draft: Day 1', 'description': ""The 2022 NFL Draft starts on Thursday, as the league's top prospects look to make the jump from college to the pros. Keep it here for Tweets, must-see highlights, and the can't-miss moments right from Las Vegas.""}}, {'domain': {'id': '11', 'name': 'Sport', 'description': 'Types of sports, like soccer and basketball'}, 'entity': {'id': '689566306014617600', 'name': 'American football'}}, {'domain': {'id': '26', 'name': 'Sports League', 'description': ''}, 'entity': {'id': '689566314835259392', 'name': 'NFL'}}, {'domain': {'id': '29', 'name': 'Events [Entity Service]', 'description': 'Entity Service related Events domain'}, 'entity': {'id': '1497206859823939591', 'name': '2022 NFL Draft: Day 1', 'description': ""The 2022 NFL Draft starts on Thursday, as the league's top prospects look to make the jump from college to the pros. Keep it here for Tweets, must-see highlights, and the can't-miss moments right from Las Vegas.""}}, {'domain': {'id': '30', 'name': 'Entities [Entity Service]', 'description': 'Entity Service top level domain, every item that is in Entity Service should be in this domain'}, 'entity': {'id': '848920371311001600', 'name': 'Technology', 'description': 'Technology and computing'}}, {'domain': {'id': '71', 'name': 'Video Game', 'description': 'A video game like Overwatch'}, 'entity': {'id': '1088118927580774400', 'name': 'Roblox', 'description': 'Roblox'}}, {'domain': {'id': '165', 'name': 'Technology', 'description': 'for individual and types of technology, e.g., food technology, 3D printing'}, 'entity': {'id': '848920371311001600', 'name': 'Technology', 'description': 'Technology and computing'}}, {'domain': {'id': '45', 'name': 'Brand Vertical', 'description': 'Top level entities that describe a Brands industry'}, 'entity': {'id': '781974597310615553', 'name': 'Entertainment'}}, {'domain': {'id': '46', 'name': 'Brand Category', 'description': 'Categories within Brand Verticals that narrow down the scope of Brands'}, 'entity': {'id': '781974597491040257', 'name': 'Sports'}}, {'domain': {'id': '47', 'name': 'Brand', 'description': 'Brands and Companies'}, 'entity': {'id': '10042758256', 'name': 'NFL'}}]","{'annotations': [{'start': 2, 'end': 11, 'probability': 0.4783, 'type': 'Product', 'normalized_text': 'NFL Tycoon'}], 'hashtags': [{'start': 112, 'end': 119, 'tag': 'Roblox'}, {'start': 120, 'end': 129, 'tag': 'NFLDraft'}, {'start': 130, 'end': 143, 'tag': 'NFLDraft2022'}, {'start': 144, 'end': 155, 'tag': 'NFLTwitter'}, {'start': 156, 'end': 166, 'tag': 'RobloxDev'}, {'start': 167, 'end': 177, 'tag': 'Metaverse'}], 'urls': [{'start': 87, 'end': 110, 'url': 'https://t.co/yeWmbXjtIV', 'expanded_url': 'http://roblox.com/games/8649501395', 'display_url': 'roblox.com/games/86495013…', 'images': [{'url': 'https://pbs.twimg.com/news_img/1522953397775003651/hzpthogj?format=jpg&name=orig', 'width': 498, 'height': 280}, {'url': 'https://pbs.twimg.com/news_img/1522953397775003651/hzpthogj?format=jpg&name=150x150', 'width': 150, 'height': 150}], 'status': 200, 'title': '[UPDATE 6] NFL Tycoon', 'description': ""Check out [UPDATE 6] NFL Tycoon. It’s one of the millions of unique, user-generated 3D experiences created on Roblox. ✨✨ Update #6 ✨✨ 🧢 Players have access to purchase New Era NFL Team Draft Hats over the course of two separate drops (The first of which was April 25th, so they're available right now!) both on the Roblox Avatar Store and in-game 🏢 Central City looks different! Now you can see other players’ stadiums that are in your six-person server, show off that beautiful build in a new way. 🛋 Stadium interiors have been freshened up for players to decorate and customize! Dazzle visitors with a crisp new look, add in NFL IP and other decorative items to really make this stadium your own. 🏟 New on-field upgrades as part of the stadium building process. This means you can place your field goals, benches, field lines, NFL shield logo on the field! 💰 Improved balancing of game programming so you can progress through your Tycoon building easier and be able to show off your customized"", 'unwound_url': 'https://www.roblox.com/games/8649501395/UPDATE-6-NFL-Tycoon?AssetId=8649501395'}, {'start': 178, 'end': 201, 'url': 'https://t.co/mlW9f4Uzcw', 'expanded_url': 'https://twitter.com/LeaksEvents/status/1521594173580881926/photo/1', 'display_url': 'pic.twitter.com/mlW9f4Uzcw', 'media_key': '3_1521594145361608704'}]}",{'media_keys': ['3_1521594145361608704']},False,,everyone,Twitter Web App
1521686362918842373,1333923390822912005,"@Roblox get it together roblox, i really want to flame people on dh.. i am foaming out of the mouth. i crave attention",2022-05-04 03:01:15+00:00,,1,2,6,0,en,1521159568562147329,"[{'domain': {'id': '71', 'name': 'Video Game', 'description': 'A video game like Overwatch'}, 'entity': {'id': '1088118927580774400', 'name': 'Roblox', 'description': 'Roblox'}}]","{'mentions': [{'start': 0, 'end': 7, 'username': 'Roblox', 'id': '16745055'}]}",,False,,everyone,Twitter Web App
1521536907506864129,1480733221700575233,"STRAY KIDS EN ROBLOX
Se informa que Spotify estaría ingresando al Metaverso de ROBLOX con el lanzamiento de ""Spotify Island"" 
La primera experiencia temática que se lanzará esta primavera es ""K-Park"".",2022-05-03 17:07:22+00:00,,214,9,1717,67,es,1521536907506864129,"[{'domain': {'id': '45', 'name': 'Brand Vertical', 'description': 'Top level entities that describe a Brands industry'}, 'entity': {'id': '781974597310615553', 'name': 'Entertainment'}}, {'domain': {'id': '46', 'name': 'Brand Category', 'description': 'Categories within Brand Verticals that narrow down the scope of Brands'}, 'entity': {'id': '781974597222535168', 'name': 'Online Services'}}, {'domain': {'id': '47', 'name': 'Brand', 'description': 'Brands and Companies'}, 'entity': {'id': '10040276669', 'name': 'Spotify'}}, {'domain': {'id': '67', 'name': 'Interests and Hobbies', 'description': 'Interests, opinions, and behaviors of individuals, groups, or cultures; like Speciality Cooking or Theme Parks'}, 'entity': {'id': '1288826829634035714', 'name': 'Backstage'}}, {'domain': {'id': '71', 'name': 'Video Game', 'description': 'A video game like Overwatch'}, 'entity': {'id': '1088118927580774400', 'name': 'Roblox', 'description': 'Roblox'}}]","{'annotations': [{'start': 0, 'end': 9, 'probability': 0.5622, 'type': 'Other', 'normalized_text': 'STRAY KIDS'}, {'start': 14, 'end': 19, 'probability': 0.5118, 'type': 'Product', 'normalized_text': 'ROBLOX'}, {'start': 36, 'end': 42, 'probability': 0.4925, 'type': 'Organization', 'normalized_text': 'Spotify'}, {'start': 66, 'end': 84, 'probability': 0.1621, 'type': 'Other', 'normalized_text': 'Metaverso de ROBLOX'}, {'start': 109, 'end': 122, 'probability': 0.381, 'type': 'Other', 'normalized_text': 'Spotify Island'}]}",,False,,everyone,Twitter for Android
1518643330833272833,16745055,A casual laid-back pair of pants go well with any outfit. Which is why you can wear these with any other items and on any avatar you want. Available now: https://t.co/7v25TLSvkr https://t.co/roTr7PweQP,2022-04-25 17:29:19+00:00,,131,642,2774,23,en,1518643330833272833,"[{'domain': {'id': '65', 'name': 'Interests and Hobbies Vertical', 'description': 'Top level interests and hobbies groupings, like Food or Travel'}, 'entity': {'id': '844603730221707264', 'name': 'Fashion', 'description': 'Fashion'}}, {'domain': {'id': '67', 'name': 'Interests and Hobbies', 'description': 'Interests, opinions, and behaviors of individuals, groups, or cultures; like Speciality Cooking or Theme Parks'}, 'entity': {'id': '1006277139233103872', 'name': 'Behavior around fashion', 'description': 'Behavior around Fashion'}}, {'domain': {'id': '71', 'name': 'Video Game', 'description': 'A video game like Overwatch'}, 'entity': {'id': '1088118927580774400', 'name': 'Roblox', 'description': 'Roblox'}}, {'domain': {'id': '65', 'name': 'Interests and Hobbies Vertical', 'description': 'Top level interests and hobbies groupings, like Food or Travel'}, 'entity': {'id': '844603730221707264', 'name': 'Fashion', 'description': 'Fashion'}}, {'domain': {'id': '66', 'name': 'Interests and Hobbies Category', 'description': 'A grouping of interests and hobbies entities, like Novelty Food or Destinations'}, 'entity': {'id': '844604232737087488', 'name': 'General Fashion', 'description': 'General Fashion'}}, {'domain': {'id': '67', 'name': 'Interests and Hobbies', 'description': 'Interests, opinions, and behaviors of individuals, groups, or cultures; like Speciality Cooking or Theme Parks'}, 'entity': {'id': '849639334663696384', 'name': 'Pants', 'description': 'Pants'}}, {'domain': {'id': '173', 'name': 'Google Product Taxonomy', 'description': 'A product taxonomy created by Google'}, 'entity': {'id': '849639334663696384', 'name': 'Pants', 'description': 'Pants'}}]","{'urls': [{'start': 154, 'end': 177, 'url': 'https://t.co/7v25TLSvkr', 'expanded_url': 'https://rblx.co/pants', 'display_url': 'rblx.co/pants', 'images': [{'url': 'https://pbs.twimg.com/news_img/1522682136339263488/tqtuOYQt?format=jpg&name=orig', 'width': 1200, 'height': 630}, {'url': 'https://pbs.twimg.com/news_img/1522682136339263488/tqtuOYQt?format=jpg&name=150x150', 'width': 150, 'height': 150}], 'status': 200, 'title': 'Roblox', 'description': 'Customize your avatar with a never-ending variety of clothing options, accessories, gear, and more!', 'unwound_url': 'https://www.roblox.com/catalog?Category=3&Subcategory=60&CreatorID=1&SortType=3'}, {'start': 178, 'end': 201, 'url': 'https://t.co/roTr7PweQP', 'expanded_url': 'https://twitter.com/Roblox/status/1518643330833272833/video/1', 'display_url': 'pic.twitter.com/roTr7PweQP', 'media_key': '7_1518643082501140480'}]}",{'media_keys': ['7_1518643082501140480']},False,,everyone,Twitter Web App
1521690547055853568,1422811929333035009,@Roblox What's happening to roblox? I want to play adopt me😔,2022-05-04 03:17:52+00:00,,0,5,4,0,en,1521159568562147329,"[{'domain': {'id': '71', 'name': 'Video Game', 'description': 'A video game like Overwatch'}, 'entity': {'id': '1088118927580774400', 'name': 'Roblox', 'description': 'Roblox'}}, {'domain': {'id': '71', 'name': 'Video Game', 'description': 'A video game like Overwatch'}, 'entity': {'id': '1229416301245763584', 'name': 'Adopt Me'}}]","{'mentions': [{'start': 0, 'end': 7, 'username': 'Roblox', 'id': '16745055'}]}",,False,,everyone,Twitter for Android
1521664609526202369,863689794,roblox,2022-05-04 01:34:48+00:00,,91,565,2746,11,en,1521664609526202369,"[{'domain': {'id': '71', 'name': 'Video Game', 'description': 'A video game like Overwatch'}, 'entity': {'id': '1088118927580774400', 'name': 'Roblox', 'description': 'Roblox'}}]",,,False,,everyone,Twitter for iPhone
1521689430330949635,1341570080585490433,"fora que tem a capa mais linda da história, se pudesse tatuava ela na retina",2022-05-04 03:13:26+00:00,,0,1,0,0,pt,1521689296138379264,[],,,False,,everyone,Twitter for Android
1520748651210936320,1427600942933811200,Bro shut up I know it's 2022 it's a joke https://t.co/EYlRbDOsTK,2022-05-01 12:55:07+00:00,,2,28,601,0,en,1520627291474120704,[],"{'urls': [{'start': 41, 'end': 64, 'url': 'https://t.co/EYlRbDOsTK', 'expanded_url': 'https://twitter.com/JustEdgarDK/status/1520748651210936320/photo/1', 'display_url': 'pic.twitter.com/EYlRbDOsTK', 'media_key': '3_1520748647855816705'}]}",{'media_keys': ['3_1520748647855816705']},False,,everyone,Twitter for Android
1521690267010617344,1474092784936226817,@skechersforlife @LilyGia_ Lol rip you broke yours ?,2022-05-04 03:16:45+00:00,,0,2,1,0,en,1521628234470801409,[],"{'mentions': [{'start': 0, 'end': 16, 'username': 'skechersforlife', 'id': '1454703946703024129'}, {'start': 17, 'end': 26, 'username': 'LilyGia_', 'id': '717006251880759296'}]}",,False,,everyone,Twitter for iPhone
1521627509116309504,1408340269087535104,Roblox is currently experiencing issues right now. #RobloxDown,2022-05-03 23:07:23+00:00,,674,2369,10330,154,en,1521627509116309504,"[{'domain': {'id': '71', 'name': 'Video Game', 'description': 'A video game like Overwatch'}, 'entity': {'id': '1088118927580774400', 'name': 'Roblox', 'description': 'Roblox'}}]","{'annotations': [{'start': 0, 'end': 5, 'probability': 0.3527, 'type': 'Organization', 'normalized_text': 'Roblox'}], 'hashtags': [{'start': 51, 'end': 62, 'tag': 'RobloxDown'}]}",,False,,everyone,Twitter for iPhone
1521470080462295043,20234637,Spotify enters the @Roblox metaverse with launch experience featuring @Stray_Kids and Sunmi https://t.co/agBGVyXtsu https://t.co/KSbbNInAWl,2022-05-03 12:41:49+00:00,,3600,412,12549,4710,en,1521470080462295043,"[{'domain': {'id': '10', 'name': 'Person', 'description': 'Named people in the world like Nelson Mandela'}, 'entity': {'id': '1062427352318173185', 'name': 'Stray Kids', 'description': 'Stray Kids (스트레이 키즈)'}}, {'domain': {'id': '45', 'name': 'Brand Vertical', 'description': 'Top level entities that describe a Brands industry'}, 'entity': {'id': '781974597310615553', 'name': 'Entertainment'}}, {'domain': {'id': '46', 'name': 'Brand Category', 'description': 'Categories within Brand Verticals that narrow down the scope of Brands'}, 'entity': {'id': '781974597222535168', 'name': 'Online Services'}}, {'domain': {'id': '47', 'name': 'Brand', 'description': 'Brands and Companies'}, 'entity': {'id': '10040276669', 'name': 'Spotify'}}, {'domain': {'id': '54', 'name': 'Musician', 'description': 'A musician in the world, like Adele or Bob Dylan'}, 'entity': {'id': '1062427352318173185', 'name': 'Stray Kids', 'description': 'Stray Kids (스트레이 키즈)'}}, {'domain': {'id': '55', 'name': 'Music Genre', 'description': 'A category for a musical style, like Pop, Rock, or Rap'}, 'entity': {'id': '888105153038958593', 'name': 'K-pop', 'description': 'K-Pop'}}, {'domain': {'id': '30', 'name': 'Entities [Entity Service]', 'description': 'Entity Service top level domain, every item that is in Entity Service should be in this domain'}, 'entity': {'id': '848920371311001600', 'name': 'Technology', 'description': 'Technology and computing'}}, {'domain': {'id': '67', 'name': 'Interests and Hobbies', 'description': 'Interests, opinions, and behaviors of individuals, groups, or cultures; like Speciality Cooking or Theme Parks'}, 'entity': {'id': '1288826829634035714', 'name': 'Backstage'}}, {'domain': {'id': '71', 'name': 'Video Game', 'description': 'A video game like Overwatch'}, 'entity': {'id': '1088118927580774400', 'name': 'Roblox', 'description': 'Roblox'}}, {'domain': {'id': '165', 'name': 'Technology', 'description': 'for individual and types of technology, e.g., food technology, 3D printing'}, 'entity': {'id': '848920371311001600', 'name': 'Technology', 'description': 'Technology and computing'}}]","{'annotations': [{'start': 0, 'end': 6, 'probability': 0.4468, 'type': 'Product', 'normalized_text': 'Spotify'}, {'start': 86, 'end': 90, 'probability': 0.8762, 'type': 'Person', 'normalized_text': 'Sunmi'}], 'mentions': [{'start': 19, 'end': 26, 'username': 'Roblox', 'id': '16745055'}, {'start': 70, 'end': 81, 'username': 'Stray_Kids', 'id': '859297966581891072'}], 'urls': [{'start': 92, 'end': 115, 'url': 'https://t.co/agBGVyXtsu', 'expanded_url': 'https://www.musicweek.com/digital/read/spotify-enters-the-roblox-metaverse/085725', 'display_url': 'musicweek.com/digital/read/s…', 'images': [{'url': 'https://pbs.twimg.com/news_img/1539830944898682880/XozoJXdZ?format=jpg&name=orig', 'width': 1200, 'height': 630}, {'url': 'https://pbs.twimg.com/news_img/1539830944898682880/XozoJXdZ?format=jpg&name=150x150', 'width': 150, 'height': 150}], 'status': 200, 'title': 'Spotify enters the Roblox metaverse', 'description': 'The streaming giant has joined major labels in the Roblox metaverse with an interactive presence. Spotify is the first streaming brand on the gaming platform.', 'unwound_url': 'https://www.musicweek.com/digital/read/spotify-enters-the-roblox-metaverse/085725'}, {'start': 116, 'end': 139, 'url': 'https://t.co/KSbbNInAWl', 'expanded_url': 'https://twitter.com/MusicWeek/status/1521470080462295043/photo/1', 'display_url': 'pic.twitter.com/KSbbNInAWl', 'media_key': '3_1521469945233776640'}]}",{'media_keys': ['3_1521469945233776640']},False,,everyone,Twitter Web App
1521689936520310784,1521688138237636608,@EvanZir what do you mean? It's still down for me? Are you sure? What do you think is happening with @Roblox rn?,2022-05-04 03:15:27+00:00,,0,1,0,0,en,1521663590608035841,"[{'domain': {'id': '71', 'name': 'Video Game', 'description': 'A video game like Overwatch'}, 'entity': {'id': '1088118927580774400', 'name': 'Roblox', 'description': 'Roblox'}}]","{'mentions': [{'start': 0, 'end': 8, 'username': 'EvanZir', 'id': '3430592104'}, {'start': 101, 'end': 108, 'username': 'Roblox', 'id': '16745055'}]}",,False,,mentionedUsers,Twitter Web App
1521672040075259905,1364514582287446016,@Roblox @Spotify @soundtrap @discord https://t.co/ydJC8r3udA,2022-05-04 02:04:20+00:00,,0,1,1,0,qme,1521449221261602817,"[{'domain': {'id': '45', 'name': 'Brand Vertical', 'description': 'Top level entities that describe a Brands industry'}, 'entity': {'id': '781974597310615553', 'name': 'Entertainment'}}, {'domain': {'id': '46', 'name': 'Brand Category', 'description': 'Categories within Brand Verticals that narrow down the scope of Brands'}, 'entity': {'id': '781974597222535168', 'name': 'Online Services'}}, {'domain': {'id': '47', 'name': 'Brand', 'description': 'Brands and Companies'}, 'entity': {'id': '10040276669', 'name': 'Spotify'}}, {'domain': {'id': '47', 'name': 'Brand', 'description': 'Brands and Companies'}, 'entity': {'id': '1168499224297656321', 'name': 'Discord'}}, {'domain': {'id': '67', 'name': 'Interests and Hobbies', 'description': 'Interests, opinions, and behaviors of individuals, groups, or cultures; like Speciality Cooking or Theme Parks'}, 'entity': {'id': '1288826829634035714', 'name': 'Backstage'}}, {'domain': {'id': '71', 'name': 'Video Game', 'description': 'A video game like Overwatch'}, 'entity': {'id': '1088118927580774400', 'name': 'Roblox', 'description': 'Roblox'}}, {'domain': {'id': '165', 'name': 'Technology', 'description': 'for individual and types of technology, e.g., food technology, 3D printing'}, 'entity': {'id': '1196446161223028736', 'name': 'Social media'}}]","{'mentions': [{'start': 0, 'end': 7, 'username': 'Roblox', 'id': '16745055'}, {'start': 8, 'end': 16, 'username': 'Spotify', 'id': '17230018'}, {'start': 17, 'end': 27, 'username': 'soundtrap', 'id': '882321548'}, {'start': 28, 'end': 36, 'username': 'discord', 'id': '3065618342'}], 'urls': [{'start': 37, 'end': 60, 'url': 'https://t.co/ydJC8r3udA', 'expanded_url': 'https://twitter.com/Sage_K1ng/status/1521672040075259905/photo/1', 'display_url': 'pic.twitter.com/ydJC8r3udA', 'media_key': '3_1521672002649530371'}]}",{'media_keys': ['3_1521672002649530371']},False,,everyone,Twitter Web App
