tweetid,author_id,text,created_at,geo,retweets,replies,likes,quote_count,lang,conversation_id,context_annotations,entities,attachments,possibly_sensitive,withheld,reply_settings,source
1520863712906821632,1310688804441817088,"does this scamming, egocentric, narcissistic, man-child have anything better to do, rather than scrape for twitter likes off of a twitter drama regarding me. what a loser. You blocked me, i blocked you, stop stalking by tweets bozo. https://t.co/sWB0QBnXE2",2022-05-01 20:32:20+00:00,,3,83,71,4,en,1520863712906821632,"[{'domain': {'id': '46', 'name': 'Brand Category', 'description': 'Categories within Brand Verticals that narrow down the scope of Brands'}, 'entity': {'id': '781974596752842752', 'name': 'Services'}}, {'domain': {'id': '47', 'name': 'Brand', 'description': 'Brands and Companies'}, 'entity': {'id': '10045225402', 'name': 'Twitter'}}]","{'urls': [{'start': 233, 'end': 256, 'url': 'https://t.co/sWB0QBnXE2', 'expanded_url': 'https://twitter.com/Parlo_ROBLOX/status/1520863712906821632/photo/1', 'display_url': 'pic.twitter.com/sWB0QBnXE2', 'media_key': '3_1520863705466085377'}], 'annotations': [{'start': 107, 'end': 113, 'probability': 0.865, 'type': 'Product', 'normalized_text': 'twitter'}, {'start': 130, 'end': 136, 'probability': 0.7971, 'type': 'Product', 'normalized_text': 'twitter'}]}",{'media_keys': ['3_1520863705466085377']},False,,everyone,Twitter Web App
1520570627442487298,1327135818390114305,@CloudsKawaiii We will consider adding these in a subsequent update,2022-05-01 01:07:43+00:00,,1,2,4,0,en,1520567681791193088,[],"{'mentions': [{'start': 0, 'end': 14, 'username': 'CloudsKawaiii', 'id': '1250446490503446530'}]}",,False,,everyone,Twitter Web App
1520627291474120704,1427600942933811200,omg !!!!1!!!!11!!! robloc is shutting down 😭 😭 https://t.co/MTQpMt4xpV,2022-05-01 04:52:52+00:00,,224,982,2509,28,en,1520627291474120704,[],"{'urls': [{'start': 47, 'end': 70, 'url': 'https://t.co/MTQpMt4xpV', 'expanded_url': 'https://twitter.com/JustEdgarDK/status/1520627291474120704/photo/1', 'display_url': 'pic.twitter.com/MTQpMt4xpV', 'media_key': '3_1520627288618201088'}]}",{'media_keys': ['3_1520627288618201088']},False,,everyone,Twitter for Android
1520959850695471104,1514113614348623874,"@LvlyKaro No, por compartir mi amiga me hizo esto https://t.co/ztKrcfhy65",2022-05-02 02:54:21+00:00,,0,1,0,0,es,1520958081366040576,[],"{'urls': [{'start': 50, 'end': 73, 'url': 'https://t.co/ztKrcfhy65', 'expanded_url': 'https://twitter.com/h4nnahILvsKen14/status/1520959850695471104/photo/1', 'display_url': 'pic.twitter.com/ztKrcfhy65', 'media_key': '3_1520959846429839363'}]}",{'media_keys': ['3_1520959846429839363']},False,,everyone,Twitter for Android
1520930144663359488,1256676156041986048,"i will put whatever you comment into this room right here . (can be images, notes, or objects .) https://t.co/8rOzfiDKFh",2022-05-02 00:56:18+00:00,,1,30,22,1,en,1520930144663359488,[],"{'urls': [{'start': 97, 'end': 120, 'url': 'https://t.co/8rOzfiDKFh', 'expanded_url': 'https://twitter.com/kelraisms/status/1520930144663359488/photo/1', 'display_url': 'pic.twitter.com/8rOzfiDKFh', 'media_key': '3_1520929937984737286'}]}",{'media_keys': ['3_1520929937984737286']},False,,mentionedUsers,Twitter Web App
1520828368551350275,1310688804441817088,"it's so easy to claim the other side isn't getting harassed, when you have never once experienced it before. I criticise obviously clickbait videos, as i have every right to. Then the hoards of children come to me. Point proven. You CANNOT have an opinion on twitter! https://t.co/wHQKxLHaxi",2022-05-01 18:11:53+00:00,,5,134,58,36,en,1520828368551350275,"[{'domain': {'id': '46', 'name': 'Brand Category', 'description': 'Categories within Brand Verticals that narrow down the scope of Brands'}, 'entity': {'id': '781974596752842752', 'name': 'Services'}}, {'domain': {'id': '47', 'name': 'Brand', 'description': 'Brands and Companies'}, 'entity': {'id': '10045225402', 'name': 'Twitter'}}]","{'urls': [{'start': 268, 'end': 291, 'url': 'https://t.co/wHQKxLHaxi', 'expanded_url': 'https://twitter.com/Parlo_ROBLOX/status/1520828368551350275/photo/1', 'display_url': 'pic.twitter.com/wHQKxLHaxi', 'media_key': '3_1520828064011329536'}], 'annotations': [{'start': 259, 'end': 265, 'probability': 0.7714, 'type': 'Product', 'normalized_text': 'twitter'}]}",{'media_keys': ['3_1520828064011329536']},False,,everyone,Twitter Web App
1519310381558398977,1327135818390114305,"Officially partnered with #SanRio® the “My Hello Kitty Cafe” game is coming to Roblox ! Mark the date and get ready to meet #hellokitty and her friends!

Game: https://t.co/dgjJ8hHzp7

Follow us on Discord  to participate in the registration! https://t.co/S29Gi6Ndho",2022-04-27 13:39:57+00:00,,58,82,943,11,en,1519310381558398977,"[{'domain': {'id': '10', 'name': 'Person', 'description': 'Named people in the world like Nelson Mandela'}, 'entity': {'id': '1443277565393719296', 'name': 'Hello Kitty'}}, {'domain': {'id': '45', 'name': 'Brand Vertical', 'description': 'Top level entities that describe a Brands industry'}, 'entity': {'id': '781974596706635776', 'name': 'Retail'}}, {'domain': {'id': '46', 'name': 'Brand Category', 'description': 'Categories within Brand Verticals that narrow down the scope of Brands'}, 'entity': {'id': '781974597302296576', 'name': 'Specialty'}}, {'domain': {'id': '47', 'name': 'Brand', 'description': 'Brands and Companies'}, 'entity': {'id': '1038116841485303808', 'name': 'Sanrio', 'description': 'Sanrio (サンリオ)'}}, {'domain': {'id': '47', 'name': 'Brand', 'description': 'Brands and Companies'}, 'entity': {'id': '1168499224297656321', 'name': 'Discord'}}, {'domain': {'id': '47', 'name': 'Brand', 'description': 'Brands and Companies'}, 'entity': {'id': '1443277565393719296', 'name': 'Hello Kitty'}}, {'domain': {'id': '65', 'name': 'Interests and Hobbies Vertical', 'description': 'Top level interests and hobbies groupings, like Food or Travel'}, 'entity': {'id': '834828264786898945', 'name': 'Drinks', 'description': 'Drinks'}}, {'domain': {'id': '66', 'name': 'Interests and Hobbies Category', 'description': 'A grouping of interests and hobbies entities, like Novelty Food or Destinations'}, 'entity': {'id': '834828445238431744', 'name': 'Generic Drinks', 'description': 'Generic Drinks'}}, {'domain': {'id': '67', 'name': 'Interests and Hobbies', 'description': 'Interests, opinions, and behaviors of individuals, groups, or cultures; like Speciality Cooking or Theme Parks'}, 'entity': {'id': '850442647088971776', 'name': 'Coffee', 'description': 'Coffee'}}, {'domain': {'id': '71', 'name': 'Video Game', 'description': 'A video game like Overwatch'}, 'entity': {'id': '1088118927580774400', 'name': 'Roblox', 'description': 'Roblox'}}, {'domain': {'id': '79', 'name': 'Video Game Hardware', 'description': 'Video Game Hardware'}, 'entity': {'id': '1174432578503204864', 'name': 'PC gaming'}}, {'domain': {'id': '122', 'name': 'Fictional Character', 'description': 'A person or other being in a narrative work of art, like Tom Sawyer or Jon Snow'}, 'entity': {'id': '1443277565393719296', 'name': 'Hello Kitty'}}, {'domain': {'id': '165', 'name': 'Technology', 'description': 'for individual and types of technology, e.g., food technology, 3D printing'}, 'entity': {'id': '1196446161223028736', 'name': 'Social media'}}, {'domain': {'id': '65', 'name': 'Interests and Hobbies Vertical', 'description': 'Top level interests and hobbies groupings, like Food or Travel'}, 'entity': {'id': '834828264786898945', 'name': 'Drinks', 'description': 'Drinks'}}, {'domain': {'id': '66', 'name': 'Interests and Hobbies Category', 'description': 'A grouping of interests and hobbies entities, like Novelty Food or Destinations'}, 'entity': {'id': '834828445238431744', 'name': 'Generic Drinks', 'description': 'Generic Drinks'}}, {'domain': {'id': '67', 'name': 'Interests and Hobbies', 'description': 'Interests, opinions, and behaviors of individuals, groups, or cultures; like Speciality Cooking or Theme Parks'}, 'entity': {'id': '850442647088971776', 'name': 'Coffee', 'description': 'Coffee'}}]","{'urls': [{'start': 160, 'end': 183, 'url': 'https://t.co/dgjJ8hHzp7', 'expanded_url': 'https://www.roblox.com/games/9346039031/My-Hello-Kitty-Cafe', 'display_url': 'roblox.com/games/93460390…', 'images': [{'url': 'https://pbs.twimg.com/news_img/1539827529304997889/bnhUbb-4?format=jpg&name=orig', 'width': 498, 'height': 280}, {'url': 'https://pbs.twimg.com/news_img/1539827529304997889/bnhUbb-4?format=jpg&name=150x150', 'width': 150, 'height': 150}], 'status': 200, 'title': '[Update]My Hello Kitty Cafe', 'description': ""Check out [Update]My Hello Kitty Cafe. It’s one of the millions of unique, user-generated 3D experiences created on Roblox. Welcome to My Hello Kitty Cafe! Join @HelloKitty and Friends in a supercute world full of fun and sweet surprises. Create, manage, and decorate your very own Hello Kitty Cafe while with new friends along the way. 🚨UPDATE LOG🚨 -Add 7-day Father's Day event Find three mystery codes within the time limit combine them and earn a reward -Add PomPompurin Sofa and Coffee Table -Add PomPompurin Guidepost -Add designated production functions at the ordering counter -Add four types of outdoor flooring Optimization -Popularity boost provided by the equipment -Fix some bugs Follow us on Twitter and disd for all redemption codes! Like reward goal 20k likes Code:LIKEKITTYQD2 40k likes Code:LIKEKITTYED2 60k likes Code:LIKEKITTYGD2 80k likes Code:LIKEKITTYDD2 100k likes Code:LIKEKITTYFD2 150k likes Code:LIKEKITTYKD2 250k likes Code:LIKEKITTYXK2 350k likes Mystery Gift Join the "", 'unwound_url': 'https://www.roblox.com/games/9346039031/Pompompurin-My-Hello-Kitty-Cafe?AssetId=9346039031'}, {'start': 243, 'end': 266, 'url': 'https://t.co/S29Gi6Ndho', 'expanded_url': 'https://twitter.com/RockPandaGames/status/1519310381558398977/video/1', 'display_url': 'pic.twitter.com/S29Gi6Ndho', 'media_key': '7_1519307424498601984'}], 'annotations': [{'start': 40, 'end': 58, 'probability': 0.5972, 'type': 'Other', 'normalized_text': 'My Hello Kitty Cafe'}, {'start': 79, 'end': 84, 'probability': 0.31, 'type': 'Product', 'normalized_text': 'Roblox'}], 'hashtags': [{'start': 26, 'end': 33, 'tag': 'SanRio'}, {'start': 124, 'end': 135, 'tag': 'hellokitty'}]}",{'media_keys': ['7_1519307424498601984']},False,,everyone,Twitter Web App
1515439883413860355,1360224426529329155,"Los Accesorio Oficiales de Sonic y entre otros Ya Esta Disponible 👍!

➤https://t.co/flQyIbSwIT https://t.co/3HlPB3c4pS https://t.co/9GYXcNtW1v",2022-04-16 21:19:58+00:00,,2,8,19,1,es,1515439883413860355,[],"{'urls': [{'start': 71, 'end': 94, 'url': 'https://t.co/flQyIbSwIT', 'expanded_url': 'https://www.roblox.com/catalog?Category=13&Subcategory=40&CreatorName=A_TEAM_&IncludeNotForSale', 'display_url': 'roblox.com/catalog?Catego…', 'images': [{'url': 'https://pbs.twimg.com/news_img/1518729285091004416/U6DnOZrn?format=jpg&name=orig', 'width': 1200, 'height': 630}, {'url': 'https://pbs.twimg.com/news_img/1518729285091004416/U6DnOZrn?format=jpg&name=150x150', 'width': 150, 'height': 150}], 'status': 200, 'title': 'Roblox', 'description': 'Customize your avatar with a never-ending variety of clothing options, accessories, gear, and more!', 'unwound_url': 'https://www.roblox.com/catalog?Category=13&Subcategory=40&CreatorName=A_TEAM_&IncludeNotForSale'}, {'start': 95, 'end': 118, 'url': 'https://t.co/3HlPB3c4pS', 'expanded_url': 'https://twitter.com/NoticiasUgc/status/1515439883413860355/photo/1', 'display_url': 'pic.twitter.com/3HlPB3c4pS', 'media_key': '3_1515439612470177799'}, {'start': 119, 'end': 142, 'url': 'https://t.co/9GYXcNtW1v', 'expanded_url': 'https://twitter.com/NoticiasUgc/status/1515024517273374720', 'display_url': 'twitter.com/NoticiasUgc/st…'}]}",{'media_keys': ['3_1515439612470177799']},False,,everyone,Twitter Web App
1520831930324955136,1310688804441817088,"@1M_oh no. you have never been harassed. these arent the same situations. i was being harassed, and he joined in, getting his fans to join in, making it worse.",2022-05-01 18:26:02+00:00,,0,5,2,1,en,1520830447411994624,[],"{'mentions': [{'start': 0, 'end': 6, 'username': '1M_oh', 'id': '1141442459081281537'}]}",,False,,everyone,Twitter Web App
1520946051510800384,1441683833934385165,@Kaylyn65163868 Notifications please :))) No worries if you had forgotten but also do remember to stay active on my YouTube channel &lt;33 Good luck,2022-05-02 01:59:31+00:00,,0,2,1,0,en,1520772852081106946,"[{'domain': {'id': '165', 'name': 'Technology', 'description': 'for individual and types of technology, e.g., food technology, 3D printing'}, 'entity': {'id': '1196446161223028736', 'name': 'Social media'}}, {'domain': {'id': '46', 'name': 'Brand Category', 'description': 'Categories within Brand Verticals that narrow down the scope of Brands'}, 'entity': {'id': '781974596752842752', 'name': 'Services'}}, {'domain': {'id': '47', 'name': 'Brand', 'description': 'Brands and Companies'}, 'entity': {'id': '10029382357', 'name': 'YouTube'}}]","{'mentions': [{'start': 0, 'end': 15, 'username': 'Kaylyn65163868', 'id': '1513017165343072258'}], 'annotations': [{'start': 116, 'end': 122, 'probability': 0.7415, 'type': 'Product', 'normalized_text': 'YouTube'}]}",,False,,everyone,Twitter Web App
1520568308348891136,1401851980562063367,"How much Robux do you want? 
⭐️MAX 2k #robux⭐️

Must be following @TheCodedGalaxy &amp; Retweet!",2022-05-01 00:58:30+00:00,,67,97,62,0,en,1520568308348891136,"[{'domain': {'id': '71', 'name': 'Video Game', 'description': 'A video game like Overwatch'}, 'entity': {'id': '1088118927580774400', 'name': 'Roblox', 'description': 'Roblox'}}]","{'mentions': [{'start': 66, 'end': 81, 'username': 'TheCodedGalaxy', 'id': '1401851980562063367'}], 'hashtags': [{'start': 38, 'end': 44, 'tag': 'robux'}]}",,False,,everyone,Twitter for iPhone
1520958372433973248,1474447327771467784,"alguien en vdd descargue minecraft ilegalmente x mi para jugar, yo les enseño como😓",2022-05-02 02:48:28+00:00,,0,2,0,0,es,1520958372433973248,"[{'domain': {'id': '45', 'name': 'Brand Vertical', 'description': 'Top level entities that describe a Brands industry'}, 'entity': {'id': '781974597310615553', 'name': 'Entertainment'}}, {'domain': {'id': '46', 'name': 'Brand Category', 'description': 'Categories within Brand Verticals that narrow down the scope of Brands'}, 'entity': {'id': '781974597218340864', 'name': 'Video Games'}}, {'domain': {'id': '71', 'name': 'Video Game', 'description': 'A video game like Overwatch'}, 'entity': {'id': '10043689888', 'name': 'Minecraft'}}]",,,False,,everyone,Twitter for Android
1520900874809135104,1327135818390114305,"Great newbie instruction, and how to get our backpacks!💪
Come get your souvenir rewards with your friends!🙌
Video from:@AniJuegos
https://t.co/xt6tBIEMH6
#HelloKitty #Roblox",2022-05-01 23:00:00+00:00,,15,27,107,3,en,1520900874809135104,"[{'domain': {'id': '10', 'name': 'Person', 'description': 'Named people in the world like Nelson Mandela'}, 'entity': {'id': '1443277565393719296', 'name': 'Hello Kitty'}}, {'domain': {'id': '47', 'name': 'Brand', 'description': 'Brands and Companies'}, 'entity': {'id': '1443277565393719296', 'name': 'Hello Kitty'}}, {'domain': {'id': '71', 'name': 'Video Game', 'description': 'A video game like Overwatch'}, 'entity': {'id': '1088118927580774400', 'name': 'Roblox', 'description': 'Roblox'}}, {'domain': {'id': '122', 'name': 'Fictional Character', 'description': 'A person or other being in a narrative work of art, like Tom Sawyer or Jon Snow'}, 'entity': {'id': '1443277565393719296', 'name': 'Hello Kitty'}}]","{'urls': [{'start': 130, 'end': 153, 'url': 'https://t.co/xt6tBIEMH6', 'expanded_url': 'https://youtu.be/UVvKqtGVTh8', 'display_url': 'youtu.be/UVvKqtGVTh8', 'images': [{'url': 'https://pbs.twimg.com/news_img/1518987096064675841/PPJJ5vfi?format=jpg&name=orig', 'width': 1280, 'height': 720}, {'url': 'https://pbs.twimg.com/news_img/1518987096064675841/PPJJ5vfi?format=jpg&name=150x150', 'width': 150, 'height': 150}], 'status': 200, 'title': '*NUEVO* OBTEN GRATIS MOCHILA CINNAMOROLL +CODIGOS MONEDAS Y DIAMANTES en MY HELLO KITTY CAFE ☕😻', 'description': '*NUEVO* OBTEN GRATIS MOCHILA CINNAMOROLL +CODIGOS MONEDAS Y DIAMANTES en MY HELLO KITTY CAFE ☕😻 ANIELICA ROBLOX 🍥 Mira el video completo y comparte... 👾s...', 'unwound_url': 'https://www.youtube.com/watch?v=UVvKqtGVTh8&feature=youtu.be'}], 'mentions': [{'start': 119, 'end': 129, 'username': 'AniJuegos', 'id': '2777859638'}], 'hashtags': [{'start': 154, 'end': 165, 'tag': 'HelloKitty'}, {'start': 166, 'end': 173, 'tag': 'Roblox'}]}",,False,,everyone,Twitter Web App
1520885473295613952,1310688804441817088,"This ROBLOX YouTuber has an INSANE EGO problem and is attacking anyone who calls them out, including youtubers like olix and chizeled, calling them ''no life losers''. And bragging about how much money he earns off of youtube. This guy is unhinged. https://t.co/N9OAdbbd0t",2022-05-01 21:58:48+00:00,,11,72,92,6,en,1520885473295613952,"[{'domain': {'id': '71', 'name': 'Video Game', 'description': 'A video game like Overwatch'}, 'entity': {'id': '1088118927580774400', 'name': 'Roblox', 'description': 'Roblox'}}, {'domain': {'id': '165', 'name': 'Technology', 'description': 'for individual and types of technology, e.g., food technology, 3D printing'}, 'entity': {'id': '1196446161223028736', 'name': 'Social media'}}, {'domain': {'id': '46', 'name': 'Brand Category', 'description': 'Categories within Brand Verticals that narrow down the scope of Brands'}, 'entity': {'id': '781974596752842752', 'name': 'Services'}}, {'domain': {'id': '47', 'name': 'Brand', 'description': 'Brands and Companies'}, 'entity': {'id': '10029382357', 'name': 'YouTube'}}]","{'urls': [{'start': 249, 'end': 272, 'url': 'https://t.co/N9OAdbbd0t', 'expanded_url': 'https://twitter.com/Parlo_ROBLOX/status/1520885473295613952/photo/1', 'display_url': 'pic.twitter.com/N9OAdbbd0t', 'media_key': '3_1520884512770736134'}, {'start': 249, 'end': 272, 'url': 'https://t.co/N9OAdbbd0t', 'expanded_url': 'https://twitter.com/Parlo_ROBLOX/status/1520885473295613952/photo/1', 'display_url': 'pic.twitter.com/N9OAdbbd0t', 'media_key': '3_1520884615145213957'}, {'start': 249, 'end': 272, 'url': 'https://t.co/N9OAdbbd0t', 'expanded_url': 'https://twitter.com/Parlo_ROBLOX/status/1520885473295613952/photo/1', 'display_url': 'pic.twitter.com/N9OAdbbd0t', 'media_key': '3_1520884903214206976'}], 'annotations': [{'start': 5, 'end': 19, 'probability': 0.2377, 'type': 'Product', 'normalized_text': 'ROBLOX YouTuber'}]}","{'media_keys': ['3_1520884512770736134', '3_1520884615145213957', '3_1520884903214206976']}",False,,everyone,Twitter Web App
1520824207781036032,1327135818390114305,"Artwork from our Discrod community players!🥰
From: Nnsaysno325
Very nice and lovely artwork!😎
It's a true reflection of what we do in the game!
We're so happy that people are enjoying our game and making similar art
If you have any good artwork, please share it with us~
#roblox https://t.co/7S2xgawA5r",2022-05-01 17:55:21+00:00,,4,5,110,0,en,1520824207781036032,"[{'domain': {'id': '71', 'name': 'Video Game', 'description': 'A video game like Overwatch'}, 'entity': {'id': '1088118927580774400', 'name': 'Roblox', 'description': 'Roblox'}}]","{'urls': [{'start': 279, 'end': 302, 'url': 'https://t.co/7S2xgawA5r', 'expanded_url': 'https://twitter.com/RockPandaGames/status/1520824207781036032/photo/1', 'display_url': 'pic.twitter.com/7S2xgawA5r', 'media_key': '3_1520823454219780098'}], 'hashtags': [{'start': 271, 'end': 278, 'tag': 'roblox'}]}",{'media_keys': ['3_1520823454219780098']},False,,everyone,Twitter Web App
1520772412803252227,1383623550142083078,@MatheuscSil @geno__td @Roblox_PTB Essa porra inventa palavra,2022-05-01 14:29:32+00:00,,0,1,2,0,pt,1520442567237775367,[],"{'mentions': [{'start': 0, 'end': 12, 'username': 'MatheuscSil', 'id': '2935449471'}, {'start': 13, 'end': 22, 'username': 'geno__td', 'id': '4902746915'}, {'start': 23, 'end': 34, 'username': 'Roblox_PTB', 'id': '1283176319178518530'}]}",,False,,everyone,Twitter for Android
1520959180928172032,1298039362446176256,"@antheialol @Roblox @robloxdevrel liar, this isnt in roblox..",2022-05-02 02:51:41+00:00,,0,1,0,0,en,1520616098944909322,"[{'domain': {'id': '71', 'name': 'Video Game', 'description': 'A video game like Overwatch'}, 'entity': {'id': '1088118927580774400', 'name': 'Roblox', 'description': 'Roblox'}}]","{'mentions': [{'start': 0, 'end': 11, 'username': 'antheialol', 'id': '1301659340898697216'}, {'start': 12, 'end': 19, 'username': 'Roblox', 'id': '16745055'}, {'start': 20, 'end': 33, 'username': 'robloxdevrel', 'id': '856650515874172928'}]}",,False,,everyone,Twitter Web App
1520483953764966400,3312778732,"Been having a lot of fun on Roblox recently, shout-out to you awesome developers!",2022-04-30 19:23:18+00:00,,1,4,12,0,en,1520483953764966400,"[{'domain': {'id': '71', 'name': 'Video Game', 'description': 'A video game like Overwatch'}, 'entity': {'id': '1088118927580774400', 'name': 'Roblox', 'description': 'Roblox'}}]","{'annotations': [{'start': 28, 'end': 33, 'probability': 0.4914, 'type': 'Product', 'normalized_text': 'Roblox'}]}",,False,,everyone,Twitter for iPhone
1520257370706051073,1401851980562063367,"How much Robux do you want? 
⭐️MAX 2k #robux⭐️

Must be following @TheCodedGalaxy &amp; Retweet!",2022-04-30 04:22:56+00:00,,52,88,50,0,en,1520257370706051073,"[{'domain': {'id': '71', 'name': 'Video Game', 'description': 'A video game like Overwatch'}, 'entity': {'id': '1088118927580774400', 'name': 'Roblox', 'description': 'Roblox'}}]","{'mentions': [{'start': 66, 'end': 81, 'username': 'TheCodedGalaxy', 'id': '1401851980562063367'}], 'hashtags': [{'start': 38, 'end': 44, 'tag': 'robux'}]}",,False,,everyone,Twitter for iPhone
1520625261758230529,1359738127938580484,"One has to go, what is it?

#Minecraft #GenshinImpact #amongus #roblox https://t.co/L1OijXB1Bc",2022-05-01 04:44:48+00:00,,28,647,411,25,en,1520625261758230529,"[{'domain': {'id': '45', 'name': 'Brand Vertical', 'description': 'Top level entities that describe a Brands industry'}, 'entity': {'id': '781974597310615553', 'name': 'Entertainment'}}, {'domain': {'id': '46', 'name': 'Brand Category', 'description': 'Categories within Brand Verticals that narrow down the scope of Brands'}, 'entity': {'id': '781974597218340864', 'name': 'Video Games'}}, {'domain': {'id': '71', 'name': 'Video Game', 'description': 'A video game like Overwatch'}, 'entity': {'id': '10043689888', 'name': 'Minecraft'}}, {'domain': {'id': '71', 'name': 'Video Game', 'description': 'A video game like Overwatch'}, 'entity': {'id': '1088118927580774400', 'name': 'Roblox', 'description': 'Roblox'}}, {'domain': {'id': '71', 'name': 'Video Game', 'description': 'A video game like Overwatch'}, 'entity': {'id': '1308398176978698241', 'name': 'Among Us'}}, {'domain': {'id': '71', 'name': 'Video Game', 'description': 'A video game like Overwatch'}, 'entity': {'id': '1310987643765678083', 'name': 'Genshin Impact'}}]","{'urls': [{'start': 71, 'end': 94, 'url': 'https://t.co/L1OijXB1Bc', 'expanded_url': 'https://twitter.com/Bestie_Buddies/status/1520625261758230529/photo/1', 'display_url': 'pic.twitter.com/L1OijXB1Bc', 'media_key': '3_1520625032786894848'}, {'start': 71, 'end': 94, 'url': 'https://t.co/L1OijXB1Bc', 'expanded_url': 'https://twitter.com/Bestie_Buddies/status/1520625261758230529/photo/1', 'display_url': 'pic.twitter.com/L1OijXB1Bc', 'media_key': '3_1520625032791162881'}, {'start': 71, 'end': 94, 'url': 'https://t.co/L1OijXB1Bc', 'expanded_url': 'https://twitter.com/Bestie_Buddies/status/1520625261758230529/photo/1', 'display_url': 'pic.twitter.com/L1OijXB1Bc', 'media_key': '3_1520625032786890753'}, {'start': 71, 'end': 94, 'url': 'https://t.co/L1OijXB1Bc', 'expanded_url': 'https://twitter.com/Bestie_Buddies/status/1520625261758230529/photo/1', 'display_url': 'pic.twitter.com/L1OijXB1Bc', 'media_key': '3_1520625033663565824'}], 'hashtags': [{'start': 28, 'end': 38, 'tag': 'Minecraft'}, {'start': 39, 'end': 53, 'tag': 'GenshinImpact'}, {'start': 54, 'end': 62, 'tag': 'amongus'}, {'start': 63, 'end': 70, 'tag': 'roblox'}]}","{'media_keys': ['3_1520625032786894848', '3_1520625032791162881', '3_1520625032786890753', '3_1520625033663565824']}",False,,everyone,Twitter Web App
1520959458867785728,1449410309148471296,@KenjiDaPro11 @TheCodedGalaxy its STRIKOR 666,2022-05-02 02:52:47+00:00,,0,2,1,0,en,1520938124595015681,[],"{'mentions': [{'start': 0, 'end': 13, 'username': 'KenjiDaPro11', 'id': '1508098805337497602'}, {'start': 14, 'end': 29, 'username': 'TheCodedGalaxy', 'id': '1401851980562063367'}]}",,False,,everyone,Twitter for Android
1520869080521191424,1310688804441817088,It is my birthday tomorrow. send me all the hate comments! it's really nice to indulge myself on such a great day with the harassment and hate comments!! 🎊🎊🎊🎊,2022-05-01 20:53:39+00:00,,20,250,370,15,en,1520869080521191424,[],,,False,,everyone,Twitter Web App
1520474394438549504,1310688804441817088,"OMG GUYS FREE ROBUX!!!! THIS CANNOT BE A CLICKABIT VIDEO! NEED TO WATCH THIS 8 MIN VIDEO TO FIND OUT-- oh wait, it's fake... https://t.co/vttTkQx9Y8",2022-04-30 18:45:19+00:00,,3,31,45,1,en,1520474394438549504,[],"{'urls': [{'start': 125, 'end': 148, 'url': 'https://t.co/vttTkQx9Y8', 'expanded_url': 'https://twitter.com/Parlo_ROBLOX/status/1520474394438549504/photo/1', 'display_url': 'pic.twitter.com/vttTkQx9Y8', 'media_key': '3_1520474258383814657'}]}",{'media_keys': ['3_1520474258383814657']},False,,everyone,Twitter Web App
