tweetid,author_id,text,created_at,geo,retweets,replies,likes,quote_count,lang,conversation_id,context_annotations,entities,attachments,possibly_sensitive,withheld,reply_settings,source
1526819622950801409,1484558142726094851,"WAIT WHAT THRY RUINED THE CLEETUS THE PENGUIN BODY IS RUINED, WHY DID I JUST KNOW THIS, NOOOOO",2022-05-18 06:58:59+00:00,,0,1,1,0,en,1526819622950801409,[],,,False,,everyone,Twitter for Android
1526683986805657600,1056053249470541824,Everyone has their favorite developer! Down below tell us who they are and why they are your inspiration!🌟,2022-05-17 22:00:01+00:00,,28,547,1117,5,en,1526683986805657600,[],,,False,,everyone,TweetDeck
1526594146382774273,1345745264263491585,@XmoondropsimpX @Roblox @charli_xcx @SamsungMobileUS like they care...,2022-05-17 16:03:01+00:00,,0,1,1,0,en,1525118592320159744,"[{'domain': {'id': '71', 'name': 'Video Game', 'description': 'A video game like Overwatch'}, 'entity': {'id': '1088118927580774400', 'name': 'Roblox', 'description': 'Roblox'}}, {'domain': {'id': '10', 'name': 'Person', 'description': 'Named people in the world like Nelson Mandela'}, 'entity': {'id': '885602209618051072', 'name': 'Charli XCX', 'description': 'CHARLI XCX'}}, {'domain': {'id': '47', 'name': 'Brand', 'description': 'Brands and Companies'}, 'entity': {'id': '10026364234', 'name': 'Samsung '}}, {'domain': {'id': '48', 'name': 'Product', 'description': 'Products created by Brands.  Examples: Ford Explorer, Apple iPhone.'}, 'entity': {'id': '10026331316', 'name': 'Samsung Mobile'}}, {'domain': {'id': '49', 'name': 'Product Version', 'description': ""The specific model or version of a product.  Examples: Audi A8, Ben & Jerry's Chocolate Chip Ice Cream""}, 'entity': {'id': '10041364617', 'name': 'Samsung Mobile US'}}, {'domain': {'id': '54', 'name': 'Musician', 'description': 'A musician in the world, like Adele or Bob Dylan'}, 'entity': {'id': '885602209618051072', 'name': 'Charli XCX', 'description': 'CHARLI XCX'}}, {'domain': {'id': '55', 'name': 'Music Genre', 'description': 'A category for a musical style, like Pop, Rock, or Rap'}, 'entity': {'id': '810938279801470977', 'name': 'Pop', 'description': 'Pop'}}, {'domain': {'id': '30', 'name': 'Entities [Entity Service]', 'description': 'Entity Service top level domain, every item that is in Entity Service should be in this domain'}, 'entity': {'id': '848920371311001600', 'name': 'Technology', 'description': 'Technology and computing'}}, {'domain': {'id': '66', 'name': 'Interests and Hobbies Category', 'description': 'A grouping of interests and hobbies entities, like Novelty Food or Destinations'}, 'entity': {'id': '848920700073123840', 'name': 'Cell Phones', 'description': 'Cell phones'}}, {'domain': {'id': '30', 'name': 'Entities [Entity Service]', 'description': 'Entity Service top level domain, every item that is in Entity Service should be in this domain'}, 'entity': {'id': '848985956778561538', 'name': 'Mobile', 'description': 'Mobile'}}]","{'mentions': [{'start': 0, 'end': 15, 'username': 'XmoondropsimpX', 'id': '1523065657084248064'}, {'start': 16, 'end': 23, 'username': 'Roblox', 'id': '16745055'}, {'start': 24, 'end': 35, 'username': 'charli_xcx', 'id': '103012173'}, {'start': 36, 'end': 52, 'username': 'SamsungMobileUS', 'id': '14117843'}]}",,False,,everyone,Twitter Web App
1526819610796109824,1483282676392292354,"Roblox took out $7 out of my bank yesterday at 10pm 💀 I wasn’t on roblox and haven’t been on roblox for 3 days, bro roblox trying to scam me.",2022-05-18 06:58:56+00:00,,9,13,47,0,en,1526819610796109824,"[{'domain': {'id': '71', 'name': 'Video Game', 'description': 'A video game like Overwatch'}, 'entity': {'id': '1088118927580774400', 'name': 'Roblox', 'description': 'Roblox'}}]","{'annotations': [{'start': 0, 'end': 5, 'probability': 0.4316, 'type': 'Organization', 'normalized_text': 'Roblox'}]}",,False,,everyone,Twitter for iPhone
1526546294042689536,1441683833934385165,"♡Adopt me giveaway!♡

Giving away a neon kangaroo if I hit 1k subs by 1st August.

🌈HOW TO ENTER:
☆Follow me➕,Like this post♥️ &amp; Retweet🔄
☆Sub to my YT with notifications🔔

https://t.co/xlPsMhCSjb

✨NO EXTRAS✨
Goodluck!😊

#adoptme #roblox #robloxgiveaway #adoptmegw https://t.co/uX8huwWcd0",2022-05-17 12:52:53+00:00,,143,88,118,5,en,1526546294042689536,"[{'domain': {'id': '71', 'name': 'Video Game', 'description': 'A video game like Overwatch'}, 'entity': {'id': '1088118927580774400', 'name': 'Roblox', 'description': 'Roblox'}}, {'domain': {'id': '71', 'name': 'Video Game', 'description': 'A video game like Overwatch'}, 'entity': {'id': '1229416301245763584', 'name': 'Adopt Me'}}]","{'urls': [{'start': 177, 'end': 200, 'url': 'https://t.co/xlPsMhCSjb', 'expanded_url': 'http://youtube.com/c/JazzyPlays', 'display_url': 'youtube.com/c/JazzyPlays', 'images': [{'url': 'https://pbs.twimg.com/news_img/1538058937672822785/sJ-aZnWE?format=jpg&name=orig', 'width': 900, 'height': 900}, {'url': 'https://pbs.twimg.com/news_img/1538058937672822785/sJ-aZnWE?format=jpg&name=150x150', 'width': 150, 'height': 150}], 'status': 200, 'title': 'Jazzy Plays', 'description': '✎ Hi! I\'m Jazzy! 😎😜💖 ╰┈➤ Welcome to my channel! 🌈🎮 ╰┈➤ I mostly do adopt me content, host giveaways on my channel and more! Also, I post once every week! ╰┈➤ Want to check out some Roblox edits made, check out my other channel, awhxjazz!🌹 ╰┈➤ My post schedule! ✨ ╰┈➤ Every Tuesday at 6pm (Time zone: GMT +8) 😇 *ੈ✩‧₊˚ For editing, I use Capcut, Inshot and KineMaster! :))) ੈ✩‧₊˚ ꒰🤗꒱ My roblox username: JKlovescubing 😇 ꒰🙃꒱ My roblox group: Jazzy Plays Squad ✨✨ ✧˚ · . Follow me on roblox because my joins are on and you can join me in game! UwU ༉‧₊˚. Always know that you are YOURSELF and you and WONDERFUL in YOUR OWN WAY! 🍡 Stay positive! 💟 ""Act as if what you\'re doing makes a difference. It does."" ~Willam James ""You are never too old to set another goal or to dream a new dream."" ~C.S. Lewis “The whole secret of a successful life is to find out what is one’s destiny to do, and then do it.” ~Henry Ford Hope you will have a wonderful day ahead! Don’t forgot to subscribe! ✨🌈', 'unwound_url': 'https://www.youtube.com/c/JazzyPlays'}, {'start': 270, 'end': 293, 'url': 'https://t.co/uX8huwWcd0', 'expanded_url': 'https://twitter.com/_jazzy_roblox_/status/1526546294042689536/photo/1', 'display_url': 'pic.twitter.com/uX8huwWcd0', 'media_key': '3_1526546213042270208'}], 'hashtags': [{'start': 226, 'end': 234, 'tag': 'adoptme'}, {'start': 235, 'end': 242, 'tag': 'roblox'}, {'start': 243, 'end': 258, 'tag': 'robloxgiveaway'}, {'start': 259, 'end': 269, 'tag': 'adoptmegw'}]}",{'media_keys': ['3_1526546213042270208']},False,,everyone,Twitter Web App
1526819140492738561,1301913999597076482,@Realmo_zZ @KarlJacobs_ @Skeppy @BadBoyHalo @Quackity @quackity4k @tommyinnit @tommyaltinnit @tomsimons @Technothepig  I would also also like to be friends with Quackity and Tommyinnit and Technoblade (although the 2 of them played Roblox once(Tommyinnit and Technoblade are the 2)).,2022-05-18 06:57:04+00:00,,0,1,0,0,en,1526557402417577988,"[{'domain': {'id': '10', 'name': 'Person', 'description': 'Named people in the world like Nelson Mandela'}, 'entity': {'id': '1252212858575675394', 'name': 'Quackity'}}, {'domain': {'id': '10', 'name': 'Person', 'description': 'Named people in the world like Nelson Mandela'}, 'entity': {'id': '1253730139352887296', 'name': 'BadBoyHalo'}}, {'domain': {'id': '10', 'name': 'Person', 'description': 'Named people in the world like Nelson Mandela'}, 'entity': {'id': '1253784072461008896', 'name': 'Skeppy'}}, {'domain': {'id': '10', 'name': 'Person', 'description': 'Named people in the world like Nelson Mandela'}, 'entity': {'id': '1254792182738808833', 'name': 'Technoblade'}}, {'domain': {'id': '10', 'name': 'Person', 'description': 'Named people in the world like Nelson Mandela'}, 'entity': {'id': '1428003418195435523', 'name': 'TommyInnit'}}, {'domain': {'id': '10', 'name': 'Person', 'description': 'Named people in the world like Nelson Mandela'}, 'entity': {'id': '1428005552668352525', 'name': 'Karl Jacobs'}}, {'domain': {'id': '71', 'name': 'Video Game', 'description': 'A video game like Overwatch'}, 'entity': {'id': '1088118927580774400', 'name': 'Roblox', 'description': 'Roblox'}}, {'domain': {'id': '120', 'name': 'Digital Creator', 'description': 'Influencers who create content on digital platforms'}, 'entity': {'id': '1252212858575675394', 'name': 'Quackity'}}, {'domain': {'id': '120', 'name': 'Digital Creator', 'description': 'Influencers who create content on digital platforms'}, 'entity': {'id': '1253730139352887296', 'name': 'BadBoyHalo'}}, {'domain': {'id': '120', 'name': 'Digital Creator', 'description': 'Influencers who create content on digital platforms'}, 'entity': {'id': '1253784072461008896', 'name': 'Skeppy'}}, {'domain': {'id': '120', 'name': 'Digital Creator', 'description': 'Influencers who create content on digital platforms'}, 'entity': {'id': '1254792182738808833', 'name': 'Technoblade'}}, {'domain': {'id': '120', 'name': 'Digital Creator', 'description': 'Influencers who create content on digital platforms'}, 'entity': {'id': '1428005552668352525', 'name': 'Karl Jacobs'}}, {'domain': {'id': '136', 'name': 'Video Game Personality ', 'description': ''}, 'entity': {'id': '1254792182738808833', 'name': 'Technoblade'}}, {'domain': {'id': '136', 'name': 'Video Game Personality ', 'description': ''}, 'entity': {'id': '1428003418195435523', 'name': 'TommyInnit'}}, {'domain': {'id': '136', 'name': 'Video Game Personality ', 'description': ''}, 'entity': {'id': '1428005552668352525', 'name': 'Karl Jacobs'}}]","{'annotations': [{'start': 161, 'end': 168, 'probability': 0.755, 'type': 'Person', 'normalized_text': 'Quackity'}, {'start': 174, 'end': 183, 'probability': 0.6509, 'type': 'Person', 'normalized_text': 'Tommyinnit'}, {'start': 189, 'end': 199, 'probability': 0.4917, 'type': 'Person', 'normalized_text': 'Technoblade'}, {'start': 232, 'end': 237, 'probability': 0.3643, 'type': 'Other', 'normalized_text': 'Roblox'}, {'start': 259, 'end': 269, 'probability': 0.4482, 'type': 'Person', 'normalized_text': 'Technoblade'}], 'mentions': [{'start': 0, 'end': 10, 'username': 'Realmo_zZ', 'id': '1365273368040247296'}, {'start': 11, 'end': 23, 'username': 'KarlJacobs_', 'id': '2653325339'}, {'start': 24, 'end': 31, 'username': 'Skeppy', 'id': '1119459925288267776'}, {'start': 32, 'end': 43, 'username': 'BadBoyHalo', 'id': '628875141'}, {'start': 44, 'end': 53, 'username': 'Quackity', 'id': '2260704146'}, {'start': 54, 'end': 65, 'username': 'quackity4k', 'id': '1169025294642102274'}, {'start': 66, 'end': 77, 'username': 'tommyinnit', 'id': '1032978119370723329'}, {'start': 78, 'end': 92, 'username': 'tommyaltinnit', 'id': '1373748437309653004'}, {'start': 93, 'end': 103, 'username': 'tomsimons', 'id': '1379779219065028612'}, {'start': 104, 'end': 117, 'username': 'Technothepig', 'id': '2413696970'}]}",,False,,everyone,Twitter Web App
1526816360856051712,2920412930,me and @M_Bandit_ carrying casuals like always even in roblox splatoon https://t.co/FauiOjQ2we,2022-05-18 06:46:01+00:00,,22,17,331,1,en,1526816360856051712,"[{'domain': {'id': '71', 'name': 'Video Game', 'description': 'A video game like Overwatch'}, 'entity': {'id': '854949050151452672', 'name': 'Splatoon', 'description': 'This entity includes all conversation about the franchise, as well as any individual installments in the series, if applicable.\t\t\t'}}, {'domain': {'id': '71', 'name': 'Video Game', 'description': 'A video game like Overwatch'}, 'entity': {'id': '1088118927580774400', 'name': 'Roblox', 'description': 'Roblox'}}]","{'urls': [{'start': 71, 'end': 94, 'url': 'https://t.co/FauiOjQ2we', 'expanded_url': 'https://twitter.com/april_hydra/status/1526816360856051712/photo/1', 'display_url': 'pic.twitter.com/FauiOjQ2we', 'media_key': '3_1526816355176943616'}, {'start': 71, 'end': 94, 'url': 'https://t.co/FauiOjQ2we', 'expanded_url': 'https://twitter.com/april_hydra/status/1526816360856051712/photo/1', 'display_url': 'pic.twitter.com/FauiOjQ2we', 'media_key': '3_1526816355181162496'}], 'annotations': [{'start': 55, 'end': 69, 'probability': 0.4509, 'type': 'Product', 'normalized_text': 'roblox splatoon'}], 'mentions': [{'start': 7, 'end': 17, 'username': 'M_Bandit_', 'id': '1257219802885533701'}]}","{'media_keys': ['3_1526816355176943616', '3_1526816355181162496']}",False,,everyone,Twitter for iPhone
1526802816140029952,1375093081972867078,@JuviaPlayz @ctf_well infinite ikea got ruined? pls explain i thought it never got changed,2022-05-18 05:52:12+00:00,,0,1,0,0,en,1526204089033449473,"[{'domain': {'id': '45', 'name': 'Brand Vertical', 'description': 'Top level entities that describe a Brands industry'}, 'entity': {'id': '781974596706635776', 'name': 'Retail'}}, {'domain': {'id': '46', 'name': 'Brand Category', 'description': 'Categories within Brand Verticals that narrow down the scope of Brands'}, 'entity': {'id': '783350882985385984', 'name': 'Home'}}, {'domain': {'id': '47', 'name': 'Brand', 'description': 'Brands and Companies'}, 'entity': {'id': '10026951194', 'name': 'IKEA'}}, {'domain': {'id': '65', 'name': 'Interests and Hobbies Vertical', 'description': 'Top level interests and hobbies groupings, like Food or Travel'}, 'entity': {'id': '864911475436957696', 'name': 'Home and garden', 'description': 'Home and garden'}}]","{'annotations': [{'start': 22, 'end': 34, 'probability': 0.2927, 'type': 'Product', 'normalized_text': 'infinite ikea'}], 'mentions': [{'start': 0, 'end': 11, 'username': 'JuviaPlayz', 'id': '1215987707400413189'}]}",,False,,everyone,Twitter for Android
1526275297380802560,2233792838,"Very limited stock! Be the first to get your hands on them - don't miss out! Expected to sell out fast (as per usual)

🔗 Watch our Twitter for more news &amp; link to purchase on Friday! https://t.co/y3Tm2tHK5U",2022-05-16 18:56:02+00:00,,125,462,1990,8,en,1526275294578999296,"[{'domain': {'id': '165', 'name': 'Technology', 'description': 'for individual and types of technology, e.g., food technology, 3D printing'}, 'entity': {'id': '1196446161223028736', 'name': 'Social media'}}, {'domain': {'id': '46', 'name': 'Brand Category', 'description': 'Categories within Brand Verticals that narrow down the scope of Brands'}, 'entity': {'id': '781974596752842752', 'name': 'Services'}}, {'domain': {'id': '47', 'name': 'Brand', 'description': 'Brands and Companies'}, 'entity': {'id': '10045225402', 'name': 'Twitter'}}, {'domain': {'id': '165', 'name': 'Technology', 'description': 'for individual and types of technology, e.g., food technology, 3D printing'}, 'entity': {'id': '1196446161223028736', 'name': 'Social media'}}]","{'urls': [{'start': 187, 'end': 210, 'url': 'https://t.co/y3Tm2tHK5U', 'expanded_url': 'https://twitter.com/BuildIntoGames/status/1526275297380802560/photo/1', 'display_url': 'pic.twitter.com/y3Tm2tHK5U', 'media_key': '3_1526273785929904129'}, {'start': 187, 'end': 210, 'url': 'https://t.co/y3Tm2tHK5U', 'expanded_url': 'https://twitter.com/BuildIntoGames/status/1526275297380802560/photo/1', 'display_url': 'pic.twitter.com/y3Tm2tHK5U', 'media_key': '3_1526273785946677249'}], 'annotations': [{'start': 132, 'end': 138, 'probability': 0.5465, 'type': 'Product', 'normalized_text': 'Twitter'}]}","{'media_keys': ['3_1526273785929904129', '3_1526273785946677249']}",False,,everyone,Twitter Web App
1526818814926913537,1126741033583136768,what can I tweet,2022-05-18 06:55:47+00:00,,0,3,6,0,en,1526818814926913537,"[{'domain': {'id': '46', 'name': 'Brand Category', 'description': 'Categories within Brand Verticals that narrow down the scope of Brands'}, 'entity': {'id': '781974596752842752', 'name': 'Services'}}, {'domain': {'id': '47', 'name': 'Brand', 'description': 'Brands and Companies'}, 'entity': {'id': '10045225402', 'name': 'Twitter'}}]",,,False,,everyone,Twitter for iPad
1526162214247448579,2287098931,did someone hack my roblox account?!,2022-05-16 11:26:41+00:00,,24,223,457,3,en,1526162214247448579,"[{'domain': {'id': '71', 'name': 'Video Game', 'description': 'A video game like Overwatch'}, 'entity': {'id': '1088118927580774400', 'name': 'Roblox', 'description': 'Roblox'}}]","{'annotations': [{'start': 20, 'end': 25, 'probability': 0.4514, 'type': 'Product', 'normalized_text': 'roblox'}]}",,False,,everyone,Twitter Web App
1526818422562201601,1301913999597076482,@Realmo_zZ @KarlJacobs_ @Skeppy @BadBoyHalo I know Karl and Skeppy and Bad Boy Halo are Minecraft yters but I would like to be friends with them because they play Roblox as well as Minecraft.,2022-05-18 06:54:13+00:00,,0,1,0,0,en,1526557402417577988,"[{'domain': {'id': '10', 'name': 'Person', 'description': 'Named people in the world like Nelson Mandela'}, 'entity': {'id': '1253730139352887296', 'name': 'BadBoyHalo'}}, {'domain': {'id': '10', 'name': 'Person', 'description': 'Named people in the world like Nelson Mandela'}, 'entity': {'id': '1253784072461008896', 'name': 'Skeppy'}}, {'domain': {'id': '10', 'name': 'Person', 'description': 'Named people in the world like Nelson Mandela'}, 'entity': {'id': '1428005552668352525', 'name': 'Karl Jacobs'}}, {'domain': {'id': '45', 'name': 'Brand Vertical', 'description': 'Top level entities that describe a Brands industry'}, 'entity': {'id': '781974597310615553', 'name': 'Entertainment'}}, {'domain': {'id': '46', 'name': 'Brand Category', 'description': 'Categories within Brand Verticals that narrow down the scope of Brands'}, 'entity': {'id': '781974597218340864', 'name': 'Video Games'}}, {'domain': {'id': '71', 'name': 'Video Game', 'description': 'A video game like Overwatch'}, 'entity': {'id': '10024663350', 'name': 'Halo', 'description': 'This entity includes all conversation about the franchise, as well as any individual installments in the series, if applicable.\t\t\t'}}, {'domain': {'id': '71', 'name': 'Video Game', 'description': 'A video game like Overwatch'}, 'entity': {'id': '10043689888', 'name': 'Minecraft'}}, {'domain': {'id': '71', 'name': 'Video Game', 'description': 'A video game like Overwatch'}, 'entity': {'id': '1088118927580774400', 'name': 'Roblox', 'description': 'Roblox'}}, {'domain': {'id': '120', 'name': 'Digital Creator', 'description': 'Influencers who create content on digital platforms'}, 'entity': {'id': '1253730139352887296', 'name': 'BadBoyHalo'}}, {'domain': {'id': '120', 'name': 'Digital Creator', 'description': 'Influencers who create content on digital platforms'}, 'entity': {'id': '1253784072461008896', 'name': 'Skeppy'}}, {'domain': {'id': '120', 'name': 'Digital Creator', 'description': 'Influencers who create content on digital platforms'}, 'entity': {'id': '1428005552668352525', 'name': 'Karl Jacobs'}}, {'domain': {'id': '130', 'name': 'Multimedia Franchise', 'description': ""Franchises which span multiple forms of media like 'Harry Potter'""}, 'entity': {'id': '10024663350', 'name': 'Halo', 'description': 'This entity includes all conversation about the franchise, as well as any individual installments in the series, if applicable.\t\t\t'}}, {'domain': {'id': '136', 'name': 'Video Game Personality ', 'description': ''}, 'entity': {'id': '1428005552668352525', 'name': 'Karl Jacobs'}}]","{'annotations': [{'start': 51, 'end': 54, 'probability': 0.9199, 'type': 'Person', 'normalized_text': 'Karl'}, {'start': 60, 'end': 65, 'probability': 0.7057, 'type': 'Person', 'normalized_text': 'Skeppy'}, {'start': 71, 'end': 82, 'probability': 0.3067, 'type': 'Product', 'normalized_text': 'Bad Boy Halo'}, {'start': 88, 'end': 96, 'probability': 0.6236, 'type': 'Product', 'normalized_text': 'Minecraft'}, {'start': 163, 'end': 168, 'probability': 0.4222, 'type': 'Product', 'normalized_text': 'Roblox'}, {'start': 181, 'end': 189, 'probability': 0.6989, 'type': 'Product', 'normalized_text': 'Minecraft'}], 'mentions': [{'start': 0, 'end': 10, 'username': 'Realmo_zZ', 'id': '1365273368040247296'}, {'start': 11, 'end': 23, 'username': 'KarlJacobs_', 'id': '2653325339'}, {'start': 24, 'end': 31, 'username': 'Skeppy', 'id': '1119459925288267776'}, {'start': 32, 'end': 43, 'username': 'BadBoyHalo', 'id': '628875141'}]}",,False,,everyone,Twitter Web App
1526818847118204928,1280815590257463297,"Is anybody willing to donate me 5 robux without tax? :'D 

#robux #roblox #rh #royalehightrades #rhd #robuxtrades",2022-05-18 06:55:54+00:00,,3,2,1,0,en,1526818847118204928,"[{'domain': {'id': '29', 'name': 'Events [Entity Service]', 'description': 'Entity Service related Events domain'}, 'entity': {'id': '1517623051860414465', 'name': 'World Environment Day'}}, {'domain': {'id': '71', 'name': 'Video Game', 'description': 'A video game like Overwatch'}, 'entity': {'id': '1088118927580774400', 'name': 'Roblox', 'description': 'Roblox'}}, {'domain': {'id': '71', 'name': 'Video Game', 'description': 'A video game like Overwatch'}, 'entity': {'id': '1230882318224510978', 'name': 'Royale High'}}]","{'hashtags': [{'start': 59, 'end': 65, 'tag': 'robux'}, {'start': 66, 'end': 73, 'tag': 'roblox'}, {'start': 74, 'end': 77, 'tag': 'rh'}, {'start': 78, 'end': 95, 'tag': 'royalehightrades'}, {'start': 96, 'end': 100, 'tag': 'rhd'}, {'start': 101, 'end': 113, 'tag': 'robuxtrades'}]}",,False,,everyone,Twitter for Android
1526818682240135168,1485972569300017152,"→ 20 #robux giveaway ₊˚. ♡
╰→ 2 winner, 10 each ! •

💛 Follow me w/notis ←
💛 Like and retweet ←",2022-05-18 06:55:15+00:00,,78,60,84,3,en,1526818682240135168,"[{'domain': {'id': '71', 'name': 'Video Game', 'description': 'A video game like Overwatch'}, 'entity': {'id': '1088118927580774400', 'name': 'Roblox', 'description': 'Roblox'}}]","{'hashtags': [{'start': 5, 'end': 11, 'tag': 'robux'}]}",,False,,everyone,Twitter for Android
1526709509195980806,1324836609741725696,Reply with your #1 favorite Roblox game,2022-05-17 23:41:26+00:00,,1,57,39,0,en,1526709509195980806,"[{'domain': {'id': '71', 'name': 'Video Game', 'description': 'A video game like Overwatch'}, 'entity': {'id': '1088118927580774400', 'name': 'Roblox', 'description': 'Roblox'}}]","{'annotations': [{'start': 28, 'end': 33, 'probability': 0.4602, 'type': 'Product', 'normalized_text': 'Roblox'}]}",,False,,everyone,Twitter Web App
1526801910501711877,136748745,bro wat do 10 year old girls want for their bday??? i am so out of the loop apologies to my cousin in advance,2022-05-18 05:48:36+00:00,,0,4,4,0,en,1526801910501711877,[],,,False,,everyone,Twitter for iPhone
1526303140873658375,1260561495898894336,Take me back roblox https://t.co/q4DOjGpOtl,2022-05-16 20:46:40+00:00,,384,339,5351,52,en,1526303140873658375,"[{'domain': {'id': '71', 'name': 'Video Game', 'description': 'A video game like Overwatch'}, 'entity': {'id': '1088118927580774400', 'name': 'Roblox', 'description': 'Roblox'}}]","{'urls': [{'start': 20, 'end': 43, 'url': 'https://t.co/q4DOjGpOtl', 'expanded_url': 'https://twitter.com/DziredRblx/status/1526303140873658375/photo/1', 'display_url': 'pic.twitter.com/q4DOjGpOtl', 'media_key': '3_1526303137618972674'}]}",{'media_keys': ['3_1526303137618972674']},False,,everyone,Twitter for iPhone
1526799363174846464,4630461859,@ILYYWNFT @PlayBlankos @Aicelle40  @klarkgwapo @TerenceNorbert @shinaogi,2022-05-18 05:38:29+00:00,,0,1,0,0,qam,1526773540023808000,[],"{'mentions': [{'start': 0, 'end': 9, 'username': 'ILYYWNFT', 'id': '1475726345149714436'}, {'start': 10, 'end': 22, 'username': 'PlayBlankos', 'id': '1045027874435026945'}, {'start': 23, 'end': 33, 'username': 'Aicelle40', 'id': '1189903344401207297'}, {'start': 35, 'end': 46, 'username': 'klarkgwapo', 'id': '52751654'}, {'start': 47, 'end': 62, 'username': 'TerenceNorbert', 'id': '60314727'}, {'start': 63, 'end': 72, 'username': 'shinaogi', 'id': '78167445'}]}",,False,,everyone,Twitter for iPhone
1526496533293957120,1420318284986019842,"Adopt me legendary pets giveaway!!

5 winners - 1 pet each

How to join? 
- Follow me and @LxvinqLia 
-Like and rt 
-RT with tags 
-Comment which one do you want

For higher chances of winning, 
Tags friends 
and that's it! 

Gl everyone :))

#adoptmegiveaway #adoptme #amtrades https://t.co/K0iV4R5ICl",2022-05-17 09:35:09+00:00,,81,86,92,75,en,1526496533293957120,[],"{'urls': [{'start': 279, 'end': 302, 'url': 'https://t.co/K0iV4R5ICl', 'expanded_url': 'https://twitter.com/Lxvinq_Ashlynn/status/1526496533293957120/photo/1', 'display_url': 'pic.twitter.com/K0iV4R5ICl', 'media_key': '3_1526496171916955648'}], 'mentions': [{'start': 90, 'end': 100, 'username': 'LxvinqLia', 'id': '1466384855181053960'}], 'hashtags': [{'start': 243, 'end': 259, 'tag': 'adoptmegiveaway'}, {'start': 260, 'end': 268, 'tag': 'adoptme'}, {'start': 269, 'end': 278, 'tag': 'amtrades'}]}",{'media_keys': ['3_1526496171916955648']},False,,everyone,Twitter Web App
1526716568608055296,1523453015654551552,"why does no one wanna play roblox with me :,))) i promise i’ll give the sloppiest toppy after 🥹🥹 #nsfwtwt",2022-05-18 00:09:29+00:00,,0,2,10,0,en,1526716568608055296,[],"{'hashtags': [{'start': 97, 'end': 105, 'tag': 'nsfwtwt'}]}",,False,,everyone,Twitter for iPhone
1526557402417577988,1365273368040247296,"If you could become friends with ONE roblox youtuber, who would it be?🤔",2022-05-17 13:37:01+00:00,,26,481,424,8,en,1526557402417577988,"[{'domain': {'id': '71', 'name': 'Video Game', 'description': 'A video game like Overwatch'}, 'entity': {'id': '1088118927580774400', 'name': 'Roblox', 'description': 'Roblox'}}]",,,False,,everyone,Twitter Web App
