tweetid,author_id,text,created_at,geo,retweets,replies,likes,quote_count,lang,conversation_id,context_annotations,entities,attachments,possibly_sensitive,withheld,reply_settings,source
1519692924212203524,1145825695941222400,"🎩 Hats! Hats! Hats! 🎩
👒New Accessories in loads of themes!
🐕 Dress up your pet today! https://t.co/Mqvz8OUK5c",2022-04-28 15:00:02+00:00,,131,439,2357,16,en,1519692924212203524,"[{'domain': {'id': '67', 'name': 'Interests and Hobbies', 'description': 'Interests, opinions, and behaviors of individuals, groups, or cultures; like Speciality Cooking or Theme Parks'}, 'entity': {'id': '846447164880433152', 'name': 'Fashion accessories', 'description': 'Accessories'}}, {'domain': {'id': '71', 'name': 'Video Game', 'description': 'A video game like Overwatch'}, 'entity': {'id': '1229416301245763584', 'name': 'Adopt Me'}}]","{'urls': [{'start': 86, 'end': 109, 'url': 'https://t.co/Mqvz8OUK5c', 'expanded_url': 'https://twitter.com/PlayAdoptMe/status/1519692924212203524/photo/1', 'display_url': 'pic.twitter.com/Mqvz8OUK5c', 'media_key': '3_1518615461134540800'}]}",{'media_keys': ['3_1518615461134540800']},False,,everyone,Twitter Web App
1519068006566948864,16745055,"From everyone here on the marketing team: it's an absolute joy working with you, Barbara. Congratulations!

(And for anyone who wants to share the joy, open roles are here: https://t.co/nFoxBBEgCC) https://t.co/iOlNF9pGAO",2022-04-26 21:36:50+00:00,,57,314,1236,4,en,1519068006566948864,"[{'domain': {'id': '66', 'name': 'Interests and Hobbies Category', 'description': 'A grouping of interests and hobbies entities, like Novelty Food or Destinations'}, 'entity': {'id': '857879016971186177', 'name': 'Marketing', 'description': 'Marketing'}}, {'domain': {'id': '71', 'name': 'Video Game', 'description': 'A video game like Overwatch'}, 'entity': {'id': '1088118927580774400', 'name': 'Roblox', 'description': 'Roblox'}}, {'domain': {'id': '164', 'name': 'Fields of study', 'description': 'for all fields of study, e.g., futurology, microbiology '}, 'entity': {'id': '1278093262406815744', 'name': 'Fields of study'}}]","{'annotations': [{'start': 81, 'end': 87, 'probability': 0.9674, 'type': 'Person', 'normalized_text': 'Barbara'}], 'urls': [{'start': 173, 'end': 196, 'url': 'https://t.co/nFoxBBEgCC', 'expanded_url': 'http://roblox.com/careers', 'display_url': 'roblox.com/careers', 'status': 503, 'unwound_url': 'https://www.roblox.com/careers'}, {'start': 198, 'end': 221, 'url': 'https://t.co/iOlNF9pGAO', 'expanded_url': 'https://twitter.com/barbmessing/status/1519045073677160448', 'display_url': 'twitter.com/barbmessing/st…'}]}",,False,,everyone,Twitter Web App
1519740025608589314,1513390878710276096,"@Roblox @bretmanrock @lizzo @whoisgayle why can't just give us some free robux?:""(",2022-04-28 18:07:12+00:00,,0,1,1,0,en,1519695192336388098,"[{'domain': {'id': '10', 'name': 'Person', 'description': 'Named people in the world like Nelson Mandela'}, 'entity': {'id': '1117789006916243456', 'name': 'Lizzo', 'description': 'American rapper'}}, {'domain': {'id': '10', 'name': 'Person', 'description': 'Named people in the world like Nelson Mandela'}, 'entity': {'id': '1141044727136940032', 'name': 'Bretman Rock', 'description': 'Bretman Rock'}}, {'domain': {'id': '54', 'name': 'Musician', 'description': 'A musician in the world, like Adele or Bob Dylan'}, 'entity': {'id': '1117789006916243456', 'name': 'Lizzo', 'description': 'American rapper'}}, {'domain': {'id': '55', 'name': 'Music Genre', 'description': 'A category for a musical style, like Pop, Rock, or Rap'}, 'entity': {'id': '810937888334487552', 'name': 'Rap', 'description': 'Hip-Hop/Rap'}}, {'domain': {'id': '71', 'name': 'Video Game', 'description': 'A video game like Overwatch'}, 'entity': {'id': '1088118927580774400', 'name': 'Roblox', 'description': 'Roblox'}}, {'domain': {'id': '120', 'name': 'Digital Creator', 'description': 'Influencers who create content on digital platforms'}, 'entity': {'id': '1141044727136940032', 'name': 'Bretman Rock', 'description': 'Bretman Rock'}}]","{'mentions': [{'start': 0, 'end': 7, 'username': 'Roblox', 'id': '16745055'}, {'start': 8, 'end': 20, 'username': 'bretmanrock', 'id': '291547392'}, {'start': 21, 'end': 27, 'username': 'lizzo', 'id': '323417384'}, {'start': 28, 'end': 39, 'username': 'whoisgayle', 'id': '1098295826424713216'}]}",,False,,everyone,Twitter for Android
1519737742405824512,1183466139961176064,"my life is simple. play roblox, eat ice cream, watch disney, love &amp; care for animals ♡",2022-04-28 17:58:07+00:00,,0,1,9,0,en,1519737742405824512,"[{'domain': {'id': '71', 'name': 'Video Game', 'description': 'A video game like Overwatch'}, 'entity': {'id': '1088118927580774400', 'name': 'Roblox', 'description': 'Roblox'}}, {'domain': {'id': '45', 'name': 'Brand Vertical', 'description': 'Top level entities that describe a Brands industry'}, 'entity': {'id': '781974597310615553', 'name': 'Entertainment'}}, {'domain': {'id': '46', 'name': 'Brand Category', 'description': 'Categories within Brand Verticals that narrow down the scope of Brands'}, 'entity': {'id': '781974597105094656', 'name': 'TV/Movies Related'}}, {'domain': {'id': '47', 'name': 'Brand', 'description': 'Brands and Companies'}, 'entity': {'id': '10037284711', 'name': 'Disney'}}]","{'annotations': [{'start': 53, 'end': 58, 'probability': 0.31, 'type': 'Product', 'normalized_text': 'disney'}]}",,False,,everyone,Twitter for iPhone
1519738637117763590,1302677966938411009,"Algunos usuarios están sufriendo problemas al entrar en experiencias de Roblox.

Les informaremos de cada actualización de lo que esté pasando.

#RobloxDown https://t.co/WFS4wImfA1",2022-04-28 18:01:41+00:00,,3,4,28,1,es,1519738637117763590,"[{'domain': {'id': '71', 'name': 'Video Game', 'description': 'A video game like Overwatch'}, 'entity': {'id': '1088118927580774400', 'name': 'Roblox', 'description': 'Roblox'}}]","{'annotations': [{'start': 72, 'end': 77, 'probability': 0.3769, 'type': 'Product', 'normalized_text': 'Roblox'}], 'urls': [{'start': 157, 'end': 180, 'url': 'https://t.co/WFS4wImfA1', 'expanded_url': 'https://twitter.com/Labu_News/status/1519738637117763590/photo/1', 'display_url': 'pic.twitter.com/WFS4wImfA1', 'media_key': '3_1519738395370700802'}], 'hashtags': [{'start': 145, 'end': 156, 'tag': 'RobloxDown'}]}",{'media_keys': ['3_1519738395370700802']},False,,everyone,Twitter Web App
1519695192336388098,16745055,"Music fans, join us on @Roblox this Saturday for the 2nd annual Song Breaker Awards. The show starring host @bretmanrock and performers @lizzo and @whoisgayle will be live at 10AM PST. See you there! https://t.co/y83wU0644X https://t.co/rnTQm4dqNx",2022-04-28 15:09:03+00:00,,133,616,2057,18,en,1519695192336388098,"[{'domain': {'id': '10', 'name': 'Person', 'description': 'Named people in the world like Nelson Mandela'}, 'entity': {'id': '1117789006916243456', 'name': 'Lizzo', 'description': 'American rapper'}}, {'domain': {'id': '10', 'name': 'Person', 'description': 'Named people in the world like Nelson Mandela'}, 'entity': {'id': '1141044727136940032', 'name': 'Bretman Rock', 'description': 'Bretman Rock'}}, {'domain': {'id': '54', 'name': 'Musician', 'description': 'A musician in the world, like Adele or Bob Dylan'}, 'entity': {'id': '1117789006916243456', 'name': 'Lizzo', 'description': 'American rapper'}}, {'domain': {'id': '55', 'name': 'Music Genre', 'description': 'A category for a musical style, like Pop, Rock, or Rap'}, 'entity': {'id': '810937888334487552', 'name': 'Rap', 'description': 'Hip-Hop/Rap'}}, {'domain': {'id': '71', 'name': 'Video Game', 'description': 'A video game like Overwatch'}, 'entity': {'id': '1088118927580774400', 'name': 'Roblox', 'description': 'Roblox'}}, {'domain': {'id': '120', 'name': 'Digital Creator', 'description': 'Influencers who create content on digital platforms'}, 'entity': {'id': '1141044727136940032', 'name': 'Bretman Rock', 'description': 'Bretman Rock'}}]","{'mentions': [{'start': 23, 'end': 30, 'username': 'Roblox', 'id': '16745055'}, {'start': 108, 'end': 120, 'username': 'bretmanrock', 'id': '291547392'}, {'start': 136, 'end': 142, 'username': 'lizzo', 'id': '323417384'}, {'start': 147, 'end': 158, 'username': 'whoisgayle', 'id': '1098295826424713216'}], 'annotations': [{'start': 64, 'end': 82, 'probability': 0.554, 'type': 'Other', 'normalized_text': 'Song Breaker Awards'}], 'urls': [{'start': 200, 'end': 223, 'url': 'https://t.co/y83wU0644X', 'expanded_url': 'https://rblx.co/songbreakerawards', 'display_url': 'rblx.co/songbreakerawa…', 'status': 200, 'title': 'Explore the Song Breaker World', 'description': 'You’re invited to the Logitech Song Breaker Awards, the first music awards show in the metaverse! Join Bretman Rock, MeganPlays, Shroud and Jaden Smith to celebrate groundbreaking creators like Walker Hayes and Cost n’ Mayor who are shaping pop music today through dance challenges, memes and trends shared on TikTok and YouTube. Watch Lizzo’s debut performance on Roblox with her new song “Special” and get up close with GAYLE, who will be performing her Billboard no. 1 hit “abcde-forget-u.” The award show', 'unwound_url': 'https://www.roblox.com/songbreakerawards'}, {'start': 224, 'end': 247, 'url': 'https://t.co/rnTQm4dqNx', 'expanded_url': 'https://twitter.com/Roblox/status/1519695192336388098/video/1', 'display_url': 'pic.twitter.com/rnTQm4dqNx', 'media_key': '7_1519694782519410689'}]}",{'media_keys': ['7_1519694782519410689']},False,,everyone,Twitter Web App
1519738099856642049,901894986836279296,📶 STATUS: Some users may be encountering issues loading parts of the #Roblox website and joining experiences (Error Code: 529). I will keep you updated. https://t.co/JUXXuOfsKZ,2022-04-28 17:59:33+00:00,,55,97,890,10,en,1519738099856642049,"[{'domain': {'id': '71', 'name': 'Video Game', 'description': 'A video game like Overwatch'}, 'entity': {'id': '1088118927580774400', 'name': 'Roblox', 'description': 'Roblox'}}]","{'urls': [{'start': 153, 'end': 176, 'url': 'https://t.co/JUXXuOfsKZ', 'expanded_url': 'https://twitter.com/Bloxy_News/status/1519738099856642049/photo/1', 'display_url': 'pic.twitter.com/JUXXuOfsKZ', 'media_key': '3_1519737948706508802'}], 'hashtags': [{'start': 69, 'end': 76, 'tag': 'Roblox'}]}",{'media_keys': ['3_1519737948706508802']},False,,everyone,TweetDeck
1519740303749570560,1221465647345033216,"Over $1 Billion dollar company Roblox cant handle the servers.

Imagine owning a Billion dollar company and can't even take care of it yet you want to make it a global thing.
#Roblox #RobloxDown",2022-04-28 18:08:18+00:00,,0,2,1,0,en,1519740303749570560,"[{'domain': {'id': '71', 'name': 'Video Game', 'description': 'A video game like Overwatch'}, 'entity': {'id': '1088118927580774400', 'name': 'Roblox', 'description': 'Roblox'}}]","{'annotations': [{'start': 31, 'end': 36, 'probability': 0.4541, 'type': 'Organization', 'normalized_text': 'Roblox'}], 'hashtags': [{'start': 175, 'end': 182, 'tag': 'Roblox'}, {'start': 183, 'end': 194, 'tag': 'RobloxDown'}]}",,False,,everyone,Twitter Web App
1519740257155133447,1431562532859359238,"Roblox Join error, unable to join experiences. #Roblox #Server https://t.co/NtLJehsggS",2022-04-28 18:08:07+00:00,,0,1,1,0,en,1519740257155133447,"[{'domain': {'id': '71', 'name': 'Video Game', 'description': 'A video game like Overwatch'}, 'entity': {'id': '1088118927580774400', 'name': 'Roblox', 'description': 'Roblox'}}]","{'urls': [{'start': 63, 'end': 86, 'url': 'https://t.co/NtLJehsggS', 'expanded_url': 'https://twitter.com/Unauthoris_ed/status/1519740257155133447/photo/1', 'display_url': 'pic.twitter.com/NtLJehsggS', 'media_key': '3_1519740244668690432'}], 'hashtags': [{'start': 47, 'end': 54, 'tag': 'Roblox'}, {'start': 55, 'end': 62, 'tag': 'Server'}]}",{'media_keys': ['3_1519740244668690432']},False,,everyone,Twitter Web App
1519740287979069442,1264455268257202177,"i just got kicked from team create 😭

#RobloxDev #RobloxDown",2022-04-28 18:08:14+00:00,,1,0,2,1,en,1519740287979069442,"[{'domain': {'id': '71', 'name': 'Video Game', 'description': 'A video game like Overwatch'}, 'entity': {'id': '1088118927580774400', 'name': 'Roblox', 'description': 'Roblox'}}]","{'hashtags': [{'start': 38, 'end': 48, 'tag': 'RobloxDev'}, {'start': 49, 'end': 60, 'tag': 'RobloxDown'}]}",,False,,everyone,Twitter Web App
1519740306581000194,1159454198485774344,"@Roblox @bretmanrock @lizzo @whoisgayle Will there be a barbie event in the future? Or idk what it’s called, just asking 😭",2022-04-28 18:08:19+00:00,,0,1,1,0,en,1519695192336388098,"[{'domain': {'id': '10', 'name': 'Person', 'description': 'Named people in the world like Nelson Mandela'}, 'entity': {'id': '1117789006916243456', 'name': 'Lizzo', 'description': 'American rapper'}}, {'domain': {'id': '10', 'name': 'Person', 'description': 'Named people in the world like Nelson Mandela'}, 'entity': {'id': '1141044727136940032', 'name': 'Bretman Rock', 'description': 'Bretman Rock'}}, {'domain': {'id': '54', 'name': 'Musician', 'description': 'A musician in the world, like Adele or Bob Dylan'}, 'entity': {'id': '1117789006916243456', 'name': 'Lizzo', 'description': 'American rapper'}}, {'domain': {'id': '55', 'name': 'Music Genre', 'description': 'A category for a musical style, like Pop, Rock, or Rap'}, 'entity': {'id': '810937888334487552', 'name': 'Rap', 'description': 'Hip-Hop/Rap'}}, {'domain': {'id': '71', 'name': 'Video Game', 'description': 'A video game like Overwatch'}, 'entity': {'id': '1088118927580774400', 'name': 'Roblox', 'description': 'Roblox'}}, {'domain': {'id': '120', 'name': 'Digital Creator', 'description': 'Influencers who create content on digital platforms'}, 'entity': {'id': '1141044727136940032', 'name': 'Bretman Rock', 'description': 'Bretman Rock'}}]","{'mentions': [{'start': 0, 'end': 7, 'username': 'Roblox', 'id': '16745055'}, {'start': 8, 'end': 20, 'username': 'bretmanrock', 'id': '291547392'}, {'start': 21, 'end': 27, 'username': 'lizzo', 'id': '323417384'}, {'start': 28, 'end': 39, 'username': 'whoisgayle', 'id': '1098295826424713216'}]}",,False,,everyone,Twitter for iPhone
1519740042624872606,1482849068250447877,@fiona131573691 @Roblox @bretmanrock @lizzo @whoisgayle https://t.co/EoQtrXngZX,2022-04-28 18:07:16+00:00,,0,1,0,0,qme,1519695192336388098,"[{'domain': {'id': '10', 'name': 'Person', 'description': 'Named people in the world like Nelson Mandela'}, 'entity': {'id': '1117789006916243456', 'name': 'Lizzo', 'description': 'American rapper'}}, {'domain': {'id': '10', 'name': 'Person', 'description': 'Named people in the world like Nelson Mandela'}, 'entity': {'id': '1141044727136940032', 'name': 'Bretman Rock', 'description': 'Bretman Rock'}}, {'domain': {'id': '54', 'name': 'Musician', 'description': 'A musician in the world, like Adele or Bob Dylan'}, 'entity': {'id': '1117789006916243456', 'name': 'Lizzo', 'description': 'American rapper'}}, {'domain': {'id': '55', 'name': 'Music Genre', 'description': 'A category for a musical style, like Pop, Rock, or Rap'}, 'entity': {'id': '810937888334487552', 'name': 'Rap', 'description': 'Hip-Hop/Rap'}}, {'domain': {'id': '71', 'name': 'Video Game', 'description': 'A video game like Overwatch'}, 'entity': {'id': '1088118927580774400', 'name': 'Roblox', 'description': 'Roblox'}}, {'domain': {'id': '120', 'name': 'Digital Creator', 'description': 'Influencers who create content on digital platforms'}, 'entity': {'id': '1141044727136940032', 'name': 'Bretman Rock', 'description': 'Bretman Rock'}}]","{'mentions': [{'start': 0, 'end': 15, 'username': 'fiona131573691', 'id': '1433096428268793859'}, {'start': 16, 'end': 23, 'username': 'Roblox', 'id': '16745055'}, {'start': 24, 'end': 36, 'username': 'bretmanrock', 'id': '291547392'}, {'start': 37, 'end': 43, 'username': 'lizzo', 'id': '323417384'}, {'start': 44, 'end': 55, 'username': 'whoisgayle', 'id': '1098295826424713216'}], 'urls': [{'start': 56, 'end': 79, 'url': 'https://t.co/EoQtrXngZX', 'expanded_url': 'https://twitter.com/noodlescatears/status/1519740042624872606/photo/1', 'display_url': 'pic.twitter.com/EoQtrXngZX', 'media_key': '3_1519740025067474944'}]}",{'media_keys': ['3_1519740025067474944']},False,,everyone,Twitter Web App
1519739172268888065,890081413466275840,@NicestCamp4781 @Roblox I was wondering bc i was playing,2022-04-28 18:03:48+00:00,,0,1,0,0,en,1519739024918736896,"[{'domain': {'id': '71', 'name': 'Video Game', 'description': 'A video game like Overwatch'}, 'entity': {'id': '1088118927580774400', 'name': 'Roblox', 'description': 'Roblox'}}]","{'mentions': [{'start': 0, 'end': 15, 'username': 'NicestCamp4781', 'id': '975551183560601600'}, {'start': 16, 'end': 23, 'username': 'Roblox', 'id': '16745055'}]}",,False,,everyone,Twitter for Android
1519737614571642881,1216068002153668608,@Roblox @bretmanrock @lizzo @whoisgayle Haven’t went on roblox twitter for a while but why is everything lagging so badly and I can barely play a game I just randomly disconnected,2022-04-28 17:57:37+00:00,,0,2,2,0,en,1519695192336388098,"[{'domain': {'id': '10', 'name': 'Person', 'description': 'Named people in the world like Nelson Mandela'}, 'entity': {'id': '1117789006916243456', 'name': 'Lizzo', 'description': 'American rapper'}}, {'domain': {'id': '10', 'name': 'Person', 'description': 'Named people in the world like Nelson Mandela'}, 'entity': {'id': '1141044727136940032', 'name': 'Bretman Rock', 'description': 'Bretman Rock'}}, {'domain': {'id': '54', 'name': 'Musician', 'description': 'A musician in the world, like Adele or Bob Dylan'}, 'entity': {'id': '1117789006916243456', 'name': 'Lizzo', 'description': 'American rapper'}}, {'domain': {'id': '55', 'name': 'Music Genre', 'description': 'A category for a musical style, like Pop, Rock, or Rap'}, 'entity': {'id': '810937888334487552', 'name': 'Rap', 'description': 'Hip-Hop/Rap'}}, {'domain': {'id': '71', 'name': 'Video Game', 'description': 'A video game like Overwatch'}, 'entity': {'id': '1088118927580774400', 'name': 'Roblox', 'description': 'Roblox'}}, {'domain': {'id': '120', 'name': 'Digital Creator', 'description': 'Influencers who create content on digital platforms'}, 'entity': {'id': '1141044727136940032', 'name': 'Bretman Rock', 'description': 'Bretman Rock'}}, {'domain': {'id': '46', 'name': 'Brand Category', 'description': 'Categories within Brand Verticals that narrow down the scope of Brands'}, 'entity': {'id': '781974596752842752', 'name': 'Services'}}, {'domain': {'id': '47', 'name': 'Brand', 'description': 'Brands and Companies'}, 'entity': {'id': '10045225402', 'name': 'Twitter'}}]","{'mentions': [{'start': 0, 'end': 7, 'username': 'Roblox', 'id': '16745055'}, {'start': 8, 'end': 20, 'username': 'bretmanrock', 'id': '291547392'}, {'start': 21, 'end': 27, 'username': 'lizzo', 'id': '323417384'}, {'start': 28, 'end': 39, 'username': 'whoisgayle', 'id': '1098295826424713216'}], 'annotations': [{'start': 63, 'end': 69, 'probability': 0.7299, 'type': 'Product', 'normalized_text': 'twitter'}]}",,False,,everyone,Twitter for iPhone
1519729001614487555,988188648372883456,@surface unlimited diamonds.. well id have to make a diamond pickaxe so i could get some netherite,2022-04-28 17:23:23+00:00,,0,1,0,0,en,1518703901335244807,"[{'domain': {'id': '46', 'name': 'Brand Category', 'description': 'Categories within Brand Verticals that narrow down the scope of Brands'}, 'entity': {'id': '781974596752842752', 'name': 'Services'}}, {'domain': {'id': '47', 'name': 'Brand', 'description': 'Brands and Companies'}, 'entity': {'id': '10027232467', 'name': 'Microsoft'}}, {'domain': {'id': '48', 'name': 'Product', 'description': 'Products created by Brands.  Examples: Ford Explorer, Apple iPhone.'}, 'entity': {'id': '10026414931', 'name': 'Microsoft - Surface'}}]","{'mentions': [{'start': 0, 'end': 8, 'username': 'surface', 'id': '612076511'}]}",,False,,everyone,Twitter for Android
1519740071414579201,1199001259904307207,"ROBLOX DOWN: Roblox is currently experiencing issues, we'll keep you updated. #RobloxDown ⚠️ 

(Credit: @KreekCraft) https://t.co/NOdaDUkw7B",2022-04-28 18:07:23+00:00,,41,63,556,6,en,1519740071414579201,"[{'domain': {'id': '71', 'name': 'Video Game', 'description': 'A video game like Overwatch'}, 'entity': {'id': '1088118927580774400', 'name': 'Roblox', 'description': 'Roblox'}}]","{'mentions': [{'start': 104, 'end': 115, 'username': 'KreekCraft', 'id': '3025674465'}], 'urls': [{'start': 117, 'end': 140, 'url': 'https://t.co/NOdaDUkw7B', 'expanded_url': 'https://twitter.com/RBXNews_/status/1519740071414579201/photo/1', 'display_url': 'pic.twitter.com/NOdaDUkw7B', 'media_key': '3_1519740063239843851'}], 'hashtags': [{'start': 78, 'end': 89, 'tag': 'RobloxDown'}]}",{'media_keys': ['3_1519740063239843851']},False,,everyone,Twitter Web App
1519739264539688960,1478780537632292864,@wassupheebaby ANLAKAS NG TRIP,2022-04-28 18:04:10+00:00,,0,1,0,0,tl,1519735869946548225,[],"{'mentions': [{'start': 0, 'end': 14, 'username': 'wassupheebaby', 'id': '1221386082794663938'}]}",,False,,everyone,Twitter for iPhone
1519739671756124164,1405240914801577987,@Roblox stop.,2022-04-28 18:05:47+00:00,,0,2,1,0,en,1519739671756124164,"[{'domain': {'id': '71', 'name': 'Video Game', 'description': 'A video game like Overwatch'}, 'entity': {'id': '1088118927580774400', 'name': 'Roblox', 'description': 'Roblox'}}]","{'mentions': [{'start': 0, 'end': 7, 'username': 'Roblox', 'id': '16745055'}]}",,False,,everyone,Twitter for iPad
1519737919556272128,3025674465,"Roblox is down and I can’t stream right now 😭😭

I’m so sorry to let you all down.",2022-04-28 17:58:50+00:00,,81,431,2840,8,en,1519737919556272128,"[{'domain': {'id': '71', 'name': 'Video Game', 'description': 'A video game like Overwatch'}, 'entity': {'id': '1088118927580774400', 'name': 'Roblox', 'description': 'Roblox'}}]","{'annotations': [{'start': 0, 'end': 5, 'probability': 0.2688, 'type': 'Product', 'normalized_text': 'Roblox'}]}",,False,,everyone,Twitter for iPhone
1518984807837011968,1404912888377118721,"Join us on @Roblox for the 2nd annual Song Breaker Awards, this Saturday at 10AM PST. 

This one-of-a-kind music awards show is open to fans all over the world with host @bretmanrock, and performances by @lizzo and @whoisgayle. See you there! https://t.co/nvDtRxkJbI #SongBreaker https://t.co/8QtD71PodO",2022-04-26 16:06:14+00:00,,120,144,1287,17,en,1518984807837011968,"[{'domain': {'id': '10', 'name': 'Person', 'description': 'Named people in the world like Nelson Mandela'}, 'entity': {'id': '1117789006916243456', 'name': 'Lizzo', 'description': 'American rapper'}}, {'domain': {'id': '10', 'name': 'Person', 'description': 'Named people in the world like Nelson Mandela'}, 'entity': {'id': '1141044727136940032', 'name': 'Bretman Rock', 'description': 'Bretman Rock'}}, {'domain': {'id': '54', 'name': 'Musician', 'description': 'A musician in the world, like Adele or Bob Dylan'}, 'entity': {'id': '1117789006916243456', 'name': 'Lizzo', 'description': 'American rapper'}}, {'domain': {'id': '55', 'name': 'Music Genre', 'description': 'A category for a musical style, like Pop, Rock, or Rap'}, 'entity': {'id': '810937888334487552', 'name': 'Rap', 'description': 'Hip-Hop/Rap'}}, {'domain': {'id': '71', 'name': 'Video Game', 'description': 'A video game like Overwatch'}, 'entity': {'id': '1088118927580774400', 'name': 'Roblox', 'description': 'Roblox'}}, {'domain': {'id': '120', 'name': 'Digital Creator', 'description': 'Influencers who create content on digital platforms'}, 'entity': {'id': '1141044727136940032', 'name': 'Bretman Rock', 'description': 'Bretman Rock'}}]","{'mentions': [{'start': 11, 'end': 18, 'username': 'Roblox', 'id': '16745055'}, {'start': 170, 'end': 182, 'username': 'bretmanrock', 'id': '291547392'}, {'start': 204, 'end': 210, 'username': 'lizzo', 'id': '323417384'}, {'start': 215, 'end': 226, 'username': 'whoisgayle', 'id': '1098295826424713216'}], 'annotations': [{'start': 38, 'end': 56, 'probability': 0.4914, 'type': 'Other', 'normalized_text': 'Song Breaker Awards'}], 'urls': [{'start': 243, 'end': 266, 'url': 'https://t.co/nvDtRxkJbI', 'expanded_url': 'https://bit.ly/3vgjx4Z', 'display_url': 'bit.ly/3vgjx4Z', 'status': 200, 'title': 'Explore the Song Breaker World', 'description': 'You’re invited to the Logitech Song Breaker Awards, the first music awards show in the metaverse! Join Bretman Rock, MeganPlays, Shroud and Jaden Smith to celebrate groundbreaking creators like Walker Hayes and Cost n’ Mayor who are shaping pop music today through dance challenges, memes and trends shared on TikTok and YouTube. Watch Lizzo’s debut performance on Roblox with her new song “Special” and get up close with GAYLE, who will be performing her Billboard no. 1 hit “abcde-forget-u.” The award show', 'unwound_url': 'https://www.roblox.com/songbreakerawards'}, {'start': 280, 'end': 303, 'url': 'https://t.co/8QtD71PodO', 'expanded_url': 'https://twitter.com/logitechc/status/1518984807837011968/video/1', 'display_url': 'pic.twitter.com/8QtD71PodO', 'media_key': '7_1518984738861723649'}], 'hashtags': [{'start': 267, 'end': 279, 'tag': 'SongBreaker'}]}",{'media_keys': ['7_1518984738861723649']},False,,everyone,Khoros Publishing App
1519730594648891394,1056053249470541824,Credits: @LilyGia_,2022-04-28 17:29:43+00:00,,2,3,82,0,en,1519730592421662720,[],"{'mentions': [{'start': 9, 'end': 18, 'username': 'LilyGia_', 'id': '717006251880759296'}]}",,False,,everyone,Twitter for iPhone
1519540909330808832,4093077509,does anyone play roblox really late?,2022-04-28 04:55:59+00:00,,15,149,433,5,en,1519540909330808832,"[{'domain': {'id': '71', 'name': 'Video Game', 'description': 'A video game like Overwatch'}, 'entity': {'id': '1088118927580774400', 'name': 'Roblox', 'description': 'Roblox'}}]",,,False,,everyone,Twitter Web App
