tweetid,author_id,text,created_at,geo,retweets,replies,likes,quote_count,lang,conversation_id,context_annotations,entities,attachments,possibly_sensitive,withheld,reply_settings,source
1518699521722650624,169312819,"My sense is that levels of crypto hate &amp; disdain are rising to ATHs amongst the mainstream college-educated coastal elite crowd.

I'm not talking about ambivalence or skepticism: I'm talking about people who have done the research, ""get it"", and are convinced it's all ponzis.",2022-04-25 21:12:36+00:00,,13,83,408,13,en,1518699521722650624,[],,,False,,everyone,Twitter Web App
1518735259579392000,1302467941921943557,"Guys!

How much should @elonmusk pay to buy Roblox's company?",2022-04-25 23:34:37+00:00,,4,44,56,0,en,1518735259579392000,"[{'domain': {'id': '71', 'name': 'Video Game', 'description': 'A video game like Overwatch'}, 'entity': {'id': '1088118927580774400', 'name': 'Roblox', 'description': 'Roblox'}}, {'domain': {'id': '10', 'name': 'Person', 'description': 'Named people in the world like Nelson Mandela'}, 'entity': {'id': '808713037230157824', 'name': 'Elon Musk', 'description': 'Elon Musk'}}, {'domain': {'id': '65', 'name': 'Interests and Hobbies Vertical', 'description': 'Top level interests and hobbies groupings, like Food or Travel'}, 'entity': {'id': '781974596148793345', 'name': 'Business & finance'}}, {'domain': {'id': '66', 'name': 'Interests and Hobbies Category', 'description': 'A grouping of interests and hobbies entities, like Novelty Food or Destinations'}, 'entity': {'id': '857878777191211008', 'name': 'Leadership', 'description': 'Leadership'}}, {'domain': {'id': '30', 'name': 'Entities [Entity Service]', 'description': 'Entity Service top level domain, every item that is in Entity Service should be in this domain'}, 'entity': {'id': '857879456773357569', 'name': 'Technology', 'description': 'Technology'}}]","{'mentions': [{'start': 23, 'end': 32, 'username': 'elonmusk', 'id': '44196397'}], 'annotations': [{'start': 44, 'end': 49, 'probability': 0.5879, 'type': 'Product', 'normalized_text': 'Roblox'}]}",,False,,everyone,Twitter for iPhone
1518863407121899520,1310688804441817088,Give me a few hours. Some members in the RTC need to be dealt with for what they have done.,2022-04-26 08:03:50+00:00,,0,9,59,3,en,1518863407121899520,[],,,False,,everyone,Twitter Web App
1518947004923232256,352619090,The best #Crypto is @ ________ ? 👀🧐,2022-04-26 13:36:01+00:00,,38,645,242,9,en,1518947004923232256,"[{'domain': {'id': '66', 'name': 'Interests and Hobbies Category', 'description': 'A grouping of interests and hobbies entities, like Novelty Food or Destinations'}, 'entity': {'id': '913142676819648512', 'name': 'Cryptocurrencies', 'description': 'Cryptocurrency'}}]","{'hashtags': [{'start': 9, 'end': 16, 'tag': 'Crypto'}]}",,False,,everyone,Twitter for iPhone
1518677066325053441,44196397,🚀💫♥️ Yesss!!! ♥️💫🚀 https://t.co/0T9HzUHuh6,2022-04-25 19:43:22+00:00,,363647,155068,2671261,64546,und,1518677066325053441,"[{'domain': {'id': '10', 'name': 'Person', 'description': 'Named people in the world like Nelson Mandela'}, 'entity': {'id': '808713037230157824', 'name': 'Elon Musk', 'description': 'Elon Musk'}}, {'domain': {'id': '65', 'name': 'Interests and Hobbies Vertical', 'description': 'Top level interests and hobbies groupings, like Food or Travel'}, 'entity': {'id': '781974596148793345', 'name': 'Business & finance'}}, {'domain': {'id': '66', 'name': 'Interests and Hobbies Category', 'description': 'A grouping of interests and hobbies entities, like Novelty Food or Destinations'}, 'entity': {'id': '857878777191211008', 'name': 'Leadership', 'description': 'Leadership'}}, {'domain': {'id': '30', 'name': 'Entities [Entity Service]', 'description': 'Entity Service top level domain, every item that is in Entity Service should be in this domain'}, 'entity': {'id': '857879456773357569', 'name': 'Technology', 'description': 'Technology'}}]","{'urls': [{'start': 19, 'end': 42, 'url': 'https://t.co/0T9HzUHuh6', 'expanded_url': 'https://twitter.com/elonmusk/status/1518677066325053441/photo/1', 'display_url': 'pic.twitter.com/0T9HzUHuh6', 'media_key': '3_1518677041738043397'}]}",{'media_keys': ['3_1518677041738043397']},False,,everyone,Twitter for iPhone
1518643330833272833,16745055,A casual laid-back pair of pants go well with any outfit. Which is why you can wear these with any other items and on any avatar you want. Available now: https://t.co/7v25TLSvkr https://t.co/roTr7PweQP,2022-04-25 17:29:19+00:00,,131,642,2773,23,en,1518643330833272833,"[{'domain': {'id': '65', 'name': 'Interests and Hobbies Vertical', 'description': 'Top level interests and hobbies groupings, like Food or Travel'}, 'entity': {'id': '844603730221707264', 'name': 'Fashion', 'description': 'Fashion'}}, {'domain': {'id': '67', 'name': 'Interests and Hobbies', 'description': 'Interests, opinions, and behaviors of individuals, groups, or cultures; like Speciality Cooking or Theme Parks'}, 'entity': {'id': '1006277139233103872', 'name': 'Behavior around fashion', 'description': 'Behavior around Fashion'}}, {'domain': {'id': '71', 'name': 'Video Game', 'description': 'A video game like Overwatch'}, 'entity': {'id': '1088118927580774400', 'name': 'Roblox', 'description': 'Roblox'}}, {'domain': {'id': '65', 'name': 'Interests and Hobbies Vertical', 'description': 'Top level interests and hobbies groupings, like Food or Travel'}, 'entity': {'id': '844603730221707264', 'name': 'Fashion', 'description': 'Fashion'}}, {'domain': {'id': '66', 'name': 'Interests and Hobbies Category', 'description': 'A grouping of interests and hobbies entities, like Novelty Food or Destinations'}, 'entity': {'id': '844604232737087488', 'name': 'General Fashion', 'description': 'General Fashion'}}, {'domain': {'id': '67', 'name': 'Interests and Hobbies', 'description': 'Interests, opinions, and behaviors of individuals, groups, or cultures; like Speciality Cooking or Theme Parks'}, 'entity': {'id': '849639334663696384', 'name': 'Pants', 'description': 'Pants'}}, {'domain': {'id': '173', 'name': 'Google Product Taxonomy', 'description': 'A product taxonomy created by Google'}, 'entity': {'id': '849639334663696384', 'name': 'Pants', 'description': 'Pants'}}]","{'urls': [{'start': 154, 'end': 177, 'url': 'https://t.co/7v25TLSvkr', 'expanded_url': 'https://rblx.co/pants', 'display_url': 'rblx.co/pants', 'images': [{'url': 'https://pbs.twimg.com/news_img/1522682136339263488/tqtuOYQt?format=jpg&name=orig', 'width': 1200, 'height': 630}, {'url': 'https://pbs.twimg.com/news_img/1522682136339263488/tqtuOYQt?format=jpg&name=150x150', 'width': 150, 'height': 150}], 'status': 200, 'title': 'Roblox', 'description': 'Customize your avatar with a never-ending variety of clothing options, accessories, gear, and more!', 'unwound_url': 'https://www.roblox.com/catalog?Category=3&Subcategory=60&CreatorID=1&SortType=3'}, {'start': 178, 'end': 201, 'url': 'https://t.co/roTr7PweQP', 'expanded_url': 'https://twitter.com/Roblox/status/1518643330833272833/video/1', 'display_url': 'pic.twitter.com/roTr7PweQP', 'media_key': '7_1518643082501140480'}]}",{'media_keys': ['7_1518643082501140480']},False,,everyone,Twitter Web App
1518940700854816768,1056053249470541824,"Do you feel the sponsored events and games coming out on Roblox lately are high quality? Why, or why not?",2022-04-26 13:10:58+00:00,,30,165,1047,4,en,1518940700854816768,"[{'domain': {'id': '71', 'name': 'Video Game', 'description': 'A video game like Overwatch'}, 'entity': {'id': '1088118927580774400', 'name': 'Roblox', 'description': 'Roblox'}}]","{'annotations': [{'start': 57, 'end': 62, 'probability': 0.5167, 'type': 'Product', 'normalized_text': 'Roblox'}]}",,False,,everyone,Twitter for iPhone
1518939448368635904,1363949565339185152,@Dareal2010egh @RubyDevRBLX @Parlo_ROBLOX Hmm https://t.co/tJBtvPIzO1,2022-04-26 13:05:59+00:00,,0,1,1,0,und,1518937447148802048,[],"{'mentions': [{'start': 0, 'end': 14, 'username': 'Dareal2010egh', 'id': '1278873765355667457'}, {'start': 15, 'end': 27, 'username': 'RubyDevRBLX', 'id': '1315758077484904449'}, {'start': 28, 'end': 41, 'username': 'Parlo_ROBLOX', 'id': '1310688804441817088'}], 'urls': [{'start': 46, 'end': 69, 'url': 'https://t.co/tJBtvPIzO1', 'expanded_url': 'https://twitter.com/HT34577/status/1518939448368635904/photo/1', 'display_url': 'pic.twitter.com/tJBtvPIzO1', 'media_key': '3_1518939445155741696'}]}",{'media_keys': ['3_1518939445155741696']},False,,everyone,Twitter for iPad
1518945674104123399,1134552730146500608,"weeeeeeeeeeeee 👽

(bean snatcher is in store now) https://t.co/E6ZAsoeADm",2022-04-26 13:30:44+00:00,,98,102,1437,8,en,1518945674104123399,"[{'domain': {'id': '71', 'name': 'Video Game', 'description': 'A video game like Overwatch'}, 'entity': {'id': '1292818086488203264', 'name': 'Fall Guys'}}]","{'urls': [{'start': 50, 'end': 73, 'url': 'https://t.co/E6ZAsoeADm', 'expanded_url': 'https://twitter.com/FallGuysGame/status/1518945674104123399/photo/1', 'display_url': 'pic.twitter.com/E6ZAsoeADm', 'media_key': '3_1518945537478868993'}]}",{'media_keys': ['3_1518945537478868993']},False,,everyone,LaterMedia
1516093694998372359,1506800401890222081,"To celebrate 100k followers...we're hosting a GIVEAWAY! 🎉 2 winners will get the Baneful Bot Bunny SECRET pet, and 2 other winners will get 5,000 Tokens! Follow us @ClickerSim1, RT + Like this tweet, and comment your Roblox username to enter! Ends in 1 week. Good luck!🙂 https://t.co/1RVUvULAs1",2022-04-18 16:37:59+00:00,,2878,7389,6429,108,en,1516093694998372359,"[{'domain': {'id': '30', 'name': 'Entities [Entity Service]', 'description': 'Entity Service top level domain, every item that is in Entity Service should be in this domain'}, 'entity': {'id': '1326539256244838401', 'name': 'Rabbits'}}, {'domain': {'id': '71', 'name': 'Video Game', 'description': 'A video game like Overwatch'}, 'entity': {'id': '1088118927580774400', 'name': 'Roblox', 'description': 'Roblox'}}, {'domain': {'id': '46', 'name': 'Brand Category', 'description': 'Categories within Brand Verticals that narrow down the scope of Brands'}, 'entity': {'id': '781974596752842752', 'name': 'Services'}}, {'domain': {'id': '47', 'name': 'Brand', 'description': 'Brands and Companies'}, 'entity': {'id': '10045225402', 'name': 'Twitter'}}]","{'mentions': [{'start': 164, 'end': 176, 'username': 'ClickerSim1', 'id': '1506800401890222081'}], 'annotations': [{'start': 82, 'end': 109, 'probability': 0.3294, 'type': 'Product', 'normalized_text': 'Baneful Bot Bunny SECRET pet'}, {'start': 218, 'end': 223, 'probability': 0.5338, 'type': 'Product', 'normalized_text': 'Roblox'}], 'urls': [{'start': 271, 'end': 294, 'url': 'https://t.co/1RVUvULAs1', 'expanded_url': 'https://twitter.com/ClickerSim1/status/1516093694998372359/photo/1', 'display_url': 'pic.twitter.com/1RVUvULAs1', 'media_key': '3_1516090993250127878'}]}",{'media_keys': ['3_1516090993250127878']},False,,everyone,Twitter Web App
1518413471792214016,872683897,"Are their any straight Minecrafters ? 

I swear like every single one of them has come out as LGBTQ+ . https://t.co/5dkaZFQbMu",2022-04-25 02:15:57+00:00,,425,6557,16926,4803,en,1518413471792214016,"[{'domain': {'id': '10', 'name': 'Person', 'description': 'Named people in the world like Nelson Mandela'}, 'entity': {'id': '1139115827632852992', 'name': 'Keemstar'}}, {'domain': {'id': '58', 'name': 'Entertainment Personality', 'description': 'An entertainment personality in the world, like Anderson Cooper or Miranda Sings'}, 'entity': {'id': '1139115827632852992', 'name': 'Keemstar'}}]","{'urls': [{'start': 103, 'end': 126, 'url': 'https://t.co/5dkaZFQbMu', 'expanded_url': 'https://twitter.com/KEEMSTAR/status/1518413471792214016/photo/1', 'display_url': 'pic.twitter.com/5dkaZFQbMu', 'media_key': '3_1518413468088639489'}]}",{'media_keys': ['3_1518413468088639489']},False,,everyone,Twitter for iPhone
1518948135954837504,848641651912388610,"@Roblox_RTC no, they feel incredibly soulless and it doesn't help that it feels like they fumble before they even start since almost all of these sponsored events feel rushed",2022-04-26 13:40:30+00:00,,0,5,51,0,en,1518940700854816768,[],"{'mentions': [{'start': 0, 'end': 11, 'username': 'Roblox_RTC', 'id': '1056053249470541824'}]}",,False,,everyone,Twitter Web App
1518682095408852994,1307372323692052480,this fucking guy i cant https://t.co/OolH2gTB3G,2022-04-25 20:03:21+00:00,,0,5,5,0,en,1518682095408852994,[],"{'urls': [{'start': 24, 'end': 47, 'url': 'https://t.co/OolH2gTB3G', 'expanded_url': 'https://twitter.com/XenSergal/status/1518682095408852994/photo/1', 'display_url': 'pic.twitter.com/OolH2gTB3G', 'media_key': '3_1518682071266467841'}]}",{'media_keys': ['3_1518682071266467841']},False,,everyone,Twitter Web App
1517264336187658240,24929621,Going Live on IG at 5:30pm PT with @LeahAshe 🥰 We'll be going to Neon Carnival in #ParisWorld on @Roblox with our friends! Make sure to tune in &amp; join us 🥳✨💕🎡 @DXSHMV @dash_radio https://t.co/C1VjQD8vzu,2022-04-21 22:09:41+00:00,,103,79,744,9,en,1517264336187658240,"[{'domain': {'id': '71', 'name': 'Video Game', 'description': 'A video game like Overwatch'}, 'entity': {'id': '1088118927580774400', 'name': 'Roblox', 'description': 'Roblox'}}, {'domain': {'id': '10', 'name': 'Person', 'description': 'Named people in the world like Nelson Mandela'}, 'entity': {'id': '808720282332450816', 'name': 'Paris Hilton', 'description': 'Paris Hilton'}}, {'domain': {'id': '58', 'name': 'Entertainment Personality', 'description': 'An entertainment personality in the world, like Anderson Cooper or Miranda Sings'}, 'entity': {'id': '808720282332450816', 'name': 'Paris Hilton', 'description': 'Paris Hilton'}}]","{'mentions': [{'start': 35, 'end': 44, 'username': 'LeahAshe', 'id': '347591743'}, {'start': 97, 'end': 104, 'username': 'Roblox', 'id': '16745055'}, {'start': 163, 'end': 170, 'username': 'DXSHMV', 'id': '1440401505798934528'}, {'start': 171, 'end': 182, 'username': 'dash_radio', 'id': '17551703'}], 'hashtags': [{'start': 82, 'end': 93, 'tag': 'ParisWorld'}], 'urls': [{'start': 183, 'end': 206, 'url': 'https://t.co/C1VjQD8vzu', 'expanded_url': 'https://twitter.com/ParisHilton/status/1517264336187658240/video/1', 'display_url': 'pic.twitter.com/C1VjQD8vzu', 'media_key': '7_1517264301236506624'}]}",{'media_keys': ['7_1517264301236506624']},False,,everyone,Twitter for iPhone
1518630751683551233,1102772383071387648,what roblox hot take do you have that will get you like this https://t.co/5oYtU7K0Hy,2022-04-25 16:39:20+00:00,,25,510,1157,34,en,1518630751683551233,"[{'domain': {'id': '71', 'name': 'Video Game', 'description': 'A video game like Overwatch'}, 'entity': {'id': '1088118927580774400', 'name': 'Roblox', 'description': 'Roblox'}}]","{'urls': [{'start': 61, 'end': 84, 'url': 'https://t.co/5oYtU7K0Hy', 'expanded_url': 'https://twitter.com/ItsAmmon/status/1518630751683551233/photo/1', 'display_url': 'pic.twitter.com/5oYtU7K0Hy', 'media_key': '3_1518630745601847296'}]}",{'media_keys': ['3_1518630745601847296']},False,,everyone,Twitter for iPhone
1518809445781934081,875140722944614401,@Buggs856 Garb,2022-04-26 04:29:24+00:00,,0,1,0,0,en,1502028677701423104,[],"{'mentions': [{'start': 0, 'end': 9, 'username': 'Buggs856', 'id': '2424015180'}]}",,False,,everyone,Twitter for iPhone
1518668819723698178,3025674465,@SlimJim @Roblox well now I have to since Slim Jim said so,2022-04-25 19:10:36+00:00,,8,21,767,0,en,1518668363228229632,"[{'domain': {'id': '45', 'name': 'Brand Vertical', 'description': 'Top level entities that describe a Brands industry'}, 'entity': {'id': '781974596740190208', 'name': 'CPG'}}, {'domain': {'id': '46', 'name': 'Brand Category', 'description': 'Categories within Brand Verticals that narrow down the scope of Brands'}, 'entity': {'id': '781974596144599042', 'name': 'Snacks'}}, {'domain': {'id': '47', 'name': 'Brand', 'description': 'Brands and Companies'}, 'entity': {'id': '1102997788873248768', 'name': 'Slim Jim', 'description': 'Slim Jim'}}, {'domain': {'id': '30', 'name': 'Entities [Entity Service]', 'description': 'Entity Service top level domain, every item that is in Entity Service should be in this domain'}, 'entity': {'id': '825047692124442624', 'name': 'Food', 'description': 'Food'}}, {'domain': {'id': '71', 'name': 'Video Game', 'description': 'A video game like Overwatch'}, 'entity': {'id': '1088118927580774400', 'name': 'Roblox', 'description': 'Roblox'}}]","{'mentions': [{'start': 0, 'end': 8, 'username': 'SlimJim', 'id': '209290982'}, {'start': 9, 'end': 16, 'username': 'Roblox', 'id': '16745055'}], 'annotations': [{'start': 42, 'end': 49, 'probability': 0.9692, 'type': 'Person', 'normalized_text': 'Slim Jim'}]}",,False,,everyone,Twitter Web App
1518794482140925953,1431813824546369540,@Rogersa39468865 @DiegoII91 @KreekCraft @Roblox thanks i'm not hungry anymore,2022-04-26 03:29:57+00:00,,0,2,2,0,en,1518668363228229632,"[{'domain': {'id': '71', 'name': 'Video Game', 'description': 'A video game like Overwatch'}, 'entity': {'id': '1088118927580774400', 'name': 'Roblox', 'description': 'Roblox'}}]","{'mentions': [{'start': 0, 'end': 16, 'username': 'Rogersa39468865', 'id': '1341895418259521537'}, {'start': 17, 'end': 27, 'username': 'DiegoII91', 'id': '1445817256391360512'}, {'start': 28, 'end': 39, 'username': 'KreekCraft', 'id': '3025674465'}, {'start': 40, 'end': 47, 'username': 'Roblox', 'id': '16745055'}]}",,False,,everyone,Twitter Web App
1518948464981331971,1292940736514666501,test,2022-04-26 13:41:49+00:00,,0,1,1,0,en,1518948464981331971,[],,,False,,everyone,Twitter Web App
1518923802452930560,1137876985072508931,@0xiiTobi tienes discord?,2022-04-26 12:03:49+00:00,,0,2,1,0,es,1518772339130859522,"[{'domain': {'id': '47', 'name': 'Brand', 'description': 'Brands and Companies'}, 'entity': {'id': '1168499224297656321', 'name': 'Discord'}}, {'domain': {'id': '165', 'name': 'Technology', 'description': 'for individual and types of technology, e.g., food technology, 3D printing'}, 'entity': {'id': '1196446161223028736', 'name': 'Social media'}}]","{'mentions': [{'start': 0, 'end': 9, 'username': '0xiiTobi', 'id': '1272894025671081985'}]}",,False,,everyone,Twitter for iPhone
1518948032137494528,1427600942933811200,@FrenzyBytes @Parlo_ROBLOX @moonliqhtdreqmz @Amansees @hhjjimhhi @ObscurestRBX @ftDerpy You can literally edit the tiers ? I didn't put parlo in that tier anyways the fuck you blaming me for ?,2022-04-26 13:40:06+00:00,,0,2,2,0,en,1518682759476269058,[],"{'mentions': [{'start': 0, 'end': 12, 'username': 'FrenzyBytes', 'id': '1065703451051593728'}, {'start': 13, 'end': 26, 'username': 'Parlo_ROBLOX', 'id': '1310688804441817088'}, {'start': 27, 'end': 43, 'username': 'moonliqhtdreqmz', 'id': '905485510042198016'}, {'start': 44, 'end': 53, 'username': 'Amansees', 'id': '1424840808381956097'}, {'start': 54, 'end': 64, 'username': 'hhjjimhhi', 'id': '1501706796397961219'}, {'start': 65, 'end': 78, 'username': 'ObscurestRBX', 'id': '1366956926500810754'}, {'start': 79, 'end': 87, 'username': 'ftDerpy', 'id': '4093077509'}]}",,False,,everyone,Twitter for Android
1518569358791958530,1388809442062438400,Been a little over two weeks since I was banned from @Roblox for using a Public model. My account was terminated for breaking Roblox Studio ToS. I had no knowledge a public model could get me banned? In fact the model is still up for use. Why was I terminated and not the model? https://t.co/qLTs9o97zH,2022-04-25 12:35:23+00:00,,14,75,126,3,en,1518569358791958530,"[{'domain': {'id': '71', 'name': 'Video Game', 'description': 'A video game like Overwatch'}, 'entity': {'id': '1088118927580774400', 'name': 'Roblox', 'description': 'Roblox'}}]","{'mentions': [{'start': 53, 'end': 60, 'username': 'Roblox', 'id': '16745055'}], 'annotations': [{'start': 126, 'end': 142, 'probability': 0.5775, 'type': 'Product', 'normalized_text': 'Roblox Studio ToS'}], 'urls': [{'start': 279, 'end': 302, 'url': 'https://t.co/qLTs9o97zH', 'expanded_url': 'https://twitter.com/DemsOnTop/status/1518569358791958530/photo/1', 'display_url': 'pic.twitter.com/qLTs9o97zH', 'media_key': '3_1518569342157443075'}]}",{'media_keys': ['3_1518569342157443075']},False,,everyone,Twitter Web App
1518940564342910977,1065703451051593728,@Parlo_ROBLOX @moonliqhtdreqmz @Amansees @hhjjimhhi @ObscurestRBX @ftDerpy i never said you should burn in hell. it was part of rtc tierlist made by edgar. blame the creator.,2022-04-26 13:10:25+00:00,,0,3,7,0,en,1518682759476269058,[],"{'mentions': [{'start': 0, 'end': 13, 'username': 'Parlo_ROBLOX', 'id': '1310688804441817088'}, {'start': 14, 'end': 30, 'username': 'moonliqhtdreqmz', 'id': '905485510042198016'}, {'start': 31, 'end': 40, 'username': 'Amansees', 'id': '1424840808381956097'}, {'start': 41, 'end': 51, 'username': 'hhjjimhhi', 'id': '1501706796397961219'}, {'start': 52, 'end': 65, 'username': 'ObscurestRBX', 'id': '1366956926500810754'}, {'start': 66, 'end': 74, 'username': 'ftDerpy', 'id': '4093077509'}], 'annotations': [{'start': 149, 'end': 153, 'probability': 0.7249, 'type': 'Person', 'normalized_text': 'edgar'}]}",,False,,everyone,Twitter Web App
1518947047189192704,1284094240922968065,@Parlo_ROBLOX @Dareal2010egh @supernot64 why tf would you need to make a video on him? just because your pissed is no reason to make a video on some random kid that annoyed you slighty. you have over 600k subscribers and theres no reason to send ur fanbase to some random minor.,2022-04-26 13:36:11+00:00,,0,3,5,0,en,1518931305194561536,[],"{'mentions': [{'start': 0, 'end': 13, 'username': 'Parlo_ROBLOX', 'id': '1310688804441817088'}, {'start': 14, 'end': 28, 'username': 'Dareal2010egh', 'id': '1278873765355667457'}]}",,False,,everyone,Twitter Web App
1518720564734705668,3319346152,"Admin no disponible
Ciego legalmente https://t.co/XsGUVorTvG",2022-04-25 22:36:13+00:00,,0,5,23,3,es,1518720564734705668,[],"{'urls': [{'start': 37, 'end': 60, 'url': 'https://t.co/XsGUVorTvG', 'expanded_url': 'https://twitter.com/d_furnox4050/status/1518720564734705668/photo/1', 'display_url': 'pic.twitter.com/XsGUVorTvG', 'media_key': '3_1518720487001665536'}]}",{'media_keys': ['3_1518720487001665536']},False,,everyone,Twitter Web App
1518769798322208770,1449756328583471106,"offers?
nft: 1 merhorse and all bullfrogs
super picky about the nfr cow and mfr uni
lf: other amp and robux

tags to ignore:
#adoptme #adoptmetrade #adoptmetrades #adoptmegiveaways #adoptmegiveaway #adoptmegw #adoptmecrosstrades #adoptmeroblox #roblox #robux #robloxtrade #trades https://t.co/o1lvhFJq2C",2022-04-26 01:51:51+00:00,,8,16,16,1,en,1518769798322208770,"[{'domain': {'id': '66', 'name': 'Interests and Hobbies Category', 'description': 'A grouping of interests and hobbies entities, like Novelty Food or Destinations'}, 'entity': {'id': '913142676819648512', 'name': 'Cryptocurrencies', 'description': 'Cryptocurrency'}}, {'domain': {'id': '71', 'name': 'Video Game', 'description': 'A video game like Overwatch'}, 'entity': {'id': '1088118927580774400', 'name': 'Roblox', 'description': 'Roblox'}}, {'domain': {'id': '71', 'name': 'Video Game', 'description': 'A video game like Overwatch'}, 'entity': {'id': '1229416301245763584', 'name': 'Adopt Me'}}]","{'hashtags': [{'start': 125, 'end': 133, 'tag': 'adoptme'}, {'start': 134, 'end': 147, 'tag': 'adoptmetrade'}, {'start': 148, 'end': 162, 'tag': 'adoptmetrades'}, {'start': 163, 'end': 180, 'tag': 'adoptmegiveaways'}, {'start': 181, 'end': 197, 'tag': 'adoptmegiveaway'}, {'start': 198, 'end': 208, 'tag': 'adoptmegw'}, {'start': 209, 'end': 228, 'tag': 'adoptmecrosstrades'}, {'start': 229, 'end': 243, 'tag': 'adoptmeroblox'}, {'start': 244, 'end': 251, 'tag': 'roblox'}, {'start': 252, 'end': 258, 'tag': 'robux'}, {'start': 259, 'end': 271, 'tag': 'robloxtrade'}, {'start': 272, 'end': 279, 'tag': 'trades'}], 'urls': [{'start': 280, 'end': 303, 'url': 'https://t.co/o1lvhFJq2C', 'expanded_url': 'https://twitter.com/dcrlinq_em/status/1518769798322208770/photo/1', 'display_url': 'pic.twitter.com/o1lvhFJq2C', 'media_key': '3_1518767846821711873'}]}",{'media_keys': ['3_1518767846821711873']},False,,everyone,Twitter Web App
1518943989772206080,214027499,#AionClassic Code: https://t.co/GR8lGBwcfV,2022-04-26 13:24:02+00:00,,0,1,0,0,en,1518943989772206080,[],"{'hashtags': [{'start': 0, 'end': 12, 'tag': 'AionClassic'}], 'urls': [{'start': 19, 'end': 42, 'url': 'https://t.co/GR8lGBwcfV', 'expanded_url': 'https://twitter.com/dreynreh/status/1518943989772206080/photo/1', 'display_url': 'pic.twitter.com/GR8lGBwcfV', 'media_key': '3_1518943970277138433'}]}",{'media_keys': ['3_1518943970277138433']},False,,everyone,Twitter Web App
1518718710634057728,1356794881071603712,"Reply with your game passes 

Buying some until I’m broke https://t.co/pyXMQZD0KT",2022-04-25 22:28:51+00:00,,25,62,86,0,en,1518718710634057728,[],"{'urls': [{'start': 58, 'end': 81, 'url': 'https://t.co/pyXMQZD0KT', 'expanded_url': 'https://twitter.com/hartpwints/status/1518718710634057728/photo/1', 'display_url': 'pic.twitter.com/pyXMQZD0KT', 'media_key': '3_1518718703809957888'}]}",{'media_keys': ['3_1518718703809957888']},False,,everyone,Twitter for iPhone
1518944991540047875,1276556241872003072,where did you guys meet your online besties?,2022-04-26 13:28:01+00:00,,0,4,3,0,en,1518944991540047875,[],,,False,,everyone,Twitter Web App
