tweetid,author_id,text,created_at,geo,retweets,replies,likes,quote_count,lang,conversation_id,context_annotations,entities,attachments,possibly_sensitive,withheld,reply_settings,source
1521217297200865287,1056053249470541824,"Spotify is likely coming to Roblox with BRAND new UGC items. 😳 The music company has been expanding their marketing lately, and roblox could be on the list. Recent leaks leaked for a “boombox” on the Roblox UGC catalog.",2022-05-02 19:57:21+00:00,,50,49,1196,8,en,1521217297200865287,"[{'domain': {'id': '45', 'name': 'Brand Vertical', 'description': 'Top level entities that describe a Brands industry'}, 'entity': {'id': '781974597310615553', 'name': 'Entertainment'}}, {'domain': {'id': '46', 'name': 'Brand Category', 'description': 'Categories within Brand Verticals that narrow down the scope of Brands'}, 'entity': {'id': '781974597222535168', 'name': 'Online Services'}}, {'domain': {'id': '47', 'name': 'Brand', 'description': 'Brands and Companies'}, 'entity': {'id': '10040276669', 'name': 'Spotify'}}, {'domain': {'id': '66', 'name': 'Interests and Hobbies Category', 'description': 'A grouping of interests and hobbies entities, like Novelty Food or Destinations'}, 'entity': {'id': '857879016971186177', 'name': 'Marketing', 'description': 'Marketing'}}, {'domain': {'id': '67', 'name': 'Interests and Hobbies', 'description': 'Interests, opinions, and behaviors of individuals, groups, or cultures; like Speciality Cooking or Theme Parks'}, 'entity': {'id': '1288826829634035714', 'name': 'Backstage'}}, {'domain': {'id': '71', 'name': 'Video Game', 'description': 'A video game like Overwatch'}, 'entity': {'id': '1088118927580774400', 'name': 'Roblox', 'description': 'Roblox'}}, {'domain': {'id': '164', 'name': 'Fields of study', 'description': 'for all fields of study, e.g., futurology, microbiology '}, 'entity': {'id': '1278093262406815744', 'name': 'Fields of study'}}]","{'annotations': [{'start': 0, 'end': 6, 'probability': 0.4611, 'type': 'Organization', 'normalized_text': 'Spotify'}, {'start': 28, 'end': 33, 'probability': 0.4432, 'type': 'Product', 'normalized_text': 'Roblox'}, {'start': 201, 'end': 210, 'probability': 0.3624, 'type': 'Product', 'normalized_text': 'Roblox UGC'}]}",,False,,everyone,Twitter for iPhone
1521560632839090178,969642040706420736,@Pest_Gremlin i don’t think I’ve heard of that one! But online child games mmos were my favorite,2022-05-03 18:41:38+00:00,,0,1,0,0,en,1521528104199598080,[],"{'mentions': [{'start': 0, 'end': 13, 'username': 'Pest_Gremlin', 'id': '2234850618'}]}",,False,,everyone,Twitter for iPhone
392013336155389952,1680731761,http://t.co/fOnRv2AE3U,2013-10-20 19:43:57+00:00,,0,19,2,0,zxx,392013336155389952,[],"{'urls': [{'start': 0, 'end': 22, 'url': 'http://t.co/fOnRv2AE3U', 'expanded_url': 'http://www.youtube.com/watch?v=Wz6vypeTYxI', 'display_url': 'youtube.com/watch?v=Wz6vyp…', 'status': 200, 'unwound_url': 'https://www.youtube.com/watch?v=Wz6vypeTYxI'}]}",,False,,everyone,Twitter Web Client
1521565826322735104,1423208183141748737,@Manoncl18 Oh no,2022-05-03 19:02:16+00:00,,0,1,0,0,en,1521565178378305536,[],"{'mentions': [{'start': 0, 'end': 10, 'username': 'Manoncl18', 'id': '805418652296216577'}]}",,False,,everyone,Twitter for Android
1521470080462295043,20234637,Spotify enters the @Roblox metaverse with launch experience featuring @Stray_Kids and Sunmi https://t.co/agBGVyXtsu https://t.co/KSbbNInAWl,2022-05-03 12:41:49+00:00,,3600,412,12549,4710,en,1521470080462295043,"[{'domain': {'id': '10', 'name': 'Person', 'description': 'Named people in the world like Nelson Mandela'}, 'entity': {'id': '1062427352318173185', 'name': 'Stray Kids', 'description': 'Stray Kids (스트레이 키즈)'}}, {'domain': {'id': '45', 'name': 'Brand Vertical', 'description': 'Top level entities that describe a Brands industry'}, 'entity': {'id': '781974597310615553', 'name': 'Entertainment'}}, {'domain': {'id': '46', 'name': 'Brand Category', 'description': 'Categories within Brand Verticals that narrow down the scope of Brands'}, 'entity': {'id': '781974597222535168', 'name': 'Online Services'}}, {'domain': {'id': '47', 'name': 'Brand', 'description': 'Brands and Companies'}, 'entity': {'id': '10040276669', 'name': 'Spotify'}}, {'domain': {'id': '54', 'name': 'Musician', 'description': 'A musician in the world, like Adele or Bob Dylan'}, 'entity': {'id': '1062427352318173185', 'name': 'Stray Kids', 'description': 'Stray Kids (스트레이 키즈)'}}, {'domain': {'id': '55', 'name': 'Music Genre', 'description': 'A category for a musical style, like Pop, Rock, or Rap'}, 'entity': {'id': '888105153038958593', 'name': 'K-pop', 'description': 'K-Pop'}}, {'domain': {'id': '30', 'name': 'Entities [Entity Service]', 'description': 'Entity Service top level domain, every item that is in Entity Service should be in this domain'}, 'entity': {'id': '848920371311001600', 'name': 'Technology', 'description': 'Technology and computing'}}, {'domain': {'id': '67', 'name': 'Interests and Hobbies', 'description': 'Interests, opinions, and behaviors of individuals, groups, or cultures; like Speciality Cooking or Theme Parks'}, 'entity': {'id': '1288826829634035714', 'name': 'Backstage'}}, {'domain': {'id': '71', 'name': 'Video Game', 'description': 'A video game like Overwatch'}, 'entity': {'id': '1088118927580774400', 'name': 'Roblox', 'description': 'Roblox'}}, {'domain': {'id': '165', 'name': 'Technology', 'description': 'for individual and types of technology, e.g., food technology, 3D printing'}, 'entity': {'id': '848920371311001600', 'name': 'Technology', 'description': 'Technology and computing'}}]","{'annotations': [{'start': 0, 'end': 6, 'probability': 0.4468, 'type': 'Product', 'normalized_text': 'Spotify'}, {'start': 86, 'end': 90, 'probability': 0.8762, 'type': 'Person', 'normalized_text': 'Sunmi'}], 'urls': [{'start': 92, 'end': 115, 'url': 'https://t.co/agBGVyXtsu', 'expanded_url': 'https://www.musicweek.com/digital/read/spotify-enters-the-roblox-metaverse/085725', 'display_url': 'musicweek.com/digital/read/s…'}, {'start': 116, 'end': 139, 'url': 'https://t.co/KSbbNInAWl', 'expanded_url': 'https://twitter.com/MusicWeek/status/1521470080462295043/photo/1', 'display_url': 'pic.twitter.com/KSbbNInAWl', 'media_key': '3_1521469945233776640'}], 'mentions': [{'start': 19, 'end': 26, 'username': 'Roblox', 'id': '16745055'}, {'start': 70, 'end': 81, 'username': 'Stray_Kids', 'id': '859297966581891072'}]}",{'media_keys': ['3_1521469945233776640']},False,,everyone,Twitter Web App
1521522722660134912,33540700,pick a dating app for Jon,2022-05-03 16:11:00+00:00,,1331,2315,35821,682,en,1521522722660134912,"[{'domain': {'id': '130', 'name': 'Multimedia Franchise', 'description': ""Franchises which span multiple forms of media like 'Harry Potter'""}, 'entity': {'id': '1455317623877476358', 'name': 'Garfield'}}]","{'annotations': [{'start': 22, 'end': 24, 'probability': 0.9454, 'type': 'Person', 'normalized_text': 'Jon'}]}",,False,,everyone,Sprinklr
1521211196594176002,1422163374339727363,"🏈NFL Draft

Com a comemoração da NFL Draft de 2022, Roblox irá lançar UM ITEM LIMITED! 

Ele irá ficar a venda por 300 Robux a partir do Dia 2 de Maio (Hoje), á Dia 3 de Maio.

#Roblox #NFLDraft #NFLDraft2022 #NFLTwitter #RobloxDev #Metaverse https://t.co/aCqys9Vw7K",2022-05-02 19:33:06+00:00,,10,7,35,2,pt,1521211196594176002,"[{'domain': {'id': '3', 'name': 'TV Shows', 'description': 'Television shows from around the world'}, 'entity': {'id': '10000612773', 'name': 'NFL Football', 'description': 'Replays of classic NFL games.'}}, {'domain': {'id': '3', 'name': 'TV Shows', 'description': 'Television shows from around the world'}, 'entity': {'id': '10032425201', 'name': 'NFL Football'}}, {'domain': {'id': '3', 'name': 'TV Shows', 'description': 'Television shows from around the world'}, 'entity': {'id': '10033407327', 'name': 'Futebol NFL'}}, {'domain': {'id': '3', 'name': 'TV Shows', 'description': 'Television shows from around the world'}, 'entity': {'id': '10042261464', 'name': 'Fútbol Americano de la NFL'}}, {'domain': {'id': '6', 'name': 'Sports Event'}, 'entity': {'id': '1497206859823939591', 'name': '2022 NFL Draft: Day 1', 'description': ""The 2022 NFL Draft starts on Thursday, as the league's top prospects look to make the jump from college to the pros. Keep it here for Tweets, must-see highlights, and the can't-miss moments right from Las Vegas.""}}, {'domain': {'id': '11', 'name': 'Sport', 'description': 'Types of sports, like soccer and basketball'}, 'entity': {'id': '689566306014617600', 'name': 'American football'}}, {'domain': {'id': '26', 'name': 'Sports League', 'description': ''}, 'entity': {'id': '689566314835259392', 'name': 'NFL'}}, {'domain': {'id': '29', 'name': 'Events [Entity Service]', 'description': 'Entity Service related Events domain'}, 'entity': {'id': '1497206859823939591', 'name': '2022 NFL Draft: Day 1', 'description': ""The 2022 NFL Draft starts on Thursday, as the league's top prospects look to make the jump from college to the pros. Keep it here for Tweets, must-see highlights, and the can't-miss moments right from Las Vegas.""}}, {'domain': {'id': '30', 'name': 'Entities [Entity Service]', 'description': 'Entity Service top level domain, every item that is in Entity Service should be in this domain'}, 'entity': {'id': '848920371311001600', 'name': 'Technology', 'description': 'Technology and computing'}}, {'domain': {'id': '71', 'name': 'Video Game', 'description': 'A video game like Overwatch'}, 'entity': {'id': '1088118927580774400', 'name': 'Roblox', 'description': 'Roblox'}}, {'domain': {'id': '165', 'name': 'Technology', 'description': 'for individual and types of technology, e.g., food technology, 3D printing'}, 'entity': {'id': '848920371311001600', 'name': 'Technology', 'description': 'Technology and computing'}}, {'domain': {'id': '45', 'name': 'Brand Vertical', 'description': 'Top level entities that describe a Brands industry'}, 'entity': {'id': '781974597310615553', 'name': 'Entertainment'}}, {'domain': {'id': '46', 'name': 'Brand Category', 'description': 'Categories within Brand Verticals that narrow down the scope of Brands'}, 'entity': {'id': '781974597491040257', 'name': 'Sports'}}, {'domain': {'id': '47', 'name': 'Brand', 'description': 'Brands and Companies'}, 'entity': {'id': '10042758256', 'name': 'NFL'}}]","{'annotations': [{'start': 53, 'end': 58, 'probability': 0.5017, 'type': 'Product', 'normalized_text': 'Roblox'}], 'urls': [{'start': 243, 'end': 266, 'url': 'https://t.co/aCqys9Vw7K', 'expanded_url': 'https://twitter.com/LeaksEvents/status/1521211196594176002/photo/1', 'display_url': 'pic.twitter.com/aCqys9Vw7K', 'media_key': '3_1521210241274335234'}], 'hashtags': [{'start': 177, 'end': 184, 'tag': 'Roblox'}, {'start': 185, 'end': 194, 'tag': 'NFLDraft'}, {'start': 195, 'end': 208, 'tag': 'NFLDraft2022'}, {'start': 209, 'end': 220, 'tag': 'NFLTwitter'}, {'start': 221, 'end': 231, 'tag': 'RobloxDev'}, {'start': 232, 'end': 242, 'tag': 'Metaverse'}]}",{'media_keys': ['3_1521210241274335234']},False,,everyone,Twitter Web App
1521553803086024704,2850532049,Roblox is promoting an illegally stolen copy of a game they falsely banned $RBLX https://t.co/aty0imOEDz,2022-05-03 18:14:30+00:00,,541,359,11779,29,en,1521553803086024704,"[{'domain': {'id': '71', 'name': 'Video Game', 'description': 'A video game like Overwatch'}, 'entity': {'id': '1088118927580774400', 'name': 'Roblox', 'description': 'Roblox'}}]","{'cashtags': [{'start': 75, 'end': 80, 'tag': 'RBLX'}], 'annotations': [{'start': 0, 'end': 5, 'probability': 0.6129, 'type': 'Organization', 'normalized_text': 'Roblox'}], 'urls': [{'start': 81, 'end': 104, 'url': 'https://t.co/aty0imOEDz', 'expanded_url': 'https://twitter.com/AlbertsStuff/status/1521553803086024704/photo/1', 'display_url': 'pic.twitter.com/aty0imOEDz', 'media_key': '3_1521553668977352705'}]}",{'media_keys': ['3_1521553668977352705']},False,,everyone,Twitter Web App
1521159568562147329,16745055,"For uptown. For downtown. For your avatar, no matter what size and shape it is. Available now: https://t.co/NaI3ENWTbw https://t.co/xFrs99Fint",2022-05-02 16:07:57+00:00,,211,3023,4524,45,en,1521159568562147329,"[{'domain': {'id': '71', 'name': 'Video Game', 'description': 'A video game like Overwatch'}, 'entity': {'id': '1088118927580774400', 'name': 'Roblox', 'description': 'Roblox'}}]","{'urls': [{'start': 95, 'end': 118, 'url': 'https://t.co/NaI3ENWTbw', 'expanded_url': 'https://rblx.co/shorts', 'display_url': 'rblx.co/shorts'}, {'start': 119, 'end': 142, 'url': 'https://t.co/xFrs99Fint', 'expanded_url': 'https://twitter.com/Roblox/status/1521159568562147329/video/1', 'display_url': 'pic.twitter.com/xFrs99Fint', 'media_key': '7_1521158682746056705'}]}",{'media_keys': ['7_1521158682746056705']},False,,everyone,Twitter Web App
1519851860173234177,1056053249470541824,"Ripull - The creator of Ripull’s Minigames - has disappeared off Roblox. It’s likely that he asked Roblox for his account to be deleted. He was going to quit soon, anyways, according to his Twitter. 😞‼️ https://t.co/GPQAJf7URD",2022-04-29 01:31:35+00:00,,103,170,1902,28,en,1519851860173234177,"[{'domain': {'id': '71', 'name': 'Video Game', 'description': 'A video game like Overwatch'}, 'entity': {'id': '1088118927580774400', 'name': 'Roblox', 'description': 'Roblox'}}, {'domain': {'id': '46', 'name': 'Brand Category', 'description': 'Categories within Brand Verticals that narrow down the scope of Brands'}, 'entity': {'id': '781974596752842752', 'name': 'Services'}}, {'domain': {'id': '47', 'name': 'Brand', 'description': 'Brands and Companies'}, 'entity': {'id': '10045225402', 'name': 'Twitter'}}]","{'annotations': [{'start': 24, 'end': 29, 'probability': 0.5223, 'type': 'Person', 'normalized_text': 'Ripull'}, {'start': 99, 'end': 104, 'probability': 0.2923, 'type': 'Person', 'normalized_text': 'Roblox'}, {'start': 190, 'end': 196, 'probability': 0.7147, 'type': 'Product', 'normalized_text': 'Twitter'}], 'urls': [{'start': 203, 'end': 226, 'url': 'https://t.co/GPQAJf7URD', 'expanded_url': 'https://twitter.com/Roblox_RTC/status/1519851860173234177/video/1', 'display_url': 'pic.twitter.com/GPQAJf7URD', 'media_key': '7_1519851830007713794'}]}",{'media_keys': ['7_1519851830007713794']},False,,everyone,Twitter for iPhone
1521546260079022080,1454477568946499584,"@Quenty BEAUTIFUL.
It is so satisfying! 😍

Did you use a UI framework?",2022-05-03 17:44:32+00:00,,0,1,1,0,en,1521544514040520705,[],"{'mentions': [{'start': 0, 'end': 7, 'username': 'Quenty', 'id': '543082478'}]}",,False,,everyone,Twitter for Android
1521512841987203084,1477831992989425664,Al parecer Roblox se ha asociado com Spotify para crear una isla de minijuegos donde estará #StrayKids y Sunmi omg https://t.co/pYeOfTElno,2022-05-03 15:31:44+00:00,,524,16,3601,415,es,1521512841987203084,"[{'domain': {'id': '10', 'name': 'Person', 'description': 'Named people in the world like Nelson Mandela'}, 'entity': {'id': '1062427352318173185', 'name': 'Stray Kids', 'description': 'Stray Kids (스트레이 키즈)'}}, {'domain': {'id': '45', 'name': 'Brand Vertical', 'description': 'Top level entities that describe a Brands industry'}, 'entity': {'id': '781974597310615553', 'name': 'Entertainment'}}, {'domain': {'id': '46', 'name': 'Brand Category', 'description': 'Categories within Brand Verticals that narrow down the scope of Brands'}, 'entity': {'id': '781974597222535168', 'name': 'Online Services'}}, {'domain': {'id': '47', 'name': 'Brand', 'description': 'Brands and Companies'}, 'entity': {'id': '10040276669', 'name': 'Spotify'}}, {'domain': {'id': '54', 'name': 'Musician', 'description': 'A musician in the world, like Adele or Bob Dylan'}, 'entity': {'id': '1062427352318173185', 'name': 'Stray Kids', 'description': 'Stray Kids (스트레이 키즈)'}}, {'domain': {'id': '55', 'name': 'Music Genre', 'description': 'A category for a musical style, like Pop, Rock, or Rap'}, 'entity': {'id': '888105153038958593', 'name': 'K-pop', 'description': 'K-Pop'}}, {'domain': {'id': '67', 'name': 'Interests and Hobbies', 'description': 'Interests, opinions, and behaviors of individuals, groups, or cultures; like Speciality Cooking or Theme Parks'}, 'entity': {'id': '1288826829634035714', 'name': 'Backstage'}}, {'domain': {'id': '71', 'name': 'Video Game', 'description': 'A video game like Overwatch'}, 'entity': {'id': '1088118927580774400', 'name': 'Roblox', 'description': 'Roblox'}}]","{'annotations': [{'start': 11, 'end': 16, 'probability': 0.36, 'type': 'Organization', 'normalized_text': 'Roblox'}, {'start': 37, 'end': 43, 'probability': 0.4255, 'type': 'Product', 'normalized_text': 'Spotify'}, {'start': 105, 'end': 109, 'probability': 0.6181, 'type': 'Person', 'normalized_text': 'Sunmi'}], 'urls': [{'start': 115, 'end': 138, 'url': 'https://t.co/pYeOfTElno', 'expanded_url': 'https://twitter.com/skzstaylatam/status/1521512841987203084/photo/1', 'display_url': 'pic.twitter.com/pYeOfTElno', 'media_key': '3_1521512839445368833'}], 'hashtags': [{'start': 92, 'end': 102, 'tag': 'StrayKids'}]}",{'media_keys': ['3_1521512839445368833']},False,,everyone,Twitter for Android
1521477040066674689,1159561904433639426,What if Eggman was now the main antagonist of the last game you played https://t.co/nqSjqfz8E1,2022-05-03 13:09:28+00:00,,955,4224,18379,1379,en,1521477040066674689,"[{'domain': {'id': '130', 'name': 'Multimedia Franchise', 'description': ""Franchises which span multiple forms of media like 'Harry Potter'""}, 'entity': {'id': '993952643209773057', 'name': 'Sonic the Hedgehog', 'description': 'This entity includes all conversation about the franchise, as well as any individual installments in the series, if applicable.\t\t\t\n\nNOTE: Stopped annotating in the Video Game domain (71) on 11/15/19. Moving forward, this entity will annotate to Multimedia Franchise domain (130) only.'}}]","{'annotations': [{'start': 8, 'end': 13, 'probability': 0.6419, 'type': 'Person', 'normalized_text': 'Eggman'}], 'urls': [{'start': 71, 'end': 94, 'url': 'https://t.co/nqSjqfz8E1', 'expanded_url': 'https://twitter.com/db_witch/status/1521477040066674689/photo/1', 'display_url': 'pic.twitter.com/nqSjqfz8E1', 'media_key': '3_1521476980968939522'}]}",{'media_keys': ['3_1521476980968939522']},False,,everyone,Twitter for iPhone
1520554194075373569,1490493848509816833,@Bandanadee17 Tshirt pls,2022-05-01 00:02:25+00:00,,0,2,0,0,tl,1520548264529084416,[],"{'mentions': [{'start': 0, 'end': 13, 'username': 'Bandanadee17', 'id': '1305643016460402693'}]}",,False,,everyone,Twitter for Android
1521472403116806146,1074000530123472897,"My game was deleted 3 days ago, roblox never sent me a reason why it was deleted. They have not answered my e-mail in 3 days too.

@Roblox @robloxdevrel #Roblox #RobloxDev https://t.co/sL9vQSy6xe",2022-05-03 12:51:03+00:00,,19,98,344,3,en,1521472403116806146,"[{'domain': {'id': '71', 'name': 'Video Game', 'description': 'A video game like Overwatch'}, 'entity': {'id': '1088118927580774400', 'name': 'Roblox', 'description': 'Roblox'}}]","{'urls': [{'start': 172, 'end': 195, 'url': 'https://t.co/sL9vQSy6xe', 'expanded_url': 'https://twitter.com/WoizYT/status/1521472403116806146/photo/1', 'display_url': 'pic.twitter.com/sL9vQSy6xe', 'media_key': '3_1521472398268243968'}], 'mentions': [{'start': 131, 'end': 138, 'username': 'Roblox', 'id': '16745055'}, {'start': 139, 'end': 152, 'username': 'robloxdevrel', 'id': '856650515874172928'}], 'hashtags': [{'start': 153, 'end': 160, 'tag': 'Roblox'}, {'start': 161, 'end': 171, 'tag': 'RobloxDev'}]}",{'media_keys': ['3_1521472398268243968']},False,,everyone,Twitter for iPhone
1520906178074619905,1228700021425655808,"Type ""Roblox is"" in the replies and let your keyboard finish the sentence. 😎",2022-05-01 23:21:04+00:00,,5,146,86,0,en,1520906178074619905,"[{'domain': {'id': '71', 'name': 'Video Game', 'description': 'A video game like Overwatch'}, 'entity': {'id': '1088118927580774400', 'name': 'Roblox', 'description': 'Roblox'}}]",,,False,,everyone,TweetDeck
1521550630187372544,1018970319174995969,"@FortniteStatus oh no now they're calling creative maps ""experiences"" too...",2022-05-03 18:01:53+00:00,,0,2,1,0,en,1521535148549885952,"[{'domain': {'id': '71', 'name': 'Video Game', 'description': 'A video game like Overwatch'}, 'entity': {'id': '974285387987169280', 'name': 'Fortnite', 'description': 'This entity includes all conversation about the franchise, as well as any individual installments in the series, if applicable.\t\t\t'}}]","{'mentions': [{'start': 0, 'end': 15, 'username': 'FortniteStatus', 'id': '1181729392755707904'}]}",,False,,everyone,Twitter Web App
1497054791402287105,1173676283798020096,"Whether it’s making new friends in a game of 3 on 3 laser blasting or meditating quietly by yourself, in Horizon Worlds the possibilities are endless.",2022-02-25 03:44:10+00:00,,174,354,1501,77,en,1497054791402287105,"[{'domain': {'id': '65', 'name': 'Interests and Hobbies Vertical', 'description': 'Top level interests and hobbies groupings, like Food or Travel'}, 'entity': {'id': '903303816698671104', 'name': 'Wellness and health', 'description': 'Wellness & Health'}}, {'domain': {'id': '67', 'name': 'Interests and Hobbies', 'description': 'Interests, opinions, and behaviors of individuals, groups, or cultures; like Speciality Cooking or Theme Parks'}, 'entity': {'id': '918221163284676608', 'name': 'Meditation', 'description': 'Meditation'}}]","{'annotations': [{'start': 105, 'end': 118, 'probability': 0.3778, 'type': 'Other', 'normalized_text': 'Horizon Worlds'}]}",,False,,everyone,Twitter for Advertisers
1521564982508404736,1498716192349077504,"@chinaeasternair CEO VP AND CHAIRMANS OF BOARD see FLL , FCO PVG welcome be safe out there save and defend as much president of china ix jinping  strange facts FLL griffin rd road and pmd pontiac formula!? griffin formula inform you about , after cyprus china now,i suspect @eastern_roblox youtube",2022-05-03 18:58:55+00:00,,0,2,0,0,en,2495636624,"[{'domain': {'id': '165', 'name': 'Technology', 'description': 'for individual and types of technology, e.g., food technology, 3D printing'}, 'entity': {'id': '1196446161223028736', 'name': 'Social media'}}, {'domain': {'id': '46', 'name': 'Brand Category', 'description': 'Categories within Brand Verticals that narrow down the scope of Brands'}, 'entity': {'id': '781974596752842752', 'name': 'Services'}}, {'domain': {'id': '47', 'name': 'Brand', 'description': 'Brands and Companies'}, 'entity': {'id': '10029382357', 'name': 'YouTube'}}]","{'annotations': [{'start': 51, 'end': 53, 'probability': 0.6994, 'type': 'Place', 'normalized_text': 'FLL'}], 'mentions': [{'start': 0, 'end': 16, 'username': 'chinaeasternair', 'id': '42024869'}, {'start': 274, 'end': 289, 'username': 'eastern_roblox', 'id': '1515254337941151747'}]}",,False,,everyone,Twitter Web App
1521564242146729984,913435814524280834,"📊[INFO] 220503 #StrayKids 

Roblox y Spotify se asociaron para crear una isla de minijuegos donde estará #StrayKids

""Spotify Island permitirá a los fanáticos crear nuevos sonidos juntos, pasar el rato en espacios digitales y obtener acceso a productos exclusivos"" https://t.co/SeravX74Mi",2022-05-03 18:55:59+00:00,,34,2,192,5,es,1521564242146729984,"[{'domain': {'id': '10', 'name': 'Person', 'description': 'Named people in the world like Nelson Mandela'}, 'entity': {'id': '1062427352318173185', 'name': 'Stray Kids', 'description': 'Stray Kids (스트레이 키즈)'}}, {'domain': {'id': '45', 'name': 'Brand Vertical', 'description': 'Top level entities that describe a Brands industry'}, 'entity': {'id': '781974597310615553', 'name': 'Entertainment'}}, {'domain': {'id': '46', 'name': 'Brand Category', 'description': 'Categories within Brand Verticals that narrow down the scope of Brands'}, 'entity': {'id': '781974597222535168', 'name': 'Online Services'}}, {'domain': {'id': '47', 'name': 'Brand', 'description': 'Brands and Companies'}, 'entity': {'id': '10040276669', 'name': 'Spotify'}}, {'domain': {'id': '54', 'name': 'Musician', 'description': 'A musician in the world, like Adele or Bob Dylan'}, 'entity': {'id': '1062427352318173185', 'name': 'Stray Kids', 'description': 'Stray Kids (스트레이 키즈)'}}, {'domain': {'id': '55', 'name': 'Music Genre', 'description': 'A category for a musical style, like Pop, Rock, or Rap'}, 'entity': {'id': '888105153038958593', 'name': 'K-pop', 'description': 'K-Pop'}}, {'domain': {'id': '67', 'name': 'Interests and Hobbies', 'description': 'Interests, opinions, and behaviors of individuals, groups, or cultures; like Speciality Cooking or Theme Parks'}, 'entity': {'id': '1288826829634035714', 'name': 'Backstage'}}, {'domain': {'id': '71', 'name': 'Video Game', 'description': 'A video game like Overwatch'}, 'entity': {'id': '1088118927580774400', 'name': 'Roblox', 'description': 'Roblox'}}]","{'annotations': [{'start': 119, 'end': 132, 'probability': 0.5849, 'type': 'Product', 'normalized_text': 'Spotify Island'}], 'urls': [{'start': 265, 'end': 288, 'url': 'https://t.co/SeravX74Mi', 'expanded_url': 'https://twitter.com/StrayKidsArgFC/status/1521564242146729984/photo/1', 'display_url': 'pic.twitter.com/SeravX74Mi', 'media_key': '3_1521564240020230151'}], 'hashtags': [{'start': 15, 'end': 25, 'tag': 'StrayKids'}, {'start': 105, 'end': 115, 'tag': 'StrayKids'}]}",{'media_keys': ['3_1521564240020230151']},False,,everyone,Twitter for Android
1521209599042506752,1310688804441817088,"shit fucking birthday. worst day ever. life is horrible, absolutely terrible LOL.",2022-05-02 19:26:45+00:00,,3,117,163,9,en,1521209599042506752,[],,,False,,everyone,Twitter Web App
