tweetid,author_id,text,created_at,geo,retweets,replies,likes,quote_count,lang,conversation_id,context_annotations,entities,attachments,possibly_sensitive,withheld,reply_settings,source
1514584571953692674,1506265873782382592,"I cant owerwrite or add my game as new place😕
What is going on? Maybe someone can help me. #Roblox #RobloxDev https://t.co/nuq59Gy9XX",2022-04-14 12:41:16+00:00,,1,0,1,1,en,1514584571953692674,"[{'domain': {'id': '71', 'name': 'Video Game', 'description': 'A video game like Overwatch'}, 'entity': {'id': '1088118927580774400', 'name': 'Roblox', 'description': 'Roblox'}}]","{'hashtags': [{'start': 91, 'end': 98, 'tag': 'Roblox'}, {'start': 99, 'end': 109, 'tag': 'RobloxDev'}], 'urls': [{'start': 110, 'end': 133, 'url': 'https://t.co/nuq59Gy9XX', 'expanded_url': 'https://twitter.com/FacylBorder/status/1514584571953692674/photo/1', 'display_url': 'pic.twitter.com/nuq59Gy9XX', 'media_key': '3_1514583151632437251'}]}",{'media_keys': ['3_1514583151632437251']},False,,everyone,Twitter Web App
1510733571941707778,1071938981389045765,Seems a lot of users were expecting Tesla's to be added. This was an April Fools joke by @RufflesPlaysMC. We were not planning to add electric cars. https://t.co/YC0mUiSCU7,2022-04-03 21:38:46+00:00,,11,52,217,0,en,1510721187780997120,"[{'domain': {'id': '29', 'name': 'Events [Entity Service]', 'description': 'Entity Service related Events domain'}, 'entity': {'id': '1227232928104534022', 'name': ""April Fools' Day"", 'description': ""This entity for April Fools' Day for all years ""}}, {'domain': {'id': '45', 'name': 'Brand Vertical', 'description': 'Top level entities that describe a Brands industry'}, 'entity': {'id': '781974597302226944', 'name': 'Transportation'}}, {'domain': {'id': '30', 'name': 'Entities [Entity Service]', 'description': 'Entity Service top level domain, every item that is in Entity Service should be in this domain'}, 'entity': {'id': '848920371311001600', 'name': 'Technology', 'description': 'Technology and computing'}}, {'domain': {'id': '119', 'name': 'Holiday', 'description': 'Holidays like Christmas or Halloween'}, 'entity': {'id': '1227232928104534022', 'name': ""April Fools' Day"", 'description': ""This entity for April Fools' Day for all years ""}}, {'domain': {'id': '165', 'name': 'Technology', 'description': 'for individual and types of technology, e.g., food technology, 3D printing'}, 'entity': {'id': '848920371311001600', 'name': 'Technology', 'description': 'Technology and computing'}}, {'domain': {'id': '45', 'name': 'Brand Vertical', 'description': 'Top level entities that describe a Brands industry'}, 'entity': {'id': '781972125171060736', 'name': 'Auto'}}, {'domain': {'id': '46', 'name': 'Brand Category', 'description': 'Categories within Brand Verticals that narrow down the scope of Brands'}, 'entity': {'id': '781972125179518977', 'name': 'Auto Manufacturer'}}, {'domain': {'id': '47', 'name': 'Brand', 'description': 'Brands and Companies'}, 'entity': {'id': '10044199219', 'name': 'Tesla Motors'}}, {'domain': {'id': '65', 'name': 'Interests and Hobbies Vertical', 'description': 'Top level interests and hobbies groupings, like Food or Travel'}, 'entity': {'id': '847528391163092993', 'name': 'Automotive', 'description': 'Car culture'}}, {'domain': {'id': '66', 'name': 'Interests and Hobbies Category', 'description': 'A grouping of interests and hobbies entities, like Novelty Food or Destinations'}, 'entity': {'id': '847528576551337984', 'name': 'Hybrid and electric vehicles', 'description': 'Hybrid and electric vehicles'}}, {'domain': {'id': '66', 'name': 'Interests and Hobbies Category', 'description': 'A grouping of interests and hobbies entities, like Novelty Food or Destinations'}, 'entity': {'id': '847528646185070592', 'name': 'Luxury Cars', 'description': 'Luxury'}}]","{'annotations': [{'start': 36, 'end': 40, 'probability': 0.5318, 'type': 'Organization', 'normalized_text': 'Tesla'}], 'urls': [{'start': 149, 'end': 172, 'url': 'https://t.co/YC0mUiSCU7', 'expanded_url': 'https://youtu.be/qYd9qbpVFjo?t=181', 'display_url': 'youtu.be/qYd9qbpVFjo?t=…', 'images': [{'url': 'https://pbs.twimg.com/news_img/1510733614505463816/tN0o5Qcb?format=jpg&name=orig', 'width': 480, 'height': 360}, {'url': 'https://pbs.twimg.com/news_img/1510733614505463816/tN0o5Qcb?format=jpg&name=150x150', 'width': 150, 'height': 150}], 'status': 200, 'title': '*NEW* NEW TESLAS COMING TO ER:LC! NEW TESLA CHARGERS & MODEL 3 CARS! ER:LC Update Leaks & Info', 'description': '-------------------------------------⭐ OPEN DESCRIPTION FOR MORE ⭐👕 Buy the Real Life RufflesOfficial Merch for a shoutout and more! https://shop.rufflesoff...', 'unwound_url': 'https://www.youtube.com/watch?t=181&v=qYd9qbpVFjo&feature=youtu.be'}], 'mentions': [{'start': 89, 'end': 104, 'username': 'RufflesPlaysMC', 'id': '825846571078148097'}]}",,False,,everyone,Twitter Web App
1514576841583079436,129228849,The fact that Kourtney and Travis are actually like this is very sweet. They are very much in love and I love that for them.,2022-04-14 12:10:33+00:00,,0,2,2,0,en,1514575706415640585,[],"{'annotations': [{'start': 14, 'end': 21, 'probability': 0.9915, 'type': 'Person', 'normalized_text': 'Kourtney'}, {'start': 27, 'end': 32, 'probability': 0.9929, 'type': 'Person', 'normalized_text': 'Travis'}]}",,False,,everyone,Twitter for iPhone
1514328560613347343,1244816209,"SEGA is collaborating with Roblox on an official Sonic game.

... that comes out tomorrow.

... but it's never been advertised once ... https://t.co/X5pqdz4cx2",2022-04-13 19:43:58+00:00,,727,63,6812,66,en,1514328560613347343,"[{'domain': {'id': '71', 'name': 'Video Game', 'description': 'A video game like Overwatch'}, 'entity': {'id': '1088118927580774400', 'name': 'Roblox', 'description': 'Roblox'}}, {'domain': {'id': '78', 'name': 'Video Game Publisher', 'description': ""A Video Game Publisher like 'Activision'""}, 'entity': {'id': '943877135894056966', 'name': 'Sega', 'description': 'Sega'}}, {'domain': {'id': '86', 'name': 'Movie', 'description': 'A film like Rogue One: A Star Wars Story'}, 'entity': {'id': '1123217054088097793', 'name': 'Sonic The Hedgehog', 'description': 'Release on February 14, 2019.\nRelease on March 27, 2020 (Japan)'}}, {'domain': {'id': '87', 'name': 'Movie Genre', 'description': 'A movie genre like Action'}, 'entity': {'id': '856976360337661952', 'name': 'Action & adventure films', 'description': 'Action and adventure'}}, {'domain': {'id': '130', 'name': 'Multimedia Franchise', 'description': ""Franchises which span multiple forms of media like 'Harry Potter'""}, 'entity': {'id': '993952643209773057', 'name': 'Sonic the Hedgehog', 'description': 'This entity includes all conversation about the franchise, as well as any individual installments in the series, if applicable.\t\t\t\n\nNOTE: Stopped annotating in the Video Game domain (71) on 11/15/19. Moving forward, this entity will annotate to Multimedia Franchise domain (130) only.'}}]","{'annotations': [{'start': 0, 'end': 3, 'probability': 0.5108, 'type': 'Organization', 'normalized_text': 'SEGA'}, {'start': 27, 'end': 32, 'probability': 0.4196, 'type': 'Product', 'normalized_text': 'Roblox'}], 'urls': [{'start': 136, 'end': 159, 'url': 'https://t.co/X5pqdz4cx2', 'expanded_url': 'https://twitter.com/DynamoSuperX/status/1514328560613347343/photo/1', 'display_url': 'pic.twitter.com/X5pqdz4cx2', 'media_key': '3_1514328549058039821'}, {'start': 136, 'end': 159, 'url': 'https://t.co/X5pqdz4cx2', 'expanded_url': 'https://twitter.com/DynamoSuperX/status/1514328560613347343/photo/1', 'display_url': 'pic.twitter.com/X5pqdz4cx2', 'media_key': '3_1514328551742394371'}, {'start': 136, 'end': 159, 'url': 'https://t.co/X5pqdz4cx2', 'expanded_url': 'https://twitter.com/DynamoSuperX/status/1514328560613347343/photo/1', 'display_url': 'pic.twitter.com/X5pqdz4cx2', 'media_key': '3_1514328554091261959'}, {'start': 136, 'end': 159, 'url': 'https://t.co/X5pqdz4cx2', 'expanded_url': 'https://twitter.com/DynamoSuperX/status/1514328560613347343/photo/1', 'display_url': 'pic.twitter.com/X5pqdz4cx2', 'media_key': '3_1514328558113591298'}]}","{'media_keys': ['3_1514328549058039821', '3_1514328551742394371', '3_1514328554091261959', '3_1514328558113591298']}",False,,everyone,Twitter for Android
1514292412214034444,759027320560627712,"🔵 Deck out your avatar on @Roblox with the Virtual Nomad Bundle created by Arsenal developer @ROLVeStuff! 🔵 

Comes with a mask, a hood and unlocks exciting bonus rewards too 👀 

Free with Prime! https://t.co/FmGbmQG210 https://t.co/m9AYYa5uvN",2022-04-13 17:20:19+00:00,,140,134,1325,18,en,1514292412214034444,"[{'domain': {'id': '71', 'name': 'Video Game', 'description': 'A video game like Overwatch'}, 'entity': {'id': '1088118927580774400', 'name': 'Roblox', 'description': 'Roblox'}}]","{'annotations': [{'start': 76, 'end': 82, 'probability': 0.8745, 'type': 'Organization', 'normalized_text': 'Arsenal'}], 'urls': [{'start': 196, 'end': 219, 'url': 'https://t.co/FmGbmQG210', 'expanded_url': 'https://amzn.to/3KzXony', 'display_url': 'amzn.to/3KzXony'}, {'start': 220, 'end': 243, 'url': 'https://t.co/m9AYYa5uvN', 'expanded_url': 'https://twitter.com/primegaming/status/1514292412214034444/video/1', 'display_url': 'pic.twitter.com/m9AYYa5uvN', 'media_key': '7_1514292336674676736'}], 'mentions': [{'start': 26, 'end': 33, 'username': 'Roblox', 'id': '16745055'}, {'start': 93, 'end': 104, 'username': 'ROLVeStuff', 'id': '2995414579'}]}",{'media_keys': ['7_1514292336674676736']},False,,everyone,Sprout Social
1514284675807731714,1207916357125386240,"Why is there a new officially licensed roblox sonic game releasing tomorrow with like

0 promotion behind it???? https://t.co/CTjoqm2ciX",2022-04-13 16:49:35+00:00,,401,56,3081,38,en,1514284675807731714,"[{'domain': {'id': '71', 'name': 'Video Game', 'description': 'A video game like Overwatch'}, 'entity': {'id': '1088118927580774400', 'name': 'Roblox', 'description': 'Roblox'}}, {'domain': {'id': '130', 'name': 'Multimedia Franchise', 'description': ""Franchises which span multiple forms of media like 'Harry Potter'""}, 'entity': {'id': '993952643209773057', 'name': 'Sonic the Hedgehog', 'description': 'This entity includes all conversation about the franchise, as well as any individual installments in the series, if applicable.\t\t\t\n\nNOTE: Stopped annotating in the Video Game domain (71) on 11/15/19. Moving forward, this entity will annotate to Multimedia Franchise domain (130) only.'}}]","{'annotations': [{'start': 39, 'end': 50, 'probability': 0.423, 'type': 'Product', 'normalized_text': 'roblox sonic'}], 'urls': [{'start': 113, 'end': 136, 'url': 'https://t.co/CTjoqm2ciX', 'expanded_url': 'https://twitter.com/existingdebeing/status/1514284675807731714/photo/1', 'display_url': 'pic.twitter.com/CTjoqm2ciX', 'media_key': '3_1514284651073921026'}, {'start': 113, 'end': 136, 'url': 'https://t.co/CTjoqm2ciX', 'expanded_url': 'https://twitter.com/existingdebeing/status/1514284675807731714/photo/1', 'display_url': 'pic.twitter.com/CTjoqm2ciX', 'media_key': '3_1514284658573381645'}, {'start': 113, 'end': 136, 'url': 'https://t.co/CTjoqm2ciX', 'expanded_url': 'https://twitter.com/existingdebeing/status/1514284675807731714/photo/1', 'display_url': 'pic.twitter.com/CTjoqm2ciX', 'media_key': '3_1514284669755441153'}, {'start': 113, 'end': 136, 'url': 'https://t.co/CTjoqm2ciX', 'expanded_url': 'https://twitter.com/existingdebeing/status/1514284675807731714/photo/1', 'display_url': 'pic.twitter.com/CTjoqm2ciX', 'media_key': '3_1514284673446330376'}]}","{'media_keys': ['3_1514284651073921026', '3_1514284658573381645', '3_1514284669755441153', '3_1514284673446330376']}",False,,everyone,Twitter for Android
