tweetid,author_id,text,created_at,geo,retweets,replies,likes,quote_count,lang,conversation_id,context_annotations,entities,attachments,possibly_sensitive,withheld,reply_settings,source
1515416239207768072,1464287891669016591,"@Roblox @gamefamstudios Can you unban me on roblox because I was banned unfairly because a friend of mine cursed me and then reported me, this is not the first defense so I can't log in to my account, please open my name; SiyahKurt207",2022-04-16 19:46:01+00:00,,0,4,3,0,en,1515026236241850380,"[{'domain': {'id': '71', 'name': 'Video Game', 'description': 'A video game like Overwatch'}, 'entity': {'id': '1088118927580774400', 'name': 'Roblox', 'description': 'Roblox'}}]","{'mentions': [{'start': 0, 'end': 7, 'username': 'Roblox', 'id': '16745055'}, {'start': 8, 'end': 23, 'username': 'gamefamstudios', 'id': '1162494706066046977'}], 'annotations': [{'start': 44, 'end': 49, 'probability': 0.459, 'type': 'Product', 'normalized_text': 'roblox'}]}",,False,,everyone,Twitter for Android
1515283863030935556,888867384404176896,"Comment your Roblox Display name!!!

The best one wins 5,000 Robux! &lt;3",2022-04-16 11:00:00+00:00,,148,4270,1315,13,en,1515283863030935556,"[{'domain': {'id': '71', 'name': 'Video Game', 'description': 'A video game like Overwatch'}, 'entity': {'id': '1088118927580774400', 'name': 'Roblox', 'description': 'Roblox'}}]",,,False,,everyone,Twitter Web App
1515420046960570378,1513718860964372494,@Roblox @sonic_hedgehog Roblox pls unban me pls I did not do anything and if I did it was my brother,2022-04-16 20:01:08+00:00,,0,3,1,0,en,1515026236241850380,"[{'domain': {'id': '71', 'name': 'Video Game', 'description': 'A video game like Overwatch'}, 'entity': {'id': '1088118927580774400', 'name': 'Roblox', 'description': 'Roblox'}}, {'domain': {'id': '130', 'name': 'Multimedia Franchise', 'description': ""Franchises which span multiple forms of media like 'Harry Potter'""}, 'entity': {'id': '993952643209773057', 'name': 'Sonic the Hedgehog', 'description': 'This entity includes all conversation about the franchise, as well as any individual installments in the series, if applicable.\t\t\t\n\nNOTE: Stopped annotating in the Video Game domain (71) on 11/15/19. Moving forward, this entity will annotate to Multimedia Franchise domain (130) only.'}}]","{'mentions': [{'start': 0, 'end': 7, 'username': 'Roblox', 'id': '16745055'}, {'start': 8, 'end': 23, 'username': 'sonic_hedgehog', 'id': '19609162'}]}",,False,,everyone,Twitter for iPhone
1515321434184237062,1333815105000247296,@Dave0and0Bambi @GoriestPunk @darkviper No their a roblox player,2022-04-16 13:29:17+00:00,,0,1,0,0,en,1515070245651636230,"[{'domain': {'id': '71', 'name': 'Video Game', 'description': 'A video game like Overwatch'}, 'entity': {'id': '1088118927580774400', 'name': 'Roblox', 'description': 'Roblox'}}]","{'mentions': [{'start': 16, 'end': 28, 'username': 'GoriestPunk', 'id': '720298765760921600'}, {'start': 29, 'end': 39, 'username': 'darkviper', 'id': '15753118'}]}",,False,,everyone,Twitter for iPhone
1514018070347485187,1069006874811363328,"Comment ""ROBLOX"" with your eyes closed 😈",2022-04-12 23:10:11+00:00,,78,3198,988,5,en,1514018070347485187,"[{'domain': {'id': '71', 'name': 'Video Game', 'description': 'A video game like Overwatch'}, 'entity': {'id': '1088118927580774400', 'name': 'Roblox', 'description': 'Roblox'}}]",,,False,,everyone,Twitter Web App
1515334066647625729,1069006874811363328,Guess who's back 😈,2022-04-16 14:19:29+00:00,,29,431,595,1,en,1515334066647625729,[],,,False,,everyone,Twitter Web App
1515255576573497349,1126031025228746752,"@RealSrzga @SswwaaggyyZ @Smoothie_Roblox @RealSodaLover @Roblox Not my location bro, he's trying to make us scared 😹",2022-04-16 09:07:36+00:00,,0,1,1,0,en,1513565875214839814,"[{'domain': {'id': '71', 'name': 'Video Game', 'description': 'A video game like Overwatch'}, 'entity': {'id': '1088118927580774400', 'name': 'Roblox', 'description': 'Roblox'}}]","{'mentions': [{'start': 0, 'end': 10, 'username': 'RealSrzga', 'id': '1044908871523999744'}, {'start': 11, 'end': 23, 'username': 'SswwaaggyyZ', 'id': '1316819652874469377'}, {'start': 41, 'end': 55, 'username': 'RealSodaLover', 'id': '1433969654809055234'}, {'start': 56, 'end': 63, 'username': 'Roblox', 'id': '16745055'}]}",,False,,everyone,Twitter for Android
1515406962112053257,2455740283,"I’m looking to hire a super creative, YouTube nerd, that wants to learn what makes videos go viral and help me brainstorm and execute content! If you’re interested just reply to this tweet with your experience and why you’re different.",2022-04-16 19:09:09+00:00,,3911,19823,171035,604,en,1515406962112053257,"[{'domain': {'id': '10', 'name': 'Person', 'description': 'Named people in the world like Nelson Mandela'}, 'entity': {'id': '1126559222122942464', 'name': 'MrBeast'}}, {'domain': {'id': '120', 'name': 'Digital Creator', 'description': 'Influencers who create content on digital platforms'}, 'entity': {'id': '1126559222122942464', 'name': 'MrBeast'}}, {'domain': {'id': '165', 'name': 'Technology', 'description': 'for individual and types of technology, e.g., food technology, 3D printing'}, 'entity': {'id': '1196446161223028736', 'name': 'Social media'}}, {'domain': {'id': '46', 'name': 'Brand Category', 'description': 'Categories within Brand Verticals that narrow down the scope of Brands'}, 'entity': {'id': '781974596752842752', 'name': 'Services'}}, {'domain': {'id': '47', 'name': 'Brand', 'description': 'Brands and Companies'}, 'entity': {'id': '10029382357', 'name': 'YouTube'}}, {'domain': {'id': '47', 'name': 'Brand', 'description': 'Brands and Companies'}, 'entity': {'id': '10045225402', 'name': 'Twitter'}}]","{'annotations': [{'start': 38, 'end': 44, 'probability': 0.5076, 'type': 'Product', 'normalized_text': 'YouTube'}]}",,False,,everyone,Twitter for iPhone
1515422249544818696,1276541584574734336,Daniel el Presidente y Comandante Supremo del Ejercito Argentino hara del Pais un Lugar Mejor mas Moderno y Acabando con la Corrupcion que habia antes del pais y este sea mucho mejor y  este sea incluso en un futuro Potencia  Discord Del Pais/Ejercito: https://t.co/iaPeFzmagp,2022-04-16 20:09:54+00:00,,1,1,1,0,es,1515422245358907393,"[{'domain': {'id': '47', 'name': 'Brand', 'description': 'Brands and Companies'}, 'entity': {'id': '1168499224297656321', 'name': 'Discord'}}, {'domain': {'id': '165', 'name': 'Technology', 'description': 'for individual and types of technology, e.g., food technology, 3D printing'}, 'entity': {'id': '1196446161223028736', 'name': 'Social media'}}]","{'annotations': [{'start': 0, 'end': 5, 'probability': 0.9417, 'type': 'Person', 'normalized_text': 'Daniel'}, {'start': 46, 'end': 63, 'probability': 0.5851, 'type': 'Organization', 'normalized_text': 'Ejercito Argentino'}], 'urls': [{'start': 253, 'end': 276, 'url': 'https://t.co/iaPeFzmagp', 'expanded_url': 'https://discord.gg/qhWzh9mM', 'display_url': 'discord.gg/qhWzh9mM', 'status': 200, 'title': 'Discord - A New Way to Chat with Friends & Communities', 'description': 'Discord is the easiest way to communicate over voice, video, and text. Chat, hang out, and stay close with your friends and communities.', 'unwound_url': 'https://discord.com/invite/qhWzh9mM'}]}",,False,,everyone,Twitter Web App
1515422141394653187,1314922633297887238,@TheRealPub6 YES!,2022-04-16 20:09:28+00:00,,0,1,1,0,und,1515421396725284864,[],"{'mentions': [{'start': 0, 'end': 12, 'username': 'TheRealPub6', 'id': '1343292178232127489'}]}",,False,,everyone,Twitter Web App
1515422148281741322,1267153177176092680,kim kardashian vs roblox wer wird gewinnen,2022-04-16 20:09:29+00:00,,0,2,15,0,de,1515422148281741322,"[{'domain': {'id': '10', 'name': 'Person', 'description': 'Named people in the world like Nelson Mandela'}, 'entity': {'id': '806570121959383040', 'name': 'Kim Kardashian', 'description': 'Kim Kardashian'}}, {'domain': {'id': '58', 'name': 'Entertainment Personality', 'description': 'An entertainment personality in the world, like Anderson Cooper or Miranda Sings'}, 'entity': {'id': '806570121959383040', 'name': 'Kim Kardashian', 'description': 'Kim Kardashian'}}, {'domain': {'id': '71', 'name': 'Video Game', 'description': 'A video game like Overwatch'}, 'entity': {'id': '1088118927580774400', 'name': 'Roblox', 'description': 'Roblox'}}]",,,False,,everyone,Twitter for iPhone
1515370734893285383,770001997550551041,@Bloxy_News Roblox is a dead game,2022-04-16 16:45:12+00:00,,2,34,31,0,en,1515370685241118723,"[{'domain': {'id': '71', 'name': 'Video Game', 'description': 'A video game like Overwatch'}, 'entity': {'id': '1088118927580774400', 'name': 'Roblox', 'description': 'Roblox'}}]","{'mentions': [{'start': 0, 'end': 11, 'username': 'Bloxy_News', 'id': '901894986836279296'}], 'annotations': [{'start': 12, 'end': 17, 'probability': 0.2443, 'type': 'Organization', 'normalized_text': 'Roblox'}]}",,False,,everyone,Twitter for iPhone
1515375295947231241,1417587809502826500,@Bloxy_News only brazilians will know https://t.co/4KImwlJX2H,2022-04-16 17:03:19+00:00,,1,19,93,1,en,1515370685241118723,[],"{'mentions': [{'start': 0, 'end': 11, 'username': 'Bloxy_News', 'id': '901894986836279296'}], 'urls': [{'start': 38, 'end': 61, 'url': 'https://t.co/4KImwlJX2H', 'expanded_url': 'https://twitter.com/Roblox_RTC_BR/status/1515375295947231241/photo/1', 'display_url': 'pic.twitter.com/4KImwlJX2H', 'media_key': '3_1515375266322952200'}]}",{'media_keys': ['3_1515375266322952200']},False,,everyone,Twitter Web App
1514342664753356802,1471996584351174661,should i stream a very cool backrooms map from roblox? possibly tomorrow or the weekend?,2022-04-13 20:40:01+00:00,,0,1,1,1,en,1514342664753356802,"[{'domain': {'id': '71', 'name': 'Video Game', 'description': 'A video game like Overwatch'}, 'entity': {'id': '1088118927580774400', 'name': 'Roblox', 'description': 'Roblox'}}]",,{'poll_ids': ['1514342663805407232']},False,,everyone,Twitter Web App
1515421805657440258,1512455625577582592,✔ 4 RGB Fans for Maximum Air Flow | Skytech Chronos Case Black Edition with Front Mesh | 1 Year Warranty on Parts and Labor | Lifetime Free Technical Support | Assembled in the USA,2022-04-16 20:08:08+00:00,,0,1,0,0,en,1515421797524590593,[],"{'annotations': [{'start': 36, 'end': 69, 'probability': 0.4072, 'type': 'Product', 'normalized_text': 'Skytech Chronos Case Black Edition'}, {'start': 177, 'end': 179, 'probability': 0.8707, 'type': 'Place', 'normalized_text': 'USA'}]}",,False,,everyone,Twitter for Android
1515418808189599747,1002736099054243843,Insira aqui coisas pra ver na live,2022-04-16 19:56:13+00:00,,6,662,403,6,pt,1515418808189599747,[],,,False,,everyone,Twitter for iPhone
1514723919260909597,17551703,"The count down to @Neon_Carnival in #ParisWorld for the first time in the metaverse has begun! This special experience will open during @Coachella for 9 days of performances, giveaways, a special DJ set by @ParisHilton +more! 👑🎶 

See you @ #NeonCarnival on @Roblox! 4/16 🎡⭐️🥳 https://t.co/4MWecTzziL",2022-04-14 21:54:59+00:00,,12,8,47,0,en,1514723919260909597,"[{'domain': {'id': '29', 'name': 'Events [Entity Service]', 'description': 'Entity Service related Events domain'}, 'entity': {'id': '1510987314591256581', 'name': 'Coachella 2022'}}, {'domain': {'id': '30', 'name': 'Entities [Entity Service]', 'description': 'Entity Service top level domain, every item that is in Entity Service should be in this domain'}, 'entity': {'id': '848920371311001600', 'name': 'Technology', 'description': 'Technology and computing'}}, {'domain': {'id': '71', 'name': 'Video Game', 'description': 'A video game like Overwatch'}, 'entity': {'id': '1088118927580774400', 'name': 'Roblox', 'description': 'Roblox'}}, {'domain': {'id': '114', 'name': 'Concert', 'description': 'Music fesitvals and concerts, like Lollapalooza or a Marian Hill Concert'}, 'entity': {'id': '1510987314591256581', 'name': 'Coachella 2022'}}, {'domain': {'id': '165', 'name': 'Technology', 'description': 'for individual and types of technology, e.g., food technology, 3D printing'}, 'entity': {'id': '848920371311001600', 'name': 'Technology', 'description': 'Technology and computing'}}, {'domain': {'id': '10', 'name': 'Person', 'description': 'Named people in the world like Nelson Mandela'}, 'entity': {'id': '808720282332450816', 'name': 'Paris Hilton', 'description': 'Paris Hilton'}}, {'domain': {'id': '58', 'name': 'Entertainment Personality', 'description': 'An entertainment personality in the world, like Anderson Cooper or Miranda Sings'}, 'entity': {'id': '808720282332450816', 'name': 'Paris Hilton', 'description': 'Paris Hilton'}}]","{'hashtags': [{'start': 36, 'end': 47, 'tag': 'ParisWorld'}, {'start': 241, 'end': 254, 'tag': 'NeonCarnival'}], 'mentions': [{'start': 18, 'end': 32, 'username': 'neon_carnival', 'id': '495706709'}, {'start': 136, 'end': 146, 'username': 'coachella', 'id': '688583'}, {'start': 206, 'end': 218, 'username': 'ParisHilton', 'id': '24929621'}, {'start': 258, 'end': 265, 'username': 'Roblox', 'id': '16745055'}], 'urls': [{'start': 277, 'end': 300, 'url': 'https://t.co/4MWecTzziL', 'expanded_url': 'https://twitter.com/dash_radio/status/1514723919260909597/video/1', 'display_url': 'pic.twitter.com/4MWecTzziL', 'media_key': '7_1514723314576490507'}]}",{'media_keys': ['7_1514723314576490507']},False,,everyone,Twitter for iPhone
1514934747705004032,1284147101752934401,"Alright, let’s try something new. What game do you play beside/exclude Dead By Daylight?",2022-04-15 11:52:44+00:00,,0,96,81,0,en,1514934747705004032,"[{'domain': {'id': '71', 'name': 'Video Game', 'description': 'A video game like Overwatch'}, 'entity': {'id': '1234625911128936448', 'name': 'Dead by Daylight'}}]","{'annotations': [{'start': 71, 'end': 86, 'probability': 0.5268, 'type': 'Other', 'normalized_text': 'Dead By Daylight'}]}",,False,,everyone,Twitter for iPhone
1515399858508771332,1315416217134469124,@AlbertsStuff @Roblox_RTC @sonic_hedgehog You’re hot I’ll marry you,2022-04-16 18:40:55+00:00,,0,1,1,0,en,1515398919420788737,"[{'domain': {'id': '130', 'name': 'Multimedia Franchise', 'description': ""Franchises which span multiple forms of media like 'Harry Potter'""}, 'entity': {'id': '993952643209773057', 'name': 'Sonic the Hedgehog', 'description': 'This entity includes all conversation about the franchise, as well as any individual installments in the series, if applicable.\t\t\t\n\nNOTE: Stopped annotating in the Video Game domain (71) on 11/15/19. Moving forward, this entity will annotate to Multimedia Franchise domain (130) only.'}}]","{'mentions': [{'start': 0, 'end': 13, 'username': 'AlbertsStuff', 'id': '2850532049'}, {'start': 14, 'end': 25, 'username': 'Roblox_RTC', 'id': '1056053249470541824'}, {'start': 26, 'end': 41, 'username': 'sonic_hedgehog', 'id': '19609162'}]}",,False,,everyone,Twitter for iPhone
1515163933472133122,2850532049,sonic roblox game VS fan made game lol https://t.co/UI1dQUSiRO,2022-04-16 03:03:26+00:00,,229,209,11381,5,en,1515163933472133122,"[{'domain': {'id': '71', 'name': 'Video Game', 'description': 'A video game like Overwatch'}, 'entity': {'id': '1088118927580774400', 'name': 'Roblox', 'description': 'Roblox'}}, {'domain': {'id': '130', 'name': 'Multimedia Franchise', 'description': ""Franchises which span multiple forms of media like 'Harry Potter'""}, 'entity': {'id': '993952643209773057', 'name': 'Sonic the Hedgehog', 'description': 'This entity includes all conversation about the franchise, as well as any individual installments in the series, if applicable.\t\t\t\n\nNOTE: Stopped annotating in the Video Game domain (71) on 11/15/19. Moving forward, this entity will annotate to Multimedia Franchise domain (130) only.'}}]","{'urls': [{'start': 39, 'end': 62, 'url': 'https://t.co/UI1dQUSiRO', 'expanded_url': 'https://twitter.com/AlbertsStuff/status/1515163933472133122/photo/1', 'display_url': 'pic.twitter.com/UI1dQUSiRO', 'media_key': '3_1515163824676126726'}, {'start': 39, 'end': 62, 'url': 'https://t.co/UI1dQUSiRO', 'expanded_url': 'https://twitter.com/AlbertsStuff/status/1515163933472133122/photo/1', 'display_url': 'pic.twitter.com/UI1dQUSiRO', 'media_key': '3_1515163833874141189'}]}","{'media_keys': ['3_1515163824676126726', '3_1515163833874141189']}",False,,everyone,Twitter Web App
1515417990224883712,3430592104,@AzireDev @gamefamstudios Doesn’t give it any less validity,2022-04-16 19:52:58+00:00,,0,1,4,0,en,1515393171886387205,[],"{'mentions': [{'start': 0, 'end': 9, 'username': 'AzireDev', 'id': '1051395500304404480'}, {'start': 10, 'end': 25, 'username': 'gamefamstudios', 'id': '1162494706066046977'}]}",,False,,mentionedUsers,Twitter for iPhone
1514793734830886917,1071938981389045765,Coming soon to Emergency Response: Liberty County! 🚑🚒 #Roblox https://t.co/slXy4ziFbj,2022-04-15 02:32:24+00:00,,77,178,967,7,en,1514793734830886917,"[{'domain': {'id': '71', 'name': 'Video Game', 'description': 'A video game like Overwatch'}, 'entity': {'id': '1088118927580774400', 'name': 'Roblox', 'description': 'Roblox'}}]","{'hashtags': [{'start': 54, 'end': 61, 'tag': 'Roblox'}], 'annotations': [{'start': 35, 'end': 48, 'probability': 0.8209, 'type': 'Place', 'normalized_text': 'Liberty County'}], 'urls': [{'start': 62, 'end': 85, 'url': 'https://t.co/slXy4ziFbj', 'expanded_url': 'https://twitter.com/PRC_Roblox/status/1514793734830886917/photo/1', 'display_url': 'pic.twitter.com/slXy4ziFbj', 'media_key': '3_1514793464868720641'}]}",{'media_keys': ['3_1514793464868720641']},False,,everyone,Twitter Web App
1287281464825057280,1210428901060730880,"So I turned my list of Roblox VR Games into a google site! The document started to become cluttered. 

I'll be adding more games as I find them to the site! 
https://t.co/gfc69c5Aod",2020-07-26 06:59:52+00:00,,3,6,21,0,en,1287281464825057280,"[{'domain': {'id': '71', 'name': 'Video Game', 'description': 'A video game like Overwatch'}, 'entity': {'id': '1088118927580774400', 'name': 'Roblox', 'description': 'Roblox'}}, {'domain': {'id': '46', 'name': 'Brand Category', 'description': 'Categories within Brand Verticals that narrow down the scope of Brands'}, 'entity': {'id': '781974596752842752', 'name': 'Services'}}, {'domain': {'id': '47', 'name': 'Brand', 'description': 'Brands and Companies'}, 'entity': {'id': '10026378521', 'name': 'Google '}}, {'domain': {'id': '30', 'name': 'Entities [Entity Service]', 'description': 'Entity Service top level domain, every item that is in Entity Service should be in this domain'}, 'entity': {'id': '848920371311001600', 'name': 'Technology', 'description': 'Technology and computing'}}, {'domain': {'id': '30', 'name': 'Entities [Entity Service]', 'description': 'Entity Service top level domain, every item that is in Entity Service should be in this domain'}, 'entity': {'id': '898670051594649601', 'name': 'Virtual reality', 'description': 'Virtual Reality'}}, {'domain': {'id': '79', 'name': 'Video Game Hardware', 'description': 'Video Game Hardware'}, 'entity': {'id': '898670051594649601', 'name': 'Virtual reality', 'description': 'Virtual Reality'}}]","{'annotations': [{'start': 23, 'end': 37, 'probability': 0.4325, 'type': 'Product', 'normalized_text': 'Roblox VR Games'}], 'urls': [{'start': 158, 'end': 181, 'url': 'https://t.co/gfc69c5Aod', 'expanded_url': 'https://sites.google.com/view/robloxvr/home', 'display_url': 'sites.google.com/view/robloxvr/…', 'images': [{'url': 'https://pbs.twimg.com/news_img/1529786485888925696/XZj3mmIb?format=png&name=orig', 'width': 150, 'height': 150}, {'url': 'https://pbs.twimg.com/news_img/1529786485888925696/XZj3mmIb?format=png&name=150x150', 'width': 150, 'height': 150}], 'status': 200, 'title': 'RobloxVR', 'description': 'Recently Released VR Games', 'unwound_url': 'https://sites.google.com/view/robloxvr/home'}]}",,False,,everyone,Twitter Web App
1515414375015796738,1422615665505148929,@18didi18_ o nike para de ser kid acorda pa vida e vai jgr fortnite,2022-04-16 19:38:36+00:00,,0,1,0,0,pt,1515409429516234760,"[{'domain': {'id': '71', 'name': 'Video Game', 'description': 'A video game like Overwatch'}, 'entity': {'id': '974285387987169280', 'name': 'Fortnite', 'description': 'This entity includes all conversation about the franchise, as well as any individual installments in the series, if applicable.\t\t\t'}}, {'domain': {'id': '46', 'name': 'Brand Category', 'description': 'Categories within Brand Verticals that narrow down the scope of Brands'}, 'entity': {'id': '781974597176467456', 'name': 'Sports/Outdoor'}}, {'domain': {'id': '47', 'name': 'Brand', 'description': 'Brands and Companies'}, 'entity': {'id': '10026482869', 'name': 'Nike'}}, {'domain': {'id': '67', 'name': 'Interests and Hobbies', 'description': 'Interests, opinions, and behaviors of individuals, groups, or cultures; like Speciality Cooking or Theme Parks'}, 'entity': {'id': '839543390668673024', 'name': 'Fashion'}}]","{'mentions': [{'start': 0, 'end': 10, 'username': '18didi18_', 'id': '1463223429704806402'}], 'annotations': [{'start': 13, 'end': 16, 'probability': 0.4412, 'type': 'Organization', 'normalized_text': 'nike'}]}",,False,,everyone,Twitter Web App
1515399894546403328,1446150573112246272,@AlbertsStuff @Roblox_RTC @sonic_hedgehog https://t.co/mGIBNxtUbr,2022-04-16 18:41:04+00:00,,0,1,6,0,qme,1515398919420788737,"[{'domain': {'id': '130', 'name': 'Multimedia Franchise', 'description': ""Franchises which span multiple forms of media like 'Harry Potter'""}, 'entity': {'id': '993952643209773057', 'name': 'Sonic the Hedgehog', 'description': 'This entity includes all conversation about the franchise, as well as any individual installments in the series, if applicable.\t\t\t\n\nNOTE: Stopped annotating in the Video Game domain (71) on 11/15/19. Moving forward, this entity will annotate to Multimedia Franchise domain (130) only.'}}]","{'mentions': [{'start': 0, 'end': 13, 'username': 'AlbertsStuff', 'id': '2850532049'}, {'start': 14, 'end': 25, 'username': 'Roblox_RTC', 'id': '1056053249470541824'}, {'start': 26, 'end': 41, 'username': 'sonic_hedgehog', 'id': '19609162'}], 'urls': [{'start': 42, 'end': 65, 'url': 'https://t.co/mGIBNxtUbr', 'expanded_url': 'https://twitter.com/FusionDontTweet/status/1515399894546403328/photo/1', 'display_url': 'pic.twitter.com/mGIBNxtUbr', 'media_key': '3_1515399889932685312'}]}",{'media_keys': ['3_1515399889932685312']},False,,everyone,Twitter for Android
1515011598812794883,19609162,"Sonic's officially in @Roblox in Sonic Speed Simulator, and all paid beta players can grab this exclusive Knuckles Chao!

Paid beta ends at 7AM PST on Saturday! https://t.co/T1WnkkntYw",2022-04-15 16:58:07+00:00,,1735,455,15220,319,en,1515011598812794883,"[{'domain': {'id': '71', 'name': 'Video Game', 'description': 'A video game like Overwatch'}, 'entity': {'id': '1088118927580774400', 'name': 'Roblox', 'description': 'Roblox'}}, {'domain': {'id': '130', 'name': 'Multimedia Franchise', 'description': ""Franchises which span multiple forms of media like 'Harry Potter'""}, 'entity': {'id': '993952643209773057', 'name': 'Sonic the Hedgehog', 'description': 'This entity includes all conversation about the franchise, as well as any individual installments in the series, if applicable.\t\t\t\n\nNOTE: Stopped annotating in the Video Game domain (71) on 11/15/19. Moving forward, this entity will annotate to Multimedia Franchise domain (130) only.'}}]","{'mentions': [{'start': 22, 'end': 29, 'username': 'Roblox', 'id': '16745055'}], 'annotations': [{'start': 33, 'end': 53, 'probability': 0.5481, 'type': 'Product', 'normalized_text': 'Sonic Speed Simulator'}, {'start': 106, 'end': 118, 'probability': 0.4147, 'type': 'Product', 'normalized_text': 'Knuckles Chao'}], 'urls': [{'start': 161, 'end': 184, 'url': 'https://t.co/T1WnkkntYw', 'expanded_url': 'https://twitter.com/sonic_hedgehog/status/1515011598812794883/photo/1', 'display_url': 'pic.twitter.com/T1WnkkntYw', 'media_key': '3_1515009384442589188'}]}",{'media_keys': ['3_1515009384442589188']},False,,everyone,Twitter Web App
1515348420827009045,1336694229909733376,"I have problem on my studio, i cant stand my character when i grab it https://t.co/qlaTbOPTZn",2022-04-16 15:16:31+00:00,,0,1,1,0,en,1515348420827009045,[],"{'urls': [{'start': 70, 'end': 93, 'url': 'https://t.co/qlaTbOPTZn', 'expanded_url': 'https://twitter.com/LocalDoomer/status/1515348420827009045/photo/1', 'display_url': 'pic.twitter.com/qlaTbOPTZn', 'media_key': '16_1515348380377096192'}]}",{'media_keys': ['16_1515348380377096192']},False,,everyone,Twitter for Android
1515347692284743682,1297228966206603264,I can run roblox now https://t.co/FoJkGJ0S5y,2022-04-16 15:13:38+00:00,,84,121,1755,3,en,1515347692284743682,"[{'domain': {'id': '71', 'name': 'Video Game', 'description': 'A video game like Overwatch'}, 'entity': {'id': '1088118927580774400', 'name': 'Roblox', 'description': 'Roblox'}}]","{'urls': [{'start': 21, 'end': 44, 'url': 'https://t.co/FoJkGJ0S5y', 'expanded_url': 'https://twitter.com/AviridisTweets/status/1515347692284743682/photo/1', 'display_url': 'pic.twitter.com/FoJkGJ0S5y', 'media_key': '3_1515347684315615241'}]}",{'media_keys': ['3_1515347684315615241']},False,,everyone,Twitter for iPhone
1515419725915820035,31426518,@FinalBossVs wait. you like fighting games? pics or it didn’t happen.,2022-04-16 19:59:52+00:00,,0,1,2,0,en,1515343527160418304,[],"{'mentions': [{'start': 0, 'end': 12, 'username': 'FinalBossVs', 'id': '1184871374055231490'}]}",,False,,everyone,Twitter for iPhone
1514800746121756676,1505975356628553734,@SlashingSim aganme moderador xd,2022-04-15 03:00:16+00:00,,0,2,0,0,es,1514715464844582915,[],"{'mentions': [{'start': 0, 'end': 12, 'username': 'SlashingSim', 'id': '1456241041380503552'}]}",,False,,everyone,Twitter Web App
