tweetid,author_id,text,created_at,geo,retweets,replies,likes,quote_count,lang,conversation_id,context_annotations,entities,attachments,possibly_sensitive,withheld,reply_settings,source
1518253548911607809,1506553644698595329,@sunshineeksn @skwonjy K,2022-04-24 15:40:28+00:00,,0,1,1,0,und,1518247268670869505,[],"{'mentions': [{'start': 0, 'end': 13, 'username': 'sunshineeksn', 'id': '1535155199932878848'}, {'start': 14, 'end': 22, 'username': 'skwonjy', 'id': '1517491922457169920'}]}",,False,,everyone,Twitter Web App
1518253118676475904,1408798440855908357,Bom dia seres vivos😔 https://t.co/vi1ifPxNuN,2022-04-24 15:38:45+00:00,,4,4,22,0,pt,1518253118676475904,[],"{'urls': [{'start': 21, 'end': 44, 'url': 'https://t.co/vi1ifPxNuN', 'expanded_url': 'https://twitter.com/Aquajato/status/1518253118676475904/photo/1', 'display_url': 'pic.twitter.com/vi1ifPxNuN', 'media_key': '3_1518253113815277569'}]}",{'media_keys': ['3_1518253113815277569']},False,,everyone,Twitter for Android
1517863422221766657,1071938981389045765,"💰The first few giveaways are beginning now! 

Like and follow our Twitter. Reply to this post with your favorite ER:LC update EVER to enter to win a $10 Roblox gift card! 

Also, https://t.co/9r9mU2foQI has another giveaway! Make sure you join!",2022-04-23 13:50:15+00:00,,94,695,898,4,en,1517863422221766657,"[{'domain': {'id': '71', 'name': 'Video Game', 'description': 'A video game like Overwatch'}, 'entity': {'id': '1088118927580774400', 'name': 'Roblox', 'description': 'Roblox'}}, {'domain': {'id': '46', 'name': 'Brand Category', 'description': 'Categories within Brand Verticals that narrow down the scope of Brands'}, 'entity': {'id': '781974596752842752', 'name': 'Services'}}, {'domain': {'id': '47', 'name': 'Brand', 'description': 'Brands and Companies'}, 'entity': {'id': '10045225402', 'name': 'Twitter'}}]","{'annotations': [{'start': 67, 'end': 73, 'probability': 0.8248, 'type': 'Product', 'normalized_text': 'Twitter'}, {'start': 154, 'end': 159, 'probability': 0.4506, 'type': 'Product', 'normalized_text': 'Roblox'}], 'urls': [{'start': 179, 'end': 202, 'url': 'https://t.co/9r9mU2foQI', 'expanded_url': 'http://discord.gg/PRC', 'display_url': 'discord.gg/PRC'}]}",,False,,everyone,Twitter for iPhone
1517918595380137985,1338580188997804035,How much do we habs in common? :o https://t.co/onyiqjER7M,2022-04-23 17:29:29+00:00,,29,257,396,7,en,1517918595380137985,"[{'domain': {'id': '3', 'name': 'TV Shows', 'description': 'Television shows from around the world'}, 'entity': {'id': '10000467383', 'name': 'NHL Hockey', 'description': 'The latest hockey action from across the NHL.'}}]","{'urls': [{'start': 34, 'end': 57, 'url': 'https://t.co/onyiqjER7M', 'expanded_url': 'https://twitter.com/alextehderg/status/1517918595380137985/photo/1', 'display_url': 'pic.twitter.com/onyiqjER7M', 'media_key': '3_1517918505575796745'}]}",{'media_keys': ['3_1517918505575796745']},False,,everyone,Twitter Web App
1518068774703828993,1330950753507106816,"I don't play #Roblox much anymore, so LINK YOUR GAMEPASS/SHIRT! (1000 Robux Limit, buying 7) https://t.co/9x8qz2RhPs",2022-04-24 03:26:14+00:00,,131,1102,1562,7,en,1518068774703828993,"[{'domain': {'id': '48', 'name': 'Product', 'description': 'Products created by Brands.  Examples: Ford Explorer, Apple iPhone.'}, 'entity': {'id': '1425921713150201858', 'name': 'Xbox Game Pass'}}, {'domain': {'id': '71', 'name': 'Video Game', 'description': 'A video game like Overwatch'}, 'entity': {'id': '1088118927580774400', 'name': 'Roblox', 'description': 'Roblox'}}, {'domain': {'id': '45', 'name': 'Brand Vertical', 'description': 'Top level entities that describe a Brands industry'}, 'entity': {'id': '781974597310615553', 'name': 'Entertainment'}}, {'domain': {'id': '46', 'name': 'Brand Category', 'description': 'Categories within Brand Verticals that narrow down the scope of Brands'}, 'entity': {'id': '781974597218340864', 'name': 'Video Games'}}, {'domain': {'id': '47', 'name': 'Brand', 'description': 'Brands and Companies'}, 'entity': {'id': '10027048851', 'name': 'Xbox'}}, {'domain': {'id': '79', 'name': 'Video Game Hardware', 'description': 'Video Game Hardware'}, 'entity': {'id': '10027048851', 'name': 'Xbox'}}]","{'urls': [{'start': 93, 'end': 116, 'url': 'https://t.co/9x8qz2RhPs', 'expanded_url': 'https://twitter.com/RBXevents_/status/1518068774703828993/photo/1', 'display_url': 'pic.twitter.com/9x8qz2RhPs', 'media_key': '3_1518068313540075520'}], 'hashtags': [{'start': 13, 'end': 20, 'tag': 'Roblox'}]}",{'media_keys': ['3_1518068313540075520']},False,,everyone,Twitter Web App
1518191232291606533,1400759820211290117,@mrkbx @LLoonion @MiniToonfan99 @Roblox_RTC They went reallll silent after what you showed,2022-04-24 11:32:51+00:00,,0,1,3,0,en,1517993743567237122,[],"{'mentions': [{'start': 0, 'end': 6, 'username': 'mrkbx', 'id': '3891079227'}, {'start': 7, 'end': 16, 'username': 'LLoonion', 'id': '1418089223706464259'}, {'start': 17, 'end': 31, 'username': 'MiniToonfan99', 'id': '1255963910215172098'}, {'start': 32, 'end': 43, 'username': 'Roblox_RTC', 'id': '1056053249470541824'}]}",,False,,everyone,Twitter for Android
1518079833577861120,1071938981389045765,"🔥 Like this tweet, reply with your Roblox username, and follow our Twitter for a chance to win 50,000 in-game cash! (3 winners, ends evening of 4/24)",2022-04-24 04:10:11+00:00,,62,559,858,1,en,1518079833577861120,"[{'domain': {'id': '71', 'name': 'Video Game', 'description': 'A video game like Overwatch'}, 'entity': {'id': '1088118927580774400', 'name': 'Roblox', 'description': 'Roblox'}}, {'domain': {'id': '46', 'name': 'Brand Category', 'description': 'Categories within Brand Verticals that narrow down the scope of Brands'}, 'entity': {'id': '781974596752842752', 'name': 'Services'}}, {'domain': {'id': '47', 'name': 'Brand', 'description': 'Brands and Companies'}, 'entity': {'id': '10045225402', 'name': 'Twitter'}}]","{'annotations': [{'start': 36, 'end': 41, 'probability': 0.7098, 'type': 'Product', 'normalized_text': 'Roblox'}, {'start': 68, 'end': 74, 'probability': 0.7998, 'type': 'Product', 'normalized_text': 'Twitter'}]}",,False,,everyone,Twitter for iPhone
1518251656378466304,1489937129123860482,AP400 - Deviant | Extra Campaign to add elements to the lore | #Roblox #RobloxDev #RobloxDevs https://t.co/pUn0lOLPUl,2022-04-24 15:32:57+00:00,,1,1,5,0,en,1518251656378466304,"[{'domain': {'id': '71', 'name': 'Video Game', 'description': 'A video game like Overwatch'}, 'entity': {'id': '1088118927580774400', 'name': 'Roblox', 'description': 'Roblox'}}]","{'urls': [{'start': 94, 'end': 117, 'url': 'https://t.co/pUn0lOLPUl', 'expanded_url': 'https://twitter.com/TrueEllieDev/status/1518251656378466304/video/1', 'display_url': 'pic.twitter.com/pUn0lOLPUl', 'media_key': '7_1518251191372857345'}], 'hashtags': [{'start': 63, 'end': 70, 'tag': 'Roblox'}, {'start': 71, 'end': 81, 'tag': 'RobloxDev'}, {'start': 82, 'end': 93, 'tag': 'RobloxDevs'}]}",{'media_keys': ['7_1518251191372857345']},False,,everyone,Twitter Web App
1518235410794696705,1102083820432605184,#LoomianLegacy https://t.co/XOpKD9KVBV,2022-04-24 14:28:24+00:00,,98,97,936,10,qme,1518235410794696705,[],"{'urls': [{'start': 15, 'end': 38, 'url': 'https://t.co/XOpKD9KVBV', 'expanded_url': 'https://twitter.com/IuckyHD/status/1518235410794696705/photo/1', 'display_url': 'pic.twitter.com/XOpKD9KVBV', 'media_key': '3_1518235235758096386'}], 'hashtags': [{'start': 0, 'end': 14, 'tag': 'LoomianLegacy'}]}",{'media_keys': ['3_1518235235758096386']},False,,everyone,Twitter Web App
1518252198311858177,1211705814471168001,"@LondraiA @meh9001 @RBXNews_ Sure, it may scam kids. But, ruining the environment. Not really. Since, the whole thing about collectable items is that it's solely converted into the game's currency. They even made it so you can't DevEx your robux that you got from your collectable items cause- (1/2)",2022-04-24 15:35:06+00:00,,0,1,5,0,en,1518228265344901120,[],"{'mentions': [{'start': 0, 'end': 9, 'username': 'LondraiA', 'id': '1386171972430835713'}, {'start': 10, 'end': 18, 'username': 'meh9001', 'id': '1101721366838108161'}, {'start': 19, 'end': 28, 'username': 'RBXNews_', 'id': '1199001259904307207'}]}",,False,,everyone,Twitter for Android
1518249876777324545,1467989448491208710,@Roblox_RTC_BR @itadoritesao,2022-04-24 15:25:52+00:00,,0,1,0,0,qam,1518249007805513730,[],"{'mentions': [{'start': 0, 'end': 14, 'username': 'Roblox_RTC_BR', 'id': '1417587809502826500'}]}",,False,,everyone,Twitter for Android
1517996522616631301,3025674465,"Controversial take but I don't want NFTs anywhere near gaming. I don't want ""Play-to-Earn"" crypto games either. The past decade of gaming has been nothing but broken promises and subpar experiences brought on by large corporations and greed

Give me fun complete games. That's it. https://t.co/K0Gxpx8Y1c",2022-04-23 22:39:08+00:00,,187,156,2313,4,en,1517996522616631301,"[{'domain': {'id': '46', 'name': 'Brand Category', 'description': 'Categories within Brand Verticals that narrow down the scope of Brands'}, 'entity': {'id': '781974596752842752', 'name': 'Services'}}, {'domain': {'id': '48', 'name': 'Product', 'description': 'Products created by Brands.  Examples: Ford Explorer, Apple iPhone.'}, 'entity': {'id': '1412579054855671809', 'name': 'Google Innovation'}}, {'domain': {'id': '30', 'name': 'Entities [Entity Service]', 'description': 'Entity Service top level domain, every item that is in Entity Service should be in this domain'}, 'entity': {'id': '857879456773357569', 'name': 'Technology', 'description': 'Technology'}}, {'domain': {'id': '66', 'name': 'Interests and Hobbies Category', 'description': 'A grouping of interests and hobbies entities, like Novelty Food or Destinations'}, 'entity': {'id': '913142676819648512', 'name': 'Cryptocurrencies', 'description': 'Cryptocurrency'}}, {'domain': {'id': '30', 'name': 'Entities [Entity Service]', 'description': 'Entity Service top level domain, every item that is in Entity Service should be in this domain'}, 'entity': {'id': '1001503516555337728', 'name': 'Blockchain', 'description': 'Blockchain'}}, {'domain': {'id': '71', 'name': 'Video Game', 'description': 'A video game like Overwatch'}, 'entity': {'id': '1088118927580774400', 'name': 'Roblox', 'description': 'Roblox'}}, {'domain': {'id': '30', 'name': 'Entities [Entity Service]', 'description': 'Entity Service top level domain, every item that is in Entity Service should be in this domain'}, 'entity': {'id': '857879456773357569', 'name': 'Technology', 'description': 'Technology'}}]","{'urls': [{'start': 281, 'end': 304, 'url': 'https://t.co/K0Gxpx8Y1c', 'expanded_url': 'https://twitter.com/Roblox_RTC/status/1517993743567237122', 'display_url': 'twitter.com/Roblox_RTC/sta…'}]}",,False,,everyone,Twitter Web App
1518174545110306816,1255963910215172098,@LLoonion @Roblox_RTC I just have better things to do than argue meaninglessly.,2022-04-24 10:26:32+00:00,,0,1,0,0,en,1517993743567237122,[],"{'mentions': [{'start': 0, 'end': 9, 'username': 'LLoonion', 'id': '1418089223706464259'}, {'start': 10, 'end': 21, 'username': 'Roblox_RTC', 'id': '1056053249470541824'}]}",,False,,everyone,Twitter for Android
1518251897639084032,1455951633804931078,"random comments can win up to 400,000 diamonds right now",2022-04-24 15:33:54+00:00,,107,205,248,0,en,1518251897639084032,[],,,False,,everyone,Twitter for iPhone
1517993743567237122,1056053249470541824,"Roblox’s chief business officer, Craig Donato - has said the company MIGHT do NFTS &amp; integrate blockchain technology into the platforms future 📸 https://t.co/VA2mjHncaR",2022-04-23 22:28:06+00:00,,112,732,1937,300,en,1517993743567237122,"[{'domain': {'id': '46', 'name': 'Brand Category', 'description': 'Categories within Brand Verticals that narrow down the scope of Brands'}, 'entity': {'id': '781974596752842752', 'name': 'Services'}}, {'domain': {'id': '48', 'name': 'Product', 'description': 'Products created by Brands.  Examples: Ford Explorer, Apple iPhone.'}, 'entity': {'id': '1412579054855671809', 'name': 'Google Innovation'}}, {'domain': {'id': '30', 'name': 'Entities [Entity Service]', 'description': 'Entity Service top level domain, every item that is in Entity Service should be in this domain'}, 'entity': {'id': '857879456773357569', 'name': 'Technology', 'description': 'Technology'}}, {'domain': {'id': '66', 'name': 'Interests and Hobbies Category', 'description': 'A grouping of interests and hobbies entities, like Novelty Food or Destinations'}, 'entity': {'id': '913142676819648512', 'name': 'Cryptocurrencies', 'description': 'Cryptocurrency'}}, {'domain': {'id': '30', 'name': 'Entities [Entity Service]', 'description': 'Entity Service top level domain, every item that is in Entity Service should be in this domain'}, 'entity': {'id': '1001503516555337728', 'name': 'Blockchain', 'description': 'Blockchain'}}, {'domain': {'id': '71', 'name': 'Video Game', 'description': 'A video game like Overwatch'}, 'entity': {'id': '1088118927580774400', 'name': 'Roblox', 'description': 'Roblox'}}, {'domain': {'id': '30', 'name': 'Entities [Entity Service]', 'description': 'Entity Service top level domain, every item that is in Entity Service should be in this domain'}, 'entity': {'id': '857879456773357569', 'name': 'Technology', 'description': 'Technology'}}]","{'annotations': [{'start': 0, 'end': 5, 'probability': 0.6402, 'type': 'Organization', 'normalized_text': 'Roblox'}, {'start': 33, 'end': 44, 'probability': 0.9823, 'type': 'Person', 'normalized_text': 'Craig Donato'}], 'urls': [{'start': 149, 'end': 172, 'url': 'https://t.co/VA2mjHncaR', 'expanded_url': 'https://twitter.com/Roblox_RTC/status/1517993743567237122/photo/1', 'display_url': 'pic.twitter.com/VA2mjHncaR', 'media_key': '3_1517993740601806850'}, {'start': 149, 'end': 172, 'url': 'https://t.co/VA2mjHncaR', 'expanded_url': 'https://twitter.com/Roblox_RTC/status/1517993743567237122/photo/1', 'display_url': 'pic.twitter.com/VA2mjHncaR', 'media_key': '3_1517993740601806849'}]}","{'media_keys': ['3_1517993740601806850', '3_1517993740601806849']}",False,,everyone,Twitter for iPhone
1518253010069364741,1499210584918663169,"MUTUALS, drop your oc, I'll rate them from 1 to 10 tomorrow",2022-04-24 15:38:20+00:00,,0,20,10,0,en,1518253010069364741,[],,,False,,following,Twitter for Android
1518228265344901120,1199001259904307207,Do you want to see NFTs on Roblox? 🤔👇,2022-04-24 14:00:00+00:00,,88,1875,2555,154,en,1518228265344901120,"[{'domain': {'id': '66', 'name': 'Interests and Hobbies Category', 'description': 'A grouping of interests and hobbies entities, like Novelty Food or Destinations'}, 'entity': {'id': '913142676819648512', 'name': 'Cryptocurrencies', 'description': 'Cryptocurrency'}}, {'domain': {'id': '71', 'name': 'Video Game', 'description': 'A video game like Overwatch'}, 'entity': {'id': '1088118927580774400', 'name': 'Roblox', 'description': 'Roblox'}}]","{'annotations': [{'start': 19, 'end': 22, 'probability': 0.6002, 'type': 'Person', 'normalized_text': 'NFTs'}, {'start': 27, 'end': 32, 'probability': 0.4867, 'type': 'Product', 'normalized_text': 'Roblox'}]}",,False,,everyone,Twitter Web App
1518047376086343684,1417587809502826500,"PERGUNTA DO DIA: Como você pronuncia a palavra ""rthro""? https://t.co/jS8HZOmDTx",2022-04-24 02:01:13+00:00,,1,96,87,0,pt,1518047376086343684,[],"{'urls': [{'start': 56, 'end': 79, 'url': 'https://t.co/jS8HZOmDTx', 'expanded_url': 'https://twitter.com/Roblox_RTC_BR/status/1518047376086343684/photo/1', 'display_url': 'pic.twitter.com/jS8HZOmDTx', 'media_key': '3_1518047043985580033'}]}",{'media_keys': ['3_1518047043985580033']},False,,everyone,Twitter Web App
1518252667033690113,1324057381970579456,@1ItzAlex @RBXNews_ yet it's still a problem.,2022-04-24 15:36:58+00:00,,0,1,2,0,en,1518228265344901120,[],"{'mentions': [{'start': 0, 'end': 9, 'username': '1ItzAlex', 'id': '1183363578474180608'}, {'start': 10, 'end': 19, 'username': 'RBXNews_', 'id': '1199001259904307207'}]}",,False,,everyone,Twitter Web App
1518252640970366983,1491577701383213058,@Skyvente's account is temporarily unavailable because it violates the Twitter Media Policy. Learn more.,2022-04-24 15:36:52+00:00,,0,1,0,0,en,1518244161094303746,"[{'domain': {'id': '71', 'name': 'Video Game', 'description': 'A video game like Overwatch'}, 'entity': {'id': '856562205210198020', 'name': ""Five Nights at Freddy's"", 'description': 'This entity includes all conversation about the franchise, as well as any individual installments in the series, if applicable.\t\t\t'}}]","{'annotations': [{'start': 58, 'end': 61, 'probability': 0.4941, 'type': 'Other', 'normalized_text': 'FNAF'}], 'urls': [{'start': 93, 'end': 103, 'url': 'https://support.twitter.com/articles/20169199', 'expanded_url': 'https://support.twitter.com/articles/20169199', 'display_url': 'Learn more'}]}",,True,,everyone,Twitter for Android
1518127412412035073,1262316526440333313,@kaliaarmani @NOIRKITTYS @EtherealRecord It's a roblox recreation of an anime?,2022-04-24 07:19:15+00:00,,0,1,0,0,en,1515096626574118912,"[{'domain': {'id': '65', 'name': 'Interests and Hobbies Vertical', 'description': 'Top level interests and hobbies groupings, like Food or Travel'}, 'entity': {'id': '839543165002506240', 'name': 'Anime'}}, {'domain': {'id': '65', 'name': 'Interests and Hobbies Vertical', 'description': 'Top level interests and hobbies groupings, like Food or Travel'}, 'entity': {'id': '1280550787207147521', 'name': 'Arts & culture'}}, {'domain': {'id': '71', 'name': 'Video Game', 'description': 'A video game like Overwatch'}, 'entity': {'id': '1088118927580774400', 'name': 'Roblox', 'description': 'Roblox'}}]","{'mentions': [{'start': 13, 'end': 24, 'username': 'NOIRKITTYS', 'id': '1262533028666118144'}, {'start': 25, 'end': 40, 'username': 'EtherealRecord', 'id': '1050980758200807424'}]}",,False,,everyone,Twitter Web App
1518098320329043968,1356794881071603712,"going on a HUGE shopping spree
buying gamepasses, limit: 41K

please be considerate of others https://t.co/zOIA6x8O9x",2022-04-24 05:23:39+00:00,,116,215,254,2,en,1518098320329043968,[],"{'urls': [{'start': 94, 'end': 117, 'url': 'https://t.co/zOIA6x8O9x', 'expanded_url': 'https://twitter.com/hartpwints/status/1518098320329043968/photo/1', 'display_url': 'pic.twitter.com/zOIA6x8O9x', 'media_key': '3_1518098201374461952'}]}",{'media_keys': ['3_1518098201374461952']},False,,everyone,Twitter Web App
1517896884840538113,3003933095,"Ski does a Jojo pose 😌✨
Watch the new Ask to ski here: https://t.co/wrGp4O4PZy
#fridaynightfunkin #FNF https://t.co/rdvDixQF7L",2022-04-23 16:03:13+00:00,,171,21,1172,4,en,1517896884840538113,"[{'domain': {'id': '3', 'name': 'TV Shows', 'description': 'Television shows from around the world'}, 'entity': {'id': '10043632267', 'name': 'ジョジョの奇妙な冒険', 'description': 'ジョルノ・ジョバァーナは、ジョースター家の宿敵・DIOの血を継ぐ息子である。幼少時代に迫害を受けて荒んでいた彼は、1人のギャングの男がきっかけで、「ギャング・スター」にあこがれるようになった。15歳になったジョルノは、イタリアの裏社会を牛耳るギャング組織「パッショーネ」とトラブルを起こし、狙われることとなり…。\n\n@anime_jojoさんの画像'}}]","{'urls': [{'start': 55, 'end': 78, 'url': 'https://t.co/wrGp4O4PZy', 'expanded_url': 'https://youtu.be/1TF7raYubGw', 'display_url': 'youtu.be/1TF7raYubGw'}, {'start': 103, 'end': 126, 'url': 'https://t.co/rdvDixQF7L', 'expanded_url': 'https://twitter.com/Bluefrok/status/1517896884840538113/photo/1', 'display_url': 'pic.twitter.com/rdvDixQF7L', 'media_key': '16_1517895193697079296'}], 'hashtags': [{'start': 79, 'end': 97, 'tag': 'fridaynightfunkin'}, {'start': 98, 'end': 102, 'tag': 'FNF'}]}",{'media_keys': ['16_1517895193697079296']},False,,everyone,Twitter Web App
1518244768706355201,1511195725044006914,"@RBXNews_ @VentureBeat @Roblox_RTC @chris12902 But i will fight!
we need to screenshot all NFTs so NFTs will become useless and roblox will not add it! https://t.co/9IKYU9QgZ0",2022-04-24 15:05:35+00:00,,0,5,7,0,en,1518198986171166721,"[{'domain': {'id': '46', 'name': 'Brand Category', 'description': 'Categories within Brand Verticals that narrow down the scope of Brands'}, 'entity': {'id': '781974596157181956', 'name': 'Online Site'}}, {'domain': {'id': '47', 'name': 'Brand', 'description': 'Brands and Companies'}, 'entity': {'id': '1066423866354847745', 'name': 'VentureBeat', 'description': 'VentureBeat'}}, {'domain': {'id': '66', 'name': 'Interests and Hobbies Category', 'description': 'A grouping of interests and hobbies entities, like Novelty Food or Destinations'}, 'entity': {'id': '913142676819648512', 'name': 'Cryptocurrencies', 'description': 'Cryptocurrency'}}, {'domain': {'id': '71', 'name': 'Video Game', 'description': 'A video game like Overwatch'}, 'entity': {'id': '1088118927580774400', 'name': 'Roblox', 'description': 'Roblox'}}]","{'urls': [{'start': 152, 'end': 175, 'url': 'https://t.co/9IKYU9QgZ0', 'expanded_url': 'https://twitter.com/aRandomNoob69/status/1518244768706355201/photo/1', 'display_url': 'pic.twitter.com/9IKYU9QgZ0', 'media_key': '3_1518244764319207427'}], 'mentions': [{'start': 0, 'end': 9, 'username': 'RBXNews_', 'id': '1199001259904307207'}, {'start': 10, 'end': 22, 'username': 'VentureBeat', 'id': '60642052'}, {'start': 23, 'end': 34, 'username': 'Roblox_RTC', 'id': '1056053249470541824'}, {'start': 35, 'end': 46, 'username': 'chris12902', 'id': '1254513527664099333'}]}",{'media_keys': ['3_1518244764319207427']},False,,everyone,Twitter for Android
1518250728719933441,1452207867814195205,I JUST REALIZED I ACCIDENTALLY SUBSCRIBED TO GET ROBUX EVERY MONTH AND ITS BEEN CHARGING ME AHHHHHH WHATTTT,2022-04-24 15:29:16+00:00,,3,26,164,0,en,1518250728719933441,[],,,False,,everyone,Twitter for iPhone
1518251855834501123,1183363578474180608,"@acidblasts @RBXNews_ well its a solution to stop children from being exposed
and besides you also get access to voicechat by verifying your id",2022-04-24 15:33:44+00:00,,0,1,0,0,en,1518228265344901120,[],"{'mentions': [{'start': 12, 'end': 21, 'username': 'RBXNews_', 'id': '1199001259904307207'}]}",,False,,everyone,Twitter Web App
1518250529578704902,1515536711442386949,get the FAWK back. https://t.co/l8wcRYSyjO,2022-04-24 15:28:28+00:00,,0,1,0,0,en,1518250529578704902,[],"{'urls': [{'start': 19, 'end': 42, 'url': 'https://t.co/l8wcRYSyjO', 'expanded_url': 'https://twitter.com/xanner2dope/status/1517925524131262464', 'display_url': 'twitter.com/xanner2dope/st…'}]}",,False,,everyone,Twitter for iPhone
1518040361976967168,1133869500338704384,Ideias de jogos agora pra brincar em live,2022-04-24 01:33:20+00:00,,8,31,286,0,pt,1518040361976967168,[],,,False,,everyone,Twitter for iPhone
1516485265262399491,16745055,What's that on the horizon? Looks like a thrilling open-world Roblox adventure for you and your whole crew. https://t.co/07puSdAAvV,2022-04-19 18:33:56+00:00,,139,516,2480,13,en,1516485265262399491,"[{'domain': {'id': '71', 'name': 'Video Game', 'description': 'A video game like Overwatch'}, 'entity': {'id': '1088118927580774400', 'name': 'Roblox', 'description': 'Roblox'}}]","{'annotations': [{'start': 62, 'end': 67, 'probability': 0.3916, 'type': 'Product', 'normalized_text': 'Roblox'}], 'urls': [{'start': 108, 'end': 131, 'url': 'https://t.co/07puSdAAvV', 'expanded_url': 'https://twitter.com/Sonar_Games/status/1506335517708673029', 'display_url': 'twitter.com/Sonar_Games/st…'}]}",,False,,everyone,Twitter Web App
1518251506390245376,1310219721309147137,@gayof87 ARE YOU OKAY???,2022-04-24 15:32:21+00:00,,0,1,0,0,en,1518248696823128064,[],"{'mentions': [{'start': 0, 'end': 8, 'username': 'gayof87', 'id': '1427452718612979714'}]}",,False,,everyone,Twitter for Android
1518239456482013185,1406697188890189828,@TurkOyuncuRBX @RBXNews_ @VentureBeat @Roblox_RTC @chris12902 Thanks for the nft buddy https://t.co/l0l9pO2UTG,2022-04-24 14:44:28+00:00,,0,1,6,0,en,1518198986171166721,"[{'domain': {'id': '46', 'name': 'Brand Category', 'description': 'Categories within Brand Verticals that narrow down the scope of Brands'}, 'entity': {'id': '781974596157181956', 'name': 'Online Site'}}, {'domain': {'id': '47', 'name': 'Brand', 'description': 'Brands and Companies'}, 'entity': {'id': '1066423866354847745', 'name': 'VentureBeat', 'description': 'VentureBeat'}}, {'domain': {'id': '66', 'name': 'Interests and Hobbies Category', 'description': 'A grouping of interests and hobbies entities, like Novelty Food or Destinations'}, 'entity': {'id': '913142676819648512', 'name': 'Cryptocurrencies', 'description': 'Cryptocurrency'}}]","{'urls': [{'start': 87, 'end': 110, 'url': 'https://t.co/l0l9pO2UTG', 'expanded_url': 'https://twitter.com/carlosman1267/status/1518239456482013185/photo/1', 'display_url': 'pic.twitter.com/l0l9pO2UTG', 'media_key': '3_1518239406930509824'}], 'mentions': [{'start': 0, 'end': 14, 'username': 'TurkOyuncuRBX', 'id': '1255447000516104194'}, {'start': 15, 'end': 24, 'username': 'RBXNews_', 'id': '1199001259904307207'}, {'start': 25, 'end': 37, 'username': 'VentureBeat', 'id': '60642052'}, {'start': 38, 'end': 49, 'username': 'Roblox_RTC', 'id': '1056053249470541824'}, {'start': 50, 'end': 61, 'username': 'chris12902', 'id': '1254513527664099333'}]}",{'media_keys': ['3_1518239406930509824']},True,,everyone,Twitter Web App
1517130173728047105,3644607147,"What do you personally want reworked in Shindo?

I’m planning on redoing some game modes, main missions, and some Jutsu rework.

Let me know what you’d like. I am reading comments even if they don’t got tons of likes or support.",2022-04-21 13:16:34+00:00,,64,2107,2193,4,en,1517130173728047105,[],,,False,,everyone,Twitter for iPhone
