tweetid,author_id,text,created_at,geo,retweets,replies,likes,quote_count,lang,conversation_id,context_annotations,entities,attachments,possibly_sensitive,withheld,reply_settings,source
1516102764979499011,1344682256368021504,@HOLDINDEEZNUTS @Roblox fortnite and roblox are completely different games ...,2022-04-18 17:14:01+00:00,,0,1,4,0,en,1516101798276309001,"[{'domain': {'id': '71', 'name': 'Video Game', 'description': 'A video game like Overwatch'}, 'entity': {'id': '974285387987169280', 'name': 'Fortnite', 'description': 'This entity includes all conversation about the franchise, as well as any individual installments in the series, if applicable.\t\t\t'}}, {'domain': {'id': '71', 'name': 'Video Game', 'description': 'A video game like Overwatch'}, 'entity': {'id': '1088118927580774400', 'name': 'Roblox', 'description': 'Roblox'}}]","{'mentions': [{'start': 0, 'end': 15, 'username': 'HOLDINDEEZNUTS', 'id': '1360720630274908161'}, {'start': 16, 'end': 23, 'username': 'Roblox', 'id': '16745055'}]}",,False,,everyone,Twitter for Android
1516103529735372811,1301877460141838337,@Rostobosto69 @Roblox Ok good point,2022-04-18 17:17:03+00:00,,0,1,1,0,en,1516101798276309001,"[{'domain': {'id': '71', 'name': 'Video Game', 'description': 'A video game like Overwatch'}, 'entity': {'id': '1088118927580774400', 'name': 'Roblox', 'description': 'Roblox'}}]","{'mentions': [{'start': 0, 'end': 13, 'username': 'Rostobosto69', 'id': '1513600173074702346'}, {'start': 14, 'end': 21, 'username': 'Roblox', 'id': '16745055'}]}",,False,,everyone,Twitter for iPhone
1516101798276309001,16745055,You know what this shirt would go well with? Anything you want. Available now to wear on any avatar and with any outfit: https://t.co/svFMbNqrU0 https://t.co/r4cTopCKuo,2022-04-18 17:10:11+00:00,,150,686,3041,22,en,1516101798276309001,"[{'domain': {'id': '71', 'name': 'Video Game', 'description': 'A video game like Overwatch'}, 'entity': {'id': '1088118927580774400', 'name': 'Roblox', 'description': 'Roblox'}}]","{'urls': [{'start': 121, 'end': 144, 'url': 'https://t.co/svFMbNqrU0', 'expanded_url': 'https://rblx.co/shirts', 'display_url': 'rblx.co/shirts', 'images': [{'url': 'https://pbs.twimg.com/news_img/1524155074854854656/X4Yo5E_U?format=jpg&name=orig', 'width': 1200, 'height': 630}, {'url': 'https://pbs.twimg.com/news_img/1524155074854854656/X4Yo5E_U?format=jpg&name=150x150', 'width': 150, 'height': 150}], 'status': 200, 'title': 'Roblox', 'description': 'Customize your avatar with a never-ending variety of clothing options, accessories, gear, and more!', 'unwound_url': 'https://www.roblox.com/catalog?Category=3&Subcategory=58&SortType=3'}, {'start': 145, 'end': 168, 'url': 'https://t.co/r4cTopCKuo', 'expanded_url': 'https://twitter.com/Roblox/status/1516101798276309001/video/1', 'display_url': 'pic.twitter.com/r4cTopCKuo', 'media_key': '7_1516098182740029441'}]}",{'media_keys': ['7_1516098182740029441']},False,,everyone,Twitter Web App
1516103455961587720,1166538336267202561,@AlexVilla347 @FanCujo @Roblox_RTC Even then the YouTube logo is everywhere on Roblox. It would baffle me if this one person would be punished for the use of a logo that is used EVERYWHERE.,2022-04-18 17:16:46+00:00,,0,1,1,0,en,1516102391401267204,"[{'domain': {'id': '71', 'name': 'Video Game', 'description': 'A video game like Overwatch'}, 'entity': {'id': '1088118927580774400', 'name': 'Roblox', 'description': 'Roblox'}}, {'domain': {'id': '165', 'name': 'Technology', 'description': 'for individual and types of technology, e.g., food technology, 3D printing'}, 'entity': {'id': '1196446161223028736', 'name': 'Social media'}}, {'domain': {'id': '46', 'name': 'Brand Category', 'description': 'Categories within Brand Verticals that narrow down the scope of Brands'}, 'entity': {'id': '781974596752842752', 'name': 'Services'}}, {'domain': {'id': '47', 'name': 'Brand', 'description': 'Brands and Companies'}, 'entity': {'id': '10029382357', 'name': 'YouTube'}}]","{'annotations': [{'start': 49, 'end': 55, 'probability': 0.6041, 'type': 'Product', 'normalized_text': 'YouTube'}, {'start': 79, 'end': 84, 'probability': 0.6065, 'type': 'Product', 'normalized_text': 'Roblox'}], 'mentions': [{'start': 0, 'end': 13, 'username': 'AlexVilla347', 'id': '1511169105545478144'}, {'start': 14, 'end': 22, 'username': 'FanCujo', 'id': '1294803548795002880'}, {'start': 23, 'end': 34, 'username': 'Roblox_RTC', 'id': '1056053249470541824'}]}",,False,,everyone,Twitter for Android
1516060515923107841,1455493182276390919,Wasn’t going to watch the new Kardashians show but then someone reminded me that this was filmed before Tristan’s third baby mama exposed him so now I need to watch this man living a double life. Fingers crossed for an ep of him getting exposed on camera.,2022-04-18 14:26:08+00:00,,0,2,5,0,en,1516060515923107841,[],"{'annotations': [{'start': 30, 'end': 40, 'probability': 0.5297, 'type': 'Person', 'normalized_text': 'Kardashians'}, {'start': 104, 'end': 110, 'probability': 0.9909, 'type': 'Person', 'normalized_text': 'Tristan'}]}",,False,,everyone,Twitter for iPhone
1516102013037133827,1360720630274908161,@Roblox Fortnite has better shirts,2022-04-18 17:11:02+00:00,,1,8,18,0,en,1516101798276309001,"[{'domain': {'id': '71', 'name': 'Video Game', 'description': 'A video game like Overwatch'}, 'entity': {'id': '974285387987169280', 'name': 'Fortnite', 'description': 'This entity includes all conversation about the franchise, as well as any individual installments in the series, if applicable.\t\t\t'}}, {'domain': {'id': '71', 'name': 'Video Game', 'description': 'A video game like Overwatch'}, 'entity': {'id': '1088118927580774400', 'name': 'Roblox', 'description': 'Roblox'}}]","{'annotations': [{'start': 8, 'end': 15, 'probability': 0.4467, 'type': 'Person', 'normalized_text': 'Fortnite'}], 'mentions': [{'start': 0, 'end': 7, 'username': 'Roblox', 'id': '16745055'}]}",,False,,everyone,Twitter for iPhone
1509899203291590708,987896766,Who's tryin to play https://t.co/boMUrjSyTI,2022-04-01 14:23:17+00:00,,0,3,12,0,en,1509899203291590708,[],"{'urls': [{'start': 20, 'end': 43, 'url': 'https://t.co/boMUrjSyTI', 'expanded_url': 'https://twitter.com/Blahwaa/status/1509899203291590708/photo/1', 'display_url': 'pic.twitter.com/boMUrjSyTI', 'media_key': '3_1509899196207407105'}]}",{'media_keys': ['3_1509899196207407105']},False,,everyone,Twitter for Android
1495131460923232263,1191795122117206016,@Roblox DEAD GAME + WE DONT CARE WE ALL ON FORTNITE ANYWAYS!!!,2022-02-19 20:21:33+00:00,,1,134,137,1,en,1495116033408987136,"[{'domain': {'id': '71', 'name': 'Video Game', 'description': 'A video game like Overwatch'}, 'entity': {'id': '974285387987169280', 'name': 'Fortnite', 'description': 'This entity includes all conversation about the franchise, as well as any individual installments in the series, if applicable.\t\t\t'}}, {'domain': {'id': '71', 'name': 'Video Game', 'description': 'A video game like Overwatch'}, 'entity': {'id': '1088118927580774400', 'name': 'Roblox', 'description': 'Roblox'}}]","{'mentions': [{'start': 0, 'end': 7, 'username': 'Roblox', 'id': '16745055'}]}",,False,,everyone,Twitter Web App
1516103463230668802,1232473295741542401,@greenlegocats @Roblox Or I'm quiting!,2022-04-18 17:16:48+00:00,,0,1,5,0,en,1516101798276309001,"[{'domain': {'id': '71', 'name': 'Video Game', 'description': 'A video game like Overwatch'}, 'entity': {'id': '1088118927580774400', 'name': 'Roblox', 'description': 'Roblox'}}]","{'mentions': [{'start': 0, 'end': 14, 'username': 'greenlegocats', 'id': '828495957964656642'}, {'start': 15, 'end': 22, 'username': 'Roblox', 'id': '16745055'}]}",,False,,everyone,Twitter for Android
1516102391401267204,1056053249470541824,"A major game on Roblox known as Star Simulator has COPIED a mobile game called My Little Universe 😟

The developers of My Little Universe say that the copy DIRECTLY stole some of their sounds, music, level layout, &amp; upgrades!😐

Multiple YouTubers regret reporting on the game.. https://t.co/uKNErTW0b3",2022-04-18 17:12:32+00:00,,144,196,2352,17,en,1516102391401267204,"[{'domain': {'id': '71', 'name': 'Video Game', 'description': 'A video game like Overwatch'}, 'entity': {'id': '1088118927580774400', 'name': 'Roblox', 'description': 'Roblox'}}, {'domain': {'id': '30', 'name': 'Entities [Entity Service]', 'description': 'Entity Service top level domain, every item that is in Entity Service should be in this domain'}, 'entity': {'id': '847527946864607232', 'name': 'Mobile gaming', 'description': 'Mobile gaming'}}, {'domain': {'id': '79', 'name': 'Video Game Hardware', 'description': 'Video Game Hardware'}, 'entity': {'id': '847527946864607232', 'name': 'Mobile gaming', 'description': 'Mobile gaming'}}]","{'urls': [{'start': 282, 'end': 305, 'url': 'https://t.co/uKNErTW0b3', 'expanded_url': 'https://twitter.com/Roblox_RTC/status/1516102391401267204/photo/1', 'display_url': 'pic.twitter.com/uKNErTW0b3', 'media_key': '3_1516102387085332480'}, {'start': 282, 'end': 305, 'url': 'https://t.co/uKNErTW0b3', 'expanded_url': 'https://twitter.com/Roblox_RTC/status/1516102391401267204/photo/1', 'display_url': 'pic.twitter.com/uKNErTW0b3', 'media_key': '3_1516102387097821195'}, {'start': 282, 'end': 305, 'url': 'https://t.co/uKNErTW0b3', 'expanded_url': 'https://twitter.com/Roblox_RTC/status/1516102391401267204/photo/1', 'display_url': 'pic.twitter.com/uKNErTW0b3', 'media_key': '3_1516102387085332484'}], 'annotations': [{'start': 16, 'end': 21, 'probability': 0.4378, 'type': 'Product', 'normalized_text': 'Roblox'}, {'start': 32, 'end': 45, 'probability': 0.431, 'type': 'Product', 'normalized_text': 'Star Simulator'}, {'start': 79, 'end': 96, 'probability': 0.3736, 'type': 'Product', 'normalized_text': 'My Little Universe'}, {'start': 120, 'end': 137, 'probability': 0.3949, 'type': 'Product', 'normalized_text': 'My Little Universe'}]}","{'media_keys': ['3_1516102387085332480', '3_1516102387097821195', '3_1516102387085332484']}",False,,everyone,Twitter for iPhone
1516103498303254536,290097288,"Tomorrow, Snoop Dogg is dropping in like it's 🔥 https://t.co/c6YhYZbNgE",2022-04-18 17:16:56+00:00,,479,243,5086,124,en,1516103498303254536,"[{'domain': {'id': '45', 'name': 'Brand Vertical', 'description': 'Top level entities that describe a Brands industry'}, 'entity': {'id': '781974597310615553', 'name': 'Entertainment'}}, {'domain': {'id': '46', 'name': 'Brand Category', 'description': 'Categories within Brand Verticals that narrow down the scope of Brands'}, 'entity': {'id': '781974597218340864', 'name': 'Video Games'}}, {'domain': {'id': '71', 'name': 'Video Game', 'description': 'A video game like Overwatch'}, 'entity': {'id': '10027933222', 'name': 'Call of Duty', 'description': 'This entity includes all conversation about the franchise, as well as any individual installments in the series, if applicable.\t\t\t'}}, {'domain': {'id': '71', 'name': 'Video Game', 'description': 'A video game like Overwatch'}, 'entity': {'id': '997093174341337088', 'name': 'Call of Duty: Black Ops 4', 'description': 'Call of Duty: Black Ops 4'}}, {'domain': {'id': '10', 'name': 'Person', 'description': 'Named people in the world like Nelson Mandela'}, 'entity': {'id': '807223820624936960', 'name': 'Snoop Dogg', 'description': 'Snoop Dogg'}}, {'domain': {'id': '54', 'name': 'Musician', 'description': 'A musician in the world, like Adele or Bob Dylan'}, 'entity': {'id': '807223820624936960', 'name': 'Snoop Dogg', 'description': 'Snoop Dogg'}}, {'domain': {'id': '55', 'name': 'Music Genre', 'description': 'A category for a musical style, like Pop, Rock, or Rap'}, 'entity': {'id': '810937888334487552', 'name': 'Rap', 'description': 'Hip-Hop/Rap'}}]","{'urls': [{'start': 48, 'end': 71, 'url': 'https://t.co/c6YhYZbNgE', 'expanded_url': 'https://twitter.com/CallofDuty/status/1516103498303254536/video/1', 'display_url': 'pic.twitter.com/c6YhYZbNgE', 'media_key': '13_1516103434126118914'}], 'annotations': [{'start': 10, 'end': 19, 'probability': 0.9923, 'type': 'Person', 'normalized_text': 'Snoop Dogg'}]}",{'media_keys': ['13_1516103434126118914']},True,,everyone,Sprinklr Publishing
1516103349430587400,1513600173074702346,@DieselBusters @Roblox No,2022-04-18 17:16:20+00:00,,0,1,1,0,und,1516101798276309001,"[{'domain': {'id': '71', 'name': 'Video Game', 'description': 'A video game like Overwatch'}, 'entity': {'id': '1088118927580774400', 'name': 'Roblox', 'description': 'Roblox'}}]","{'mentions': [{'start': 0, 'end': 14, 'username': 'DieselBusters', 'id': '1301877460141838337'}, {'start': 15, 'end': 22, 'username': 'Roblox', 'id': '16745055'}]}",,False,,everyone,Twitter for Android
1495118814530445315,1008120773045899264,"@Roblox stay down forever, dead platform https://t.co/CjBNO85C30",2022-02-19 19:31:18+00:00,,13,35,385,1,en,1495116033408987136,"[{'domain': {'id': '71', 'name': 'Video Game', 'description': 'A video game like Overwatch'}, 'entity': {'id': '1088118927580774400', 'name': 'Roblox', 'description': 'Roblox'}}]","{'urls': [{'start': 41, 'end': 64, 'url': 'https://t.co/CjBNO85C30', 'expanded_url': 'https://twitter.com/notedicista/status/1495118814530445315/photo/1', 'display_url': 'pic.twitter.com/CjBNO85C30', 'media_key': '3_1495118812219387906'}], 'mentions': [{'start': 0, 'end': 7, 'username': 'Roblox', 'id': '16745055'}]}",{'media_keys': ['3_1495118812219387906']},False,,everyone,Twitter for Android
1516102919065509889,1371675151243218947,"@Roblox_RTC i mean isnt all roblox game 
is copied",2022-04-18 17:14:38+00:00,,0,1,4,0,en,1516102391401267204,"[{'domain': {'id': '71', 'name': 'Video Game', 'description': 'A video game like Overwatch'}, 'entity': {'id': '1088118927580774400', 'name': 'Roblox', 'description': 'Roblox'}}]","{'mentions': [{'start': 0, 'end': 11, 'username': 'Roblox_RTC', 'id': '1056053249470541824'}]}",,False,,everyone,Twitter Web App
1516103383005876225,828495957964656642,@Roblox Bring back REAL Egg Hunts!!!,2022-04-18 17:16:29+00:00,,12,9,323,0,en,1516101798276309001,"[{'domain': {'id': '71', 'name': 'Video Game', 'description': 'A video game like Overwatch'}, 'entity': {'id': '1088118927580774400', 'name': 'Roblox', 'description': 'Roblox'}}]","{'mentions': [{'start': 0, 'end': 7, 'username': 'Roblox', 'id': '16745055'}]}",,False,,everyone,Twitter for Android
1516101798276309001,16745055,You know what this shirt would go well with? Anything you want. Available now to wear on any avatar and with any outfit: https://t.co/svFMbNqrU0 https://t.co/r4cTopCKuo,2022-04-18 17:10:11+00:00,,150,686,3041,22,en,1516101798276309001,"[{'domain': {'id': '71', 'name': 'Video Game', 'description': 'A video game like Overwatch'}, 'entity': {'id': '1088118927580774400', 'name': 'Roblox', 'description': 'Roblox'}}]","{'urls': [{'start': 121, 'end': 144, 'url': 'https://t.co/svFMbNqrU0', 'expanded_url': 'https://rblx.co/shirts', 'display_url': 'rblx.co/shirts'}, {'start': 145, 'end': 168, 'url': 'https://t.co/r4cTopCKuo', 'expanded_url': 'https://twitter.com/Roblox/status/1516101798276309001/video/1', 'display_url': 'pic.twitter.com/r4cTopCKuo', 'media_key': '7_1516098182740029441'}]}",{'media_keys': ['7_1516098182740029441']},False,,everyone,Twitter Web App
1516103170425974784,1511169105545478144,"@FanCujo @Roblox_RTC maybe the youtube logo, or it’s a glitch",2022-04-18 17:15:38+00:00,,0,1,1,0,en,1516102391401267204,"[{'domain': {'id': '165', 'name': 'Technology', 'description': 'for individual and types of technology, e.g., food technology, 3D printing'}, 'entity': {'id': '1196446161223028736', 'name': 'Social media'}}, {'domain': {'id': '46', 'name': 'Brand Category', 'description': 'Categories within Brand Verticals that narrow down the scope of Brands'}, 'entity': {'id': '781974596752842752', 'name': 'Services'}}, {'domain': {'id': '47', 'name': 'Brand', 'description': 'Brands and Companies'}, 'entity': {'id': '10029382357', 'name': 'YouTube'}}]","{'annotations': [{'start': 31, 'end': 37, 'probability': 0.4265, 'type': 'Product', 'normalized_text': 'youtube'}], 'mentions': [{'start': 0, 'end': 8, 'username': 'FanCujo', 'id': '1294803548795002880'}, {'start': 9, 'end': 20, 'username': 'Roblox_RTC', 'id': '1056053249470541824'}]}",,False,,everyone,Twitter for iPad
1516102390491009024,1305373229746323456,@Roblox Fortnite is way better then ALL Roblox games sadly,2022-04-18 17:12:32+00:00,,0,19,4,0,en,1516101798276309001,"[{'domain': {'id': '71', 'name': 'Video Game', 'description': 'A video game like Overwatch'}, 'entity': {'id': '974285387987169280', 'name': 'Fortnite', 'description': 'This entity includes all conversation about the franchise, as well as any individual installments in the series, if applicable.\t\t\t'}}, {'domain': {'id': '71', 'name': 'Video Game', 'description': 'A video game like Overwatch'}, 'entity': {'id': '1088118927580774400', 'name': 'Roblox', 'description': 'Roblox'}}]","{'annotations': [{'start': 8, 'end': 15, 'probability': 0.436, 'type': 'Person', 'normalized_text': 'Fortnite'}, {'start': 40, 'end': 45, 'probability': 0.3458, 'type': 'Product', 'normalized_text': 'Roblox'}], 'mentions': [{'start': 0, 'end': 7, 'username': 'Roblox', 'id': '16745055'}]}",,False,,everyone,Twitter for iPhone
1516102060260802560,1454532595270647813,@Roblox We all play clash of clans,2022-04-18 17:11:13+00:00,,0,12,18,1,en,1516101798276309001,"[{'domain': {'id': '30', 'name': 'Entities [Entity Service]', 'description': 'Entity Service top level domain, every item that is in Entity Service should be in this domain'}, 'entity': {'id': '847527946864607232', 'name': 'Mobile gaming', 'description': 'Mobile gaming'}}, {'domain': {'id': '71', 'name': 'Video Game', 'description': 'A video game like Overwatch'}, 'entity': {'id': '855317585268662274', 'name': 'Clash of Clans', 'description': 'This entity includes all conversation about the franchise, as well as any individual installments in the series, if applicable.\t\t\t'}}, {'domain': {'id': '71', 'name': 'Video Game', 'description': 'A video game like Overwatch'}, 'entity': {'id': '1088118927580774400', 'name': 'Roblox', 'description': 'Roblox'}}]","{'mentions': [{'start': 0, 'end': 7, 'username': 'Roblox', 'id': '16745055'}]}",,False,,everyone,Twitter for Android
1516103229830057984,1301877460141838337,@AlexVilla347 @Roblox_RTC NBA youngboy better then Roblox,2022-04-18 17:15:52+00:00,,0,1,1,0,en,1516102391401267204,"[{'domain': {'id': '3', 'name': 'TV Shows', 'description': 'Television shows from around the world'}, 'entity': {'id': '10000607734', 'name': 'NBA Basketball', 'description': 'All the latest basketball action from the NBA.'}}, {'domain': {'id': '3', 'name': 'TV Shows', 'description': 'Television shows from around the world'}, 'entity': {'id': '10029190505', 'name': 'Live: NBA Basketball', 'description': 'Live coverage from the National Basketball Association, the top basketball league in North America.'}}, {'domain': {'id': '3', 'name': 'TV Shows', 'description': 'Television shows from around the world'}, 'entity': {'id': '10029304530', 'name': 'NBA Basketball'}}, {'domain': {'id': '10', 'name': 'Person', 'description': 'Named people in the world like Nelson Mandela'}, 'entity': {'id': '1138467126497296384', 'name': 'NBA YOUNGBOY'}}, {'domain': {'id': '54', 'name': 'Musician', 'description': 'A musician in the world, like Adele or Bob Dylan'}, 'entity': {'id': '1138467126497296384', 'name': 'NBA YOUNGBOY'}}, {'domain': {'id': '55', 'name': 'Music Genre', 'description': 'A category for a musical style, like Pop, Rock, or Rap'}, 'entity': {'id': '810937888334487552', 'name': 'Rap', 'description': 'Hip-Hop/Rap'}}, {'domain': {'id': '71', 'name': 'Video Game', 'description': 'A video game like Overwatch'}, 'entity': {'id': '1088118927580774400', 'name': 'Roblox', 'description': 'Roblox'}}, {'domain': {'id': '45', 'name': 'Brand Vertical', 'description': 'Top level entities that describe a Brands industry'}, 'entity': {'id': '781974597310615553', 'name': 'Entertainment'}}, {'domain': {'id': '46', 'name': 'Brand Category', 'description': 'Categories within Brand Verticals that narrow down the scope of Brands'}, 'entity': {'id': '781974597491040257', 'name': 'Sports'}}, {'domain': {'id': '47', 'name': 'Brand', 'description': 'Brands and Companies'}, 'entity': {'id': '10042758024', 'name': 'NBA'}}]","{'annotations': [{'start': 26, 'end': 28, 'probability': 0.4981, 'type': 'Organization', 'normalized_text': 'NBA'}, {'start': 51, 'end': 56, 'probability': 0.2935, 'type': 'Product', 'normalized_text': 'Roblox'}], 'mentions': [{'start': 0, 'end': 13, 'username': 'AlexVilla347', 'id': '1511169105545478144'}, {'start': 14, 'end': 25, 'username': 'Roblox_RTC', 'id': '1056053249470541824'}]}",,False,,everyone,Twitter for iPhone
1516061297817063426,915828497775419392,"@Roblox_RTC There's another game based on this one
it's called ""Doodle World"" with the same gameplay like Pokémon BrickBronze except that it was different https://t.co/xZrVkr7cuG",2022-04-18 14:29:15+00:00,,0,14,24,1,en,1516052156788445184,"[{'domain': {'id': '45', 'name': 'Brand Vertical', 'description': 'Top level entities that describe a Brands industry'}, 'entity': {'id': '781974597310615553', 'name': 'Entertainment'}}, {'domain': {'id': '46', 'name': 'Brand Category', 'description': 'Categories within Brand Verticals that narrow down the scope of Brands'}, 'entity': {'id': '781974597218340864', 'name': 'Video Games'}}, {'domain': {'id': '130', 'name': 'Multimedia Franchise', 'description': ""Franchises which span multiple forms of media like 'Harry Potter'""}, 'entity': {'id': '10045599546', 'name': 'Pokémon', 'description': 'This entity includes all conversation about the franchise, as well as any individual installments in the series, if applicable. **NOTE: Annotations redirected to domain 130 ONLY on 8/7/18.'}}]","{'urls': [{'start': 155, 'end': 178, 'url': 'https://t.co/xZrVkr7cuG', 'expanded_url': 'https://twitter.com/ibluric/status/1516061297817063426/photo/1', 'display_url': 'pic.twitter.com/xZrVkr7cuG', 'media_key': '3_1516061294893613059'}], 'annotations': [{'start': 64, 'end': 75, 'probability': 0.6198, 'type': 'Other', 'normalized_text': 'Doodle World'}, {'start': 106, 'end': 124, 'probability': 0.4507, 'type': 'Product', 'normalized_text': 'Pokémon BrickBronze'}], 'mentions': [{'start': 0, 'end': 11, 'username': 'Roblox_RTC', 'id': '1056053249470541824'}]}",{'media_keys': ['3_1516061294893613059']},False,,everyone,Twitter for Android
1516102012483551234,1301877460141838337,@Roblox Dead game,2022-04-18 17:11:02+00:00,,0,2,2,0,en,1516101798276309001,"[{'domain': {'id': '71', 'name': 'Video Game', 'description': 'A video game like Overwatch'}, 'entity': {'id': '1088118927580774400', 'name': 'Roblox', 'description': 'Roblox'}}]","{'mentions': [{'start': 0, 'end': 7, 'username': 'Roblox', 'id': '16745055'}]}",,False,,everyone,Twitter for iPhone
1516052158147350530,1056053249470541824,Credits: @LeArmenti,2022-04-18 13:52:56+00:00,,4,5,162,0,en,1516052156788445184,[],"{'mentions': [{'start': 9, 'end': 19, 'username': 'LeArmenti', 'id': '1107392661198118914'}]}",,False,,everyone,Twitter for iPhone
1516103127744667649,2682868226,@RealSrzga @Roblox ?,2022-04-18 17:15:28+00:00,,0,1,0,0,qam,1516101798276309001,"[{'domain': {'id': '71', 'name': 'Video Game', 'description': 'A video game like Overwatch'}, 'entity': {'id': '1088118927580774400', 'name': 'Roblox', 'description': 'Roblox'}}]","{'mentions': [{'start': 0, 'end': 10, 'username': 'RealSrzga', 'id': '1044908871523999744'}, {'start': 11, 'end': 18, 'username': 'Roblox', 'id': '16745055'}]}",,False,,everyone,Twitter for iPhone
1516075316527124481,1056053249470541824,"Congrats to @SubToLcLc for reaching 1 million subscribers! They're most known for their Pet Simulator X videos. He celebrated with a live stream with his fans 👏

LCLC has been a rising YouTuber on the YouTube scene, hitting trending multiple times. https://t.co/VWmtnddzOD",2022-04-18 15:24:57+00:00,,17,34,546,3,en,1516075316527124481,"[{'domain': {'id': '165', 'name': 'Technology', 'description': 'for individual and types of technology, e.g., food technology, 3D printing'}, 'entity': {'id': '1196446161223028736', 'name': 'Social media'}}, {'domain': {'id': '46', 'name': 'Brand Category', 'description': 'Categories within Brand Verticals that narrow down the scope of Brands'}, 'entity': {'id': '781974596752842752', 'name': 'Services'}}, {'domain': {'id': '47', 'name': 'Brand', 'description': 'Brands and Companies'}, 'entity': {'id': '10029382357', 'name': 'YouTube'}}]","{'urls': [{'start': 249, 'end': 272, 'url': 'https://t.co/VWmtnddzOD', 'expanded_url': 'https://twitter.com/Roblox_RTC/status/1516075316527124481/photo/1', 'display_url': 'pic.twitter.com/VWmtnddzOD', 'media_key': '3_1516075313830285313'}], 'annotations': [{'start': 202, 'end': 208, 'probability': 0.4209, 'type': 'Product', 'normalized_text': 'YouTube'}], 'mentions': [{'start': 12, 'end': 22, 'username': 'SubToLcLc', 'id': '1265660439477784579'}]}",{'media_keys': ['3_1516075313830285313']},False,,everyone,Twitter for iPhone
