tweetid,author_id,text,created_at,geo,retweets,replies,likes,quote_count,lang,conversation_id,context_annotations,entities,attachments,possibly_sensitive,withheld,reply_settings,source
1522246156696182784,24742040,"Take your Victory Royale to the Cloud.

Drop into @FortniteGame on your phone, tablet, or PC with Xbox Cloud Gaming (Beta) for free. No install or subscription required: https://t.co/uh6uFw2PgD https://t.co/P5x4NneZmw",2022-05-05 16:05:40+00:00,,2425,846,24835,617,en,1522246156696182784,"[{'domain': {'id': '71', 'name': 'Video Game', 'description': 'A video game like Overwatch'}, 'entity': {'id': '974285387987169280', 'name': 'Fortnite', 'description': 'This entity includes all conversation about the franchise, as well as any individual installments in the series, if applicable.\t\t\t'}}, {'domain': {'id': '79', 'name': 'Video Game Hardware', 'description': 'Video Game Hardware'}, 'entity': {'id': '1174432578503204864', 'name': 'PC gaming'}}, {'domain': {'id': '79', 'name': 'Video Game Hardware', 'description': 'Video Game Hardware'}, 'entity': {'id': '1201639602840145920', 'name': 'Cloud gaming'}}, {'domain': {'id': '45', 'name': 'Brand Vertical', 'description': 'Top level entities that describe a Brands industry'}, 'entity': {'id': '781974597310615553', 'name': 'Entertainment'}}, {'domain': {'id': '46', 'name': 'Brand Category', 'description': 'Categories within Brand Verticals that narrow down the scope of Brands'}, 'entity': {'id': '781974597218340864', 'name': 'Video Games'}}, {'domain': {'id': '47', 'name': 'Brand', 'description': 'Brands and Companies'}, 'entity': {'id': '10027048851', 'name': 'Xbox'}}, {'domain': {'id': '79', 'name': 'Video Game Hardware', 'description': 'Video Game Hardware'}, 'entity': {'id': '10027048851', 'name': 'Xbox'}}]","{'mentions': [{'start': 50, 'end': 63, 'username': 'FortniteGame', 'id': '425871040'}], 'annotations': [{'start': 90, 'end': 91, 'probability': 0.5808, 'type': 'Product', 'normalized_text': 'PC'}, {'start': 98, 'end': 114, 'probability': 0.7764, 'type': 'Product', 'normalized_text': 'Xbox Cloud Gaming'}], 'urls': [{'start': 170, 'end': 193, 'url': 'https://t.co/uh6uFw2PgD', 'expanded_url': 'https://xbx.lv/3yeo9L5', 'display_url': 'xbx.lv/3yeo9L5', 'images': [{'url': 'https://pbs.twimg.com/news_img/1528274236283887618/MdcUCBlQ?format=jpg&name=orig', 'width': 1080, 'height': 1080}, {'url': 'https://pbs.twimg.com/news_img/1528274236283887618/MdcUCBlQ?format=jpg&name=150x150', 'width': 150, 'height': 150}], 'status': 200, 'title': 'Play Fortnite | Xbox Cloud Gaming (Beta) on Xbox.com', 'description': 'Play Fortnite with Xbox Cloud Gaming (Beta). Join the Resistance in the final battle to free the Zero Point! The IO has lined up guards and sky stations, but the Resistance is equipped with new tactics like sprinting, mantling, and more. Board an Armored Battle Bus to be a powerful force or attach a Cow Catcher to your truck for extra ramming power. Take on your opponents in the ultimate battle for the Zero Point in Chapter 3 Season 2: Resistance! Fortnite is the always evolving, multiplayer game where you and your friends battle to be the last one standing or collaborate to create your dream Fortnite world. Play both Battle Royale and Fortnite Creative for free or purchase Fortnite’s PvE Campaign mode, Save the World. Download now and jump into the action.', 'unwound_url': 'https://www.xbox.com/en-US/play/games/fortnite/BT5P2X999VH2?ocid=Fortnite_soc_omc_xbo_tw_Video_dlo_5.5.2'}, {'start': 194, 'end': 217, 'url': 'https://t.co/P5x4NneZmw', 'expanded_url': 'https://twitter.com/Xbox/status/1522246156696182784/video/1', 'display_url': 'pic.twitter.com/P5x4NneZmw', 'media_key': '13_1522239940196675584'}]}",{'media_keys': ['13_1522239940196675584']},False,,everyone,Twitter Media Studio
1522090812518981638,902529968269279232,"people who have high bedwars/skywars stars, how much xp do gou average a game and how long is each game on average",2022-05-05 05:48:23+00:00,,0,3,1,0,en,1522090812518981638,[],,,False,,everyone,Twitter for iPhone
1522247124590772229,4854388066,@marianomike @Roblox @EGOTISMS_RBLX Yayyyyy ego!!!,2022-05-05 16:09:31+00:00,,0,1,1,0,en,1522236966896488453,"[{'domain': {'id': '71', 'name': 'Video Game', 'description': 'A video game like Overwatch'}, 'entity': {'id': '1088118927580774400', 'name': 'Roblox', 'description': 'Roblox'}}]","{'mentions': [{'start': 0, 'end': 12, 'username': 'marianomike', 'id': '14989091'}, {'start': 13, 'end': 20, 'username': 'Roblox', 'id': '16745055'}, {'start': 21, 'end': 35, 'username': 'EGOTISMS_RBLX', 'id': '848945786389966853'}]}",,False,,everyone,Twitter Web App
1522246904280670208,2874048832,@marianomike @Roblox @EGOTISMS_RBLX Congrats EGOTISMS!,2022-05-05 16:08:38+00:00,,0,1,1,0,en,1522236966896488453,"[{'domain': {'id': '71', 'name': 'Video Game', 'description': 'A video game like Overwatch'}, 'entity': {'id': '1088118927580774400', 'name': 'Roblox', 'description': 'Roblox'}}]","{'mentions': [{'start': 0, 'end': 12, 'username': 'marianomike', 'id': '14989091'}, {'start': 13, 'end': 20, 'username': 'Roblox', 'id': '16745055'}, {'start': 21, 'end': 35, 'username': 'EGOTISMS_RBLX', 'id': '848945786389966853'}]}",,False,,everyone,Twitter Web App
1522246774819364867,3368231362,@marianomike @Roblox @EGOTISMS_RBLX WOOOOOOOOO Well done!!!,2022-05-05 16:08:07+00:00,,0,1,2,0,en,1522236966896488453,"[{'domain': {'id': '71', 'name': 'Video Game', 'description': 'A video game like Overwatch'}, 'entity': {'id': '1088118927580774400', 'name': 'Roblox', 'description': 'Roblox'}}]","{'mentions': [{'start': 0, 'end': 12, 'username': 'marianomike', 'id': '14989091'}, {'start': 13, 'end': 20, 'username': 'Roblox', 'id': '16745055'}, {'start': 21, 'end': 35, 'username': 'EGOTISMS_RBLX', 'id': '848945786389966853'}]}",,False,,everyone,Twitter Web App
1522215178380533763,1454529351995772932,@specialedllama @Roblox LOL because I like to change my avatar daily! 🖤,2022-05-05 14:02:34+00:00,,0,1,1,0,en,1522061503788195847,"[{'domain': {'id': '71', 'name': 'Video Game', 'description': 'A video game like Overwatch'}, 'entity': {'id': '1088118927580774400', 'name': 'Roblox', 'description': 'Roblox'}}]","{'mentions': [{'start': 0, 'end': 15, 'username': 'specialedllama', 'id': '1387520283607769092'}, {'start': 16, 'end': 23, 'username': 'Roblox', 'id': '16745055'}]}",,False,,everyone,Twitter Web App
1522244693022625792,1325887443254587402,Why does roblox keep crashing?,2022-05-05 15:59:51+00:00,,0,2,5,0,en,1522244693022625792,"[{'domain': {'id': '71', 'name': 'Video Game', 'description': 'A video game like Overwatch'}, 'entity': {'id': '1088118927580774400', 'name': 'Roblox', 'description': 'Roblox'}}]",,,False,,everyone,Twitter Web App
1521981278613999616,3075806400,"After 4 incredible years, today is my last day @Roblox

Building the Roblox Video Stars program and working with this wonderful community of creators was a joy and privilege. I'm so proud of everything we accomplished together!

#MayThe4thBeWithYou. Always. https://t.co/HxYMFXYkup",2022-05-04 22:33:08+00:00,,177,225,3285,17,en,1521981278613999616,"[{'domain': {'id': '29', 'name': 'Events [Entity Service]', 'description': 'Entity Service related Events domain'}, 'entity': {'id': '1511289278550085638', 'name': 'May The Fourth Be With You 2022', 'description': 'This May The Fourth Be With You entity will include all conversations for all years'}}, {'domain': {'id': '71', 'name': 'Video Game', 'description': 'A video game like Overwatch'}, 'entity': {'id': '1088118927580774400', 'name': 'Roblox', 'description': 'Roblox'}}]","{'mentions': [{'start': 47, 'end': 54, 'username': 'Roblox', 'id': '16745055'}], 'hashtags': [{'start': 229, 'end': 248, 'tag': 'MayThe4thBeWithYou'}], 'urls': [{'start': 258, 'end': 281, 'url': 'https://t.co/HxYMFXYkup', 'expanded_url': 'https://twitter.com/rodvelloso/status/1521981278613999616/photo/1', 'display_url': 'pic.twitter.com/HxYMFXYkup', 'media_key': '3_1521981275266985984'}]}",{'media_keys': ['3_1521981275266985984']},False,,everyone,Twitter for Android
1522060874567065601,3541877712,"I AM FUMING, ROBLOX DELETED MY LASHES😭😭😭FIRST MY CHEST SHADINGS NOW MY LASHES im crying, now i look like a hairless bald eye rat https://t.co/OLteP3hC50",2022-05-05 03:49:25+00:00,,11,65,510,2,en,1522060874567065601,"[{'domain': {'id': '71', 'name': 'Video Game', 'description': 'A video game like Overwatch'}, 'entity': {'id': '1088118927580774400', 'name': 'Roblox', 'description': 'Roblox'}}]","{'urls': [{'start': 129, 'end': 152, 'url': 'https://t.co/OLteP3hC50', 'expanded_url': 'https://twitter.com/IBellaYT/status/1522060874567065601/photo/1', 'display_url': 'pic.twitter.com/OLteP3hC50', 'media_key': '3_1522060745449652225'}]}",{'media_keys': ['3_1522060745449652225']},False,,everyone,Twitter Web App
1521773341182361601,1400238715805470723,https://t.co/bVcJ2oAecJ,2022-05-04 08:46:52+00:00,,20200,222,82783,921,zxx,1521773341182361601,[],"{'urls': [{'start': 0, 'end': 23, 'url': 'https://t.co/bVcJ2oAecJ', 'expanded_url': 'https://twitter.com/MojangPigFacts/status/1521773341182361601/video/1', 'display_url': 'pic.twitter.com/bVcJ2oAecJ', 'media_key': '7_1521772998381899777'}]}",{'media_keys': ['7_1521772998381899777']},False,,everyone,Twitter for Android
1521627509116309504,1408340269087535104,Roblox is currently experiencing issues right now. #RobloxDown,2022-05-03 23:07:23+00:00,,674,2369,10331,154,en,1521627509116309504,"[{'domain': {'id': '71', 'name': 'Video Game', 'description': 'A video game like Overwatch'}, 'entity': {'id': '1088118927580774400', 'name': 'Roblox', 'description': 'Roblox'}}]","{'hashtags': [{'start': 51, 'end': 62, 'tag': 'RobloxDown'}], 'annotations': [{'start': 0, 'end': 5, 'probability': 0.3527, 'type': 'Organization', 'normalized_text': 'Roblox'}]}",,False,,everyone,Twitter for iPhone
1522246886001811457,2480033480,"4/ We've seen many other brands create a Roblox strategy like @Nike's NIKELAND, @Vans' Vans World, and @ChipotleTweets' Burrito Event.",2022-05-05 16:08:34+00:00,,0,1,0,0,en,1522246881929179136,"[{'domain': {'id': '45', 'name': 'Brand Vertical', 'description': 'Top level entities that describe a Brands industry'}, 'entity': {'id': '781974596161376261', 'name': 'Dining'}}, {'domain': {'id': '46', 'name': 'Brand Category', 'description': 'Categories within Brand Verticals that narrow down the scope of Brands'}, 'entity': {'id': '781974597017083904', 'name': 'QSR'}}, {'domain': {'id': '47', 'name': 'Brand', 'description': 'Brands and Companies'}, 'entity': {'id': '10027202349', 'name': 'Chipotle'}}, {'domain': {'id': '71', 'name': 'Video Game', 'description': 'A video game like Overwatch'}, 'entity': {'id': '1088118927580774400', 'name': 'Roblox', 'description': 'Roblox'}}, {'domain': {'id': '46', 'name': 'Brand Category', 'description': 'Categories within Brand Verticals that narrow down the scope of Brands'}, 'entity': {'id': '781974596807299072', 'name': 'Apparel/Accessories'}}, {'domain': {'id': '47', 'name': 'Brand', 'description': 'Brands and Companies'}, 'entity': {'id': '10024011481', 'name': 'Vans'}}, {'domain': {'id': '67', 'name': 'Interests and Hobbies', 'description': 'Interests, opinions, and behaviors of individuals, groups, or cultures; like Speciality Cooking or Theme Parks'}, 'entity': {'id': '839543390668673024', 'name': 'Fashion'}}]","{'mentions': [{'start': 62, 'end': 67, 'username': 'Nike', 'id': '415859364'}, {'start': 80, 'end': 85, 'username': 'Vans', 'id': '15383636'}, {'start': 103, 'end': 118, 'username': 'ChipotleTweets', 'id': '141341662'}], 'annotations': [{'start': 41, 'end': 46, 'probability': 0.5534, 'type': 'Product', 'normalized_text': 'Roblox'}]}",,False,,everyone,Twitter Web App
1522246884655439872,2480033480,"3/ The first experience, K-Park, will launch this Spring and will be centered all around K-Pop, featuring Stray Kids and SUNMI.",2022-05-05 16:08:33+00:00,,0,1,0,0,en,1522246881929179136,"[{'domain': {'id': '55', 'name': 'Music Genre', 'description': 'A category for a musical style, like Pop, Rock, or Rap'}, 'entity': {'id': '888105153038958593', 'name': 'K-pop', 'description': 'K-Pop'}}]","{'annotations': [{'start': 106, 'end': 115, 'probability': 0.2787, 'type': 'Person', 'normalized_text': 'Stray Kids'}, {'start': 121, 'end': 125, 'probability': 0.7771, 'type': 'Person', 'normalized_text': 'SUNMI'}]}",,False,,everyone,Twitter Web App
1522179091134402562,1091503634771267584,@Roblox should add this 😆 https://t.co/VrSPyRSqo5,2022-05-05 11:39:10+00:00,,0,1,1,0,en,1522179091134402562,"[{'domain': {'id': '46', 'name': 'Brand Category', 'description': 'Categories within Brand Verticals that narrow down the scope of Brands'}, 'entity': {'id': '781974596157181956', 'name': 'Online Site'}}, {'domain': {'id': '47', 'name': 'Brand', 'description': 'Brands and Companies'}, 'entity': {'id': '1286296657135468545', 'name': 'TikTok'}}, {'domain': {'id': '71', 'name': 'Video Game', 'description': 'A video game like Overwatch'}, 'entity': {'id': '1088118927580774400', 'name': 'Roblox', 'description': 'Roblox'}}]","{'mentions': [{'start': 0, 'end': 7, 'username': 'Roblox', 'id': '16745055'}], 'urls': [{'start': 26, 'end': 49, 'url': 'https://t.co/VrSPyRSqo5', 'expanded_url': 'https://twitter.com/xNekorii/status/1521905160511016960', 'display_url': 'twitter.com/xNekorii/statu…'}]}",,False,,everyone,Twitter for Android
1522233773328371716,865593156288602112,"Mutuals only!

Who wants to friend me on Roblox? 🤔 https://t.co/jVOkvFqEvJ",2022-05-05 15:16:27+00:00,,9,33,140,5,en,1522233773328371716,"[{'domain': {'id': '71', 'name': 'Video Game', 'description': 'A video game like Overwatch'}, 'entity': {'id': '1088118927580774400', 'name': 'Roblox', 'description': 'Roblox'}}]","{'annotations': [{'start': 41, 'end': 46, 'probability': 0.5511, 'type': 'Product', 'normalized_text': 'Roblox'}], 'urls': [{'start': 51, 'end': 74, 'url': 'https://t.co/jVOkvFqEvJ', 'expanded_url': 'https://twitter.com/Jonah_RBX/status/1522233773328371716/photo/1', 'display_url': 'pic.twitter.com/jVOkvFqEvJ', 'media_key': '3_1522233551739133956'}]}",{'media_keys': ['3_1522233551739133956']},False,,following,Twitter Web App
1522171925224517634,1091122540087369729,@VelanteG @NFLTycoon @Roblox @NFL @Melonverse Same for me i can't get NFL Black jacket one. This game completely broken since release.,2022-05-05 11:10:42+00:00,,0,2,0,0,en,1521935538797916160,"[{'domain': {'id': '3', 'name': 'TV Shows', 'description': 'Television shows from around the world'}, 'entity': {'id': '10000612773', 'name': 'NFL Football', 'description': 'Replays of classic NFL games.'}}, {'domain': {'id': '3', 'name': 'TV Shows', 'description': 'Television shows from around the world'}, 'entity': {'id': '10032425201', 'name': 'NFL Football'}}, {'domain': {'id': '3', 'name': 'TV Shows', 'description': 'Television shows from around the world'}, 'entity': {'id': '10033407327', 'name': 'Futebol NFL'}}, {'domain': {'id': '3', 'name': 'TV Shows', 'description': 'Television shows from around the world'}, 'entity': {'id': '10042261464', 'name': 'Fútbol Americano de la NFL'}}, {'domain': {'id': '11', 'name': 'Sport', 'description': 'Types of sports, like soccer and basketball'}, 'entity': {'id': '689566306014617600', 'name': 'American football'}}, {'domain': {'id': '26', 'name': 'Sports League', 'description': ''}, 'entity': {'id': '689566314835259392', 'name': 'NFL'}}, {'domain': {'id': '71', 'name': 'Video Game', 'description': 'A video game like Overwatch'}, 'entity': {'id': '1088118927580774400', 'name': 'Roblox', 'description': 'Roblox'}}, {'domain': {'id': '45', 'name': 'Brand Vertical', 'description': 'Top level entities that describe a Brands industry'}, 'entity': {'id': '781974597310615553', 'name': 'Entertainment'}}, {'domain': {'id': '46', 'name': 'Brand Category', 'description': 'Categories within Brand Verticals that narrow down the scope of Brands'}, 'entity': {'id': '781974597491040257', 'name': 'Sports'}}, {'domain': {'id': '47', 'name': 'Brand', 'description': 'Brands and Companies'}, 'entity': {'id': '10042758256', 'name': 'NFL'}}]","{'mentions': [{'start': 0, 'end': 9, 'username': 'VelanteG', 'id': '1339460189997522944'}, {'start': 10, 'end': 20, 'username': 'NFLTycoon', 'id': '1488582104443142156'}, {'start': 21, 'end': 28, 'username': 'Roblox', 'id': '16745055'}, {'start': 29, 'end': 33, 'username': 'NFL', 'id': '19426551'}, {'start': 34, 'end': 45, 'username': 'Melonverse', 'id': '864655911037657088'}], 'annotations': [{'start': 70, 'end': 72, 'probability': 0.4856, 'type': 'Organization', 'normalized_text': 'NFL'}]}",,False,,everyone,Twitter Web App
1521918532006596610,1521914056688517122,@KonekoKittenYT @Roblox i just got scammed for 305.07 dollars can you guys help me by any chance....,2022-05-04 18:23:48+00:00,,0,2,0,0,en,1521918532006596610,"[{'domain': {'id': '71', 'name': 'Video Game', 'description': 'A video game like Overwatch'}, 'entity': {'id': '1088118927580774400', 'name': 'Roblox', 'description': 'Roblox'}}]","{'mentions': [{'start': 0, 'end': 15, 'username': 'KonekoKittenYT', 'id': '740824468541571072'}, {'start': 16, 'end': 23, 'username': 'Roblox', 'id': '16745055'}]}",,False,,everyone,Twitter Web App
1522231652138766336,1286054959599976450,nothing is funnier than grown adults crying about Minecraft Steve https://t.co/VKteknOME6,2022-05-05 15:08:02+00:00,,13,12,292,1,en,1522231652138766336,"[{'domain': {'id': '45', 'name': 'Brand Vertical', 'description': 'Top level entities that describe a Brands industry'}, 'entity': {'id': '781974597310615553', 'name': 'Entertainment'}}, {'domain': {'id': '46', 'name': 'Brand Category', 'description': 'Categories within Brand Verticals that narrow down the scope of Brands'}, 'entity': {'id': '781974597218340864', 'name': 'Video Games'}}, {'domain': {'id': '71', 'name': 'Video Game', 'description': 'A video game like Overwatch'}, 'entity': {'id': '10043689888', 'name': 'Minecraft'}}]","{'annotations': [{'start': 50, 'end': 64, 'probability': 0.5835, 'type': 'Person', 'normalized_text': 'Minecraft Steve'}], 'urls': [{'start': 66, 'end': 89, 'url': 'https://t.co/VKteknOME6', 'expanded_url': 'https://twitter.com/ScrubQuotesX/status/1522227586956664833', 'display_url': 'twitter.com/ScrubQuotesX/s…'}]}",,False,,everyone,Twitter for iPhone
1522075285092503554,1078203950770388992,"@kade_builder @Roblox This isn't about earning it in a day jade, it's much bigger problem that you currently do not understand for X amount of reasons",2022-05-05 04:46:41+00:00,,0,2,5,0,en,1521728064987688960,"[{'domain': {'id': '71', 'name': 'Video Game', 'description': 'A video game like Overwatch'}, 'entity': {'id': '1088118927580774400', 'name': 'Roblox', 'description': 'Roblox'}}]","{'mentions': [{'start': 0, 'end': 13, 'username': 'kade_builder', 'id': '1318083200321728515'}, {'start': 14, 'end': 21, 'username': 'Roblox', 'id': '16745055'}]}",,False,,everyone,Twitter for Android
1522004562563014658,1056053249470541824,"Prop Hunt by https://t.co/3MpSwqWdsN - The studio behind Roblox Bedwars, &amp; Islands - has shut down just a few days after release. They’ve been doing some thinking, and the game doesn’t set out what they want to build. Although, they may visit prop hunt in the future. 🪦 https://t.co/9q0Y43qsgo",2022-05-05 00:05:39+00:00,,61,117,1638,9,en,1522004562563014658,"[{'domain': {'id': '71', 'name': 'Video Game', 'description': 'A video game like Overwatch'}, 'entity': {'id': '1088118927580774400', 'name': 'Roblox', 'description': 'Roblox'}}]","{'annotations': [{'start': 57, 'end': 81, 'probability': 0.5929, 'type': 'Organization', 'normalized_text': 'Roblox Bedwars, & Islands'}], 'urls': [{'start': 13, 'end': 36, 'url': 'https://t.co/3MpSwqWdsN', 'expanded_url': 'http://easy.gg', 'display_url': 'easy.gg', 'status': 200, 'title': 'Easy Games', 'unwound_url': 'https://easy.gg/'}, {'start': 274, 'end': 297, 'url': 'https://t.co/9q0Y43qsgo', 'expanded_url': 'https://twitter.com/Roblox_RTC/status/1522004562563014658/photo/1', 'display_url': 'pic.twitter.com/9q0Y43qsgo', 'media_key': '3_1522004560025370631'}, {'start': 274, 'end': 297, 'url': 'https://t.co/9q0Y43qsgo', 'expanded_url': 'https://twitter.com/Roblox_RTC/status/1522004562563014658/photo/1', 'display_url': 'pic.twitter.com/9q0Y43qsgo', 'media_key': '3_1522004560017072130'}]}","{'media_keys': ['3_1522004560025370631', '3_1522004560017072130']}",False,,everyone,Twitter for iPhone
1520428041482121216,1492181230065885184,There is no sound. Btw here's the full vid. Becareful peeps :/ https://t.co/bZhl1LlXPP,2022-04-30 15:41:07+00:00,,7278,19409,79830,845,en,1520428041482121216,[],"{'urls': [{'start': 63, 'end': 86, 'url': 'https://t.co/bZhl1LlXPP', 'expanded_url': 'https://twitter.com/Yo_nanay/status/1520428041482121216/video/1', 'display_url': 'pic.twitter.com/bZhl1LlXPP', 'media_key': '7_1520427594776080384'}]}",{'media_keys': ['7_1520427594776080384']},True,,everyone,Twitter for Android
