tweetid,author_id,text,created_at,geo,retweets,replies,likes,quote_count,lang,conversation_id,context_annotations,entities,attachments,possibly_sensitive,withheld,reply_settings,source
1518259386275315712,1273514763813781504,vittu että voin pelata paskasti,2022-04-24 16:03:40+00:00,,0,18,53,0,fi,1518259386275315712,[],,,False,,everyone,Twitter Web App
1509629460147945474,16745055,"Shout out to @parrygripp. Along with 6 of his other catchy songs, the iconic ‘’Raining Tacos’’ is now back in the catalog.",2022-03-31 20:31:25+00:00,,1036,1392,12323,253,en,1509576982962581511,"[{'domain': {'id': '71', 'name': 'Video Game', 'description': 'A video game like Overwatch'}, 'entity': {'id': '1088118927580774400', 'name': 'Roblox', 'description': 'Roblox'}}]","{'mentions': [{'start': 13, 'end': 24, 'username': 'parrygripp', 'id': '34342176'}], 'annotations': [{'start': 79, 'end': 91, 'probability': 0.7231, 'type': 'Other', 'normalized_text': 'Raining Tacos'}]}",,False,,everyone,Twitter Web App
1516910351740067840,16745055,"Whoever you are on Roblox, this puffer jacket comes in your size. Match with any look you want to create a style of your own: https://t.co/nNxda3j0KB https://t.co/RakqDRKgIR",2022-04-20 22:43:05+00:00,,197,1138,4168,28,en,1516910351740067840,"[{'domain': {'id': '71', 'name': 'Video Game', 'description': 'A video game like Overwatch'}, 'entity': {'id': '1088118927580774400', 'name': 'Roblox', 'description': 'Roblox'}}]","{'annotations': [{'start': 19, 'end': 24, 'probability': 0.6263, 'type': 'Product', 'normalized_text': 'Roblox'}], 'urls': [{'start': 126, 'end': 149, 'url': 'https://t.co/nNxda3j0KB', 'expanded_url': 'https://rblx.co/puffer-jackets', 'display_url': 'rblx.co/puffer-jackets', 'images': [{'url': 'https://pbs.twimg.com/news_img/1521760632814530560/mlwwGbux?format=jpg&name=orig', 'width': 1200, 'height': 630}, {'url': 'https://pbs.twimg.com/news_img/1521760632814530560/mlwwGbux?format=jpg&name=150x150', 'width': 150, 'height': 150}], 'status': 200, 'title': 'Roblox', 'description': 'Customize your avatar with a never-ending variety of clothing options, accessories, gear, and more!', 'unwound_url': 'https://www.roblox.com/catalog?Keyword=puffer&Category=1'}, {'start': 150, 'end': 173, 'url': 'https://t.co/RakqDRKgIR', 'expanded_url': 'https://twitter.com/Roblox/status/1516910351740067840/photo/1', 'display_url': 'pic.twitter.com/RakqDRKgIR', 'media_key': '3_1516910263642910720'}]}",{'media_keys': ['3_1516910263642910720']},False,,everyone,Twitter Web App
1518262748030947329,1470947830554583042,pensando se vou pro omegle ou se vou jogar roblox,2022-04-24 16:17:01+00:00,,0,2,0,0,pt,1518262748030947329,"[{'domain': {'id': '46', 'name': 'Brand Category', 'description': 'Categories within Brand Verticals that narrow down the scope of Brands'}, 'entity': {'id': '781974596157181956', 'name': 'Online Site'}}, {'domain': {'id': '47', 'name': 'Brand', 'description': 'Brands and Companies'}, 'entity': {'id': '1290262162057789443', 'name': 'Omegle'}}, {'domain': {'id': '71', 'name': 'Video Game', 'description': 'A video game like Overwatch'}, 'entity': {'id': '1088118927580774400', 'name': 'Roblox', 'description': 'Roblox'}}]",,,False,,everyone,Twitter for iPhone
1517481461984673797,3541877712,uhhhh a random game i did not make is on my roblox profile?? literally scared to touch it or something https://t.co/qZFNl3U1jm,2022-04-22 12:32:28+00:00,,9,64,486,3,en,1517481461984673797,"[{'domain': {'id': '71', 'name': 'Video Game', 'description': 'A video game like Overwatch'}, 'entity': {'id': '1088118927580774400', 'name': 'Roblox', 'description': 'Roblox'}}]","{'urls': [{'start': 103, 'end': 126, 'url': 'https://t.co/qZFNl3U1jm', 'expanded_url': 'https://twitter.com/IBellaYT/status/1517481461984673797/photo/1', 'display_url': 'pic.twitter.com/qZFNl3U1jm', 'media_key': '3_1517481423602692096'}]}",{'media_keys': ['3_1517481423602692096']},False,,everyone,Twitter Web App
1518258604780015616,1162494706066046977,What's your #1 favorite #Roblox game right now?,2022-04-24 16:00:33+00:00,,38,783,1110,18,en,1518258604780015616,"[{'domain': {'id': '71', 'name': 'Video Game', 'description': 'A video game like Overwatch'}, 'entity': {'id': '1088118927580774400', 'name': 'Roblox', 'description': 'Roblox'}}]","{'hashtags': [{'start': 24, 'end': 31, 'tag': 'Roblox'}]}",,False,,everyone,Buffer
1518228265344901120,1199001259904307207,Do you want to see NFTs on Roblox? 🤔👇,2022-04-24 14:00:00+00:00,,88,1875,2555,154,en,1518228265344901120,"[{'domain': {'id': '66', 'name': 'Interests and Hobbies Category', 'description': 'A grouping of interests and hobbies entities, like Novelty Food or Destinations'}, 'entity': {'id': '913142676819648512', 'name': 'Cryptocurrencies', 'description': 'Cryptocurrency'}}, {'domain': {'id': '71', 'name': 'Video Game', 'description': 'A video game like Overwatch'}, 'entity': {'id': '1088118927580774400', 'name': 'Roblox', 'description': 'Roblox'}}]","{'annotations': [{'start': 19, 'end': 22, 'probability': 0.6002, 'type': 'Person', 'normalized_text': 'NFTs'}, {'start': 27, 'end': 32, 'probability': 0.4867, 'type': 'Product', 'normalized_text': 'Roblox'}]}",,False,,everyone,Twitter Web App
1518260081577672706,1382766223977500673,"Pinned I think idk

hi I'm Felix_TND 

Here's some things about me

○ I make bad jokes and I love drawing
○ I very much love roblox, among us and fnf 
○ I also really like mario, sonic and pokemon. Same with many other indie games.
○ I am Bisexual (men and women enjoyer)",2022-04-24 16:06:26+00:00,,0,5,15,0,en,1518260081577672706,"[{'domain': {'id': '45', 'name': 'Brand Vertical', 'description': 'Top level entities that describe a Brands industry'}, 'entity': {'id': '781974597310615553', 'name': 'Entertainment'}}, {'domain': {'id': '46', 'name': 'Brand Category', 'description': 'Categories within Brand Verticals that narrow down the scope of Brands'}, 'entity': {'id': '781974597218340864', 'name': 'Video Games'}}, {'domain': {'id': '71', 'name': 'Video Game', 'description': 'A video game like Overwatch'}, 'entity': {'id': '854952148374663168', 'name': 'Super Mario', 'description': 'This entity includes all conversation about the franchise, as well as any individual installments in the series, if applicable.\t\t\t'}}, {'domain': {'id': '71', 'name': 'Video Game', 'description': 'A video game like Overwatch'}, 'entity': {'id': '1088118927580774400', 'name': 'Roblox', 'description': 'Roblox'}}, {'domain': {'id': '71', 'name': 'Video Game', 'description': 'A video game like Overwatch'}, 'entity': {'id': '1308398176978698241', 'name': 'Among Us'}}, {'domain': {'id': '130', 'name': 'Multimedia Franchise', 'description': ""Franchises which span multiple forms of media like 'Harry Potter'""}, 'entity': {'id': '10045599546', 'name': 'Pokémon', 'description': 'This entity includes all conversation about the franchise, as well as any individual installments in the series, if applicable. **NOTE: Annotations redirected to domain 130 ONLY on 8/7/18.'}}, {'domain': {'id': '130', 'name': 'Multimedia Franchise', 'description': ""Franchises which span multiple forms of media like 'Harry Potter'""}, 'entity': {'id': '993952643209773057', 'name': 'Sonic the Hedgehog', 'description': 'This entity includes all conversation about the franchise, as well as any individual installments in the series, if applicable.\t\t\t\n\nNOTE: Stopped annotating in the Video Game domain (71) on 11/15/19. Moving forward, this entity will annotate to Multimedia Franchise domain (130) only.'}}]",,,False,,everyone,Twitter for Android
1508804530242265089,1333978396716576771,https://t.co/8hMe8wXiDp,2022-03-29 13:53:26+00:00,,1098,128,13346,85,zxx,1508804530242265089,[],"{'urls': [{'start': 0, 'end': 23, 'url': 'https://t.co/8hMe8wXiDp', 'expanded_url': 'https://twitter.com/ContextoRoblox/status/1508804530242265089/photo/1', 'display_url': 'pic.twitter.com/8hMe8wXiDp', 'media_key': '3_1508802416753397773'}]}",{'media_keys': ['3_1508802416753397773']},False,,everyone,Twitter Web App
1517571532570378240,16745055,@chizeled_ See! You just need to trust us.,2022-04-22 18:30:23+00:00,,16,95,718,3,en,1517213841695911936,"[{'domain': {'id': '71', 'name': 'Video Game', 'description': 'A video game like Overwatch'}, 'entity': {'id': '1088118927580774400', 'name': 'Roblox', 'description': 'Roblox'}}]","{'mentions': [{'start': 0, 'end': 10, 'username': 'chizeled_', 'id': '1255111848518651904'}]}",,False,,everyone,Twitter Web App
1518202797086367744,1056053249470541824,"📍 My Hello Kitty Cafe, an official game by Sanrio &amp; @RockPandaGames , releases officially on Roblox, on April 25th, 4:30 PM PST. https://t.co/O2JWqRaXRq",2022-04-24 12:18:48+00:00,,237,231,2274,81,en,1518202797086367744,"[{'domain': {'id': '10', 'name': 'Person', 'description': 'Named people in the world like Nelson Mandela'}, 'entity': {'id': '1443277565393719296', 'name': 'Hello Kitty'}}, {'domain': {'id': '45', 'name': 'Brand Vertical', 'description': 'Top level entities that describe a Brands industry'}, 'entity': {'id': '781974596706635776', 'name': 'Retail'}}, {'domain': {'id': '46', 'name': 'Brand Category', 'description': 'Categories within Brand Verticals that narrow down the scope of Brands'}, 'entity': {'id': '781974597302296576', 'name': 'Specialty'}}, {'domain': {'id': '47', 'name': 'Brand', 'description': 'Brands and Companies'}, 'entity': {'id': '1038116841485303808', 'name': 'Sanrio', 'description': 'Sanrio (サンリオ)'}}, {'domain': {'id': '47', 'name': 'Brand', 'description': 'Brands and Companies'}, 'entity': {'id': '1443277565393719296', 'name': 'Hello Kitty'}}, {'domain': {'id': '65', 'name': 'Interests and Hobbies Vertical', 'description': 'Top level interests and hobbies groupings, like Food or Travel'}, 'entity': {'id': '834828264786898945', 'name': 'Drinks', 'description': 'Drinks'}}, {'domain': {'id': '66', 'name': 'Interests and Hobbies Category', 'description': 'A grouping of interests and hobbies entities, like Novelty Food or Destinations'}, 'entity': {'id': '834828445238431744', 'name': 'Generic Drinks', 'description': 'Generic Drinks'}}, {'domain': {'id': '67', 'name': 'Interests and Hobbies', 'description': 'Interests, opinions, and behaviors of individuals, groups, or cultures; like Speciality Cooking or Theme Parks'}, 'entity': {'id': '850442647088971776', 'name': 'Coffee', 'description': 'Coffee'}}, {'domain': {'id': '71', 'name': 'Video Game', 'description': 'A video game like Overwatch'}, 'entity': {'id': '1088118927580774400', 'name': 'Roblox', 'description': 'Roblox'}}, {'domain': {'id': '122', 'name': 'Fictional Character', 'description': 'A person or other being in a narrative work of art, like Tom Sawyer or Jon Snow'}, 'entity': {'id': '1443277565393719296', 'name': 'Hello Kitty'}}, {'domain': {'id': '65', 'name': 'Interests and Hobbies Vertical', 'description': 'Top level interests and hobbies groupings, like Food or Travel'}, 'entity': {'id': '834828264786898945', 'name': 'Drinks', 'description': 'Drinks'}}, {'domain': {'id': '66', 'name': 'Interests and Hobbies Category', 'description': 'A grouping of interests and hobbies entities, like Novelty Food or Destinations'}, 'entity': {'id': '834828445238431744', 'name': 'Generic Drinks', 'description': 'Generic Drinks'}}, {'domain': {'id': '67', 'name': 'Interests and Hobbies', 'description': 'Interests, opinions, and behaviors of individuals, groups, or cultures; like Speciality Cooking or Theme Parks'}, 'entity': {'id': '850442647088971776', 'name': 'Coffee', 'description': 'Coffee'}}]","{'mentions': [{'start': 56, 'end': 71, 'username': 'RockPandaGames', 'id': '1327135818390114305'}], 'annotations': [{'start': 12, 'end': 21, 'probability': 0.2269, 'type': 'Other', 'normalized_text': 'Kitty Cafe'}, {'start': 44, 'end': 49, 'probability': 0.682, 'type': 'Organization', 'normalized_text': 'Sanrio'}, {'start': 94, 'end': 99, 'probability': 0.3175, 'type': 'Other', 'normalized_text': 'Roblox'}], 'urls': [{'start': 133, 'end': 156, 'url': 'https://t.co/O2JWqRaXRq', 'expanded_url': 'https://twitter.com/Roblox_RTC/status/1518202797086367744/photo/1', 'display_url': 'pic.twitter.com/O2JWqRaXRq', 'media_key': '3_1518202793957470210'}]}",{'media_keys': ['3_1518202793957470210']},False,,everyone,Twitter for iPhone
1518254935359508482,1071938981389045765,"🔥 Last Twitter giveaway! 🎉

75k in-game cash to two people! Like, reply with your favorite car in-game, and make sure you are following to enter! 

Head down to https://t.co/9r9mU2foQI as we will be having two $25 Roblox gift card giveaways today! (One hosted by @McSlothYT)",2022-04-24 15:45:59+00:00,,46,345,535,1,en,1518254935359508482,"[{'domain': {'id': '71', 'name': 'Video Game', 'description': 'A video game like Overwatch'}, 'entity': {'id': '1088118927580774400', 'name': 'Roblox', 'description': 'Roblox'}}, {'domain': {'id': '46', 'name': 'Brand Category', 'description': 'Categories within Brand Verticals that narrow down the scope of Brands'}, 'entity': {'id': '781974596752842752', 'name': 'Services'}}, {'domain': {'id': '47', 'name': 'Brand', 'description': 'Brands and Companies'}, 'entity': {'id': '10045225402', 'name': 'Twitter'}}]","{'mentions': [{'start': 263, 'end': 273, 'username': 'McSlothYT', 'id': '1307365319850291202'}], 'annotations': [{'start': 8, 'end': 14, 'probability': 0.6723, 'type': 'Product', 'normalized_text': 'Twitter'}], 'urls': [{'start': 161, 'end': 184, 'url': 'https://t.co/9r9mU2foQI', 'expanded_url': 'http://discord.gg/PRC', 'display_url': 'discord.gg/PRC', 'status': 200, 'title': 'Discord - A New Way to Chat with Friends & Communities', 'description': 'Discord is the easiest way to communicate over voice, video, and text. Chat, hang out, and stay close with your friends and communities.', 'unwound_url': 'https://discord.com/invite/PRC'}]}",,False,,everyone,Twitter for iPhone
1518079833577861120,1071938981389045765,"🔥 Like this tweet, reply with your Roblox username, and follow our Twitter for a chance to win 50,000 in-game cash! (3 winners, ends evening of 4/24)",2022-04-24 04:10:11+00:00,,62,559,858,1,en,1518079833577861120,"[{'domain': {'id': '71', 'name': 'Video Game', 'description': 'A video game like Overwatch'}, 'entity': {'id': '1088118927580774400', 'name': 'Roblox', 'description': 'Roblox'}}, {'domain': {'id': '46', 'name': 'Brand Category', 'description': 'Categories within Brand Verticals that narrow down the scope of Brands'}, 'entity': {'id': '781974596752842752', 'name': 'Services'}}, {'domain': {'id': '47', 'name': 'Brand', 'description': 'Brands and Companies'}, 'entity': {'id': '10045225402', 'name': 'Twitter'}}]","{'annotations': [{'start': 36, 'end': 41, 'probability': 0.7098, 'type': 'Product', 'normalized_text': 'Roblox'}, {'start': 68, 'end': 74, 'probability': 0.7998, 'type': 'Product', 'normalized_text': 'Twitter'}]}",,False,,everyone,Twitter for iPhone
1518198986171166721,1199001259904307207,"Chief Business Officer Craig Donato says #Roblox may implement #NFTs to the platform in the future. 👀

Article (@VentureBeat): https://t.co/viEyRtRnWY (via: @Roblox_RTC + @chris12902) https://t.co/MQNBxuiAXr",2022-04-24 12:03:39+00:00,,27,217,381,55,en,1518198986171166721,"[{'domain': {'id': '46', 'name': 'Brand Category', 'description': 'Categories within Brand Verticals that narrow down the scope of Brands'}, 'entity': {'id': '781974596157181956', 'name': 'Online Site'}}, {'domain': {'id': '47', 'name': 'Brand', 'description': 'Brands and Companies'}, 'entity': {'id': '1066423866354847745', 'name': 'VentureBeat', 'description': 'VentureBeat'}}, {'domain': {'id': '66', 'name': 'Interests and Hobbies Category', 'description': 'A grouping of interests and hobbies entities, like Novelty Food or Destinations'}, 'entity': {'id': '913142676819648512', 'name': 'Cryptocurrencies', 'description': 'Cryptocurrency'}}, {'domain': {'id': '71', 'name': 'Video Game', 'description': 'A video game like Overwatch'}, 'entity': {'id': '1088118927580774400', 'name': 'Roblox', 'description': 'Roblox'}}]","{'mentions': [{'start': 112, 'end': 124, 'username': 'VentureBeat', 'id': '60642052'}, {'start': 157, 'end': 168, 'username': 'Roblox_RTC', 'id': '1056053249470541824'}, {'start': 171, 'end': 182, 'username': 'chris12902', 'id': '1254513527664099333'}], 'hashtags': [{'start': 41, 'end': 48, 'tag': 'Roblox'}, {'start': 63, 'end': 68, 'tag': 'NFTs'}], 'annotations': [{'start': 23, 'end': 34, 'probability': 0.9924, 'type': 'Person', 'normalized_text': 'Craig Donato'}], 'urls': [{'start': 127, 'end': 150, 'url': 'https://t.co/viEyRtRnWY', 'expanded_url': 'https://venturebeat.com/2022/04/23/craig-donato-interview-how-roblox-navigates-brands-ugc-and-the-metaverse/', 'display_url': 'venturebeat.com/2022/04/23/cra…', 'images': [{'url': 'https://pbs.twimg.com/news_img/1529253707438858242/lCO-zhlz?format=jpg&name=orig', 'width': 1200, 'height': 734}, {'url': 'https://pbs.twimg.com/news_img/1529253707438858242/lCO-zhlz?format=jpg&name=150x150', 'width': 150, 'height': 150}], 'status': 200, 'title': 'Craig Donato interview: How Roblox navigates brands, UGC, and the metaverse', 'description': ""Craig Donato, the chief business officer at Roblox, talked with GamesBeat's Dean Takahashi about the metaverse and more at Stanford."", 'unwound_url': 'https://venturebeat.com/2022/04/23/craig-donato-interview-how-roblox-navigates-brands-ugc-and-the-metaverse/'}, {'start': 184, 'end': 207, 'url': 'https://t.co/MQNBxuiAXr', 'expanded_url': 'https://twitter.com/RBXNews_/status/1518198986171166721/photo/1', 'display_url': 'pic.twitter.com/MQNBxuiAXr', 'media_key': '3_1518198834588966916'}, {'start': 184, 'end': 207, 'url': 'https://t.co/MQNBxuiAXr', 'expanded_url': 'https://twitter.com/RBXNews_/status/1518198986171166721/photo/1', 'display_url': 'pic.twitter.com/MQNBxuiAXr', 'media_key': '3_1518198885562433536'}]}","{'media_keys': ['3_1518198834588966916', '3_1518198885562433536']}",False,,everyone,Twitter Web App
1518262349056122882,1415317344461668360,@Cutiesliltoe @Smoothie_Roblox Happy birthday,2022-04-24 16:15:26+00:00,,0,1,2,0,en,1518259045521522688,[],"{'mentions': [{'start': 0, 'end': 13, 'username': 'Cutiesliltoe', 'id': '1431536975622787076'}]}",,False,,everyone,Twitter Web App
1518261780572688393,1487773869352140805,i love poop world on roblox,2022-04-24 16:13:11+00:00,,1,0,0,1,en,1518261780572688393,"[{'domain': {'id': '71', 'name': 'Video Game', 'description': 'A video game like Overwatch'}, 'entity': {'id': '1088118927580774400', 'name': 'Roblox', 'description': 'Roblox'}}]",,,False,,everyone,Twitter Web App
1506746743534530560,1347264921805811712,@RoMonitorStats @Pulsarnova_RBX Definitely deserved! Great game with a lot of effort put into it. One of the best developers in Roblox so far,2022-03-23 21:36:32+00:00,,0,1,2,0,en,1506481390036176898,"[{'domain': {'id': '71', 'name': 'Video Game', 'description': 'A video game like Overwatch'}, 'entity': {'id': '1088118927580774400', 'name': 'Roblox', 'description': 'Roblox'}}]","{'mentions': [{'start': 0, 'end': 15, 'username': 'RoMonitorStats', 'id': '1203395420916998145'}, {'start': 16, 'end': 31, 'username': 'Pulsarnova_RBX', 'id': '917130562388754432'}], 'annotations': [{'start': 128, 'end': 133, 'probability': 0.3669, 'type': 'Product', 'normalized_text': 'Roblox'}]}",,False,,everyone,Twitter for Android
1517993743567237122,1056053249470541824,"Roblox’s chief business officer, Craig Donato - has said the company MIGHT do NFTS &amp; integrate blockchain technology into the platforms future 📸 https://t.co/VA2mjHncaR",2022-04-23 22:28:06+00:00,,112,732,1937,300,en,1517993743567237122,"[{'domain': {'id': '46', 'name': 'Brand Category', 'description': 'Categories within Brand Verticals that narrow down the scope of Brands'}, 'entity': {'id': '781974596752842752', 'name': 'Services'}}, {'domain': {'id': '48', 'name': 'Product', 'description': 'Products created by Brands.  Examples: Ford Explorer, Apple iPhone.'}, 'entity': {'id': '1412579054855671809', 'name': 'Google Innovation'}}, {'domain': {'id': '30', 'name': 'Entities [Entity Service]', 'description': 'Entity Service top level domain, every item that is in Entity Service should be in this domain'}, 'entity': {'id': '857879456773357569', 'name': 'Technology', 'description': 'Technology'}}, {'domain': {'id': '66', 'name': 'Interests and Hobbies Category', 'description': 'A grouping of interests and hobbies entities, like Novelty Food or Destinations'}, 'entity': {'id': '913142676819648512', 'name': 'Cryptocurrencies', 'description': 'Cryptocurrency'}}, {'domain': {'id': '30', 'name': 'Entities [Entity Service]', 'description': 'Entity Service top level domain, every item that is in Entity Service should be in this domain'}, 'entity': {'id': '1001503516555337728', 'name': 'Blockchain', 'description': 'Blockchain'}}, {'domain': {'id': '71', 'name': 'Video Game', 'description': 'A video game like Overwatch'}, 'entity': {'id': '1088118927580774400', 'name': 'Roblox', 'description': 'Roblox'}}, {'domain': {'id': '30', 'name': 'Entities [Entity Service]', 'description': 'Entity Service top level domain, every item that is in Entity Service should be in this domain'}, 'entity': {'id': '857879456773357569', 'name': 'Technology', 'description': 'Technology'}}]","{'annotations': [{'start': 0, 'end': 5, 'probability': 0.6402, 'type': 'Organization', 'normalized_text': 'Roblox'}, {'start': 33, 'end': 44, 'probability': 0.9823, 'type': 'Person', 'normalized_text': 'Craig Donato'}], 'urls': [{'start': 149, 'end': 172, 'url': 'https://t.co/VA2mjHncaR', 'expanded_url': 'https://twitter.com/Roblox_RTC/status/1517993743567237122/photo/1', 'display_url': 'pic.twitter.com/VA2mjHncaR', 'media_key': '3_1517993740601806850'}, {'start': 149, 'end': 172, 'url': 'https://t.co/VA2mjHncaR', 'expanded_url': 'https://twitter.com/Roblox_RTC/status/1517993743567237122/photo/1', 'display_url': 'pic.twitter.com/VA2mjHncaR', 'media_key': '3_1517993740601806849'}]}","{'media_keys': ['3_1517993740601806850', '3_1517993740601806849']}",False,,everyone,Twitter for iPhone
1518259045521522688,1431536975622787076,https://t.co/zbqV9HktqH,2022-04-24 16:02:18+00:00,,2,11,13,0,zxx,1518259045521522688,[],"{'urls': [{'start': 0, 'end': 23, 'url': 'https://t.co/zbqV9HktqH', 'expanded_url': 'https://twitter.com/Cutiesliltoe/status/1518259045521522688/photo/1', 'display_url': 'pic.twitter.com/zbqV9HktqH', 'media_key': '3_1518259042006622209'}]}",{'media_keys': ['3_1518259042006622209']},False,,everyone,Twitter for Android
1518215018558459905,1229828718304034819,No sabía que los videos VHS de FNAF también podían ser catalogados como Analog Horror. https://t.co/TUeUNtDvEe,2022-04-24 13:07:22+00:00,,4,13,124,1,es,1518215018558459905,"[{'domain': {'id': '71', 'name': 'Video Game', 'description': 'A video game like Overwatch'}, 'entity': {'id': '856562205210198020', 'name': ""Five Nights at Freddy's"", 'description': 'This entity includes all conversation about the franchise, as well as any individual installments in the series, if applicable.\t\t\t'}}]","{'annotations': [{'start': 31, 'end': 34, 'probability': 0.531, 'type': 'Other', 'normalized_text': 'FNAF'}, {'start': 72, 'end': 84, 'probability': 0.4035, 'type': 'Other', 'normalized_text': 'Analog Horror'}], 'urls': [{'start': 87, 'end': 110, 'url': 'https://t.co/TUeUNtDvEe', 'expanded_url': 'https://twitter.com/IconicAHMoments/status/1518213165959368705', 'display_url': 'twitter.com/IconicAHMoment…'}]}",,False,,everyone,Twitter for Android
355501677534642176,36562751,"How to get on the front page: Hold control, scroll out, and repeat. http://t.co/3QGlnzTry7",2013-07-12 01:39:39+00:00,,12,14,25,3,en,355501677534642176,[],"{'urls': [{'start': 68, 'end': 90, 'url': 'http://t.co/3QGlnzTry7', 'expanded_url': 'https://twitter.com/stickmasterluke/status/355501677534642176/photo/1', 'display_url': 'pic.twitter.com/3QGlnzTry7', 'media_key': '3_355501677538836484'}]}",{'media_keys': ['3_355501677538836484']},False,,everyone,Twitter Web Client
1515749489793019907,841362000143872001,"Current gameplay from my game SpeedLands.

Early Access is now available! [link in bio]

#RobloxDev  #Roblox  #indiedev https://t.co/w0dXIMlijJ",2022-04-17 17:50:14+00:00,,10,5,24,1,en,1515749489793019907,"[{'domain': {'id': '71', 'name': 'Video Game', 'description': 'A video game like Overwatch'}, 'entity': {'id': '1088118927580774400', 'name': 'Roblox', 'description': 'Roblox'}}]","{'hashtags': [{'start': 89, 'end': 99, 'tag': 'RobloxDev'}, {'start': 101, 'end': 108, 'tag': 'Roblox'}, {'start': 110, 'end': 119, 'tag': 'indiedev'}], 'urls': [{'start': 120, 'end': 143, 'url': 'https://t.co/w0dXIMlijJ', 'expanded_url': 'https://twitter.com/PrismaTechRBLX/status/1515749489793019907/video/1', 'display_url': 'pic.twitter.com/w0dXIMlijJ', 'media_key': '7_1515749278257401862'}]}",{'media_keys': ['7_1515749278257401862']},False,,everyone,Twitter for iPhone
