tweetid,author_id,text,created_at,geo,retweets,replies,likes,quote_count,lang,conversation_id,context_annotations,entities,attachments,possibly_sensitive,withheld,reply_settings,source
1515341524522967046,1482678691419332608,@Icelestinaya Glad,2022-04-16 14:49:07+00:00,,0,1,1,0,en,1515337196831711236,[],"{'mentions': [{'start': 0, 'end': 13, 'username': 'Icelestinaya', 'id': '1492103000256507909'}]}",,False,,everyone,Twitter for iPhone
1360660665459957774,2995414579,"Hello all, quick reminder!

Our trusted Discord URLs are https://t.co/SpPMHVDVt2 and https://t.co/LYSpaoFv5C ! Other links are not safe!

Please also remember that ROLVe devs, mods, or other staff will NEVER ask for your passwords/emails/money!

#Roblox #RobloxArsenal @ROLVeStuff",2021-02-13 18:42:37+00:00,,137,2688,2092,40,en,1360660665459957774,"[{'domain': {'id': '47', 'name': 'Brand', 'description': 'Brands and Companies'}, 'entity': {'id': '1168499224297656321', 'name': 'Discord'}}, {'domain': {'id': '71', 'name': 'Video Game', 'description': 'A video game like Overwatch'}, 'entity': {'id': '1088118927580774400', 'name': 'Roblox', 'description': 'Roblox'}}]","{'urls': [{'start': 57, 'end': 80, 'url': 'https://t.co/SpPMHVDVt2', 'expanded_url': 'http://discord.gg/rolve', 'display_url': 'discord.gg/rolve', 'images': [{'url': 'https://pbs.twimg.com/news_img/1536975230664445952/eI48PVoJ?format=jpg&name=orig', 'width': 512, 'height': 262}, {'url': 'https://pbs.twimg.com/news_img/1536975230664445952/eI48PVoJ?format=jpg&name=150x150', 'width': 150, 'height': 150}], 'status': 200, 'title': 'Discord - A New Way to Chat with Friends & Communities', 'description': 'Discord is the easiest way to communicate over voice, video, and text. Chat, hang out, and stay close with your friends and communities.', 'unwound_url': 'https://discord.com/invite/rolve'}, {'start': 85, 'end': 108, 'url': 'https://t.co/LYSpaoFv5C', 'expanded_url': 'http://discord.gg/rolvearsenal', 'display_url': 'discord.gg/rolvearsenal'}], 'mentions': [{'start': 269, 'end': 280, 'username': 'ROLVeStuff', 'id': '2995414579'}], 'hashtags': [{'start': 246, 'end': 253, 'tag': 'Roblox'}, {'start': 254, 'end': 268, 'tag': 'RobloxArsenal'}]}",,False,,everyone,Twitter Web App
1420089032114065410,1280974679008841733,@CraftyRoblox @roksekYT @Roblox i got fucking warned for uploading a train to my inventory like what the hell roblox fix your employees are they on crack?,2021-07-27 18:29:43+00:00,,0,1,0,0,en,1348935695159721984,"[{'domain': {'id': '71', 'name': 'Video Game', 'description': 'A video game like Overwatch'}, 'entity': {'id': '1088118927580774400', 'name': 'Roblox', 'description': 'Roblox'}}]","{'mentions': [{'start': 0, 'end': 13, 'username': 'CraftyRoblox', 'id': '1284971799055347712'}, {'start': 14, 'end': 23, 'username': 'roksekYT', 'id': '1227952086408667138'}, {'start': 24, 'end': 31, 'username': 'Roblox', 'id': '16745055'}]}",,False,,everyone,Twitter Web App
1515341857601040387,2225947382,What Sonic game will I play today? 🤔,2022-04-16 14:50:27+00:00,,28,163,555,0,en,1515341857601040387,"[{'domain': {'id': '130', 'name': 'Multimedia Franchise', 'description': ""Franchises which span multiple forms of media like 'Harry Potter'""}, 'entity': {'id': '993952643209773057', 'name': 'Sonic the Hedgehog', 'description': 'This entity includes all conversation about the franchise, as well as any individual installments in the series, if applicable.\t\t\t\n\nNOTE: Stopped annotating in the Video Game domain (71) on 11/15/19. Moving forward, this entity will annotate to Multimedia Franchise domain (130) only.'}}]",,,False,,everyone,Twitter for iPhone
1515147231241940997,1257985458908299265,CODE: easterart #starvingartistsrbx https://t.co/y0n8z3eQtE,2022-04-16 01:57:04+00:00,,8,37,244,3,en,1515147231241940997,[],"{'urls': [{'start': 36, 'end': 59, 'url': 'https://t.co/y0n8z3eQtE', 'expanded_url': 'https://twitter.com/LAgurlzRBLX/status/1515147231241940997/video/1', 'display_url': 'pic.twitter.com/y0n8z3eQtE', 'media_key': '7_1515147195464486913'}], 'hashtags': [{'start': 16, 'end': 35, 'tag': 'starvingartistsrbx'}]}",{'media_keys': ['7_1515147195464486913']},False,,everyone,Twitter Web App
1511408448977575940,16745055,We are thrilled to announce the talented team at @Hamulgg is joining the Roblox team. They share our passion for innovation and will focus on creating new ways for people to play together and build deeper social connections. Welcome aboard and excited to get building together. https://t.co/zQQFmME4Hx,2022-04-05 18:20:29+00:00,,178,413,2689,20,en,1511408448977575940,"[{'domain': {'id': '71', 'name': 'Video Game', 'description': 'A video game like Overwatch'}, 'entity': {'id': '1088118927580774400', 'name': 'Roblox', 'description': 'Roblox'}}]","{'urls': [{'start': 278, 'end': 301, 'url': 'https://t.co/zQQFmME4Hx', 'expanded_url': 'https://twitter.com/Roblox/status/1511408448977575940/photo/1', 'display_url': 'pic.twitter.com/zQQFmME4Hx', 'media_key': '3_1511408330694037504'}], 'annotations': [{'start': 73, 'end': 78, 'probability': 0.5044, 'type': 'Organization', 'normalized_text': 'Roblox'}], 'mentions': [{'start': 49, 'end': 57, 'username': 'hamulgg', 'id': '1179964847754117121'}]}",{'media_keys': ['3_1511408330694037504']},False,,everyone,Twitter Web App
1515159804813135873,1332496504305618944,"@ftDerpy You know a lot lately roblox moderation has been getting worse and worse, and sometimes it’s even warnings for dumb things. So it’s kinda making me think my account is not that safe anymore and every day people are getting warnings and warnings and people are still as we speak. https://t.co/RJSEicqSjd",2022-04-16 02:47:02+00:00,,0,10,61,1,en,1515061842305064964,"[{'domain': {'id': '71', 'name': 'Video Game', 'description': 'A video game like Overwatch'}, 'entity': {'id': '1088118927580774400', 'name': 'Roblox', 'description': 'Roblox'}}]","{'urls': [{'start': 288, 'end': 311, 'url': 'https://t.co/RJSEicqSjd', 'expanded_url': 'https://twitter.com/Adamabd73644830/status/1515159804813135873/photo/1', 'display_url': 'pic.twitter.com/RJSEicqSjd', 'media_key': '3_1515159799666774018'}], 'mentions': [{'start': 0, 'end': 8, 'username': 'ftDerpy', 'id': '4093077509'}]}",{'media_keys': ['3_1515159799666774018']},False,,everyone,Twitter for iPhone
1515340998578098178,1402449566587252738,"Hey Guys So Today Someone Scammed For A Pfp
 He Said He Is Offering Me A 10$ Robux GiftCard 
And I Said Sure Will Get You A Pfp Then I Ask Will You Scammed Me Or Not He Said Nope Don't Be Afraid... Then This Happened 1/2 https://t.co/UVSCyZMdxC",2022-04-16 14:47:02+00:00,,1,9,9,1,en,1515340998578098178,[],"{'urls': [{'start': 221, 'end': 244, 'url': 'https://t.co/UVSCyZMdxC', 'expanded_url': 'https://twitter.com/NavinRblx/status/1515340998578098178/photo/1', 'display_url': 'pic.twitter.com/UVSCyZMdxC', 'media_key': '3_1515340319457390594'}, {'start': 221, 'end': 244, 'url': 'https://t.co/UVSCyZMdxC', 'expanded_url': 'https://twitter.com/NavinRblx/status/1515340998578098178/photo/1', 'display_url': 'pic.twitter.com/UVSCyZMdxC', 'media_key': '3_1515340446163038216'}, {'start': 221, 'end': 244, 'url': 'https://t.co/UVSCyZMdxC', 'expanded_url': 'https://twitter.com/NavinRblx/status/1515340998578098178/photo/1', 'display_url': 'pic.twitter.com/UVSCyZMdxC', 'media_key': '3_1515340536084717579'}, {'start': 221, 'end': 244, 'url': 'https://t.co/UVSCyZMdxC', 'expanded_url': 'https://twitter.com/NavinRblx/status/1515340998578098178/photo/1', 'display_url': 'pic.twitter.com/UVSCyZMdxC', 'media_key': '3_1515340594670817283'}]}","{'media_keys': ['3_1515340319457390594', '3_1515340446163038216', '3_1515340536084717579', '3_1515340594670817283']}",False,,everyone,Twitter Web App
1514981881175019520,1894642398,If you had unlimited Robux what would you spend it on? https://t.co/wAeFgv2p9o,2022-04-15 15:00:02+00:00,,13,199,199,2,en,1514981881175019520,[],"{'urls': [{'start': 55, 'end': 78, 'url': 'https://t.co/wAeFgv2p9o', 'expanded_url': 'https://twitter.com/FishyBlox/status/1514981881175019520/photo/1', 'display_url': 'pic.twitter.com/wAeFgv2p9o', 'media_key': '3_1514465380374261766'}]}",{'media_keys': ['3_1514465380374261766']},False,,everyone,Twitter Web App
1515026236241850380,16745055,Anyone got any avatar accessories they'd like to recommend to @sonic_hedgehog? https://t.co/XxBNu7ju0i,2022-04-15 17:56:17+00:00,,167,1036,2785,14,en,1515026236241850380,[],"{'urls': [{'start': 79, 'end': 102, 'url': 'https://t.co/XxBNu7ju0i', 'expanded_url': 'https://twitter.com/VentureBeat/status/1514272343731814403', 'display_url': 'twitter.com/VentureBeat/st…'}], 'mentions': [{'start': 62, 'end': 77, 'username': 'sonic_hedgehog', 'id': '19609162'}]}",,False,,everyone,Twitter Web App
1514838191991361544,1470442246294155267,no way this is how kim kardashian called kanye about the sextape on roblox LMAOOO https://t.co/tixxFRzmLC,2022-04-15 05:29:03+00:00,,27353,3618,300154,12819,en,1514838191991361544,"[{'domain': {'id': '10', 'name': 'Person', 'description': 'Named people in the world like Nelson Mandela'}, 'entity': {'id': '806561823407239169', 'name': 'Kanye West', 'description': 'Kanye West'}}, {'domain': {'id': '10', 'name': 'Person', 'description': 'Named people in the world like Nelson Mandela'}, 'entity': {'id': '806570121959383040', 'name': 'Kim Kardashian', 'description': 'Kim Kardashian'}}, {'domain': {'id': '54', 'name': 'Musician', 'description': 'A musician in the world, like Adele or Bob Dylan'}, 'entity': {'id': '806561823407239169', 'name': 'Kanye West', 'description': 'Kanye West'}}, {'domain': {'id': '55', 'name': 'Music Genre', 'description': 'A category for a musical style, like Pop, Rock, or Rap'}, 'entity': {'id': '810937888334487552', 'name': 'Rap', 'description': 'Hip-Hop/Rap'}}, {'domain': {'id': '58', 'name': 'Entertainment Personality', 'description': 'An entertainment personality in the world, like Anderson Cooper or Miranda Sings'}, 'entity': {'id': '806570121959383040', 'name': 'Kim Kardashian', 'description': 'Kim Kardashian'}}, {'domain': {'id': '71', 'name': 'Video Game', 'description': 'A video game like Overwatch'}, 'entity': {'id': '1088118927580774400', 'name': 'Roblox', 'description': 'Roblox'}}]","{'urls': [{'start': 82, 'end': 105, 'url': 'https://t.co/tixxFRzmLC', 'expanded_url': 'https://twitter.com/ayedocc/status/1514838191991361544/video/1', 'display_url': 'pic.twitter.com/tixxFRzmLC', 'media_key': '7_1514838163092652034'}], 'annotations': [{'start': 19, 'end': 32, 'probability': 0.9784, 'type': 'Person', 'normalized_text': 'kim kardashian'}, {'start': 41, 'end': 45, 'probability': 0.9975, 'type': 'Person', 'normalized_text': 'kanye'}]}",{'media_keys': ['7_1514838163092652034']},False,,everyone,Twitter for iPhone
1515061842305064964,4093077509,is roblox getting boring?,2022-04-15 20:17:46+00:00,,114,1651,4377,62,en,1515061842305064964,"[{'domain': {'id': '71', 'name': 'Video Game', 'description': 'A video game like Overwatch'}, 'entity': {'id': '1088118927580774400', 'name': 'Roblox', 'description': 'Roblox'}}]",,,False,,everyone,Twitter Web App
1515132333627781128,1435265641326448643,@Roblox @sonic_hedgehog WHY DID I GET BANNED FOR NO REASON ROBLOX,2022-04-16 00:57:52+00:00,,0,7,2,0,en,1515026236241850380,"[{'domain': {'id': '71', 'name': 'Video Game', 'description': 'A video game like Overwatch'}, 'entity': {'id': '1088118927580774400', 'name': 'Roblox', 'description': 'Roblox'}}, {'domain': {'id': '130', 'name': 'Multimedia Franchise', 'description': ""Franchises which span multiple forms of media like 'Harry Potter'""}, 'entity': {'id': '993952643209773057', 'name': 'Sonic the Hedgehog', 'description': 'This entity includes all conversation about the franchise, as well as any individual installments in the series, if applicable.\t\t\t\n\nNOTE: Stopped annotating in the Video Game domain (71) on 11/15/19. Moving forward, this entity will annotate to Multimedia Franchise domain (130) only.'}}]","{'mentions': [{'start': 0, 'end': 7, 'username': 'Roblox', 'id': '16745055'}, {'start': 8, 'end': 23, 'username': 'sonic_hedgehog', 'id': '19609162'}]}",,False,,everyone,Twitter for iPad
1515164550005407747,1212776883781128192,"@iiNotJoshXD I was so curious of what she saw, but then this tweet-",2022-04-16 03:05:53+00:00,,0,2,20,0,en,1515158718694182913,"[{'domain': {'id': '46', 'name': 'Brand Category', 'description': 'Categories within Brand Verticals that narrow down the scope of Brands'}, 'entity': {'id': '781974596752842752', 'name': 'Services'}}, {'domain': {'id': '47', 'name': 'Brand', 'description': 'Brands and Companies'}, 'entity': {'id': '10045225402', 'name': 'Twitter'}}]","{'mentions': [{'start': 0, 'end': 12, 'username': 'iiNotJoshXD', 'id': '1276313631601291267'}]}",,False,,everyone,Twitter Web App
1514674156293480453,759191393868939264,Kim VS Roblox is definitely not the feud I would expect to see on this show.💀 #TheKardashians https://t.co/89umdeqkKt,2022-04-14 18:37:14+00:00,,74,14,685,38,en,1514674156293480453,"[{'domain': {'id': '3', 'name': 'TV Shows', 'description': 'Television shows from around the world'}, 'entity': {'id': '10000283194', 'name': 'Keeping Up With the Kardashians', 'description': 'Life with the Kardashian family. \n\nPhoto via @KUWTK'}}, {'domain': {'id': '3', 'name': 'TV Shows', 'description': 'Television shows from around the world'}, 'entity': {'id': '1478839714908016640', 'name': 'The Kardashians ', 'description': 'The Premiere of #TheKardashians is happening! Explore the latest tweets and must-see highlights right here.'}}, {'domain': {'id': '71', 'name': 'Video Game', 'description': 'A video game like Overwatch'}, 'entity': {'id': '1088118927580774400', 'name': 'Roblox', 'description': 'Roblox'}}, {'domain': {'id': '172', 'name': 'Global TV Show', 'description': 'For global/conceptual TV shows without localization.'}, 'entity': {'id': '1223200321637249025', 'name': 'Keeping Up With the Kardashians'}}, {'domain': {'id': '3', 'name': 'TV Shows', 'description': 'Television shows from around the world'}, 'entity': {'id': '1478839714908016640', 'name': 'The Kardashians ', 'description': 'The Premiere of #TheKardashians is happening! Explore the latest tweets and must-see highlights right here.'}}, {'domain': {'id': '29', 'name': 'Events [Entity Service]', 'description': 'Entity Service related Events domain'}, 'entity': {'id': '1478839714908016640', 'name': 'The Kardashians ', 'description': 'The Premiere of #TheKardashians is happening! Explore the latest tweets and must-see highlights right here.'}}]","{'urls': [{'start': 94, 'end': 117, 'url': 'https://t.co/89umdeqkKt', 'expanded_url': 'https://twitter.com/superficialxoxo/status/1514674156293480453/video/1', 'display_url': 'pic.twitter.com/89umdeqkKt', 'media_key': '7_1514674082700275712'}], 'annotations': [{'start': 0, 'end': 2, 'probability': 0.9508, 'type': 'Person', 'normalized_text': 'Kim'}, {'start': 7, 'end': 12, 'probability': 0.286, 'type': 'Person', 'normalized_text': 'Roblox'}], 'hashtags': [{'start': 78, 'end': 93, 'tag': 'TheKardashians'}]}",{'media_keys': ['7_1514674082700275712']},False,,everyone,Twitter for iPhone
1515011814454665221,196388844,@sonic_hedgehog @Roblox AAAAAAAAAAAAAAAAA https://t.co/fghVTh7gQN,2022-04-15 16:58:58+00:00,,285,43,2688,13,und,1515011598812794883,"[{'domain': {'id': '71', 'name': 'Video Game', 'description': 'A video game like Overwatch'}, 'entity': {'id': '1088118927580774400', 'name': 'Roblox', 'description': 'Roblox'}}, {'domain': {'id': '130', 'name': 'Multimedia Franchise', 'description': ""Franchises which span multiple forms of media like 'Harry Potter'""}, 'entity': {'id': '993952643209773057', 'name': 'Sonic the Hedgehog', 'description': 'This entity includes all conversation about the franchise, as well as any individual installments in the series, if applicable.\t\t\t\n\nNOTE: Stopped annotating in the Video Game domain (71) on 11/15/19. Moving forward, this entity will annotate to Multimedia Franchise domain (130) only.'}}]","{'urls': [{'start': 42, 'end': 65, 'url': 'https://t.co/fghVTh7gQN', 'expanded_url': 'https://twitter.com/chaomix/status/1515011814454665221/video/1', 'display_url': 'pic.twitter.com/fghVTh7gQN', 'media_key': '7_1515011727624224774'}], 'mentions': [{'start': 0, 'end': 15, 'username': 'sonic_hedgehog', 'id': '19609162'}, {'start': 16, 'end': 23, 'username': 'Roblox', 'id': '16745055'}]}",{'media_keys': ['7_1515011727624224774']},False,,everyone,Twitter for iPhone
1515024721787633665,1056053249470541824,"Here was the media in question regarding Kim Kardasian’s Roblox incident.. It’s likely this frame was a reference to an NSFW media of Kim Kardashian. Her child discovered this on Roblox, likely searching for their mom’s name. https://t.co/iBZ86Pqyc5 https://t.co/bWtNEK9vFF",2022-04-15 17:50:16+00:00,,22,42,456,2,en,1515024721787633665,"[{'domain': {'id': '10', 'name': 'Person', 'description': 'Named people in the world like Nelson Mandela'}, 'entity': {'id': '806570121959383040', 'name': 'Kim Kardashian', 'description': 'Kim Kardashian'}}, {'domain': {'id': '58', 'name': 'Entertainment Personality', 'description': 'An entertainment personality in the world, like Anderson Cooper or Miranda Sings'}, 'entity': {'id': '806570121959383040', 'name': 'Kim Kardashian', 'description': 'Kim Kardashian'}}, {'domain': {'id': '71', 'name': 'Video Game', 'description': 'A video game like Overwatch'}, 'entity': {'id': '1088118927580774400', 'name': 'Roblox', 'description': 'Roblox'}}]","{'urls': [{'start': 226, 'end': 249, 'url': 'https://t.co/iBZ86Pqyc5', 'expanded_url': 'https://twitter.com/Roblox_RTC/status/1515024721787633665/photo/1', 'display_url': 'pic.twitter.com/iBZ86Pqyc5', 'media_key': '3_1515024718201503751'}, {'start': 250, 'end': 273, 'url': 'https://t.co/bWtNEK9vFF', 'expanded_url': 'https://twitter.com/Roblox_RTC/status/1514972374789197830', 'display_url': 'twitter.com/Roblox_RTC/sta…'}], 'annotations': [{'start': 41, 'end': 53, 'probability': 0.9876, 'type': 'Person', 'normalized_text': 'Kim Kardasian'}, {'start': 57, 'end': 62, 'probability': 0.3506, 'type': 'Other', 'normalized_text': 'Roblox'}, {'start': 134, 'end': 147, 'probability': 0.9961, 'type': 'Person', 'normalized_text': 'Kim Kardashian'}, {'start': 179, 'end': 184, 'probability': 0.4461, 'type': 'Product', 'normalized_text': 'Roblox'}]}",{'media_keys': ['3_1515024718201503751']},False,,everyone,Twitter for iPhone
1515338684228255745,1489171743864328192,"ppl, what r u doing rnn??",2022-04-16 14:37:50+00:00,,0,3,0,0,en,1515338684228255745,[],,,False,,everyone,Twitter for Android
1513565875214839814,16745055,"A bold jacket can complete any outfit...and we mean ANY outfit. Wear these on any avatar you want, on top of any items you want. Available now:  https://t.co/nNxda3j0KB https://t.co/x1wggyfQOM",2022-04-11 17:13:20+00:00,,174,752,3486,34,en,1513565875214839814,"[{'domain': {'id': '71', 'name': 'Video Game', 'description': 'A video game like Overwatch'}, 'entity': {'id': '1088118927580774400', 'name': 'Roblox', 'description': 'Roblox'}}]","{'urls': [{'start': 145, 'end': 168, 'url': 'https://t.co/nNxda3j0KB', 'expanded_url': 'https://rblx.co/puffer-jackets', 'display_url': 'rblx.co/puffer-jackets'}, {'start': 169, 'end': 192, 'url': 'https://t.co/x1wggyfQOM', 'expanded_url': 'https://twitter.com/Roblox/status/1513565875214839814/video/1', 'display_url': 'pic.twitter.com/x1wggyfQOM', 'media_key': '7_1513565391582334977'}]}",{'media_keys': ['7_1513565391582334977']},False,,everyone,Twitter Web App
1514366060257951751,16745055,You’re already clearing up in Arsenal. Now do it with style. Amazon Prime users can get the @primegaming Virtual Nomad Bundle by @ROLVeStuff here: https://t.co/jUbfif33rM https://t.co/seK5wlQSY7,2022-04-13 22:12:58+00:00,,149,881,2596,26,en,1514366060257951751,"[{'domain': {'id': '71', 'name': 'Video Game', 'description': 'A video game like Overwatch'}, 'entity': {'id': '1088118927580774400', 'name': 'Roblox', 'description': 'Roblox'}}, {'domain': {'id': '45', 'name': 'Brand Vertical', 'description': 'Top level entities that describe a Brands industry'}, 'entity': {'id': '781974596706635776', 'name': 'Retail'}}, {'domain': {'id': '46', 'name': 'Brand Category', 'description': 'Categories within Brand Verticals that narrow down the scope of Brands'}, 'entity': {'id': '783335558466506752', 'name': 'Online'}}, {'domain': {'id': '47', 'name': 'Brand', 'description': 'Brands and Companies'}, 'entity': {'id': '10026792024', 'name': 'Amazon'}}, {'domain': {'id': '48', 'name': 'Product', 'description': 'Products created by Brands.  Examples: Ford Explorer, Apple iPhone.'}, 'entity': {'id': '10046538542', 'name': 'Amazon Prime'}}]","{'urls': [{'start': 147, 'end': 170, 'url': 'https://t.co/jUbfif33rM', 'expanded_url': 'https://rblx.co/Virtual-Nomad', 'display_url': 'rblx.co/Virtual-Nomad'}, {'start': 171, 'end': 194, 'url': 'https://t.co/seK5wlQSY7', 'expanded_url': 'https://twitter.com/Roblox/status/1514366060257951751/video/1', 'display_url': 'pic.twitter.com/seK5wlQSY7', 'media_key': '7_1514365737481080835'}], 'annotations': [{'start': 30, 'end': 36, 'probability': 0.6733, 'type': 'Place', 'normalized_text': 'Arsenal'}, {'start': 61, 'end': 72, 'probability': 0.4441, 'type': 'Product', 'normalized_text': 'Amazon Prime'}], 'mentions': [{'start': 92, 'end': 104, 'username': 'primegaming', 'id': '759027320560627712'}, {'start': 129, 'end': 140, 'username': 'ROLVeStuff', 'id': '2995414579'}]}",{'media_keys': ['7_1514365737481080835']},False,,everyone,Twitter Web App
1515303199519162369,1278689422184046593,Ada suggestion game selain dari ml and pubg?,2022-04-16 12:16:50+00:00,,141,228,1022,44,en,1515303199519162369,"[{'domain': {'id': '30', 'name': 'Entities [Entity Service]', 'description': 'Entity Service top level domain, every item that is in Entity Service should be in this domain'}, 'entity': {'id': '847527946864607232', 'name': 'Mobile gaming', 'description': 'Mobile gaming'}}, {'domain': {'id': '71', 'name': 'Video Game', 'description': 'A video game like Overwatch'}, 'entity': {'id': '961618132874883072', 'name': ""PlayerUnknown's Battlegrounds"", 'description': 'This entity includes all conversation about the franchise, as well as any individual installments in the series, if applicable.\t\t\t'}}]",,,False,,everyone,Twitter for Android
1515309298569846784,907960915512848385,"#RobloxDev #Roblox 
=Game Recommendation= (Week #15)
PHIGHTING! by @7GB0_ is a very unique fighting game. Chooses the best kit and go win the game! 

Link:https://t.co/piODLMpG0F https://t.co/7cxJ7BkP9O",2022-04-16 12:41:04+00:00,,18,5,41,0,en,1515309298569846784,"[{'domain': {'id': '71', 'name': 'Video Game', 'description': 'A video game like Overwatch'}, 'entity': {'id': '1088118927580774400', 'name': 'Roblox', 'description': 'Roblox'}}]","{'urls': [{'start': 155, 'end': 178, 'url': 'https://t.co/piODLMpG0F', 'expanded_url': 'https://www.roblox.com/games/7138009149/PHIGHTING#!/game-instances', 'display_url': 'roblox.com/games/71380091…'}, {'start': 179, 'end': 202, 'url': 'https://t.co/7cxJ7BkP9O', 'expanded_url': 'https://twitter.com/Roblox_UGs/status/1515309298569846784/photo/1', 'display_url': 'pic.twitter.com/7cxJ7BkP9O', 'media_key': '3_1515309269281042435'}], 'mentions': [{'start': 67, 'end': 73, 'username': '7GB0_', 'id': '866778668357517312'}], 'hashtags': [{'start': 0, 'end': 10, 'tag': 'RobloxDev'}, {'start': 11, 'end': 18, 'tag': 'Roblox'}]}",{'media_keys': ['3_1515309269281042435']},False,,everyone,Twitter Web App
1515319824523616258,1430727773014867968,@kayluuhlol @Parlo_ROBLOX @TheDarkCreeper5 this you taking jokes out of context? also even if it was real parlo is in fact a minor himself,2022-04-16 13:22:54+00:00,,0,1,1,0,en,1515064113625546761,[],"{'mentions': [{'start': 0, 'end': 11, 'username': 'kayluuhlol', 'id': '1448174835587244034'}, {'start': 12, 'end': 25, 'username': 'Parlo_ROBLOX', 'id': '1310688804441817088'}, {'start': 26, 'end': 42, 'username': 'TheDarkCreeper5', 'id': '1367610140975910919'}]}",,False,,everyone,Twitter Web App
1515339553673986050,1256542992938262528,Dunno what roblox games to play. link some please,2022-04-16 14:41:17+00:00,,0,3,3,0,en,1515339553673986050,"[{'domain': {'id': '71', 'name': 'Video Game', 'description': 'A video game like Overwatch'}, 'entity': {'id': '1088118927580774400', 'name': 'Roblox', 'description': 'Roblox'}}]",,,False,,everyone,Twitter Web App
