tweetid,author_id,text,created_at,geo,retweets,replies,likes,quote_count,lang,conversation_id,context_annotations,entities,attachments,possibly_sensitive,withheld,reply_settings,source
1525205742659088385,4429003533,"Charli XCX announces new collaboration with Samsung and @Roblox. 

Users can explore, create, and play in Superstar Galaxy, an interstellar music festival, and climb the charts for a chance to join the star onstage in an interactive concert. https://t.co/jIz5Hq1a73",2022-05-13 20:06:00+00:00,,62,56,1029,73,en,1525205742659088385,"[{'domain': {'id': '47', 'name': 'Brand', 'description': 'Brands and Companies'}, 'entity': {'id': '1174344555111469057', 'name': 'Samsung Indonesia'}}, {'domain': {'id': '71', 'name': 'Video Game', 'description': 'A video game like Overwatch'}, 'entity': {'id': '1088118927580774400', 'name': 'Roblox', 'description': 'Roblox'}}, {'domain': {'id': '10', 'name': 'Person', 'description': 'Named people in the world like Nelson Mandela'}, 'entity': {'id': '885602209618051072', 'name': 'Charli XCX', 'description': 'CHARLI XCX'}}, {'domain': {'id': '47', 'name': 'Brand', 'description': 'Brands and Companies'}, 'entity': {'id': '10026364234', 'name': 'Samsung '}}, {'domain': {'id': '48', 'name': 'Product', 'description': 'Products created by Brands.  Examples: Ford Explorer, Apple iPhone.'}, 'entity': {'id': '10026331316', 'name': 'Samsung Mobile'}}, {'domain': {'id': '48', 'name': 'Product', 'description': 'Products created by Brands.  Examples: Ford Explorer, Apple iPhone.'}, 'entity': {'id': '10045298641', 'name': 'Samsung USA'}}, {'domain': {'id': '49', 'name': 'Product Version', 'description': ""The specific model or version of a product.  Examples: Audi A8, Ben & Jerry's Chocolate Chip Ice Cream""}, 'entity': {'id': '10040464729', 'name': 'Samsung Mobile UK'}}, {'domain': {'id': '49', 'name': 'Product Version', 'description': ""The specific model or version of a product.  Examples: Audi A8, Ben & Jerry's Chocolate Chip Ice Cream""}, 'entity': {'id': '10041364617', 'name': 'Samsung Mobile US'}}, {'domain': {'id': '54', 'name': 'Musician', 'description': 'A musician in the world, like Adele or Bob Dylan'}, 'entity': {'id': '885602209618051072', 'name': 'Charli XCX', 'description': 'CHARLI XCX'}}, {'domain': {'id': '55', 'name': 'Music Genre', 'description': 'A category for a musical style, like Pop, Rock, or Rap'}, 'entity': {'id': '810938279801470977', 'name': 'Pop', 'description': 'Pop'}}, {'domain': {'id': '30', 'name': 'Entities [Entity Service]', 'description': 'Entity Service top level domain, every item that is in Entity Service should be in this domain'}, 'entity': {'id': '848920371311001600', 'name': 'Technology', 'description': 'Technology and computing'}}, {'domain': {'id': '66', 'name': 'Interests and Hobbies Category', 'description': 'A grouping of interests and hobbies entities, like Novelty Food or Destinations'}, 'entity': {'id': '848920700073123840', 'name': 'Cell Phones', 'description': 'Cell phones'}}, {'domain': {'id': '30', 'name': 'Entities [Entity Service]', 'description': 'Entity Service top level domain, every item that is in Entity Service should be in this domain'}, 'entity': {'id': '848985956778561538', 'name': 'Mobile', 'description': 'Mobile'}}]","{'mentions': [{'start': 56, 'end': 63, 'username': 'Roblox', 'id': '16745055'}], 'annotations': [{'start': 0, 'end': 9, 'probability': 0.3552, 'type': 'Person', 'normalized_text': 'Charli XCX'}, {'start': 44, 'end': 50, 'probability': 0.5635, 'type': 'Product', 'normalized_text': 'Samsung'}, {'start': 106, 'end': 121, 'probability': 0.5539, 'type': 'Other', 'normalized_text': 'Superstar Galaxy'}], 'urls': [{'start': 242, 'end': 265, 'url': 'https://t.co/jIz5Hq1a73', 'expanded_url': 'https://twitter.com/PopCrave/status/1525205742659088385/photo/1', 'display_url': 'pic.twitter.com/jIz5Hq1a73', 'media_key': '3_1525205736053014528'}, {'start': 242, 'end': 265, 'url': 'https://t.co/jIz5Hq1a73', 'expanded_url': 'https://twitter.com/PopCrave/status/1525205742659088385/photo/1', 'display_url': 'pic.twitter.com/jIz5Hq1a73', 'media_key': '3_1525205736048865281'}]}","{'media_keys': ['3_1525205736053014528', '3_1525205736048865281']}",False,,everyone,Twitter for iPhone
1525174253712048130,16745055,"Style's all about expressing yourself. Which is why you can style these shorts on any avatar you want, with any accessories you want. Available now: https://t.co/NaI3ENWTbw https://t.co/GgVTTA530c",2022-05-13 18:00:53+00:00,,163,857,3062,33,en,1525174253712048130,"[{'domain': {'id': '71', 'name': 'Video Game', 'description': 'A video game like Overwatch'}, 'entity': {'id': '1088118927580774400', 'name': 'Roblox', 'description': 'Roblox'}}]","{'urls': [{'start': 149, 'end': 172, 'url': 'https://t.co/NaI3ENWTbw', 'expanded_url': 'https://rblx.co/shorts', 'display_url': 'rblx.co/shorts', 'images': [{'url': 'https://pbs.twimg.com/news_img/1538678570985197568/2tviCHKw?format=jpg&name=orig', 'width': 1200, 'height': 630}, {'url': 'https://pbs.twimg.com/news_img/1538678570985197568/2tviCHKw?format=jpg&name=150x150', 'width': 150, 'height': 150}], 'status': 200, 'title': 'Roblox', 'description': 'Customize your avatar with a never-ending variety of clothing options, accessories, gear, and more!', 'unwound_url': 'https://www.roblox.com/catalog?Category=3&Subcategory=63&CreatorID=1&SortType=3'}, {'start': 173, 'end': 196, 'url': 'https://t.co/GgVTTA530c', 'expanded_url': 'https://twitter.com/Roblox/status/1525174253712048130/photo/1', 'display_url': 'pic.twitter.com/GgVTTA530c', 'media_key': '3_1525174144601493504'}]}",{'media_keys': ['3_1525174144601493504']},False,,everyone,Twitter Web App
1525204036173148160,752005937041473536,"Cool announcement! Bakon has an official @Roblox toy now! 

You can collect Bakonette and redeem a code for her face by purchasing the latest Mystery Box series in stores! 

#Roblox #RobloxDev https://t.co/Mgo1tzPwvH",2022-05-13 19:59:13+00:00,,15,23,164,2,en,1525204036173148160,"[{'domain': {'id': '71', 'name': 'Video Game', 'description': 'A video game like Overwatch'}, 'entity': {'id': '1088118927580774400', 'name': 'Roblox', 'description': 'Roblox'}}]","{'hashtags': [{'start': 174, 'end': 181, 'tag': 'Roblox'}, {'start': 182, 'end': 192, 'tag': 'RobloxDev'}], 'mentions': [{'start': 41, 'end': 48, 'username': 'Roblox', 'id': '16745055'}], 'urls': [{'start': 193, 'end': 216, 'url': 'https://t.co/Mgo1tzPwvH', 'expanded_url': 'https://twitter.com/PinkBeardRBX/status/1525204036173148160/photo/1', 'display_url': 'pic.twitter.com/Mgo1tzPwvH', 'media_key': '3_1525204032285024258'}]}",{'media_keys': ['3_1525204032285024258']},False,,everyone,Twitter for iPhone
1525205794106376192,1247619543985512454,@PopCrave @Roblox @charli_xcx two tanks https://t.co/8KBXVFa0Ai,2022-05-13 20:06:12+00:00,,0,2,1,0,en,1525205742659088385,"[{'domain': {'id': '71', 'name': 'Video Game', 'description': 'A video game like Overwatch'}, 'entity': {'id': '1088118927580774400', 'name': 'Roblox', 'description': 'Roblox'}}, {'domain': {'id': '10', 'name': 'Person', 'description': 'Named people in the world like Nelson Mandela'}, 'entity': {'id': '885602209618051072', 'name': 'Charli XCX', 'description': 'CHARLI XCX'}}, {'domain': {'id': '54', 'name': 'Musician', 'description': 'A musician in the world, like Adele or Bob Dylan'}, 'entity': {'id': '885602209618051072', 'name': 'Charli XCX', 'description': 'CHARLI XCX'}}, {'domain': {'id': '55', 'name': 'Music Genre', 'description': 'A category for a musical style, like Pop, Rock, or Rap'}, 'entity': {'id': '810938279801470977', 'name': 'Pop', 'description': 'Pop'}}]","{'mentions': [{'start': 0, 'end': 9, 'username': 'PopCrave', 'id': '4429003533'}, {'start': 10, 'end': 17, 'username': 'Roblox', 'id': '16745055'}, {'start': 18, 'end': 29, 'username': 'charli_xcx', 'id': '103012173'}], 'urls': [{'start': 40, 'end': 63, 'url': 'https://t.co/8KBXVFa0Ai', 'expanded_url': 'https://twitter.com/remremyola/status/1519875695496867840/video/1', 'display_url': 'pic.twitter.com/8KBXVFa0Ai', 'media_key': '7_1519875496351260673'}]}",{'media_keys': ['7_1519875496351260673']},False,,everyone,Twitter for iPhone
1525204782327160832,194155866,"I’m at the bank getting a car loan, tell them I’m good for the money podlords!!! https://t.co/77XxG1DDIV",2022-05-13 20:02:11+00:00,,5,31,169,0,en,1525204782327160832,"[{'domain': {'id': '65', 'name': 'Interests and Hobbies Vertical', 'description': 'Top level interests and hobbies groupings, like Food or Travel'}, 'entity': {'id': '781974596148793345', 'name': 'Business & finance'}}, {'domain': {'id': '65', 'name': 'Interests and Hobbies Vertical', 'description': 'Top level interests and hobbies groupings, like Food or Travel'}, 'entity': {'id': '781974596148793345', 'name': 'Business & finance'}}, {'domain': {'id': '66', 'name': 'Interests and Hobbies Category', 'description': 'A grouping of interests and hobbies entities, like Novelty Food or Destinations'}, 'entity': {'id': '847888632711061504', 'name': 'Personal finance', 'description': 'Personal finance'}}, {'domain': {'id': '67', 'name': 'Interests and Hobbies', 'description': 'Interests, opinions, and behaviors of individuals, groups, or cultures; like Speciality Cooking or Theme Parks'}, 'entity': {'id': '847894059859402753', 'name': 'Credit, debt and loans', 'description': 'Credit, debt and loans'}}]","{'urls': [{'start': 81, 'end': 104, 'url': 'https://t.co/77XxG1DDIV', 'expanded_url': 'https://twitter.com/GigaBoots/status/1525204782327160832/photo/1', 'display_url': 'pic.twitter.com/77XxG1DDIV', 'media_key': '3_1525204774760632320'}]}",{'media_keys': ['3_1525204774760632320']},False,,everyone,Twitter for iPhone
1525120056794959874,1329767975113601024,"cool lego roblox game i made.
#Roblox #RobloxDev @AlbertsStuff @Sk3tchYT @Temprist https://t.co/FxQndpDZqn",2022-05-13 14:25:31+00:00,,206,176,3910,3,en,1525120056794959874,"[{'domain': {'id': '45', 'name': 'Brand Vertical', 'description': 'Top level entities that describe a Brands industry'}, 'entity': {'id': '781974596740190208', 'name': 'CPG'}}, {'domain': {'id': '46', 'name': 'Brand Category', 'description': 'Categories within Brand Verticals that narrow down the scope of Brands'}, 'entity': {'id': '781974596148862977', 'name': 'Child Care'}}, {'domain': {'id': '47', 'name': 'Brand', 'description': 'Brands and Companies'}, 'entity': {'id': '10024374015', 'name': 'LEGO'}}, {'domain': {'id': '65', 'name': 'Interests and Hobbies Vertical', 'description': 'Top level interests and hobbies groupings, like Food or Travel'}, 'entity': {'id': '864925500627484672', 'name': 'Family and life stages', 'description': 'Family and Life Stages'}}, {'domain': {'id': '71', 'name': 'Video Game', 'description': 'A video game like Overwatch'}, 'entity': {'id': '1088118927580774400', 'name': 'Roblox', 'description': 'Roblox'}}]","{'hashtags': [{'start': 30, 'end': 37, 'tag': 'Roblox'}, {'start': 38, 'end': 48, 'tag': 'RobloxDev'}], 'mentions': [{'start': 49, 'end': 62, 'username': 'AlbertsStuff', 'id': '2850532049'}, {'start': 63, 'end': 72, 'username': 'Sk3tchYT', 'id': '770430685307805696'}, {'start': 73, 'end': 82, 'username': 'Temprist', 'id': '2846152221'}], 'urls': [{'start': 83, 'end': 106, 'url': 'https://t.co/FxQndpDZqn', 'expanded_url': 'https://twitter.com/DeaterpIays/status/1525120056794959874/video/1', 'display_url': 'pic.twitter.com/FxQndpDZqn', 'media_key': '7_1525119415444029441'}]}",{'media_keys': ['7_1525119415444029441']},False,,everyone,Twitter Web App
1525041827241512961,1280329914776989696,@Moxxietheoofer @GoodReddit what is this image I must know,2022-05-13 09:14:40+00:00,,0,1,1,0,en,1524774338376916995,[],"{'mentions': [{'start': 0, 'end': 15, 'username': 'Moxxietheoofer', 'id': '1471588510905913360'}, {'start': 16, 'end': 27, 'username': 'GoodReddit', 'id': '1313147693628297218'}]}",,False,,everyone,Twitter Web App
1525196981907357699,3025674465,What if... Roblox just made every single item limited?,2022-05-13 19:31:11+00:00,,100,531,3667,16,en,1525196981907357699,"[{'domain': {'id': '71', 'name': 'Video Game', 'description': 'A video game like Overwatch'}, 'entity': {'id': '1088118927580774400', 'name': 'Roblox', 'description': 'Roblox'}}]","{'annotations': [{'start': 11, 'end': 16, 'probability': 0.4499, 'type': 'Product', 'normalized_text': 'Roblox'}]}",,False,,everyone,Twitter Web App
1525205842760552450,1271249803649916928,@sam_lovesroblox @max_lovesroblox can we watch it together i dont even rememeber it,2022-05-13 20:06:24+00:00,,0,1,0,0,en,1525205742059409413,[],"{'mentions': [{'start': 0, 'end': 16, 'username': 'sam_lovesroblox', 'id': '1400194705875472387'}, {'start': 17, 'end': 33, 'username': 'max_lovesroblox', 'id': '1514966276640317442'}]}",,False,,everyone,Twitter Web App
1525204301223796736,1476933025216794654,MEEPCITY IS HACKED?????? @roblox @sharkblox @Meepcityishacked what is happening to my screen?? https://t.co/v8vuD8A76y,2022-05-13 20:00:16+00:00,,0,1,1,0,en,1525204301223796736,"[{'domain': {'id': '71', 'name': 'Video Game', 'description': 'A video game like Overwatch'}, 'entity': {'id': '1088118927580774400', 'name': 'Roblox', 'description': 'Roblox'}}]","{'mentions': [{'start': 25, 'end': 32, 'username': 'Roblox', 'id': '16745055'}, {'start': 33, 'end': 43, 'username': 'sharkblox', 'id': '882275269201014785'}], 'urls': [{'start': 95, 'end': 118, 'url': 'https://t.co/v8vuD8A76y', 'expanded_url': 'https://twitter.com/XxLuna_OnYt/status/1525204301223796736/photo/1', 'display_url': 'pic.twitter.com/v8vuD8A76y', 'media_key': '3_1525204169858207744'}]}",{'media_keys': ['3_1525204169858207744']},False,,everyone,Twitter Web App
1525205548853080064,1271249803649916928,@sam_lovesroblox @max_lovesroblox shes liking all of mine too idiot dont feel special,2022-05-13 20:05:14+00:00,,0,1,0,0,en,1525205439650185216,[],"{'mentions': [{'start': 0, 'end': 16, 'username': 'sam_lovesroblox', 'id': '1400194705875472387'}, {'start': 17, 'end': 33, 'username': 'max_lovesroblox', 'id': '1514966276640317442'}]}",,False,,everyone,Twitter Web App
1525205712325992451,1271249803649916928,@sam_lovesroblox @max_lovesroblox see they just had to add batman because ur stupid lego movie wasnt even good enough it sucks,2022-05-13 20:05:53+00:00,,0,1,0,0,en,1525204950636285955,"[{'domain': {'id': '45', 'name': 'Brand Vertical', 'description': 'Top level entities that describe a Brands industry'}, 'entity': {'id': '781974596740190208', 'name': 'CPG'}}, {'domain': {'id': '46', 'name': 'Brand Category', 'description': 'Categories within Brand Verticals that narrow down the scope of Brands'}, 'entity': {'id': '781974596148862977', 'name': 'Child Care'}}, {'domain': {'id': '47', 'name': 'Brand', 'description': 'Brands and Companies'}, 'entity': {'id': '10024374015', 'name': 'LEGO'}}, {'domain': {'id': '65', 'name': 'Interests and Hobbies Vertical', 'description': 'Top level interests and hobbies groupings, like Food or Travel'}, 'entity': {'id': '864925500627484672', 'name': 'Family and life stages', 'description': 'Family and Life Stages'}}, {'domain': {'id': '87', 'name': 'Movie Genre', 'description': 'A movie genre like Action'}, 'entity': {'id': '1478371796449517568', 'name': 'Superhero films'}}, {'domain': {'id': '130', 'name': 'Multimedia Franchise', 'description': ""Franchises which span multiple forms of media like 'Harry Potter'""}, 'entity': {'id': '1080503141345374208', 'name': 'DC Extended Universe', 'description': 'DC Extended Universe (DCEU)'}}, {'domain': {'id': '130', 'name': 'Multimedia Franchise', 'description': ""Franchises which span multiple forms of media like 'Harry Potter'""}, 'entity': {'id': '1499034278327246853', 'name': 'Batman'}}]","{'mentions': [{'start': 0, 'end': 16, 'username': 'sam_lovesroblox', 'id': '1400194705875472387'}, {'start': 17, 'end': 33, 'username': 'max_lovesroblox', 'id': '1514966276640317442'}]}",,False,,everyone,Twitter Web App
1525137552461729796,888867384404176896,"Who wants 10,000 Robux?",2022-05-13 15:35:02+00:00,,261,2985,1351,13,en,1525137552461729796,[],,,False,,everyone,Twitter for iPhone
1524857909112209409,1397049726160105478,"American Naval Officer Caps will be on sale tomorrow! 
#RobloxDev #RobloxUGC #Roblox https://t.co/lIhwDN83J3",2022-05-12 21:03:50+00:00,,14,9,108,1,en,1524857909112209409,"[{'domain': {'id': '71', 'name': 'Video Game', 'description': 'A video game like Overwatch'}, 'entity': {'id': '1088118927580774400', 'name': 'Roblox', 'description': 'Roblox'}}]","{'hashtags': [{'start': 55, 'end': 65, 'tag': 'RobloxDev'}, {'start': 66, 'end': 76, 'tag': 'RobloxUGC'}, {'start': 77, 'end': 84, 'tag': 'Roblox'}], 'annotations': [{'start': 0, 'end': 26, 'probability': 0.3401, 'type': 'Organization', 'normalized_text': 'American Naval Officer Caps'}], 'urls': [{'start': 85, 'end': 108, 'url': 'https://t.co/lIhwDN83J3', 'expanded_url': 'https://twitter.com/II_Lion801/status/1524857909112209409/photo/1', 'display_url': 'pic.twitter.com/lIhwDN83J3', 'media_key': '3_1524857759606272002'}]}",{'media_keys': ['3_1524857759606272002']},False,,everyone,Twitter Web App
1525205137136001024,1289032501718130690,@RBXNews_ sticth face limited for 900 years and for 9000000000000000000000000000000000000000000000000000000000000000000000000000000000000000000 robux and remove the face from every inventary and no more slenders,2022-05-13 20:03:36+00:00,,0,9,21,0,en,1525181488312070144,[],"{'mentions': [{'start': 0, 'end': 9, 'username': 'RBXNews_', 'id': '1199001259904307207'}]}",,False,,everyone,Twitter Web App
1525124366383693825,1402000875279851522,"Ay this yall pokemon metal malachite devs? This is the ""co-dev"" of pokemon metal malachite. Yall have fun supporting a dev team that comes to start drama in other dev teams. I always voice stuff like this and keep stuff 100% real. https://t.co/49wQ0QiNq6",2022-05-13 14:42:39+00:00,,20,41,187,7,en,1525124366383693825,"[{'domain': {'id': '45', 'name': 'Brand Vertical', 'description': 'Top level entities that describe a Brands industry'}, 'entity': {'id': '781974597310615553', 'name': 'Entertainment'}}, {'domain': {'id': '46', 'name': 'Brand Category', 'description': 'Categories within Brand Verticals that narrow down the scope of Brands'}, 'entity': {'id': '781974597218340864', 'name': 'Video Games'}}, {'domain': {'id': '130', 'name': 'Multimedia Franchise', 'description': ""Franchises which span multiple forms of media like 'Harry Potter'""}, 'entity': {'id': '10045599546', 'name': 'Pokémon', 'description': 'This entity includes all conversation about the franchise, as well as any individual installments in the series, if applicable. **NOTE: Annotations redirected to domain 130 ONLY on 8/7/18.'}}]","{'urls': [{'start': 231, 'end': 254, 'url': 'https://t.co/49wQ0QiNq6', 'expanded_url': 'https://twitter.com/ItzSoara/status/1525124366383693825/photo/1', 'display_url': 'pic.twitter.com/49wQ0QiNq6', 'media_key': '3_1525123608493834240'}, {'start': 231, 'end': 254, 'url': 'https://t.co/49wQ0QiNq6', 'expanded_url': 'https://twitter.com/ItzSoara/status/1525124366383693825/photo/1', 'display_url': 'pic.twitter.com/49wQ0QiNq6', 'media_key': '3_1525123665792319488'}, {'start': 231, 'end': 254, 'url': 'https://t.co/49wQ0QiNq6', 'expanded_url': 'https://twitter.com/ItzSoara/status/1525124366383693825/photo/1', 'display_url': 'pic.twitter.com/49wQ0QiNq6', 'media_key': '3_1525123730556452867'}, {'start': 231, 'end': 254, 'url': 'https://t.co/49wQ0QiNq6', 'expanded_url': 'https://twitter.com/ItzSoara/status/1525124366383693825/photo/1', 'display_url': 'pic.twitter.com/49wQ0QiNq6', 'media_key': '3_1525123794863529985'}]}","{'media_keys': ['3_1525123608493834240', '3_1525123665792319488', '3_1525123730556452867', '3_1525123794863529985']}",False,,everyone,Twitter Web App
1525178267954814977,1505915394770493451,@ybPresidentNBA @Roblox I hate fortnite roblox has a game like fortnite much same and it has much games than fortnite so roblox is better,2022-05-13 18:16:50+00:00,,0,2,2,0,en,1525174253712048130,"[{'domain': {'id': '71', 'name': 'Video Game', 'description': 'A video game like Overwatch'}, 'entity': {'id': '974285387987169280', 'name': 'Fortnite', 'description': 'This entity includes all conversation about the franchise, as well as any individual installments in the series, if applicable.\t\t\t'}}, {'domain': {'id': '71', 'name': 'Video Game', 'description': 'A video game like Overwatch'}, 'entity': {'id': '1088118927580774400', 'name': 'Roblox', 'description': 'Roblox'}}]","{'mentions': [{'start': 0, 'end': 15, 'username': 'ybPresidentNBA', 'id': '1492694879339790343'}, {'start': 16, 'end': 23, 'username': 'Roblox', 'id': '16745055'}]}",,False,,everyone,Twitter for Android
1525138044952662020,1313242522286727172,"Roblox Toy Code Giveaway
⭐️Starry Eyes Sparkling⭐️

How to enter:
⚡️Follow @brittdaycake 
❤️Like + ♻️Retweet
🗨️Comment ""Roblox"" 

⏳Ends at 10K Followers 
#robux #roblox #robloxtoycode https://t.co/lTjEwEI8WX",2022-05-13 15:37:00+00:00,,389,398,563,9,en,1525138044952662020,"[{'domain': {'id': '71', 'name': 'Video Game', 'description': 'A video game like Overwatch'}, 'entity': {'id': '1088118927580774400', 'name': 'Roblox', 'description': 'Roblox'}}]","{'hashtags': [{'start': 154, 'end': 160, 'tag': 'robux'}, {'start': 161, 'end': 168, 'tag': 'roblox'}, {'start': 169, 'end': 183, 'tag': 'robloxtoycode'}], 'mentions': [{'start': 75, 'end': 88, 'username': 'brittdaycake', 'id': '1313242522286727172'}], 'urls': [{'start': 184, 'end': 207, 'url': 'https://t.co/lTjEwEI8WX', 'expanded_url': 'https://twitter.com/brittdaycake/status/1525138044952662020/photo/1', 'display_url': 'pic.twitter.com/lTjEwEI8WX', 'media_key': '3_1525138042926817284'}]}",{'media_keys': ['3_1525138042926817284']},False,,mentionedUsers,Twitter for iPhone
1524876664806617088,1519933842756235264,"How much robux do you want?
Limit: 15k

#robux #roblox #giveaway",2022-05-12 22:18:22+00:00,,229,2911,1060,16,en,1524876664806617088,"[{'domain': {'id': '71', 'name': 'Video Game', 'description': 'A video game like Overwatch'}, 'entity': {'id': '1088118927580774400', 'name': 'Roblox', 'description': 'Roblox'}}]","{'hashtags': [{'start': 40, 'end': 46, 'tag': 'robux'}, {'start': 47, 'end': 54, 'tag': 'roblox'}, {'start': 55, 'end': 64, 'tag': 'giveaway'}]}",,False,,everyone,Twitter for iPad
1525205336738738179,70637143,"@Fotomaf Si claro, es la cenicienta de las zapatillas 😂",2022-05-13 20:04:23+00:00,,0,1,0,0,es,1525110106714689536,[],"{'mentions': [{'start': 0, 'end': 8, 'username': 'Fotomaf', 'id': '1638691'}]}",,False,,everyone,Twitter for Android
1525202294727376896,1514966276640317442,"@benloves_roblox @sam_lovesroblox @liya_fushiguro the movie makes u laugh, cry and smile effortlessly and allows you to see a new side to batman and the joker, this family movie incorporates everything you need to make a great and engaging cinematic experience with incredible visuals",2022-05-13 19:52:18+00:00,,0,2,1,1,en,1525160379898155008,"[{'domain': {'id': '86', 'name': 'Movie', 'description': 'A film like Rogue One: A Star Wars Story'}, 'entity': {'id': '1113493536949776385', 'name': 'Joker (2019)', 'description': 'Release on October 4, 2019.\nOpened query 24/7'}}, {'domain': {'id': '87', 'name': 'Movie Genre', 'description': 'A movie genre like Action'}, 'entity': {'id': '856976804749258752', 'name': 'Drama films', 'description': 'Drama'}}, {'domain': {'id': '87', 'name': 'Movie Genre', 'description': 'A movie genre like Action'}, 'entity': {'id': '1478371540559302658', 'name': 'Family films'}}, {'domain': {'id': '87', 'name': 'Movie Genre', 'description': 'A movie genre like Action'}, 'entity': {'id': '1478371796449517568', 'name': 'Superhero films'}}, {'domain': {'id': '130', 'name': 'Multimedia Franchise', 'description': ""Franchises which span multiple forms of media like 'Harry Potter'""}, 'entity': {'id': '1080503141345374208', 'name': 'DC Extended Universe', 'description': 'DC Extended Universe (DCEU)'}}, {'domain': {'id': '130', 'name': 'Multimedia Franchise', 'description': ""Franchises which span multiple forms of media like 'Harry Potter'""}, 'entity': {'id': '1499034278327246853', 'name': 'Batman'}}]","{'mentions': [{'start': 0, 'end': 16, 'username': 'benloves_roblox', 'id': '1271249803649916928'}, {'start': 17, 'end': 33, 'username': 'sam_lovesroblox', 'id': '1400194705875472387'}, {'start': 34, 'end': 49, 'username': 'liya_fushiguro', 'id': '1259054395754377217'}], 'annotations': [{'start': 138, 'end': 157, 'probability': 0.3287, 'type': 'Other', 'normalized_text': 'batman and the joker'}]}",,False,,everyone,Twitter for iPhone
1524807672159162370,1514850172458647556,@yyawnzzz @roblox_player15 @Pride @jamjamjoo Completely arbitrary and non-inclusive bigoted reasoning,2022-05-12 17:44:13+00:00,,0,1,2,0,en,1399806927610081280,[],"{'mentions': [{'start': 0, 'end': 9, 'username': 'yyawnzzz', 'id': '1374606895139422209'}, {'start': 10, 'end': 26, 'username': 'roblox_player15', 'id': '1400471200023908356'}, {'start': 27, 'end': 33, 'username': 'Pride', 'id': '1098294927774048256'}, {'start': 34, 'end': 44, 'username': 'jamjamjoo', 'id': '1511332577004687369'}]}",,False,,everyone,Twitter for iPhone
1524508203563814912,3115193878,yall fw the secondary fit ft gravee hat https://t.co/DWqEmfwftl,2022-05-11 21:54:14+00:00,,0,4,7,1,en,1524508203563814912,[],"{'urls': [{'start': 40, 'end': 63, 'url': 'https://t.co/DWqEmfwftl', 'expanded_url': 'https://twitter.com/cringeguava/status/1524508203563814912/photo/1', 'display_url': 'pic.twitter.com/DWqEmfwftl', 'media_key': '3_1524508109611413504'}, {'start': 40, 'end': 63, 'url': 'https://t.co/DWqEmfwftl', 'expanded_url': 'https://twitter.com/cringeguava/status/1524508203563814912/photo/1', 'display_url': 'pic.twitter.com/DWqEmfwftl', 'media_key': '3_1524508121376374794'}]}","{'media_keys': ['3_1524508109611413504', '3_1524508121376374794']}",False,,everyone,Twitter Web App
