tweetid,author_id,text,created_at,geo,retweets,replies,likes,quote_count,lang,conversation_id,context_annotations,entities,attachments,possibly_sensitive,withheld,reply_settings,source
1523766690860847105,858065622097436672,"🥁 We are excited to announce... 
A new member to our team!: @critstyx! 🎉

He's new to Roblox and an extremely talented programmer. He actually had a helping hand in our latest update and will be helping us for many updates to come!

❤️ Please give @critstyx a warm welcome! https://t.co/1IbFJR5nxh",2022-05-09 20:47:43+00:00,,234,702,3514,28,en,1523766690860847105,"[{'domain': {'id': '30', 'name': 'Entities [Entity Service]', 'description': 'Entity Service top level domain, every item that is in Entity Service should be in this domain'}, 'entity': {'id': '848920371311001600', 'name': 'Technology', 'description': 'Technology and computing'}}, {'domain': {'id': '66', 'name': 'Interests and Hobbies Category', 'description': 'A grouping of interests and hobbies entities, like Novelty Food or Destinations'}, 'entity': {'id': '848921413196984320', 'name': 'Computer programming', 'description': 'Computer programming'}}, {'domain': {'id': '71', 'name': 'Video Game', 'description': 'A video game like Overwatch'}, 'entity': {'id': '1088118927580774400', 'name': 'Roblox', 'description': 'Roblox'}}]","{'urls': [{'start': 274, 'end': 297, 'url': 'https://t.co/1IbFJR5nxh', 'expanded_url': 'https://twitter.com/badimo/status/1523766690860847105/photo/1', 'display_url': 'pic.twitter.com/1IbFJR5nxh', 'media_key': '3_1523766076655300608'}], 'annotations': [{'start': 88, 'end': 93, 'probability': 0.3023, 'type': 'Product', 'normalized_text': 'Roblox'}], 'mentions': [{'start': 60, 'end': 69, 'username': 'critstyx', 'id': '1514516900407132161'}, {'start': 248, 'end': 257, 'username': 'critstyx', 'id': '1514516900407132161'}]}",{'media_keys': ['3_1523766076655300608']},False,,everyone,Twitter Web App
1523813615635206151,1300194672464330753,@TheManInTheBag1 @sonic_hedgehog @Roblox You don’t even wanna know… I’ve seen some things,2022-05-09 23:54:11+00:00,,0,1,0,0,en,1515011598812794883,"[{'domain': {'id': '71', 'name': 'Video Game', 'description': 'A video game like Overwatch'}, 'entity': {'id': '1088118927580774400', 'name': 'Roblox', 'description': 'Roblox'}}, {'domain': {'id': '130', 'name': 'Multimedia Franchise', 'description': ""Franchises which span multiple forms of media like 'Harry Potter'""}, 'entity': {'id': '993952643209773057', 'name': 'Sonic the Hedgehog', 'description': 'This entity includes all conversation about the franchise, as well as any individual installments in the series, if applicable.\t\t\t\n\nNOTE: Stopped annotating in the Video Game domain (71) on 11/15/19. Moving forward, this entity will annotate to Multimedia Franchise domain (130) only.'}}]","{'mentions': [{'start': 0, 'end': 16, 'username': 'TheManInTheBag1', 'id': '1478423540244303876'}, {'start': 17, 'end': 32, 'username': 'sonic_hedgehog', 'id': '19609162'}, {'start': 33, 'end': 40, 'username': 'Roblox', 'id': '16745055'}]}",,False,,everyone,Twitter for iPhone
1523510286334017536,1472480701719187458,"Type “Roblox” in 4 seconds ✨

No Cheating 👀",2022-05-09 03:48:52+00:00,,1,22,20,0,en,1523510286334017536,"[{'domain': {'id': '71', 'name': 'Video Game', 'description': 'A video game like Overwatch'}, 'entity': {'id': '1088118927580774400', 'name': 'Roblox', 'description': 'Roblox'}}]",,,False,,everyone,Twitter Web App
1523316400747692032,1463248543095787523,touched the back of my laptop and omg it’s so hot as if I touched a kettle 😭😭😭 is this a sign to stop playing genshin on this crappy old laptop,2022-05-08 14:58:26+00:00,,0,1,6,1,en,1523316400747692032,"[{'domain': {'id': '71', 'name': 'Video Game', 'description': 'A video game like Overwatch'}, 'entity': {'id': '1310987643765678083', 'name': 'Genshin Impact'}}]",,,False,,everyone,Twitter for iPhone
1523802464381992960,1478423540244303876,@AidenRamburger @sonic_hedgehog @Roblox whats the weirdest thing you have seen?,2022-05-09 23:09:53+00:00,,0,1,0,0,en,1515011598812794883,"[{'domain': {'id': '71', 'name': 'Video Game', 'description': 'A video game like Overwatch'}, 'entity': {'id': '1088118927580774400', 'name': 'Roblox', 'description': 'Roblox'}}, {'domain': {'id': '130', 'name': 'Multimedia Franchise', 'description': ""Franchises which span multiple forms of media like 'Harry Potter'""}, 'entity': {'id': '993952643209773057', 'name': 'Sonic the Hedgehog', 'description': 'This entity includes all conversation about the franchise, as well as any individual installments in the series, if applicable.\t\t\t\n\nNOTE: Stopped annotating in the Video Game domain (71) on 11/15/19. Moving forward, this entity will annotate to Multimedia Franchise domain (130) only.'}}]","{'mentions': [{'start': 0, 'end': 15, 'username': 'AidenRamburger', 'id': '1300194672464330753'}, {'start': 16, 'end': 31, 'username': 'sonic_hedgehog', 'id': '19609162'}, {'start': 32, 'end': 39, 'username': 'Roblox', 'id': '16745055'}]}",,False,,everyone,Twitter Web App
1523293820502548481,28522827,What do your parents think about Roblox? Have they ever even played any of the games? 🤣,2022-05-08 13:28:42+00:00,,26,310,806,6,en,1523293820502548481,"[{'domain': {'id': '71', 'name': 'Video Game', 'description': 'A video game like Overwatch'}, 'entity': {'id': '1088118927580774400', 'name': 'Roblox', 'description': 'Roblox'}}]","{'annotations': [{'start': 33, 'end': 38, 'probability': 0.431, 'type': 'Product', 'normalized_text': 'Roblox'}]}",,False,,everyone,Twitter for Android
1523813418800750593,751804277719502848,@SploopyDoopy512 yo,2022-05-09 23:53:24+00:00,,0,1,0,0,und,1523813352815964160,[],"{'mentions': [{'start': 0, 'end': 16, 'username': 'SploopyDoopy512', 'id': '1072296691494256646'}]}",,False,,everyone,Twitter for Android
1523768101623730176,866369514493149184,loving with the new material service update 👍 #Roblox #RobloxDev https://t.co/hOTebH6zUL,2022-05-09 20:53:20+00:00,,132,67,1023,7,en,1523768101623730176,"[{'domain': {'id': '71', 'name': 'Video Game', 'description': 'A video game like Overwatch'}, 'entity': {'id': '1088118927580774400', 'name': 'Roblox', 'description': 'Roblox'}}]","{'urls': [{'start': 65, 'end': 88, 'url': 'https://t.co/hOTebH6zUL', 'expanded_url': 'https://twitter.com/ArtBlox_406/status/1523768101623730176/photo/1', 'display_url': 'pic.twitter.com/hOTebH6zUL', 'media_key': '3_1523768070770151425'}, {'start': 65, 'end': 88, 'url': 'https://t.co/hOTebH6zUL', 'expanded_url': 'https://twitter.com/ArtBlox_406/status/1523768101623730176/photo/1', 'display_url': 'pic.twitter.com/hOTebH6zUL', 'media_key': '3_1523768078856818688'}, {'start': 65, 'end': 88, 'url': 'https://t.co/hOTebH6zUL', 'expanded_url': 'https://twitter.com/ArtBlox_406/status/1523768101623730176/photo/1', 'display_url': 'pic.twitter.com/hOTebH6zUL', 'media_key': '3_1523768087199338498'}, {'start': 65, 'end': 88, 'url': 'https://t.co/hOTebH6zUL', 'expanded_url': 'https://twitter.com/ArtBlox_406/status/1523768101623730176/photo/1', 'display_url': 'pic.twitter.com/hOTebH6zUL', 'media_key': '3_1523768093494980608'}], 'hashtags': [{'start': 46, 'end': 53, 'tag': 'Roblox'}, {'start': 54, 'end': 64, 'tag': 'RobloxDev'}]}","{'media_keys': ['3_1523768070770151425', '3_1523768078856818688', '3_1523768087199338498', '3_1523768093494980608']}",False,,everyone,Twitter for Android
1523812772517072896,3199165031,@carinodream this is the worst news ever sage how could you do this to me 😔 am i just a roblox kid to you? 🥺,2022-05-09 23:50:50+00:00,,0,1,0,0,en,1523809483947872256,"[{'domain': {'id': '71', 'name': 'Video Game', 'description': 'A video game like Overwatch'}, 'entity': {'id': '1088118927580774400', 'name': 'Roblox', 'description': 'Roblox'}}]","{'mentions': [{'start': 0, 'end': 12, 'username': 'carinodream', 'id': '1339758577188126720'}]}",,False,,everyone,Twitter for iPhone
1523738927357517824,1370725798320209921,Imagine if i die.. And a random person from real life tweets about it. Will you guys care?,2022-05-09 18:57:24+00:00,,5,57,65,0,en,1523738927357517824,"[{'domain': {'id': '46', 'name': 'Brand Category', 'description': 'Categories within Brand Verticals that narrow down the scope of Brands'}, 'entity': {'id': '781974596752842752', 'name': 'Services'}}, {'domain': {'id': '47', 'name': 'Brand', 'description': 'Brands and Companies'}, 'entity': {'id': '10045225402', 'name': 'Twitter'}}]",,,False,,everyone,Twitter for Android
1523738083593961473,1252124788258213888,"brains and eyeballs will not be reintroduced

i want to see the look of despair on your face when you realize the mythical you just rolled is a weak generalist https://t.co/q03z4iwWAR",2022-05-09 18:54:03+00:00,,2,25,22,0,en,1523738083593961473,[],"{'urls': [{'start': 160, 'end': 183, 'url': 'https://t.co/q03z4iwWAR', 'expanded_url': 'https://twitter.com/_AspectGames/status/1523738083593961473/photo/1', 'display_url': 'pic.twitter.com/q03z4iwWAR', 'media_key': '3_1523737967398989825'}]}",{'media_keys': ['3_1523737967398989825']},False,,everyone,Twitter Web App
1523812737029001217,1523041767590965248,@KevinRi88628601 I don't know.,2022-05-09 23:50:42+00:00,,0,3,0,0,en,1523443828190896128,[],"{'mentions': [{'start': 0, 'end': 16, 'username': 'KevinRi88628601', 'id': '1512865100427837440'}]}",,False,,everyone,Twitter for Android
1523811645428019200,1339758577188126720,@nottmeagain it’s my headcanon and it is true !!!,2022-05-09 23:46:21+00:00,,0,1,0,0,en,1523809483947872256,[],"{'mentions': [{'start': 0, 'end': 12, 'username': 'nottmeagain', 'id': '3199165031'}]}",,False,,everyone,Twitter for iPhone
1523810854986211329,1333525366133186560,roblox ou minecraft,2022-05-09 23:43:13+00:00,,1,10,14,0,en,1523810854986211329,"[{'domain': {'id': '45', 'name': 'Brand Vertical', 'description': 'Top level entities that describe a Brands industry'}, 'entity': {'id': '781974597310615553', 'name': 'Entertainment'}}, {'domain': {'id': '46', 'name': 'Brand Category', 'description': 'Categories within Brand Verticals that narrow down the scope of Brands'}, 'entity': {'id': '781974597218340864', 'name': 'Video Games'}}, {'domain': {'id': '71', 'name': 'Video Game', 'description': 'A video game like Overwatch'}, 'entity': {'id': '10043689888', 'name': 'Minecraft'}}, {'domain': {'id': '71', 'name': 'Video Game', 'description': 'A video game like Overwatch'}, 'entity': {'id': '1088118927580774400', 'name': 'Roblox', 'description': 'Roblox'}}]",,,False,,everyone,Twitter Web App
1522682091325902848,16745055,"How you wear them says a lot about you. But no matter what size and shape your avatar is, you'll wear these jeans well. Available now: https://t.co/7v25TLSvkr https://t.co/XHmiGJHLPf",2022-05-06 20:57:55+00:00,,162,1223,3623,36,en,1522682091325902848,"[{'domain': {'id': '65', 'name': 'Interests and Hobbies Vertical', 'description': 'Top level interests and hobbies groupings, like Food or Travel'}, 'entity': {'id': '844603730221707264', 'name': 'Fashion', 'description': 'Fashion'}}, {'domain': {'id': '67', 'name': 'Interests and Hobbies', 'description': 'Interests, opinions, and behaviors of individuals, groups, or cultures; like Speciality Cooking or Theme Parks'}, 'entity': {'id': '1006277139233103872', 'name': 'Behavior around fashion', 'description': 'Behavior around Fashion'}}, {'domain': {'id': '71', 'name': 'Video Game', 'description': 'A video game like Overwatch'}, 'entity': {'id': '1088118927580774400', 'name': 'Roblox', 'description': 'Roblox'}}]","{'urls': [{'start': 135, 'end': 158, 'url': 'https://t.co/7v25TLSvkr', 'expanded_url': 'https://rblx.co/pants', 'display_url': 'rblx.co/pants', 'images': [{'url': 'https://pbs.twimg.com/news_img/1522682136339263488/tqtuOYQt?format=jpg&name=orig', 'width': 1200, 'height': 630}, {'url': 'https://pbs.twimg.com/news_img/1522682136339263488/tqtuOYQt?format=jpg&name=150x150', 'width': 150, 'height': 150}], 'status': 200, 'title': 'Roblox', 'description': 'Customize your avatar with a never-ending variety of clothing options, accessories, gear, and more!', 'unwound_url': 'https://www.roblox.com/catalog?Category=3&Subcategory=60&CreatorID=1&SortType=3'}, {'start': 159, 'end': 182, 'url': 'https://t.co/XHmiGJHLPf', 'expanded_url': 'https://twitter.com/Roblox/status/1522682091325902848/photo/1', 'display_url': 'pic.twitter.com/XHmiGJHLPf', 'media_key': '3_1522681958383308800'}]}",{'media_keys': ['3_1522681958383308800']},False,,everyone,Twitter Web App
1523767547132227584,1056053249470541824,Roblox stock keeps going down and hitting new all time lows 😞 📉 Some investors hope that the stock will rise again for a “long term investment” https://t.co/qnaVQkjoNk,2022-05-09 20:51:08+00:00,,76,215,1868,24,en,1523767547132227584,"[{'domain': {'id': '71', 'name': 'Video Game', 'description': 'A video game like Overwatch'}, 'entity': {'id': '1088118927580774400', 'name': 'Roblox', 'description': 'Roblox'}}, {'domain': {'id': '65', 'name': 'Interests and Hobbies Vertical', 'description': 'Top level interests and hobbies groupings, like Food or Travel'}, 'entity': {'id': '781974596148793345', 'name': 'Business & finance'}}, {'domain': {'id': '65', 'name': 'Interests and Hobbies Vertical', 'description': 'Top level interests and hobbies groupings, like Food or Travel'}, 'entity': {'id': '781974596148793345', 'name': 'Business & finance'}}, {'domain': {'id': '66', 'name': 'Interests and Hobbies Category', 'description': 'A grouping of interests and hobbies entities, like Novelty Food or Destinations'}, 'entity': {'id': '847888632711061504', 'name': 'Personal finance', 'description': 'Personal finance'}}, {'domain': {'id': '66', 'name': 'Interests and Hobbies Category', 'description': 'A grouping of interests and hobbies entities, like Novelty Food or Destinations'}, 'entity': {'id': '857878402157629440', 'name': 'Investors and patents', 'description': 'Investors and patents'}}, {'domain': {'id': '67', 'name': 'Interests and Hobbies', 'description': 'Interests, opinions, and behaviors of individuals, groups, or cultures; like Speciality Cooking or Theme Parks'}, 'entity': {'id': '847894353708068864', 'name': 'Investing', 'description': 'Investing'}}, {'domain': {'id': '67', 'name': 'Interests and Hobbies', 'description': 'Interests, opinions, and behaviors of individuals, groups, or cultures; like Speciality Cooking or Theme Parks'}, 'entity': {'id': '847894852779900928', 'name': 'Stocks & indices', 'description': 'Stocks'}}, {'domain': {'id': '47', 'name': 'Brand', 'description': 'Brands and Companies'}, 'entity': {'id': '10026364369', 'name': 'Allstate'}}]","{'urls': [{'start': 144, 'end': 167, 'url': 'https://t.co/qnaVQkjoNk', 'expanded_url': 'https://twitter.com/Roblox_RTC/status/1523767547132227584/photo/1', 'display_url': 'pic.twitter.com/qnaVQkjoNk', 'media_key': '3_1523767544724787200'}], 'annotations': [{'start': 0, 'end': 5, 'probability': 0.374, 'type': 'Organization', 'normalized_text': 'Roblox'}]}",{'media_keys': ['3_1523767544724787200']},False,,everyone,Twitter for iPhone
1523812352897912832,1478189738792144900,@BIGDOUBLEYOU1 @ParkyxMC Sorry Minecraft,2022-05-09 23:49:10+00:00,,0,1,2,0,en,1523803894379278336,"[{'domain': {'id': '45', 'name': 'Brand Vertical', 'description': 'Top level entities that describe a Brands industry'}, 'entity': {'id': '781974597310615553', 'name': 'Entertainment'}}, {'domain': {'id': '46', 'name': 'Brand Category', 'description': 'Categories within Brand Verticals that narrow down the scope of Brands'}, 'entity': {'id': '781974597218340864', 'name': 'Video Games'}}, {'domain': {'id': '71', 'name': 'Video Game', 'description': 'A video game like Overwatch'}, 'entity': {'id': '10043689888', 'name': 'Minecraft'}}]","{'annotations': [{'start': 31, 'end': 39, 'probability': 0.5238, 'type': 'Product', 'normalized_text': 'Minecraft'}], 'mentions': [{'start': 0, 'end': 14, 'username': 'BIGDOUBLEYOU1', 'id': '2592234332'}]}",,False,,everyone,Twitter for iPhone
1523776590005424128,1460659700752596994,Nahh se imaginan  que al final el coso del roblox sea un juego de parkour re difícil con música de skz de fondo donde quien llegue primero se gana una vc con los kids o un álbum?,2022-05-09 21:27:04+00:00,,1,9,81,3,es,1523776590005424128,"[{'domain': {'id': '71', 'name': 'Video Game', 'description': 'A video game like Overwatch'}, 'entity': {'id': '1088118927580774400', 'name': 'Roblox', 'description': 'Roblox'}}]","{'annotations': [{'start': 43, 'end': 48, 'probability': 0.4267, 'type': 'Product', 'normalized_text': 'roblox'}, {'start': 66, 'end': 72, 'probability': 0.6139, 'type': 'Other', 'normalized_text': 'parkour'}]}",,False,,everyone,Twitter for Android
1523725438778241024,1378641450599120896,"@Roblox What is this 👀🔥
#RobloxDev https://t.co/YeYXOvs2Z3",2022-05-09 18:03:48+00:00,,0,6,25,0,en,1523725438778241024,"[{'domain': {'id': '71', 'name': 'Video Game', 'description': 'A video game like Overwatch'}, 'entity': {'id': '1088118927580774400', 'name': 'Roblox', 'description': 'Roblox'}}]","{'urls': [{'start': 35, 'end': 58, 'url': 'https://t.co/YeYXOvs2Z3', 'expanded_url': 'https://twitter.com/000Scripter/status/1523725438778241024/photo/1', 'display_url': 'pic.twitter.com/YeYXOvs2Z3', 'media_key': '3_1523725357668614145'}], 'mentions': [{'start': 0, 'end': 7, 'username': 'Roblox', 'id': '16745055'}], 'hashtags': [{'start': 24, 'end': 34, 'tag': 'RobloxDev'}]}",{'media_keys': ['3_1523725357668614145']},False,,everyone,Twitter Web App
1523810607589384192,1322822292401999872,@FalconLfan @imJoblessss @NotBlizzzo @MrBeast 1 i’m a girl 2 you probably play fucking cod and rocket league gets  fucking life and quit trying to start shit on social media. hurry up. i’m pretty sure your mom still has to read your bedtime story still :),2022-05-09 23:42:14+00:00,,0,2,0,0,en,1523808360696451072,"[{'domain': {'id': '10', 'name': 'Person', 'description': 'Named people in the world like Nelson Mandela'}, 'entity': {'id': '1126559222122942464', 'name': 'MrBeast'}}, {'domain': {'id': '45', 'name': 'Brand Vertical', 'description': 'Top level entities that describe a Brands industry'}, 'entity': {'id': '781974597310615553', 'name': 'Entertainment'}}, {'domain': {'id': '46', 'name': 'Brand Category', 'description': 'Categories within Brand Verticals that narrow down the scope of Brands'}, 'entity': {'id': '781974597218340864', 'name': 'Video Games'}}, {'domain': {'id': '71', 'name': 'Video Game', 'description': 'A video game like Overwatch'}, 'entity': {'id': '10027933222', 'name': 'Call of Duty', 'description': 'This entity includes all conversation about the franchise, as well as any individual installments in the series, if applicable.\t\t\t'}}, {'domain': {'id': '71', 'name': 'Video Game', 'description': 'A video game like Overwatch'}, 'entity': {'id': '1135913559727067136', 'name': 'Rocket League', 'description': 'This entity includes all conversation about the franchise, as well as any individual installments in the series, if applicable.\t\t\t'}}, {'domain': {'id': '120', 'name': 'Digital Creator', 'description': 'Influencers who create content on digital platforms'}, 'entity': {'id': '1126559222122942464', 'name': 'MrBeast'}}]","{'mentions': [{'start': 0, 'end': 11, 'username': 'FalconLfan', 'id': '1503529870890090500'}, {'start': 12, 'end': 24, 'username': 'imJoblessss', 'id': '1400563929651294214'}, {'start': 25, 'end': 36, 'username': 'NotBlizzzo', 'id': '1401369200007000070'}, {'start': 37, 'end': 45, 'username': 'MrBeast', 'id': '2455740283'}]}",,False,,everyone,Twitter for iPhone
1523712323772313602,1316216456682631169,Gimme games to pley ples,2022-05-09 17:11:41+00:00,,22,258,2583,4,en,1523712323772313602,[],,,False,,everyone,Twitter for iPhone
1523767774958346240,1067212876211982336,Opening my map in 10 minutes!,2022-05-09 20:52:02+00:00,,2,18,40,0,en,1523767774958346240,[],,,False,,everyone,Twitter Web App
1523738962946273280,466328748,Finalement mon vieil ordre de $LUNA à $40 pour recharger ... on va p'tre patienter il est p'tre trop haut LOL,2022-05-09 18:57:33+00:00,,0,1,0,0,fr,1523738962946273280,[],"{'cashtags': [{'start': 30, 'end': 35, 'tag': 'LUNA'}]}",,False,,everyone,Twitter Web App
1523784543555448836,1438611443927166976,@sincleopatra @Totally_0ne @Gl_acial @Roblox_RTC @FGteev Well that's me loading a gun at you for asking,2022-05-09 21:58:40+00:00,,0,1,0,0,en,1523612153873584128,"[{'domain': {'id': '10', 'name': 'Person', 'description': 'Named people in the world like Nelson Mandela'}, 'entity': {'id': '1381600508461285383', 'name': 'FGTEEV'}}, {'domain': {'id': '120', 'name': 'Digital Creator', 'description': 'Influencers who create content on digital platforms'}, 'entity': {'id': '1381600508461285383', 'name': 'FGTEEV'}}, {'domain': {'id': '136', 'name': 'Video Game Personality ', 'description': ''}, 'entity': {'id': '1381600508461285383', 'name': 'FGTEEV'}}]","{'mentions': [{'start': 0, 'end': 13, 'username': 'sincleopatra', 'id': '1399833002595786756'}, {'start': 14, 'end': 26, 'username': 'Totally_0ne', 'id': '1520455000865984512'}, {'start': 27, 'end': 36, 'username': 'Gl_acial', 'id': '1235005904325611521'}, {'start': 37, 'end': 48, 'username': 'Roblox_RTC', 'id': '1056053249470541824'}, {'start': 49, 'end': 56, 'username': 'FGteev', 'id': '4901727369'}]}",,False,,everyone,Twitter for Android
1523811178278834177,1161824261859729408,roblox time 🕺,2022-05-09 23:44:30+00:00,,0,2,2,0,en,1523811178278834177,"[{'domain': {'id': '71', 'name': 'Video Game', 'description': 'A video game like Overwatch'}, 'entity': {'id': '1088118927580774400', 'name': 'Roblox', 'description': 'Roblox'}}]",,,False,,everyone,Twitter for iPhone
1523621535986032644,1101376954161229827,Seriously roblox wth is this... 😭💀 https://t.co/jVARBEhZbN,2022-05-09 11:10:56+00:00,,57,254,435,5,en,1523621535986032644,"[{'domain': {'id': '71', 'name': 'Video Game', 'description': 'A video game like Overwatch'}, 'entity': {'id': '1088118927580774400', 'name': 'Roblox', 'description': 'Roblox'}}]","{'urls': [{'start': 35, 'end': 58, 'url': 'https://t.co/jVARBEhZbN', 'expanded_url': 'https://twitter.com/imcyrian/status/1523621535986032644/photo/1', 'display_url': 'pic.twitter.com/jVARBEhZbN', 'media_key': '3_1523621529937797120'}, {'start': 35, 'end': 58, 'url': 'https://t.co/jVARBEhZbN', 'expanded_url': 'https://twitter.com/imcyrian/status/1523621535986032644/photo/1', 'display_url': 'pic.twitter.com/jVARBEhZbN', 'media_key': '3_1523621533293236224'}]}","{'media_keys': ['3_1523621529937797120', '3_1523621533293236224']}",False,,everyone,Twitter for Android
1523751407827922944,227432818,"I loved Leah's super cute idea from the other day and now I'm curious... show me your Royale High OC, vs your Roblox avatar OC 🥰",2022-05-09 19:47:00+00:00,,18,123,454,1,en,1523751407827922944,"[{'domain': {'id': '71', 'name': 'Video Game', 'description': 'A video game like Overwatch'}, 'entity': {'id': '1088118927580774400', 'name': 'Roblox', 'description': 'Roblox'}}, {'domain': {'id': '71', 'name': 'Video Game', 'description': 'A video game like Overwatch'}, 'entity': {'id': '1230882318224510978', 'name': 'Royale High'}}]","{'annotations': [{'start': 8, 'end': 11, 'probability': 0.986, 'type': 'Person', 'normalized_text': 'Leah'}, {'start': 86, 'end': 99, 'probability': 0.3998, 'type': 'Product', 'normalized_text': 'Royale High OC'}, {'start': 110, 'end': 115, 'probability': 0.5829, 'type': 'Product', 'normalized_text': 'Roblox'}]}",,False,,everyone,TweetDeck
1523714513262215168,1280632147343216641,"[ENDS 5/12] $5,000 Robux Card, Like this Tweet and follow to Win! https://t.co/Ltu6gvpJcW",2022-05-09 17:20:23+00:00,,268,552,1353,2,en,1523714513262215168,"[{'domain': {'id': '46', 'name': 'Brand Category', 'description': 'Categories within Brand Verticals that narrow down the scope of Brands'}, 'entity': {'id': '781974596752842752', 'name': 'Services'}}, {'domain': {'id': '47', 'name': 'Brand', 'description': 'Brands and Companies'}, 'entity': {'id': '10045225402', 'name': 'Twitter'}}]","{'urls': [{'start': 66, 'end': 89, 'url': 'https://t.co/Ltu6gvpJcW', 'expanded_url': 'https://twitter.com/plebcy/status/1523714513262215168/photo/1', 'display_url': 'pic.twitter.com/Ltu6gvpJcW', 'media_key': '3_1523714510154047494'}]}",{'media_keys': ['3_1523714510154047494']},False,,everyone,Twitter for iPhone
1523811280028680194,1342687472686407682,loomian legacy traders are fuming rn im sure,2022-05-09 23:44:54+00:00,,0,6,20,0,en,1523811280028680194,[],,,False,,everyone,Twitter Web App
1523335590380400640,1441147666012934152,@DSyneck @Roblox played it! its a bit too hard tho!,2022-05-08 16:14:41+00:00,,0,1,2,0,en,1517477027800317954,"[{'domain': {'id': '71', 'name': 'Video Game', 'description': 'A video game like Overwatch'}, 'entity': {'id': '1088118927580774400', 'name': 'Roblox', 'description': 'Roblox'}}]","{'mentions': [{'start': 0, 'end': 8, 'username': 'DSyneck', 'id': '1452925409171886081'}, {'start': 9, 'end': 16, 'username': 'Roblox', 'id': '16745055'}]}",,False,,everyone,Twitter Web App
