tweetid,author_id,text,created_at,geo,retweets,replies,likes,quote_count,lang,conversation_id,context_annotations,entities,attachments,possibly_sensitive,withheld,reply_settings,source
1519096516262215682,1411301770131877896,@kristy_clueless It’s like my youngest and Roblox,2022-04-26 23:30:07+00:00,,0,2,3,0,en,1519029860848521220,"[{'domain': {'id': '71', 'name': 'Video Game', 'description': 'A video game like Overwatch'}, 'entity': {'id': '1088118927580774400', 'name': 'Roblox', 'description': 'Roblox'}}]","{'annotations': [{'start': 43, 'end': 48, 'probability': 0.4383, 'type': 'Product', 'normalized_text': 'Roblox'}], 'mentions': [{'start': 0, 'end': 16, 'username': 'kristy_clueless', 'id': '866757688729927681'}]}",,False,,everyone,Twitter for iPhone
1519086693416148995,1329136656155291648,"@BruhCosmo @LukePlayzzz11 @RPlusNotifier And they say that flying to the moon was impossible, yet it still happend...",2022-04-26 22:51:05+00:00,,0,2,0,0,en,1518990831188910081,[],"{'mentions': [{'start': 0, 'end': 10, 'username': 'BruhCosmo', 'id': '1206447452082991105'}, {'start': 11, 'end': 25, 'username': 'LukePlayzzz11', 'id': '1367442079429885952'}, {'start': 26, 'end': 40, 'username': 'RPlusNotifier', 'id': '713208007522279425'}]}",,False,,everyone,Twitter Web App
1518677066325053441,44196397,🚀💫♥️ Yesss!!! ♥️💫🚀 https://t.co/0T9HzUHuh6,2022-04-25 19:43:22+00:00,,363648,155068,2671262,64546,und,1518677066325053441,"[{'domain': {'id': '10', 'name': 'Person', 'description': 'Named people in the world like Nelson Mandela'}, 'entity': {'id': '808713037230157824', 'name': 'Elon Musk', 'description': 'Elon Musk'}}, {'domain': {'id': '65', 'name': 'Interests and Hobbies Vertical', 'description': 'Top level interests and hobbies groupings, like Food or Travel'}, 'entity': {'id': '781974596148793345', 'name': 'Business & finance'}}, {'domain': {'id': '66', 'name': 'Interests and Hobbies Category', 'description': 'A grouping of interests and hobbies entities, like Novelty Food or Destinations'}, 'entity': {'id': '857878777191211008', 'name': 'Leadership', 'description': 'Leadership'}}, {'domain': {'id': '30', 'name': 'Entities [Entity Service]', 'description': 'Entity Service top level domain, every item that is in Entity Service should be in this domain'}, 'entity': {'id': '857879456773357569', 'name': 'Technology', 'description': 'Technology'}}]","{'urls': [{'start': 19, 'end': 42, 'url': 'https://t.co/0T9HzUHuh6', 'expanded_url': 'https://twitter.com/elonmusk/status/1518677066325053441/photo/1', 'display_url': 'pic.twitter.com/0T9HzUHuh6', 'media_key': '3_1518677041738043397'}]}",{'media_keys': ['3_1518677041738043397']},False,,everyone,Twitter for iPhone
1519043637727879168,1894642398,What’s the first ever game you played? 👇🏻,2022-04-26 20:00:00+00:00,,10,199,183,0,en,1519043637727879168,[],,,False,,everyone,Twitter Web App
1517191851274514441,1251677662810042371,"How much Robux have you
spent this week?",2022-04-21 17:21:40+00:00,,55,1236,611,2,en,1517191851274514441,[],,,False,,everyone,Twitter for iPhone
1518643330833272833,16745055,A casual laid-back pair of pants go well with any outfit. Which is why you can wear these with any other items and on any avatar you want. Available now: https://t.co/7v25TLSvkr https://t.co/roTr7PweQP,2022-04-25 17:29:19+00:00,,131,642,2773,23,en,1518643330833272833,"[{'domain': {'id': '65', 'name': 'Interests and Hobbies Vertical', 'description': 'Top level interests and hobbies groupings, like Food or Travel'}, 'entity': {'id': '844603730221707264', 'name': 'Fashion', 'description': 'Fashion'}}, {'domain': {'id': '67', 'name': 'Interests and Hobbies', 'description': 'Interests, opinions, and behaviors of individuals, groups, or cultures; like Speciality Cooking or Theme Parks'}, 'entity': {'id': '1006277139233103872', 'name': 'Behavior around fashion', 'description': 'Behavior around Fashion'}}, {'domain': {'id': '71', 'name': 'Video Game', 'description': 'A video game like Overwatch'}, 'entity': {'id': '1088118927580774400', 'name': 'Roblox', 'description': 'Roblox'}}, {'domain': {'id': '65', 'name': 'Interests and Hobbies Vertical', 'description': 'Top level interests and hobbies groupings, like Food or Travel'}, 'entity': {'id': '844603730221707264', 'name': 'Fashion', 'description': 'Fashion'}}, {'domain': {'id': '66', 'name': 'Interests and Hobbies Category', 'description': 'A grouping of interests and hobbies entities, like Novelty Food or Destinations'}, 'entity': {'id': '844604232737087488', 'name': 'General Fashion', 'description': 'General Fashion'}}, {'domain': {'id': '67', 'name': 'Interests and Hobbies', 'description': 'Interests, opinions, and behaviors of individuals, groups, or cultures; like Speciality Cooking or Theme Parks'}, 'entity': {'id': '849639334663696384', 'name': 'Pants', 'description': 'Pants'}}, {'domain': {'id': '173', 'name': 'Google Product Taxonomy', 'description': 'A product taxonomy created by Google'}, 'entity': {'id': '849639334663696384', 'name': 'Pants', 'description': 'Pants'}}]","{'urls': [{'start': 154, 'end': 177, 'url': 'https://t.co/7v25TLSvkr', 'expanded_url': 'https://rblx.co/pants', 'display_url': 'rblx.co/pants'}, {'start': 178, 'end': 201, 'url': 'https://t.co/roTr7PweQP', 'expanded_url': 'https://twitter.com/Roblox/status/1518643330833272833/video/1', 'display_url': 'pic.twitter.com/roTr7PweQP', 'media_key': '7_1518643082501140480'}]}",{'media_keys': ['7_1518643082501140480']},False,,everyone,Twitter Web App
1519060763331239936,1310688804441817088,i LOVE the rtc (roblox twitter community),2022-04-26 21:08:03+00:00,,10,42,103,2,en,1519060763331239936,"[{'domain': {'id': '71', 'name': 'Video Game', 'description': 'A video game like Overwatch'}, 'entity': {'id': '1088118927580774400', 'name': 'Roblox', 'description': 'Roblox'}}, {'domain': {'id': '46', 'name': 'Brand Category', 'description': 'Categories within Brand Verticals that narrow down the scope of Brands'}, 'entity': {'id': '781974596752842752', 'name': 'Services'}}, {'domain': {'id': '47', 'name': 'Brand', 'description': 'Brands and Companies'}, 'entity': {'id': '10045225402', 'name': 'Twitter'}}]",,,False,,everyone,Twitter Web App
1518755676532756481,1442193512397635584,this user misses ariana grande on tour. https://t.co/Ojo17fWQXT,2022-04-26 00:55:45+00:00,,503,24,4331,32,en,1518755676532756481,"[{'domain': {'id': '10', 'name': 'Person', 'description': 'Named people in the world like Nelson Mandela'}, 'entity': {'id': '806557506851848192', 'name': 'Ariana Grande', 'description': 'Ariana Grande'}}, {'domain': {'id': '54', 'name': 'Musician', 'description': 'A musician in the world, like Adele or Bob Dylan'}, 'entity': {'id': '806557506851848192', 'name': 'Ariana Grande', 'description': 'Ariana Grande'}}]","{'urls': [{'start': 40, 'end': 63, 'url': 'https://t.co/Ojo17fWQXT', 'expanded_url': 'https://twitter.com/imaginepovss/status/1518755676532756481/photo/1', 'display_url': 'pic.twitter.com/Ojo17fWQXT', 'media_key': '3_1518755673802264583'}], 'annotations': [{'start': 17, 'end': 29, 'probability': 0.5146, 'type': 'Person', 'normalized_text': 'ariana grande'}]}",{'media_keys': ['3_1518755673802264583']},False,,everyone,Twitter for iPhone
1519019541002608640,3028676001,"Roblox is...

(let your keyboard finish the sentence)",2022-04-26 18:24:15+00:00,,9,874,397,7,en,1519019541002608640,"[{'domain': {'id': '71', 'name': 'Video Game', 'description': 'A video game like Overwatch'}, 'entity': {'id': '1088118927580774400', 'name': 'Roblox', 'description': 'Roblox'}}]",,,False,,everyone,Twitter Web App
1519097144971464705,1167857673401880576,@WhoseTrade yeah i was actually laughing when i joined the nfl tycoon game lol,2022-04-26 23:32:37+00:00,,0,1,2,0,en,1519095658921218049,"[{'domain': {'id': '3', 'name': 'TV Shows', 'description': 'Television shows from around the world'}, 'entity': {'id': '10000612773', 'name': 'NFL Football', 'description': 'Replays of classic NFL games.'}}, {'domain': {'id': '3', 'name': 'TV Shows', 'description': 'Television shows from around the world'}, 'entity': {'id': '10032425201', 'name': 'NFL Football'}}, {'domain': {'id': '3', 'name': 'TV Shows', 'description': 'Television shows from around the world'}, 'entity': {'id': '10033407327', 'name': 'Futebol NFL'}}, {'domain': {'id': '3', 'name': 'TV Shows', 'description': 'Television shows from around the world'}, 'entity': {'id': '10042261464', 'name': 'Fútbol Americano de la NFL'}}, {'domain': {'id': '11', 'name': 'Sport', 'description': 'Types of sports, like soccer and basketball'}, 'entity': {'id': '689566306014617600', 'name': 'American football'}}, {'domain': {'id': '26', 'name': 'Sports League', 'description': ''}, 'entity': {'id': '689566314835259392', 'name': 'NFL'}}, {'domain': {'id': '45', 'name': 'Brand Vertical', 'description': 'Top level entities that describe a Brands industry'}, 'entity': {'id': '781974597310615553', 'name': 'Entertainment'}}, {'domain': {'id': '46', 'name': 'Brand Category', 'description': 'Categories within Brand Verticals that narrow down the scope of Brands'}, 'entity': {'id': '781974597491040257', 'name': 'Sports'}}, {'domain': {'id': '47', 'name': 'Brand', 'description': 'Brands and Companies'}, 'entity': {'id': '10042758256', 'name': 'NFL'}}]","{'annotations': [{'start': 59, 'end': 61, 'probability': 0.4563, 'type': 'Organization', 'normalized_text': 'nfl'}], 'mentions': [{'start': 0, 'end': 11, 'username': 'WhoseTrade', 'id': '3143454491'}]}",,False,,everyone,Twitter Web App
1518808446526709760,1296655673896378369,Qn quiere jugar conmigo este juego?? https://t.co/HtKeinMAF5,2022-04-26 04:25:26+00:00,,0,1,0,0,es,1518808446526709760,[],"{'urls': [{'start': 37, 'end': 60, 'url': 'https://t.co/HtKeinMAF5', 'expanded_url': 'https://twitter.com/BTS_Notices/status/1518808446526709760/photo/1', 'display_url': 'pic.twitter.com/HtKeinMAF5', 'media_key': '3_1518808445025193984'}]}",{'media_keys': ['3_1518808445025193984']},False,,everyone,Twitter for Android
1519040203637198850,827710059459256320,"@_terrisaurus @Roblox thank you so so much for everything you've done for the community and myself. 15 year old me forever is grateful for instilling confidence in me and always being there for all of us devs. i wish you the best of luck wherever you go next, but we will miss you greatly!!!",2022-04-26 19:46:21+00:00,,0,1,9,0,en,1519033325414850560,"[{'domain': {'id': '71', 'name': 'Video Game', 'description': 'A video game like Overwatch'}, 'entity': {'id': '1088118927580774400', 'name': 'Roblox', 'description': 'Roblox'}}]","{'mentions': [{'start': 0, 'end': 13, 'username': '_terrisaurus', 'id': '778274087202267136'}, {'start': 14, 'end': 21, 'username': 'Roblox', 'id': '16745055'}]}",,False,,everyone,Twitter Web App
1519033325414850560,778274087202267136,"1.Hi! A couple months ago, I decided to part ways with @Roblox. It has been an incredible 5 1/2 years, growing professionally and personally with most amazing Robloxians, developers, creators, and dreamers out here. Thanks for the memories we've made together! I will cherish them https://t.co/aeTBwAlEXw",2022-04-26 19:19:01+00:00,,33,124,1186,4,en,1519033325414850560,"[{'domain': {'id': '71', 'name': 'Video Game', 'description': 'A video game like Overwatch'}, 'entity': {'id': '1088118927580774400', 'name': 'Roblox', 'description': 'Roblox'}}]","{'urls': [{'start': 281, 'end': 304, 'url': 'https://t.co/aeTBwAlEXw', 'expanded_url': 'https://twitter.com/_terrisaurus/status/1519033325414850560/photo/1', 'display_url': 'pic.twitter.com/aeTBwAlEXw', 'media_key': '3_1519016672627073025'}], 'mentions': [{'start': 55, 'end': 62, 'username': 'Roblox', 'id': '16745055'}]}",{'media_keys': ['3_1519016672627073025']},False,,everyone,Twitter Web App
1518953170751430658,59515801,"Welcome to My Hello Kitty Cafe! 🎀 Join Hello Kitty and Friends in a supercute world full of fun and sweet surprises. Create, manage, and decorate your very own Hello Kitty Cafe while making new friends along the way. Available only on @Roblox. Learn more: https://t.co/cBZ0th3gKV https://t.co/PZtI8BBKrL",2022-04-26 14:00:31+00:00,,402,81,2540,326,en,1518953170751430658,"[{'domain': {'id': '10', 'name': 'Person', 'description': 'Named people in the world like Nelson Mandela'}, 'entity': {'id': '1443277565393719296', 'name': 'Hello Kitty'}}, {'domain': {'id': '45', 'name': 'Brand Vertical', 'description': 'Top level entities that describe a Brands industry'}, 'entity': {'id': '781974596706635776', 'name': 'Retail'}}, {'domain': {'id': '46', 'name': 'Brand Category', 'description': 'Categories within Brand Verticals that narrow down the scope of Brands'}, 'entity': {'id': '781974597302296576', 'name': 'Specialty'}}, {'domain': {'id': '47', 'name': 'Brand', 'description': 'Brands and Companies'}, 'entity': {'id': '1038116841485303808', 'name': 'Sanrio', 'description': 'Sanrio (サンリオ)'}}, {'domain': {'id': '47', 'name': 'Brand', 'description': 'Brands and Companies'}, 'entity': {'id': '1443277565393719296', 'name': 'Hello Kitty'}}, {'domain': {'id': '65', 'name': 'Interests and Hobbies Vertical', 'description': 'Top level interests and hobbies groupings, like Food or Travel'}, 'entity': {'id': '834828264786898945', 'name': 'Drinks', 'description': 'Drinks'}}, {'domain': {'id': '66', 'name': 'Interests and Hobbies Category', 'description': 'A grouping of interests and hobbies entities, like Novelty Food or Destinations'}, 'entity': {'id': '834828445238431744', 'name': 'Generic Drinks', 'description': 'Generic Drinks'}}, {'domain': {'id': '67', 'name': 'Interests and Hobbies', 'description': 'Interests, opinions, and behaviors of individuals, groups, or cultures; like Speciality Cooking or Theme Parks'}, 'entity': {'id': '850442647088971776', 'name': 'Coffee', 'description': 'Coffee'}}, {'domain': {'id': '71', 'name': 'Video Game', 'description': 'A video game like Overwatch'}, 'entity': {'id': '1088118927580774400', 'name': 'Roblox', 'description': 'Roblox'}}, {'domain': {'id': '122', 'name': 'Fictional Character', 'description': 'A person or other being in a narrative work of art, like Tom Sawyer or Jon Snow'}, 'entity': {'id': '1443277565393719296', 'name': 'Hello Kitty'}}, {'domain': {'id': '65', 'name': 'Interests and Hobbies Vertical', 'description': 'Top level interests and hobbies groupings, like Food or Travel'}, 'entity': {'id': '834828264786898945', 'name': 'Drinks', 'description': 'Drinks'}}, {'domain': {'id': '66', 'name': 'Interests and Hobbies Category', 'description': 'A grouping of interests and hobbies entities, like Novelty Food or Destinations'}, 'entity': {'id': '834828445238431744', 'name': 'Generic Drinks', 'description': 'Generic Drinks'}}, {'domain': {'id': '67', 'name': 'Interests and Hobbies', 'description': 'Interests, opinions, and behaviors of individuals, groups, or cultures; like Speciality Cooking or Theme Parks'}, 'entity': {'id': '850442647088971776', 'name': 'Coffee', 'description': 'Coffee'}}]","{'urls': [{'start': 256, 'end': 279, 'url': 'https://t.co/cBZ0th3gKV', 'expanded_url': 'https://bit.ly/3KbBcPG', 'display_url': 'bit.ly/3KbBcPG', 'status': 200, 'title': 'Roblox x Hello Kitty and Friends', 'description': 'Also Available on: Introducing My Hello Kitty Cafe on Roblox, an experience that enables creativity and full control over your very own cafe in the Hello Kitty universe. Community members have the chance to build from the ground up, manage, and expand their cafe with the help from Hello Kitty and her friends such as My', 'unwound_url': 'https://www.sanrio.com/pages/roblox-x-hello-kitty-and-friends?utm_source=TW&utm_campaign=220426_RobloxLaunch&utm_medium=Post&utm_term=SAN&sf163898523=1'}, {'start': 280, 'end': 303, 'url': 'https://t.co/PZtI8BBKrL', 'expanded_url': 'https://twitter.com/sanrio/status/1518953170751430658/video/1', 'display_url': 'pic.twitter.com/PZtI8BBKrL', 'media_key': '7_1518953102782644224'}], 'mentions': [{'start': 235, 'end': 242, 'username': 'Roblox', 'id': '16745055'}]}",{'media_keys': ['7_1518953102782644224']},False,,everyone,Khoros Publishing App
1519097283433975809,424558608,@ilyr0x @Spliitzz1 @AyoEndvyy @Spliitzz1 @fukcracn say it for me my children,2022-04-26 23:33:10+00:00,,0,4,0,0,en,1519063216432816130,[],"{'mentions': [{'start': 19, 'end': 29, 'username': 'AyoEndvyy', 'id': '1035700671708717056'}]}",,False,,everyone,Twitter for iPhone
1517217160552087553,719254445448495104,@Snapback48 https://t.co/ODBRYme1y5,2022-04-21 19:02:14+00:00,,93,48,3789,29,qme,1517212298586181632,[],"{'urls': [{'start': 12, 'end': 35, 'url': 'https://t.co/ODBRYme1y5', 'expanded_url': 'https://twitter.com/bigwanger12/status/1517217160552087553/photo/1', 'display_url': 'pic.twitter.com/ODBRYme1y5', 'media_key': '3_1517217157720944640'}], 'mentions': [{'start': 0, 'end': 11, 'username': 'Snapback48', 'id': '1473012701345595395'}]}",{'media_keys': ['3_1517217157720944640']},False,,everyone,Twitter for iPhone
1518979302439755778,1132099522405044225,Type roblox with your face,2022-04-26 15:44:21+00:00,,20,688,471,5,en,1518979302439755778,"[{'domain': {'id': '71', 'name': 'Video Game', 'description': 'A video game like Overwatch'}, 'entity': {'id': '1088118927580774400', 'name': 'Roblox', 'description': 'Roblox'}}]",,,False,,everyone,Twitter for iPhone
1519096529822175232,1488623330622308352,no se q jugar me aburro,2022-04-26 23:30:10+00:00,,0,3,1,0,es,1519096529822175232,[],,,False,,everyone,Twitter for Android
1518617193117794306,1296186402544275456,"100k diamond giveaway ! ~ 💎

• follow me + @ministry10123 
• like + rt

~ extras in thread ~",2022-04-25 15:45:28+00:00,,107,86,115,32,en,1518617193117794306,[],"{'mentions': [{'start': 43, 'end': 57, 'username': 'ministry10123', 'id': '1375331774671155203'}]}",,False,,everyone,Twitter for iPhone
1519094202608594944,1240709806547222528,Good night everyone sorry no challenge for tonight because I'm busy,2022-04-26 23:20:55+00:00,,0,6,8,0,en,1519094202608594944,[],,,False,,everyone,Twitter for Android
1519068006566948864,16745055,"From everyone here on the marketing team: it's an absolute joy working with you, Barbara. Congratulations!

(And for anyone who wants to share the joy, open roles are here: https://t.co/nFoxBBEgCC) https://t.co/iOlNF9pGAO",2022-04-26 21:36:50+00:00,,57,314,1236,4,en,1519068006566948864,"[{'domain': {'id': '66', 'name': 'Interests and Hobbies Category', 'description': 'A grouping of interests and hobbies entities, like Novelty Food or Destinations'}, 'entity': {'id': '857879016971186177', 'name': 'Marketing', 'description': 'Marketing'}}, {'domain': {'id': '71', 'name': 'Video Game', 'description': 'A video game like Overwatch'}, 'entity': {'id': '1088118927580774400', 'name': 'Roblox', 'description': 'Roblox'}}, {'domain': {'id': '164', 'name': 'Fields of study', 'description': 'for all fields of study, e.g., futurology, microbiology '}, 'entity': {'id': '1278093262406815744', 'name': 'Fields of study'}}]","{'urls': [{'start': 173, 'end': 196, 'url': 'https://t.co/nFoxBBEgCC', 'expanded_url': 'http://roblox.com/careers', 'display_url': 'roblox.com/careers'}, {'start': 198, 'end': 221, 'url': 'https://t.co/iOlNF9pGAO', 'expanded_url': 'https://twitter.com/barbmessing/status/1519045073677160448', 'display_url': 'twitter.com/barbmessing/st…'}], 'annotations': [{'start': 81, 'end': 87, 'probability': 0.9674, 'type': 'Person', 'normalized_text': 'Barbara'}]}",,False,,everyone,Twitter Web App
1519041565196488706,1025750035290566658,@manu_caradecu @sanrio @Roblox entao joga 🤨,2022-04-26 19:51:46+00:00,,0,1,1,0,pt,1518953170751430658,"[{'domain': {'id': '71', 'name': 'Video Game', 'description': 'A video game like Overwatch'}, 'entity': {'id': '1088118927580774400', 'name': 'Roblox', 'description': 'Roblox'}}]","{'mentions': [{'start': 0, 'end': 14, 'username': 'manu_caradecu', 'id': '1143534180938190850'}, {'start': 15, 'end': 22, 'username': 'sanrio', 'id': '59515801'}, {'start': 23, 'end': 30, 'username': 'Roblox', 'id': '16745055'}]}",,False,,everyone,Twitter Web App
1519066106614493184,1414613694915485701,BYTE FUNKY   LOOK https://t.co/zd2btVD3tL,2022-04-26 21:29:17+00:00,,0,1,10,0,en,1519066106614493184,[],"{'urls': [{'start': 18, 'end': 41, 'url': 'https://t.co/zd2btVD3tL', 'expanded_url': 'https://twitter.com/ByteFunkin/status/1519048143492558851', 'display_url': 'twitter.com/ByteFunkin/sta…'}]}",,False,,everyone,Twitter for iPhone
1519096866281238528,1415542213862322177,@OfficalYT_nooob https://t.co/qwnAWEvg1P,2022-04-26 23:31:31+00:00,,0,1,1,0,qme,1518940978291552256,[],"{'urls': [{'start': 17, 'end': 40, 'url': 'https://t.co/qwnAWEvg1P', 'expanded_url': 'https://twitter.com/ROBLOX77h/status/1519096866281238528/photo/1', 'display_url': 'pic.twitter.com/qwnAWEvg1P', 'media_key': '3_1519096862388940800'}], 'mentions': [{'start': 0, 'end': 16, 'username': 'OfficalYT_nooob', 'id': '1444860511967801352'}]}",{'media_keys': ['3_1519096862388940800']},False,,everyone,Twitter for Android
1518956149969760257,1310688804441817088,"About to make a weekly series exposing rtc members and having a big livestream exposing people today. Tune in, it's about to get interesting.",2022-04-26 14:12:21+00:00,,2,25,83,11,en,1518956149969760257,[],,,False,,everyone,Twitter Web App
1518957331777789953,1518948687355031556,"10k Robux Giveaway! 
Requirements:
-Follow me, @PeebleFun, @fun54658 
-Retweet
-Comment A Gamepass Link For 10k Robux

Picking Winner When I Hit 150 Followers On Here! https://t.co/aarCWRf3iZ",2022-04-26 14:17:03+00:00,,3,3,3,0,en,1518957331777789953,"[{'domain': {'id': '48', 'name': 'Product', 'description': 'Products created by Brands.  Examples: Ford Explorer, Apple iPhone.'}, 'entity': {'id': '1425921713150201858', 'name': 'Xbox Game Pass'}}, {'domain': {'id': '45', 'name': 'Brand Vertical', 'description': 'Top level entities that describe a Brands industry'}, 'entity': {'id': '781974597310615553', 'name': 'Entertainment'}}, {'domain': {'id': '46', 'name': 'Brand Category', 'description': 'Categories within Brand Verticals that narrow down the scope of Brands'}, 'entity': {'id': '781974597218340864', 'name': 'Video Games'}}, {'domain': {'id': '47', 'name': 'Brand', 'description': 'Brands and Companies'}, 'entity': {'id': '10027048851', 'name': 'Xbox'}}, {'domain': {'id': '79', 'name': 'Video Game Hardware', 'description': 'Video Game Hardware'}, 'entity': {'id': '10027048851', 'name': 'Xbox'}}]","{'urls': [{'start': 168, 'end': 191, 'url': 'https://t.co/aarCWRf3iZ', 'expanded_url': 'https://twitter.com/Camping53126949/status/1518957331777789953/photo/1', 'display_url': 'pic.twitter.com/aarCWRf3iZ', 'media_key': '3_1518957249040945152'}], 'mentions': [{'start': 47, 'end': 57, 'username': 'PeebleFun', 'id': '1504474755969155073'}, {'start': 59, 'end': 68, 'username': 'fun54658', 'id': '1125108503759265792'}]}",{'media_keys': ['3_1518957249040945152']},False,,everyone,Twitter Web App
1519096803941101572,1372985813148041217,"@thauanyyc_ @mariatadormindo concordo, porém roblox sempre no meu coração",2022-04-26 23:31:16+00:00,,0,1,0,0,pt,1519060414025318406,"[{'domain': {'id': '71', 'name': 'Video Game', 'description': 'A video game like Overwatch'}, 'entity': {'id': '1088118927580774400', 'name': 'Roblox', 'description': 'Roblox'}}]","{'mentions': [{'start': 0, 'end': 11, 'username': 'thauanyyc_', 'id': '1284865608857853955'}, {'start': 12, 'end': 28, 'username': 'mariatadormindo', 'id': '1462388239734607879'}]}",,False,,everyone,Twitter for Android
1519096402504212480,1427039720677298188,@perrinsitowo @troliadoputo @gatokuIiao @bamtorigay @yunacida sullisitos,2022-04-26 23:29:40+00:00,,0,1,0,0,es,1519083057793445894,[],"{'mentions': [{'start': 0, 'end': 13, 'username': 'perrinsitowo', 'id': '1508554855786364932'}, {'start': 14, 'end': 27, 'username': 'troliadoputo', 'id': '1147269549034790913'}, {'start': 28, 'end': 39, 'username': 'gatokuIiao', 'id': '1506433030763724803'}, {'start': 40, 'end': 51, 'username': 'bamtorigay', 'id': '1087152343479697409'}]}",,False,,everyone,Twitter for iPad
1519095901389791237,1284865608857853955,"@mariatadormindo @laysrbisca dsclp, mas mine é o melhor de todos os tempos",2022-04-26 23:27:40+00:00,,0,1,1,0,pt,1519060414025318406,[],"{'mentions': [{'start': 0, 'end': 16, 'username': 'mariatadormindo', 'id': '1462388239734607879'}, {'start': 17, 'end': 28, 'username': 'laysrbisca', 'id': '1372985813148041217'}]}",,False,,everyone,Twitter for iPhone
1519093766895792128,1277773532638801920,I am only selling beans https://t.co/X1A2znWVG0,2022-04-26 23:19:12+00:00,,0,0,4,1,en,1519093766895792128,[],"{'urls': [{'start': 24, 'end': 47, 'url': 'https://t.co/X1A2znWVG0', 'expanded_url': 'https://twitter.com/ice_icemonster/status/1519093766895792128/photo/1', 'display_url': 'pic.twitter.com/X1A2znWVG0', 'media_key': '3_1519093730015203328'}]}",{'media_keys': ['3_1519093730015203328']},False,,everyone,Twitter Web App
1519086000290635781,1738893547,@_terrisaurus @Roblox TERRI UR THE BEST ♥️♥️ TY FOR ALL YOU DID,2022-04-26 22:48:20+00:00,,0,2,8,0,en,1519033325414850560,"[{'domain': {'id': '71', 'name': 'Video Game', 'description': 'A video game like Overwatch'}, 'entity': {'id': '1088118927580774400', 'name': 'Roblox', 'description': 'Roblox'}}]","{'annotations': [{'start': 22, 'end': 26, 'probability': 0.8364, 'type': 'Person', 'normalized_text': 'TERRI'}], 'mentions': [{'start': 0, 'end': 13, 'username': '_terrisaurus', 'id': '778274087202267136'}, {'start': 14, 'end': 21, 'username': 'Roblox', 'id': '16745055'}]}",,False,,everyone,Twitter Web App
1519029860848521220,866757688729927681,Some of y'all have been spreading the rumor that they're gonna start charging for Twitter for a long damn time and y'all need to quit.,2022-04-26 19:05:15+00:00,,10,7,60,0,en,1519029860848521220,[],"{'annotations': [{'start': 82, 'end': 88, 'probability': 0.7246, 'type': 'Product', 'normalized_text': 'Twitter'}]}",,False,,everyone,Twitter Web App
