tweetid,author_id,text,created_at,geo,retweets,replies,likes,quote_count,lang,conversation_id,context_annotations,entities,attachments,possibly_sensitive,withheld,reply_settings,source
1514859745449963521,1457577138463260676,the metaverse is already here https://t.co/PFLWXqQ12r,2022-04-15 06:54:42+00:00,,0,2,10,0,en,1514859745449963521,"[{'domain': {'id': '10', 'name': 'Person', 'description': 'Named people in the world like Nelson Mandela'}, 'entity': {'id': '806561823407239169', 'name': 'Kanye West', 'description': 'Kanye West'}}, {'domain': {'id': '10', 'name': 'Person', 'description': 'Named people in the world like Nelson Mandela'}, 'entity': {'id': '806570121959383040', 'name': 'Kim Kardashian', 'description': 'Kim Kardashian'}}, {'domain': {'id': '54', 'name': 'Musician', 'description': 'A musician in the world, like Adele or Bob Dylan'}, 'entity': {'id': '806561823407239169', 'name': 'Kanye West', 'description': 'Kanye West'}}, {'domain': {'id': '55', 'name': 'Music Genre', 'description': 'A category for a musical style, like Pop, Rock, or Rap'}, 'entity': {'id': '810937888334487552', 'name': 'Rap', 'description': 'Hip-Hop/Rap'}}, {'domain': {'id': '58', 'name': 'Entertainment Personality', 'description': 'An entertainment personality in the world, like Anderson Cooper or Miranda Sings'}, 'entity': {'id': '806570121959383040', 'name': 'Kim Kardashian', 'description': 'Kim Kardashian'}}, {'domain': {'id': '30', 'name': 'Entities [Entity Service]', 'description': 'Entity Service top level domain, every item that is in Entity Service should be in this domain'}, 'entity': {'id': '848920371311001600', 'name': 'Technology', 'description': 'Technology and computing'}}, {'domain': {'id': '71', 'name': 'Video Game', 'description': 'A video game like Overwatch'}, 'entity': {'id': '1088118927580774400', 'name': 'Roblox', 'description': 'Roblox'}}, {'domain': {'id': '165', 'name': 'Technology', 'description': 'for individual and types of technology, e.g., food technology, 3D printing'}, 'entity': {'id': '848920371311001600', 'name': 'Technology', 'description': 'Technology and computing'}}]","{'urls': [{'start': 30, 'end': 53, 'url': 'https://t.co/PFLWXqQ12r', 'expanded_url': 'https://twitter.com/ayedocc/status/1514838191991361544', 'display_url': 'twitter.com/ayedocc/status…'}]}",,False,,everyone,Twitter for iPhone
1515004281644068865,1450217010265300996,"🚨 Noob's adventures breaking news 🚨
O capítulo 1 lançará dia 7 de maio (sábado)
Ás 17:30 no horário de Brasília
Ele estara disponível no build mode nesse horário caso queiram saber meu nick pra entrar ta ai:
Lucasgame28play
Aqui esta uma dica de um personagem que logo pode vir: https://t.co/vCED9ult8R",2022-04-15 16:29:02+00:00,,0,3,0,0,pt,1515004281644068865,[],"{'urls': [{'start': 279, 'end': 302, 'url': 'https://t.co/vCED9ult8R', 'expanded_url': 'https://twitter.com/Lucas_of_Roblox/status/1515004281644068865/photo/1', 'display_url': 'pic.twitter.com/vCED9ult8R', 'media_key': '3_1515004279383367680'}], 'annotations': [{'start': 105, 'end': 112, 'probability': 0.8731, 'type': 'Place', 'normalized_text': 'Brasília'}]}",{'media_keys': ['3_1515004279383367680']},True,,everyone,Twitter for Android
1515031901106733056,1162494706066046977,@Roblox @sonic_hedgehog We may or may not have some in the works 👀,2022-04-15 18:18:47+00:00,,5,4,131,0,en,1515026236241850380,"[{'domain': {'id': '71', 'name': 'Video Game', 'description': 'A video game like Overwatch'}, 'entity': {'id': '1088118927580774400', 'name': 'Roblox', 'description': 'Roblox'}}, {'domain': {'id': '130', 'name': 'Multimedia Franchise', 'description': ""Franchises which span multiple forms of media like 'Harry Potter'""}, 'entity': {'id': '993952643209773057', 'name': 'Sonic the Hedgehog', 'description': 'This entity includes all conversation about the franchise, as well as any individual installments in the series, if applicable.\t\t\t\n\nNOTE: Stopped annotating in the Video Game domain (71) on 11/15/19. Moving forward, this entity will annotate to Multimedia Franchise domain (130) only.'}}]","{'mentions': [{'start': 0, 'end': 7, 'username': 'Roblox', 'id': '16745055'}, {'start': 8, 'end': 23, 'username': 'sonic_hedgehog', 'id': '19609162'}]}",,False,,everyone,Twitter Web App
1515023402905571333,1487911756219437060,@sharky3553 gimmie the link to the sonic hat rq. i wanna try something,2022-04-15 17:45:01+00:00,,0,1,1,0,en,1514866440737853442,[],"{'mentions': [{'start': 0, 'end': 11, 'username': 'sharky3553', 'id': '1140852584590315520'}]}",,False,,everyone,Twitter Web App
1515011814454665221,196388844,@sonic_hedgehog @Roblox AAAAAAAAAAAAAAAAA https://t.co/fghVTh7gQN,2022-04-15 16:58:58+00:00,,285,43,2688,13,und,1515011598812794883,"[{'domain': {'id': '71', 'name': 'Video Game', 'description': 'A video game like Overwatch'}, 'entity': {'id': '1088118927580774400', 'name': 'Roblox', 'description': 'Roblox'}}, {'domain': {'id': '130', 'name': 'Multimedia Franchise', 'description': ""Franchises which span multiple forms of media like 'Harry Potter'""}, 'entity': {'id': '993952643209773057', 'name': 'Sonic the Hedgehog', 'description': 'This entity includes all conversation about the franchise, as well as any individual installments in the series, if applicable.\t\t\t\n\nNOTE: Stopped annotating in the Video Game domain (71) on 11/15/19. Moving forward, this entity will annotate to Multimedia Franchise domain (130) only.'}}]","{'urls': [{'start': 42, 'end': 65, 'url': 'https://t.co/fghVTh7gQN', 'expanded_url': 'https://twitter.com/chaomix/status/1515011814454665221/video/1', 'display_url': 'pic.twitter.com/fghVTh7gQN', 'media_key': '7_1515011727624224774'}], 'mentions': [{'start': 0, 'end': 15, 'username': 'sonic_hedgehog', 'id': '19609162'}, {'start': 16, 'end': 23, 'username': 'Roblox', 'id': '16745055'}]}",{'media_keys': ['7_1515011727624224774']},False,,everyone,Twitter for iPhone
1515026413241475078,1374876286208851969,@Roblox @sonic_hedgehog Gacha life&gt;roblox,2022-04-15 17:56:59+00:00,,1,61,5,1,en,1515026236241850380,"[{'domain': {'id': '71', 'name': 'Video Game', 'description': 'A video game like Overwatch'}, 'entity': {'id': '1088118927580774400', 'name': 'Roblox', 'description': 'Roblox'}}, {'domain': {'id': '130', 'name': 'Multimedia Franchise', 'description': ""Franchises which span multiple forms of media like 'Harry Potter'""}, 'entity': {'id': '993952643209773057', 'name': 'Sonic the Hedgehog', 'description': 'This entity includes all conversation about the franchise, as well as any individual installments in the series, if applicable.\t\t\t\n\nNOTE: Stopped annotating in the Video Game domain (71) on 11/15/19. Moving forward, this entity will annotate to Multimedia Franchise domain (130) only.'}}]","{'mentions': [{'start': 0, 'end': 7, 'username': 'Roblox', 'id': '16745055'}, {'start': 8, 'end': 23, 'username': 'sonic_hedgehog', 'id': '19609162'}]}",,False,,everyone,Twitter for iPhone
1515029964273463298,1417587809502826500,"@robloxdevrelptb Tema escuro, SEMPRE escuro",2022-04-15 18:11:06+00:00,,0,2,13,0,pt,1515027033394397194,[],"{'mentions': [{'start': 0, 'end': 16, 'username': 'robloxdevrelptb', 'id': '1088966685493649408'}]}",,False,,everyone,Twitter Web App
1514987144678457348,1201893465795256325,why do my tweets get so many likes,2022-04-15 15:20:57+00:00,,15,134,641,2,en,1514987144678457348,"[{'domain': {'id': '46', 'name': 'Brand Category', 'description': 'Categories within Brand Verticals that narrow down the scope of Brands'}, 'entity': {'id': '781974596752842752', 'name': 'Services'}}, {'domain': {'id': '47', 'name': 'Brand', 'description': 'Brands and Companies'}, 'entity': {'id': '10045225402', 'name': 'Twitter'}}]",,,False,,everyone,Twitter for iPhone
1515026236241850380,16745055,Anyone got any avatar accessories they'd like to recommend to @sonic_hedgehog? https://t.co/XxBNu7ju0i,2022-04-15 17:56:17+00:00,,167,1036,2785,14,en,1515026236241850380,[],"{'urls': [{'start': 79, 'end': 102, 'url': 'https://t.co/XxBNu7ju0i', 'expanded_url': 'https://twitter.com/VentureBeat/status/1514272343731814403', 'display_url': 'twitter.com/VentureBeat/st…'}], 'mentions': [{'start': 62, 'end': 77, 'username': 'sonic_hedgehog', 'id': '19609162'}]}",,False,,everyone,Twitter Web App
1515031093556170756,1099416369894952960,"@slimmyslimey @Chonibabe @broooookieeeeee @Nuecents37 U dnt kno shit about me either bitch, so fuck u",2022-04-15 18:15:35+00:00,,0,2,0,0,en,1514779850212462598,[],"{'mentions': [{'start': 0, 'end': 13, 'username': 'slimmyslimey', 'id': '1468832639343759361'}, {'start': 14, 'end': 24, 'username': 'Chonibabe', 'id': '2382503042'}, {'start': 25, 'end': 41, 'username': 'broooookieeeeee', 'id': '60807297'}, {'start': 42, 'end': 53, 'username': 'Nuecents37', 'id': '1322211039379746816'}]}",,False,,everyone,Twitter Web App
1514838191991361544,1470442246294155267,no way this is how kim kardashian called kanye about the sextape on roblox LMAOOO https://t.co/tixxFRzmLC,2022-04-15 05:29:03+00:00,,27353,3618,300154,12819,en,1514838191991361544,"[{'domain': {'id': '10', 'name': 'Person', 'description': 'Named people in the world like Nelson Mandela'}, 'entity': {'id': '806561823407239169', 'name': 'Kanye West', 'description': 'Kanye West'}}, {'domain': {'id': '10', 'name': 'Person', 'description': 'Named people in the world like Nelson Mandela'}, 'entity': {'id': '806570121959383040', 'name': 'Kim Kardashian', 'description': 'Kim Kardashian'}}, {'domain': {'id': '54', 'name': 'Musician', 'description': 'A musician in the world, like Adele or Bob Dylan'}, 'entity': {'id': '806561823407239169', 'name': 'Kanye West', 'description': 'Kanye West'}}, {'domain': {'id': '55', 'name': 'Music Genre', 'description': 'A category for a musical style, like Pop, Rock, or Rap'}, 'entity': {'id': '810937888334487552', 'name': 'Rap', 'description': 'Hip-Hop/Rap'}}, {'domain': {'id': '58', 'name': 'Entertainment Personality', 'description': 'An entertainment personality in the world, like Anderson Cooper or Miranda Sings'}, 'entity': {'id': '806570121959383040', 'name': 'Kim Kardashian', 'description': 'Kim Kardashian'}}, {'domain': {'id': '71', 'name': 'Video Game', 'description': 'A video game like Overwatch'}, 'entity': {'id': '1088118927580774400', 'name': 'Roblox', 'description': 'Roblox'}}]","{'urls': [{'start': 82, 'end': 105, 'url': 'https://t.co/tixxFRzmLC', 'expanded_url': 'https://twitter.com/ayedocc/status/1514838191991361544/video/1', 'display_url': 'pic.twitter.com/tixxFRzmLC', 'media_key': '7_1514838163092652034'}], 'annotations': [{'start': 19, 'end': 32, 'probability': 0.9784, 'type': 'Person', 'normalized_text': 'kim kardashian'}, {'start': 41, 'end': 45, 'probability': 0.9975, 'type': 'Person', 'normalized_text': 'kanye'}]}",{'media_keys': ['7_1514838163092652034']},False,,everyone,Twitter for iPhone
1515031088053239823,1046437653988683776,hihi .. i’ll read this on my bday :)) 🫂 https://t.co/Xi7M9qZzJQ,2022-04-15 18:15:33+00:00,,0,11,9,1,en,1515031088053239823,[],"{'urls': [{'start': 40, 'end': 63, 'url': 'https://t.co/Xi7M9qZzJQ', 'expanded_url': 'https://twitter.com/patitosgnf/status/1515031088053239823/photo/1', 'display_url': 'pic.twitter.com/Xi7M9qZzJQ', 'media_key': '3_1515031083636645891'}]}",{'media_keys': ['3_1515031083636645891']},False,,following,Twitter for iPhone
1515028318684422148,1341123813694722048,@johann_dieter I heard roblox got paid to be mentioned on the episode lmao puede que si es falso🤣,2022-04-15 18:04:33+00:00,,0,1,1,0,en,1514994215477993476,"[{'domain': {'id': '71', 'name': 'Video Game', 'description': 'A video game like Overwatch'}, 'entity': {'id': '1088118927580774400', 'name': 'Roblox', 'description': 'Roblox'}}]","{'mentions': [{'start': 0, 'end': 14, 'username': 'johann_dieter', 'id': '221853973'}]}",,False,,everyone,Twitter for iPhone
1515027098183913477,1422163374339727363,@Roblox @sonic_hedgehog YES!!!! https://t.co/Cbc4qJtHBG,2022-04-15 17:59:42+00:00,,2,8,99,2,und,1515026236241850380,"[{'domain': {'id': '71', 'name': 'Video Game', 'description': 'A video game like Overwatch'}, 'entity': {'id': '1088118927580774400', 'name': 'Roblox', 'description': 'Roblox'}}, {'domain': {'id': '130', 'name': 'Multimedia Franchise', 'description': ""Franchises which span multiple forms of media like 'Harry Potter'""}, 'entity': {'id': '993952643209773057', 'name': 'Sonic the Hedgehog', 'description': 'This entity includes all conversation about the franchise, as well as any individual installments in the series, if applicable.\t\t\t\n\nNOTE: Stopped annotating in the Video Game domain (71) on 11/15/19. Moving forward, this entity will annotate to Multimedia Franchise domain (130) only.'}}]","{'urls': [{'start': 32, 'end': 55, 'url': 'https://t.co/Cbc4qJtHBG', 'expanded_url': 'https://twitter.com/LeaksEvents/status/1515027098183913477/photo/1', 'display_url': 'pic.twitter.com/Cbc4qJtHBG', 'media_key': '3_1515027086687318016'}], 'mentions': [{'start': 0, 'end': 7, 'username': 'Roblox', 'id': '16745055'}, {'start': 8, 'end': 23, 'username': 'sonic_hedgehog', 'id': '19609162'}]}",{'media_keys': ['3_1515027086687318016']},False,,everyone,Twitter Web App
1515031125478977538,1477098417989898240,"@LAgurlzRBLX @IntranceRBX is this a glitch? i try to place a pixel and it just doesn't let me, i leave the game and rejoin and it still wont let me, it doesnt higlight or anything, it just puts the one next to it. #glitch #rblxglitch #starvingartistsRBX",2022-04-15 18:15:42+00:00,,0,1,1,0,en,1515031125478977538,[],"{'mentions': [{'start': 0, 'end': 12, 'username': 'LAgurlzRBLX', 'id': '1257985458908299265'}, {'start': 13, 'end': 25, 'username': 'IntranceRBX', 'id': '1005592961411792896'}], 'hashtags': [{'start': 214, 'end': 221, 'tag': 'glitch'}, {'start': 222, 'end': 233, 'tag': 'rblxglitch'}, {'start': 234, 'end': 253, 'tag': 'starvingartistsRBX'}]}",,False,,everyone,Twitter Web App
1514849597214101504,1377670267917438978,she might be the only 40 year old person to ever cry while saying the word ‘roblox’ https://t.co/R0PuMNBPaM,2022-04-15 06:14:23+00:00,,14740,501,214412,421,en,1514849597214101504,"[{'domain': {'id': '10', 'name': 'Person', 'description': 'Named people in the world like Nelson Mandela'}, 'entity': {'id': '806561823407239169', 'name': 'Kanye West', 'description': 'Kanye West'}}, {'domain': {'id': '10', 'name': 'Person', 'description': 'Named people in the world like Nelson Mandela'}, 'entity': {'id': '806570121959383040', 'name': 'Kim Kardashian', 'description': 'Kim Kardashian'}}, {'domain': {'id': '54', 'name': 'Musician', 'description': 'A musician in the world, like Adele or Bob Dylan'}, 'entity': {'id': '806561823407239169', 'name': 'Kanye West', 'description': 'Kanye West'}}, {'domain': {'id': '55', 'name': 'Music Genre', 'description': 'A category for a musical style, like Pop, Rock, or Rap'}, 'entity': {'id': '810937888334487552', 'name': 'Rap', 'description': 'Hip-Hop/Rap'}}, {'domain': {'id': '58', 'name': 'Entertainment Personality', 'description': 'An entertainment personality in the world, like Anderson Cooper or Miranda Sings'}, 'entity': {'id': '806570121959383040', 'name': 'Kim Kardashian', 'description': 'Kim Kardashian'}}, {'domain': {'id': '71', 'name': 'Video Game', 'description': 'A video game like Overwatch'}, 'entity': {'id': '1088118927580774400', 'name': 'Roblox', 'description': 'Roblox'}}]","{'urls': [{'start': 84, 'end': 107, 'url': 'https://t.co/R0PuMNBPaM', 'expanded_url': 'https://twitter.com/ayedocc/status/1514838191991361544', 'display_url': 'twitter.com/ayedocc/status…'}]}",,False,,everyone,Twitter for iPhone
1515030711249649665,1424402282410565632,Can you reply to this tweet?,2022-04-15 18:14:04+00:00,,0,1,3,0,en,1515030711249649665,"[{'domain': {'id': '46', 'name': 'Brand Category', 'description': 'Categories within Brand Verticals that narrow down the scope of Brands'}, 'entity': {'id': '781974596752842752', 'name': 'Services'}}, {'domain': {'id': '47', 'name': 'Brand', 'description': 'Brands and Companies'}, 'entity': {'id': '10045225402', 'name': 'Twitter'}}]",,,False,,following,Twitter Web App
1515011598812794883,19609162,"Sonic's officially in @Roblox in Sonic Speed Simulator, and all paid beta players can grab this exclusive Knuckles Chao!

Paid beta ends at 7AM PST on Saturday! https://t.co/T1WnkkntYw",2022-04-15 16:58:07+00:00,,1735,455,15220,319,en,1515011598812794883,"[{'domain': {'id': '71', 'name': 'Video Game', 'description': 'A video game like Overwatch'}, 'entity': {'id': '1088118927580774400', 'name': 'Roblox', 'description': 'Roblox'}}, {'domain': {'id': '130', 'name': 'Multimedia Franchise', 'description': ""Franchises which span multiple forms of media like 'Harry Potter'""}, 'entity': {'id': '993952643209773057', 'name': 'Sonic the Hedgehog', 'description': 'This entity includes all conversation about the franchise, as well as any individual installments in the series, if applicable.\t\t\t\n\nNOTE: Stopped annotating in the Video Game domain (71) on 11/15/19. Moving forward, this entity will annotate to Multimedia Franchise domain (130) only.'}}]","{'urls': [{'start': 161, 'end': 184, 'url': 'https://t.co/T1WnkkntYw', 'expanded_url': 'https://twitter.com/sonic_hedgehog/status/1515011598812794883/photo/1', 'display_url': 'pic.twitter.com/T1WnkkntYw', 'media_key': '3_1515009384442589188'}], 'annotations': [{'start': 33, 'end': 53, 'probability': 0.5481, 'type': 'Product', 'normalized_text': 'Sonic Speed Simulator'}, {'start': 106, 'end': 118, 'probability': 0.4147, 'type': 'Product', 'normalized_text': 'Knuckles Chao'}], 'mentions': [{'start': 22, 'end': 29, 'username': 'Roblox', 'id': '16745055'}]}",{'media_keys': ['3_1515009384442589188']},False,,everyone,Twitter Web App
1515031454840983559,1293547120289550338,@k1y0mi__ @caiizee ??,2022-04-15 18:17:01+00:00,,0,2,1,0,qam,1514965459757580290,[],"{'mentions': [{'start': 0, 'end': 9, 'username': 'k1y0mi__', 'id': '1444953018512838656'}, {'start': 10, 'end': 18, 'username': 'caiizee', 'id': '874211888736985088'}]}",,False,,everyone,Twitter for iPhone
1514757633844166657,1186391896630972418,"Your last saved picture is the reason as why Roblox went down today 😱📸

Yeah this is mine! Dont ask me why lol. 😡 https://t.co/CHCM2s7r4C",2022-04-15 00:08:57+00:00,,7,693,398,7,en,1514757633844166657,"[{'domain': {'id': '71', 'name': 'Video Game', 'description': 'A video game like Overwatch'}, 'entity': {'id': '1088118927580774400', 'name': 'Roblox', 'description': 'Roblox'}}]","{'urls': [{'start': 114, 'end': 137, 'url': 'https://t.co/CHCM2s7r4C', 'expanded_url': 'https://twitter.com/CaptainSteve_RB/status/1514757633844166657/photo/1', 'display_url': 'pic.twitter.com/CHCM2s7r4C', 'media_key': '3_1514757631893815298'}], 'annotations': [{'start': 45, 'end': 50, 'probability': 0.3387, 'type': 'Other', 'normalized_text': 'Roblox'}]}",{'media_keys': ['3_1514757631893815298']},False,,everyone,Twitter for Android
1514938393469325313,1418352846915919874,@strapcoderblx @Forever21 @vbg_studios @Roblox @robloxdevrel wow so nice,2022-04-15 12:07:13+00:00,,0,1,1,0,en,1514735379471032320,"[{'domain': {'id': '45', 'name': 'Brand Vertical', 'description': 'Top level entities that describe a Brands industry'}, 'entity': {'id': '781974596706635776', 'name': 'Retail'}}, {'domain': {'id': '46', 'name': 'Brand Category', 'description': 'Categories within Brand Verticals that narrow down the scope of Brands'}, 'entity': {'id': '781974596715024385', 'name': 'Apparel/Accessories'}}, {'domain': {'id': '47', 'name': 'Brand', 'description': 'Brands and Companies'}, 'entity': {'id': '10040780782', 'name': 'Forever 21'}}, {'domain': {'id': '65', 'name': 'Interests and Hobbies Vertical', 'description': 'Top level interests and hobbies groupings, like Food or Travel'}, 'entity': {'id': '844603730221707264', 'name': 'Fashion', 'description': 'Fashion'}}, {'domain': {'id': '66', 'name': 'Interests and Hobbies Category', 'description': 'A grouping of interests and hobbies entities, like Novelty Food or Destinations'}, 'entity': {'id': '846427983237672960', 'name': 'Fashion Brand', 'description': 'Fashion Brand'}}, {'domain': {'id': '71', 'name': 'Video Game', 'description': 'A video game like Overwatch'}, 'entity': {'id': '1088118927580774400', 'name': 'Roblox', 'description': 'Roblox'}}, {'domain': {'id': '45', 'name': 'Brand Vertical', 'description': 'Top level entities that describe a Brands industry'}, 'entity': {'id': '781974596706635776', 'name': 'Retail'}}, {'domain': {'id': '46', 'name': 'Brand Category', 'description': 'Categories within Brand Verticals that narrow down the scope of Brands'}, 'entity': {'id': '781974596715024385', 'name': 'Apparel/Accessories'}}, {'domain': {'id': '47', 'name': 'Brand', 'description': 'Brands and Companies'}, 'entity': {'id': '10040780782', 'name': 'Forever 21'}}]","{'mentions': [{'start': 0, 'end': 14, 'username': 'strapcoderblx', 'id': '1170556138095616000'}, {'start': 15, 'end': 25, 'username': 'Forever21', 'id': '28384755'}, {'start': 26, 'end': 38, 'username': 'vbg_studios', 'id': '1507356439530061829'}, {'start': 39, 'end': 46, 'username': 'Roblox', 'id': '16745055'}, {'start': 47, 'end': 60, 'username': 'robloxdevrel', 'id': '856650515874172928'}]}",,False,,everyone,Twitter Web App
1515031275916177418,1384997535513731074,I dont care if sonic frontiers is the best goddamn sonic game of all time if it doesn't have a fucking chao garden,2022-04-15 18:16:18+00:00,,0,1,2,0,en,1515031275916177418,"[{'domain': {'id': '130', 'name': 'Multimedia Franchise', 'description': ""Franchises which span multiple forms of media like 'Harry Potter'""}, 'entity': {'id': '993952643209773057', 'name': 'Sonic the Hedgehog', 'description': 'This entity includes all conversation about the franchise, as well as any individual installments in the series, if applicable.\t\t\t\n\nNOTE: Stopped annotating in the Video Game domain (71) on 11/15/19. Moving forward, this entity will annotate to Multimedia Franchise domain (130) only.'}}]","{'annotations': [{'start': 15, 'end': 29, 'probability': 0.3584, 'type': 'Other', 'normalized_text': 'sonic frontiers'}]}",,False,,everyone,Twitter for Android
1513943741798756362,815346414482051072,"At last, my long con has paid off. I will now become a Roblox YouTuber. https://t.co/TFcoQwHsOn",2022-04-12 18:14:50+00:00,,13,19,635,1,en,1513943741798756362,"[{'domain': {'id': '71', 'name': 'Video Game', 'description': 'A video game like Overwatch'}, 'entity': {'id': '1088118927580774400', 'name': 'Roblox', 'description': 'Roblox'}}]","{'urls': [{'start': 72, 'end': 95, 'url': 'https://t.co/TFcoQwHsOn', 'expanded_url': 'https://twitter.com/_SecondThought/status/1513943741798756362/photo/1', 'display_url': 'pic.twitter.com/TFcoQwHsOn', 'media_key': '3_1513943738699202560'}], 'annotations': [{'start': 55, 'end': 69, 'probability': 0.484, 'type': 'Product', 'normalized_text': 'Roblox YouTuber'}]}",{'media_keys': ['3_1513943738699202560']},False,,everyone,Twitter for iPhone
1515028961406902276,248937363,"@prettynerdy__ look a certain genius told her about social media and fans of her said, he too controlling. imagine… social media is not a place for kids, even when monitored. thank God he didn’t see much then, but he finna grow up and hear about it later. I promise you",2022-04-15 18:07:06+00:00,,0,1,0,0,en,1514954193240481793,[],"{'annotations': [{'start': 181, 'end': 183, 'probability': 0.9775, 'type': 'Other', 'normalized_text': 'God'}], 'mentions': [{'start': 0, 'end': 14, 'username': 'prettynerdy__', 'id': '1401914784904253441'}]}",,False,,everyone,Twitter for iPhone
1509576982962581511,16745055,🌧️ + 🌮 = ❤️,2022-03-31 17:02:53+00:00,,3401,4101,38452,492,art,1509576982962581511,"[{'domain': {'id': '71', 'name': 'Video Game', 'description': 'A video game like Overwatch'}, 'entity': {'id': '1088118927580774400', 'name': 'Roblox', 'description': 'Roblox'}}]",,,False,,everyone,Twitter Web App
1514948147063279621,1228274775832875008,"⭐️ Pet Sim X Giveaway ⭐️

Prize: 
💎 10 Billion Gems 💎

Rules :
1. Follow me 
2. Retweet this post
3. Leave a comment

⭐️ 1 Winner announced in 24 hours ⭐️
#PetSimulatorX #Roblox https://t.co/j7omv53L56",2022-04-15 12:45:59+00:00,,552,623,556,11,en,1514948147063279621,"[{'domain': {'id': '71', 'name': 'Video Game', 'description': 'A video game like Overwatch'}, 'entity': {'id': '1088118927580774400', 'name': 'Roblox', 'description': 'Roblox'}}]","{'urls': [{'start': 178, 'end': 201, 'url': 'https://t.co/j7omv53L56', 'expanded_url': 'https://twitter.com/MintysGiveaways/status/1514948147063279621/photo/1', 'display_url': 'pic.twitter.com/j7omv53L56', 'media_key': '3_1514948144856973321'}], 'hashtags': [{'start': 155, 'end': 169, 'tag': 'PetSimulatorX'}, {'start': 170, 'end': 177, 'tag': 'Roblox'}]}",{'media_keys': ['3_1514948144856973321']},False,,everyone,Twitter for Android
