tweetid,author_id,text,created_at,geo,retweets,replies,likes,quote_count,lang,conversation_id,context_annotations,entities,attachments,possibly_sensitive,withheld,reply_settings,source
1515026236241850380,16745055,Anyone got any avatar accessories they'd like to recommend to @sonic_hedgehog? https://t.co/XxBNu7ju0i,2022-04-15 17:56:17+00:00,,167,1036,2785,14,en,1515026236241850380,[],"{'mentions': [{'start': 62, 'end': 77, 'username': 'sonic_hedgehog', 'id': '19609162'}], 'urls': [{'start': 79, 'end': 102, 'url': 'https://t.co/XxBNu7ju0i', 'expanded_url': 'https://twitter.com/VentureBeat/status/1514272343731814403', 'display_url': 'twitter.com/VentureBeat/st…'}]}",,False,,everyone,Twitter Web App
1515694599884484612,17532613,Eu tô sentindo VERGONHA real dos Sonystas q estão atacando o cara pq ele apresentou as vantagens do gamepass pra mãe do garoto e mudou a decisão de compra dele.. eu mesmo vivo indicando o Xbox pra jogadores casuais pelo custo benefício.. apenas parem de surto que a coisa tá feia! https://t.co/V0wePvZSh0,2022-04-17 14:12:07+00:00,,1,11,69,0,pt,1515694599884484612,"[{'domain': {'id': '45', 'name': 'Brand Vertical', 'description': 'Top level entities that describe a Brands industry'}, 'entity': {'id': '781974597310615553', 'name': 'Entertainment'}}, {'domain': {'id': '46', 'name': 'Brand Category', 'description': 'Categories within Brand Verticals that narrow down the scope of Brands'}, 'entity': {'id': '781974597218340864', 'name': 'Video Games'}}, {'domain': {'id': '48', 'name': 'Product', 'description': 'Products created by Brands.  Examples: Ford Explorer, Apple iPhone.'}, 'entity': {'id': '1425921713150201858', 'name': 'Xbox Game Pass'}}, {'domain': {'id': '71', 'name': 'Video Game', 'description': 'A video game like Overwatch'}, 'entity': {'id': '10043689888', 'name': 'Minecraft'}}, {'domain': {'id': '71', 'name': 'Video Game', 'description': 'A video game like Overwatch'}, 'entity': {'id': '10044917017', 'name': 'God of War', 'description': 'This entity includes all conversation about the franchise, as well as any individual installments in the series, if applicable.\t\t\t'}}, {'domain': {'id': '71', 'name': 'Video Game', 'description': 'A video game like Overwatch'}, 'entity': {'id': '974285387987169280', 'name': 'Fortnite', 'description': 'This entity includes all conversation about the franchise, as well as any individual installments in the series, if applicable.\t\t\t'}}, {'domain': {'id': '71', 'name': 'Video Game', 'description': 'A video game like Overwatch'}, 'entity': {'id': '1004742145515745280', 'name': 'The Last of Us', 'description': 'The Last of Us'}}, {'domain': {'id': '45', 'name': 'Brand Vertical', 'description': 'Top level entities that describe a Brands industry'}, 'entity': {'id': '781974597310615553', 'name': 'Entertainment'}}, {'domain': {'id': '46', 'name': 'Brand Category', 'description': 'Categories within Brand Verticals that narrow down the scope of Brands'}, 'entity': {'id': '781974597218340864', 'name': 'Video Games'}}, {'domain': {'id': '47', 'name': 'Brand', 'description': 'Brands and Companies'}, 'entity': {'id': '10027048851', 'name': 'Xbox'}}, {'domain': {'id': '79', 'name': 'Video Game Hardware', 'description': 'Video Game Hardware'}, 'entity': {'id': '10027048851', 'name': 'Xbox'}}]","{'annotations': [{'start': 188, 'end': 191, 'probability': 0.4949, 'type': 'Product', 'normalized_text': 'Xbox'}], 'urls': [{'start': 281, 'end': 304, 'url': 'https://t.co/V0wePvZSh0', 'expanded_url': 'https://twitter.com/nenecoxb/status/1515538484794167301', 'display_url': 'twitter.com/nenecoxb/statu…'}]}",,False,,everyone,Twitter for iPhone
1515694829333798918,1457389721496211464,"@JonatasXB117 Mas o Fortnite tbm é gratuito no PS e roda da mesma forma que o Xbox cara...
Não vi sentido nisso até agora,a não ser empurrar o que o cara queria pra criança! Tô argumento em cima do que vcs estão falando. Que é Fortinite, Warzone esses games gratuitos de todas as plataformas!",2022-04-17 14:13:02+00:00,,0,1,0,0,pt,1515597926906671110,"[{'domain': {'id': '71', 'name': 'Video Game', 'description': 'A video game like Overwatch'}, 'entity': {'id': '974285387987169280', 'name': 'Fortnite', 'description': 'This entity includes all conversation about the franchise, as well as any individual installments in the series, if applicable.\t\t\t'}}, {'domain': {'id': '123', 'name': 'Ongoing News Story', 'description': ""Ongoing News Stories like 'Brexit'""}, 'entity': {'id': '1484601166080081920', 'name': 'Russo-Ukrainian conflict'}}, {'domain': {'id': '45', 'name': 'Brand Vertical', 'description': 'Top level entities that describe a Brands industry'}, 'entity': {'id': '781974597310615553', 'name': 'Entertainment'}}, {'domain': {'id': '46', 'name': 'Brand Category', 'description': 'Categories within Brand Verticals that narrow down the scope of Brands'}, 'entity': {'id': '781974597218340864', 'name': 'Video Games'}}, {'domain': {'id': '47', 'name': 'Brand', 'description': 'Brands and Companies'}, 'entity': {'id': '10027048851', 'name': 'Xbox'}}, {'domain': {'id': '47', 'name': 'Brand', 'description': 'Brands and Companies'}, 'entity': {'id': '10027048853', 'name': 'PlayStation'}}, {'domain': {'id': '79', 'name': 'Video Game Hardware', 'description': 'Video Game Hardware'}, 'entity': {'id': '10027048851', 'name': 'Xbox'}}, {'domain': {'id': '79', 'name': 'Video Game Hardware', 'description': 'Video Game Hardware'}, 'entity': {'id': '10027048853', 'name': 'PlayStation'}}]","{'mentions': [{'start': 0, 'end': 13, 'username': 'JonatasXB117', 'id': '1240455421049143296'}], 'annotations': [{'start': 20, 'end': 27, 'probability': 0.8416, 'type': 'Person', 'normalized_text': 'Fortnite'}, {'start': 78, 'end': 81, 'probability': 0.5989, 'type': 'Product', 'normalized_text': 'Xbox'}]}",,False,,everyone,Twitter for Android
1515416619966734341,1271771003497185281,"Okay so, we now officially have Sonic in Minecraft and Roblox...

Fortnite... it's your move. https://t.co/zPwPV0djaK",2022-04-16 19:47:31+00:00,,961,197,9430,97,en,1515416619966734341,"[{'domain': {'id': '45', 'name': 'Brand Vertical', 'description': 'Top level entities that describe a Brands industry'}, 'entity': {'id': '781974597310615553', 'name': 'Entertainment'}}, {'domain': {'id': '46', 'name': 'Brand Category', 'description': 'Categories within Brand Verticals that narrow down the scope of Brands'}, 'entity': {'id': '781974597218340864', 'name': 'Video Games'}}, {'domain': {'id': '71', 'name': 'Video Game', 'description': 'A video game like Overwatch'}, 'entity': {'id': '10043689888', 'name': 'Minecraft'}}, {'domain': {'id': '71', 'name': 'Video Game', 'description': 'A video game like Overwatch'}, 'entity': {'id': '974285387987169280', 'name': 'Fortnite', 'description': 'This entity includes all conversation about the franchise, as well as any individual installments in the series, if applicable.\t\t\t'}}, {'domain': {'id': '71', 'name': 'Video Game', 'description': 'A video game like Overwatch'}, 'entity': {'id': '1088118927580774400', 'name': 'Roblox', 'description': 'Roblox'}}]","{'annotations': [{'start': 41, 'end': 49, 'probability': 0.5884, 'type': 'Product', 'normalized_text': 'Minecraft'}, {'start': 55, 'end': 60, 'probability': 0.6164, 'type': 'Product', 'normalized_text': 'Roblox'}], 'urls': [{'start': 94, 'end': 117, 'url': 'https://t.co/zPwPV0djaK', 'expanded_url': 'https://twitter.com/unleash_yt/status/1515416619966734341/photo/1', 'display_url': 'pic.twitter.com/zPwPV0djaK', 'media_key': '3_1515416611993362446'}, {'start': 94, 'end': 117, 'url': 'https://t.co/zPwPV0djaK', 'expanded_url': 'https://twitter.com/unleash_yt/status/1515416619966734341/photo/1', 'display_url': 'pic.twitter.com/zPwPV0djaK', 'media_key': '3_1515416617739554818'}]}","{'media_keys': ['3_1515416611993362446', '3_1515416617739554818']}",False,,everyone,Twitter for Android
1515451341291888646,1344466603057033218,NOW TWITTER IS GIVING ME ROBLOX PORN WTF,2022-04-16 22:05:30+00:00,,0,1,4,0,en,1515451341291888646,[],"{'annotations': [{'start': 4, 'end': 10, 'probability': 0.5118, 'type': 'Product', 'normalized_text': 'TWITTER'}]}",,False,,everyone,Twitter for iPhone
1515427160902803457,1408677557411717121,BREAKING NEWS: Roblox Is Being Shut Down #RIP https://t.co/YGafnbaDID,2022-04-16 20:29:25+00:00,,745,4230,12090,202,en,1515427160902803457,"[{'domain': {'id': '71', 'name': 'Video Game', 'description': 'A video game like Overwatch'}, 'entity': {'id': '1088118927580774400', 'name': 'Roblox', 'description': 'Roblox'}}]","{'hashtags': [{'start': 41, 'end': 45, 'tag': 'RIP'}], 'urls': [{'start': 46, 'end': 69, 'url': 'https://t.co/YGafnbaDID', 'expanded_url': 'https://twitter.com/Rolbox_RTC/status/1515427160902803457/photo/1', 'display_url': 'pic.twitter.com/YGafnbaDID', 'media_key': '3_1515427155634757641'}]}",{'media_keys': ['3_1515427155634757641']},False,,everyone,Twitter for iPhone
1515694030402764810,1219313624100921345,"@ElKrackenYT Si hablamos de cuando inicio en YouTube cada uno 
Dinosebas se unico exactamente el 8 de enero del 2018
Mientras que en el primer canal de Dinobenja actualmente llamado ""Dino Benja 2"" se puede ver aver que se unió el 3 de enero de 2018 https://t.co/OAgrM6vZqt",2022-04-17 14:09:51+00:00,,0,1,3,1,es,1515673363926167558,"[{'domain': {'id': '165', 'name': 'Technology', 'description': 'for individual and types of technology, e.g., food technology, 3D printing'}, 'entity': {'id': '1196446161223028736', 'name': 'Social media'}}, {'domain': {'id': '46', 'name': 'Brand Category', 'description': 'Categories within Brand Verticals that narrow down the scope of Brands'}, 'entity': {'id': '781974596752842752', 'name': 'Services'}}, {'domain': {'id': '47', 'name': 'Brand', 'description': 'Brands and Companies'}, 'entity': {'id': '10029382357', 'name': 'YouTube'}}]","{'mentions': [{'start': 0, 'end': 12, 'username': 'ElKrackenYT', 'id': '1269802433917718529'}], 'annotations': [{'start': 45, 'end': 51, 'probability': 0.7441, 'type': 'Product', 'normalized_text': 'YouTube'}, {'start': 62, 'end': 71, 'probability': 0.7658, 'type': 'Person', 'normalized_text': 'Dinosebas'}, {'start': 152, 'end': 160, 'probability': 0.289, 'type': 'Place', 'normalized_text': 'Dinobenja'}, {'start': 183, 'end': 192, 'probability': 0.7243, 'type': 'Person', 'normalized_text': 'Dino Benja'}], 'urls': [{'start': 249, 'end': 272, 'url': 'https://t.co/OAgrM6vZqt', 'expanded_url': 'https://twitter.com/RANDOM_ARITZI/status/1515694030402764810/photo/1', 'display_url': 'pic.twitter.com/OAgrM6vZqt', 'media_key': '3_1515694027412172800'}, {'start': 249, 'end': 272, 'url': 'https://t.co/OAgrM6vZqt', 'expanded_url': 'https://twitter.com/RANDOM_ARITZI/status/1515694030402764810/photo/1', 'display_url': 'pic.twitter.com/OAgrM6vZqt', 'media_key': '3_1515694029039493124'}]}","{'media_keys': ['3_1515694027412172800', '3_1515694029039493124']}",False,,everyone,Twitter for Android
1515694741152747528,1421045033533313024,@Rosalovesfan @KyllieLilDonut @Harshitakately1,2022-04-17 14:12:41+00:00,,0,1,2,0,qam,1515694604246417411,[],"{'mentions': [{'start': 14, 'end': 29, 'username': 'KyllieLilDonut', 'id': '1512623741599039489'}]}",,False,,everyone,Twitter for iPad
1515633500187238404,1349447060421042181,"speed simulator is good fun but i found something so much fucking cooler, at least in accordance to my taste https://t.co/Ae4aBFYYqb",2022-04-17 10:09:20+00:00,,435,93,3103,23,en,1515633500187238404,[],"{'urls': [{'start': 109, 'end': 132, 'url': 'https://t.co/Ae4aBFYYqb', 'expanded_url': 'https://twitter.com/JaceyAmaris/status/1515633500187238404/video/1', 'display_url': 'pic.twitter.com/Ae4aBFYYqb', 'media_key': '7_1515633215062609920'}]}",{'media_keys': ['7_1515633215062609920']},False,,everyone,Twitter for iPhone
1515693746473558018,1292247651812028417,@Le_PotatoPrince Man 😭,2022-04-17 14:08:44+00:00,,0,1,1,0,und,1515691934177796101,[],"{'mentions': [{'start': 0, 'end': 16, 'username': 'Le_PotatoPrince', 'id': '1284228502976421888'}]}",,False,,mentionedUsers,Twitter for iPhone
1515423989727961088,946164003855880192,I got a girlfriend guys reply with romantic and wholesome roblox games,2022-04-16 20:16:49+00:00,,13,168,650,3,en,1515423989727961088,"[{'domain': {'id': '71', 'name': 'Video Game', 'description': 'A video game like Overwatch'}, 'entity': {'id': '1088118927580774400', 'name': 'Roblox', 'description': 'Roblox'}}]",,,False,,everyone,Twitter Web App
1515684509269827592,1056053249470541824,Happy Easter to all our friends who celebrate 🐣,2022-04-17 13:32:01+00:00,,49,51,860,2,en,1515684509269827592,"[{'domain': {'id': '29', 'name': 'Events [Entity Service]', 'description': 'Entity Service related Events domain'}, 'entity': {'id': '1372917575357591554', 'name': 'Easter', 'description': 'this entity for all conversations for Easter all year '}}, {'domain': {'id': '119', 'name': 'Holiday', 'description': 'Holidays like Christmas or Halloween'}, 'entity': {'id': '1372917575357591554', 'name': 'Easter', 'description': 'this entity for all conversations for Easter all year '}}, {'domain': {'id': '29', 'name': 'Events [Entity Service]', 'description': 'Entity Service related Events domain'}, 'entity': {'id': '1506086002208636930', 'name': '4月17日はイースター', 'description': '4月17日は、キリスト教でイエス・キリストが復活した日とされるイースターです。このモーメントは自動でツイートを掲載しています。'}}]",,,False,,everyone,Twitter for iPhone
1515691152510709763,1499402025003487233,tl what was your first online name,2022-04-17 13:58:25+00:00,,4,127,177,483,en,1515691152510709763,[],,,False,,everyone,Twitter Web App
1515694087185252356,3430592104,Who remembers this app? #RobloxDev https://t.co/LoAgKNbkY8,2022-04-17 14:10:05+00:00,,41,51,738,1,en,1515694087185252356,"[{'domain': {'id': '71', 'name': 'Video Game', 'description': 'A video game like Overwatch'}, 'entity': {'id': '1088118927580774400', 'name': 'Roblox', 'description': 'Roblox'}}]","{'hashtags': [{'start': 24, 'end': 34, 'tag': 'RobloxDev'}], 'urls': [{'start': 35, 'end': 58, 'url': 'https://t.co/LoAgKNbkY8', 'expanded_url': 'https://twitter.com/EvanZir/status/1515694087185252356/photo/1', 'display_url': 'pic.twitter.com/LoAgKNbkY8', 'media_key': '3_1515694085004267529'}, {'start': 35, 'end': 58, 'url': 'https://t.co/LoAgKNbkY8', 'expanded_url': 'https://twitter.com/EvanZir/status/1515694087185252356/photo/1', 'display_url': 'pic.twitter.com/LoAgKNbkY8', 'media_key': '3_1515694085004304386'}]}","{'media_keys': ['3_1515694085004267529', '3_1515694085004304386']}",False,,mentionedUsers,Twitter for iPhone
1515686922097762309,1148333794056953857,"@JonatasXB117 A quem eu era super fã e falava que ele era meu, eu vejo algo parecido nesse caso aí, moleque vai querer jogar o Miranha mas terão de improvisar e deixar ele jogando o patrulha canina.",2022-04-17 13:41:36+00:00,,0,5,2,0,pt,1515597926906671110,"[{'domain': {'id': '130', 'name': 'Multimedia Franchise', 'description': ""Franchises which span multiple forms of media like 'Harry Potter'""}, 'entity': {'id': '1002576732971384832', 'name': 'Marvel Universe', 'description': 'This entity includes all conversation about the franchise, as well as any individual installments in the series, if applicable.\t\t\t'}}, {'domain': {'id': '130', 'name': 'Multimedia Franchise', 'description': ""Franchises which span multiple forms of media like 'Harry Potter'""}, 'entity': {'id': '1012672762442182657', 'name': 'Spider-Man', 'description': 'Spider-Man'}}, {'domain': {'id': '130', 'name': 'Multimedia Franchise', 'description': ""Franchises which span multiple forms of media like 'Harry Potter'""}, 'entity': {'id': '1423369284210753538', 'name': 'PAW Patrol'}}]","{'mentions': [{'start': 0, 'end': 13, 'username': 'JonatasXB117', 'id': '1240455421049143296'}], 'annotations': [{'start': 127, 'end': 133, 'probability': 0.5085, 'type': 'Person', 'normalized_text': 'Miranha'}]}",,False,,everyone,Twitter Web App
1515353339411763200,1056053249470541824,"Sonic Speed Simulator has released FREE to all players. 😳

Play here: https://t.co/rJJWmrbcbr",2022-04-16 15:36:04+00:00,,37,31,595,6,en,1515353339411763200,"[{'domain': {'id': '130', 'name': 'Multimedia Franchise', 'description': ""Franchises which span multiple forms of media like 'Harry Potter'""}, 'entity': {'id': '993952643209773057', 'name': 'Sonic the Hedgehog', 'description': 'This entity includes all conversation about the franchise, as well as any individual installments in the series, if applicable.\t\t\t\n\nNOTE: Stopped annotating in the Video Game domain (71) on 11/15/19. Moving forward, this entity will annotate to Multimedia Franchise domain (130) only.'}}]","{'annotations': [{'start': 0, 'end': 20, 'probability': 0.6957, 'type': 'Product', 'normalized_text': 'Sonic Speed Simulator'}], 'urls': [{'start': 70, 'end': 93, 'url': 'https://t.co/rJJWmrbcbr', 'expanded_url': 'https://www.roblox.com/games/9049840490', 'display_url': 'roblox.com/games/90498404…', 'images': [{'url': 'https://pbs.twimg.com/news_img/1541078096576745472/ek0KnL6w?format=jpg&name=orig', 'width': 498, 'height': 280}, {'url': 'https://pbs.twimg.com/news_img/1541078096576745472/ek0KnL6w?format=jpg&name=150x150', 'width': 150, 'height': 150}], 'status': 200, 'title': '[SONIC BIRTHDAY] Sonic Speed Simulator', 'description': 'Check out [SONIC BIRTHDAY] Sonic Speed Simulator. It’s one of the millions of unique, user-generated 3D experiences created on Roblox. ✨THE OFFICIAL SONIC THE HEDGEHOG GAME ON ROBLOX! LATEST UPDATES: ◉ SONIC BIRTHDAY BASH EVENT! ◉ Celebrate Sonic\'s Birthday and destroy Eggman\'s crates and balloons ◉ Tails\' Tornado Plane flies through Green Hill and drops Rings ◉ Birthday Bash Spin Wheel - Free rewards every 2 hours ◉ New Playable Character - Classic Sonic ◉ New Character Skin - Birthday King Sonic ◉ 3 New Chao - SONIC Chao, Gift Chao, Birthday Chao ◉ Inventory System revamp COMMUNITY REWARD👍 👍 1.25MM LIKES REWARD -> MYSTERY REWARD! 👍 NEW LIKE CODE - Bloxian Chao = ""thumbsup"" 👍 NEW LIKE CODE - Gratitude Chao = ""thankyouchao"" The fastest game in Roblox history. 👟 GET FAST by running to LEVEL UP 🏁 RACE against other players to EARN REWARDS 🔓 UNLOCK NEW WORLDS and go on an incredible adventure 🐶 COLLECT CHAO to increase your stats and collection 👓 EARN SONIC CHARACTER SKINS to sho', 'unwound_url': 'https://www.roblox.com/games/9049840490/SONIC-BIRTHDAY-Sonic-Speed-Simulator?AssetId=9049840490'}]}",,False,,everyone,Twitter for iPhone
1515693331409514498,1442150956016173075,"o jogo do sonic mal lanço e ja tem hacker por exemplo um deles é leechy exploits e cara eles são uns bostas em forma de pessoa so espero que gamefam studios consiga arrumar isso
@Roblox_RTC_BR @LeaksEvents @RobloxxNotices @Noticias_BloxBr @Robloxnoticiabr @Roblog_ @BloxRadio_",2022-04-17 14:07:05+00:00,,1,1,3,0,pt,1515693331409514498,"[{'domain': {'id': '130', 'name': 'Multimedia Franchise', 'description': ""Franchises which span multiple forms of media like 'Harry Potter'""}, 'entity': {'id': '993952643209773057', 'name': 'Sonic the Hedgehog', 'description': 'This entity includes all conversation about the franchise, as well as any individual installments in the series, if applicable.\t\t\t\n\nNOTE: Stopped annotating in the Video Game domain (71) on 11/15/19. Moving forward, this entity will annotate to Multimedia Franchise domain (130) only.'}}]","{'mentions': [{'start': 178, 'end': 192, 'username': 'Roblox_RTC_BR', 'id': '1417587809502826500'}, {'start': 193, 'end': 205, 'username': 'LeaksEvents', 'id': '1422163374339727363'}, {'start': 206, 'end': 221, 'username': 'RobloxxNotices', 'id': '1456969609198833665'}, {'start': 222, 'end': 238, 'username': 'Noticias_BloxBr', 'id': '1450935663541592073'}, {'start': 239, 'end': 255, 'username': 'Robloxnoticiabr', 'id': '1478554450738438146'}, {'start': 256, 'end': 264, 'username': 'Roblog_', 'id': '1425933854733393926'}, {'start': 265, 'end': 276, 'username': 'BloxRadio_', 'id': '1368934010840379401'}]}",,False,,everyone,Twitter Web App
1515419761009577987,1894642398,"Quick $50 Robux Card Giveaway!
✨$5,000 Robux✨

HOW TO ENTER:
1️⃣Follow @FishyBlox
2️⃣LIKE + RETWEET
3️⃣Reply “Robux”

Winner will be picked in 48 Hours.
Good Luck To Everyone!
#robux #robuxgiveaway #roblox #ROBLOXGiveaway #Giveaway",2022-04-16 20:00:00+00:00,,977,1364,1298,21,en,1515419761009577987,"[{'domain': {'id': '71', 'name': 'Video Game', 'description': 'A video game like Overwatch'}, 'entity': {'id': '1088118927580774400', 'name': 'Roblox', 'description': 'Roblox'}}]","{'hashtags': [{'start': 176, 'end': 182, 'tag': 'robux'}, {'start': 183, 'end': 197, 'tag': 'robuxgiveaway'}, {'start': 198, 'end': 205, 'tag': 'roblox'}, {'start': 206, 'end': 221, 'tag': 'ROBLOXGiveaway'}, {'start': 222, 'end': 231, 'tag': 'Giveaway'}], 'mentions': [{'start': 71, 'end': 81, 'username': 'FishyBlox', 'id': '1894642398'}]}",,False,,everyone,Twitter Web App
1499267686622466048,1380154878274764802,@22zachprime https://t.co/NH0R5K5s7z,2022-03-03 06:17:26+00:00,,0,2,1,1,qme,1499244317038108672,[],"{'mentions': [{'start': 0, 'end': 12, 'username': '22zachprime', 'id': '1287802271590256641'}], 'urls': [{'start': 13, 'end': 36, 'url': 'https://t.co/NH0R5K5s7z', 'expanded_url': 'https://twitter.com/GamerDareal/status/1499267686622466048/photo/1', 'display_url': 'pic.twitter.com/NH0R5K5s7z', 'media_key': '3_1499267671254511618'}]}",{'media_keys': ['3_1499267671254511618']},False,,everyone,Twitter Web App
1515661797277433859,1458036479398068228,@unicorn_yuri IM SORRY 😭😭😭😭😭😭,2022-04-17 12:01:46+00:00,,0,1,1,0,en,1515610947263807490,[],"{'mentions': [{'start': 0, 'end': 13, 'username': 'unicorn_yuri', 'id': '1273059063186653185'}]}",,False,,everyone,Twitter for iPad
1511885321142689792,1383956734612361224,@MapleSyrupPls @Catabonk @Roblox @hamulgg i'm not christian and i still want the egg hunt lmao,2022-04-07 01:55:24+00:00,,0,1,0,0,en,1511408448977575940,"[{'domain': {'id': '71', 'name': 'Video Game', 'description': 'A video game like Overwatch'}, 'entity': {'id': '1088118927580774400', 'name': 'Roblox', 'description': 'Roblox'}}]","{'mentions': [{'start': 0, 'end': 14, 'username': 'MapleSyrupPls', 'id': '1451043075233443847'}, {'start': 15, 'end': 24, 'username': 'Catabonk', 'id': '1463651946959716353'}, {'start': 25, 'end': 32, 'username': 'Roblox', 'id': '16745055'}, {'start': 33, 'end': 41, 'username': 'hamulgg', 'id': '1179964847754117121'}]}",,False,,everyone,Twitter Web App
1515406962112053257,2455740283,"I’m looking to hire a super creative, YouTube nerd, that wants to learn what makes videos go viral and help me brainstorm and execute content! If you’re interested just reply to this tweet with your experience and why you’re different.",2022-04-16 19:09:09+00:00,,3911,19823,171035,604,en,1515406962112053257,"[{'domain': {'id': '10', 'name': 'Person', 'description': 'Named people in the world like Nelson Mandela'}, 'entity': {'id': '1126559222122942464', 'name': 'MrBeast'}}, {'domain': {'id': '120', 'name': 'Digital Creator', 'description': 'Influencers who create content on digital platforms'}, 'entity': {'id': '1126559222122942464', 'name': 'MrBeast'}}, {'domain': {'id': '165', 'name': 'Technology', 'description': 'for individual and types of technology, e.g., food technology, 3D printing'}, 'entity': {'id': '1196446161223028736', 'name': 'Social media'}}, {'domain': {'id': '46', 'name': 'Brand Category', 'description': 'Categories within Brand Verticals that narrow down the scope of Brands'}, 'entity': {'id': '781974596752842752', 'name': 'Services'}}, {'domain': {'id': '47', 'name': 'Brand', 'description': 'Brands and Companies'}, 'entity': {'id': '10029382357', 'name': 'YouTube'}}, {'domain': {'id': '47', 'name': 'Brand', 'description': 'Brands and Companies'}, 'entity': {'id': '10045225402', 'name': 'Twitter'}}]","{'annotations': [{'start': 38, 'end': 44, 'probability': 0.5076, 'type': 'Product', 'normalized_text': 'YouTube'}]}",,False,,everyone,Twitter for iPhone
1515661951837229059,1399719473343512584,"🐰Hoppy Easter!  

Only 4 days left to earn event coins to collect the LIMITED time Easter Egg, Bunnies, Vehicles and Home &amp; Garden.

Code for 🥕 500 Carrot Coins

Code: HOPPYEASTER
Expires: 24 hours 
Enter Code in Backpack&gt; 🎁

#Roblox #SoftLaunch #RoPets https://t.co/9Y9slEtzY6",2022-04-17 12:02:23+00:00,,39,35,204,13,en,1515661951837229059,"[{'domain': {'id': '29', 'name': 'Events [Entity Service]', 'description': 'Entity Service related Events domain'}, 'entity': {'id': '1372917575357591554', 'name': 'Easter', 'description': 'this entity for all conversations for Easter all year '}}, {'domain': {'id': '71', 'name': 'Video Game', 'description': 'A video game like Overwatch'}, 'entity': {'id': '1088118927580774400', 'name': 'Roblox', 'description': 'Roblox'}}, {'domain': {'id': '119', 'name': 'Holiday', 'description': 'Holidays like Christmas or Halloween'}, 'entity': {'id': '1372917575357591554', 'name': 'Easter', 'description': 'this entity for all conversations for Easter all year '}}]","{'hashtags': [{'start': 233, 'end': 240, 'tag': 'Roblox'}, {'start': 241, 'end': 252, 'tag': 'SoftLaunch'}, {'start': 253, 'end': 260, 'tag': 'RoPets'}], 'urls': [{'start': 261, 'end': 284, 'url': 'https://t.co/9Y9slEtzY6', 'expanded_url': 'https://twitter.com/RoPetsGame/status/1515661951837229059/photo/1', 'display_url': 'pic.twitter.com/9Y9slEtzY6', 'media_key': '3_1515661787173048323'}]}",{'media_keys': ['3_1515661787173048323']},False,,everyone,Twitter Web App
