tweetid,author_id,text,created_at,geo,retweets,replies,likes,quote_count,lang,conversation_id,context_annotations,entities,attachments,possibly_sensitive,withheld,reply_settings,source
1521470080462295043,20234637,Spotify enters the @Roblox metaverse with launch experience featuring @Stray_Kids and Sunmi https://t.co/agBGVyXtsu https://t.co/KSbbNInAWl,2022-05-03 12:41:49+00:00,,3600,412,12549,4710,en,1521470080462295043,"[{'domain': {'id': '10', 'name': 'Person', 'description': 'Named people in the world like Nelson Mandela'}, 'entity': {'id': '1062427352318173185', 'name': 'Stray Kids', 'description': 'Stray Kids (스트레이 키즈)'}}, {'domain': {'id': '45', 'name': 'Brand Vertical', 'description': 'Top level entities that describe a Brands industry'}, 'entity': {'id': '781974597310615553', 'name': 'Entertainment'}}, {'domain': {'id': '46', 'name': 'Brand Category', 'description': 'Categories within Brand Verticals that narrow down the scope of Brands'}, 'entity': {'id': '781974597222535168', 'name': 'Online Services'}}, {'domain': {'id': '47', 'name': 'Brand', 'description': 'Brands and Companies'}, 'entity': {'id': '10040276669', 'name': 'Spotify'}}, {'domain': {'id': '54', 'name': 'Musician', 'description': 'A musician in the world, like Adele or Bob Dylan'}, 'entity': {'id': '1062427352318173185', 'name': 'Stray Kids', 'description': 'Stray Kids (스트레이 키즈)'}}, {'domain': {'id': '55', 'name': 'Music Genre', 'description': 'A category for a musical style, like Pop, Rock, or Rap'}, 'entity': {'id': '888105153038958593', 'name': 'K-pop', 'description': 'K-Pop'}}, {'domain': {'id': '30', 'name': 'Entities [Entity Service]', 'description': 'Entity Service top level domain, every item that is in Entity Service should be in this domain'}, 'entity': {'id': '848920371311001600', 'name': 'Technology', 'description': 'Technology and computing'}}, {'domain': {'id': '67', 'name': 'Interests and Hobbies', 'description': 'Interests, opinions, and behaviors of individuals, groups, or cultures; like Speciality Cooking or Theme Parks'}, 'entity': {'id': '1288826829634035714', 'name': 'Backstage'}}, {'domain': {'id': '71', 'name': 'Video Game', 'description': 'A video game like Overwatch'}, 'entity': {'id': '1088118927580774400', 'name': 'Roblox', 'description': 'Roblox'}}, {'domain': {'id': '165', 'name': 'Technology', 'description': 'for individual and types of technology, e.g., food technology, 3D printing'}, 'entity': {'id': '848920371311001600', 'name': 'Technology', 'description': 'Technology and computing'}}]","{'urls': [{'start': 92, 'end': 115, 'url': 'https://t.co/agBGVyXtsu', 'expanded_url': 'https://www.musicweek.com/digital/read/spotify-enters-the-roblox-metaverse/085725', 'display_url': 'musicweek.com/digital/read/s…', 'images': [{'url': 'https://pbs.twimg.com/news_img/1539830944898682880/XozoJXdZ?format=jpg&name=orig', 'width': 1200, 'height': 630}, {'url': 'https://pbs.twimg.com/news_img/1539830944898682880/XozoJXdZ?format=jpg&name=150x150', 'width': 150, 'height': 150}], 'status': 200, 'title': 'Spotify enters the Roblox metaverse', 'description': 'The streaming giant has joined major labels in the Roblox metaverse with an interactive presence. Spotify is the first streaming brand on the gaming platform.', 'unwound_url': 'https://www.musicweek.com/digital/read/spotify-enters-the-roblox-metaverse/085725'}, {'start': 116, 'end': 139, 'url': 'https://t.co/KSbbNInAWl', 'expanded_url': 'https://twitter.com/MusicWeek/status/1521470080462295043/photo/1', 'display_url': 'pic.twitter.com/KSbbNInAWl', 'media_key': '3_1521469945233776640'}], 'annotations': [{'start': 0, 'end': 6, 'probability': 0.4468, 'type': 'Product', 'normalized_text': 'Spotify'}, {'start': 86, 'end': 90, 'probability': 0.8762, 'type': 'Person', 'normalized_text': 'Sunmi'}], 'mentions': [{'start': 19, 'end': 26, 'username': 'Roblox', 'id': '16745055'}, {'start': 70, 'end': 81, 'username': 'Stray_Kids', 'id': '859297966581891072'}]}",{'media_keys': ['3_1521469945233776640']},False,,everyone,Twitter Web App
1521475562807738375,838024470635905024,you gotta be on stayville at all times to make sure u don’t miss anything i left for 20 minutes and now skz is on roblox???,2022-05-03 13:03:36+00:00,,977,101,7781,413,en,1521475562807738375,"[{'domain': {'id': '71', 'name': 'Video Game', 'description': 'A video game like Overwatch'}, 'entity': {'id': '1088118927580774400', 'name': 'Roblox', 'description': 'Roblox'}}]","{'annotations': [{'start': 114, 'end': 119, 'probability': 0.4035, 'type': 'Product', 'normalized_text': 'roblox'}]}",,False,,everyone,Twitter for iPhone
1521510599997329410,1402094908668788744,now performing the yearly ritual of updating my age on all of my socials,2022-05-03 15:22:49+00:00,,0,1,5,0,en,1521510599997329410,[],,,False,,everyone,Twitter for Android
1521449221261602817,17230018,Pack your bags! This is your invite to #SpotifyIsland 🏝️ Scroll down for a tour or jump right in on @Roblox now 👉 https://t.co/jrp6JawnSU https://t.co/UBFYXf28BP,2022-05-03 11:18:56+00:00,,234,254,1998,87,en,1521449221261602817,"[{'domain': {'id': '45', 'name': 'Brand Vertical', 'description': 'Top level entities that describe a Brands industry'}, 'entity': {'id': '781974597310615553', 'name': 'Entertainment'}}, {'domain': {'id': '46', 'name': 'Brand Category', 'description': 'Categories within Brand Verticals that narrow down the scope of Brands'}, 'entity': {'id': '781974597222535168', 'name': 'Online Services'}}, {'domain': {'id': '47', 'name': 'Brand', 'description': 'Brands and Companies'}, 'entity': {'id': '10040276669', 'name': 'Spotify'}}, {'domain': {'id': '67', 'name': 'Interests and Hobbies', 'description': 'Interests, opinions, and behaviors of individuals, groups, or cultures; like Speciality Cooking or Theme Parks'}, 'entity': {'id': '1288826829634035714', 'name': 'Backstage'}}, {'domain': {'id': '71', 'name': 'Video Game', 'description': 'A video game like Overwatch'}, 'entity': {'id': '1088118927580774400', 'name': 'Roblox', 'description': 'Roblox'}}]","{'urls': [{'start': 114, 'end': 137, 'url': 'https://t.co/jrp6JawnSU', 'expanded_url': 'http://roblox.com/spotify', 'display_url': 'roblox.com/spotify', 'status': 200, 'unwound_url': 'https://www.roblox.com/spotify'}, {'start': 138, 'end': 161, 'url': 'https://t.co/UBFYXf28BP', 'expanded_url': 'https://twitter.com/Spotify/status/1521449221261602817/photo/1', 'display_url': 'pic.twitter.com/UBFYXf28BP', 'media_key': '16_1521449008149024768'}], 'mentions': [{'start': 100, 'end': 107, 'username': 'Roblox', 'id': '16745055'}], 'hashtags': [{'start': 39, 'end': 53, 'tag': 'SpotifyIsland'}]}",{'media_keys': ['16_1521449008149024768']},False,,everyone,Twitter Web App
1521517798622515200,1368427422597722114,"No entiendo qué es Roblox, skz entiendan que soy una adulta que usa twitter para aliviar el estrés de su vida llena de cuentas por pagar y una vida laboral agotadora https://t.co/areCSHOfuC",2022-05-03 15:51:26+00:00,,26,10,707,6,es,1521517798622515200,"[{'domain': {'id': '71', 'name': 'Video Game', 'description': 'A video game like Overwatch'}, 'entity': {'id': '1088118927580774400', 'name': 'Roblox', 'description': 'Roblox'}}, {'domain': {'id': '46', 'name': 'Brand Category', 'description': 'Categories within Brand Verticals that narrow down the scope of Brands'}, 'entity': {'id': '781974596752842752', 'name': 'Services'}}, {'domain': {'id': '47', 'name': 'Brand', 'description': 'Brands and Companies'}, 'entity': {'id': '10045225402', 'name': 'Twitter'}}]","{'urls': [{'start': 166, 'end': 189, 'url': 'https://t.co/areCSHOfuC', 'expanded_url': 'https://twitter.com/straykidsxzone/status/1521517798622515200/photo/1', 'display_url': 'pic.twitter.com/areCSHOfuC', 'media_key': '3_1521517796496183297'}], 'annotations': [{'start': 19, 'end': 24, 'probability': 0.5107, 'type': 'Product', 'normalized_text': 'Roblox'}]}",{'media_keys': ['3_1521517796496183297']},False,,following,Twitter for Android
1521509707537842176,1365210061807575042,"Hello to those who came, thank you it was really fun !!!! ❤️❤️❤️

#StrayKids #MANIAC_SKZ https://t.co/hKUCkgP6Dh",2022-05-03 15:19:17+00:00,,81,11,703,50,en,1521509707537842176,"[{'domain': {'id': '10', 'name': 'Person', 'description': 'Named people in the world like Nelson Mandela'}, 'entity': {'id': '1062427352318173185', 'name': 'Stray Kids', 'description': 'Stray Kids (스트레이 키즈)'}}, {'domain': {'id': '54', 'name': 'Musician', 'description': 'A musician in the world, like Adele or Bob Dylan'}, 'entity': {'id': '1062427352318173185', 'name': 'Stray Kids', 'description': 'Stray Kids (스트레이 키즈)'}}, {'domain': {'id': '55', 'name': 'Music Genre', 'description': 'A category for a musical style, like Pop, Rock, or Rap'}, 'entity': {'id': '888105153038958593', 'name': 'K-pop', 'description': 'K-Pop'}}]","{'urls': [{'start': 89, 'end': 112, 'url': 'https://t.co/hKUCkgP6Dh', 'expanded_url': 'https://twitter.com/stayvillesnews/status/1521509707537842176/photo/1', 'display_url': 'pic.twitter.com/hKUCkgP6Dh', 'media_key': '3_1521509685882667013'}, {'start': 89, 'end': 112, 'url': 'https://t.co/hKUCkgP6Dh', 'expanded_url': 'https://twitter.com/stayvillesnews/status/1521509707537842176/photo/1', 'display_url': 'pic.twitter.com/hKUCkgP6Dh', 'media_key': '3_1521509690479616000'}, {'start': 89, 'end': 112, 'url': 'https://t.co/hKUCkgP6Dh', 'expanded_url': 'https://twitter.com/stayvillesnews/status/1521509707537842176/photo/1', 'display_url': 'pic.twitter.com/hKUCkgP6Dh', 'media_key': '3_1521509691016478725'}, {'start': 89, 'end': 112, 'url': 'https://t.co/hKUCkgP6Dh', 'expanded_url': 'https://twitter.com/stayvillesnews/status/1521509707537842176/photo/1', 'display_url': 'pic.twitter.com/hKUCkgP6Dh', 'media_key': '3_1521509698478166016'}], 'hashtags': [{'start': 66, 'end': 76, 'tag': 'StrayKids'}, {'start': 77, 'end': 88, 'tag': 'MANIAC_SKZ'}]}","{'media_keys': ['3_1521509685882667013', '3_1521509690479616000', '3_1521509691016478725', '3_1521509698478166016']}",False,,everyone,Twitter for iPad
1521209599042506752,1310688804441817088,"shit fucking birthday. worst day ever. life is horrible, absolutely terrible LOL.",2022-05-02 19:26:45+00:00,,3,117,163,9,en,1521209599042506752,[],,,False,,everyone,Twitter Web App
1521475650204307457,857587174778093569,ผุ้เฒ่าแดงไลฟ์เกนชินว่ะ,2022-05-03 13:03:57+00:00,,0,1,0,0,th,1521475650204307457,[],,,False,,everyone,Twitter for iPhone
1521508481358045187,1103861475926593536,whens the roblox thing,2022-05-03 15:14:24+00:00,,0,1,0,0,en,1521508481358045187,"[{'domain': {'id': '71', 'name': 'Video Game', 'description': 'A video game like Overwatch'}, 'entity': {'id': '1088118927580774400', 'name': 'Roblox', 'description': 'Roblox'}}]",,,False,,everyone,Twitter Web App
1521514928313667590,9695312,"Spotify is partnering with Roblox on a virtual music ""island."" 🌴 https://t.co/63FFtENeKf",2022-05-03 15:40:01+00:00,,26,5,163,0,en,1521514928313667590,"[{'domain': {'id': '45', 'name': 'Brand Vertical', 'description': 'Top level entities that describe a Brands industry'}, 'entity': {'id': '781974597310615553', 'name': 'Entertainment'}}, {'domain': {'id': '46', 'name': 'Brand Category', 'description': 'Categories within Brand Verticals that narrow down the scope of Brands'}, 'entity': {'id': '781974596157181956', 'name': 'Online Site'}}, {'domain': {'id': '46', 'name': 'Brand Category', 'description': 'Categories within Brand Verticals that narrow down the scope of Brands'}, 'entity': {'id': '781974597222535168', 'name': 'Online Services'}}, {'domain': {'id': '47', 'name': 'Brand', 'description': 'Brands and Companies'}, 'entity': {'id': '10040276669', 'name': 'Spotify'}}, {'domain': {'id': '47', 'name': 'Brand', 'description': 'Brands and Companies'}, 'entity': {'id': '10046487315', 'name': 'Billboard'}}, {'domain': {'id': '67', 'name': 'Interests and Hobbies', 'description': 'Interests, opinions, and behaviors of individuals, groups, or cultures; like Speciality Cooking or Theme Parks'}, 'entity': {'id': '1288826829634035714', 'name': 'Backstage'}}, {'domain': {'id': '71', 'name': 'Video Game', 'description': 'A video game like Overwatch'}, 'entity': {'id': '1088118927580774400', 'name': 'Roblox', 'description': 'Roblox'}}]","{'urls': [{'start': 65, 'end': 88, 'url': 'https://t.co/63FFtENeKf', 'expanded_url': 'http://blbrd.cm/hxDRluY', 'display_url': 'blbrd.cm/hxDRluY', 'images': [{'url': 'https://pbs.twimg.com/news_img/1521503152490659840/kRR9a5om?format=jpg&name=orig', 'width': 1024, 'height': 573}, {'url': 'https://pbs.twimg.com/news_img/1521503152490659840/kRR9a5om?format=jpg&name=150x150', 'width': 150, 'height': 150}], 'status': 200, 'title': 'Spotify Partners With Roblox on Virtual Music ‘Island’', 'description': ""Spotify is the latest music company hoping to tap into Roblox's large, youthful userbase"", 'unwound_url': 'https://www.billboard.com/pro/spotify-roblox-partnership-island/?utm_source=twitter&utm_medium=social'}], 'annotations': [{'start': 0, 'end': 6, 'probability': 0.5594, 'type': 'Organization', 'normalized_text': 'Spotify'}, {'start': 27, 'end': 32, 'probability': 0.4692, 'type': 'Product', 'normalized_text': 'Roblox'}]}",,False,,everyone,SocialFlow
1521482812326825986,1456217481970806787,@hwangslixie @MusicWeek @Roblox @Stray_Kids @miyaohyeah @SpotifyUK @Spotify what if roblox concert,2022-05-03 13:32:24+00:00,,13,5,646,21,en,1521470080462295043,"[{'domain': {'id': '10', 'name': 'Person', 'description': 'Named people in the world like Nelson Mandela'}, 'entity': {'id': '1062427352318173185', 'name': 'Stray Kids', 'description': 'Stray Kids (스트레이 키즈)'}}, {'domain': {'id': '45', 'name': 'Brand Vertical', 'description': 'Top level entities that describe a Brands industry'}, 'entity': {'id': '781974597310615553', 'name': 'Entertainment'}}, {'domain': {'id': '46', 'name': 'Brand Category', 'description': 'Categories within Brand Verticals that narrow down the scope of Brands'}, 'entity': {'id': '781974597222535168', 'name': 'Online Services'}}, {'domain': {'id': '47', 'name': 'Brand', 'description': 'Brands and Companies'}, 'entity': {'id': '10040276669', 'name': 'Spotify'}}, {'domain': {'id': '54', 'name': 'Musician', 'description': 'A musician in the world, like Adele or Bob Dylan'}, 'entity': {'id': '1062427352318173185', 'name': 'Stray Kids', 'description': 'Stray Kids (스트레이 키즈)'}}, {'domain': {'id': '55', 'name': 'Music Genre', 'description': 'A category for a musical style, like Pop, Rock, or Rap'}, 'entity': {'id': '888105153038958593', 'name': 'K-pop', 'description': 'K-Pop'}}, {'domain': {'id': '67', 'name': 'Interests and Hobbies', 'description': 'Interests, opinions, and behaviors of individuals, groups, or cultures; like Speciality Cooking or Theme Parks'}, 'entity': {'id': '1288826829634035714', 'name': 'Backstage'}}, {'domain': {'id': '71', 'name': 'Video Game', 'description': 'A video game like Overwatch'}, 'entity': {'id': '1088118927580774400', 'name': 'Roblox', 'description': 'Roblox'}}]","{'mentions': [{'start': 13, 'end': 23, 'username': 'MusicWeek', 'id': '20234637'}, {'start': 24, 'end': 31, 'username': 'Roblox', 'id': '16745055'}, {'start': 32, 'end': 43, 'username': 'Stray_Kids', 'id': '859297966581891072'}, {'start': 44, 'end': 55, 'username': 'miyaohyeah', 'id': '2347170860'}, {'start': 56, 'end': 66, 'username': 'SpotifyUK', 'id': '479315245'}, {'start': 67, 'end': 75, 'username': 'Spotify', 'id': '17230018'}]}",,False,,everyone,Twitter Web App
1521518272537296901,1320960445281300480,anyway I have more👆,2022-05-03 15:53:19+00:00,,0,1,0,0,en,1521517739948781568,[],,,False,,everyone,Twitter for iPhone
1521483185464520709,1288068153482727425,https://t.co/sBIAcDL97S,2022-05-03 13:33:53+00:00,,0,1,0,0,zxx,1521483104329900032,"[{'domain': {'id': '71', 'name': 'Video Game', 'description': 'A video game like Overwatch'}, 'entity': {'id': '1088118927580774400', 'name': 'Roblox', 'description': 'Roblox'}}, {'domain': {'id': '71', 'name': 'Video Game', 'description': 'A video game like Overwatch'}, 'entity': {'id': '1230882318224510978', 'name': 'Royale High'}}]","{'urls': [{'start': 0, 'end': 23, 'url': 'https://t.co/sBIAcDL97S', 'expanded_url': 'https://twitter.com/Lovearo0n/status/1521482644197810176?t=pKmdHJCVaX2d9LyCkGlw8w&s=19', 'display_url': 'twitter.com/Lovearo0n/stat…'}]}",,False,,everyone,Twitter for Android
1521492274944921601,1056053249470541824,"Spotify Island has now RELEASED to all players 🎶

https://t.co/TKtEeG0Lx5 https://t.co/UgY5vCB9QJ",2022-05-03 14:10:00+00:00,,22,38,384,4,en,1521492274944921601,"[{'domain': {'id': '45', 'name': 'Brand Vertical', 'description': 'Top level entities that describe a Brands industry'}, 'entity': {'id': '781974597310615553', 'name': 'Entertainment'}}, {'domain': {'id': '46', 'name': 'Brand Category', 'description': 'Categories within Brand Verticals that narrow down the scope of Brands'}, 'entity': {'id': '781974597222535168', 'name': 'Online Services'}}, {'domain': {'id': '47', 'name': 'Brand', 'description': 'Brands and Companies'}, 'entity': {'id': '10040276669', 'name': 'Spotify'}}, {'domain': {'id': '67', 'name': 'Interests and Hobbies', 'description': 'Interests, opinions, and behaviors of individuals, groups, or cultures; like Speciality Cooking or Theme Parks'}, 'entity': {'id': '1288826829634035714', 'name': 'Backstage'}}, {'domain': {'id': '71', 'name': 'Video Game', 'description': 'A video game like Overwatch'}, 'entity': {'id': '1088118927580774400', 'name': 'Roblox', 'description': 'Roblox'}}]","{'urls': [{'start': 50, 'end': 73, 'url': 'https://t.co/TKtEeG0Lx5', 'expanded_url': 'https://www.roblox.com/games/8209480473/Spotify-Island', 'display_url': 'roblox.com/games/82094804…', 'images': [{'url': 'https://pbs.twimg.com/news_img/1539716087390019592/GLYMsOb5?format=jpg&name=orig', 'width': 498, 'height': 280}, {'url': 'https://pbs.twimg.com/news_img/1539716087390019592/GLYMsOb5?format=jpg&name=150x150', 'width': 150, 'height': 150}], 'status': 200, 'title': 'Spotify Island', 'description': 'Check out Spotify Island. It’s one of the millions of unique, user-generated 3D experiences created on Roblox. SUNMI IS HERE! 🦋 Visit SUNMI in K-Park! Get her in-game items and complete her brand-new scavenger hunt! The Butterfly Wings - SUNMI will be available for free when you jump through the K-Park portal until Monday night 12am PST. We are working on a solution to compensate everyone who has already bought the wings. 🌴 Welcome to Spotify Island. Your next adventure awaits! 👨\u200d🎤 Meet your favorite artists! 🎵 Play with sounds! 🧭 Explore quests! 🦋 Collect special merch! 🥰 Have fun and be kind! ✨ The possibilities are endless! Like reward goal! 10K Likes = Double XP! ⭐ 20K Likes = Promo code: SPOTIFY20K 30K Likes = Promo code: SPOTIFY30K Next reward at 40K likes!', 'unwound_url': 'https://www.roblox.com/games/8209480473/Spotify-Island'}, {'start': 74, 'end': 97, 'url': 'https://t.co/UgY5vCB9QJ', 'expanded_url': 'https://twitter.com/Roblox_RTC/status/1521443607382740992', 'display_url': 'twitter.com/Roblox_RTC/sta…'}], 'annotations': [{'start': 0, 'end': 13, 'probability': 0.5233, 'type': 'Organization', 'normalized_text': 'Spotify Island'}]}",,False,,everyone,Twitter for iPhone
1521517888758235136,1518950776546238470,@guipimenteI @Marcellamkt @KauNicollasOli1 @LulaOficial O que pensar de um cara que dá uma resposta dessa?! Jesus!,2022-05-03 15:51:47+00:00,,0,2,3,0,pt,1521503865622843393,"[{'domain': {'id': '29', 'name': 'Events [Entity Service]', 'description': 'Entity Service related Events domain'}, 'entity': {'id': '1411038381841084418', 'name': 'Brazil General Elections 2022', 'description': 'Brazil General Elections 2022 (presidential, gubernatorial, VPS)'}}, {'domain': {'id': '38', 'name': 'Political Race', 'description': ''}, 'entity': {'id': '1411038381841084418', 'name': 'Brazil General Elections 2022', 'description': 'Brazil General Elections 2022 (presidential, gubernatorial, VPS)'}}, {'domain': {'id': '10', 'name': 'Person', 'description': 'Named people in the world like Nelson Mandela'}, 'entity': {'id': '862070591737675776', 'name': 'Luiz Inácio ""Lula"" da Silva', 'description': 'Brazilian 35th president.'}}, {'domain': {'id': '35', 'name': 'Politician', 'description': 'Politicians in the world, like Joe Biden'}, 'entity': {'id': '862070591737675776', 'name': 'Luiz Inácio ""Lula"" da Silva', 'description': 'Brazilian 35th president.'}}]","{'annotations': [{'start': 108, 'end': 112, 'probability': 0.6811, 'type': 'Person', 'normalized_text': 'Jesus'}], 'mentions': [{'start': 0, 'end': 12, 'username': 'guipimenteI', 'id': '1067606668207362048'}, {'start': 13, 'end': 25, 'username': 'Marcellamkt', 'id': '1520056856496021504'}, {'start': 26, 'end': 42, 'username': 'KauNicollasOli1', 'id': '1382748385439023104'}, {'start': 43, 'end': 55, 'username': 'LulaOficial', 'id': '2670726740'}]}",,False,,everyone,Twitter for iPhone
1521303863411675137,1332851349214482436,You guys got games on your phone? https://t.co/bFjQJRAcaA,2022-05-03 01:41:20+00:00,,166,658,4514,9,en,1521303863411675137,[],"{'urls': [{'start': 34, 'end': 57, 'url': 'https://t.co/bFjQJRAcaA', 'expanded_url': 'https://twitter.com/BeanNotHere/status/1521303863411675137/photo/1', 'display_url': 'pic.twitter.com/bFjQJRAcaA', 'media_key': '3_1521303861008297984'}]}",{'media_keys': ['3_1521303861008297984']},False,,everyone,Twitter for iPhone
1521501502698831873,2969545881,I just got HUGE News comin out Later today Folks this is gonna be so Lit yall have no idea!?!?!?!?,2022-05-03 14:46:41+00:00,,4,24,128,0,en,1521501502698831873,[],,,False,,everyone,Twitter for Android
1521515803598012417,1500643343059255296,stays robloxian era https://t.co/IFFSG4h1DL,2022-05-03 15:43:30+00:00,,3,5,20,1,en,1521515803598012417,[],"{'urls': [{'start': 20, 'end': 43, 'url': 'https://t.co/IFFSG4h1DL', 'expanded_url': 'https://twitter.com/hyunstival/status/1521515803598012417/photo/1', 'display_url': 'pic.twitter.com/IFFSG4h1DL', 'media_key': '3_1521515786116157441'}, {'start': 20, 'end': 43, 'url': 'https://t.co/IFFSG4h1DL', 'expanded_url': 'https://twitter.com/hyunstival/status/1521515803598012417/photo/1', 'display_url': 'pic.twitter.com/IFFSG4h1DL', 'media_key': '3_1521515791665221632'}, {'start': 20, 'end': 43, 'url': 'https://t.co/IFFSG4h1DL', 'expanded_url': 'https://twitter.com/hyunstival/status/1521515803598012417/photo/1', 'display_url': 'pic.twitter.com/IFFSG4h1DL', 'media_key': '3_1521515795708510209'}, {'start': 20, 'end': 43, 'url': 'https://t.co/IFFSG4h1DL', 'expanded_url': 'https://twitter.com/hyunstival/status/1521515803598012417/photo/1', 'display_url': 'pic.twitter.com/IFFSG4h1DL', 'media_key': '3_1521515800779444225'}]}","{'media_keys': ['3_1521515786116157441', '3_1521515791665221632', '3_1521515795708510209', '3_1521515800779444225']}",False,,everyone,Twitter for Android
1521213652296159234,1465851881180348425,i wanna play a horror game this week. what's a genuinely terrifying game we can do,2022-05-02 19:42:52+00:00,,866,738,27129,58,en,1521213652296159234,[],,,False,,everyone,Twitter Web App
1515371450177314820,1507681535058718722,"꒰ Inventory gw! ꒱ 

ʚ  Follow me &amp; @LuvqxCrystal &amp; @LuvqxAbby

ʚ  Like + Retweet !
ʚ  Comment done &amp; Comment what items u want from my inv (1-2) !

⌗ Goodluck! ❞ 

- extras in thread -

— Layout by @//luvhkylie https://t.co/xNMHZfxZzK",2022-04-16 16:48:02+00:00,,44,33,44,14,en,1515371450177314820,[],"{'urls': [{'start': 223, 'end': 246, 'url': 'https://t.co/xNMHZfxZzK', 'expanded_url': 'https://twitter.com/Peteltwins/status/1515371450177314820/video/1', 'display_url': 'pic.twitter.com/xNMHZfxZzK', 'media_key': '7_1515371103727857672'}], 'mentions': [{'start': 59, 'end': 69, 'username': 'LuvqxAbby', 'id': '1498097733252653056'}]}",{'media_keys': ['7_1515371103727857672']},False,,everyone,Twitter Web App
1521479247625396229,921743454354452480,"ok for anyone who is confused let me explain:
roblox is a video game where you play mini games and explore the online universe - it seems like spotify is creating an interactive island in this universe, and skz and sunmi are featured 💕 https://t.co/F8YuRFgfjB",2022-05-03 13:18:15+00:00,,462,14,2009,125,en,1521479247625396229,"[{'domain': {'id': '45', 'name': 'Brand Vertical', 'description': 'Top level entities that describe a Brands industry'}, 'entity': {'id': '781974597310615553', 'name': 'Entertainment'}}, {'domain': {'id': '46', 'name': 'Brand Category', 'description': 'Categories within Brand Verticals that narrow down the scope of Brands'}, 'entity': {'id': '781974597222535168', 'name': 'Online Services'}}, {'domain': {'id': '47', 'name': 'Brand', 'description': 'Brands and Companies'}, 'entity': {'id': '10040276669', 'name': 'Spotify'}}, {'domain': {'id': '67', 'name': 'Interests and Hobbies', 'description': 'Interests, opinions, and behaviors of individuals, groups, or cultures; like Speciality Cooking or Theme Parks'}, 'entity': {'id': '1288826829634035714', 'name': 'Backstage'}}, {'domain': {'id': '71', 'name': 'Video Game', 'description': 'A video game like Overwatch'}, 'entity': {'id': '1088118927580774400', 'name': 'Roblox', 'description': 'Roblox'}}]","{'urls': [{'start': 236, 'end': 259, 'url': 'https://t.co/F8YuRFgfjB', 'expanded_url': 'https://twitter.com/haetbitskzz/status/1521479247625396229/photo/1', 'display_url': 'pic.twitter.com/F8YuRFgfjB', 'media_key': '3_1521479244345393154'}], 'annotations': [{'start': 143, 'end': 149, 'probability': 0.7034, 'type': 'Product', 'normalized_text': 'spotify'}, {'start': 215, 'end': 219, 'probability': 0.6808, 'type': 'Person', 'normalized_text': 'sunmi'}]}",{'media_keys': ['3_1521479244345393154']},False,,everyone,Twitter for iPhone
