tweetid,author_id,text,created_at,geo,retweets,replies,likes,quote_count,lang,conversation_id,context_annotations,entities,attachments,possibly_sensitive,withheld,reply_settings,source
1514018070347485187,1069006874811363328,"Comment ""ROBLOX"" with your eyes closed 😈",2022-04-12 23:10:11+00:00,,78,3198,989,5,en,1514018070347485187,"[{'domain': {'id': '71', 'name': 'Video Game', 'description': 'A video game like Overwatch'}, 'entity': {'id': '1088118927580774400', 'name': 'Roblox', 'description': 'Roblox'}}]",,,False,,everyone,Twitter Web App
1514589016775036930,1274567943364284417,"If you don't know how to get this item, watch this video from SharkBlox:
Video: https://t.co/EiphQpxTCx",2022-04-14 12:58:55+00:00,,0,1,2,0,en,1514588933094404096,[],"{'annotations': [{'start': 62, 'end': 70, 'probability': 0.4353, 'type': 'Person', 'normalized_text': 'SharkBlox'}], 'urls': [{'start': 80, 'end': 103, 'url': 'https://t.co/EiphQpxTCx', 'expanded_url': 'https://www.youtube.com/watch?v=KMwzBWOOQ0M', 'display_url': 'youtube.com/watch?v=KMwzBW…', 'images': [{'url': 'https://pbs.twimg.com/news_img/1514589019291611140/MVebNGby?format=jpg&name=orig', 'width': 480, 'height': 360}, {'url': 'https://pbs.twimg.com/news_img/1514589019291611140/MVebNGby?format=jpg&name=150x150', 'width': 150, 'height': 150}], 'status': 200, 'title': 'FREE ACCESSORY! HOW TO GET Arsenal Nomad Bundle! (ROBLOX PRIME GAMING)', 'description': 'How’s it going guys, SharkBlox here,Today I’m going to show you guys how to get this free Roblox Aresenal bundle with 2 free hat accessories! Make sure to us...', 'unwound_url': 'https://www.youtube.com/watch?v=KMwzBWOOQ0M'}]}",,False,,everyone,Twitter Web App
1514588961284317186,1274567943364284417,"You can get it by signing in/up for your Amazon Account then get a 30-day free trial using any of your credit cards ( impossible without it ). Next, go to this Prime Gaming Website then click the claim now button and it should give you a code to redeem to get the item.",2022-04-14 12:58:42+00:00,,0,1,2,0,en,1514588933094404096,"[{'domain': {'id': '45', 'name': 'Brand Vertical', 'description': 'Top level entities that describe a Brands industry'}, 'entity': {'id': '781974596706635776', 'name': 'Retail'}}, {'domain': {'id': '46', 'name': 'Brand Category', 'description': 'Categories within Brand Verticals that narrow down the scope of Brands'}, 'entity': {'id': '783335558466506752', 'name': 'Online'}}, {'domain': {'id': '47', 'name': 'Brand', 'description': 'Brands and Companies'}, 'entity': {'id': '10026792024', 'name': 'Amazon'}}, {'domain': {'id': '48', 'name': 'Product', 'description': 'Products created by Brands.  Examples: Ford Explorer, Apple iPhone.'}, 'entity': {'id': '10046538542', 'name': 'Amazon Prime'}}]","{'annotations': [{'start': 41, 'end': 46, 'probability': 0.5507, 'type': 'Organization', 'normalized_text': 'Amazon'}]}",,False,,everyone,Twitter Web App
1514582261781381125,1541198544,@SONICstalgia @Rv1Rx @Goldbrella1 @OnTheDownLoTho @SoopaKoopa_ I'm speaking while being more familiar with the entire platform than anyone in this thread,2022-04-14 12:32:05+00:00,,0,1,0,0,en,1514286658509803530,[],"{'mentions': [{'start': 0, 'end': 13, 'username': 'SONICstalgia', 'id': '1473114908384505856'}, {'start': 14, 'end': 20, 'username': 'Rv1Rx', 'id': '1470436593198637060'}, {'start': 21, 'end': 33, 'username': 'Goldbrella1', 'id': '1278101097182310400'}, {'start': 34, 'end': 49, 'username': 'OnTheDownLoTho', 'id': '1215723171200012288'}, {'start': 50, 'end': 62, 'username': 'SoopaKoopa_', 'id': '3248720387'}]}",,False,,everyone,Twitter Web App
1514588448430166025,4872964317,@chubbyhusbandos Do you need to be able to read to play Roblox?,2022-04-14 12:56:40+00:00,,0,1,1,0,en,1514585313523474441,"[{'domain': {'id': '71', 'name': 'Video Game', 'description': 'A video game like Overwatch'}, 'entity': {'id': '1088118927580774400', 'name': 'Roblox', 'description': 'Roblox'}}]","{'annotations': [{'start': 56, 'end': 61, 'probability': 0.4489, 'type': 'Product', 'normalized_text': 'Roblox'}], 'mentions': [{'start': 0, 'end': 16, 'username': 'chubbyhusbandos', 'id': '1127376337939730433'}]}",,False,,everyone,Twitter for iPhone
1514367860310745088,1143392550,"@Roblox @primegaming @ROLVeStuff Arsenal it's the best shooting game in roblox, but too many hackers with auto aiming and wall shooting, come on 😕",2022-04-13 22:20:08+00:00,,0,1,11,0,en,1514366060257951751,"[{'domain': {'id': '71', 'name': 'Video Game', 'description': 'A video game like Overwatch'}, 'entity': {'id': '1088118927580774400', 'name': 'Roblox', 'description': 'Roblox'}}]","{'annotations': [{'start': 33, 'end': 39, 'probability': 0.7792, 'type': 'Organization', 'normalized_text': 'Arsenal'}], 'mentions': [{'start': 0, 'end': 7, 'username': 'Roblox', 'id': '16745055'}, {'start': 8, 'end': 20, 'username': 'primegaming', 'id': '759027320560627712'}, {'start': 21, 'end': 32, 'username': 'ROLVeStuff', 'id': '2995414579'}]}",,False,,everyone,Twitter for Android
1514366060257951751,16745055,You’re already clearing up in Arsenal. Now do it with style. Amazon Prime users can get the @primegaming Virtual Nomad Bundle by @ROLVeStuff here: https://t.co/jUbfif33rM https://t.co/seK5wlQSY7,2022-04-13 22:12:58+00:00,,149,881,2596,26,en,1514366060257951751,"[{'domain': {'id': '71', 'name': 'Video Game', 'description': 'A video game like Overwatch'}, 'entity': {'id': '1088118927580774400', 'name': 'Roblox', 'description': 'Roblox'}}, {'domain': {'id': '45', 'name': 'Brand Vertical', 'description': 'Top level entities that describe a Brands industry'}, 'entity': {'id': '781974596706635776', 'name': 'Retail'}}, {'domain': {'id': '46', 'name': 'Brand Category', 'description': 'Categories within Brand Verticals that narrow down the scope of Brands'}, 'entity': {'id': '783335558466506752', 'name': 'Online'}}, {'domain': {'id': '47', 'name': 'Brand', 'description': 'Brands and Companies'}, 'entity': {'id': '10026792024', 'name': 'Amazon'}}, {'domain': {'id': '48', 'name': 'Product', 'description': 'Products created by Brands.  Examples: Ford Explorer, Apple iPhone.'}, 'entity': {'id': '10046538542', 'name': 'Amazon Prime'}}]","{'annotations': [{'start': 30, 'end': 36, 'probability': 0.6733, 'type': 'Place', 'normalized_text': 'Arsenal'}, {'start': 61, 'end': 72, 'probability': 0.4441, 'type': 'Product', 'normalized_text': 'Amazon Prime'}], 'urls': [{'start': 147, 'end': 170, 'url': 'https://t.co/jUbfif33rM', 'expanded_url': 'https://rblx.co/Virtual-Nomad', 'display_url': 'rblx.co/Virtual-Nomad'}, {'start': 171, 'end': 194, 'url': 'https://t.co/seK5wlQSY7', 'expanded_url': 'https://twitter.com/Roblox/status/1514366060257951751/video/1', 'display_url': 'pic.twitter.com/seK5wlQSY7', 'media_key': '7_1514365737481080835'}], 'mentions': [{'start': 92, 'end': 104, 'username': 'primegaming', 'id': '759027320560627712'}, {'start': 129, 'end': 140, 'username': 'ROLVeStuff', 'id': '2995414579'}]}",{'media_keys': ['7_1514365737481080835']},False,,everyone,Twitter Web App
1514530019510521862,1096446289863155714,"Téma spoření dětem, resp. naučit je investovat je hodně populární a už jsem slyšel mnoho názorů a rad
Ale s čím přišel dnes @j_brychta 😂
Nechám je nakoupit horší akcie ať prodělávaj a přemýšlí o tom...
Když jednomu akcie poroste a druhému bude klesat, jo to bude taky dobrý... 🤣 https://t.co/siWOAaYFrV",2022-04-14 09:04:29+00:00,,1,3,33,0,cs,1514530019510521862,[],"{'urls': [{'start': 279, 'end': 302, 'url': 'https://t.co/siWOAaYFrV', 'expanded_url': 'https://twitter.com/TPlechac/status/1514530019510521862/photo/1', 'display_url': 'pic.twitter.com/siWOAaYFrV', 'media_key': '3_1514529093714337799'}], 'mentions': [{'start': 124, 'end': 134, 'username': 'j_brychta', 'id': '2734045067'}]}",{'media_keys': ['3_1514529093714337799']},False,,everyone,Twitter Web App
1514586399432925195,1417592374679719937,@its_me_kade @gaytertot_ Ooo me too! I totally still don’t watch him and I have definitely moved on😁,2022-04-14 12:48:31+00:00,,0,1,1,0,en,1514579668636037123,[],"{'mentions': [{'start': 13, 'end': 24, 'username': 'gaytertot_', 'id': '1408451166913110017'}]}",,False,,everyone,Twitter for iPad
1514286658509803530,1215723171200012288,"ROBLOX PARTNERED WITH SEGA FOR A SONIC GAME IN ROBLOX WHAT THE  FK LOOOOOL
 https://t.co/k1Q2QERcJ4",2022-04-13 16:57:28+00:00,,1670,372,15411,255,en,1514286658509803530,"[{'domain': {'id': '71', 'name': 'Video Game', 'description': 'A video game like Overwatch'}, 'entity': {'id': '1088118927580774400', 'name': 'Roblox', 'description': 'Roblox'}}, {'domain': {'id': '78', 'name': 'Video Game Publisher', 'description': ""A Video Game Publisher like 'Activision'""}, 'entity': {'id': '943877135894056966', 'name': 'Sega', 'description': 'Sega'}}, {'domain': {'id': '130', 'name': 'Multimedia Franchise', 'description': ""Franchises which span multiple forms of media like 'Harry Potter'""}, 'entity': {'id': '993952643209773057', 'name': 'Sonic the Hedgehog', 'description': 'This entity includes all conversation about the franchise, as well as any individual installments in the series, if applicable.\t\t\t\n\nNOTE: Stopped annotating in the Video Game domain (71) on 11/15/19. Moving forward, this entity will annotate to Multimedia Franchise domain (130) only.'}}]","{'urls': [{'start': 76, 'end': 99, 'url': 'https://t.co/k1Q2QERcJ4', 'expanded_url': 'https://twitter.com/gamefamstudios/status/1514280013201297408/video/1', 'display_url': 'pic.twitter.com/k1Q2QERcJ4', 'media_key': '7_1514279913066573825'}]}",{'media_keys': ['7_1514279913066573825']},False,,everyone,Twitter for iPhone
1514413969452240899,1405544095192207367,https://t.co/kh6nxXOWee,2022-04-14 01:23:21+00:00,,65,314,1116,26,zxx,1514413969452240899,[],"{'urls': [{'start': 0, 'end': 23, 'url': 'https://t.co/kh6nxXOWee', 'expanded_url': 'https://twitter.com/BadRobloxTikTok/status/1514413969452240899/video/1', 'display_url': 'pic.twitter.com/kh6nxXOWee', 'media_key': '7_1514413943934132230'}]}",{'media_keys': ['7_1514413943934132230']},False,,everyone,Twitter for iPhone
1514588308239695876,1127376337939730433,@invisibleblkguy Why is he playing Roblox if he can’t even read yet? He’s gonna turn into an iPad kid lol,2022-04-14 12:56:07+00:00,,0,1,1,0,en,1514585313523474441,"[{'domain': {'id': '47', 'name': 'Brand', 'description': 'Brands and Companies'}, 'entity': {'id': '10026364281', 'name': 'Apple'}}, {'domain': {'id': '48', 'name': 'Product', 'description': 'Products created by Brands.  Examples: Ford Explorer, Apple iPhone.'}, 'entity': {'id': '972153731067273222', 'name': 'Apple iPad', 'description': 'Apple iPad'}}, {'domain': {'id': '71', 'name': 'Video Game', 'description': 'A video game like Overwatch'}, 'entity': {'id': '1088118927580774400', 'name': 'Roblox', 'description': 'Roblox'}}]","{'annotations': [{'start': 35, 'end': 40, 'probability': 0.4512, 'type': 'Product', 'normalized_text': 'Roblox'}, {'start': 93, 'end': 96, 'probability': 0.6447, 'type': 'Product', 'normalized_text': 'iPad'}], 'mentions': [{'start': 0, 'end': 16, 'username': 'invisibleblkguy', 'id': '4872964317'}]}",,False,,everyone,Twitter for iPhone
1514588279546519556,1196170618821054464,"@scrappybtw @Jogerko BRO, ONI JSOU FR NEJLEPŠI XDDD",2022-04-14 12:56:00+00:00,,0,1,0,0,cs,1514582516983865346,[],"{'mentions': [{'start': 0, 'end': 11, 'username': 'scrappybtw', 'id': '1116391925844774912'}, {'start': 12, 'end': 20, 'username': 'Jogerko', 'id': '1240736679238959104'}]}",,False,,everyone,Twitter Web App
1514585313523474441,4872964317,Not Kim K saying her 6 year old son can’t read yet. Lol shouldn’t he be in Pre K/kindergarten https://t.co/c6Zv7WAuOV,2022-04-14 12:44:13+00:00,,0,1,1,0,en,1514585313523474441,"[{'domain': {'id': '10', 'name': 'Person', 'description': 'Named people in the world like Nelson Mandela'}, 'entity': {'id': '806570121959383040', 'name': 'Kim Kardashian', 'description': 'Kim Kardashian'}}, {'domain': {'id': '58', 'name': 'Entertainment Personality', 'description': 'An entertainment personality in the world, like Anderson Cooper or Miranda Sings'}, 'entity': {'id': '806570121959383040', 'name': 'Kim Kardashian', 'description': 'Kim Kardashian'}}, {'domain': {'id': '65', 'name': 'Interests and Hobbies Vertical', 'description': 'Top level interests and hobbies groupings, like Food or Travel'}, 'entity': {'id': '864925500627484672', 'name': 'Family and life stages', 'description': 'Family and Life Stages'}}]","{'annotations': [{'start': 4, 'end': 8, 'probability': 0.9714, 'type': 'Person', 'normalized_text': 'Kim K'}], 'urls': [{'start': 94, 'end': 117, 'url': 'https://t.co/c6Zv7WAuOV', 'expanded_url': 'https://twitter.com/invisibleblkguy/status/1514585313523474441/photo/1', 'display_url': 'pic.twitter.com/c6Zv7WAuOV', 'media_key': '3_1514585310553939971'}]}",{'media_keys': ['3_1514585310553939971']},False,,everyone,Twitter for iPhone
1514550543473119237,1276056962992672768,"@Idealoli @Roblox_RTC @LinusTech Bro did you even think their parent are that dumb to let children earn money? Roblox is not for gain money and they don’t force them, they are the ones  doing it for fun like a passion project.",2022-04-14 10:26:03+00:00,,0,1,0,0,en,1513150135664091140,"[{'domain': {'id': '10', 'name': 'Person', 'description': 'Named people in the world like Nelson Mandela'}, 'entity': {'id': '1436352927157784576', 'name': 'Linus Tech', 'description': 'Youtube Channel.'}}, {'domain': {'id': '71', 'name': 'Video Game', 'description': 'A video game like Overwatch'}, 'entity': {'id': '1088118927580774400', 'name': 'Roblox', 'description': 'Roblox'}}, {'domain': {'id': '120', 'name': 'Digital Creator', 'description': 'Influencers who create content on digital platforms'}, 'entity': {'id': '1436352927157784576', 'name': 'Linus Tech', 'description': 'Youtube Channel.'}}]","{'annotations': [{'start': 111, 'end': 116, 'probability': 0.2963, 'type': 'Product', 'normalized_text': 'Roblox'}], 'mentions': [{'start': 0, 'end': 9, 'username': 'Idealoli', 'id': '1115728297051082753'}, {'start': 10, 'end': 21, 'username': 'Roblox_RTC', 'id': '1056053249470541824'}, {'start': 22, 'end': 32, 'username': 'LinusTech', 'id': '403614288'}]}",,False,,everyone,Twitter Web App
1514514735328382979,41366469,"With less than 100 days to go until @UEFAWomensEURO kicks off at Old Trafford, UEFA has unveiled the tournament’s first Hat Trick heroes.
https://t.co/3qdrPkhXH9",2022-04-14 08:03:45+00:00,,2,1,7,1,en,1514514735328382979,"[{'domain': {'id': '3', 'name': 'TV Shows', 'description': 'Television shows from around the world'}, 'entity': {'id': '10027336009', 'name': ""Live: UEFA European Women's Championship Football"", 'description': ""Coverage from the women's association competition between national teams of the UEFA Confederation.""}}, {'domain': {'id': '3', 'name': 'TV Shows', 'description': 'Television shows from around the world'}, 'entity': {'id': '10050231681', 'name': 'Football : UEFA Euro féminin 2017'}}, {'domain': {'id': '26', 'name': 'Sports League', 'description': ''}, 'entity': {'id': '1453815075102355456', 'name': ""UEFA European Women's Championship""}}]","{'annotations': [{'start': 65, 'end': 76, 'probability': 0.6292, 'type': 'Place', 'normalized_text': 'Old Trafford'}, {'start': 79, 'end': 82, 'probability': 0.8197, 'type': 'Organization', 'normalized_text': 'UEFA'}], 'urls': [{'start': 138, 'end': 161, 'url': 'https://t.co/3qdrPkhXH9', 'expanded_url': 'https://shekicks.net/hat-trick-of-virtual-world-mascots-unveiled-ahead-of-weuro2022/', 'display_url': 'shekicks.net/hat-trick-of-v…', 'images': [{'url': 'https://pbs.twimg.com/news_img/1514514748217434115/r9D5Brau?format=jpg&name=orig', 'width': 1200, 'height': 675}, {'url': 'https://pbs.twimg.com/news_img/1514514748217434115/r9D5Brau?format=jpg&name=150x150', 'width': 150, 'height': 150}], 'status': 200, 'title': 'Hat Trick of virtual world mascots unveiled ahead of WEURO2022 - SheKicks', 'description': 'With less than 100 days to go until UEFA Women’s EURO kicks off at Old Trafford, UEFA has unveiled the tournament’s first Hat Trick heroes', 'unwound_url': 'https://shekicks.net/hat-trick-of-virtual-world-mascots-unveiled-ahead-of-weuro2022/'}], 'mentions': [{'start': 36, 'end': 51, 'username': 'UEFAWomensEURO', 'id': '1536347099750666240'}]}",,False,,everyone,Twitter Web App
1514366397731807237,1431995894652706819,@Roblox @primegaming @ROLVeStuff bro fix my game dawg ☠️,2022-04-13 22:14:19+00:00,,0,1,13,0,en,1514366060257951751,"[{'domain': {'id': '71', 'name': 'Video Game', 'description': 'A video game like Overwatch'}, 'entity': {'id': '1088118927580774400', 'name': 'Roblox', 'description': 'Roblox'}}]","{'mentions': [{'start': 0, 'end': 7, 'username': 'Roblox', 'id': '16745055'}, {'start': 8, 'end': 20, 'username': 'primegaming', 'id': '759027320560627712'}, {'start': 21, 'end': 32, 'username': 'ROLVeStuff', 'id': '2995414579'}]}",,False,,everyone,Twitter for iPhone
1514573078243778569,220238741,Omg I’m watching The new Kardashians  and Saint was on his iPad playing Roblox and an ad came up with Kim’s crying face and it said “click here for Kim’s unreleased sex tape footage” 🥴🥴🥴🥴,2022-04-14 11:55:35+00:00,,2,2,8,11,en,1514573078243778569,"[{'domain': {'id': '47', 'name': 'Brand', 'description': 'Brands and Companies'}, 'entity': {'id': '10026364281', 'name': 'Apple'}}, {'domain': {'id': '48', 'name': 'Product', 'description': 'Products created by Brands.  Examples: Ford Explorer, Apple iPhone.'}, 'entity': {'id': '972153731067273222', 'name': 'Apple iPad', 'description': 'Apple iPad'}}, {'domain': {'id': '71', 'name': 'Video Game', 'description': 'A video game like Overwatch'}, 'entity': {'id': '1088118927580774400', 'name': 'Roblox', 'description': 'Roblox'}}]","{'annotations': [{'start': 25, 'end': 35, 'probability': 0.412, 'type': 'Person', 'normalized_text': 'Kardashians'}, {'start': 42, 'end': 46, 'probability': 0.8379, 'type': 'Person', 'normalized_text': 'Saint'}, {'start': 59, 'end': 62, 'probability': 0.8409, 'type': 'Product', 'normalized_text': 'iPad'}, {'start': 72, 'end': 77, 'probability': 0.5461, 'type': 'Product', 'normalized_text': 'Roblox'}, {'start': 102, 'end': 104, 'probability': 0.9907, 'type': 'Person', 'normalized_text': 'Kim'}, {'start': 148, 'end': 150, 'probability': 0.9773, 'type': 'Person', 'normalized_text': 'Kim'}]}",,False,,everyone,Twitter for iPhone
1514282152694890509,1300864368171782145,"A few months ago we posted a commonly seen Roblox Avatar that looks identical to Adolf Hitler.

Now we have Dolly Parton and size F boobs, Great job Roblox! 😄

🤦🤦🤦 https://t.co/XEG9fa4gre",2022-04-13 16:39:33+00:00,,8,45,190,5,en,1514282152694890509,"[{'domain': {'id': '71', 'name': 'Video Game', 'description': 'A video game like Overwatch'}, 'entity': {'id': '1088118927580774400', 'name': 'Roblox', 'description': 'Roblox'}}, {'domain': {'id': '10', 'name': 'Person', 'description': 'Named people in the world like Nelson Mandela'}, 'entity': {'id': '877865935654207488', 'name': 'Dolly Parton', 'description': 'Dolly Parton'}}, {'domain': {'id': '54', 'name': 'Musician', 'description': 'A musician in the world, like Adele or Bob Dylan'}, 'entity': {'id': '877865935654207488', 'name': 'Dolly Parton', 'description': 'Dolly Parton'}}, {'domain': {'id': '55', 'name': 'Music Genre', 'description': 'A category for a musical style, like Pop, Rock, or Rap'}, 'entity': {'id': '810937781996253185', 'name': 'Country music', 'description': 'Country'}}, {'domain': {'id': '55', 'name': 'Music Genre', 'description': 'A category for a musical style, like Pop, Rock, or Rap'}, 'entity': {'id': '884775851589419008', 'name': 'Folk music', 'description': 'Folk'}}]","{'annotations': [{'start': 43, 'end': 55, 'probability': 0.2898, 'type': 'Product', 'normalized_text': 'Roblox Avatar'}, {'start': 81, 'end': 92, 'probability': 0.9716, 'type': 'Person', 'normalized_text': 'Adolf Hitler'}, {'start': 108, 'end': 119, 'probability': 0.9946, 'type': 'Person', 'normalized_text': 'Dolly Parton'}], 'urls': [{'start': 164, 'end': 187, 'url': 'https://t.co/XEG9fa4gre', 'expanded_url': 'https://twitter.com/RealCV10K/status/1514282152694890509/photo/1', 'display_url': 'pic.twitter.com/XEG9fa4gre', 'media_key': '3_1514280709304770566'}]}",{'media_keys': ['3_1514280709304770566']},False,,everyone,Twitter Web App
1514587124309413890,11937352,"@joethephish Yep. Of course, Christ help you if you admit weakness in any way. If I was From, I'd not be able to resist sending out a beta build tuned to be impossible, just to see who had the guts to actually admit they couldn't handle it.",2022-04-14 12:51:24+00:00,,0,1,2,0,en,1514574169723211785,[],"{'annotations': [{'start': 29, 'end': 34, 'probability': 0.4778, 'type': 'Other', 'normalized_text': 'Christ'}], 'mentions': [{'start': 0, 'end': 12, 'username': 'joethephish', 'id': '63722579'}]}",,False,,everyone,Twitter Web App
1514460433188794372,1159878626067664896,"Does anyone feel like Roblox is getting really boring nowadays, or is it just me?",2022-04-14 04:27:59+00:00,,5,100,164,2,en,1514460433188794372,"[{'domain': {'id': '71', 'name': 'Video Game', 'description': 'A video game like Overwatch'}, 'entity': {'id': '1088118927580774400', 'name': 'Roblox', 'description': 'Roblox'}}]","{'annotations': [{'start': 22, 'end': 27, 'probability': 0.3985, 'type': 'Product', 'normalized_text': 'Roblox'}]}",,False,,everyone,Twitter for Android
1513885650101055489,1069006874811363328,"Where do you think the name ""Digito"" comes from?",2022-04-12 14:24:00+00:00,,33,547,486,2,en,1513885650101055489,[],,,False,,everyone,Twitter Web App
1514587277887873032,980354275,"(1/3) I am curious who at SEGA keeps making odd but interesting choices for the Sonic brand. Within the last 5 years, we've had a fan game crew turned official with Sonic Mania releasing, the Sonic film franchise coming out, an official Sonic DLC for Minecraft, and now I guess https://t.co/LbRojcoDtR",2022-04-14 12:52:01+00:00,,1,1,19,0,en,1514587277887873032,"[{'domain': {'id': '45', 'name': 'Brand Vertical', 'description': 'Top level entities that describe a Brands industry'}, 'entity': {'id': '781974597310615553', 'name': 'Entertainment'}}, {'domain': {'id': '46', 'name': 'Brand Category', 'description': 'Categories within Brand Verticals that narrow down the scope of Brands'}, 'entity': {'id': '781974597218340864', 'name': 'Video Games'}}, {'domain': {'id': '71', 'name': 'Video Game', 'description': 'A video game like Overwatch'}, 'entity': {'id': '10043689888', 'name': 'Minecraft'}}, {'domain': {'id': '71', 'name': 'Video Game', 'description': 'A video game like Overwatch'}, 'entity': {'id': '896925910611316741', 'name': 'Sonic Mania', 'description': 'Sonic Mania'}}, {'domain': {'id': '71', 'name': 'Video Game', 'description': 'A video game like Overwatch'}, 'entity': {'id': '993952643209773057', 'name': 'Sonic the Hedgehog', 'description': 'This entity includes all conversation about the franchise, as well as any individual installments in the series, if applicable.\t\t\t\n\nNOTE: Stopped annotating in the Video Game domain (71) on 11/15/19. Moving forward, this entity will annotate to Multimedia Franchise domain (130) only.'}}, {'domain': {'id': '71', 'name': 'Video Game', 'description': 'A video game like Overwatch'}, 'entity': {'id': '1088118927580774400', 'name': 'Roblox', 'description': 'Roblox'}}, {'domain': {'id': '78', 'name': 'Video Game Publisher', 'description': ""A Video Game Publisher like 'Activision'""}, 'entity': {'id': '943877135894056966', 'name': 'Sega', 'description': 'Sega'}}, {'domain': {'id': '86', 'name': 'Movie', 'description': 'A film like Rogue One: A Star Wars Story'}, 'entity': {'id': '1123217054088097793', 'name': 'Sonic The Hedgehog', 'description': 'Release on February 14, 2019.\nRelease on March 27, 2020 (Japan)'}}, {'domain': {'id': '87', 'name': 'Movie Genre', 'description': 'A movie genre like Action'}, 'entity': {'id': '856976360337661952', 'name': 'Action & adventure films', 'description': 'Action and adventure'}}, {'domain': {'id': '130', 'name': 'Multimedia Franchise', 'description': ""Franchises which span multiple forms of media like 'Harry Potter'""}, 'entity': {'id': '993952643209773057', 'name': 'Sonic the Hedgehog', 'description': 'This entity includes all conversation about the franchise, as well as any individual installments in the series, if applicable.\t\t\t\n\nNOTE: Stopped annotating in the Video Game domain (71) on 11/15/19. Moving forward, this entity will annotate to Multimedia Franchise domain (130) only.'}}]","{'annotations': [{'start': 26, 'end': 29, 'probability': 0.5136, 'type': 'Organization', 'normalized_text': 'SEGA'}, {'start': 165, 'end': 175, 'probability': 0.5291, 'type': 'Other', 'normalized_text': 'Sonic Mania'}, {'start': 192, 'end': 196, 'probability': 0.5403, 'type': 'Other', 'normalized_text': 'Sonic'}, {'start': 237, 'end': 245, 'probability': 0.4901, 'type': 'Product', 'normalized_text': 'Sonic DLC'}, {'start': 251, 'end': 259, 'probability': 0.707, 'type': 'Product', 'normalized_text': 'Minecraft'}], 'urls': [{'start': 278, 'end': 301, 'url': 'https://t.co/LbRojcoDtR', 'expanded_url': 'https://twitter.com/gamefamstudios/status/1514280013201297408', 'display_url': 'twitter.com/gamefamstudios…'}]}",,False,,everyone,Twitter Web App
