tweetid,author_id,text,created_at,geo,retweets,replies,likes,quote_count,lang,conversation_id,context_annotations,entities,attachments,possibly_sensitive,withheld,reply_settings,source
1515589256663781380,3811611622,quick prototype for a dig game. https://t.co/ugDwwiQEfI,2022-04-17 07:13:31+00:00,,5,7,173,0,en,1515589256663781380,[],"{'urls': [{'start': 32, 'end': 55, 'url': 'https://t.co/ugDwwiQEfI', 'expanded_url': 'https://twitter.com/Onogork/status/1515589256663781380/video/1', 'display_url': 'pic.twitter.com/ugDwwiQEfI', 'media_key': '7_1515589228213817346'}]}",{'media_keys': ['7_1515589228213817346']},False,,everyone,Twitter Web App
1515659356620181510,1014977026569142273,"Sobre a criança lá ganhar um Xbox invés do PlayStation. Aquela postagem é o suco da podridão, eu odeio fanboy, mas não dá mano pra mim Sonysta é o pior de todos.

""Ain num vai joga o Daleste 2 e os exclusivo"".

Cara é uma criança, ele vai querer jogar Fortnite, Minecraft etc...",2022-04-17 11:52:04+00:00,,41,80,963,18,pt,1515659356620181510,"[{'domain': {'id': '45', 'name': 'Brand Vertical', 'description': 'Top level entities that describe a Brands industry'}, 'entity': {'id': '781974597310615553', 'name': 'Entertainment'}}, {'domain': {'id': '46', 'name': 'Brand Category', 'description': 'Categories within Brand Verticals that narrow down the scope of Brands'}, 'entity': {'id': '781974597218340864', 'name': 'Video Games'}}, {'domain': {'id': '30', 'name': 'Entities [Entity Service]', 'description': 'Entity Service top level domain, every item that is in Entity Service should be in this domain'}, 'entity': {'id': '825047692124442624', 'name': 'Food', 'description': 'Food'}}, {'domain': {'id': '65', 'name': 'Interests and Hobbies Vertical', 'description': 'Top level interests and hobbies groupings, like Food or Travel'}, 'entity': {'id': '834828264786898945', 'name': 'Drinks', 'description': 'Drinks'}}, {'domain': {'id': '66', 'name': 'Interests and Hobbies Category', 'description': 'A grouping of interests and hobbies entities, like Novelty Food or Destinations'}, 'entity': {'id': '834828445238431744', 'name': 'Generic Drinks', 'description': 'Generic Drinks'}}, {'domain': {'id': '67', 'name': 'Interests and Hobbies', 'description': 'Interests, opinions, and behaviors of individuals, groups, or cultures; like Speciality Cooking or Theme Parks'}, 'entity': {'id': '850147694358036480', 'name': 'Juice', 'description': 'Juice'}}, {'domain': {'id': '71', 'name': 'Video Game', 'description': 'A video game like Overwatch'}, 'entity': {'id': '10043689888', 'name': 'Minecraft'}}, {'domain': {'id': '71', 'name': 'Video Game', 'description': 'A video game like Overwatch'}, 'entity': {'id': '974285387987169280', 'name': 'Fortnite', 'description': 'This entity includes all conversation about the franchise, as well as any individual installments in the series, if applicable.\t\t\t'}}, {'domain': {'id': '173', 'name': 'Google Product Taxonomy', 'description': 'A product taxonomy created by Google'}, 'entity': {'id': '850147694358036480', 'name': 'Juice', 'description': 'Juice'}}, {'domain': {'id': '45', 'name': 'Brand Vertical', 'description': 'Top level entities that describe a Brands industry'}, 'entity': {'id': '781974597310615553', 'name': 'Entertainment'}}, {'domain': {'id': '46', 'name': 'Brand Category', 'description': 'Categories within Brand Verticals that narrow down the scope of Brands'}, 'entity': {'id': '781974597218340864', 'name': 'Video Games'}}, {'domain': {'id': '47', 'name': 'Brand', 'description': 'Brands and Companies'}, 'entity': {'id': '10027048851', 'name': 'Xbox'}}, {'domain': {'id': '47', 'name': 'Brand', 'description': 'Brands and Companies'}, 'entity': {'id': '10027048853', 'name': 'PlayStation'}}, {'domain': {'id': '79', 'name': 'Video Game Hardware', 'description': 'Video Game Hardware'}, 'entity': {'id': '10027048851', 'name': 'Xbox'}}, {'domain': {'id': '79', 'name': 'Video Game Hardware', 'description': 'Video Game Hardware'}, 'entity': {'id': '10027048853', 'name': 'PlayStation'}}]","{'annotations': [{'start': 29, 'end': 32, 'probability': 0.8004, 'type': 'Product', 'normalized_text': 'Xbox'}, {'start': 43, 'end': 53, 'probability': 0.601, 'type': 'Product', 'normalized_text': 'PlayStation'}]}",,False,,everyone,Twitter for Android
1514637256438464516,2233792838,Easter event anyone? 🥚🐰,2022-04-14 16:10:37+00:00,,1228,8092,16256,125,en,1514637256438464516,"[{'domain': {'id': '29', 'name': 'Events [Entity Service]', 'description': 'Entity Service related Events domain'}, 'entity': {'id': '1372917575357591554', 'name': 'Easter', 'description': 'this entity for all conversations for Easter all year '}}, {'domain': {'id': '119', 'name': 'Holiday', 'description': 'Holidays like Christmas or Halloween'}, 'entity': {'id': '1372917575357591554', 'name': 'Easter', 'description': 'this entity for all conversations for Easter all year '}}]",,,False,,everyone,Twitter Web App
1515693009169698817,1157520371299434497,@ilheesg takut la kalau dia jadi killer mcm mana,2022-04-17 14:05:48+00:00,,0,2,0,0,in,1515686844545265669,[],"{'mentions': [{'start': 0, 'end': 8, 'username': 'ilheesg', 'id': '1476950230608191489'}]}",,False,,everyone,Twitter for Android
1515601325962133508,1441683833934385165,"♡Adopt me giveaway!♡

Giving away a neon kangaroo if I hit 850 subs in 2 weeks.

Rules:
~Follow me, like this post, Retweet
~Sub to my YT with notifications &amp; stay active

https://t.co/xlPsMhkJ53
 
Goodluck!

#adoptme #roblox #gaming #robloxgiveaway #adoptmegiveaway #Giveway https://t.co/nP3c33XI8a",2022-04-17 08:01:29+00:00,,57,43,63,1,en,1515601325962133508,"[{'domain': {'id': '71', 'name': 'Video Game', 'description': 'A video game like Overwatch'}, 'entity': {'id': '1088118927580774400', 'name': 'Roblox', 'description': 'Roblox'}}, {'domain': {'id': '71', 'name': 'Video Game', 'description': 'A video game like Overwatch'}, 'entity': {'id': '1229416301245763584', 'name': 'Adopt Me'}}]","{'hashtags': [{'start': 213, 'end': 221, 'tag': 'adoptme'}, {'start': 222, 'end': 229, 'tag': 'roblox'}, {'start': 230, 'end': 237, 'tag': 'gaming'}, {'start': 238, 'end': 253, 'tag': 'robloxgiveaway'}, {'start': 254, 'end': 270, 'tag': 'adoptmegiveaway'}, {'start': 271, 'end': 279, 'tag': 'Giveway'}], 'urls': [{'start': 176, 'end': 199, 'url': 'https://t.co/xlPsMhkJ53', 'expanded_url': 'http://youtube.com/c/JazzyPlays', 'display_url': 'youtube.com/c/JazzyPlays', 'images': [{'url': 'https://pbs.twimg.com/news_img/1538058937672822785/sJ-aZnWE?format=jpg&name=orig', 'width': 900, 'height': 900}, {'url': 'https://pbs.twimg.com/news_img/1538058937672822785/sJ-aZnWE?format=jpg&name=150x150', 'width': 150, 'height': 150}], 'status': 200, 'title': 'Jazzy Plays', 'description': '✎ Hi! I\'m Jazzy! 😎😜💖 ╰┈➤ Welcome to my channel! 🌈🎮 ╰┈➤ I mostly do adopt me content, host giveaways on my channel and more! Also, I post once every week! ╰┈➤ Want to check out some Roblox edits made, check out my other channel, awhxjazz!🌹 ╰┈➤ My post schedule! ✨ ╰┈➤ Every Tuesday at 6pm (Time zone: GMT +8) 😇 *ੈ✩‧₊˚ For editing, I use Capcut, Inshot and KineMaster! :))) ੈ✩‧₊˚ ꒰🤗꒱ My roblox username: JKlovescubing 😇 ꒰🙃꒱ My roblox group: Jazzy Plays Squad ✨✨ ✧˚ · . Follow me on roblox because my joins are on and you can join me in game! UwU ༉‧₊˚. Always know that you are YOURSELF and you and WONDERFUL in YOUR OWN WAY! 🍡 Stay positive! 💟 ""Act as if what you\'re doing makes a difference. It does."" ~Willam James ""You are never too old to set another goal or to dream a new dream."" ~C.S. Lewis “The whole secret of a successful life is to find out what is one’s destiny to do, and then do it.” ~Henry Ford Hope you will have a wonderful day ahead! Don’t forgot to subscribe! ✨🌈', 'unwound_url': 'https://www.youtube.com/c/JazzyPlays'}, {'start': 280, 'end': 303, 'url': 'https://t.co/nP3c33XI8a', 'expanded_url': 'https://twitter.com/_jazzy_roblox_/status/1515601325962133508/photo/1', 'display_url': 'pic.twitter.com/nP3c33XI8a', 'media_key': '3_1515600049266331649'}]}",{'media_keys': ['3_1515600049266331649']},False,,everyone,Twitter Web App
1515693932554100736,2427302047,"Overigens vind ik dat persoonlijk niet erg. Het is mijn eigen streven om het merendeel van mijn columns te laten gaan over dingen die veel meer aandacht verdienen.

Anders zou ik steeds weer schrijven over de waan van de dag. (af en toe moet dat ook, anders vergeten jullie me)",2022-04-17 14:09:28+00:00,,0,1,0,0,nl,1515693112467009541,[],,,False,,everyone,Twitter for Android
1515552443177877512,830259782447665152,Sonic Speed Simulator #SonicRoblox https://t.co/X7UivRL7Wa,2022-04-17 04:47:14+00:00,,304,12,3413,7,en,1515552443177877512,[],"{'hashtags': [{'start': 22, 'end': 34, 'tag': 'SonicRoblox'}], 'annotations': [{'start': 0, 'end': 20, 'probability': 0.6736, 'type': 'Product', 'normalized_text': 'Sonic Speed Simulator'}], 'urls': [{'start': 35, 'end': 58, 'url': 'https://t.co/X7UivRL7Wa', 'expanded_url': 'https://twitter.com/LixesPrototype/status/1515552443177877512/photo/1', 'display_url': 'pic.twitter.com/X7UivRL7Wa', 'media_key': '3_1515551694028955651'}]}",{'media_keys': ['3_1515551694028955651']},False,,everyone,Twitter Web App
1515693559738818563,1448971074712997889,"#roblox This group just stole practically all of my robux, They managed to make a purchase on my account, And my external authenticator app is somehow disabled, Everyone else in the group has experienced the same thing. (part 1) https://t.co/Ht5rG3JTgi",2022-04-17 14:07:59+00:00,,0,2,1,0,en,1515693559738818563,"[{'domain': {'id': '71', 'name': 'Video Game', 'description': 'A video game like Overwatch'}, 'entity': {'id': '1088118927580774400', 'name': 'Roblox', 'description': 'Roblox'}}]","{'hashtags': [{'start': 0, 'end': 7, 'tag': 'roblox'}], 'urls': [{'start': 229, 'end': 252, 'url': 'https://t.co/Ht5rG3JTgi', 'expanded_url': 'https://twitter.com/JensenTheGreen1/status/1515693559738818563/photo/1', 'display_url': 'pic.twitter.com/Ht5rG3JTgi', 'media_key': '3_1515693520069091331'}]}",{'media_keys': ['3_1515693520069091331']},False,,everyone,Twitter Web App
1511818497969598480,1339674571935510528,"@MapleSyrupPls @Catabonk @Roblox @hamulgg same im atheist i like christmas and easter bc of presents, food, choclate eggs, and the awesome awesome roblox egg hunt",2022-04-06 21:29:52+00:00,,0,2,1,0,en,1511408448977575940,"[{'domain': {'id': '29', 'name': 'Events [Entity Service]', 'description': 'Entity Service related Events domain'}, 'entity': {'id': '1372917575357591554', 'name': 'Easter', 'description': 'this entity for all conversations for Easter all year '}}, {'domain': {'id': '71', 'name': 'Video Game', 'description': 'A video game like Overwatch'}, 'entity': {'id': '1088118927580774400', 'name': 'Roblox', 'description': 'Roblox'}}, {'domain': {'id': '119', 'name': 'Holiday', 'description': 'Holidays like Christmas or Halloween'}, 'entity': {'id': '1372917575357591554', 'name': 'Easter', 'description': 'this entity for all conversations for Easter all year '}}]","{'mentions': [{'start': 0, 'end': 14, 'username': 'MapleSyrupPls', 'id': '1451043075233443847'}, {'start': 15, 'end': 24, 'username': 'Catabonk', 'id': '1463651946959716353'}, {'start': 25, 'end': 32, 'username': 'Roblox', 'id': '16745055'}, {'start': 33, 'end': 41, 'username': 'hamulgg', 'id': '1179964847754117121'}], 'annotations': [{'start': 65, 'end': 73, 'probability': 0.9384, 'type': 'Other', 'normalized_text': 'christmas'}]}",,False,,everyone,Twitter Web App
1515475555717627909,1299062340609101826,nunca creí que mi primera vez en roblox sería jugando en un servidor oficial de sonic xd https://t.co/IfCBmUvigR,2022-04-16 23:41:43+00:00,,0,2,3,0,es,1515475555717627909,"[{'domain': {'id': '71', 'name': 'Video Game', 'description': 'A video game like Overwatch'}, 'entity': {'id': '1088118927580774400', 'name': 'Roblox', 'description': 'Roblox'}}]","{'annotations': [{'start': 33, 'end': 38, 'probability': 0.3731, 'type': 'Product', 'normalized_text': 'roblox'}], 'urls': [{'start': 89, 'end': 112, 'url': 'https://t.co/IfCBmUvigR', 'expanded_url': 'https://twitter.com/AzureBoy2nd/status/1515475555717627909/photo/1', 'display_url': 'pic.twitter.com/IfCBmUvigR', 'media_key': '3_1515475139894427649'}, {'start': 89, 'end': 112, 'url': 'https://t.co/IfCBmUvigR', 'expanded_url': 'https://twitter.com/AzureBoy2nd/status/1515475555717627909/photo/1', 'display_url': 'pic.twitter.com/IfCBmUvigR', 'media_key': '3_1515475162728222724'}, {'start': 89, 'end': 112, 'url': 'https://t.co/IfCBmUvigR', 'expanded_url': 'https://twitter.com/AzureBoy2nd/status/1515475555717627909/photo/1', 'display_url': 'pic.twitter.com/IfCBmUvigR', 'media_key': '3_1515475194160324615'}]}","{'media_keys': ['3_1515475139894427649', '3_1515475162728222724', '3_1515475194160324615']}",False,,everyone,Twitter Web App
1515389850987466755,769228033299472384,Kim Kardashian chora após filho ver anúncio de sua sextape no jogo Roblox - https://t.co/g2AmMi1Tau https://t.co/p9umGfRLp8,2022-04-16 18:01:09+00:00,,332,203,14326,794,pt,1515389850987466755,"[{'domain': {'id': '10', 'name': 'Person', 'description': 'Named people in the world like Nelson Mandela'}, 'entity': {'id': '806570121959383040', 'name': 'Kim Kardashian', 'description': 'Kim Kardashian'}}, {'domain': {'id': '58', 'name': 'Entertainment Personality', 'description': 'An entertainment personality in the world, like Anderson Cooper or Miranda Sings'}, 'entity': {'id': '806570121959383040', 'name': 'Kim Kardashian', 'description': 'Kim Kardashian'}}, {'domain': {'id': '71', 'name': 'Video Game', 'description': 'A video game like Overwatch'}, 'entity': {'id': '1088118927580774400', 'name': 'Roblox', 'description': 'Roblox'}}]","{'annotations': [{'start': 0, 'end': 13, 'probability': 0.9667, 'type': 'Person', 'normalized_text': 'Kim Kardashian'}], 'urls': [{'start': 76, 'end': 99, 'url': 'https://t.co/g2AmMi1Tau', 'expanded_url': 'https://portalrapmais.com/kim-kardashian-chora-apos-filho-ver-anuncio-de-sua-sextape-no-jogo-roblox/', 'display_url': 'portalrapmais.com/kim-kardashian…'}, {'start': 100, 'end': 123, 'url': 'https://t.co/p9umGfRLp8', 'expanded_url': 'https://twitter.com/RapMais/status/1515389850987466755/photo/1', 'display_url': 'pic.twitter.com/p9umGfRLp8', 'media_key': '3_1515389849116815367'}]}",{'media_keys': ['3_1515389849116815367']},False,,everyone,PortalRapmais
1515693182469742593,1383478991709900804,"So how's everyone doing today?

Just chillin' and that's it. What about you?

Already enjoying my twitter anniversary day here.",2022-04-17 14:06:29+00:00,,0,3,6,0,en,1515693182469742593,"[{'domain': {'id': '46', 'name': 'Brand Category', 'description': 'Categories within Brand Verticals that narrow down the scope of Brands'}, 'entity': {'id': '781974596752842752', 'name': 'Services'}}, {'domain': {'id': '47', 'name': 'Brand', 'description': 'Brands and Companies'}, 'entity': {'id': '10045225402', 'name': 'Twitter'}}]","{'annotations': [{'start': 98, 'end': 104, 'probability': 0.7414, 'type': 'Product', 'normalized_text': 'twitter'}]}",,False,,everyone,Twitter for Android
1515422723043848193,952306545752129536,@iamdeat543alt @robloxpredicts_ @sonic_hedgehog @Roblox you said that I got ratio'd by 2 likes when I got ratio'd by 8 when you posted that,2022-04-16 20:11:47+00:00,,0,1,0,0,en,1515011598812794883,[],"{'mentions': [{'start': 0, 'end': 14, 'username': 'iamdeat543alt', 'id': '1480994592690475012'}, {'start': 15, 'end': 31, 'username': 'robloxpredicts_', 'id': '1394996915750768640'}, {'start': 32, 'end': 47, 'username': 'sonic_hedgehog', 'id': '19609162'}, {'start': 48, 'end': 55, 'username': 'Roblox', 'id': '16745055'}]}",,False,,everyone,Twitter Web App
1515303137015648257,1392445448946810881,yeah gonna draw him too https://t.co/uJza6TaJol,2022-04-16 12:16:35+00:00,,93,9,1933,2,en,1515303137015648257,[],"{'urls': [{'start': 24, 'end': 47, 'url': 'https://t.co/uJza6TaJol', 'expanded_url': 'https://twitter.com/_dadsado/status/1515303137015648257/photo/1', 'display_url': 'pic.twitter.com/uJza6TaJol', 'media_key': '3_1515303122016813061'}]}",{'media_keys': ['3_1515303122016813061']},False,,everyone,Twitter Web App
1515485602245857283,1241044363519590413,@badimo @Roblox jumped on the meteor i never got  spoiler 🤬🤬,2022-04-17 00:21:38+00:00,,0,2,4,0,en,1515484755956940803,"[{'domain': {'id': '30', 'name': 'Entities [Entity Service]', 'description': 'Entity Service top level domain, every item that is in Entity Service should be in this domain'}, 'entity': {'id': '854692455005921281', 'name': 'Science', 'description': 'Science'}}, {'domain': {'id': '71', 'name': 'Video Game', 'description': 'A video game like Overwatch'}, 'entity': {'id': '1088118927580774400', 'name': 'Roblox', 'description': 'Roblox'}}, {'domain': {'id': '164', 'name': 'Fields of study', 'description': 'for all fields of study, e.g., futurology, microbiology '}, 'entity': {'id': '854692455005921281', 'name': 'Science', 'description': 'Science'}}]","{'mentions': [{'start': 0, 'end': 7, 'username': 'badimo', 'id': '858065622097436672'}, {'start': 8, 'end': 15, 'username': 'Roblox', 'id': '16745055'}]}",,False,,everyone,Twitter for iPhone
