tweetid,author_id,text,created_at,geo,retweets,replies,likes,quote_count,lang,conversation_id,context_annotations,entities,attachments,possibly_sensitive,withheld,reply_settings,source
1507708846856413184,1056053249470541824,"Roblox now filters the phrase ""R63"" 

Basically, users would bypass NSFW models onto the Creator Marketplace by placing it within a block. And they commonly used the phrase ""R63"" so users could more easily find them on the platform. 

( Basically, the Roblox alternative to r34. ) https://t.co/Jj8z8p1WY3",2022-03-26 13:19:35+00:00,,57,151,1058,16,en,1507708846856413184,"[{'domain': {'id': '71', 'name': 'Video Game', 'description': 'A video game like Overwatch'}, 'entity': {'id': '1088118927580774400', 'name': 'Roblox', 'description': 'Roblox'}}]","{'urls': [{'start': 281, 'end': 304, 'url': 'https://t.co/Jj8z8p1WY3', 'expanded_url': 'https://twitter.com/Roblox_RTC/status/1507708846856413184/photo/1', 'display_url': 'pic.twitter.com/Jj8z8p1WY3', 'media_key': '3_1507708843622547463'}]}",{'media_keys': ['3_1507708843622547463']},False,,everyone,Twitter for iPhone
1522247816277635073,4902746915,HAHAHAHAHAHHHA SONIC FROTNIERS SONIC FRONTIERS SONIC FRONTIERS SUMMER GAMES FEST 🥳🥳🥳🥳🥳🥳🥳🥳🥳🥳🥳🥳🥳🥳🥳🥳🥳🥳🥳🥳🥳 EU TO MALUCOOOO,2022-05-05 16:12:16+00:00,,10,19,188,0,en,1522247816277635073,"[{'domain': {'id': '130', 'name': 'Multimedia Franchise', 'description': ""Franchises which span multiple forms of media like 'Harry Potter'""}, 'entity': {'id': '993952643209773057', 'name': 'Sonic the Hedgehog', 'description': 'This entity includes all conversation about the franchise, as well as any individual installments in the series, if applicable.\t\t\t\n\nNOTE: Stopped annotating in the Video Game domain (71) on 11/15/19. Moving forward, this entity will annotate to Multimedia Franchise domain (130) only.'}}]","{'annotations': [{'start': 15, 'end': 79, 'probability': 0.357, 'type': 'Other', 'normalized_text': 'SONIC FROTNIERS SONIC FRONTIERS SONIC FRONTIERS SUMMER GAMES FEST'}]}",,False,,everyone,Twitter for Android
1522247915196108802,1519682456257015808,"@OhSySaikou approximately 30 minutes ago, I like switching avatars from time to time.",2022-05-05 16:12:39+00:00,,0,1,1,0,en,1522246120050954240,[],"{'mentions': [{'start': 0, 'end': 11, 'username': 'OhSySaikou', 'id': '1246128556993724416'}]}",,False,,everyone,Twitter Web App
1521979715300597760,17230018,"@Roblox @soundtrap @discord ICYMI 👉 we’ve got your vacation playlist covered with tracks from @miyaohyeah, @Stray_Kids and more 🎶🏝️ #SpotifyIsland https://t.co/ngvAlfF5MO https://t.co/lJzoZKWPSN",2022-05-04 22:26:55+00:00,,31,21,304,2,en,1521449221261602817,"[{'domain': {'id': '10', 'name': 'Person', 'description': 'Named people in the world like Nelson Mandela'}, 'entity': {'id': '1062427352318173185', 'name': 'Stray Kids', 'description': 'Stray Kids (스트레이 키즈)'}}, {'domain': {'id': '45', 'name': 'Brand Vertical', 'description': 'Top level entities that describe a Brands industry'}, 'entity': {'id': '781974597310615553', 'name': 'Entertainment'}}, {'domain': {'id': '46', 'name': 'Brand Category', 'description': 'Categories within Brand Verticals that narrow down the scope of Brands'}, 'entity': {'id': '781974597222535168', 'name': 'Online Services'}}, {'domain': {'id': '47', 'name': 'Brand', 'description': 'Brands and Companies'}, 'entity': {'id': '10040276669', 'name': 'Spotify'}}, {'domain': {'id': '47', 'name': 'Brand', 'description': 'Brands and Companies'}, 'entity': {'id': '1168499224297656321', 'name': 'Discord'}}, {'domain': {'id': '54', 'name': 'Musician', 'description': 'A musician in the world, like Adele or Bob Dylan'}, 'entity': {'id': '1062427352318173185', 'name': 'Stray Kids', 'description': 'Stray Kids (스트레이 키즈)'}}, {'domain': {'id': '55', 'name': 'Music Genre', 'description': 'A category for a musical style, like Pop, Rock, or Rap'}, 'entity': {'id': '888105153038958593', 'name': 'K-pop', 'description': 'K-Pop'}}, {'domain': {'id': '67', 'name': 'Interests and Hobbies', 'description': 'Interests, opinions, and behaviors of individuals, groups, or cultures; like Speciality Cooking or Theme Parks'}, 'entity': {'id': '1288826829634035714', 'name': 'Backstage'}}, {'domain': {'id': '71', 'name': 'Video Game', 'description': 'A video game like Overwatch'}, 'entity': {'id': '1088118927580774400', 'name': 'Roblox', 'description': 'Roblox'}}, {'domain': {'id': '165', 'name': 'Technology', 'description': 'for individual and types of technology, e.g., food technology, 3D printing'}, 'entity': {'id': '1196446161223028736', 'name': 'Social media'}}, {'domain': {'id': '30', 'name': 'Entities [Entity Service]', 'description': 'Entity Service top level domain, every item that is in Entity Service should be in this domain'}, 'entity': {'id': '839159814991167489', 'name': 'Travel', 'description': 'Travel'}}, {'domain': {'id': '66', 'name': 'Interests and Hobbies Category', 'description': 'A grouping of interests and hobbies entities, like Novelty Food or Destinations'}, 'entity': {'id': '839160129752686593', 'name': 'General Travel', 'description': 'General Travel'}}, {'domain': {'id': '67', 'name': 'Interests and Hobbies', 'description': 'Interests, opinions, and behaviors of individuals, groups, or cultures; like Speciality Cooking or Theme Parks'}, 'entity': {'id': '839161975712067584', 'name': 'Travel Actions', 'description': 'This entity includes all conversations about travel and vacation.'}}]","{'mentions': [{'start': 0, 'end': 7, 'username': 'Roblox', 'id': '16745055'}, {'start': 8, 'end': 18, 'username': 'soundtrap', 'id': '882321548'}, {'start': 19, 'end': 27, 'username': 'discord', 'id': '3065618342'}, {'start': 94, 'end': 105, 'username': 'miyaohyeah', 'id': '2347170860'}, {'start': 107, 'end': 118, 'username': 'Stray_Kids', 'id': '859297966581891072'}], 'hashtags': [{'start': 132, 'end': 146, 'tag': 'SpotifyIsland'}], 'urls': [{'start': 147, 'end': 170, 'url': 'https://t.co/ngvAlfF5MO', 'expanded_url': 'http://spotify.link/SpotifyIsland', 'display_url': 'spotify.link/SpotifyIsland', 'images': [{'url': 'https://pbs.twimg.com/news_img/1521979717414445057/0krNn3cR?format=jpg&name=orig', 'width': 640, 'height': 640}, {'url': 'https://pbs.twimg.com/news_img/1521979717414445057/0krNn3cR?format=jpg&name=150x150', 'width': 150, 'height': 150}], 'status': 200, 'title': 'Spotify Island on Roblox', 'description': 'Spotify · Playlist · 50 songs · 208 likes', 'unwound_url': 'http://spotify.link/SpotifyIsland'}, {'start': 171, 'end': 194, 'url': 'https://t.co/lJzoZKWPSN', 'expanded_url': 'https://twitter.com/Spotify/status/1521979715300597760/photo/1', 'display_url': 'pic.twitter.com/lJzoZKWPSN', 'media_key': '3_1521972151791800321'}]}",{'media_keys': ['3_1521972151791800321']},False,,everyone,Twitter Web App
1521992721178578944,901894986836279296,"In the past few months, John Vlassopulos (Head of Music), Terri Tiongson (Head Social Media Manager), and Rodrigo Velloso (Head of Influencer Marketing/Star Video Creators Program) have all voluntarily left their positions at @Roblox.",2022-05-04 23:18:36+00:00,,38,39,765,9,en,1521992721178578944,"[{'domain': {'id': '66', 'name': 'Interests and Hobbies Category', 'description': 'A grouping of interests and hobbies entities, like Novelty Food or Destinations'}, 'entity': {'id': '857879016971186177', 'name': 'Marketing', 'description': 'Marketing'}}, {'domain': {'id': '71', 'name': 'Video Game', 'description': 'A video game like Overwatch'}, 'entity': {'id': '1088118927580774400', 'name': 'Roblox', 'description': 'Roblox'}}, {'domain': {'id': '164', 'name': 'Fields of study', 'description': 'for all fields of study, e.g., futurology, microbiology '}, 'entity': {'id': '1278093262406815744', 'name': 'Fields of study'}}]","{'mentions': [{'start': 226, 'end': 233, 'username': 'Roblox', 'id': '16745055'}], 'annotations': [{'start': 24, 'end': 39, 'probability': 0.9856, 'type': 'Person', 'normalized_text': 'John Vlassopulos'}, {'start': 58, 'end': 71, 'probability': 0.9596, 'type': 'Person', 'normalized_text': 'Terri Tiongson'}, {'start': 106, 'end': 120, 'probability': 0.9491, 'type': 'Person', 'normalized_text': 'Rodrigo Velloso'}]}",,False,,everyone,Twitter Web App
1522229220356739072,1520260783522803713,"secret amount of #robux gw 
^ 10-35 Robux

• follow me w notifs
• like and rt
• rt w tags = hc
• stay active for more!

&gt; ends in 20+ entries/1-2 days ‼️",2022-05-05 14:58:22+00:00,,30,24,31,16,en,1522229220356739072,"[{'domain': {'id': '71', 'name': 'Video Game', 'description': 'A video game like Overwatch'}, 'entity': {'id': '1088118927580774400', 'name': 'Roblox', 'description': 'Roblox'}}]","{'hashtags': [{'start': 17, 'end': 23, 'tag': 'robux'}]}",,False,,everyone,Twitter for iPhone
1522247868735627268,1521883642515001344,@akiyuri15 HEY HI!!,2022-05-05 16:12:28+00:00,,0,1,0,0,en,1522247434721660929,[],"{'mentions': [{'start': 0, 'end': 10, 'username': 'akiyuri15', 'id': '1521516375545577472'}]}",,False,,everyone,Twitter for Android
1522247412802277399,1454121530900815876,"@LemonGummlBunny @LuminousEva Yeah I get that, they should at least give us something, anything at all for having us waste a lot of money on an item or even just clothing that we cannot use anymore.",2022-05-05 16:10:39+00:00,,0,1,0,0,en,1522006387701821442,[],"{'mentions': [{'start': 0, 'end': 16, 'username': 'LemonGummlBunny', 'id': '1224095152605663240'}, {'start': 17, 'end': 29, 'username': 'LuminousEva', 'id': '1347215370759892995'}]}",,False,,everyone,Twitter for iPhone
1521894335968653316,1132099522405044225,Omg roblox is shutting down https://t.co/nQYkHk923N,2022-05-04 16:47:39+00:00,,451,1963,7309,85,en,1521894335968653316,"[{'domain': {'id': '71', 'name': 'Video Game', 'description': 'A video game like Overwatch'}, 'entity': {'id': '1088118927580774400', 'name': 'Roblox', 'description': 'Roblox'}}]","{'urls': [{'start': 28, 'end': 51, 'url': 'https://t.co/nQYkHk923N', 'expanded_url': 'https://twitter.com/RobloxNoobifier/status/1521894335968653316/photo/1', 'display_url': 'pic.twitter.com/nQYkHk923N', 'media_key': '3_1521894330876805120'}]}",{'media_keys': ['3_1521894330876805120']},False,,everyone,Twitter for iPhone
1522247722283282432,1432262946307072003,"@LuminousEva Most girls are upset that roblox doing that! I saw 100 comments that the girls posted. I think that was a bad decision for roblox to delete the hand warmer, eyelashes and leg warmer...",2022-05-05 16:11:53+00:00,,0,1,9,0,en,1522006387701821442,"[{'domain': {'id': '71', 'name': 'Video Game', 'description': 'A video game like Overwatch'}, 'entity': {'id': '1088118927580774400', 'name': 'Roblox', 'description': 'Roblox'}}]","{'mentions': [{'start': 0, 'end': 12, 'username': 'LuminousEva', 'id': '1347215370759892995'}]}",,False,,everyone,Twitter for Android
1522209186788130817,1419079299131486212,@memeskillyou i used to have so much sex on roblox when I was 9,2022-05-05 13:38:46+00:00,,0,4,25,1,en,1522208797678260224,"[{'domain': {'id': '71', 'name': 'Video Game', 'description': 'A video game like Overwatch'}, 'entity': {'id': '1088118927580774400', 'name': 'Roblox', 'description': 'Roblox'}}]","{'mentions': [{'start': 0, 'end': 13, 'username': 'memeskillyou', 'id': '1393338583877095435'}], 'annotations': [{'start': 44, 'end': 49, 'probability': 0.4435, 'type': 'Product', 'normalized_text': 'roblox'}]}",,False,,everyone,Twitter for iPhone
1522242977074225152,714898408176295936,To the person who stole my name...I will find you https://t.co/tSh5oFYrIu,2022-05-05 15:53:02+00:00,,0,3,15,0,en,1522242977074225152,[],"{'urls': [{'start': 50, 'end': 73, 'url': 'https://t.co/tSh5oFYrIu', 'expanded_url': 'https://twitter.com/Nohshy_/status/1522242977074225152/photo/1', 'display_url': 'pic.twitter.com/tSh5oFYrIu', 'media_key': '3_1522242874028535808'}]}",{'media_keys': ['3_1522242874028535808']},False,,everyone,Twitter Web App
1522006387701821442,1347215370759892995,"OMG ROBLOX DELETED THE ARM AND LEG WARMERS 😭😭😭

#roblox #RTC https://t.co/sV6gsF6GMS",2022-05-05 00:12:54+00:00,,150,379,2180,62,en,1522006387701821442,"[{'domain': {'id': '71', 'name': 'Video Game', 'description': 'A video game like Overwatch'}, 'entity': {'id': '1088118927580774400', 'name': 'Roblox', 'description': 'Roblox'}}]","{'hashtags': [{'start': 48, 'end': 55, 'tag': 'roblox'}, {'start': 56, 'end': 60, 'tag': 'RTC'}], 'annotations': [{'start': 4, 'end': 9, 'probability': 0.3828, 'type': 'Product', 'normalized_text': 'ROBLOX'}], 'urls': [{'start': 61, 'end': 84, 'url': 'https://t.co/sV6gsF6GMS', 'expanded_url': 'https://twitter.com/LuminousEva/status/1522006387701821442/photo/1', 'display_url': 'pic.twitter.com/sV6gsF6GMS', 'media_key': '3_1522006381057957892'}, {'start': 61, 'end': 84, 'url': 'https://t.co/sV6gsF6GMS', 'expanded_url': 'https://twitter.com/LuminousEva/status/1522006387701821442/photo/1', 'display_url': 'pic.twitter.com/sV6gsF6GMS', 'media_key': '3_1522006381062152192'}, {'start': 61, 'end': 84, 'url': 'https://t.co/sV6gsF6GMS', 'expanded_url': 'https://twitter.com/LuminousEva/status/1522006387701821442/photo/1', 'display_url': 'pic.twitter.com/sV6gsF6GMS', 'media_key': '3_1522006381137694721'}]}","{'media_keys': ['3_1522006381057957892', '3_1522006381062152192', '3_1522006381137694721']}",False,,everyone,Twitter for iPad
1522247567546798080,988480057822900226,"@masonnystrom @TusharJain_ Great read @masonnystrom. Do you have an opinion on what does this mean for Sandbox and MANA. Will this lead to entry barrier for devs and lack of creativity and hence experiences in the platform, or the second possibility can be-",2022-05-05 16:11:16+00:00,,0,1,1,0,en,1521862426542714880,[],"{'mentions': [{'start': 0, 'end': 13, 'username': 'masonnystrom', 'id': '1279369220'}, {'start': 14, 'end': 26, 'username': 'TusharJain_', 'id': '1523751438'}, {'start': 38, 'end': 51, 'username': 'masonnystrom', 'id': '1279369220'}], 'annotations': [{'start': 103, 'end': 109, 'probability': 0.3281, 'type': 'Other', 'normalized_text': 'Sandbox'}]}",,False,,everyone,Twitter Web App
1522236966896488453,14989091,"Excited that @Roblox's intern matching has completed &amp; I can officially welcome @EGOTISMS_RBLX to the Developer Design Team for the summer!

I'm especially glad she came from the community 
&amp; brings yrs of experience designing UI on the platform.

Can't wait to see what she does!",2022-05-05 15:29:09+00:00,,1,14,117,0,en,1522236966896488453,"[{'domain': {'id': '71', 'name': 'Video Game', 'description': 'A video game like Overwatch'}, 'entity': {'id': '1088118927580774400', 'name': 'Roblox', 'description': 'Roblox'}}]","{'mentions': [{'start': 13, 'end': 20, 'username': 'Roblox', 'id': '16745055'}, {'start': 84, 'end': 98, 'username': 'EGOTISMS_RBLX', 'id': '848945786389966853'}]}",,False,,everyone,Twitter Web App
1522244982043684864,2915629133,"In support of Mental Health Awareness Month, Dear Evan Hansen is partnering with @BlueberryMeta / @BerryxBlueberry for the first-ever Broadway metaverse fashion drop! Evan’s iconic blue striped polo will be available on @Roblox from May 13th &amp; all proceeds benefit @ChildMindInst. https://t.co/znoOHV3OmR",2022-05-05 16:01:00+00:00,,22,56,84,96,en,1522244982043684864,"[{'domain': {'id': '46', 'name': 'Brand Category', 'description': 'Categories within Brand Verticals that narrow down the scope of Brands'}, 'entity': {'id': '781974596148793347', 'name': 'Venue/Theatre'}}, {'domain': {'id': '47', 'name': 'Brand', 'description': 'Brands and Companies'}, 'entity': {'id': '1277671069185261569', 'name': 'Broadway'}}, {'domain': {'id': '30', 'name': 'Entities [Entity Service]', 'description': 'Entity Service top level domain, every item that is in Entity Service should be in this domain'}, 'entity': {'id': '848920371311001600', 'name': 'Technology', 'description': 'Technology and computing'}}, {'domain': {'id': '71', 'name': 'Video Game', 'description': 'A video game like Overwatch'}, 'entity': {'id': '1088118927580774400', 'name': 'Roblox', 'description': 'Roblox'}}, {'domain': {'id': '109', 'name': 'Reoccurring Trends', 'description': 'Twitter generated Trends that occur on a daily, weekly, monthly, or yearly basis'}, 'entity': {'id': '1521265495537643521', 'name': 'Mental Health Awareness Month'}}, {'domain': {'id': '165', 'name': 'Technology', 'description': 'for individual and types of technology, e.g., food technology, 3D printing'}, 'entity': {'id': '848920371311001600', 'name': 'Technology', 'description': 'Technology and computing'}}]","{'mentions': [{'start': 81, 'end': 95, 'username': 'BlueberryMeta', 'id': '1461361471640592398'}, {'start': 98, 'end': 114, 'username': 'BerryxBlueberry', 'id': '1514662190879592457'}, {'start': 220, 'end': 227, 'username': 'Roblox', 'id': '16745055'}, {'start': 269, 'end': 283, 'username': 'childmindinst', 'id': '233609943'}], 'annotations': [{'start': 14, 'end': 42, 'probability': 0.8398, 'type': 'Other', 'normalized_text': 'Mental Health Awareness Month'}, {'start': 50, 'end': 60, 'probability': 0.9695, 'type': 'Person', 'normalized_text': 'Evan Hansen'}, {'start': 167, 'end': 170, 'probability': 0.5977, 'type': 'Person', 'normalized_text': 'Evan'}], 'urls': [{'start': 285, 'end': 308, 'url': 'https://t.co/znoOHV3OmR', 'expanded_url': 'https://twitter.com/DearEvanHansen/status/1522244982043684864/video/1', 'display_url': 'pic.twitter.com/znoOHV3OmR', 'media_key': '7_1522239103483449345'}]}",{'media_keys': ['7_1522239103483449345']},False,,everyone,Twitter Web App
1522247407559495680,1266085094827208704,@joons_shop t’aime pas ?,2022-05-05 16:10:38+00:00,,0,1,0,0,fr,1522247127874813952,[],"{'mentions': [{'start': 0, 'end': 11, 'username': 'joons_shop', 'id': '2405177923'}]}",,False,,everyone,Twitter for iPhone
1513150135664091140,1056053249470541824,"@LinusTech has said that ROBLOX is a Scam based off exploiting young developers in his latest video 😳

Many Roblox Devs &amp; fans are MAD at this, saying the video that inspired (People Make Games) has some invalid points, &amp; Linus is wrong. Others say Linus is correct. https://t.co/IZTe5OCF9r",2022-04-10 13:41:19+00:00,,165,339,2112,101,en,1513150135664091140,"[{'domain': {'id': '10', 'name': 'Person', 'description': 'Named people in the world like Nelson Mandela'}, 'entity': {'id': '1436352927157784576', 'name': 'Linus Tech', 'description': 'Youtube Channel.'}}, {'domain': {'id': '71', 'name': 'Video Game', 'description': 'A video game like Overwatch'}, 'entity': {'id': '1088118927580774400', 'name': 'Roblox', 'description': 'Roblox'}}, {'domain': {'id': '120', 'name': 'Digital Creator', 'description': 'Influencers who create content on digital platforms'}, 'entity': {'id': '1436352927157784576', 'name': 'Linus Tech', 'description': 'Youtube Channel.'}}]","{'mentions': [{'start': 0, 'end': 10, 'username': 'LinusTech', 'id': '403614288'}], 'annotations': [{'start': 25, 'end': 30, 'probability': 0.4621, 'type': 'Organization', 'normalized_text': 'ROBLOX'}, {'start': 250, 'end': 254, 'probability': 0.6474, 'type': 'Person', 'normalized_text': 'Linus'}], 'urls': [{'start': 275, 'end': 298, 'url': 'https://t.co/IZTe5OCF9r', 'expanded_url': 'https://twitter.com/Roblox_RTC/status/1513150135664091140/video/1', 'display_url': 'pic.twitter.com/IZTe5OCF9r', 'media_key': '7_1513150096791252992'}]}",{'media_keys': ['7_1513150096791252992']},False,,everyone,Twitter for iPhone
1522224748427722753,1056053249470541824,"Babybel, the cheese company, has wheeled its way on over to Roblox in Babybel land - It's up to you to fight the corruption with the help of all the Babybel heroes. Is this game “cheesed?” or is it delicious to play? 

🔗 https://t.co/oxsCcZeJHo https://t.co/8qI99oj6Dt",2022-05-05 14:40:36+00:00,,57,202,1076,69,en,1522224748427722753,"[{'domain': {'id': '45', 'name': 'Brand Vertical', 'description': 'Top level entities that describe a Brands industry'}, 'entity': {'id': '781974596740190208', 'name': 'CPG'}}, {'domain': {'id': '46', 'name': 'Brand Category', 'description': 'Categories within Brand Verticals that narrow down the scope of Brands'}, 'entity': {'id': '781974596144599042', 'name': 'Snacks'}}, {'domain': {'id': '47', 'name': 'Brand', 'description': 'Brands and Companies'}, 'entity': {'id': '10040931677', 'name': 'Babybel'}}, {'domain': {'id': '30', 'name': 'Entities [Entity Service]', 'description': 'Entity Service top level domain, every item that is in Entity Service should be in this domain'}, 'entity': {'id': '825047692124442624', 'name': 'Food', 'description': 'Food'}}, {'domain': {'id': '71', 'name': 'Video Game', 'description': 'A video game like Overwatch'}, 'entity': {'id': '1088118927580774400', 'name': 'Roblox', 'description': 'Roblox'}}, {'domain': {'id': '45', 'name': 'Brand Vertical', 'description': 'Top level entities that describe a Brands industry'}, 'entity': {'id': '781974596740190208', 'name': 'CPG'}}, {'domain': {'id': '46', 'name': 'Brand Category', 'description': 'Categories within Brand Verticals that narrow down the scope of Brands'}, 'entity': {'id': '781974596144599042', 'name': 'Snacks'}}, {'domain': {'id': '47', 'name': 'Brand', 'description': 'Brands and Companies'}, 'entity': {'id': '10040931677', 'name': 'Babybel'}}]","{'annotations': [{'start': 60, 'end': 65, 'probability': 0.3656, 'type': 'Organization', 'normalized_text': 'Roblox'}], 'urls': [{'start': 221, 'end': 244, 'url': 'https://t.co/oxsCcZeJHo', 'expanded_url': 'https://www.roblox.com/games/8257155505/Babybel-Land', 'display_url': 'roblox.com/games/82571555…', 'images': [{'url': 'https://pbs.twimg.com/news_img/1522215071610404867/lUwm2eiB?format=jpg&name=orig', 'width': 498, 'height': 280}, {'url': 'https://pbs.twimg.com/news_img/1522215071610404867/lUwm2eiB?format=jpg&name=150x150', 'width': 150, 'height': 150}], 'status': 200, 'title': 'Babybel Land', 'description': ""Check out Babybel Land. It’s one of the millions of unique, user-generated 3D experiences created on Roblox. Welcome to Babybel Land, a brand new world to explore 😎 To play this simulator game you should be at least 13 years old or with parents supervision You are about to set foot in the home of all Babybel heroes: the true Land of Goodness. A place where what is good is the rule: a world of harmony, surrounded by waterfalls of milk, peaceful forests and beautiful mountains... But a curse threatens this harmony! It's up to you to fight the corruption with the help of all the Babybel heroes. • 🤠 Explore the different kingdoms of Babybel Land and improve your characters for the next adventure. • 💪 Fight the curse that corrupts nature and brings goodness back to Babybel Land. • 🌵The desert of cereals, the jungle of fruits... Other worlds will be revealed soon to complete your collection • Many more surprises will be added, so check back regularly in this simulator game!"", 'unwound_url': 'https://www.roblox.com/games/8257155505/Babybel-Land'}, {'start': 245, 'end': 268, 'url': 'https://t.co/8qI99oj6Dt', 'expanded_url': 'https://twitter.com/Roblox_RTC/status/1522224748427722753/photo/1', 'display_url': 'pic.twitter.com/8qI99oj6Dt', 'media_key': '3_1522224745441333250'}]}",{'media_keys': ['3_1522224745441333250']},False,,everyone,Twitter for iPhone
1521941818413395969,1273016858812264453,"When did you join the Roblox Twitter Community? 

Me: June 2020",2022-05-04 19:56:20+00:00,,8,197,254,4,en,1521941818413395969,"[{'domain': {'id': '71', 'name': 'Video Game', 'description': 'A video game like Overwatch'}, 'entity': {'id': '1088118927580774400', 'name': 'Roblox', 'description': 'Roblox'}}, {'domain': {'id': '46', 'name': 'Brand Category', 'description': 'Categories within Brand Verticals that narrow down the scope of Brands'}, 'entity': {'id': '781974596752842752', 'name': 'Services'}}, {'domain': {'id': '47', 'name': 'Brand', 'description': 'Brands and Companies'}, 'entity': {'id': '10045225402', 'name': 'Twitter'}}]","{'annotations': [{'start': 22, 'end': 27, 'probability': 0.4038, 'type': 'Product', 'normalized_text': 'Roblox'}, {'start': 29, 'end': 35, 'probability': 0.5241, 'type': 'Product', 'normalized_text': 'Twitter'}]}",,False,,everyone,Twitter for iPhone
1522246973524377600,1364805561158574086,@ayasakiilen AHAHAHAH WAHT IN THE WOLF ROLEPLAY,2022-05-05 16:08:55+00:00,,0,1,1,0,en,1522246280763764736,[],"{'mentions': [{'start': 0, 'end': 12, 'username': 'ayasakiilen', 'id': '1520522393118257160'}]}",,False,,everyone,Twitter for iPhone
