tweetid,author_id,text,created_at,geo,retweets,replies,likes,quote_count,lang,conversation_id,context_annotations,entities,attachments,possibly_sensitive,withheld,reply_settings,source
1516542698739666959,1199001259904307207,"#RobloxDev! Starting the week of June 6, Roblox will block all calls to third party ad networks. https://t.co/UrxIQPIIj0 

(via: @chris12902) https://t.co/S0Vcg6diDi",2022-04-19 22:22:10+00:00,,18,7,144,1,en,1516542698739666959,"[{'domain': {'id': '71', 'name': 'Video Game', 'description': 'A video game like Overwatch'}, 'entity': {'id': '1088118927580774400', 'name': 'Roblox', 'description': 'Roblox'}}]","{'urls': [{'start': 97, 'end': 120, 'url': 'https://t.co/UrxIQPIIj0', 'expanded_url': 'http://devforum.roblox.com/t/enforcing-our-advertising-guidelines/1761082', 'display_url': 'devforum.roblox.com/t/enforcing-ou…', 'images': [{'url': 'https://pbs.twimg.com/news_img/1535366039885815809/uD0rIJjl?format=png&name=orig', 'width': 256, 'height': 256}, {'url': 'https://pbs.twimg.com/news_img/1535366039885815809/uD0rIJjl?format=png&name=150x150', 'width': 150, 'height': 150}], 'status': 200, 'title': 'Enforcing Our Advertising Guidelines', 'description': 'Developers, We announced an update to the Community Standards last year which included information about how to advertise within your experiences. These policies exist to ensure that the platform remains safe and respects the privacy of all people on Roblox. Please take some time to read and ensure you are following our Advertising guidelines in the Community Standards. It is particularly important for you to review the following policies if you are working with 3rd party ad networks: First...', 'unwound_url': 'https://devforum.roblox.com/t/enforcing-our-advertising-guidelines/1761082'}, {'start': 142, 'end': 165, 'url': 'https://t.co/S0Vcg6diDi', 'expanded_url': 'https://twitter.com/RBXNews_/status/1516542698739666959/photo/1', 'display_url': 'pic.twitter.com/S0Vcg6diDi', 'media_key': '3_1516542661943046148'}], 'annotations': [{'start': 41, 'end': 46, 'probability': 0.6199, 'type': 'Organization', 'normalized_text': 'Roblox'}], 'mentions': [{'start': 129, 'end': 140, 'username': 'chris12902', 'id': '1254513527664099333'}], 'hashtags': [{'start': 0, 'end': 10, 'tag': 'RobloxDev'}]}",{'media_keys': ['3_1516542661943046148']},False,,everyone,Twitter Web App
1516373325555064833,1056053249470541824,"A group named “Project Bonn” has been uploading @TMobile items to Roblox, like cell phones, boomboxes, and much more tech. ☎️

T - Mobile is possibly coming to Roblox. Stay tuned.. https://t.co/mutCbpVx8C",2022-04-19 11:09:08+00:00,,87,115,1824,22,en,1516373325555064833,"[{'domain': {'id': '71', 'name': 'Video Game', 'description': 'A video game like Overwatch'}, 'entity': {'id': '1088118927580774400', 'name': 'Roblox', 'description': 'Roblox'}}, {'domain': {'id': '46', 'name': 'Brand Category', 'description': 'Categories within Brand Verticals that narrow down the scope of Brands'}, 'entity': {'id': '781974596165640192', 'name': 'Telco'}}, {'domain': {'id': '47', 'name': 'Brand', 'description': 'Brands and Companies'}, 'entity': {'id': '10026302013', 'name': 'T-Mobile'}}, {'domain': {'id': '30', 'name': 'Entities [Entity Service]', 'description': 'Entity Service top level domain, every item that is in Entity Service should be in this domain'}, 'entity': {'id': '848920371311001600', 'name': 'Technology', 'description': 'Technology and computing'}}, {'domain': {'id': '66', 'name': 'Interests and Hobbies Category', 'description': 'A grouping of interests and hobbies entities, like Novelty Food or Destinations'}, 'entity': {'id': '848920700073123840', 'name': 'Cell Phones', 'description': 'Cell phones'}}, {'domain': {'id': '30', 'name': 'Entities [Entity Service]', 'description': 'Entity Service top level domain, every item that is in Entity Service should be in this domain'}, 'entity': {'id': '848985956778561538', 'name': 'Mobile', 'description': 'Mobile'}}]","{'urls': [{'start': 181, 'end': 204, 'url': 'https://t.co/mutCbpVx8C', 'expanded_url': 'https://twitter.com/Roblox_RTC/status/1516373325555064833/photo/1', 'display_url': 'pic.twitter.com/mutCbpVx8C', 'media_key': '3_1516373314331201539'}, {'start': 181, 'end': 204, 'url': 'https://t.co/mutCbpVx8C', 'expanded_url': 'https://twitter.com/Roblox_RTC/status/1516373325555064833/photo/1', 'display_url': 'pic.twitter.com/mutCbpVx8C', 'media_key': '3_1516373314335395847'}, {'start': 181, 'end': 204, 'url': 'https://t.co/mutCbpVx8C', 'expanded_url': 'https://twitter.com/Roblox_RTC/status/1516373325555064833/photo/1', 'display_url': 'pic.twitter.com/mutCbpVx8C', 'media_key': '3_1516373314343690241'}], 'annotations': [{'start': 15, 'end': 26, 'probability': 0.2852, 'type': 'Other', 'normalized_text': 'Project Bonn'}, {'start': 66, 'end': 71, 'probability': 0.4552, 'type': 'Product', 'normalized_text': 'Roblox'}, {'start': 160, 'end': 165, 'probability': 0.3095, 'type': 'Product', 'normalized_text': 'Roblox'}], 'mentions': [{'start': 48, 'end': 56, 'username': 'TMobile', 'id': '17338082'}]}","{'media_keys': ['3_1516373314331201539', '3_1516373314335395847', '3_1516373314343690241']}",False,,everyone,Twitter for iPhone
1516650909635387392,995849635909525505,https://t.co/PCjoiBKnq8,2022-04-20 05:32:09+00:00,,0,2,11,0,zxx,1516650909635387392,[],"{'urls': [{'start': 0, 'end': 23, 'url': 'https://t.co/PCjoiBKnq8', 'expanded_url': 'https://twitter.com/GhostHQtv/status/1516650909635387392/photo/1', 'display_url': 'pic.twitter.com/PCjoiBKnq8', 'media_key': '3_1516650821148106753'}]}",{'media_keys': ['3_1516650821148106753']},False,,everyone,Twitter Web App
1516447841819971590,865593156288602112,"ROBLOX PLAYERS!!!!!!!!! #Roblox 

I DONT KNOW WHAT TO DO WITH THIS MUCH ROBUX. I'm going to donate to some people, reply with shirts &amp; gamepasses and Retweet. 👇 https://t.co/RWYe8JL8E2",2022-04-19 16:05:14+00:00,,546,1278,1323,17,en,1516447841819971590,"[{'domain': {'id': '71', 'name': 'Video Game', 'description': 'A video game like Overwatch'}, 'entity': {'id': '1088118927580774400', 'name': 'Roblox', 'description': 'Roblox'}}]","{'urls': [{'start': 165, 'end': 188, 'url': 'https://t.co/RWYe8JL8E2', 'expanded_url': 'https://twitter.com/Jonah_RBX/status/1516447841819971590/photo/1', 'display_url': 'pic.twitter.com/RWYe8JL8E2', 'media_key': '3_1516447483995566088'}], 'hashtags': [{'start': 24, 'end': 31, 'tag': 'Roblox'}]}",{'media_keys': ['3_1516447483995566088']},False,,everyone,Twitter Web App
1516705002915459076,1285046843445919747,"Phil Eggtree Soundfont! (His mod is practically one of the oldest, yet satisfying mods I've seen)
https://t.co/5no9Gav13Y",2022-04-20 09:07:06+00:00,,0,1,0,0,en,1516704997135683587,[],"{'urls': [{'start': 98, 'end': 121, 'url': 'https://t.co/5no9Gav13Y', 'expanded_url': 'https://gamebanana.com/tools/9078', 'display_url': 'gamebanana.com/tools/9078', 'status': 200, 'title': ""Phil Eggtree Soundfont [Friday Night Funkin'] [Modding Tools]"", 'description': '""toh bee dah"" - phil eggtree... A Friday Night Funkin\' (FNF) Modding Tool in the Soundfonts category, submitted by InfineoInfinite', 'unwound_url': 'https://gamebanana.com/tools/9078'}], 'annotations': [{'start': 0, 'end': 11, 'probability': 0.9455, 'type': 'Person', 'normalized_text': 'Phil Eggtree'}]}",,True,,everyone,Twitter for Android
1514410067696754695,1417701705005903881,@ElevenBravo_ABN @Tendurag “aryan” lmao stfu,2022-04-14 01:07:51+00:00,,0,2,0,0,en,1512770019846987776,[],"{'mentions': [{'start': 0, 'end': 16, 'username': 'ElevenBravo_ABN', 'id': '1461817561767718916'}, {'start': 17, 'end': 26, 'username': 'Tendurag', 'id': '1286533746112565256'}]}",,False,,everyone,Twitter Web App
1516639641038131204,1479394704252817408,"valentine’s 2021 halo giveaway!
• follow me 
• like + retweet https://t.co/X1tlmrIs5D",2022-04-20 04:47:22+00:00,,516,348,521,140,en,1516639641038131204,[],"{'urls': [{'start': 62, 'end': 85, 'url': 'https://t.co/X1tlmrIs5D', 'expanded_url': 'https://twitter.com/luvhscar/status/1516639641038131204/photo/1', 'display_url': 'pic.twitter.com/X1tlmrIs5D', 'media_key': '3_1516639636546011139'}]}",{'media_keys': ['3_1516639636546011139']},False,,mentionedUsers,Twitter for iPhone
1516704664347189250,870734950752014336,"this platform has given me many personal and professional opportunities, and chances to meet cool people and make new friends. Also miss being closer to people I look up to and get inspiration from.",2022-04-20 09:05:45+00:00,,0,1,1,0,en,1516704661692112898,[],,,False,,mentionedUsers,Twitter Web App
1516093694998372359,1506800401890222081,"To celebrate 100k followers...we're hosting a GIVEAWAY! 🎉 2 winners will get the Baneful Bot Bunny SECRET pet, and 2 other winners will get 5,000 Tokens! Follow us @ClickerSim1, RT + Like this tweet, and comment your Roblox username to enter! Ends in 1 week. Good luck!🙂 https://t.co/1RVUvULAs1",2022-04-18 16:37:59+00:00,,2878,7389,6429,108,en,1516093694998372359,"[{'domain': {'id': '30', 'name': 'Entities [Entity Service]', 'description': 'Entity Service top level domain, every item that is in Entity Service should be in this domain'}, 'entity': {'id': '1326539256244838401', 'name': 'Rabbits'}}, {'domain': {'id': '71', 'name': 'Video Game', 'description': 'A video game like Overwatch'}, 'entity': {'id': '1088118927580774400', 'name': 'Roblox', 'description': 'Roblox'}}, {'domain': {'id': '46', 'name': 'Brand Category', 'description': 'Categories within Brand Verticals that narrow down the scope of Brands'}, 'entity': {'id': '781974596752842752', 'name': 'Services'}}, {'domain': {'id': '47', 'name': 'Brand', 'description': 'Brands and Companies'}, 'entity': {'id': '10045225402', 'name': 'Twitter'}}]","{'urls': [{'start': 271, 'end': 294, 'url': 'https://t.co/1RVUvULAs1', 'expanded_url': 'https://twitter.com/ClickerSim1/status/1516093694998372359/photo/1', 'display_url': 'pic.twitter.com/1RVUvULAs1', 'media_key': '3_1516090993250127878'}], 'annotations': [{'start': 82, 'end': 109, 'probability': 0.3294, 'type': 'Product', 'normalized_text': 'Baneful Bot Bunny SECRET pet'}, {'start': 218, 'end': 223, 'probability': 0.5338, 'type': 'Product', 'normalized_text': 'Roblox'}], 'mentions': [{'start': 164, 'end': 176, 'username': 'ClickerSim1', 'id': '1506800401890222081'}]}",{'media_keys': ['3_1516090993250127878']},False,,everyone,Twitter Web App
1516638487159750659,1320722640080900096,"@kxro_nxte Very nice man I'm also tryna become a developer, but I don't know which language to learn, rn I'm learning python and HTML/CSS.  Do you need javascript for that?",2022-04-20 04:42:47+00:00,,0,4,3,0,en,1516624410739945484,"[{'domain': {'id': '30', 'name': 'Entities [Entity Service]', 'description': 'Entity Service top level domain, every item that is in Entity Service should be in this domain'}, 'entity': {'id': '848920371311001600', 'name': 'Technology', 'description': 'Technology and computing'}}, {'domain': {'id': '66', 'name': 'Interests and Hobbies Category', 'description': 'A grouping of interests and hobbies entities, like Novelty Food or Destinations'}, 'entity': {'id': '848921413196984320', 'name': 'Computer programming', 'description': 'Computer programming'}}, {'domain': {'id': '66', 'name': 'Interests and Hobbies Category', 'description': 'A grouping of interests and hobbies entities, like Novelty Food or Destinations'}, 'entity': {'id': '898673391980261376', 'name': 'Web development', 'description': 'Web Development'}}, {'domain': {'id': '165', 'name': 'Technology', 'description': 'for individual and types of technology, e.g., food technology, 3D printing'}, 'entity': {'id': '848920371311001600', 'name': 'Technology', 'description': 'Technology and computing'}}, {'domain': {'id': '30', 'name': 'Entities [Entity Service]', 'description': 'Entity Service top level domain, every item that is in Entity Service should be in this domain'}, 'entity': {'id': '848920371311001600', 'name': 'Technology', 'description': 'Technology and computing'}}, {'domain': {'id': '66', 'name': 'Interests and Hobbies Category', 'description': 'A grouping of interests and hobbies entities, like Novelty Food or Destinations'}, 'entity': {'id': '898659750950207489', 'name': 'JavaScript', 'description': 'JavaScript'}}]",,,False,,everyone,Twitter Web App
1516704489067409409,1413012256665706498,"So.. I haven't really told anyone why I left- 

So to put it short, my mom went through my wattpad account, saw some weird shit from like 8 months ago, and told me to delete both wattpad and twt 

Im possibly gonna come back in July or August idk- 

Welp bye &lt;3",2022-04-20 09:05:03+00:00,,0,5,6,0,en,1516704489067409409,[],,,False,,everyone,Twitter Web App
1516381427943759880,888867384404176896,"Roblox or Twitter?

You can only pick one xD!",2022-04-19 11:41:20+00:00,,21,291,325,6,en,1516381427943759880,"[{'domain': {'id': '71', 'name': 'Video Game', 'description': 'A video game like Overwatch'}, 'entity': {'id': '1088118927580774400', 'name': 'Roblox', 'description': 'Roblox'}}, {'domain': {'id': '46', 'name': 'Brand Category', 'description': 'Categories within Brand Verticals that narrow down the scope of Brands'}, 'entity': {'id': '781974596752842752', 'name': 'Services'}}, {'domain': {'id': '47', 'name': 'Brand', 'description': 'Brands and Companies'}, 'entity': {'id': '10045225402', 'name': 'Twitter'}}]","{'annotations': [{'start': 10, 'end': 16, 'probability': 0.5935, 'type': 'Product', 'normalized_text': 'Twitter'}]}",,False,,everyone,Twitter for iPhone
1516666869432074241,1353950218169896960,"@Mr_istheDoge but that was only for PC, its out on mobile now.",2022-04-20 06:35:34+00:00,,0,8,104,0,en,1516616764632834058,[],"{'annotations': [{'start': 36, 'end': 37, 'probability': 0.6182, 'type': 'Product', 'normalized_text': 'PC'}], 'mentions': [{'start': 0, 'end': 13, 'username': 'Mr_istheDoge', 'id': '1478320398895042560'}]}",,False,,everyone,Twitter Web App
1516555376782544897,1491405382132334594,"@SharkBloxYT @CaIIMeRyzen @Roblox_RTC @SharkBloxYT 
Is this new update on mobile? https://t.co/pl22qTRtue",2022-04-19 23:12:32+00:00,,0,1,1,0,en,1516052156788445184,[],"{'urls': [{'start': 82, 'end': 105, 'url': 'https://t.co/pl22qTRtue', 'expanded_url': 'https://twitter.com/ZYREXOPS/status/1516555376782544897/photo/1', 'display_url': 'pic.twitter.com/pl22qTRtue', 'media_key': '3_1516555176819126273'}], 'mentions': [{'start': 0, 'end': 12, 'username': 'SharkBloxYT', 'id': '985359254184964096'}, {'start': 13, 'end': 25, 'username': 'CaIIMeRyzen', 'id': '1426933088588861441'}, {'start': 26, 'end': 37, 'username': 'Roblox_RTC', 'id': '1056053249470541824'}, {'start': 38, 'end': 50, 'username': 'SharkBloxYT', 'id': '985359254184964096'}]}",{'media_keys': ['3_1516555176819126273']},False,,everyone,Twitter Web App
1516697641765130240,24929621,🥰Love you💘 See you back in #ParisWorld @Roblox! 💘💘💘 https://t.co/hB9kyLW2WP,2022-04-20 08:37:51+00:00,,18,44,187,0,en,1516697641765130240,"[{'domain': {'id': '71', 'name': 'Video Game', 'description': 'A video game like Overwatch'}, 'entity': {'id': '1088118927580774400', 'name': 'Roblox', 'description': 'Roblox'}}, {'domain': {'id': '10', 'name': 'Person', 'description': 'Named people in the world like Nelson Mandela'}, 'entity': {'id': '808720282332450816', 'name': 'Paris Hilton', 'description': 'Paris Hilton'}}, {'domain': {'id': '58', 'name': 'Entertainment Personality', 'description': 'An entertainment personality in the world, like Anderson Cooper or Miranda Sings'}, 'entity': {'id': '808720282332450816', 'name': 'Paris Hilton', 'description': 'Paris Hilton'}}]","{'urls': [{'start': 52, 'end': 75, 'url': 'https://t.co/hB9kyLW2WP', 'expanded_url': 'https://twitter.com/enzokrew/status/1515874842544910342', 'display_url': 'twitter.com/enzokrew/statu…'}], 'mentions': [{'start': 39, 'end': 46, 'username': 'Roblox', 'id': '16745055'}], 'hashtags': [{'start': 27, 'end': 38, 'tag': 'ParisWorld'}]}",,False,,everyone,Twitter for iPhone
1516461257963884544,1421045033533313024,I GOT QUADRUPLE NOTIFICATIONS I- ERGNJT&amp;GBHNHVTVGGBFVG,2022-04-19 16:58:33+00:00,,0,2,3,0,sv,1516461257963884544,[],,,False,,everyone,Twitter for iPad
1516685855158685700,1424407857861206029,@LittleHobishi UwU https://t.co/DaHOUS0wWe,2022-04-20 07:51:01+00:00,,1,1,6,0,und,1515797314304196613,[],"{'urls': [{'start': 19, 'end': 42, 'url': 'https://t.co/DaHOUS0wWe', 'expanded_url': 'https://twitter.com/Gurka_Opinie/status/1516685855158685700/photo/1', 'display_url': 'pic.twitter.com/DaHOUS0wWe', 'media_key': '3_1516685853183127559'}], 'mentions': [{'start': 0, 'end': 14, 'username': 'LittleHobishi', 'id': '1007649454776832000'}]}",{'media_keys': ['3_1516685853183127559']},False,,everyone,Twitter for Android
1516645297589567491,1493424946063814656,You can sell items in the metaverse — but Meta will keep a nearly 50% cut https://t.co/ryy65pj8nv,2022-04-20 05:09:51+00:00,,0,1,0,0,en,1516645297589567491,"[{'domain': {'id': '30', 'name': 'Entities [Entity Service]', 'description': 'Entity Service top level domain, every item that is in Entity Service should be in this domain'}, 'entity': {'id': '848920371311001600', 'name': 'Technology', 'description': 'Technology and computing'}}, {'domain': {'id': '165', 'name': 'Technology', 'description': 'for individual and types of technology, e.g., food technology, 3D printing'}, 'entity': {'id': '848920371311001600', 'name': 'Technology', 'description': 'Technology and computing'}}]","{'urls': [{'start': 74, 'end': 97, 'url': 'https://t.co/ryy65pj8nv', 'expanded_url': 'https://nypost.com/2022/04/12/meta-will-keep-nearly-50-cut-of-virtual-item-sales-in-metaverse/', 'display_url': 'nypost.com/2022/04/12/met…', 'status': 200, 'title': 'You can sell items in the metaverse -- but Meta will keep a nearly...', 'description': 'Mark Zuckerberg says Meta plans to let creators sell virtual items in the metaverse — but the company plans in many cases to keep a cut of nearly 50%.\xa0', 'unwound_url': 'https://nypost.com/2022/04/12/meta-will-keep-nearly-50-cut-of-virtual-item-sales-in-metaverse/'}]}",,False,,everyone,Twitter for iPhone
1516667444735094787,4449647239,its time to delete roblox https://t.co/RXuDJAHoN4,2022-04-20 06:37:51+00:00,,143,693,2766,46,en,1516667444735094787,"[{'domain': {'id': '71', 'name': 'Video Game', 'description': 'A video game like Overwatch'}, 'entity': {'id': '1088118927580774400', 'name': 'Roblox', 'description': 'Roblox'}}]","{'urls': [{'start': 26, 'end': 49, 'url': 'https://t.co/RXuDJAHoN4', 'expanded_url': 'https://twitter.com/devforumtxt/status/1516667444735094787/photo/1', 'display_url': 'pic.twitter.com/RXuDJAHoN4', 'media_key': '3_1516667291672268800'}]}",{'media_keys': ['3_1516667291672268800']},False,,everyone,TweetDeck
1516640486723043329,1305267683194150912,@FloatingGravs as a 2017 mobile player its great seeing this again,2022-04-20 04:50:44+00:00,,1,23,317,0,en,1516616764632834058,[],"{'mentions': [{'start': 0, 'end': 14, 'username': 'FloatingGravs', 'id': '1304028446406914054'}]}",,False,,everyone,Twitter Web App
1509074031957639169,1355440476803883010,011 https://t.co/KYljKQ4yrZ,2022-03-30 07:44:21+00:00,,9,1,290,147,und,1509073855532646400,[],"{'urls': [{'start': 4, 'end': 27, 'url': 'https://t.co/KYljKQ4yrZ', 'expanded_url': 'https://twitter.com/plumajis/status/1509074031957639169/photo/1', 'display_url': 'pic.twitter.com/KYljKQ4yrZ', 'media_key': '3_1509074026060484611'}, {'start': 4, 'end': 27, 'url': 'https://t.co/KYljKQ4yrZ', 'expanded_url': 'https://twitter.com/plumajis/status/1509074031957639169/photo/1', 'display_url': 'pic.twitter.com/KYljKQ4yrZ', 'media_key': '3_1509074026123395079'}, {'start': 4, 'end': 27, 'url': 'https://t.co/KYljKQ4yrZ', 'expanded_url': 'https://twitter.com/plumajis/status/1509074031957639169/photo/1', 'display_url': 'pic.twitter.com/KYljKQ4yrZ', 'media_key': '3_1509074026505072642'}, {'start': 4, 'end': 27, 'url': 'https://t.co/KYljKQ4yrZ', 'expanded_url': 'https://twitter.com/plumajis/status/1509074031957639169/photo/1', 'display_url': 'pic.twitter.com/KYljKQ4yrZ', 'media_key': '3_1509074026559586304'}]}","{'media_keys': ['3_1509074026060484611', '3_1509074026123395079', '3_1509074026505072642', '3_1509074026559586304']}",False,,mentionedUsers,Twitter for iPhone
1515760217232797697,1251677662810042371,"How much Robux do you
want this Easter?",2022-04-17 18:32:51+00:00,,96,1939,848,5,en,1515760217232797697,"[{'domain': {'id': '29', 'name': 'Events [Entity Service]', 'description': 'Entity Service related Events domain'}, 'entity': {'id': '1372917575357591554', 'name': 'Easter', 'description': 'this entity for all conversations for Easter all year '}}, {'domain': {'id': '119', 'name': 'Holiday', 'description': 'Holidays like Christmas or Halloween'}, 'entity': {'id': '1372917575357591554', 'name': 'Easter', 'description': 'this entity for all conversations for Easter all year '}}]",,,False,,everyone,Twitter for iPhone
1516576431383269377,1393710146765869057,"I need art ideas so BASDDD BAD,, I’m doing so many things at once I gotta FOCUS!!! Give me your ideas.. NOW!! 

( preferably Roblox )",2022-04-20 00:36:12+00:00,,0,26,45,0,en,1516576431383269377,"[{'domain': {'id': '71', 'name': 'Video Game', 'description': 'A video game like Overwatch'}, 'entity': {'id': '1088118927580774400', 'name': 'Roblox', 'description': 'Roblox'}}]",,,False,,everyone,Twitter Web App
1516213941004910594,2710233133,@TheRealWqd @ValorLeaks Why is Da Hood your most payed lol,2022-04-19 00:35:48+00:00,,1,3,54,0,en,1516103483606421517,[],"{'annotations': [{'start': 31, 'end': 37, 'probability': 0.5187, 'type': 'Person', 'normalized_text': 'Da Hood'}], 'mentions': [{'start': 0, 'end': 11, 'username': 'TheRealWqd', 'id': '1501874293906436098'}, {'start': 12, 'end': 23, 'username': 'ValorLeaks', 'id': '1267553030788055047'}]}",,False,,everyone,Twitter Web App
1516532810349039618,1309690592713039873,"✧*｡ ꒰ #robux giveaway ꒱ ｡*✧ 

⊰⊹ rules:
{🌙} – follow me +
@maublxz

{🌟} – like &amp; retweet + qrt tags
{☄️} – follow rblx account on the thread + must show proofs.

[ ꗃ: layout by: @.sxxji_ ]",2022-04-19 21:42:52+00:00,,9,6,12,6,en,1516532810349039618,"[{'domain': {'id': '71', 'name': 'Video Game', 'description': 'A video game like Overwatch'}, 'entity': {'id': '1088118927580774400', 'name': 'Roblox', 'description': 'Roblox'}}]","{'mentions': [{'start': 58, 'end': 66, 'username': 'maublxz', 'id': '1508124368391458820'}], 'hashtags': [{'start': 6, 'end': 12, 'tag': 'robux'}]}",,False,,everyone,Twitter for Android
1516583719255085064,1109893372574162945,"Another 🏀👟

🔗https://t.co/EViA0ZVx4r

#Roblox #RobloxCommissions #robloxcommission #RobloxUGC @robloxdevrel #RobloxDev  #UGCConcept @Roblox 😊 https://t.co/hJ08IQIeVy",2022-04-20 01:05:10+00:00,,5,4,24,0,en,1516583719255085064,"[{'domain': {'id': '71', 'name': 'Video Game', 'description': 'A video game like Overwatch'}, 'entity': {'id': '1088118927580774400', 'name': 'Roblox', 'description': 'Roblox'}}]","{'urls': [{'start': 13, 'end': 36, 'url': 'https://t.co/EViA0ZVx4r', 'expanded_url': 'https://www.roblox.com/games/6549794549/RH2-The-Journey-Alpha?rbxp=952138828', 'display_url': 'roblox.com/games/65497945…', 'images': [{'url': 'https://pbs.twimg.com/news_img/1516576210091921412/m0E-CASi?format=jpg&name=orig', 'width': 498, 'height': 280}, {'url': 'https://pbs.twimg.com/news_img/1516576210091921412/m0E-CASi?format=jpg&name=150x150', 'width': 150, 'height': 150}], 'status': 200, 'title': 'RH2 The Journey [Alpha]', 'description': 'Check out RH2 The Journey [Alpha]. It’s one of the millions of unique, user-generated 3D experiences created on Roblox. x2 Weekends happen automatically. You are given x2 Coins and Upgrade points in the PRO-AM RH2 The Journey is a basketball game series that introduces many new features. Controls and more information will be listed inside the game. GAME IS NOT FINISHED and it should not be treated as a finished game. RH2 currently supports: -PC , -XBOX , -MOBILE Please report all bugs found!', 'unwound_url': 'https://www.roblox.com/games/6549794549/RH2-The-Journey-Alpha?rbxp=952138828'}, {'start': 142, 'end': 165, 'url': 'https://t.co/hJ08IQIeVy', 'expanded_url': 'https://twitter.com/ItsBina/status/1516583719255085064/photo/1', 'display_url': 'pic.twitter.com/hJ08IQIeVy', 'media_key': '3_1516583371501146119'}], 'mentions': [{'start': 94, 'end': 107, 'username': 'robloxdevrel', 'id': '856650515874172928'}, {'start': 132, 'end': 139, 'username': 'Roblox', 'id': '16745055'}], 'hashtags': [{'start': 38, 'end': 45, 'tag': 'Roblox'}, {'start': 46, 'end': 64, 'tag': 'RobloxCommissions'}, {'start': 65, 'end': 82, 'tag': 'robloxcommission'}, {'start': 83, 'end': 93, 'tag': 'RobloxUGC'}, {'start': 108, 'end': 118, 'tag': 'RobloxDev'}, {'start': 120, 'end': 131, 'tag': 'UGCConcept'}]}",{'media_keys': ['3_1516583371501146119']},False,,everyone,Twitter Web App
1516431558328135697,1174149854,"السؤال الرابع ⁧#رمضان_بريميرا⁩

أربح 800 ريال نقدًا 😍

اكتب اسماء ثلاث بطاقات موجودة على تطبيق بريميرا

 الجوائز بالقرعة بعد يومين لأصحاب 3 إجابات صحيحة...

الشروط:
1. اكتب اجابتك مع هاشتاق ⁧#رمضان_بريميرا⁩
2. متابعة
3. ريتويت https://t.co/4sI4Rwe2tz",2022-04-19 15:00:32+00:00,,1939,2212,884,30,ar,1516431558328135697,[],"{'urls': [{'start': 227, 'end': 250, 'url': 'https://t.co/4sI4Rwe2tz', 'expanded_url': 'https://twitter.com/primeraApp/status/1516431558328135697/photo/1', 'display_url': 'pic.twitter.com/4sI4Rwe2tz', 'media_key': '3_1516431551600410631'}], 'hashtags': [{'start': 15, 'end': 29, 'tag': 'رمضان_بريميرا'}, {'start': 191, 'end': 205, 'tag': 'رمضان_بريميرا'}]}",{'media_keys': ['3_1516431551600410631']},False,,everyone,Sprout Social
