tweetid,author_id,text,created_at,geo,retweets,replies,likes,quote_count,lang,conversation_id,context_annotations,entities,attachments,possibly_sensitive,withheld,reply_settings,source
1516929967669534723,18927441,"Kim Kardashian threatened to sue Roblox after a game claiming to offer an unreleased sex tape appeared, and her six-year-old son saw the ad. Her response? ""I have all the time, all the money, and all the resources to burn them all to the f**king ground."" https://t.co/LNomN3XpQ4 https://t.co/r53baPBJJg",2022-04-21 00:01:02+00:00,,2143,1436,28444,2947,en,1516929967669534723,"[{'domain': {'id': '10', 'name': 'Person', 'description': 'Named people in the world like Nelson Mandela'}, 'entity': {'id': '806570121959383040', 'name': 'Kim Kardashian', 'description': 'Kim Kardashian'}}, {'domain': {'id': '46', 'name': 'Brand Category', 'description': 'Categories within Brand Verticals that narrow down the scope of Brands'}, 'entity': {'id': '781974596157181956', 'name': 'Online Site'}}, {'domain': {'id': '47', 'name': 'Brand', 'description': 'Brands and Companies'}, 'entity': {'id': '1106638172182597632', 'name': 'IGN'}}, {'domain': {'id': '58', 'name': 'Entertainment Personality', 'description': 'An entertainment personality in the world, like Anderson Cooper or Miranda Sings'}, 'entity': {'id': '806570121959383040', 'name': 'Kim Kardashian', 'description': 'Kim Kardashian'}}, {'domain': {'id': '71', 'name': 'Video Game', 'description': 'A video game like Overwatch'}, 'entity': {'id': '1088118927580774400', 'name': 'Roblox', 'description': 'Roblox'}}]","{'urls': [{'start': 255, 'end': 278, 'url': 'https://t.co/LNomN3XpQ4', 'expanded_url': 'https://bit.ly/3v2D5Ko', 'display_url': 'bit.ly/3v2D5Ko', 'images': [{'url': 'https://pbs.twimg.com/news_img/1516777890146185226/odgrMuCY?format=jpg&name=orig', 'width': 1280, 'height': 720}, {'url': 'https://pbs.twimg.com/news_img/1516777890146185226/odgrMuCY?format=jpg&name=150x150', 'width': 150, 'height': 150}], 'status': 200, 'title': 'Kim Kardashian Threatened to Sue Roblox Over a Fake Sex Tape Game - IGN', 'description': 'Kim Kardashian threatened to sue Roblox after a game claiming to offer an unreleased sex tape appeared on the platform.', 'unwound_url': 'https://www.ign.com/articles/kim-kardashian-threatened-to-sue-roblox-over-a-fake-sex-tape-game'}, {'start': 279, 'end': 302, 'url': 'https://t.co/r53baPBJJg', 'expanded_url': 'https://twitter.com/IGN/status/1516929967669534723/photo/1', 'display_url': 'pic.twitter.com/r53baPBJJg', 'media_key': '3_1516929961965330432'}], 'annotations': [{'start': 0, 'end': 13, 'probability': 0.9924, 'type': 'Person', 'normalized_text': 'Kim Kardashian'}, {'start': 33, 'end': 38, 'probability': 0.3564, 'type': 'Organization', 'normalized_text': 'Roblox'}]}",{'media_keys': ['3_1516929961965330432']},False,,everyone,Sprout Social
1517176638328475648,1452731301799383040,who yall got in a fight Kim Kardashian or Roblox,2022-04-21 16:21:13+00:00,,0,5,11,0,en,1517176638328475648,"[{'domain': {'id': '10', 'name': 'Person', 'description': 'Named people in the world like Nelson Mandela'}, 'entity': {'id': '806570121959383040', 'name': 'Kim Kardashian', 'description': 'Kim Kardashian'}}, {'domain': {'id': '58', 'name': 'Entertainment Personality', 'description': 'An entertainment personality in the world, like Anderson Cooper or Miranda Sings'}, 'entity': {'id': '806570121959383040', 'name': 'Kim Kardashian', 'description': 'Kim Kardashian'}}, {'domain': {'id': '71', 'name': 'Video Game', 'description': 'A video game like Overwatch'}, 'entity': {'id': '1088118927580774400', 'name': 'Roblox', 'description': 'Roblox'}}]","{'annotations': [{'start': 24, 'end': 37, 'probability': 0.9958, 'type': 'Person', 'normalized_text': 'Kim Kardashian'}, {'start': 42, 'end': 47, 'probability': 0.3553, 'type': 'Product', 'normalized_text': 'Roblox'}]}",,False,,everyone,Twitter for Android
1517175905893982212,1373003981530750983,"@FloatingGravs Broo name your group in roblox,",2022-04-21 16:18:18+00:00,,0,1,1,0,en,1517173460526637056,"[{'domain': {'id': '71', 'name': 'Video Game', 'description': 'A video game like Overwatch'}, 'entity': {'id': '1088118927580774400', 'name': 'Roblox', 'description': 'Roblox'}}]","{'mentions': [{'start': 0, 'end': 14, 'username': 'FloatingGravs', 'id': '1304028446406914054'}]}",,False,,everyone,Twitter for Android
1517175282783952899,1475485970573234181,"@RvanArtist @Nuubzzz2 @cranstonburry @Aynatic @IGN I wish I could @ everyone but at this point I guess it doesn't matter.

I guess if others do find this buried in the replies I will say I have seen the many opinions of users within the replies,  the  overall view seems to be that many think PMG inaccurate information in it 1/2",2022-04-21 16:15:49+00:00,,0,1,0,0,en,1516929967669534723,"[{'domain': {'id': '46', 'name': 'Brand Category', 'description': 'Categories within Brand Verticals that narrow down the scope of Brands'}, 'entity': {'id': '781974596157181956', 'name': 'Online Site'}}, {'domain': {'id': '47', 'name': 'Brand', 'description': 'Brands and Companies'}, 'entity': {'id': '1106638172182597632', 'name': 'IGN'}}]","{'mentions': [{'start': 0, 'end': 11, 'username': 'RvanArtist', 'id': '1492945274930618368'}, {'start': 12, 'end': 21, 'username': 'Nuubzzz2', 'id': '1132570403904413696'}, {'start': 22, 'end': 36, 'username': 'cranstonburry', 'id': '1349112778188091392'}, {'start': 37, 'end': 45, 'username': 'Aynatic', 'id': '1057786856077754369'}, {'start': 46, 'end': 50, 'username': 'IGN', 'id': '18927441'}]}",,False,,everyone,Twitter Web App
1517176793387585536,1414315302775451655,@quotafallouts Roblox,2022-04-21 16:21:49+00:00,,0,1,3,0,en,1517176638328475648,"[{'domain': {'id': '71', 'name': 'Video Game', 'description': 'A video game like Overwatch'}, 'entity': {'id': '1088118927580774400', 'name': 'Roblox', 'description': 'Roblox'}}]","{'mentions': [{'start': 0, 'end': 14, 'username': 'quotafallouts', 'id': '1452731301799383040'}]}",,False,,everyone,Twitter for Android
1517168005993893892,1407018182313877509,@cafitoast @Arkinity_ As you can see our poor buddy here got banned from a very popular website for something related to balls.,2022-04-21 15:46:54+00:00,,0,1,1,0,en,1517152986526494721,[],"{'mentions': [{'start': 0, 'end': 10, 'username': 'cafitoast', 'id': '1434722475229827078'}, {'start': 11, 'end': 21, 'username': 'Arkinity_', 'id': '1358384069252272129'}]}",,False,,everyone,Twitter for Android
1517099690545881091,1056053249470541824,"Roblox has RESPONDED to Kim Kardashians alleged suing.. 😟

They say that there was NEVER some sort of referenced NSFW video on the platform.. it was only text, which has since been taken down and moderated.

(Via: @IGN ) https://t.co/M9U2xHZotO",2022-04-21 11:15:27+00:00,,102,103,1604,19,en,1517099690545881091,"[{'domain': {'id': '10', 'name': 'Person', 'description': 'Named people in the world like Nelson Mandela'}, 'entity': {'id': '806570121959383040', 'name': 'Kim Kardashian', 'description': 'Kim Kardashian'}}, {'domain': {'id': '46', 'name': 'Brand Category', 'description': 'Categories within Brand Verticals that narrow down the scope of Brands'}, 'entity': {'id': '781974596157181956', 'name': 'Online Site'}}, {'domain': {'id': '47', 'name': 'Brand', 'description': 'Brands and Companies'}, 'entity': {'id': '1106638172182597632', 'name': 'IGN'}}, {'domain': {'id': '58', 'name': 'Entertainment Personality', 'description': 'An entertainment personality in the world, like Anderson Cooper or Miranda Sings'}, 'entity': {'id': '806570121959383040', 'name': 'Kim Kardashian', 'description': 'Kim Kardashian'}}, {'domain': {'id': '71', 'name': 'Video Game', 'description': 'A video game like Overwatch'}, 'entity': {'id': '1088118927580774400', 'name': 'Roblox', 'description': 'Roblox'}}]","{'urls': [{'start': 221, 'end': 244, 'url': 'https://t.co/M9U2xHZotO', 'expanded_url': 'https://twitter.com/Roblox_RTC/status/1517099690545881091/photo/1', 'display_url': 'pic.twitter.com/M9U2xHZotO', 'media_key': '3_1517099686766821379'}, {'start': 221, 'end': 244, 'url': 'https://t.co/M9U2xHZotO', 'expanded_url': 'https://twitter.com/Roblox_RTC/status/1517099690545881091/photo/1', 'display_url': 'pic.twitter.com/M9U2xHZotO', 'media_key': '3_1517099686770974721'}], 'annotations': [{'start': 0, 'end': 5, 'probability': 0.3456, 'type': 'Organization', 'normalized_text': 'Roblox'}, {'start': 24, 'end': 38, 'probability': 0.9933, 'type': 'Person', 'normalized_text': 'Kim Kardashians'}], 'mentions': [{'start': 214, 'end': 218, 'username': 'IGN', 'id': '18927441'}]}","{'media_keys': ['3_1517099686766821379', '3_1517099686770974721']}",False,,everyone,Twitter for iPhone
1516864091729678337,1345823301818605574,"A couple days ago I got terminated from roblox. They were super vague as to why I was banned, so I emailed them. They told me I was terminated because of a backdoor script in my game. Obviously I didn't put it in there on purpose. #Roblox #RobloxDev #RTC https://t.co/UxSKFSTfjq",2022-04-20 19:39:16+00:00,,85,100,734,14,en,1516864091729678337,"[{'domain': {'id': '71', 'name': 'Video Game', 'description': 'A video game like Overwatch'}, 'entity': {'id': '1088118927580774400', 'name': 'Roblox', 'description': 'Roblox'}}]","{'urls': [{'start': 255, 'end': 278, 'url': 'https://t.co/UxSKFSTfjq', 'expanded_url': 'https://twitter.com/MxExists/status/1516864091729678337/photo/1', 'display_url': 'pic.twitter.com/UxSKFSTfjq', 'media_key': '3_1516863699360878595'}], 'hashtags': [{'start': 231, 'end': 238, 'tag': 'Roblox'}, {'start': 239, 'end': 249, 'tag': 'RobloxDev'}, {'start': 250, 'end': 254, 'tag': 'RTC'}]}",{'media_keys': ['3_1516863699360878595']},False,,everyone,Twitter Web App
1517171165260746753,1463395540847136768,Guys The school and doin twitter is really hard,2022-04-21 15:59:28+00:00,,0,1,5,0,en,1517171165260746753,"[{'domain': {'id': '46', 'name': 'Brand Category', 'description': 'Categories within Brand Verticals that narrow down the scope of Brands'}, 'entity': {'id': '781974596752842752', 'name': 'Services'}}, {'domain': {'id': '47', 'name': 'Brand', 'description': 'Brands and Companies'}, 'entity': {'id': '10045225402', 'name': 'Twitter'}}]","{'annotations': [{'start': 25, 'end': 31, 'probability': 0.6156, 'type': 'Product', 'normalized_text': 'twitter'}]}",,False,,everyone,Twitter Web App
1517175740218945537,3123873822,"@SkiesCollapsing Actually she's in the right. Think about it, why should kids be seeing that sort of thing in Roblox, much less her own child?",2022-04-21 16:17:38+00:00,,0,2,0,0,en,1517156082686210049,"[{'domain': {'id': '71', 'name': 'Video Game', 'description': 'A video game like Overwatch'}, 'entity': {'id': '1088118927580774400', 'name': 'Roblox', 'description': 'Roblox'}}]","{'annotations': [{'start': 110, 'end': 115, 'probability': 0.4888, 'type': 'Other', 'normalized_text': 'Roblox'}], 'mentions': [{'start': 0, 'end': 16, 'username': 'SkiesCollapsing', 'id': '1211533319143211008'}]}",,False,,everyone,Twitter for Android
1517162107862716417,1486871801858867203,@Kaskyktt KKKKKKKKKKKKKKKKKKKETWJEUWJ CE É FÃ DE ONE PIECE?,2022-04-21 15:23:28+00:00,,0,2,0,0,pt,1517007148051537922,[],"{'mentions': [{'start': 0, 'end': 9, 'username': 'Kaskyktt', 'id': '1404205674939179014'}]}",,False,,everyone,Twitter for Android
1515035061179109378,2850532049,i broke the rules https://t.co/xWSVTsvo3r,2022-04-15 18:31:21+00:00,,759,903,19900,54,en,1515035061179109378,[],"{'urls': [{'start': 18, 'end': 41, 'url': 'https://t.co/xWSVTsvo3r', 'expanded_url': 'https://twitter.com/AlbertsStuff/status/1515035061179109378/photo/1', 'display_url': 'pic.twitter.com/xWSVTsvo3r', 'media_key': '3_1515034936981524486'}]}",{'media_keys': ['3_1515034936981524486']},False,,everyone,Twitter Web App
1517175792261906433,301675379,@ItzNxthaniel @PlanetJunkie @discord @BurritoSOFTWARE @teamguilded @UpDownLeftDie @ItsKoiske @Roblox @guildedjared @Fi_Guilded @elonmusk No Xyphien 😭 I must be slacking,2022-04-21 16:17:51+00:00,,0,2,4,0,en,1516965674916061184,"[{'domain': {'id': '47', 'name': 'Brand', 'description': 'Brands and Companies'}, 'entity': {'id': '1168499224297656321', 'name': 'Discord'}}, {'domain': {'id': '71', 'name': 'Video Game', 'description': 'A video game like Overwatch'}, 'entity': {'id': '1088118927580774400', 'name': 'Roblox', 'description': 'Roblox'}}, {'domain': {'id': '165', 'name': 'Technology', 'description': 'for individual and types of technology, e.g., food technology, 3D printing'}, 'entity': {'id': '1196446161223028736', 'name': 'Social media'}}, {'domain': {'id': '10', 'name': 'Person', 'description': 'Named people in the world like Nelson Mandela'}, 'entity': {'id': '808713037230157824', 'name': 'Elon Musk', 'description': 'Elon Musk'}}, {'domain': {'id': '65', 'name': 'Interests and Hobbies Vertical', 'description': 'Top level interests and hobbies groupings, like Food or Travel'}, 'entity': {'id': '781974596148793345', 'name': 'Business & finance'}}, {'domain': {'id': '66', 'name': 'Interests and Hobbies Category', 'description': 'A grouping of interests and hobbies entities, like Novelty Food or Destinations'}, 'entity': {'id': '857878777191211008', 'name': 'Leadership', 'description': 'Leadership'}}, {'domain': {'id': '30', 'name': 'Entities [Entity Service]', 'description': 'Entity Service top level domain, every item that is in Entity Service should be in this domain'}, 'entity': {'id': '857879456773357569', 'name': 'Technology', 'description': 'Technology'}}]","{'mentions': [{'start': 0, 'end': 13, 'username': 'ItzNxthaniel', 'id': '1370134702372229121'}, {'start': 14, 'end': 27, 'username': 'PlanetJunkie', 'id': '1300763546880544770'}, {'start': 28, 'end': 36, 'username': 'discord', 'id': '3065618342'}, {'start': 37, 'end': 53, 'username': 'BurritoSOFTWARE', 'id': '1212591460849082369'}, {'start': 54, 'end': 66, 'username': 'teamguilded', 'id': '721224440160264192'}, {'start': 67, 'end': 81, 'username': 'UpDownLeftDie', 'id': '768939535069655040'}, {'start': 82, 'end': 92, 'username': 'ItsKoiske', 'id': '4854388066'}, {'start': 93, 'end': 100, 'username': 'Roblox', 'id': '16745055'}, {'start': 101, 'end': 114, 'username': 'guildedjared', 'id': '1345236397683216386'}, {'start': 115, 'end': 126, 'username': 'Fi_Guilded', 'id': '1180846925660262400'}, {'start': 127, 'end': 136, 'username': 'elonmusk', 'id': '44196397'}]}",,False,,everyone,Twitter for Android
1517175242741133312,1516801591026012160,@convomf rate buat hari ini,2022-04-21 16:15:40+00:00,,0,3,1,347,in,1517175094011117568,[],"{'mentions': [{'start': 0, 'end': 8, 'username': 'convomf', 'id': '1314975287294083073'}]}",,False,,everyone,Twitter for iPhone
1512896544013524993,805915274415407104,já esta começando... https://t.co/Se9eQ4s0YS,2022-04-09 20:53:39+00:00,,4,54,51,2,pt,1512896544013524993,[],"{'urls': [{'start': 21, 'end': 44, 'url': 'https://t.co/Se9eQ4s0YS', 'expanded_url': 'https://twitter.com/myster0y/status/1512896544013524993/photo/1', 'display_url': 'pic.twitter.com/Se9eQ4s0YS', 'media_key': '3_1512896539731152896'}]}",{'media_keys': ['3_1512896539731152896']},False,,everyone,Twitter Web App
1517160845436137472,1450036032716492801,@Bloxy_News Hey can you tell to david to add a roblox stud. In android pls,2022-04-21 15:18:27+00:00,,0,2,2,0,en,1516930068739543040,"[{'domain': {'id': '71', 'name': 'Video Game', 'description': 'A video game like Overwatch'}, 'entity': {'id': '1088118927580774400', 'name': 'Roblox', 'description': 'Roblox'}}, {'domain': {'id': '47', 'name': 'Brand', 'description': 'Brands and Companies'}, 'entity': {'id': '10026820777', 'name': 'Android'}}, {'domain': {'id': '30', 'name': 'Entities [Entity Service]', 'description': 'Entity Service top level domain, every item that is in Entity Service should be in this domain'}, 'entity': {'id': '848920371311001600', 'name': 'Technology', 'description': 'Technology and computing'}}, {'domain': {'id': '30', 'name': 'Entities [Entity Service]', 'description': 'Entity Service top level domain, every item that is in Entity Service should be in this domain'}, 'entity': {'id': '848985956778561538', 'name': 'Mobile', 'description': 'Mobile'}}]","{'annotations': [{'start': 32, 'end': 36, 'probability': 0.8466, 'type': 'Person', 'normalized_text': 'david'}, {'start': 63, 'end': 69, 'probability': 0.8408, 'type': 'Product', 'normalized_text': 'android'}], 'mentions': [{'start': 0, 'end': 11, 'username': 'Bloxy_News', 'id': '901894986836279296'}]}",,False,,everyone,Twitter for Android
1516485265262399491,16745055,What's that on the horizon? Looks like a thrilling open-world Roblox adventure for you and your whole crew. https://t.co/07puSdAAvV,2022-04-19 18:33:56+00:00,,139,516,2480,13,en,1516485265262399491,"[{'domain': {'id': '71', 'name': 'Video Game', 'description': 'A video game like Overwatch'}, 'entity': {'id': '1088118927580774400', 'name': 'Roblox', 'description': 'Roblox'}}]","{'urls': [{'start': 108, 'end': 131, 'url': 'https://t.co/07puSdAAvV', 'expanded_url': 'https://twitter.com/Sonar_Games/status/1506335517708673029', 'display_url': 'twitter.com/Sonar_Games/st…'}], 'annotations': [{'start': 62, 'end': 67, 'probability': 0.3916, 'type': 'Product', 'normalized_text': 'Roblox'}]}",,False,,everyone,Twitter Web App
1516638081339826176,1323372481382649859,POV: this guy just found out you took psychedelics at a music festival and is going to overly explain ever trip he's had and then sexually assault you https://t.co/mZahLEyhC6,2022-04-20 04:41:11+00:00,,541,161,9054,83,en,1516638081339826176,[],"{'urls': [{'start': 151, 'end': 174, 'url': 'https://t.co/mZahLEyhC6', 'expanded_url': 'https://twitter.com/YungCrippComedy/status/1516638081339826176/photo/1', 'display_url': 'pic.twitter.com/mZahLEyhC6', 'media_key': '3_1516635703760900101'}]}",{'media_keys': ['3_1516635703760900101']},False,,everyone,Twitter Web App
1517174823981658112,1324160922559139840,"@CraftVenusian @The_dewon @mizu_teas @subjectz24_CFC @kirawontmiss The game was not made for kids. Kids just started to play it more than adults cuz omg wow they obv have more free time. They do blaclmarket trades and deals for real money. 

Keep telling your self this was made for kids 😆",2022-04-21 16:14:00+00:00,,0,1,5,0,en,1517034011964620800,[],"{'mentions': [{'start': 0, 'end': 14, 'username': 'CraftVenusian', 'id': '1069666391110942720'}, {'start': 15, 'end': 25, 'username': 'The_dewon', 'id': '377706591'}, {'start': 26, 'end': 36, 'username': 'mizu_teas', 'id': '1408414532960067586'}, {'start': 53, 'end': 66, 'username': 'kirawontmiss', 'id': '1471414739880189955'}]}",,False,,everyone,Twitter for Android
1516965674916061184,1370134702372229121,"That seems about right except @PlanetJunkie &amp; @discord.

But 100% on @BurritoSOFTWARE, @teamguilded, @UpDownLeftDie, @ItsKoiske, @Roblox, @guildedjared, @Fi_Guilded, @elonmusk. https://t.co/hRk1zHUdVg",2022-04-21 02:22:55+00:00,,0,2,8,0,en,1516965674916061184,"[{'domain': {'id': '47', 'name': 'Brand', 'description': 'Brands and Companies'}, 'entity': {'id': '1168499224297656321', 'name': 'Discord'}}, {'domain': {'id': '71', 'name': 'Video Game', 'description': 'A video game like Overwatch'}, 'entity': {'id': '1088118927580774400', 'name': 'Roblox', 'description': 'Roblox'}}, {'domain': {'id': '165', 'name': 'Technology', 'description': 'for individual and types of technology, e.g., food technology, 3D printing'}, 'entity': {'id': '1196446161223028736', 'name': 'Social media'}}, {'domain': {'id': '10', 'name': 'Person', 'description': 'Named people in the world like Nelson Mandela'}, 'entity': {'id': '808713037230157824', 'name': 'Elon Musk', 'description': 'Elon Musk'}}, {'domain': {'id': '65', 'name': 'Interests and Hobbies Vertical', 'description': 'Top level interests and hobbies groupings, like Food or Travel'}, 'entity': {'id': '781974596148793345', 'name': 'Business & finance'}}, {'domain': {'id': '66', 'name': 'Interests and Hobbies Category', 'description': 'A grouping of interests and hobbies entities, like Novelty Food or Destinations'}, 'entity': {'id': '857878777191211008', 'name': 'Leadership', 'description': 'Leadership'}}, {'domain': {'id': '30', 'name': 'Entities [Entity Service]', 'description': 'Entity Service top level domain, every item that is in Entity Service should be in this domain'}, 'entity': {'id': '857879456773357569', 'name': 'Technology', 'description': 'Technology'}}]","{'urls': [{'start': 181, 'end': 204, 'url': 'https://t.co/hRk1zHUdVg', 'expanded_url': 'https://twitter.com/ItzNxthaniel/status/1516965674916061184/photo/1', 'display_url': 'pic.twitter.com/hRk1zHUdVg', 'media_key': '3_1516965379884470273'}], 'mentions': [{'start': 30, 'end': 43, 'username': 'PlanetJunkie', 'id': '1300763546880544770'}, {'start': 50, 'end': 58, 'username': 'discord', 'id': '3065618342'}, {'start': 73, 'end': 89, 'username': 'BurritoSOFTWARE', 'id': '1212591460849082369'}, {'start': 91, 'end': 103, 'username': 'teamguilded', 'id': '721224440160264192'}, {'start': 105, 'end': 119, 'username': 'UpDownLeftDie', 'id': '768939535069655040'}, {'start': 121, 'end': 131, 'username': 'ItsKoiske', 'id': '4854388066'}, {'start': 133, 'end': 140, 'username': 'Roblox', 'id': '16745055'}, {'start': 142, 'end': 155, 'username': 'guildedjared', 'id': '1345236397683216386'}, {'start': 157, 'end': 168, 'username': 'Fi_Guilded', 'id': '1180846925660262400'}, {'start': 170, 'end': 179, 'username': 'elonmusk', 'id': '44196397'}]}",{'media_keys': ['3_1516965379884470273']},False,,everyone,Twitter Web App
1516778000032829443,1480398176179789829,@ParisHilton @Roblox My Princess💛 https://t.co/1bo7aw6VG7,2022-04-20 13:57:10+00:00,,3,11,12,0,en,1516697641765130240,"[{'domain': {'id': '71', 'name': 'Video Game', 'description': 'A video game like Overwatch'}, 'entity': {'id': '1088118927580774400', 'name': 'Roblox', 'description': 'Roblox'}}, {'domain': {'id': '10', 'name': 'Person', 'description': 'Named people in the world like Nelson Mandela'}, 'entity': {'id': '808720282332450816', 'name': 'Paris Hilton', 'description': 'Paris Hilton'}}, {'domain': {'id': '58', 'name': 'Entertainment Personality', 'description': 'An entertainment personality in the world, like Anderson Cooper or Miranda Sings'}, 'entity': {'id': '808720282332450816', 'name': 'Paris Hilton', 'description': 'Paris Hilton'}}]","{'urls': [{'start': 34, 'end': 57, 'url': 'https://t.co/1bo7aw6VG7', 'expanded_url': 'https://twitter.com/The_Saviour10/status/1516778000032829443/photo/1', 'display_url': 'pic.twitter.com/1bo7aw6VG7', 'media_key': '3_1516777996237283329'}], 'mentions': [{'start': 0, 'end': 12, 'username': 'ParisHilton', 'id': '24929621'}, {'start': 13, 'end': 20, 'username': 'Roblox', 'id': '16745055'}]}",{'media_keys': ['3_1516777996237283329']},False,,everyone,Twitter for Android
1517173448547651589,1321187928819798016,"@emvx_002 Tô mais que maluco, tô no roblox",2022-04-21 16:08:32+00:00,,0,1,1,0,pt,1516986098311966720,"[{'domain': {'id': '71', 'name': 'Video Game', 'description': 'A video game like Overwatch'}, 'entity': {'id': '1088118927580774400', 'name': 'Roblox', 'description': 'Roblox'}}]","{'mentions': [{'start': 0, 'end': 9, 'username': 'emvx_002', 'id': '1344383381971283970'}]}",,False,,everyone,Twitter for Android
1517156082686210049,1211533319143211008,"Bruh, she gonna lose against a bunch of kids 🤣🤣🤣🤣 https://t.co/a2dWi8CYZK",2022-04-21 14:59:32+00:00,,0,1,0,0,en,1517156082686210049,"[{'domain': {'id': '10', 'name': 'Person', 'description': 'Named people in the world like Nelson Mandela'}, 'entity': {'id': '806570121959383040', 'name': 'Kim Kardashian', 'description': 'Kim Kardashian'}}, {'domain': {'id': '58', 'name': 'Entertainment Personality', 'description': 'An entertainment personality in the world, like Anderson Cooper or Miranda Sings'}, 'entity': {'id': '806570121959383040', 'name': 'Kim Kardashian', 'description': 'Kim Kardashian'}}, {'domain': {'id': '71', 'name': 'Video Game', 'description': 'A video game like Overwatch'}, 'entity': {'id': '1088118927580774400', 'name': 'Roblox', 'description': 'Roblox'}}]","{'urls': [{'start': 50, 'end': 73, 'url': 'https://t.co/a2dWi8CYZK', 'expanded_url': 'https://twitter.com/IGN/status/1516929967669534723', 'display_url': 'twitter.com/IGN/status/151…'}]}",,False,,everyone,Twitter for Android
1517159971036622849,1287074490640408583,🥲 https://t.co/xbFvF3ec11,2022-04-21 15:14:59+00:00,,0,15,93,0,und,1517159971036622849,[],"{'urls': [{'start': 2, 'end': 25, 'url': 'https://t.co/xbFvF3ec11', 'expanded_url': 'https://twitter.com/BliBlossom/status/1517159971036622849/photo/1', 'display_url': 'pic.twitter.com/xbFvF3ec11', 'media_key': '3_1517159967123378181'}]}",{'media_keys': ['3_1517159967123378181']},False,,everyone,Twitter Web App
