tweetid,author_id,text,created_at,geo,retweets,replies,likes,quote_count,lang,conversation_id,context_annotations,entities,attachments,possibly_sensitive,withheld,reply_settings,source
1530234126984421377,1312652681404731398,@ManCity @Roblox Minecraft &gt; Roblox,2022-05-27 17:07:00+00:00,,0,6,57,0,en,1530233904455684096,"[{'domain': {'id': '45', 'name': 'Brand Vertical', 'description': 'Top level entities that describe a Brands industry'}, 'entity': {'id': '781974597310615553', 'name': 'Entertainment'}}, {'domain': {'id': '46', 'name': 'Brand Category', 'description': 'Categories within Brand Verticals that narrow down the scope of Brands'}, 'entity': {'id': '781974597218340864', 'name': 'Video Games'}}, {'domain': {'id': '71', 'name': 'Video Game', 'description': 'A video game like Overwatch'}, 'entity': {'id': '10043689888', 'name': 'Minecraft'}}, {'domain': {'id': '71', 'name': 'Video Game', 'description': 'A video game like Overwatch'}, 'entity': {'id': '1088118927580774400', 'name': 'Roblox', 'description': 'Roblox'}}, {'domain': {'id': '12', 'name': 'Sports Team', 'description': 'A sports team organization, like Arsenal and the Boston Celtics'}, 'entity': {'id': '731226203856637952', 'name': 'Manchester City'}}]","{'mentions': [{'start': 0, 'end': 8, 'username': 'ManCity', 'id': '14573900'}, {'start': 9, 'end': 16, 'username': 'Roblox', 'id': '16745055'}]}",,False,,everyone,Twitter Web App
1530233904455684096,14573900,"Man City have landed on @Roblox! 🙌

Get your #ManCity Premier League 21/22 Champions scarf on the #Roblox marketplace now! 🧣

And look out for much more soon...",2022-05-27 17:06:07+00:00,,196,198,2486,99,en,1530233904455684096,"[{'domain': {'id': '3', 'name': 'TV Shows', 'description': 'Television shows from around the world'}, 'entity': {'id': '10000277815', 'name': 'English Premier League Soccer', 'description': 'Action from English Premier League Soccer matches.'}}, {'domain': {'id': '3', 'name': 'TV Shows', 'description': 'Television shows from around the world'}, 'entity': {'id': '10027427957', 'name': 'Barclays Premier League Football', 'description': 'Live football coverage of a match from the Premier League.'}}, {'domain': {'id': '3', 'name': 'TV Shows', 'description': 'Television shows from around the world'}, 'entity': {'id': '10029304591', 'name': 'Barclays Premier League Soccer'}}, {'domain': {'id': '3', 'name': 'TV Shows', 'description': 'Television shows from around the world'}, 'entity': {'id': '10053653751', 'name': 'Premier League'}}, {'domain': {'id': '11', 'name': 'Sport', 'description': 'Types of sports, like soccer and basketball'}, 'entity': {'id': '733756536430809088', 'name': 'Soccer'}}, {'domain': {'id': '26', 'name': 'Sports League', 'description': ''}, 'entity': {'id': '733756526872006656', 'name': 'Premier League'}}, {'domain': {'id': '71', 'name': 'Video Game', 'description': 'A video game like Overwatch'}, 'entity': {'id': '1088118927580774400', 'name': 'Roblox', 'description': 'Roblox'}}, {'domain': {'id': '12', 'name': 'Sports Team', 'description': 'A sports team organization, like Arsenal and the Boston Celtics'}, 'entity': {'id': '731226203856637952', 'name': 'Manchester City'}}, {'domain': {'id': '29', 'name': 'Events [Entity Service]', 'description': 'Entity Service related Events domain'}, 'entity': {'id': '733756526872006656', 'name': 'Premier League'}}]","{'hashtags': [{'start': 45, 'end': 53, 'tag': 'ManCity'}, {'start': 98, 'end': 105, 'tag': 'Roblox'}], 'mentions': [{'start': 24, 'end': 31, 'username': 'Roblox', 'id': '16745055'}]}",,False,,everyone,Twitter for Advertisers
1530234267342602241,1421776108295438344,@17woid @ManCity @Roblox Both mid,2022-05-27 17:07:34+00:00,,0,1,15,0,en,1530233904455684096,"[{'domain': {'id': '71', 'name': 'Video Game', 'description': 'A video game like Overwatch'}, 'entity': {'id': '1088118927580774400', 'name': 'Roblox', 'description': 'Roblox'}}, {'domain': {'id': '12', 'name': 'Sports Team', 'description': 'A sports team organization, like Arsenal and the Boston Celtics'}, 'entity': {'id': '731226203856637952', 'name': 'Manchester City'}}]","{'mentions': [{'start': 0, 'end': 7, 'username': '17woid', 'id': '1312652681404731398'}, {'start': 8, 'end': 16, 'username': 'ManCity', 'id': '14573900'}, {'start': 17, 'end': 24, 'username': 'Roblox', 'id': '16745055'}]}",,False,,everyone,Twitter for Android
1530171888890175492,1529897703316107265,Why do we have shooting games on @Roblox that 5 year olds can play? Why is a game like @PRC_Roblox letting younger kids shot cops and rob banks? Those games need ban. Help me get them ban @NRA @VP stop the violence by stopping them.,2022-05-27 12:59:42+00:00,,1,2,0,0,en,1530171888890175492,"[{'domain': {'id': '10', 'name': 'Person', 'description': 'Named people in the world like Nelson Mandela'}, 'entity': {'id': '875006493984149509', 'name': 'Kamala Harris', 'description': 'US Senator Kamala Harris (CA)'}}, {'domain': {'id': '35', 'name': 'Politician', 'description': 'Politicians in the world, like Joe Biden'}, 'entity': {'id': '875006493984149509', 'name': 'Kamala Harris', 'description': 'US Senator Kamala Harris (CA)'}}, {'domain': {'id': '45', 'name': 'Brand Vertical', 'description': 'Top level entities that describe a Brands industry'}, 'entity': {'id': '781974596157251587', 'name': 'Government/Education'}}, {'domain': {'id': '46', 'name': 'Brand Category', 'description': 'Categories within Brand Verticals that narrow down the scope of Brands'}, 'entity': {'id': '781974597226729473', 'name': 'Non-profit'}}, {'domain': {'id': '47', 'name': 'Brand', 'description': 'Brands and Companies'}, 'entity': {'id': '993576046648741888', 'name': 'National Rifle Association', 'description': 'National Rifle Association'}}, {'domain': {'id': '71', 'name': 'Video Game', 'description': 'A video game like Overwatch'}, 'entity': {'id': '1088118927580774400', 'name': 'Roblox', 'description': 'Roblox'}}]","{'mentions': [{'start': 33, 'end': 40, 'username': 'Roblox', 'id': '16745055'}, {'start': 87, 'end': 98, 'username': 'PRC_Roblox', 'id': '1071938981389045765'}, {'start': 188, 'end': 192, 'username': 'NRA', 'id': '21829541'}, {'start': 193, 'end': 196, 'username': 'VP', 'id': '803694179079458816'}]}",,False,,everyone,Twitter Web App
1530233519036694528,1528491904664342529,"What your Roblox style says about you:

Cnp: you have no sense of style and you probably are a odor

Slender: you're just a hornkee 9-year-old

Troll: you're just trying to be funny

Emo: you're a edgy teenager and you're stuck in the 2000s

More coming soon!",2022-05-27 17:04:35+00:00,,0,2,0,0,en,1530233519036694528,"[{'domain': {'id': '65', 'name': 'Interests and Hobbies Vertical', 'description': 'Top level interests and hobbies groupings, like Food or Travel'}, 'entity': {'id': '850395585941086209', 'name': 'Beauty', 'description': 'Beauty'}}, {'domain': {'id': '71', 'name': 'Video Game', 'description': 'A video game like Overwatch'}, 'entity': {'id': '1088118927580774400', 'name': 'Roblox', 'description': 'Roblox'}}]",,,False,,everyone,Twitter for Android
1530233817138601986,1420903390830370816,@cfc_theoo haaland yes,2022-05-27 17:05:47+00:00,,0,2,3,0,en,1530232415578357760,[],"{'mentions': [{'start': 0, 'end': 10, 'username': 'cfc_theoo', 'id': '1428156349305827332'}]}",,False,,everyone,Twitter for iPhone
1530234210342019073,1499760377374068739,@ManCity @Roblox Should have keep it deleted idiot,2022-05-27 17:07:20+00:00,,0,1,0,0,en,1530233904455684096,"[{'domain': {'id': '71', 'name': 'Video Game', 'description': 'A video game like Overwatch'}, 'entity': {'id': '1088118927580774400', 'name': 'Roblox', 'description': 'Roblox'}}, {'domain': {'id': '12', 'name': 'Sports Team', 'description': 'A sports team organization, like Arsenal and the Boston Celtics'}, 'entity': {'id': '731226203856637952', 'name': 'Manchester City'}}]","{'mentions': [{'start': 0, 'end': 8, 'username': 'ManCity', 'id': '14573900'}, {'start': 9, 'end': 16, 'username': 'Roblox', 'id': '16745055'}]}",,False,,everyone,Twitter for Android
1530233783190196224,117651118,@_Ocean_Roy_ @ManCity @Roblox Sidha tweet hi delete kar dia😂😂,2022-05-27 17:05:38+00:00,,0,1,1,0,in,1530232371907158017,"[{'domain': {'id': '71', 'name': 'Video Game', 'description': 'A video game like Overwatch'}, 'entity': {'id': '1088118927580774400', 'name': 'Roblox', 'description': 'Roblox'}}, {'domain': {'id': '12', 'name': 'Sports Team', 'description': 'A sports team organization, like Arsenal and the Boston Celtics'}, 'entity': {'id': '731226203856637952', 'name': 'Manchester City'}}, {'domain': {'id': '46', 'name': 'Brand Category', 'description': 'Categories within Brand Verticals that narrow down the scope of Brands'}, 'entity': {'id': '781974596752842752', 'name': 'Services'}}, {'domain': {'id': '47', 'name': 'Brand', 'description': 'Brands and Companies'}, 'entity': {'id': '10045225402', 'name': 'Twitter'}}]","{'mentions': [{'start': 0, 'end': 12, 'username': '_Ocean_Roy_', 'id': '868043827059331072'}, {'start': 13, 'end': 21, 'username': 'ManCity', 'id': '14573900'}, {'start': 22, 'end': 29, 'username': 'Roblox', 'id': '16745055'}]}",,False,,everyone,Twitter for Android
1530233458878038025,1468963294325010440,@gucci @Roblox @gucci YOU HEARD THE MAN,2022-05-27 17:04:21+00:00,,0,1,1,0,en,1529770336937562112,"[{'domain': {'id': '46', 'name': 'Brand Category', 'description': 'Categories within Brand Verticals that narrow down the scope of Brands'}, 'entity': {'id': '781974596807299072', 'name': 'Apparel/Accessories'}}, {'domain': {'id': '47', 'name': 'Brand', 'description': 'Brands and Companies'}, 'entity': {'id': '1266401847104827392', 'name': 'Gucci'}}, {'domain': {'id': '65', 'name': 'Interests and Hobbies Vertical', 'description': 'Top level interests and hobbies groupings, like Food or Travel'}, 'entity': {'id': '1256236649253449729', 'name': 'Fashion & beauty'}}, {'domain': {'id': '67', 'name': 'Interests and Hobbies', 'description': 'Interests, opinions, and behaviors of individuals, groups, or cultures; like Speciality Cooking or Theme Parks'}, 'entity': {'id': '839543390668673024', 'name': 'Fashion'}}, {'domain': {'id': '71', 'name': 'Video Game', 'description': 'A video game like Overwatch'}, 'entity': {'id': '1088118927580774400', 'name': 'Roblox', 'description': 'Roblox'}}]","{'mentions': [{'start': 0, 'end': 6, 'username': 'gucci', 'id': '16913418'}, {'start': 7, 'end': 14, 'username': 'Roblox', 'id': '16745055'}, {'start': 15, 'end': 21, 'username': 'gucci', 'id': '16913418'}]}",,False,,everyone,Twitter Web App
1530224493972443137,1331636931273244673,minecraft sex so good I got sticky keys,2022-05-27 16:28:44+00:00,,4,5,15,0,en,1530224493972443137,"[{'domain': {'id': '45', 'name': 'Brand Vertical', 'description': 'Top level entities that describe a Brands industry'}, 'entity': {'id': '781974597310615553', 'name': 'Entertainment'}}, {'domain': {'id': '46', 'name': 'Brand Category', 'description': 'Categories within Brand Verticals that narrow down the scope of Brands'}, 'entity': {'id': '781974597218340864', 'name': 'Video Games'}}, {'domain': {'id': '71', 'name': 'Video Game', 'description': 'A video game like Overwatch'}, 'entity': {'id': '10043689888', 'name': 'Minecraft'}}]",,,False,,everyone,Twitter for Android
1528536947471355906,1410362481726443526,"Who hasn't won a giftcard from me before??

Picking 1 person in the comments to get a 20$ roblox giftcard!",2022-05-23 00:43:01+00:00,,60,236,195,1,en,1528536947471355906,"[{'domain': {'id': '71', 'name': 'Video Game', 'description': 'A video game like Overwatch'}, 'entity': {'id': '1088118927580774400', 'name': 'Roblox', 'description': 'Roblox'}}]",,,False,,everyone,Twitter for Android
1527314036722761728,2960478694,i just logged on 💀 https://t.co/XAEEoziNKR,2022-05-19 15:43:37+00:00,,25,150,981,2,en,1527314036722761728,[],"{'urls': [{'start': 19, 'end': 42, 'url': 'https://t.co/XAEEoziNKR', 'expanded_url': 'https://twitter.com/Socksfor1/status/1527314036722761728/photo/1', 'display_url': 'pic.twitter.com/XAEEoziNKR', 'media_key': '3_1527313981547085826'}]}",{'media_keys': ['3_1527313981547085826']},False,,everyone,Twitter Web App
1530233736142405637,1285680586737295361,"Man City Premier League 21-22 Champions Scarf

https://t.co/1wfgeaJREM https://t.co/BD1sdndwvR https://t.co/FJ0Y6nenuK",2022-05-27 17:05:27+00:00,,0,1,1,1,fr,1530233736142405637,"[{'domain': {'id': '3', 'name': 'TV Shows', 'description': 'Television shows from around the world'}, 'entity': {'id': '10000277815', 'name': 'English Premier League Soccer', 'description': 'Action from English Premier League Soccer matches.'}}, {'domain': {'id': '3', 'name': 'TV Shows', 'description': 'Television shows from around the world'}, 'entity': {'id': '10027427957', 'name': 'Barclays Premier League Football', 'description': 'Live football coverage of a match from the Premier League.'}}, {'domain': {'id': '3', 'name': 'TV Shows', 'description': 'Television shows from around the world'}, 'entity': {'id': '10029304591', 'name': 'Barclays Premier League Soccer'}}, {'domain': {'id': '3', 'name': 'TV Shows', 'description': 'Television shows from around the world'}, 'entity': {'id': '10053653751', 'name': 'Premier League'}}, {'domain': {'id': '11', 'name': 'Sport', 'description': 'Types of sports, like soccer and basketball'}, 'entity': {'id': '733756536430809088', 'name': 'Soccer'}}, {'domain': {'id': '26', 'name': 'Sports League', 'description': ''}, 'entity': {'id': '733756526872006656', 'name': 'Premier League'}}, {'domain': {'id': '12', 'name': 'Sports Team', 'description': 'A sports team organization, like Arsenal and the Boston Celtics'}, 'entity': {'id': '731226203856637952', 'name': 'Manchester City'}}, {'domain': {'id': '29', 'name': 'Events [Entity Service]', 'description': 'Entity Service related Events domain'}, 'entity': {'id': '733756526872006656', 'name': 'Premier League'}}]","{'urls': [{'start': 47, 'end': 70, 'url': 'https://t.co/1wfgeaJREM', 'expanded_url': 'https://www.roblox.com/catalog/9737633665/Man-City-Premier-League-21-22-Champions-Scarf', 'display_url': 'roblox.com/catalog/973763…'}, {'start': 71, 'end': 94, 'url': 'https://t.co/BD1sdndwvR', 'expanded_url': 'https://twitter.com/LiedsonMaciel7/status/1530233736142405637/photo/1', 'display_url': 'pic.twitter.com/BD1sdndwvR', 'media_key': '3_1530233720938053635'}, {'start': 95, 'end': 118, 'url': 'https://t.co/FJ0Y6nenuK', 'expanded_url': 'https://twitter.com/LiedsonMaciel7/status/1530233073501102085', 'display_url': 'twitter.com/LiedsonMaciel7…'}]}",{'media_keys': ['3_1530233720938053635']},False,,everyone,Twitter Web App
1530031523654770688,1471568844418338816,"PART OF THREAD☝️🏽

FACT 1⃣1⃣

He spends most of his spare time playing games like Roblox and Minecraft on his tablet

👇🏽 https://t.co/WL6VU3KCKS",2022-05-27 03:41:56+00:00,,0,2,1,0,en,1529608880900153345,"[{'domain': {'id': '45', 'name': 'Brand Vertical', 'description': 'Top level entities that describe a Brands industry'}, 'entity': {'id': '781974597310615553', 'name': 'Entertainment'}}, {'domain': {'id': '46', 'name': 'Brand Category', 'description': 'Categories within Brand Verticals that narrow down the scope of Brands'}, 'entity': {'id': '781974597218340864', 'name': 'Video Games'}}, {'domain': {'id': '71', 'name': 'Video Game', 'description': 'A video game like Overwatch'}, 'entity': {'id': '10043689888', 'name': 'Minecraft'}}, {'domain': {'id': '71', 'name': 'Video Game', 'description': 'A video game like Overwatch'}, 'entity': {'id': '1088118927580774400', 'name': 'Roblox', 'description': 'Roblox'}}]","{'annotations': [{'start': 83, 'end': 88, 'probability': 0.3751, 'type': 'Product', 'normalized_text': 'Roblox'}, {'start': 94, 'end': 102, 'probability': 0.7587, 'type': 'Product', 'normalized_text': 'Minecraft'}], 'urls': [{'start': 121, 'end': 144, 'url': 'https://t.co/WL6VU3KCKS', 'expanded_url': 'https://twitter.com/familyNFTs/status/1530031523654770688/photo/1', 'display_url': 'pic.twitter.com/WL6VU3KCKS', 'media_key': '3_1530030589646077952'}, {'start': 121, 'end': 144, 'url': 'https://t.co/WL6VU3KCKS', 'expanded_url': 'https://twitter.com/familyNFTs/status/1530031523654770688/photo/1', 'display_url': 'pic.twitter.com/WL6VU3KCKS', 'media_key': '3_1530030661997838352'}]}","{'media_keys': ['3_1530030589646077952', '3_1530030661997838352']}",False,,everyone,Twitter Web App
1530227670910369792,36071175,"I played the Gucci Roblox game during the workday and it made me laugh and smile. I did get owned attempting to play the minigames but that's ok. (I am still looking for a ""C"" and an ""I"" to complete a challenge.) In @VogueBusiness https://t.co/DJwGPzeIPA",2022-05-27 16:41:21+00:00,,6,6,51,2,en,1530227670910369792,"[{'domain': {'id': '71', 'name': 'Video Game', 'description': 'A video game like Overwatch'}, 'entity': {'id': '1088118927580774400', 'name': 'Roblox', 'description': 'Roblox'}}]","{'annotations': [{'start': 13, 'end': 24, 'probability': 0.4706, 'type': 'Product', 'normalized_text': 'Gucci Roblox'}], 'mentions': [{'start': 216, 'end': 230, 'username': 'voguebusiness', 'id': '1085163264894480395'}], 'urls': [{'start': 231, 'end': 254, 'url': 'https://t.co/DJwGPzeIPA', 'expanded_url': 'https://www.voguebusiness.com/technology/when-it-comes-to-roblox-gucci-is-not-playing-around', 'display_url': 'voguebusiness.com/technology/whe…'}]}",,False,,everyone,Twitter Web App
1530211642767773698,1081622265081589760,@DivFPS Its almost like theres 100s of other games to play on ur thousand dollar pc instead of a free to play pile of dog shit,2022-05-27 15:37:40+00:00,,1,2,6,0,en,1530211056047357952,"[{'domain': {'id': '79', 'name': 'Video Game Hardware', 'description': 'Video Game Hardware'}, 'entity': {'id': '1174432578503204864', 'name': 'PC gaming'}}]","{'mentions': [{'start': 0, 'end': 7, 'username': 'DivFPS', 'id': '4636026481'}]}",,False,,everyone,Twitter for iPhone
1530224160583974918,3302829048,HI EVERYONE WHAT GAMES R U PLAYING RN I NEED THEM FOR. REASONS.,2022-05-27 16:27:24+00:00,,0,18,17,0,en,1530224160583974918,[],,,False,,everyone,Twitter for iPhone
1530231350350995456,3098421852,"@Roony_Marie lol &lt;3 I have a ton of colors approved for this style, lmk if there's one I missed",2022-05-27 16:55:58+00:00,,0,3,2,0,en,1530229408803409921,[],"{'mentions': [{'start': 0, 'end': 12, 'username': 'Roony_Marie', 'id': '735294322577448960'}]}",,False,,everyone,Twitter Web App
1529906779282341888,188966714,"@lmingione @HarvardBiz The most reliable stablecoins (as of right now) require collaterals, which will lock up too much liquidity just to trade in the Metaverse.",2022-05-26 19:26:15+00:00,,0,3,0,0,en,1529555910426861568,"[{'domain': {'id': '30', 'name': 'Entities [Entity Service]', 'description': 'Entity Service top level domain, every item that is in Entity Service should be in this domain'}, 'entity': {'id': '848920371311001600', 'name': 'Technology', 'description': 'Technology and computing'}}, {'domain': {'id': '157', 'name': 'Colleges & Universities', 'description': 'Colleges & universities around the world'}, 'entity': {'id': '1281451124470411264', 'name': 'Harvard University'}}, {'domain': {'id': '165', 'name': 'Technology', 'description': 'for individual and types of technology, e.g., food technology, 3D printing'}, 'entity': {'id': '848920371311001600', 'name': 'Technology', 'description': 'Technology and computing'}}]","{'mentions': [{'start': 0, 'end': 10, 'username': 'lmingione', 'id': '73469950'}, {'start': 11, 'end': 22, 'username': 'HarvardBiz', 'id': '14800270'}]}",,False,,everyone,Twitter for iPhone
1530233621197377537,1259271090603536384,"Huge thank you to @PUMA for allowing us the opportunity to bring this experience to life! 🙏

We're so proud of our team and we hope you guys love this experience as much as we do!! 🥰

🕹️ Play Here: https://t.co/qgr7Setaam https://t.co/UW3WllxO4c",2022-05-27 17:05:00+00:00,,9,32,164,0,en,1530233621197377537,[],"{'mentions': [{'start': 18, 'end': 23, 'username': 'PUMA', 'id': '50883209'}], 'urls': [{'start': 198, 'end': 221, 'url': 'https://t.co/qgr7Setaam', 'expanded_url': 'https://bit.ly/3GnKZlB', 'display_url': 'bit.ly/3GnKZlB', 'status': 200, 'title': 'Puma and the Land of Games', 'description': 'Check out Puma and the Land of Games. It’s one of the millions of unique, user-generated 3D experiences created on Roblox.', 'unwound_url': 'https://www.roblox.com/games/9281971995/Puma-and-the-Land-of-Games'}, {'start': 222, 'end': 245, 'url': 'https://t.co/UW3WllxO4c', 'expanded_url': 'https://twitter.com/WonderWorksRB/status/1530233621197377537/video/1', 'display_url': 'pic.twitter.com/UW3WllxO4c', 'media_key': '7_1529879370780778497'}]}",{'media_keys': ['7_1529879370780778497']},False,,everyone,Twitter Web App
1530159735583948800,4239154096,Conservative mormon momtok is crashing and burning because turns out a whole group of them were secretly swingers and one of the moms just spilled all this tea.,2022-05-27 12:11:24+00:00,,13572,917,205698,2754,en,1530159735583948800,[],,,False,,everyone,Twitter for Android
1530233335481761792,868043827059331072,@ManCity @Roblox ANNOUNCE HAALAND CMON FFS,2022-05-27 17:03:52+00:00,,0,1,0,0,en,1530232371907158017,"[{'domain': {'id': '10', 'name': 'Person', 'description': 'Named people in the world like Nelson Mandela'}, 'entity': {'id': '827325580764815361', 'name': 'Erling Haaland'}}, {'domain': {'id': '60', 'name': 'Athlete', 'description': 'An athlete in the world, like Serena Williams or Lionel Messi'}, 'entity': {'id': '827325580764815361', 'name': 'Erling Haaland'}}, {'domain': {'id': '71', 'name': 'Video Game', 'description': 'A video game like Overwatch'}, 'entity': {'id': '1088118927580774400', 'name': 'Roblox', 'description': 'Roblox'}}, {'domain': {'id': '12', 'name': 'Sports Team', 'description': 'A sports team organization, like Arsenal and the Boston Celtics'}, 'entity': {'id': '731226203856637952', 'name': 'Manchester City'}}]","{'mentions': [{'start': 0, 'end': 8, 'username': 'ManCity', 'id': '14573900'}, {'start': 9, 'end': 16, 'username': 'Roblox', 'id': '16745055'}]}",,False,,everyone,Twitter for Android
1530233073501102085,1285680586737295361,👀 https://t.co/SxX4p7RnNk,2022-05-27 17:02:49+00:00,,0,0,0,1,art,1530233073501102085,"[{'domain': {'id': '3', 'name': 'TV Shows', 'description': 'Television shows from around the world'}, 'entity': {'id': '10000277815', 'name': 'English Premier League Soccer', 'description': 'Action from English Premier League Soccer matches.'}}, {'domain': {'id': '3', 'name': 'TV Shows', 'description': 'Television shows from around the world'}, 'entity': {'id': '10027427957', 'name': 'Barclays Premier League Football', 'description': 'Live football coverage of a match from the Premier League.'}}, {'domain': {'id': '3', 'name': 'TV Shows', 'description': 'Television shows from around the world'}, 'entity': {'id': '10029304591', 'name': 'Barclays Premier League Soccer'}}, {'domain': {'id': '3', 'name': 'TV Shows', 'description': 'Television shows from around the world'}, 'entity': {'id': '10053653751', 'name': 'Premier League'}}, {'domain': {'id': '11', 'name': 'Sport', 'description': 'Types of sports, like soccer and basketball'}, 'entity': {'id': '733756536430809088', 'name': 'Soccer'}}, {'domain': {'id': '26', 'name': 'Sports League', 'description': ''}, 'entity': {'id': '733756526872006656', 'name': 'Premier League'}}, {'domain': {'id': '71', 'name': 'Video Game', 'description': 'A video game like Overwatch'}, 'entity': {'id': '1088118927580774400', 'name': 'Roblox', 'description': 'Roblox'}}, {'domain': {'id': '12', 'name': 'Sports Team', 'description': 'A sports team organization, like Arsenal and the Boston Celtics'}, 'entity': {'id': '731226203856637952', 'name': 'Manchester City'}}, {'domain': {'id': '29', 'name': 'Events [Entity Service]', 'description': 'Entity Service related Events domain'}, 'entity': {'id': '733756526872006656', 'name': 'Premier League'}}]","{'urls': [{'start': 2, 'end': 25, 'url': 'https://t.co/SxX4p7RnNk', 'expanded_url': 'https://twitter.com/ManCity/status/1530232371907158017', 'display_url': 'twitter.com/ManCity/status…'}]}",,False,,everyone,Twitter Web App
