tweetid,author_id,text,created_at,geo,retweets,replies,likes,quote_count,lang,conversation_id,context_annotations,entities,attachments,possibly_sensitive,withheld,reply_settings,source
1521737577698574337,1516088310279684100,@Roblox My hello kitty café 😔 https://t.co/xw4dYneD6v,2022-05-04 06:24:45+00:00,,0,9,156,0,en,1521728064987688960,"[{'domain': {'id': '10', 'name': 'Person', 'description': 'Named people in the world like Nelson Mandela'}, 'entity': {'id': '1443277565393719296', 'name': 'Hello Kitty'}}, {'domain': {'id': '47', 'name': 'Brand', 'description': 'Brands and Companies'}, 'entity': {'id': '1443277565393719296', 'name': 'Hello Kitty'}}, {'domain': {'id': '65', 'name': 'Interests and Hobbies Vertical', 'description': 'Top level interests and hobbies groupings, like Food or Travel'}, 'entity': {'id': '834828264786898945', 'name': 'Drinks', 'description': 'Drinks'}}, {'domain': {'id': '66', 'name': 'Interests and Hobbies Category', 'description': 'A grouping of interests and hobbies entities, like Novelty Food or Destinations'}, 'entity': {'id': '834828445238431744', 'name': 'Generic Drinks', 'description': 'Generic Drinks'}}, {'domain': {'id': '67', 'name': 'Interests and Hobbies', 'description': 'Interests, opinions, and behaviors of individuals, groups, or cultures; like Speciality Cooking or Theme Parks'}, 'entity': {'id': '850442647088971776', 'name': 'Coffee', 'description': 'Coffee'}}, {'domain': {'id': '71', 'name': 'Video Game', 'description': 'A video game like Overwatch'}, 'entity': {'id': '1088118927580774400', 'name': 'Roblox', 'description': 'Roblox'}}, {'domain': {'id': '122', 'name': 'Fictional Character', 'description': 'A person or other being in a narrative work of art, like Tom Sawyer or Jon Snow'}, 'entity': {'id': '1443277565393719296', 'name': 'Hello Kitty'}}, {'domain': {'id': '65', 'name': 'Interests and Hobbies Vertical', 'description': 'Top level interests and hobbies groupings, like Food or Travel'}, 'entity': {'id': '834828264786898945', 'name': 'Drinks', 'description': 'Drinks'}}, {'domain': {'id': '66', 'name': 'Interests and Hobbies Category', 'description': 'A grouping of interests and hobbies entities, like Novelty Food or Destinations'}, 'entity': {'id': '834828445238431744', 'name': 'Generic Drinks', 'description': 'Generic Drinks'}}, {'domain': {'id': '67', 'name': 'Interests and Hobbies', 'description': 'Interests, opinions, and behaviors of individuals, groups, or cultures; like Speciality Cooking or Theme Parks'}, 'entity': {'id': '850442647088971776', 'name': 'Coffee', 'description': 'Coffee'}}]","{'urls': [{'start': 30, 'end': 53, 'url': 'https://t.co/xw4dYneD6v', 'expanded_url': 'https://twitter.com/thr0winguppp/status/1521737577698574337/photo/1', 'display_url': 'pic.twitter.com/xw4dYneD6v', 'media_key': '3_1521737573017784320'}], 'mentions': [{'start': 0, 'end': 7, 'username': 'Roblox', 'id': '16745055'}]}",{'media_keys': ['3_1521737573017784320']},False,,everyone,Twitter for iPhone
1521728064987688960,16745055,"Hi everyone, we are aware that some of you are having issues accessing Roblox. Our team is actively working on it. Thanks for your patience",2022-05-04 05:46:57+00:00,,4060,14667,47263,1017,en,1521728064987688960,"[{'domain': {'id': '71', 'name': 'Video Game', 'description': 'A video game like Overwatch'}, 'entity': {'id': '1088118927580774400', 'name': 'Roblox', 'description': 'Roblox'}}]","{'annotations': [{'start': 71, 'end': 76, 'probability': 0.3595, 'type': 'Product', 'normalized_text': 'Roblox'}]}",,False,,everyone,Twitter Web App
1521730213176123392,1235005904325611521,@Roblox Fortnite is better,2022-05-04 05:55:29+00:00,,3,101,170,0,en,1521728064987688960,"[{'domain': {'id': '71', 'name': 'Video Game', 'description': 'A video game like Overwatch'}, 'entity': {'id': '974285387987169280', 'name': 'Fortnite', 'description': 'This entity includes all conversation about the franchise, as well as any individual installments in the series, if applicable.\t\t\t'}}, {'domain': {'id': '71', 'name': 'Video Game', 'description': 'A video game like Overwatch'}, 'entity': {'id': '1088118927580774400', 'name': 'Roblox', 'description': 'Roblox'}}]","{'annotations': [{'start': 8, 'end': 15, 'probability': 0.5037, 'type': 'Person', 'normalized_text': 'Fortnite'}], 'mentions': [{'start': 0, 'end': 7, 'username': 'Roblox', 'id': '16745055'}]}",,False,,everyone,Twitter for iPhone
1521743946547879936,804900700060848128,"last time roblox went down for 3 days was during chipotle event, today its during spotify event

coincidence? idk man",2022-05-04 06:50:04+00:00,,13,47,346,0,en,1521743946547879936,"[{'domain': {'id': '45', 'name': 'Brand Vertical', 'description': 'Top level entities that describe a Brands industry'}, 'entity': {'id': '781974597310615553', 'name': 'Entertainment'}}, {'domain': {'id': '46', 'name': 'Brand Category', 'description': 'Categories within Brand Verticals that narrow down the scope of Brands'}, 'entity': {'id': '781974597222535168', 'name': 'Online Services'}}, {'domain': {'id': '47', 'name': 'Brand', 'description': 'Brands and Companies'}, 'entity': {'id': '10040276669', 'name': 'Spotify'}}, {'domain': {'id': '67', 'name': 'Interests and Hobbies', 'description': 'Interests, opinions, and behaviors of individuals, groups, or cultures; like Speciality Cooking or Theme Parks'}, 'entity': {'id': '1288826829634035714', 'name': 'Backstage'}}, {'domain': {'id': '71', 'name': 'Video Game', 'description': 'A video game like Overwatch'}, 'entity': {'id': '1088118927580774400', 'name': 'Roblox', 'description': 'Roblox'}}]",,,False,,everyone,Twitter Web App
1521704469183930370,204563745,Roblox do be down.,2022-05-04 04:13:12+00:00,,48,192,1652,2,en,1521704469183930370,"[{'domain': {'id': '71', 'name': 'Video Game', 'description': 'A video game like Overwatch'}, 'entity': {'id': '1088118927580774400', 'name': 'Roblox', 'description': 'Roblox'}}]",,,False,,everyone,Twitter for iPhone
1521677529391718401,2287098931,Spotify took down roblox,2022-05-04 02:26:09+00:00,,45,220,1085,5,en,1521677529391718401,"[{'domain': {'id': '45', 'name': 'Brand Vertical', 'description': 'Top level entities that describe a Brands industry'}, 'entity': {'id': '781974597310615553', 'name': 'Entertainment'}}, {'domain': {'id': '46', 'name': 'Brand Category', 'description': 'Categories within Brand Verticals that narrow down the scope of Brands'}, 'entity': {'id': '781974597222535168', 'name': 'Online Services'}}, {'domain': {'id': '47', 'name': 'Brand', 'description': 'Brands and Companies'}, 'entity': {'id': '10040276669', 'name': 'Spotify'}}, {'domain': {'id': '67', 'name': 'Interests and Hobbies', 'description': 'Interests, opinions, and behaviors of individuals, groups, or cultures; like Speciality Cooking or Theme Parks'}, 'entity': {'id': '1288826829634035714', 'name': 'Backstage'}}, {'domain': {'id': '71', 'name': 'Video Game', 'description': 'A video game like Overwatch'}, 'entity': {'id': '1088118927580774400', 'name': 'Roblox', 'description': 'Roblox'}}]","{'annotations': [{'start': 0, 'end': 6, 'probability': 0.4818, 'type': 'Organization', 'normalized_text': 'Spotify'}]}",,False,,everyone,Twitter Web App
1521752841940963329,1257658763030392833,"It's been 19 hours without Roblox, I can’t stop shaking and I’m having severe mental breakdowns. I woke up today trying to log onto Roblox but the site was down, I had a major panic attack but managed to calm down after a few hours. 1/???",2022-05-04 07:25:24+00:00,,0,1,1,0,en,1521752841940963329,"[{'domain': {'id': '71', 'name': 'Video Game', 'description': 'A video game like Overwatch'}, 'entity': {'id': '1088118927580774400', 'name': 'Roblox', 'description': 'Roblox'}}]","{'annotations': [{'start': 27, 'end': 32, 'probability': 0.3556, 'type': 'Other', 'normalized_text': 'Roblox'}, {'start': 132, 'end': 137, 'probability': 0.5127, 'type': 'Product', 'normalized_text': 'Roblox'}]}",,False,,everyone,Twitter Web App
1521720025723330563,1383185736631980034,"⚠ ROBLOX DOWN ⚠
A majority of the ROBLOX playerbase is now reporting outages throughout the roblox site. Roblox's official status reports the Website, Mobile App, Xbox App &amp; Games as not working.

🔁RETWEET if ROBLOX is having issues
#RobloxDown https://t.co/PGGVh7aG92",2022-05-04 05:15:00+00:00,,282,176,189,6,en,1521720025723330563,"[{'domain': {'id': '71', 'name': 'Video Game', 'description': 'A video game like Overwatch'}, 'entity': {'id': '1088118927580774400', 'name': 'Roblox', 'description': 'Roblox'}}, {'domain': {'id': '45', 'name': 'Brand Vertical', 'description': 'Top level entities that describe a Brands industry'}, 'entity': {'id': '781974597310615553', 'name': 'Entertainment'}}, {'domain': {'id': '46', 'name': 'Brand Category', 'description': 'Categories within Brand Verticals that narrow down the scope of Brands'}, 'entity': {'id': '781974597218340864', 'name': 'Video Games'}}, {'domain': {'id': '47', 'name': 'Brand', 'description': 'Brands and Companies'}, 'entity': {'id': '10027048851', 'name': 'Xbox'}}, {'domain': {'id': '30', 'name': 'Entities [Entity Service]', 'description': 'Entity Service top level domain, every item that is in Entity Service should be in this domain'}, 'entity': {'id': '847527946864607232', 'name': 'Mobile gaming', 'description': 'Mobile gaming'}}, {'domain': {'id': '79', 'name': 'Video Game Hardware', 'description': 'Video Game Hardware'}, 'entity': {'id': '10027048851', 'name': 'Xbox'}}, {'domain': {'id': '79', 'name': 'Video Game Hardware', 'description': 'Video Game Hardware'}, 'entity': {'id': '847527946864607232', 'name': 'Mobile gaming', 'description': 'Mobile gaming'}}]","{'urls': [{'start': 249, 'end': 272, 'url': 'https://t.co/PGGVh7aG92', 'expanded_url': 'https://twitter.com/blox_status/status/1521720025723330563/photo/1', 'display_url': 'pic.twitter.com/PGGVh7aG92', 'media_key': '3_1521720006865735680'}], 'annotations': [{'start': 163, 'end': 170, 'probability': 0.8429, 'type': 'Product', 'normalized_text': 'Xbox App'}], 'hashtags': [{'start': 237, 'end': 248, 'tag': 'RobloxDown'}]}",{'media_keys': ['3_1521720006865735680']},False,,everyone,Twitter Web App
1521728218595831808,1235005904325611521,"@Roblox been almost 45 seconds without Roblox, I can't stop shaking and I'm having severe withdrawls I woke up today trying to log onto Roblox but the site was down I had a major panic attack but managed to calm down after a few hours. I couldn't go to school today, and I can barely talk",2022-05-04 05:47:34+00:00,,111,115,1929,6,en,1521728064987688960,"[{'domain': {'id': '71', 'name': 'Video Game', 'description': 'A video game like Overwatch'}, 'entity': {'id': '1088118927580774400', 'name': 'Roblox', 'description': 'Roblox'}}]","{'annotations': [{'start': 39, 'end': 44, 'probability': 0.3531, 'type': 'Other', 'normalized_text': 'Roblox'}, {'start': 136, 'end': 141, 'probability': 0.5234, 'type': 'Product', 'normalized_text': 'Roblox'}], 'mentions': [{'start': 0, 'end': 7, 'username': 'Roblox', 'id': '16745055'}]}",,False,,everyone,Twitter for iPhone
1521573104513806336,1422715417278230530,HOLY SHIT THIS IS CREEPY https://t.co/Na2yLr3ero,2022-05-03 19:31:12+00:00,,13,59,238,1,en,1521573104513806336,[],"{'urls': [{'start': 25, 'end': 48, 'url': 'https://t.co/Na2yLr3ero', 'expanded_url': 'https://twitter.com/DaRealKatya/status/1521573104513806336/photo/1', 'display_url': 'pic.twitter.com/Na2yLr3ero', 'media_key': '3_1521573035291119617'}]}",{'media_keys': ['3_1521573035291119617']},False,,everyone,Twitter Web App
1521660319759802369,1413886688640868353,"What videogame opinion you have has everyone be like this to you? c:

#Vtuber #ENVTuber https://t.co/e1XOvfWv7e",2022-05-04 01:17:45+00:00,,3,25,53,1,en,1521660319759802369,[],"{'urls': [{'start': 88, 'end': 111, 'url': 'https://t.co/e1XOvfWv7e', 'expanded_url': 'https://twitter.com/CaramelKaiteki/status/1521660319759802369/photo/1', 'display_url': 'pic.twitter.com/e1XOvfWv7e', 'media_key': '3_1521660193347624960'}], 'hashtags': [{'start': 70, 'end': 77, 'tag': 'Vtuber'}, {'start': 78, 'end': 87, 'tag': 'ENVTuber'}]}",{'media_keys': ['3_1521660193347624960']},False,,everyone,Twitter Web App
1521512841987203084,1477831992989425664,Al parecer Roblox se ha asociado com Spotify para crear una isla de minijuegos donde estará #StrayKids y Sunmi omg https://t.co/pYeOfTElno,2022-05-03 15:31:44+00:00,,524,16,3601,415,es,1521512841987203084,"[{'domain': {'id': '10', 'name': 'Person', 'description': 'Named people in the world like Nelson Mandela'}, 'entity': {'id': '1062427352318173185', 'name': 'Stray Kids', 'description': 'Stray Kids (스트레이 키즈)'}}, {'domain': {'id': '45', 'name': 'Brand Vertical', 'description': 'Top level entities that describe a Brands industry'}, 'entity': {'id': '781974597310615553', 'name': 'Entertainment'}}, {'domain': {'id': '46', 'name': 'Brand Category', 'description': 'Categories within Brand Verticals that narrow down the scope of Brands'}, 'entity': {'id': '781974597222535168', 'name': 'Online Services'}}, {'domain': {'id': '47', 'name': 'Brand', 'description': 'Brands and Companies'}, 'entity': {'id': '10040276669', 'name': 'Spotify'}}, {'domain': {'id': '54', 'name': 'Musician', 'description': 'A musician in the world, like Adele or Bob Dylan'}, 'entity': {'id': '1062427352318173185', 'name': 'Stray Kids', 'description': 'Stray Kids (스트레이 키즈)'}}, {'domain': {'id': '55', 'name': 'Music Genre', 'description': 'A category for a musical style, like Pop, Rock, or Rap'}, 'entity': {'id': '888105153038958593', 'name': 'K-pop', 'description': 'K-Pop'}}, {'domain': {'id': '67', 'name': 'Interests and Hobbies', 'description': 'Interests, opinions, and behaviors of individuals, groups, or cultures; like Speciality Cooking or Theme Parks'}, 'entity': {'id': '1288826829634035714', 'name': 'Backstage'}}, {'domain': {'id': '71', 'name': 'Video Game', 'description': 'A video game like Overwatch'}, 'entity': {'id': '1088118927580774400', 'name': 'Roblox', 'description': 'Roblox'}}]","{'urls': [{'start': 115, 'end': 138, 'url': 'https://t.co/pYeOfTElno', 'expanded_url': 'https://twitter.com/skzstaylatam/status/1521512841987203084/photo/1', 'display_url': 'pic.twitter.com/pYeOfTElno', 'media_key': '3_1521512839445368833'}], 'annotations': [{'start': 11, 'end': 16, 'probability': 0.36, 'type': 'Organization', 'normalized_text': 'Roblox'}, {'start': 37, 'end': 43, 'probability': 0.4255, 'type': 'Product', 'normalized_text': 'Spotify'}, {'start': 105, 'end': 109, 'probability': 0.6181, 'type': 'Person', 'normalized_text': 'Sunmi'}], 'hashtags': [{'start': 92, 'end': 102, 'tag': 'StrayKids'}]}",{'media_keys': ['3_1521512839445368833']},False,,everyone,Twitter for Android
1521530859853123588,1302467941921943557,"Finish the sentence!😎

I am ……!
You are ……!
We are ………..!",2022-05-03 16:43:20+00:00,,20,574,414,24,en,1521530859853123588,[],,,False,,everyone,Twitter for iPhone
1521729238063325184,1129473457685651458,@Roblox stay down,2022-05-04 05:51:37+00:00,,9,45,533,2,en,1521728064987688960,"[{'domain': {'id': '71', 'name': 'Video Game', 'description': 'A video game like Overwatch'}, 'entity': {'id': '1088118927580774400', 'name': 'Roblox', 'description': 'Roblox'}}]","{'mentions': [{'start': 0, 'end': 7, 'username': 'Roblox', 'id': '16745055'}]}",,False,,everyone,Twitter for iPhone
1521728335092592641,1141442459081281537,@Roblox https://t.co/OOK046OYT3,2022-05-04 05:48:02+00:00,,128,45,3813,5,qme,1521728064987688960,"[{'domain': {'id': '71', 'name': 'Video Game', 'description': 'A video game like Overwatch'}, 'entity': {'id': '1088118927580774400', 'name': 'Roblox', 'description': 'Roblox'}}]","{'urls': [{'start': 8, 'end': 31, 'url': 'https://t.co/OOK046OYT3', 'expanded_url': 'https://twitter.com/1M_oh/status/1521728335092592641/photo/1', 'display_url': 'pic.twitter.com/OOK046OYT3', 'media_key': '3_1521728326221635586'}], 'mentions': [{'start': 0, 'end': 7, 'username': 'Roblox', 'id': '16745055'}]}",{'media_keys': ['3_1521728326221635586']},True,,everyone,Twitter Web App
1521527491445366787,1266115586305728512,"Hey everyone
i decided to make a huge group art
but this time no need to follow this time
all you have to do is reply with your roblox avatar

picking original and best avatars. gl!

#Roblox I #robloxart I #RobloxDev I #RobloxDown I #RobloxGFX https://t.co/Qtop7JDEew",2022-05-03 16:29:57+00:00,,10,46,38,1,en,1521527491445366787,"[{'domain': {'id': '71', 'name': 'Video Game', 'description': 'A video game like Overwatch'}, 'entity': {'id': '1088118927580774400', 'name': 'Roblox', 'description': 'Roblox'}}]","{'urls': [{'start': 244, 'end': 267, 'url': 'https://t.co/Qtop7JDEew', 'expanded_url': 'https://twitter.com/StevePixels_/status/1521527491445366787/photo/1', 'display_url': 'pic.twitter.com/Qtop7JDEew', 'media_key': '3_1521527482154995712'}], 'hashtags': [{'start': 183, 'end': 190, 'tag': 'Roblox'}, {'start': 193, 'end': 203, 'tag': 'robloxart'}, {'start': 206, 'end': 216, 'tag': 'RobloxDev'}, {'start': 219, 'end': 230, 'tag': 'RobloxDown'}, {'start': 233, 'end': 243, 'tag': 'RobloxGFX'}]}",{'media_keys': ['3_1521527482154995712']},False,,everyone,Twitter Web App
1521159568562147329,16745055,"For uptown. For downtown. For your avatar, no matter what size and shape it is. Available now: https://t.co/NaI3ENWTbw https://t.co/xFrs99Fint",2022-05-02 16:07:57+00:00,,211,3023,4524,45,en,1521159568562147329,"[{'domain': {'id': '71', 'name': 'Video Game', 'description': 'A video game like Overwatch'}, 'entity': {'id': '1088118927580774400', 'name': 'Roblox', 'description': 'Roblox'}}]","{'urls': [{'start': 95, 'end': 118, 'url': 'https://t.co/NaI3ENWTbw', 'expanded_url': 'https://rblx.co/shorts', 'display_url': 'rblx.co/shorts', 'images': [{'url': 'https://pbs.twimg.com/news_img/1538678570985197568/2tviCHKw?format=jpg&name=orig', 'width': 1200, 'height': 630}, {'url': 'https://pbs.twimg.com/news_img/1538678570985197568/2tviCHKw?format=jpg&name=150x150', 'width': 150, 'height': 150}], 'status': 200, 'title': 'Roblox', 'description': 'Customize your avatar with a never-ending variety of clothing options, accessories, gear, and more!', 'unwound_url': 'https://www.roblox.com/catalog?Category=3&Subcategory=63&CreatorID=1&SortType=3'}, {'start': 119, 'end': 142, 'url': 'https://t.co/xFrs99Fint', 'expanded_url': 'https://twitter.com/Roblox/status/1521159568562147329/video/1', 'display_url': 'pic.twitter.com/xFrs99Fint', 'media_key': '7_1521158682746056705'}]}",{'media_keys': ['7_1521158682746056705']},False,,everyone,Twitter Web App
1521580576297398274,44196397,"Ultimately, the downfall of the Freemasons was giving away their stonecutting services for nothing",2022-05-03 20:00:53+00:00,,33010,25723,435576,4763,en,1521580576297398274,"[{'domain': {'id': '10', 'name': 'Person', 'description': 'Named people in the world like Nelson Mandela'}, 'entity': {'id': '808713037230157824', 'name': 'Elon Musk', 'description': 'Elon Musk'}}, {'domain': {'id': '65', 'name': 'Interests and Hobbies Vertical', 'description': 'Top level interests and hobbies groupings, like Food or Travel'}, 'entity': {'id': '781974596148793345', 'name': 'Business & finance'}}, {'domain': {'id': '66', 'name': 'Interests and Hobbies Category', 'description': 'A grouping of interests and hobbies entities, like Novelty Food or Destinations'}, 'entity': {'id': '857878777191211008', 'name': 'Leadership', 'description': 'Leadership'}}, {'domain': {'id': '30', 'name': 'Entities [Entity Service]', 'description': 'Entity Service top level domain, every item that is in Entity Service should be in this domain'}, 'entity': {'id': '857879456773357569', 'name': 'Technology', 'description': 'Technology'}}]",,,False,,everyone,Twitter for iPhone
1521593153173831682,1258116552458670081,"Piggy Find The Markers is now out!
Go play it here!
https://t.co/wmPp1R8sAh",2022-05-03 20:50:52+00:00,,28,42,174,6,en,1521593153173831682,[],"{'urls': [{'start': 52, 'end': 75, 'url': 'https://t.co/wmPp1R8sAh', 'expanded_url': 'https://www.roblox.com/games/9056549676/Piggy-Find-the-Markers-RELEASE-50', 'display_url': 'roblox.com/games/90565496…', 'images': [{'url': 'https://pbs.twimg.com/news_img/1524495761635000321/0nOKWV--?format=jpg&name=orig', 'width': 439, 'height': 280}, {'url': 'https://pbs.twimg.com/news_img/1524495761635000321/0nOKWV--?format=jpg&name=150x150', 'width': 150, 'height': 150}], 'status': 200, 'title': 'Piggy: Find the Markers [DUNGEONS!] [61]', 'description': ""Check out Piggy: Find the Markers [DUNGEONS!] [61]. It’s one of the millions of unique, user-generated 3D experiences created on Roblox. In this game, you can find markers. But, they're Piggy characters. That's about it. Obviously inspired by Find the Markers so go play that. Owner - AVENTIC Developers - LegoGonkk, Sworded_Developer, Finny737910, Epic_Tank."", 'unwound_url': 'https://www.roblox.com/games/9056549676/Piggy-Find-the-Markers-DUNGEONS-61?AssetId=9056549676'}], 'annotations': [{'start': 0, 'end': 21, 'probability': 0.3649, 'type': 'Other', 'normalized_text': 'Piggy Find The Markers'}]}",,False,,everyone,Twitter Web App
1520233336689504256,3070937366,"opened commissions!!
payments accepted in: robux, nitro, and toyhouse premium :3
dm me on here or discord if you're interested!!
#roblox #robux #robloxcommissions #robuxcommission #robloxart #robloxartcommissions https://t.co/YWy8hYE8hb",2022-04-30 02:47:26+00:00,,8,3,11,1,en,1520233336689504256,"[{'domain': {'id': '47', 'name': 'Brand', 'description': 'Brands and Companies'}, 'entity': {'id': '1168499224297656321', 'name': 'Discord'}}, {'domain': {'id': '71', 'name': 'Video Game', 'description': 'A video game like Overwatch'}, 'entity': {'id': '1088118927580774400', 'name': 'Roblox', 'description': 'Roblox'}}, {'domain': {'id': '165', 'name': 'Technology', 'description': 'for individual and types of technology, e.g., food technology, 3D printing'}, 'entity': {'id': '1196446161223028736', 'name': 'Social media'}}]","{'urls': [{'start': 213, 'end': 236, 'url': 'https://t.co/YWy8hYE8hb', 'expanded_url': 'https://twitter.com/blurphrenia/status/1520233336689504256/photo/1', 'display_url': 'pic.twitter.com/YWy8hYE8hb', 'media_key': '3_1520233289751031808'}, {'start': 213, 'end': 236, 'url': 'https://t.co/YWy8hYE8hb', 'expanded_url': 'https://twitter.com/blurphrenia/status/1520233336689504256/photo/1', 'display_url': 'pic.twitter.com/YWy8hYE8hb', 'media_key': '3_1520233334348992513'}], 'hashtags': [{'start': 129, 'end': 136, 'tag': 'roblox'}, {'start': 137, 'end': 143, 'tag': 'robux'}, {'start': 144, 'end': 162, 'tag': 'robloxcommissions'}, {'start': 163, 'end': 179, 'tag': 'robuxcommission'}, {'start': 180, 'end': 190, 'tag': 'robloxart'}, {'start': 191, 'end': 212, 'tag': 'robloxartcommissions'}]}","{'media_keys': ['3_1520233289751031808', '3_1520233334348992513']}",False,,everyone,Twitter for Android
1521653089320767488,1341830144458145793,Roblox needs to cool their shit #RobloxDown #Roblox https://t.co/F7d4XXFSC9,2022-05-04 00:49:02+00:00,,228,142,2797,5,en,1521653089320767488,"[{'domain': {'id': '71', 'name': 'Video Game', 'description': 'A video game like Overwatch'}, 'entity': {'id': '1088118927580774400', 'name': 'Roblox', 'description': 'Roblox'}}]","{'urls': [{'start': 52, 'end': 75, 'url': 'https://t.co/F7d4XXFSC9', 'expanded_url': 'https://twitter.com/KC2POK/status/1521653089320767488/photo/1', 'display_url': 'pic.twitter.com/F7d4XXFSC9', 'media_key': '3_1521653086695137280'}], 'annotations': [{'start': 0, 'end': 5, 'probability': 0.3348, 'type': 'Organization', 'normalized_text': 'Roblox'}], 'hashtags': [{'start': 32, 'end': 43, 'tag': 'RobloxDown'}, {'start': 44, 'end': 51, 'tag': 'Roblox'}]}",{'media_keys': ['3_1521653086695137280']},False,,everyone,Twitter for Android
1521686610030612482,1227378949732421649,"@PallasRiot @IntentionsNasty This! Literally this.

Their whole spiel is ""when they go low, we go high"" which translates to ""when they attack and murder, you petition, vote and sing""",2022-05-04 03:02:14+00:00,,0,1,10,0,en,1521661679423180800,[],"{'mentions': [{'start': 0, 'end': 11, 'username': 'PallasRiot', 'id': '1428899770421104642'}, {'start': 12, 'end': 28, 'username': 'IntentionsNasty', 'id': '1153681974160232448'}]}",,False,,everyone,Twitter for Android
1521665977536159746,1201893465795256325,social exprermeint,2022-05-04 01:40:14+00:00,,4,20,48,0,fr,1521665726402240514,[],,,False,,everyone,Twitter for iPhone
1521693045384794112,3025674465,Oh no... Is this the beginning of the Great Roblox Outage of 2022? https://t.co/atyQXeXd90,2022-05-04 03:27:48+00:00,,637,2692,10203,87,en,1521693045384794112,"[{'domain': {'id': '71', 'name': 'Video Game', 'description': 'A video game like Overwatch'}, 'entity': {'id': '1088118927580774400', 'name': 'Roblox', 'description': 'Roblox'}}]","{'urls': [{'start': 67, 'end': 90, 'url': 'https://t.co/atyQXeXd90', 'expanded_url': 'https://twitter.com/KreekCraft/status/1521693045384794112/photo/1', 'display_url': 'pic.twitter.com/atyQXeXd90', 'media_key': '3_1521692710452748290'}]}",{'media_keys': ['3_1521692710452748290']},False,,everyone,Twitter Web App
1521649352120446976,1404614493464842244,is roblox down for u guys? https://t.co/AhXwN5G33F,2022-05-04 00:34:11+00:00,,12,177,217,3,en,1521649352120446976,"[{'domain': {'id': '71', 'name': 'Video Game', 'description': 'A video game like Overwatch'}, 'entity': {'id': '1088118927580774400', 'name': 'Roblox', 'description': 'Roblox'}}]","{'urls': [{'start': 27, 'end': 50, 'url': 'https://t.co/AhXwN5G33F', 'expanded_url': 'https://twitter.com/qllice/status/1521649352120446976/photo/1', 'display_url': 'pic.twitter.com/AhXwN5G33F', 'media_key': '3_1521649342955859969'}]}",{'media_keys': ['3_1521649342955859969']},False,,everyone,Twitter Web App
