tweetid,author_id,text,created_at,geo,retweets,replies,likes,quote_count,lang,conversation_id,context_annotations,entities,attachments,possibly_sensitive,withheld,reply_settings,source
1521651025488146432,1515902058309644288,Is anybody else's @Roblox down? Roblox is always shutting down and I am sad bc of it :(,2022-05-04 00:40:50+00:00,,0,5,5,0,en,1521651025488146432,"[{'domain': {'id': '71', 'name': 'Video Game', 'description': 'A video game like Overwatch'}, 'entity': {'id': '1088118927580774400', 'name': 'Roblox', 'description': 'Roblox'}}]","{'annotations': [{'start': 32, 'end': 37, 'probability': 0.2737, 'type': 'Product', 'normalized_text': 'Roblox'}], 'mentions': [{'start': 18, 'end': 25, 'username': 'Roblox', 'id': '16745055'}]}",,False,,everyone,Twitter Web App
1521583163067281408,1488582104443142156,"We’re excited to announce our LIMITED @NFL Draft Chain on @Roblox.🤩

On sale now for ONLY 24 hours!⏰

Grab yours today 👉 https://t.co/UnjghNcGMV

#NFLTycoon #RobloxDev https://t.co/yEywplfb03",2022-05-03 20:11:10+00:00,,30,31,159,4,en,1521583163067281408,"[{'domain': {'id': '3', 'name': 'TV Shows', 'description': 'Television shows from around the world'}, 'entity': {'id': '10000612773', 'name': 'NFL Football', 'description': 'Replays of classic NFL games.'}}, {'domain': {'id': '3', 'name': 'TV Shows', 'description': 'Television shows from around the world'}, 'entity': {'id': '10032425201', 'name': 'NFL Football'}}, {'domain': {'id': '3', 'name': 'TV Shows', 'description': 'Television shows from around the world'}, 'entity': {'id': '10033407327', 'name': 'Futebol NFL'}}, {'domain': {'id': '3', 'name': 'TV Shows', 'description': 'Television shows from around the world'}, 'entity': {'id': '10042261464', 'name': 'Fútbol Americano de la NFL'}}, {'domain': {'id': '6', 'name': 'Sports Event'}, 'entity': {'id': '1497206859823939591', 'name': '2022 NFL Draft: Day 1', 'description': ""The 2022 NFL Draft starts on Thursday, as the league's top prospects look to make the jump from college to the pros. Keep it here for Tweets, must-see highlights, and the can't-miss moments right from Las Vegas.""}}, {'domain': {'id': '11', 'name': 'Sport', 'description': 'Types of sports, like soccer and basketball'}, 'entity': {'id': '689566306014617600', 'name': 'American football'}}, {'domain': {'id': '26', 'name': 'Sports League', 'description': ''}, 'entity': {'id': '689566314835259392', 'name': 'NFL'}}, {'domain': {'id': '29', 'name': 'Events [Entity Service]', 'description': 'Entity Service related Events domain'}, 'entity': {'id': '1497206859823939591', 'name': '2022 NFL Draft: Day 1', 'description': ""The 2022 NFL Draft starts on Thursday, as the league's top prospects look to make the jump from college to the pros. Keep it here for Tweets, must-see highlights, and the can't-miss moments right from Las Vegas.""}}, {'domain': {'id': '71', 'name': 'Video Game', 'description': 'A video game like Overwatch'}, 'entity': {'id': '1088118927580774400', 'name': 'Roblox', 'description': 'Roblox'}}, {'domain': {'id': '45', 'name': 'Brand Vertical', 'description': 'Top level entities that describe a Brands industry'}, 'entity': {'id': '781974597310615553', 'name': 'Entertainment'}}, {'domain': {'id': '46', 'name': 'Brand Category', 'description': 'Categories within Brand Verticals that narrow down the scope of Brands'}, 'entity': {'id': '781974597491040257', 'name': 'Sports'}}, {'domain': {'id': '47', 'name': 'Brand', 'description': 'Brands and Companies'}, 'entity': {'id': '10042758256', 'name': 'NFL'}}]","{'urls': [{'start': 121, 'end': 144, 'url': 'https://t.co/UnjghNcGMV', 'expanded_url': 'http://roblox.com/nfl', 'display_url': 'roblox.com/nfl', 'status': 200, 'unwound_url': 'https://www.roblox.com/nfl'}, {'start': 168, 'end': 191, 'url': 'https://t.co/yEywplfb03', 'expanded_url': 'https://twitter.com/NFLTycoon/status/1521583163067281408/photo/1', 'display_url': 'pic.twitter.com/yEywplfb03', 'media_key': '3_1521582024938737664'}], 'mentions': [{'start': 38, 'end': 42, 'username': 'NFL', 'id': '19426551'}, {'start': 58, 'end': 65, 'username': 'Roblox', 'id': '16745055'}], 'hashtags': [{'start': 146, 'end': 156, 'tag': 'NFLTycoon'}, {'start': 157, 'end': 167, 'tag': 'RobloxDev'}]}",{'media_keys': ['3_1521582024938737664']},False,,everyone,Twitter Web App
1519695192336388098,16745055,"Music fans, join us on @Roblox this Saturday for the 2nd annual Song Breaker Awards. The show starring host @bretmanrock and performers @lizzo and @whoisgayle will be live at 10AM PST. See you there! https://t.co/y83wU0644X https://t.co/rnTQm4dqNx",2022-04-28 15:09:03+00:00,,133,616,2057,18,en,1519695192336388098,"[{'domain': {'id': '10', 'name': 'Person', 'description': 'Named people in the world like Nelson Mandela'}, 'entity': {'id': '1117789006916243456', 'name': 'Lizzo', 'description': 'American rapper'}}, {'domain': {'id': '10', 'name': 'Person', 'description': 'Named people in the world like Nelson Mandela'}, 'entity': {'id': '1141044727136940032', 'name': 'Bretman Rock', 'description': 'Bretman Rock'}}, {'domain': {'id': '54', 'name': 'Musician', 'description': 'A musician in the world, like Adele or Bob Dylan'}, 'entity': {'id': '1117789006916243456', 'name': 'Lizzo', 'description': 'American rapper'}}, {'domain': {'id': '55', 'name': 'Music Genre', 'description': 'A category for a musical style, like Pop, Rock, or Rap'}, 'entity': {'id': '810937888334487552', 'name': 'Rap', 'description': 'Hip-Hop/Rap'}}, {'domain': {'id': '71', 'name': 'Video Game', 'description': 'A video game like Overwatch'}, 'entity': {'id': '1088118927580774400', 'name': 'Roblox', 'description': 'Roblox'}}, {'domain': {'id': '120', 'name': 'Digital Creator', 'description': 'Influencers who create content on digital platforms'}, 'entity': {'id': '1141044727136940032', 'name': 'Bretman Rock', 'description': 'Bretman Rock'}}]","{'urls': [{'start': 200, 'end': 223, 'url': 'https://t.co/y83wU0644X', 'expanded_url': 'https://rblx.co/songbreakerawards', 'display_url': 'rblx.co/songbreakerawa…', 'status': 200, 'title': 'Explore the Song Breaker World', 'description': 'You’re invited to the Logitech Song Breaker Awards, the first music awards show in the metaverse! Join Bretman Rock, MeganPlays, Shroud and Jaden Smith to celebrate groundbreaking creators like Walker Hayes and Cost n’ Mayor who are shaping pop music today through dance challenges, memes and trends shared on TikTok and YouTube. Watch Lizzo’s debut performance on Roblox with her new song “Special” and get up close with GAYLE, who will be performing her Billboard no. 1 hit “abcde-forget-u.” The award show', 'unwound_url': 'https://www.roblox.com/songbreakerawards'}, {'start': 224, 'end': 247, 'url': 'https://t.co/rnTQm4dqNx', 'expanded_url': 'https://twitter.com/Roblox/status/1519695192336388098/video/1', 'display_url': 'pic.twitter.com/rnTQm4dqNx', 'media_key': '7_1519694782519410689'}], 'annotations': [{'start': 64, 'end': 82, 'probability': 0.554, 'type': 'Other', 'normalized_text': 'Song Breaker Awards'}], 'mentions': [{'start': 23, 'end': 30, 'username': 'Roblox', 'id': '16745055'}, {'start': 108, 'end': 120, 'username': 'bretmanrock', 'id': '291547392'}, {'start': 136, 'end': 142, 'username': 'lizzo', 'id': '323417384'}, {'start': 147, 'end': 158, 'username': 'whoisgayle', 'id': '1098295826424713216'}]}",{'media_keys': ['7_1519694782519410689']},False,,everyone,Twitter Web App
1521627724829310976,3025674465,"welp roblox went down the exact moment i did a sponsor video. 😂

SHOULD I STREAM ANYWAY!?",2022-05-03 23:08:14+00:00,,74,461,3069,10,en,1521627724829310976,"[{'domain': {'id': '71', 'name': 'Video Game', 'description': 'A video game like Overwatch'}, 'entity': {'id': '1088118927580774400', 'name': 'Roblox', 'description': 'Roblox'}}]",,,False,,everyone,Twitter Web App
1521627509116309504,1408340269087535104,Roblox is currently experiencing issues right now. #RobloxDown,2022-05-03 23:07:23+00:00,,674,2369,10330,154,en,1521627509116309504,"[{'domain': {'id': '71', 'name': 'Video Game', 'description': 'A video game like Overwatch'}, 'entity': {'id': '1088118927580774400', 'name': 'Roblox', 'description': 'Roblox'}}]","{'annotations': [{'start': 0, 'end': 5, 'probability': 0.3527, 'type': 'Organization', 'normalized_text': 'Roblox'}], 'hashtags': [{'start': 51, 'end': 62, 'tag': 'RobloxDown'}]}",,False,,everyone,Twitter for iPhone
1521159568562147329,16745055,"For uptown. For downtown. For your avatar, no matter what size and shape it is. Available now: https://t.co/NaI3ENWTbw https://t.co/xFrs99Fint",2022-05-02 16:07:57+00:00,,211,3023,4524,45,en,1521159568562147329,"[{'domain': {'id': '71', 'name': 'Video Game', 'description': 'A video game like Overwatch'}, 'entity': {'id': '1088118927580774400', 'name': 'Roblox', 'description': 'Roblox'}}]","{'urls': [{'start': 95, 'end': 118, 'url': 'https://t.co/NaI3ENWTbw', 'expanded_url': 'https://rblx.co/shorts', 'display_url': 'rblx.co/shorts', 'images': [{'url': 'https://pbs.twimg.com/news_img/1538678570985197568/2tviCHKw?format=jpg&name=orig', 'width': 1200, 'height': 630}, {'url': 'https://pbs.twimg.com/news_img/1538678570985197568/2tviCHKw?format=jpg&name=150x150', 'width': 150, 'height': 150}], 'status': 200, 'title': 'Roblox', 'description': 'Customize your avatar with a never-ending variety of clothing options, accessories, gear, and more!', 'unwound_url': 'https://www.roblox.com/catalog?Category=3&Subcategory=63&CreatorID=1&SortType=3'}, {'start': 119, 'end': 142, 'url': 'https://t.co/xFrs99Fint', 'expanded_url': 'https://twitter.com/Roblox/status/1521159568562147329/video/1', 'display_url': 'pic.twitter.com/xFrs99Fint', 'media_key': '7_1521158682746056705'}]}",{'media_keys': ['7_1521158682746056705']},False,,everyone,Twitter Web App
1521654945056964609,1508967858008698881,"@Outofcontrolgam @Roblox Bro, that's a game for making fnaf animatronics. It's not a furry game it's just a drawing of one of the animatronics from the game. Maybe stop assuming",2022-05-04 00:56:24+00:00,,0,1,0,0,en,1521649632526450688,"[{'domain': {'id': '71', 'name': 'Video Game', 'description': 'A video game like Overwatch'}, 'entity': {'id': '856562205210198020', 'name': ""Five Nights at Freddy's"", 'description': 'This entity includes all conversation about the franchise, as well as any individual installments in the series, if applicable.\t\t\t'}}, {'domain': {'id': '71', 'name': 'Video Game', 'description': 'A video game like Overwatch'}, 'entity': {'id': '1088118927580774400', 'name': 'Roblox', 'description': 'Roblox'}}, {'domain': {'id': '67', 'name': 'Interests and Hobbies', 'description': 'Interests, opinions, and behaviors of individuals, groups, or cultures; like Speciality Cooking or Theme Parks'}, 'entity': {'id': '847869251595542528', 'name': 'Drawing & illustration', 'description': 'Drawing and sketching'}}]","{'mentions': [{'start': 0, 'end': 16, 'username': 'Outofcontrolgam', 'id': '943945429481291776'}, {'start': 17, 'end': 24, 'username': 'Roblox', 'id': '16745055'}]}",,False,,everyone,Twitter Web App
1520483405086998528,957320216622567424,@gamefamstudios Where is the m1 combat like in the movies 🫣,2022-04-30 19:21:07+00:00,,1,18,134,0,en,1520415991741702148,[],"{'mentions': [{'start': 0, 'end': 15, 'username': 'gamefamstudios', 'id': '1162494706066046977'}]}",,False,,everyone,Twitter for iPhone
1521627037181612032,1056053249470541824,"⚠️OUTAGE⚠️: Roblox is currently down at the moment. Not only are experiences failing to load, but studio is also failing to load as well. Our team will update you with further information.",2022-05-03 23:05:30+00:00,,428,1291,6967,83,en,1521627037181612032,"[{'domain': {'id': '71', 'name': 'Video Game', 'description': 'A video game like Overwatch'}, 'entity': {'id': '1088118927580774400', 'name': 'Roblox', 'description': 'Roblox'}}]","{'annotations': [{'start': 12, 'end': 17, 'probability': 0.3525, 'type': 'Organization', 'normalized_text': 'Roblox'}]}",,False,,everyone,Twitter Web App
1521655584818630656,700299840,"Very slowly and steadily Youtube chips away at features it needs

While twitch continues to be run by small brains https://t.co/2sHcvdkabm",2022-05-04 00:58:57+00:00,,3,15,65,0,en,1521655584818630656,"[{'domain': {'id': '46', 'name': 'Brand Category', 'description': 'Categories within Brand Verticals that narrow down the scope of Brands'}, 'entity': {'id': '781974596752842752', 'name': 'Services'}}, {'domain': {'id': '47', 'name': 'Brand', 'description': 'Brands and Companies'}, 'entity': {'id': '1054826545758396416', 'name': 'Twitch', 'description': 'Twitch'}}, {'domain': {'id': '165', 'name': 'Technology', 'description': 'for individual and types of technology, e.g., food technology, 3D printing'}, 'entity': {'id': '1196446161223028736', 'name': 'Social media'}}, {'domain': {'id': '46', 'name': 'Brand Category', 'description': 'Categories within Brand Verticals that narrow down the scope of Brands'}, 'entity': {'id': '781974596752842752', 'name': 'Services'}}, {'domain': {'id': '47', 'name': 'Brand', 'description': 'Brands and Companies'}, 'entity': {'id': '10029382357', 'name': 'YouTube'}}]","{'urls': [{'start': 115, 'end': 138, 'url': 'https://t.co/2sHcvdkabm', 'expanded_url': 'https://twitter.com/TeamYouTube/status/1521586556212895744', 'display_url': 'twitter.com/TeamYouTube/st…'}], 'annotations': [{'start': 25, 'end': 31, 'probability': 0.5259, 'type': 'Product', 'normalized_text': 'Youtube'}]}",,False,,everyone,Twitter for Android
1521656868417982466,1508464188217249803,@Roblox What is wrong with roblox???,2022-05-04 01:04:03+00:00,,0,1,1,0,en,1521159568562147329,"[{'domain': {'id': '71', 'name': 'Video Game', 'description': 'A video game like Overwatch'}, 'entity': {'id': '1088118927580774400', 'name': 'Roblox', 'description': 'Roblox'}}]","{'mentions': [{'start': 0, 'end': 7, 'username': 'Roblox', 'id': '16745055'}]}",,False,,everyone,Twitter for iPhone
1521576812630925318,1344320177496862721,@Parlo_ROBLOX first time on social media? people on here are GOING to get mad at you for having an opinion. and making suicidal tweets and fueling those people isnt helping.,2022-05-03 19:45:56+00:00,,0,4,11,0,en,1521575187136794627,"[{'domain': {'id': '46', 'name': 'Brand Category', 'description': 'Categories within Brand Verticals that narrow down the scope of Brands'}, 'entity': {'id': '781974596752842752', 'name': 'Services'}}, {'domain': {'id': '47', 'name': 'Brand', 'description': 'Brands and Companies'}, 'entity': {'id': '10045225402', 'name': 'Twitter'}}]","{'mentions': [{'start': 0, 'end': 13, 'username': 'Parlo_ROBLOX', 'id': '1310688804441817088'}]}",,False,,everyone,Twitter Web App
1521597057303121920,16745055,@Spotify @soundtrap @discord Queen SUNMI! So excited to have you on Roblox! 🥰,2022-05-03 21:06:23+00:00,,37,465,544,11,en,1521449221261602817,"[{'domain': {'id': '45', 'name': 'Brand Vertical', 'description': 'Top level entities that describe a Brands industry'}, 'entity': {'id': '781974597310615553', 'name': 'Entertainment'}}, {'domain': {'id': '46', 'name': 'Brand Category', 'description': 'Categories within Brand Verticals that narrow down the scope of Brands'}, 'entity': {'id': '781974597222535168', 'name': 'Online Services'}}, {'domain': {'id': '47', 'name': 'Brand', 'description': 'Brands and Companies'}, 'entity': {'id': '10040276669', 'name': 'Spotify'}}, {'domain': {'id': '47', 'name': 'Brand', 'description': 'Brands and Companies'}, 'entity': {'id': '1168499224297656321', 'name': 'Discord'}}, {'domain': {'id': '67', 'name': 'Interests and Hobbies', 'description': 'Interests, opinions, and behaviors of individuals, groups, or cultures; like Speciality Cooking or Theme Parks'}, 'entity': {'id': '1288826829634035714', 'name': 'Backstage'}}, {'domain': {'id': '71', 'name': 'Video Game', 'description': 'A video game like Overwatch'}, 'entity': {'id': '1088118927580774400', 'name': 'Roblox', 'description': 'Roblox'}}, {'domain': {'id': '165', 'name': 'Technology', 'description': 'for individual and types of technology, e.g., food technology, 3D printing'}, 'entity': {'id': '1196446161223028736', 'name': 'Social media'}}]","{'annotations': [{'start': 29, 'end': 39, 'probability': 0.829, 'type': 'Person', 'normalized_text': 'Queen SUNMI'}, {'start': 68, 'end': 73, 'probability': 0.4973, 'type': 'Product', 'normalized_text': 'Roblox'}], 'mentions': [{'start': 0, 'end': 8, 'username': 'Spotify', 'id': '17230018'}, {'start': 9, 'end': 19, 'username': 'soundtrap', 'id': '882321548'}, {'start': 20, 'end': 28, 'username': 'discord', 'id': '3065618342'}]}",,False,,everyone,Twitter Web App
1521627107826278400,1056053249470541824,POLL: Are you having issues with Roblox at the moment?,2022-05-03 23:05:47+00:00,,36,159,607,3,en,1521627037181612032,"[{'domain': {'id': '71', 'name': 'Video Game', 'description': 'A video game like Overwatch'}, 'entity': {'id': '1088118927580774400', 'name': 'Roblox', 'description': 'Roblox'}}]","{'annotations': [{'start': 33, 'end': 38, 'probability': 0.3331, 'type': 'Product', 'normalized_text': 'Roblox'}]}",{'poll_ids': ['1521627107364950017']},False,,everyone,Twitter Web App
1521628778635702272,859580565942661121,Se cayó roblox vístanse de tocines 🥓 https://t.co/urxVISzmuH,2022-05-03 23:12:25+00:00,,50,95,713,1,es,1521628778635702272,"[{'domain': {'id': '71', 'name': 'Video Game', 'description': 'A video game like Overwatch'}, 'entity': {'id': '1088118927580774400', 'name': 'Roblox', 'description': 'Roblox'}}]","{'urls': [{'start': 37, 'end': 60, 'url': 'https://t.co/urxVISzmuH', 'expanded_url': 'https://twitter.com/AnielicaYT/status/1521628778635702272/photo/1', 'display_url': 'pic.twitter.com/urxVISzmuH', 'media_key': '3_1521628775523536898'}]}",{'media_keys': ['3_1521628775523536898']},False,,everyone,Twitter for iPhone
1521651910977196032,1327507951662362624,"@Outofcontrolgam @Mr_B3l0v3d @Roblox bro you have a 7ds pfp, you can’t talk lol",2022-05-04 00:44:21+00:00,,0,2,1,0,en,1521649632526450688,"[{'domain': {'id': '71', 'name': 'Video Game', 'description': 'A video game like Overwatch'}, 'entity': {'id': '1088118927580774400', 'name': 'Roblox', 'description': 'Roblox'}}]","{'mentions': [{'start': 0, 'end': 16, 'username': 'Outofcontrolgam', 'id': '943945429481291776'}, {'start': 17, 'end': 28, 'username': 'Mr_B3l0v3d', 'id': '1508967858008698881'}, {'start': 29, 'end': 36, 'username': 'Roblox', 'id': '16745055'}]}",,False,,everyone,Twitter for iPhone
1521656906699313153,1401499494722592770,WHAT THE FUCK @Roblox GIVE ME MY FUCKING ACC BACK OMG LITERALLY I WORKED HARD ON ARSENAL AND ROYALE HIGH FUCK YOU @Roblox https://t.co/zXQRChQCAz,2022-05-04 01:04:12+00:00,,0,3,0,0,en,1521656906699313153,"[{'domain': {'id': '71', 'name': 'Video Game', 'description': 'A video game like Overwatch'}, 'entity': {'id': '1088118927580774400', 'name': 'Roblox', 'description': 'Roblox'}}, {'domain': {'id': '71', 'name': 'Video Game', 'description': 'A video game like Overwatch'}, 'entity': {'id': '1230882318224510978', 'name': 'Royale High'}}]","{'urls': [{'start': 122, 'end': 145, 'url': 'https://t.co/zXQRChQCAz', 'expanded_url': 'https://twitter.com/DrxcoPxtter/status/1521656906699313153/photo/1', 'display_url': 'pic.twitter.com/zXQRChQCAz', 'media_key': '3_1521656903301959680'}], 'annotations': [{'start': 81, 'end': 87, 'probability': 0.9143, 'type': 'Organization', 'normalized_text': 'ARSENAL'}], 'mentions': [{'start': 14, 'end': 21, 'username': 'Roblox', 'id': '16745055'}, {'start': 114, 'end': 121, 'username': 'Roblox', 'id': '16745055'}]}",{'media_keys': ['3_1521656903301959680']},False,,everyone,Twitter for Android
1521632135626596353,1505126119590219780,@Roblox Roblox my acount is hacked https://t.co/ruk6XVbIIP,2022-05-03 23:25:46+00:00,,3,63,73,1,en,1521159568562147329,"[{'domain': {'id': '71', 'name': 'Video Game', 'description': 'A video game like Overwatch'}, 'entity': {'id': '1088118927580774400', 'name': 'Roblox', 'description': 'Roblox'}}]","{'urls': [{'start': 35, 'end': 58, 'url': 'https://t.co/ruk6XVbIIP', 'expanded_url': 'https://twitter.com/Mrzxc13/status/1521632135626596353/photo/1', 'display_url': 'pic.twitter.com/ruk6XVbIIP', 'media_key': '3_1521632133269307394'}], 'mentions': [{'start': 0, 'end': 7, 'username': 'Roblox', 'id': '16745055'}]}",{'media_keys': ['3_1521632133269307394']},False,,everyone,Twitter for Android
1519578400461045761,1285265967774408705,"@kittywitty79 I could definitely see a proper Loomian Legacy game in that style. Not sure why, but it somehow has the vibe of Roblox while looking like it belongs in a triple a game. Definitely good art!",2022-04-28 07:24:57+00:00,,0,0,1,1,en,1382788768931868672,"[{'domain': {'id': '71', 'name': 'Video Game', 'description': 'A video game like Overwatch'}, 'entity': {'id': '1088118927580774400', 'name': 'Roblox', 'description': 'Roblox'}}]","{'annotations': [{'start': 126, 'end': 131, 'probability': 0.376, 'type': 'Product', 'normalized_text': 'Roblox'}], 'mentions': [{'start': 0, 'end': 13, 'username': 'kittywitty79', 'id': '806518671455748097'}]}",,False,,everyone,Twitter for iPad
1521159900159954944,1500162191118708747,@Roblox Can y’all stop hating on roblox?like if u hate it then don’t reply to their tweets,2022-05-02 16:09:16+00:00,,1,20,48,0,en,1521159568562147329,"[{'domain': {'id': '71', 'name': 'Video Game', 'description': 'A video game like Overwatch'}, 'entity': {'id': '1088118927580774400', 'name': 'Roblox', 'description': 'Roblox'}}, {'domain': {'id': '46', 'name': 'Brand Category', 'description': 'Categories within Brand Verticals that narrow down the scope of Brands'}, 'entity': {'id': '781974596752842752', 'name': 'Services'}}, {'domain': {'id': '47', 'name': 'Brand', 'description': 'Brands and Companies'}, 'entity': {'id': '10045225402', 'name': 'Twitter'}}]","{'annotations': [{'start': 33, 'end': 38, 'probability': 0.3844, 'type': 'Product', 'normalized_text': 'roblox'}], 'mentions': [{'start': 0, 'end': 7, 'username': 'Roblox', 'id': '16745055'}]}",,False,,everyone,Twitter for iPad
1512610416320520197,1056053249470541824,Controversial YouTuber Xonnek was recently REMOVED FROM THE STAR PROGRAM! His Main account has now been terminated on ROBLOX. ❌ https://t.co/zmdJiWhPyt,2022-04-09 01:56:40+00:00,,130,188,2380,33,en,1512610416320520197,"[{'domain': {'id': '71', 'name': 'Video Game', 'description': 'A video game like Overwatch'}, 'entity': {'id': '1088118927580774400', 'name': 'Roblox', 'description': 'Roblox'}}]","{'urls': [{'start': 128, 'end': 151, 'url': 'https://t.co/zmdJiWhPyt', 'expanded_url': 'https://twitter.com/Roblox_RTC/status/1512610416320520197/photo/1', 'display_url': 'pic.twitter.com/zmdJiWhPyt', 'media_key': '3_1512610413141233676'}], 'annotations': [{'start': 14, 'end': 28, 'probability': 0.61, 'type': 'Person', 'normalized_text': 'YouTuber Xonnek'}]}",{'media_keys': ['3_1512610413141233676']},False,,everyone,Twitter for iPhone
1521235796279316485,957320216622567424,@PrismSsj @CaribVros @FrosZ16 @rin19562797 @ShindoArts @Jojx95731009 @alphateen3x3 @JazaxR @Lord_Froggy16 @The_Eyesmith Make her flat,2022-05-02 21:10:51+00:00,,3,44,191,0,en,1521184471520796685,[],"{'mentions': [{'start': 0, 'end': 9, 'username': 'PrismSsj', 'id': '1112364962222145536'}, {'start': 10, 'end': 20, 'username': 'CaribVros', 'id': '3644607147'}, {'start': 21, 'end': 29, 'username': 'FrosZ16', 'id': '1409070934061772807'}, {'start': 30, 'end': 42, 'username': 'rin19562797', 'id': '1334313154797420545'}, {'start': 43, 'end': 54, 'username': 'ShindoArts', 'id': '1360318061874532355'}, {'start': 55, 'end': 68, 'username': 'Jojx95731009', 'id': '1410440670133772288'}, {'start': 69, 'end': 82, 'username': 'alphateen3x3', 'id': '856298731708272640'}, {'start': 83, 'end': 90, 'username': 'JazaxR', 'id': '1465848350633340934'}, {'start': 91, 'end': 105, 'username': 'Lord_Froggy16', 'id': '1342122300942925825'}, {'start': 106, 'end': 119, 'username': 'The_Eyesmith', 'id': '1390181735095230464'}]}",,False,,everyone,Twitter for iPhone
1521656712079757313,1504587577143492608,roblox shut down yall 😭-,2022-05-04 01:03:25+00:00,,0,1,1,0,en,1521656712079757313,"[{'domain': {'id': '71', 'name': 'Video Game', 'description': 'A video game like Overwatch'}, 'entity': {'id': '1088118927580774400', 'name': 'Roblox', 'description': 'Roblox'}}]",,,False,,everyone,Twitter Web App
1521443247968595968,1101376954161229827,"GIVEAWAY EXCLUSIVE PETS! Just Comment which pet you want to get! FOLLOW,LIKE,RETWEET if you want to WIN it! Good Luck! 💙💙  #PetSimulatorX #Roblox https://t.co/PXFiHJU55O",2022-05-03 10:55:12+00:00,,303,401,488,6,en,1521443247968595968,"[{'domain': {'id': '71', 'name': 'Video Game', 'description': 'A video game like Overwatch'}, 'entity': {'id': '1088118927580774400', 'name': 'Roblox', 'description': 'Roblox'}}]","{'urls': [{'start': 146, 'end': 169, 'url': 'https://t.co/PXFiHJU55O', 'expanded_url': 'https://twitter.com/imcyrian/status/1521443247968595968/photo/1', 'display_url': 'pic.twitter.com/PXFiHJU55O', 'media_key': '3_1521443245447819273'}], 'hashtags': [{'start': 123, 'end': 137, 'tag': 'PetSimulatorX'}, {'start': 138, 'end': 145, 'tag': 'Roblox'}]}",{'media_keys': ['3_1521443245447819273']},False,,everyone,Twitter for Android
1521656634703245313,1354430416711602176,"@Roblox what the heck is going on? I was literally scared to f*ckin death when it said something went wrong cuz i havent played in weeks. I thought i got hacked or something, this is crazy. Please fix the issue if there is one cuz im really bored Thank you.",2022-05-04 01:03:07+00:00,,0,1,0,0,en,1521656634703245313,"[{'domain': {'id': '71', 'name': 'Video Game', 'description': 'A video game like Overwatch'}, 'entity': {'id': '1088118927580774400', 'name': 'Roblox', 'description': 'Roblox'}}]","{'mentions': [{'start': 0, 'end': 7, 'username': 'Roblox', 'id': '16745055'}]}",,False,,everyone,Twitter for Android
