tweetid,author_id,text,created_at,geo,retweets,replies,likes,quote_count,lang,conversation_id,context_annotations,entities,attachments,possibly_sensitive,withheld,reply_settings,source
1537907089867034624,1056053249470541824,"The hyperpop queen Charli XCX preforms TONIGHT.. How about you “Vroom Vroom” your way over? This concert is sponsored by Samsung, in which many influencers have promoted it. We’ll update you of the overall rating of the concert in this! 🖤 https://t.co/APxAzLrzuS",2022-06-17 21:16:37+00:00,,12,34,264,4,en,1537907089867034624,"[{'domain': {'id': '3', 'name': 'TV Shows', 'description': 'Television shows from around the world'}, 'entity': {'id': '10031713489', 'name': 'The Next Step'}}, {'domain': {'id': '47', 'name': 'Brand', 'description': 'Brands and Companies'}, 'entity': {'id': '1174344555111469057', 'name': 'Samsung Indonesia'}}, {'domain': {'id': '71', 'name': 'Video Game', 'description': 'A video game like Overwatch'}, 'entity': {'id': '1088118927580774400', 'name': 'Roblox', 'description': 'Roblox'}}, {'domain': {'id': '10', 'name': 'Person', 'description': 'Named people in the world like Nelson Mandela'}, 'entity': {'id': '885602209618051072', 'name': 'Charli XCX', 'description': 'CHARLI XCX'}}, {'domain': {'id': '47', 'name': 'Brand', 'description': 'Brands and Companies'}, 'entity': {'id': '10026364234', 'name': 'Samsung '}}, {'domain': {'id': '48', 'name': 'Product', 'description': 'Products created by Brands.  Examples: Ford Explorer, Apple iPhone.'}, 'entity': {'id': '10026230384', 'name': 'Samsung Galaxy'}}, {'domain': {'id': '48', 'name': 'Product', 'description': 'Products created by Brands.  Examples: Ford Explorer, Apple iPhone.'}, 'entity': {'id': '10026331316', 'name': 'Samsung Mobile'}}, {'domain': {'id': '48', 'name': 'Product', 'description': 'Products created by Brands.  Examples: Ford Explorer, Apple iPhone.'}, 'entity': {'id': '10045298641', 'name': 'Samsung USA'}}, {'domain': {'id': '49', 'name': 'Product Version', 'description': ""The specific model or version of a product.  Examples: Audi A8, Ben & Jerry's Chocolate Chip Ice Cream""}, 'entity': {'id': '10040464729', 'name': 'Samsung Mobile UK'}}, {'domain': {'id': '49', 'name': 'Product Version', 'description': ""The specific model or version of a product.  Examples: Audi A8, Ben & Jerry's Chocolate Chip Ice Cream""}, 'entity': {'id': '10041364617', 'name': 'Samsung Mobile US'}}, {'domain': {'id': '54', 'name': 'Musician', 'description': 'A musician in the world, like Adele or Bob Dylan'}, 'entity': {'id': '885602209618051072', 'name': 'Charli XCX', 'description': 'CHARLI XCX'}}, {'domain': {'id': '55', 'name': 'Music Genre', 'description': 'A category for a musical style, like Pop, Rock, or Rap'}, 'entity': {'id': '810938279801470977', 'name': 'Pop', 'description': 'Pop'}}, {'domain': {'id': '30', 'name': 'Entities [Entity Service]', 'description': 'Entity Service top level domain, every item that is in Entity Service should be in this domain'}, 'entity': {'id': '848920371311001600', 'name': 'Technology', 'description': 'Technology and computing'}}, {'domain': {'id': '66', 'name': 'Interests and Hobbies Category', 'description': 'A grouping of interests and hobbies entities, like Novelty Food or Destinations'}, 'entity': {'id': '848920700073123840', 'name': 'Cell Phones', 'description': 'Cell phones'}}, {'domain': {'id': '30', 'name': 'Entities [Entity Service]', 'description': 'Entity Service top level domain, every item that is in Entity Service should be in this domain'}, 'entity': {'id': '848985956778561538', 'name': 'Mobile', 'description': 'Mobile'}}]","{'urls': [{'start': 239, 'end': 262, 'url': 'https://t.co/APxAzLrzuS', 'expanded_url': 'https://twitter.com/Roblox/status/1537904144605859840', 'display_url': 'twitter.com/Roblox/status/…'}], 'annotations': [{'start': 19, 'end': 28, 'probability': 0.5304, 'type': 'Person', 'normalized_text': 'Charli XCX'}, {'start': 64, 'end': 74, 'probability': 0.3417, 'type': 'Person', 'normalized_text': 'Vroom Vroom'}, {'start': 121, 'end': 127, 'probability': 0.8495, 'type': 'Organization', 'normalized_text': 'Samsung'}]}",,False,,everyone,Twitter for iPhone
1537908792020504576,1228007171339755521,"@Yourmom97497851 @Socka_boy @Roblox_RTC it's an opinion, we'll have opinions if you don't like it. Simply ignore it",2022-06-17 21:23:23+00:00,,0,3,1,0,en,1537907089867034624,[],"{'mentions': [{'start': 0, 'end': 16, 'username': 'Yourmom97497851', 'id': '1378034143162949639'}, {'start': 17, 'end': 27, 'username': 'Socka_boy', 'id': '1246678052576215040'}, {'start': 28, 'end': 39, 'username': 'Roblox_RTC', 'id': '1056053249470541824'}]}",,False,,everyone,Twitter Web App
1537909313183678465,1489894527582232577,"MEU AMIGO FOI FALAR ""jesus cristo"" NO ROBLOX E CENSUROU KKKKKKKKKKKKKKKKKKKKKKKKKKKKKKKKKKKKKKKKKKKKKKKKKKKKKKKKKKKKKKKKKKKKKKKKKKKKKKKKKKKKKKKKKKKKKKKKKKKKKKKKKKKKKKKKKKKKKKKKK https://t.co/iusIMGn9IB",2022-06-17 21:25:27+00:00,,0,2,1,0,pt,1537909313183678465,"[{'domain': {'id': '71', 'name': 'Video Game', 'description': 'A video game like Overwatch'}, 'entity': {'id': '1088118927580774400', 'name': 'Roblox', 'description': 'Roblox'}}]","{'urls': [{'start': 178, 'end': 201, 'url': 'https://t.co/iusIMGn9IB', 'expanded_url': 'https://twitter.com/aquelewonder/status/1537909313183678465/photo/1', 'display_url': 'pic.twitter.com/iusIMGn9IB', 'media_key': '3_1537909220883910658'}], 'annotations': [{'start': 21, 'end': 32, 'probability': 0.6728, 'type': 'Person', 'normalized_text': 'jesus cristo'}]}",{'media_keys': ['3_1537909220883910658']},False,,everyone,Twitter Web App
1537909554129666049,1377526604318924802,@DJNinjaRoblox @Socka_boy @Roblox_RTC ur british,2022-06-17 21:26:25+00:00,,0,2,1,0,en,1537907089867034624,[],"{'mentions': [{'start': 0, 'end': 14, 'username': 'DJNinjaRoblox', 'id': '1240709806547222528'}, {'start': 15, 'end': 25, 'username': 'Socka_boy', 'id': '1246678052576215040'}, {'start': 26, 'end': 37, 'username': 'Roblox_RTC', 'id': '1056053249470541824'}]}",,False,,everyone,Twitter for iPhone
1537893324517847040,1133967985205338112,@Muhamma59903584 @_khione_roblox_ @PlayAdoptMe @Minions You do realise about 50% of the people in adopt me crosstrade... and since you seem so fucking riled up about it why not go pester them instead?,2022-06-17 20:21:55+00:00,,0,1,0,0,en,1537450088133382145,"[{'domain': {'id': '71', 'name': 'Video Game', 'description': 'A video game like Overwatch'}, 'entity': {'id': '1229416301245763584', 'name': 'Adopt Me'}}, {'domain': {'id': '86', 'name': 'Movie', 'description': 'A film like Rogue One: A Star Wars Story'}, 'entity': {'id': '1247868495129264128', 'name': 'Minions: The Rise of Gru', 'description': 'Releases on July 3rd, 2020. POSTPONED DUE CORONAVIRUS. '}}, {'domain': {'id': '87', 'name': 'Movie Genre', 'description': 'A movie genre like Action'}, 'entity': {'id': '856976559529263104', 'name': 'Animated films', 'description': 'Animation'}}, {'domain': {'id': '130', 'name': 'Multimedia Franchise', 'description': ""Franchises which span multiple forms of media like 'Harry Potter'""}, 'entity': {'id': '1536698369501843456', 'name': 'Despicable Me'}}]","{'mentions': [{'start': 0, 'end': 16, 'username': 'Muhamma59903584', 'id': '1397950385474654209'}, {'start': 17, 'end': 33, 'username': '_khione_roblox_', 'id': '1527875872870797312'}, {'start': 34, 'end': 46, 'username': 'PlayAdoptMe', 'id': '1145825695941222400'}, {'start': 47, 'end': 55, 'username': 'Minions', 'id': '2255460432'}]}",,False,,everyone,Twitter Web App
1537904144605859840,16745055,"The next step on Charli XCX's CRASH tour? Roblox...today.

Don't miss the virtual concert debut of @charli_xcx in Samsung's Superstar Galaxy. The show starts Friday at 4PM PST: https://t.co/7x21bYAmUj https://t.co/jL8dgD2FOe",2022-06-17 21:04:55+00:00,,170,844,1670,52,en,1537904144605859840,"[{'domain': {'id': '3', 'name': 'TV Shows', 'description': 'Television shows from around the world'}, 'entity': {'id': '10031713489', 'name': 'The Next Step'}}, {'domain': {'id': '47', 'name': 'Brand', 'description': 'Brands and Companies'}, 'entity': {'id': '1174344555111469057', 'name': 'Samsung Indonesia'}}, {'domain': {'id': '71', 'name': 'Video Game', 'description': 'A video game like Overwatch'}, 'entity': {'id': '1088118927580774400', 'name': 'Roblox', 'description': 'Roblox'}}, {'domain': {'id': '10', 'name': 'Person', 'description': 'Named people in the world like Nelson Mandela'}, 'entity': {'id': '885602209618051072', 'name': 'Charli XCX', 'description': 'CHARLI XCX'}}, {'domain': {'id': '47', 'name': 'Brand', 'description': 'Brands and Companies'}, 'entity': {'id': '10026364234', 'name': 'Samsung '}}, {'domain': {'id': '48', 'name': 'Product', 'description': 'Products created by Brands.  Examples: Ford Explorer, Apple iPhone.'}, 'entity': {'id': '10026230384', 'name': 'Samsung Galaxy'}}, {'domain': {'id': '48', 'name': 'Product', 'description': 'Products created by Brands.  Examples: Ford Explorer, Apple iPhone.'}, 'entity': {'id': '10026331316', 'name': 'Samsung Mobile'}}, {'domain': {'id': '48', 'name': 'Product', 'description': 'Products created by Brands.  Examples: Ford Explorer, Apple iPhone.'}, 'entity': {'id': '10045298641', 'name': 'Samsung USA'}}, {'domain': {'id': '49', 'name': 'Product Version', 'description': ""The specific model or version of a product.  Examples: Audi A8, Ben & Jerry's Chocolate Chip Ice Cream""}, 'entity': {'id': '10040464729', 'name': 'Samsung Mobile UK'}}, {'domain': {'id': '49', 'name': 'Product Version', 'description': ""The specific model or version of a product.  Examples: Audi A8, Ben & Jerry's Chocolate Chip Ice Cream""}, 'entity': {'id': '10041364617', 'name': 'Samsung Mobile US'}}, {'domain': {'id': '54', 'name': 'Musician', 'description': 'A musician in the world, like Adele or Bob Dylan'}, 'entity': {'id': '885602209618051072', 'name': 'Charli XCX', 'description': 'CHARLI XCX'}}, {'domain': {'id': '55', 'name': 'Music Genre', 'description': 'A category for a musical style, like Pop, Rock, or Rap'}, 'entity': {'id': '810938279801470977', 'name': 'Pop', 'description': 'Pop'}}, {'domain': {'id': '30', 'name': 'Entities [Entity Service]', 'description': 'Entity Service top level domain, every item that is in Entity Service should be in this domain'}, 'entity': {'id': '848920371311001600', 'name': 'Technology', 'description': 'Technology and computing'}}, {'domain': {'id': '66', 'name': 'Interests and Hobbies Category', 'description': 'A grouping of interests and hobbies entities, like Novelty Food or Destinations'}, 'entity': {'id': '848920700073123840', 'name': 'Cell Phones', 'description': 'Cell phones'}}, {'domain': {'id': '30', 'name': 'Entities [Entity Service]', 'description': 'Entity Service top level domain, every item that is in Entity Service should be in this domain'}, 'entity': {'id': '848985956778561538', 'name': 'Mobile', 'description': 'Mobile'}}]","{'urls': [{'start': 177, 'end': 200, 'url': 'https://t.co/7x21bYAmUj', 'expanded_url': 'https://rblx.co/SuperstarGalaxy', 'display_url': 'rblx.co/SuperstarGalaxy', 'images': [{'url': 'https://pbs.twimg.com/news_img/1537904189233213440/tSREOdVz?format=jpg&name=orig', 'width': 498, 'height': 280}, {'url': 'https://pbs.twimg.com/news_img/1537904189233213440/tSREOdVz?format=jpg&name=150x150', 'width': 150, 'height': 150}], 'status': 200, 'title': '[🔊 BOOMBOX UPDATE 🔊] Samsung Superstar Galaxy', 'description': 'Check out [🔊 BOOMBOX UPDATE 🔊] Samsung Superstar Galaxy. It’s one of the millions of unique, user-generated 3D experiences created on Roblox. [🔊 BOOMBOX UPDATE 🔊] Samsung Superstar Galaxy JUNE 10 UPDATE / ONE WEEK TIL CHARLI XCX TAKES THE SAMSUNG STAGE! 🏟 / GRAB THE BOOMBOX ACCESSORY 🔊/ PLAY THE NEW ASTEROID OBBY ☄️ / NEW SONGS 🎵 / IMPROVED DIFFICULTY + MORE! Ready to become the Galaxy’s greatest superstar? 💫 In Superstar Galaxy, you can dance along to your favorite Charli XCX songs, perform on stage for all your friends, and customize your look and stage props! Perfect your pop star persona now! There’s only one more week til you can take the stage with Charli XCX! STARTING JUNE 17 AT 7PM EST 🎤 Unlock exclusive Charli XCX items ⭐️ Earn Star Power to unlock new gear 🚀 Explore the Superstar space station 🏗 Customize your own pop star stage 💖 PERFORM YOUR HEART OUT NEW ZONES, SONGS, AND OUTFITS UNLOCKED EVERY WEEK! 🌆 CYBER CITY OUT NOW! 🎡 SUNFEST VALLEY OUT NOW! 👽 COSMIC W', 'unwound_url': 'https://www.roblox.com/games/9426082120/BOOMBOX-UPDATE-Samsung-Superstar-Galaxy'}, {'start': 201, 'end': 224, 'url': 'https://t.co/jL8dgD2FOe', 'expanded_url': 'https://twitter.com/Roblox/status/1537904144605859840/photo/1', 'display_url': 'pic.twitter.com/jL8dgD2FOe', 'media_key': '3_1537904030067724290'}], 'annotations': [{'start': 17, 'end': 26, 'probability': 0.3106, 'type': 'Person', 'normalized_text': 'Charli XCX'}, {'start': 114, 'end': 120, 'probability': 0.6338, 'type': 'Product', 'normalized_text': 'Samsung'}], 'mentions': [{'start': 99, 'end': 110, 'username': 'charli_xcx', 'id': '103012173'}]}",{'media_keys': ['3_1537904030067724290']},False,,everyone,Twitter Web App
1537904423669620738,1312411467422064640,@Roblox @charli_xcx ratio,2022-06-17 21:06:02+00:00,,0,2,1,0,en,1537904144605859840,"[{'domain': {'id': '71', 'name': 'Video Game', 'description': 'A video game like Overwatch'}, 'entity': {'id': '1088118927580774400', 'name': 'Roblox', 'description': 'Roblox'}}, {'domain': {'id': '10', 'name': 'Person', 'description': 'Named people in the world like Nelson Mandela'}, 'entity': {'id': '885602209618051072', 'name': 'Charli XCX', 'description': 'CHARLI XCX'}}, {'domain': {'id': '54', 'name': 'Musician', 'description': 'A musician in the world, like Adele or Bob Dylan'}, 'entity': {'id': '885602209618051072', 'name': 'Charli XCX', 'description': 'CHARLI XCX'}}, {'domain': {'id': '55', 'name': 'Music Genre', 'description': 'A category for a musical style, like Pop, Rock, or Rap'}, 'entity': {'id': '810938279801470977', 'name': 'Pop', 'description': 'Pop'}}]","{'mentions': [{'start': 0, 'end': 7, 'username': 'Roblox', 'id': '16745055'}, {'start': 8, 'end': 19, 'username': 'charli_xcx', 'id': '103012173'}]}",,False,,everyone,Twitter Web App
1537909420574724097,1378034143162949639,@Shrimp_Roblox @Socka_boy @Roblox_RTC (Shes been in there for 3 days now) and it's been really stressing me out. I know that I my grandma's troubles shouldn't be an excuse for how I've been in these replies but I hope that it'll help salt the wound. If there is anything else that is needed of me in repaying my debt,2022-06-17 21:25:53+00:00,,0,2,0,0,en,1537907089867034624,[],"{'mentions': [{'start': 0, 'end': 14, 'username': 'Shrimp_Roblox', 'id': '1442125646726004745'}, {'start': 15, 'end': 25, 'username': 'Socka_boy', 'id': '1246678052576215040'}, {'start': 26, 'end': 37, 'username': 'Roblox_RTC', 'id': '1056053249470541824'}]}",,False,,everyone,Twitter for Android
1537908987483463680,1240709806547222528,@Socka_boy @Roblox_RTC Agreed,2022-06-17 21:24:10+00:00,,0,1,0,0,en,1537907089867034624,[],"{'mentions': [{'start': 0, 'end': 10, 'username': 'Socka_boy', 'id': '1246678052576215040'}, {'start': 11, 'end': 22, 'username': 'Roblox_RTC', 'id': '1056053249470541824'}]}",,False,,everyone,Twitter for Android
1537908735003086849,1104048876867276800,"This isn’t spoken about enough. 

 https://t.co/jGkMTzSMIN",2022-06-17 21:23:10+00:00,,14,9,414,8,en,1537908735003086849,[],"{'urls': [{'start': 35, 'end': 58, 'url': 'https://t.co/jGkMTzSMIN', 'expanded_url': 'https://twitter.com/SkySportsPL/status/1112811778235351040/video/1', 'display_url': 'pic.twitter.com/jGkMTzSMIN', 'media_key': '13_1112810402721775618'}]}",{'media_keys': ['13_1112810402721775618']},False,,everyone,Twitter for iPhone
1537908909947596804,1378034143162949639,"@Shrimp_Roblox @Socka_boy @Roblox_RTC You know what, you're right. I apologize to not only you but the person that I responded to. I was really immature in the way that I responded and I hope that you can forgive me. I've been going through a lot ever since  my grandma got stuck in the bathroom",2022-06-17 21:23:51+00:00,,0,2,1,0,en,1537907089867034624,[],"{'mentions': [{'start': 0, 'end': 14, 'username': 'Shrimp_Roblox', 'id': '1442125646726004745'}, {'start': 15, 'end': 25, 'username': 'Socka_boy', 'id': '1246678052576215040'}, {'start': 26, 'end': 37, 'username': 'Roblox_RTC', 'id': '1056053249470541824'}]}",,False,,everyone,Twitter for Android
1537783233999429640,4429003533,.@Charli_XCX’s virtual Roblox concert with Samsung premieres tonight at 7pm ET. https://t.co/yeYKb1TRKx,2022-06-17 13:04:28+00:00,,171,122,2962,193,en,1537783233999429640,"[{'domain': {'id': '47', 'name': 'Brand', 'description': 'Brands and Companies'}, 'entity': {'id': '1174344555111469057', 'name': 'Samsung Indonesia'}}, {'domain': {'id': '71', 'name': 'Video Game', 'description': 'A video game like Overwatch'}, 'entity': {'id': '1088118927580774400', 'name': 'Roblox', 'description': 'Roblox'}}, {'domain': {'id': '10', 'name': 'Person', 'description': 'Named people in the world like Nelson Mandela'}, 'entity': {'id': '885602209618051072', 'name': 'Charli XCX', 'description': 'CHARLI XCX'}}, {'domain': {'id': '47', 'name': 'Brand', 'description': 'Brands and Companies'}, 'entity': {'id': '10026364234', 'name': 'Samsung '}}, {'domain': {'id': '48', 'name': 'Product', 'description': 'Products created by Brands.  Examples: Ford Explorer, Apple iPhone.'}, 'entity': {'id': '10045298641', 'name': 'Samsung USA'}}, {'domain': {'id': '54', 'name': 'Musician', 'description': 'A musician in the world, like Adele or Bob Dylan'}, 'entity': {'id': '885602209618051072', 'name': 'Charli XCX', 'description': 'CHARLI XCX'}}, {'domain': {'id': '55', 'name': 'Music Genre', 'description': 'A category for a musical style, like Pop, Rock, or Rap'}, 'entity': {'id': '810938279801470977', 'name': 'Pop', 'description': 'Pop'}}]","{'urls': [{'start': 80, 'end': 103, 'url': 'https://t.co/yeYKb1TRKx', 'expanded_url': 'https://twitter.com/PopCrave/status/1537783233999429640/photo/1', 'display_url': 'pic.twitter.com/yeYKb1TRKx', 'media_key': '3_1537783230702682113'}], 'annotations': [{'start': 23, 'end': 28, 'probability': 0.4467, 'type': 'Product', 'normalized_text': 'Roblox'}, {'start': 43, 'end': 49, 'probability': 0.6581, 'type': 'Organization', 'normalized_text': 'Samsung'}], 'mentions': [{'start': 1, 'end': 12, 'username': 'charli_xcx', 'id': '103012173'}]}",{'media_keys': ['3_1537783230702682113']},False,,everyone,Buffer
1537832714077732864,1330315562170380289,@WilburSoot @ConnorEatsPants @jschlatt penis,2022-06-17 16:21:05+00:00,,0,1,27,0,in,1537832641684291584,"[{'domain': {'id': '10', 'name': 'Person', 'description': 'Named people in the world like Nelson Mandela'}, 'entity': {'id': '1253661551615045633', 'name': 'ConnorEatsPants'}}, {'domain': {'id': '10', 'name': 'Person', 'description': 'Named people in the world like Nelson Mandela'}, 'entity': {'id': '1253712982791516161', 'name': 'Wilbur Soot'}}, {'domain': {'id': '10', 'name': 'Person', 'description': 'Named people in the world like Nelson Mandela'}, 'entity': {'id': '1253736905218289664', 'name': 'Schlatt'}}, {'domain': {'id': '120', 'name': 'Digital Creator', 'description': 'Influencers who create content on digital platforms'}, 'entity': {'id': '1253661551615045633', 'name': 'ConnorEatsPants'}}, {'domain': {'id': '120', 'name': 'Digital Creator', 'description': 'Influencers who create content on digital platforms'}, 'entity': {'id': '1253712982791516161', 'name': 'Wilbur Soot'}}, {'domain': {'id': '120', 'name': 'Digital Creator', 'description': 'Influencers who create content on digital platforms'}, 'entity': {'id': '1253736905218289664', 'name': 'Schlatt'}}, {'domain': {'id': '136', 'name': 'Video Game Personality ', 'description': ''}, 'entity': {'id': '1253712982791516161', 'name': 'Wilbur Soot'}}]","{'mentions': [{'start': 0, 'end': 11, 'username': 'WilburSoot', 'id': '2174576629'}, {'start': 12, 'end': 28, 'username': 'ConnorEatsPants', 'id': '1049716874'}, {'start': 29, 'end': 38, 'username': 'jschlatt', 'id': '4694011844'}]}",,False,,everyone,Twitter for iPhone
1537909118278610944,1390138000743440384,@SealsLuv Roblox,2022-06-17 21:24:41+00:00,,0,1,0,0,en,1537905643721756672,"[{'domain': {'id': '71', 'name': 'Video Game', 'description': 'A video game like Overwatch'}, 'entity': {'id': '1088118927580774400', 'name': 'Roblox', 'description': 'Roblox'}}]","{'mentions': [{'start': 0, 'end': 9, 'username': 'SealsLuv', 'id': '1185926327674630145'}]}",,False,,everyone,Twitter Web App
1537906163857051648,1004392807522553856,a,2022-06-17 21:12:57+00:00,,1582,2620,45742,97,qst,1537906163857051648,[],,,False,,everyone,Twitter Web App
1537904509858373636,1283789942791995392,"@Roblox @charli_xcx Roblox, there is a guy with a model that automatically bans people when they put it in a game. You guys only care about your sponsors. Your “support” team has ghosted me 3 times, and my friend lost hundreds of dollars with his account for doing nothing. Fix your moderation.",2022-06-17 21:06:22+00:00,,2,7,41,0,en,1537904144605859840,"[{'domain': {'id': '3', 'name': 'TV Shows', 'description': 'Television shows from around the world'}, 'entity': {'id': '10058144212', 'name': 'Ghosted: Love Gone Missing', 'description': 'Investigadores ajudam pessoas angustiadas a localizar e confrontar pessoas que desapareceram, interrompendo todas as comunicações.'}}, {'domain': {'id': '71', 'name': 'Video Game', 'description': 'A video game like Overwatch'}, 'entity': {'id': '1088118927580774400', 'name': 'Roblox', 'description': 'Roblox'}}, {'domain': {'id': '10', 'name': 'Person', 'description': 'Named people in the world like Nelson Mandela'}, 'entity': {'id': '885602209618051072', 'name': 'Charli XCX', 'description': 'CHARLI XCX'}}, {'domain': {'id': '54', 'name': 'Musician', 'description': 'A musician in the world, like Adele or Bob Dylan'}, 'entity': {'id': '885602209618051072', 'name': 'Charli XCX', 'description': 'CHARLI XCX'}}, {'domain': {'id': '55', 'name': 'Music Genre', 'description': 'A category for a musical style, like Pop, Rock, or Rap'}, 'entity': {'id': '810938279801470977', 'name': 'Pop', 'description': 'Pop'}}]","{'mentions': [{'start': 0, 'end': 7, 'username': 'Roblox', 'id': '16745055'}, {'start': 8, 'end': 19, 'username': 'charli_xcx', 'id': '103012173'}]}",,False,,everyone,Twitter for iPhone
1537833602322407426,1119411285966368769,@WilburSoot @ConnorEatsPants @jschlatt that fridge magnet is the new Hollywood walk of fame,2022-06-17 16:24:37+00:00,,1,1,81,0,en,1537832641684291584,"[{'domain': {'id': '10', 'name': 'Person', 'description': 'Named people in the world like Nelson Mandela'}, 'entity': {'id': '1253661551615045633', 'name': 'ConnorEatsPants'}}, {'domain': {'id': '10', 'name': 'Person', 'description': 'Named people in the world like Nelson Mandela'}, 'entity': {'id': '1253712982791516161', 'name': 'Wilbur Soot'}}, {'domain': {'id': '10', 'name': 'Person', 'description': 'Named people in the world like Nelson Mandela'}, 'entity': {'id': '1253736905218289664', 'name': 'Schlatt'}}, {'domain': {'id': '120', 'name': 'Digital Creator', 'description': 'Influencers who create content on digital platforms'}, 'entity': {'id': '1253661551615045633', 'name': 'ConnorEatsPants'}}, {'domain': {'id': '120', 'name': 'Digital Creator', 'description': 'Influencers who create content on digital platforms'}, 'entity': {'id': '1253712982791516161', 'name': 'Wilbur Soot'}}, {'domain': {'id': '120', 'name': 'Digital Creator', 'description': 'Influencers who create content on digital platforms'}, 'entity': {'id': '1253736905218289664', 'name': 'Schlatt'}}, {'domain': {'id': '136', 'name': 'Video Game Personality ', 'description': ''}, 'entity': {'id': '1253712982791516161', 'name': 'Wilbur Soot'}}]","{'annotations': [{'start': 69, 'end': 77, 'probability': 0.3374, 'type': 'Place', 'normalized_text': 'Hollywood'}], 'mentions': [{'start': 0, 'end': 11, 'username': 'WilburSoot', 'id': '2174576629'}, {'start': 12, 'end': 28, 'username': 'ConnorEatsPants', 'id': '1049716874'}, {'start': 29, 'end': 38, 'username': 'jschlatt', 'id': '4694011844'}]}",,False,,everyone,Twitter for iPhone
1537908259830394882,1317651107351568384,@hyunhonies DE DONDE ES EL JUEGO,2022-06-17 21:21:16+00:00,,0,1,0,0,es,1537842531932721153,[],"{'mentions': [{'start': 0, 'end': 11, 'username': 'hyunhonies', 'id': '1266790524016525313'}]}",,False,,everyone,Twitter for iPhone
1537908946820042752,1185926327674630145,"@d1avololi They’re annoying asf bruh LMAO
I remember seeing a sam cosplayer while playing roblox with a friend that was exploiting but they were so bad at it that we still killed them anyway",2022-06-17 21:24:00+00:00,,0,1,0,0,en,1537905643721756672,"[{'domain': {'id': '65', 'name': 'Interests and Hobbies Vertical', 'description': 'Top level interests and hobbies groupings, like Food or Travel'}, 'entity': {'id': '1280550787207147521', 'name': 'Arts & culture'}}, {'domain': {'id': '66', 'name': 'Interests and Hobbies Category', 'description': 'A grouping of interests and hobbies entities, like Novelty Food or Destinations'}, 'entity': {'id': '1047106191829028865', 'name': 'Cosplay', 'description': 'Cosplay'}}, {'domain': {'id': '71', 'name': 'Video Game', 'description': 'A video game like Overwatch'}, 'entity': {'id': '1088118927580774400', 'name': 'Roblox', 'description': 'Roblox'}}]","{'annotations': [{'start': 62, 'end': 74, 'probability': 0.7456, 'type': 'Person', 'normalized_text': 'sam cosplayer'}], 'mentions': [{'start': 0, 'end': 10, 'username': 'd1avololi', 'id': '1390138000743440384'}]}",,False,,everyone,Twitter for iPhone
