tweetid,author_id,text,created_at,geo,retweets,replies,likes,quote_count,lang,conversation_id,context_annotations,entities,attachments,possibly_sensitive,withheld,reply_settings,source
1530657495601094664,778450189627498496,"10,000 Robux Giveaway!

HOW TO ENTER:
Follow @VuxxVuxx
Like + Retweet
Reply “Vux”

Winner picked this Monday. Good luck! https://t.co/GE49QFHOsR",2022-05-28 21:09:19+00:00,,1098,1455,1449,17,en,1530657495601094664,[],"{'urls': [{'start': 121, 'end': 144, 'url': 'https://t.co/GE49QFHOsR', 'expanded_url': 'https://twitter.com/VuxxVuxx/status/1530657495601094664/photo/1', 'display_url': 'pic.twitter.com/GE49QFHOsR', 'media_key': '3_1530657491499065347'}], 'mentions': [{'start': 45, 'end': 54, 'username': 'VuxxVuxx', 'id': '778450189627498496'}]}",{'media_keys': ['3_1530657491499065347']},False,,everyone,Twitter for iPhone
1530948802508627968,1417587809502826500,"PROBLEMAS: O DevForum do Roblox está fora do ar de novo. Já se passaram mais de 3 horas desde o início do incidente.

Essa queda não irá afetar sua jogabilidade no Roblox. https://t.co/9b986V1m0M",2022-05-29 16:26:52+00:00,,5,5,31,0,pt,1530948802508627968,"[{'domain': {'id': '71', 'name': 'Video Game', 'description': 'A video game like Overwatch'}, 'entity': {'id': '1088118927580774400', 'name': 'Roblox', 'description': 'Roblox'}}]","{'annotations': [{'start': 25, 'end': 30, 'probability': 0.3014, 'type': 'Product', 'normalized_text': 'Roblox'}], 'urls': [{'start': 172, 'end': 195, 'url': 'https://t.co/9b986V1m0M', 'expanded_url': 'https://twitter.com/Roblox_RTC_BR/status/1530948802508627968/photo/1', 'display_url': 'pic.twitter.com/9b986V1m0M', 'media_key': '3_1530948594110545921'}]}",{'media_keys': ['3_1530948594110545921']},False,,everyone,Twitter Web App
1530942731975110658,1172298824531857408,"@Roblox_RTC People need to stop making Pokémon games on the platform already, it's just plain annoying to have a game constantly reuploaded over and over because the devs just refuse to let it go.",2022-05-29 16:02:45+00:00,,0,6,3,1,en,1530894099598958592,"[{'domain': {'id': '45', 'name': 'Brand Vertical', 'description': 'Top level entities that describe a Brands industry'}, 'entity': {'id': '781974597310615553', 'name': 'Entertainment'}}, {'domain': {'id': '46', 'name': 'Brand Category', 'description': 'Categories within Brand Verticals that narrow down the scope of Brands'}, 'entity': {'id': '781974597218340864', 'name': 'Video Games'}}, {'domain': {'id': '130', 'name': 'Multimedia Franchise', 'description': ""Franchises which span multiple forms of media like 'Harry Potter'""}, 'entity': {'id': '10045599546', 'name': 'Pokémon', 'description': 'This entity includes all conversation about the franchise, as well as any individual installments in the series, if applicable. **NOTE: Annotations redirected to domain 130 ONLY on 8/7/18.'}}]","{'annotations': [{'start': 39, 'end': 45, 'probability': 0.6413, 'type': 'Product', 'normalized_text': 'Pokémon'}], 'mentions': [{'start': 0, 'end': 11, 'username': 'Roblox_RTC', 'id': '1056053249470541824'}]}",,False,,everyone,Twitter for Android
1530606308579086336,1069006874811363328,Starting off with summer fun! I'm going to giveaway this rainbow huge unicorn to anyone that likes and comments! :O https://t.co/WQVhBBBiIo,2022-05-28 17:45:55+00:00,,208,2070,2581,10,en,1530606308579086336,[],"{'urls': [{'start': 116, 'end': 139, 'url': 'https://t.co/WQVhBBBiIo', 'expanded_url': 'https://twitter.com/DigitoPlays/status/1530606308579086336/photo/1', 'display_url': 'pic.twitter.com/WQVhBBBiIo', 'media_key': '3_1530606087442862081'}]}",{'media_keys': ['3_1530606087442862081']},False,,everyone,Twitter Web App
1530845437636362240,1417382892381089817,"@memeumonster @humanoid_fish @Zilancer_ @JennyCelzo @Roblox_RTC I never mentioned you wanted to change my opinion, I just noted that if you disagree with someone’s opinion, just don’t reply and be a bitch about it?",2022-05-29 09:36:08+00:00,,0,1,2,0,en,1529775508656881664,[],"{'mentions': [{'start': 0, 'end': 13, 'username': 'memeumonster', 'id': '1454672731916496902'}, {'start': 14, 'end': 28, 'username': 'humanoid_fish', 'id': '1268508413492891648'}, {'start': 29, 'end': 39, 'username': 'Zilancer_', 'id': '1432279603654037504'}, {'start': 40, 'end': 51, 'username': 'JennyCelzo', 'id': '3272613966'}, {'start': 52, 'end': 63, 'username': 'Roblox_RTC', 'id': '1056053249470541824'}]}",,False,,everyone,Twitter for iPhone
1530655153422049282,1338782938423578624,"The final version of the climbing system! 😍

The path of creation was not easy, but I coped, and I coped thanks to your feedback and notes😊

#Roblox #RobloxDev #game #gamedev https://t.co/yPSc2iKq1t",2022-05-28 21:00:01+00:00,,87,53,855,4,en,1530655153422049282,"[{'domain': {'id': '71', 'name': 'Video Game', 'description': 'A video game like Overwatch'}, 'entity': {'id': '1088118927580774400', 'name': 'Roblox', 'description': 'Roblox'}}]","{'hashtags': [{'start': 141, 'end': 148, 'tag': 'Roblox'}, {'start': 149, 'end': 159, 'tag': 'RobloxDev'}, {'start': 160, 'end': 165, 'tag': 'game'}, {'start': 166, 'end': 174, 'tag': 'gamedev'}], 'urls': [{'start': 175, 'end': 198, 'url': 'https://t.co/yPSc2iKq1t', 'expanded_url': 'https://twitter.com/DanielM00512725/status/1530655153422049282/video/1', 'display_url': 'pic.twitter.com/yPSc2iKq1t', 'media_key': '7_1530653373027995652'}]}",{'media_keys': ['7_1530653373027995652']},False,,everyone,Twitter Web App
1530632762373316610,1498321566115012611,"MUTUALS!!
SEND YOUR OC NOWWW
needing examples for com sheet &lt;3
any gender is fine, as im trying to draw guys",2022-05-28 19:31:02+00:00,,5,6,24,0,en,1530632762373316610,[],,,False,,following,Twitter Web App
1530940727470960641,349249475,Children love roblox and YouTube the most.  Or watching roblox on YouTube. $rblx $goog,2022-05-29 15:54:47+00:00,,15,41,380,3,en,1530940727470960641,"[{'domain': {'id': '47', 'name': 'Brand', 'description': 'Brands and Companies'}, 'entity': {'id': '10043803050', 'name': 'Alphabet Inc.'}}, {'domain': {'id': '71', 'name': 'Video Game', 'description': 'A video game like Overwatch'}, 'entity': {'id': '1088118927580774400', 'name': 'Roblox', 'description': 'Roblox'}}, {'domain': {'id': '165', 'name': 'Technology', 'description': 'for individual and types of technology, e.g., food technology, 3D printing'}, 'entity': {'id': '1196446161223028736', 'name': 'Social media'}}, {'domain': {'id': '166', 'name': 'Stocks', 'description': 'for individual and types of stocks, e.g., $TRX, $QQQ'}, 'entity': {'id': '1306713906467885056', 'name': '$GOOG'}}, {'domain': {'id': '46', 'name': 'Brand Category', 'description': 'Categories within Brand Verticals that narrow down the scope of Brands'}, 'entity': {'id': '781974596752842752', 'name': 'Services'}}, {'domain': {'id': '47', 'name': 'Brand', 'description': 'Brands and Companies'}, 'entity': {'id': '10029382357', 'name': 'YouTube'}}, {'domain': {'id': '47', 'name': 'Brand', 'description': 'Brands and Companies'}, 'entity': {'id': '10043803050', 'name': 'Alphabet Inc.'}}, {'domain': {'id': '65', 'name': 'Interests and Hobbies Vertical', 'description': 'Top level interests and hobbies groupings, like Food or Travel'}, 'entity': {'id': '781974596148793345', 'name': 'Business & finance'}}, {'domain': {'id': '66', 'name': 'Interests and Hobbies Category', 'description': 'A grouping of interests and hobbies entities, like Novelty Food or Destinations'}, 'entity': {'id': '847888632711061504', 'name': 'Personal finance', 'description': 'Personal finance'}}, {'domain': {'id': '67', 'name': 'Interests and Hobbies', 'description': 'Interests, opinions, and behaviors of individuals, groups, or cultures; like Speciality Cooking or Theme Parks'}, 'entity': {'id': '847894852779900928', 'name': 'Stocks & indices', 'description': 'Stocks'}}]","{'annotations': [{'start': 25, 'end': 31, 'probability': 0.5992, 'type': 'Product', 'normalized_text': 'YouTube'}, {'start': 66, 'end': 72, 'probability': 0.7338, 'type': 'Product', 'normalized_text': 'YouTube'}], 'cashtags': [{'start': 75, 'end': 80, 'tag': 'rblx'}, {'start': 81, 'end': 86, 'tag': 'goog'}]}",,False,,everyone,Twitter for iPhone
1530844859875065856,1218660932659896321,@Marvelizd game?,2022-05-29 09:33:50+00:00,,0,1,1,0,en,1530766198828318721,[],"{'mentions': [{'start': 0, 'end': 10, 'username': 'Marvelizd', 'id': '3044736406'}]}",,False,,everyone,Twitter for iPhone
1530371055268798464,1381791662758854656,❌‧彡Yo nunca he mentido sobre los años que tengo,2022-05-28 02:11:07+00:00,,0,1,1,18,es,1530367728036585474,[],,,False,,everyone,Twitter Web App
1530476934878179328,899494453974577152,https://t.co/pw9wP61KaV,2022-05-28 09:11:50+00:00,,192,2418,2905,3101,zxx,1530476934878179328,[],"{'urls': [{'start': 0, 'end': 23, 'url': 'https://t.co/pw9wP61KaV', 'expanded_url': 'https://twitter.com/replicantpinky/status/1530476934878179328/photo/1', 'display_url': 'pic.twitter.com/pw9wP61KaV', 'media_key': '3_1530476932063715328'}]}",{'media_keys': ['3_1530476932063715328']},False,,everyone,Twitter for iPhone
1460289466103336961,16745055,"Roblox believes in supporting hands-on learning. That’s why we’re proud to announce the Roblox Community Fund, an initiative supporting the innovative and hard-working educators who leverage our platform: https://t.co/jkEFUbI5tP https://t.co/ppijos5LvD",2021-11-15 16:51:54+00:00,,206,372,4309,19,en,1460289466103336961,"[{'domain': {'id': '71', 'name': 'Video Game', 'description': 'A video game like Overwatch'}, 'entity': {'id': '1088118927580774400', 'name': 'Roblox', 'description': 'Roblox'}}, {'domain': {'id': '65', 'name': 'Interests and Hobbies Vertical', 'description': 'Top level interests and hobbies groupings, like Food or Travel'}, 'entity': {'id': '847546154439000064', 'name': 'Education', 'description': 'Education through the lens of those passionate about resources and news. This topic excludes Education policy and reform.'}}, {'domain': {'id': '65', 'name': 'Interests and Hobbies Vertical', 'description': 'Top level interests and hobbies groupings, like Food or Travel'}, 'entity': {'id': '847868745150119936', 'name': 'Family & relationships', 'description': 'Hobbies and interests'}}]","{'annotations': [{'start': 0, 'end': 5, 'probability': 0.6111, 'type': 'Organization', 'normalized_text': 'Roblox'}, {'start': 88, 'end': 108, 'probability': 0.753, 'type': 'Organization', 'normalized_text': 'Roblox Community Fund'}], 'urls': [{'start': 205, 'end': 228, 'url': 'https://t.co/jkEFUbI5tP', 'expanded_url': 'http://rblx.co/CommunityFund', 'display_url': 'rblx.co/CommunityFund', 'images': [{'url': 'https://pbs.twimg.com/news_img/1478344831088873478/3CsJgbEU?format=jpg&name=orig', 'width': 1920, 'height': 1080}, {'url': 'https://pbs.twimg.com/news_img/1478344831088873478/3CsJgbEU?format=jpg&name=150x150', 'width': 150, 'height': 150}], 'status': 200, 'title': 'Introducing the Roblox Community Fund - Roblox Blog', 'description': 'Launching the Roblox Community Fund to support the next chapter of our educational expansion.', 'unwound_url': 'https://blog.roblox.com/2021/11/introducing-roblox-community-fund/'}, {'start': 229, 'end': 252, 'url': 'https://t.co/ppijos5LvD', 'expanded_url': 'https://twitter.com/Roblox/status/1460289466103336961/photo/1', 'display_url': 'pic.twitter.com/ppijos5LvD', 'media_key': '3_1460289193540657152'}]}",{'media_keys': ['3_1460289193540657152']},False,,everyone,Twitter Web App
1530948864471191553,1319599324851019777,"@Celebirteas Thats an idea, but i feel like it's not that special...or unique.",2022-05-29 16:27:07+00:00,,0,1,1,0,en,1530948144246272001,[],"{'mentions': [{'start': 0, 'end': 12, 'username': 'Celebirteas', 'id': '2510399959'}]}",,False,,everyone,Twitter for Android
1530685343485370368,2782793664,"Yo @Roblox please, it's time to make this LIMITED! 👀 https://t.co/yXxY0NTDDN",2022-05-28 22:59:59+00:00,,27,44,449,1,en,1530685343485370368,"[{'domain': {'id': '71', 'name': 'Video Game', 'description': 'A video game like Overwatch'}, 'entity': {'id': '1088118927580774400', 'name': 'Roblox', 'description': 'Roblox'}}]","{'urls': [{'start': 53, 'end': 76, 'url': 'https://t.co/yXxY0NTDDN', 'expanded_url': 'https://twitter.com/Lonnwick/status/1530685343485370368/photo/1', 'display_url': 'pic.twitter.com/yXxY0NTDDN', 'media_key': '3_1530685263839522816'}], 'mentions': [{'start': 3, 'end': 10, 'username': 'Roblox', 'id': '16745055'}]}",{'media_keys': ['3_1530685263839522816']},False,,everyone,Twitter Web App
1530939431842197504,1292535447764250625,"@ben_labell @Roblox_RTC No it doesn't. Tbradm already made a statement saying if people upload versions of Brick Bronze and people play them, then it is disrespectful to the devs that actually worked on Brick Bronze.",2022-05-29 15:49:38+00:00,,0,4,7,0,en,1530894099598958592,[],"{'annotations': [{'start': 107, 'end': 118, 'probability': 0.5997, 'type': 'Product', 'normalized_text': 'Brick Bronze'}, {'start': 203, 'end': 214, 'probability': 0.4757, 'type': 'Product', 'normalized_text': 'Brick Bronze'}], 'mentions': [{'start': 0, 'end': 11, 'username': 'ben_labell', 'id': '1297201670439526401'}, {'start': 12, 'end': 23, 'username': 'Roblox_RTC', 'id': '1056053249470541824'}]}",,False,,everyone,Twitter Web App
1530943609553420290,1505671642365759489,@DarkForceIsaac @Roblox_RTC Fr it’s here to stay idk why people complaining,2022-05-29 16:06:14+00:00,,0,1,0,0,en,1530894099598958592,[],"{'mentions': [{'start': 0, 'end': 15, 'username': 'DarkForceIsaac', 'id': '751204221706436608'}, {'start': 16, 'end': 27, 'username': 'Roblox_RTC', 'id': '1056053249470541824'}]}",,False,,everyone,Twitter Web App
1530894099598958592,1056053249470541824,"Some players are calling for THIS Pokémon Brick Bronze copy to go..

It keeps getting deleted &amp; going back up, making players who want it gone frustrated. Some say this violates nintendos IP - &amp; disrespects the original developers. https://t.co/a0uKEGX4WC",2022-05-29 12:49:30+00:00,,50,161,1095,10,en,1530894099598958592,"[{'domain': {'id': '45', 'name': 'Brand Vertical', 'description': 'Top level entities that describe a Brands industry'}, 'entity': {'id': '781974597310615553', 'name': 'Entertainment'}}, {'domain': {'id': '46', 'name': 'Brand Category', 'description': 'Categories within Brand Verticals that narrow down the scope of Brands'}, 'entity': {'id': '781974597218340864', 'name': 'Video Games'}}, {'domain': {'id': '47', 'name': 'Brand', 'description': 'Brands and Companies'}, 'entity': {'id': '10026713294', 'name': 'Nintendo'}}, {'domain': {'id': '78', 'name': 'Video Game Publisher', 'description': ""A Video Game Publisher like 'Activision'""}, 'entity': {'id': '10026713294', 'name': 'Nintendo'}}, {'domain': {'id': '130', 'name': 'Multimedia Franchise', 'description': ""Franchises which span multiple forms of media like 'Harry Potter'""}, 'entity': {'id': '10045599546', 'name': 'Pokémon', 'description': 'This entity includes all conversation about the franchise, as well as any individual installments in the series, if applicable. **NOTE: Annotations redirected to domain 130 ONLY on 8/7/18.'}}]","{'annotations': [{'start': 34, 'end': 53, 'probability': 0.8036, 'type': 'Product', 'normalized_text': 'Pokémon Brick Bronze'}], 'urls': [{'start': 240, 'end': 263, 'url': 'https://t.co/a0uKEGX4WC', 'expanded_url': 'https://twitter.com/Roblox_RTC/status/1530894099598958592/photo/1', 'display_url': 'pic.twitter.com/a0uKEGX4WC', 'media_key': '3_1530894096679698432'}]}",{'media_keys': ['3_1530894096679698432']},False,,everyone,Twitter for iPhone
1530948795558674433,1352046290121748480,. @rantotheboofan @byersloves I’ve just found the most wonderful game get on roblox right now.,2022-05-29 16:26:51+00:00,,0,2,3,0,en,1530948795558674433,"[{'domain': {'id': '71', 'name': 'Video Game', 'description': 'A video game like Overwatch'}, 'entity': {'id': '1088118927580774400', 'name': 'Roblox', 'description': 'Roblox'}}]","{'mentions': [{'start': 2, 'end': 17, 'username': 'rantotheboofan', 'id': '1398635778364821512'}]}",,False,,everyone,Twitter for iPhone
1530918542685753344,1424497224495534080,"@Roblox_RTC This has been happening for a while. People don’t acknowledge that developers of old Pokémon games have moved onto to new, original ones. Not only is this just disrespectful to the original devs, but it’s also getting Roblox in some real trouble if Nintendo sees this.",2022-05-29 14:26:38+00:00,,0,2,5,0,en,1530894099598958592,"[{'domain': {'id': '45', 'name': 'Brand Vertical', 'description': 'Top level entities that describe a Brands industry'}, 'entity': {'id': '781974597310615553', 'name': 'Entertainment'}}, {'domain': {'id': '46', 'name': 'Brand Category', 'description': 'Categories within Brand Verticals that narrow down the scope of Brands'}, 'entity': {'id': '781974597218340864', 'name': 'Video Games'}}, {'domain': {'id': '47', 'name': 'Brand', 'description': 'Brands and Companies'}, 'entity': {'id': '10026713294', 'name': 'Nintendo'}}, {'domain': {'id': '71', 'name': 'Video Game', 'description': 'A video game like Overwatch'}, 'entity': {'id': '1088118927580774400', 'name': 'Roblox', 'description': 'Roblox'}}, {'domain': {'id': '78', 'name': 'Video Game Publisher', 'description': ""A Video Game Publisher like 'Activision'""}, 'entity': {'id': '10026713294', 'name': 'Nintendo'}}, {'domain': {'id': '130', 'name': 'Multimedia Franchise', 'description': ""Franchises which span multiple forms of media like 'Harry Potter'""}, 'entity': {'id': '10045599546', 'name': 'Pokémon', 'description': 'This entity includes all conversation about the franchise, as well as any individual installments in the series, if applicable. **NOTE: Annotations redirected to domain 130 ONLY on 8/7/18.'}}]","{'annotations': [{'start': 97, 'end': 103, 'probability': 0.6493, 'type': 'Product', 'normalized_text': 'Pokémon'}, {'start': 230, 'end': 235, 'probability': 0.3794, 'type': 'Product', 'normalized_text': 'Roblox'}, {'start': 261, 'end': 268, 'probability': 0.3855, 'type': 'Product', 'normalized_text': 'Nintendo'}], 'mentions': [{'start': 0, 'end': 11, 'username': 'Roblox_RTC', 'id': '1056053249470541824'}]}",,False,,everyone,Twitter Web App
1530799451568316417,991014368023400450,"@allisonisbored trust me, i’ve got a gf i don’t actually want u lmao",2022-05-29 06:33:24+00:00,,0,1,0,0,en,1530774029241565186,[],"{'mentions': [{'start': 0, 'end': 15, 'username': 'allisonisbored', 'id': '1390678775088697350'}]}",,False,,everyone,Twitter for iPhone
1530890888632729601,1296998450291146752,@Shin_Nor @Roblox i dont see anything that caused the picture to get banned,2022-05-29 12:36:45+00:00,,2,1,1,0,en,1530782427534196741,"[{'domain': {'id': '71', 'name': 'Video Game', 'description': 'A video game like Overwatch'}, 'entity': {'id': '1088118927580774400', 'name': 'Roblox', 'description': 'Roblox'}}]","{'mentions': [{'start': 0, 'end': 9, 'username': 'Shin_Nor', 'id': '1472237048803344390'}, {'start': 10, 'end': 17, 'username': 'Roblox', 'id': '16745055'}]}",,False,,everyone,Twitter Web App
1530946661454856192,1295107823119093760,THEYRE ALL SO PRETTYYYU https://t.co/IdxSp1lXuJ,2022-05-29 16:18:22+00:00,,0,2,7,0,en,1530946661454856192,[],"{'urls': [{'start': 24, 'end': 47, 'url': 'https://t.co/IdxSp1lXuJ', 'expanded_url': 'https://twitter.com/XVIIAlexisMori/status/1530946661454856192/photo/1', 'display_url': 'pic.twitter.com/IdxSp1lXuJ', 'media_key': '3_1530946657512312833'}]}",{'media_keys': ['3_1530946657512312833']},True,,everyone,Twitter for iPhone
1530909932500963330,885646263169028096,@Roblox_RTC They need to go https://t.co/0svp8DAsAq pretty sure its illegal and can get roblox in trouble 2.Disrespect for the Loomian Legacy devs 3. Its a waste of time cause you have to start all over and the games seem to crash alot,2022-05-29 13:52:25+00:00,,0,10,4,0,en,1530894099598958592,"[{'domain': {'id': '71', 'name': 'Video Game', 'description': 'A video game like Overwatch'}, 'entity': {'id': '1088118927580774400', 'name': 'Roblox', 'description': 'Roblox'}}]","{'annotations': [{'start': 127, 'end': 147, 'probability': 0.3466, 'type': 'Other', 'normalized_text': 'Loomian Legacy devs 3'}], 'urls': [{'start': 28, 'end': 51, 'url': 'https://t.co/0svp8DAsAq', 'expanded_url': 'http://1.im', 'display_url': '1.im', 'status': 200, 'unwound_url': 'https://1.im/'}], 'mentions': [{'start': 0, 'end': 11, 'username': 'Roblox_RTC', 'id': '1056053249470541824'}]}",,False,,everyone,Twitter for iPhone
1529770336937562112,16913418,Gucci Town is coming to @Roblox. Start exploring tomorrow. #AlessandroMichele #GucciTown https://t.co/0PvtDCKUAg,2022-05-26 10:24:04+00:00,,392,799,3731,163,en,1529770336937562112,"[{'domain': {'id': '46', 'name': 'Brand Category', 'description': 'Categories within Brand Verticals that narrow down the scope of Brands'}, 'entity': {'id': '781974596807299072', 'name': 'Apparel/Accessories'}}, {'domain': {'id': '47', 'name': 'Brand', 'description': 'Brands and Companies'}, 'entity': {'id': '1266401847104827392', 'name': 'Gucci'}}, {'domain': {'id': '65', 'name': 'Interests and Hobbies Vertical', 'description': 'Top level interests and hobbies groupings, like Food or Travel'}, 'entity': {'id': '1256236649253449729', 'name': 'Fashion & beauty'}}, {'domain': {'id': '67', 'name': 'Interests and Hobbies', 'description': 'Interests, opinions, and behaviors of individuals, groups, or cultures; like Speciality Cooking or Theme Parks'}, 'entity': {'id': '839543390668673024', 'name': 'Fashion'}}, {'domain': {'id': '71', 'name': 'Video Game', 'description': 'A video game like Overwatch'}, 'entity': {'id': '1088118927580774400', 'name': 'Roblox', 'description': 'Roblox'}}]","{'annotations': [{'start': 0, 'end': 9, 'probability': 0.6118, 'type': 'Organization', 'normalized_text': 'Gucci Town'}], 'hashtags': [{'start': 59, 'end': 77, 'tag': 'AlessandroMichele'}, {'start': 78, 'end': 88, 'tag': 'GucciTown'}], 'urls': [{'start': 89, 'end': 112, 'url': 'https://t.co/0PvtDCKUAg', 'expanded_url': 'https://twitter.com/gucci/status/1529770336937562112/photo/1', 'display_url': 'pic.twitter.com/0PvtDCKUAg', 'media_key': '3_1529770322639060992'}], 'mentions': [{'start': 24, 'end': 31, 'username': 'Roblox', 'id': '16745055'}]}",{'media_keys': ['3_1529770322639060992']},False,,everyone,Twitter Web App
1530945095343783937,1396871322882482176,@100TabbyCats @gucci @Roblox Looks like trash personally it costs a lot you can just buy one from the Roblox Avatar shop and get a better one-,2022-05-29 16:12:08+00:00,,1,1,0,0,en,1529770336937562112,"[{'domain': {'id': '46', 'name': 'Brand Category', 'description': 'Categories within Brand Verticals that narrow down the scope of Brands'}, 'entity': {'id': '781974596807299072', 'name': 'Apparel/Accessories'}}, {'domain': {'id': '47', 'name': 'Brand', 'description': 'Brands and Companies'}, 'entity': {'id': '1266401847104827392', 'name': 'Gucci'}}, {'domain': {'id': '65', 'name': 'Interests and Hobbies Vertical', 'description': 'Top level interests and hobbies groupings, like Food or Travel'}, 'entity': {'id': '1256236649253449729', 'name': 'Fashion & beauty'}}, {'domain': {'id': '67', 'name': 'Interests and Hobbies', 'description': 'Interests, opinions, and behaviors of individuals, groups, or cultures; like Speciality Cooking or Theme Parks'}, 'entity': {'id': '839543390668673024', 'name': 'Fashion'}}, {'domain': {'id': '71', 'name': 'Video Game', 'description': 'A video game like Overwatch'}, 'entity': {'id': '1088118927580774400', 'name': 'Roblox', 'description': 'Roblox'}}]","{'annotations': [{'start': 102, 'end': 114, 'probability': 0.715, 'type': 'Product', 'normalized_text': 'Roblox Avatar'}], 'mentions': [{'start': 0, 'end': 13, 'username': '100TabbyCats', 'id': '1516168891768225801'}, {'start': 14, 'end': 20, 'username': 'gucci', 'id': '16913418'}, {'start': 21, 'end': 28, 'username': 'Roblox', 'id': '16745055'}]}",,False,,everyone,Twitter for Android
1530866552639262720,888867384404176896,"You just got banned in Roblox..

Your fifth emoji is your reaction...",2022-05-29 11:00:02+00:00,,48,2607,1135,22,en,1530866552639262720,"[{'domain': {'id': '71', 'name': 'Video Game', 'description': 'A video game like Overwatch'}, 'entity': {'id': '1088118927580774400', 'name': 'Roblox', 'description': 'Roblox'}}]","{'annotations': [{'start': 23, 'end': 28, 'probability': 0.4841, 'type': 'Product', 'normalized_text': 'Roblox'}]}",,False,,everyone,Twitter Web App
