tweetid,author_id,text,created_at,geo,retweets,replies,likes,quote_count,lang,conversation_id,context_annotations,entities,attachments,possibly_sensitive,withheld,reply_settings,source
1526646560028733440,1259192351324422146,"Challenge to Roblox as Epic Games open its game engine for Fortnite?
Epic Games is releasing an ""open to everybody"" Unreal Engine 5 editor for Fortnite, and will let creators monetize what they make.",2022-05-17 19:31:18+00:00,,0,1,4,0,en,1526646560028733440,"[{'domain': {'id': '71', 'name': 'Video Game', 'description': 'A video game like Overwatch'}, 'entity': {'id': '974285387987169280', 'name': 'Fortnite', 'description': 'This entity includes all conversation about the franchise, as well as any individual installments in the series, if applicable.\t\t\t'}}, {'domain': {'id': '71', 'name': 'Video Game', 'description': 'A video game like Overwatch'}, 'entity': {'id': '1088118927580774400', 'name': 'Roblox', 'description': 'Roblox'}}, {'domain': {'id': '78', 'name': 'Video Game Publisher', 'description': ""A Video Game Publisher like 'Activision'""}, 'entity': {'id': '1131277895010099201', 'name': 'Epic Games'}}]","{'annotations': [{'start': 13, 'end': 18, 'probability': 0.3452, 'type': 'Product', 'normalized_text': 'Roblox'}]}",,False,,everyone,Twitter Web App
1526649934845460486,863689794,"would u rather have 

10 dollars

or 

1 robuck👀",2022-05-17 19:44:42+00:00,,86,1779,2160,30,en,1526649934845460486,[],,,False,,everyone,Twitter for iPhone
1526653785606594561,425871040,"Arm yourself with an anomaly! 

Come pick up the unvaulted Sideways Rifle &amp; Minigun for Sideways Showdown Week. https://t.co/uzv0ccO3mw",2022-05-17 20:00:01+00:00,,373,274,6621,65,en,1526653785606594561,"[{'domain': {'id': '71', 'name': 'Video Game', 'description': 'A video game like Overwatch'}, 'entity': {'id': '974285387987169280', 'name': 'Fortnite', 'description': 'This entity includes all conversation about the franchise, as well as any individual installments in the series, if applicable.\t\t\t'}}]","{'urls': [{'start': 116, 'end': 139, 'url': 'https://t.co/uzv0ccO3mw', 'expanded_url': 'https://twitter.com/FortniteGame/status/1526653785606594561/photo/1', 'display_url': 'pic.twitter.com/uzv0ccO3mw', 'media_key': '3_1526288296405524481'}]}",{'media_keys': ['3_1526288296405524481']},False,,everyone,Twitter Media Studio
1526209528970235905,1325325793715761158,if you know me whats one thing i love,2022-05-16 14:34:41+00:00,,0,7,2,0,en,1526209528970235905,[],,,False,,everyone,Twitter for iPhone
1526653346081390595,1523578171022524416,Any actives? Might do a robux giveaway.,2022-05-17 19:58:16+00:00,,0,3,3,0,en,1526653346081390595,[],,,False,,everyone,Twitter for Android
1525168267693899776,1102772383071387648,"like if you are older than roblox
retweet if you are younger than roblox https://t.co/eOwvC97G4T",2022-05-13 17:37:05+00:00,,588,136,1078,29,en,1525168267693899776,"[{'domain': {'id': '71', 'name': 'Video Game', 'description': 'A video game like Overwatch'}, 'entity': {'id': '1088118927580774400', 'name': 'Roblox', 'description': 'Roblox'}}]","{'urls': [{'start': 73, 'end': 96, 'url': 'https://t.co/eOwvC97G4T', 'expanded_url': 'https://twitter.com/ItsAmmon/status/1525168267693899776/photo/1', 'display_url': 'pic.twitter.com/eOwvC97G4T', 'media_key': '3_1525168201176338435'}]}",{'media_keys': ['3_1525168201176338435']},False,,everyone,Twitter Web App
1526355642738425859,1315278295655686144,mr. big cheese #robloxart https://t.co/Rbi73Pl8w7,2022-05-17 00:15:18+00:00,,110,31,1086,3,en,1526355642738425859,"[{'domain': {'id': '71', 'name': 'Video Game', 'description': 'A video game like Overwatch'}, 'entity': {'id': '1088118927580774400', 'name': 'Roblox', 'description': 'Roblox'}}]","{'urls': [{'start': 26, 'end': 49, 'url': 'https://t.co/Rbi73Pl8w7', 'expanded_url': 'https://twitter.com/JanaIcedTea/status/1526355642738425859/photo/1', 'display_url': 'pic.twitter.com/Rbi73Pl8w7', 'media_key': '3_1526355609263788032'}, {'start': 26, 'end': 49, 'url': 'https://t.co/Rbi73Pl8w7', 'expanded_url': 'https://twitter.com/JanaIcedTea/status/1526355642738425859/photo/1', 'display_url': 'pic.twitter.com/Rbi73Pl8w7', 'media_key': '3_1526355637894107137'}], 'hashtags': [{'start': 15, 'end': 25, 'tag': 'robloxart'}]}","{'media_keys': ['3_1526355609263788032', '3_1526355637894107137']}",False,,everyone,Twitter for Android
1526653649799217152,1337424932,"TELL ME COUNTER STRIKE AINT THE BEST ESPORTS IN THE WORLD, HOLY FUUUUUUC IS THIS GOOD ENTERTAINMENT",2022-05-17 19:59:28+00:00,,115,21,4934,7,en,1526653649799217152,"[{'domain': {'id': '45', 'name': 'Brand Vertical', 'description': 'Top level entities that describe a Brands industry'}, 'entity': {'id': '781974597310615553', 'name': 'Entertainment'}}, {'domain': {'id': '46', 'name': 'Brand Category', 'description': 'Categories within Brand Verticals that narrow down the scope of Brands'}, 'entity': {'id': '781974597218340864', 'name': 'Video Games'}}, {'domain': {'id': '71', 'name': 'Video Game', 'description': 'A video game like Overwatch'}, 'entity': {'id': '10045347491', 'name': 'Counter-Strike', 'description': 'This entity includes all conversation about the franchise, as well as any individual installments in the series, if applicable.\t\t\t'}}]",,,False,,everyone,Twitter Web App
1526428599053582336,943675321794011136,Hey! GOT ANY GAMES ON YOUR PHONE? 👾👾👾👾👾👾 https://t.co/HOlw5jCTqs,2022-05-17 05:05:12+00:00,,26,25,557,3,en,1526428599053582336,[],"{'urls': [{'start': 41, 'end': 64, 'url': 'https://t.co/HOlw5jCTqs', 'expanded_url': 'https://twitter.com/SuckTheRainbow/status/1526428599053582336/photo/1', 'display_url': 'pic.twitter.com/HOlw5jCTqs', 'media_key': '3_1526428593345159168'}]}",{'media_keys': ['3_1526428593345159168']},False,,everyone,Twitter for iPhone
1526650528683507712,1469156373418160132,@follasion requisitos para ser mi dua,2022-05-17 19:47:04+00:00,,0,1,0,0,es,1526644059359412224,[],"{'mentions': [{'start': 0, 'end': 10, 'username': 'follasion', 'id': '1494211588324311046'}]}",,False,,everyone,Twitter for Android
1526653134742904832,1295802882260967427,@hyunjinfrenica di,2022-05-17 19:57:25+00:00,,0,1,0,0,und,1526649739340570625,[],"{'mentions': [{'start': 0, 'end': 15, 'username': 'hyunjinfrenica', 'id': '1505770715995328512'}]}",,False,,everyone,Twitter for Android
1526300073654616064,1102772383071387648,roblox is dying yes or no,2022-05-16 20:34:29+00:00,,52,1007,2621,21,en,1526300073654616064,"[{'domain': {'id': '71', 'name': 'Video Game', 'description': 'A video game like Overwatch'}, 'entity': {'id': '1088118927580774400', 'name': 'Roblox', 'description': 'Roblox'}}]",,,False,,everyone,Twitter Web App
1526653268767670273,1357176841409335297,"@LonelyWonders @DziredRblx Roblox was always toxic, plus old roblox was full of kids, because it was a pretty unknow site that you would find from searching dumb stuff as a child.",2022-05-17 19:57:57+00:00,,0,1,0,0,en,1526303140873658375,"[{'domain': {'id': '71', 'name': 'Video Game', 'description': 'A video game like Overwatch'}, 'entity': {'id': '1088118927580774400', 'name': 'Roblox', 'description': 'Roblox'}}]","{'mentions': [{'start': 0, 'end': 14, 'username': 'LonelyWonders', 'id': '4093091662'}, {'start': 15, 'end': 26, 'username': 'DziredRBLX', 'id': '1260561495898894336'}]}",,False,,everyone,Twitter Web App
1526651079072415745,1081080542106275842,@datfooray @Blood500 FURRY ALERT,2022-05-17 19:49:15+00:00,,0,1,0,0,en,1526524836092297217,[],"{'mentions': [{'start': 0, 'end': 10, 'username': 'datfooray', 'id': '1301984924057194496'}, {'start': 11, 'end': 20, 'username': 'Blood500', 'id': '1363791215775293440'}]}",,False,,everyone,Twitter for iPhone
1526321569236234243,4093091662,"@DziredRblx I wish we could go back, as Roblox back then was at least a bit more mature. Now we got a toxic cesspool nowadays.",2022-05-16 21:59:54+00:00,,0,3,33,0,en,1526303140873658375,"[{'domain': {'id': '71', 'name': 'Video Game', 'description': 'A video game like Overwatch'}, 'entity': {'id': '1088118927580774400', 'name': 'Roblox', 'description': 'Roblox'}}]","{'annotations': [{'start': 40, 'end': 45, 'probability': 0.3202, 'type': 'Product', 'normalized_text': 'Roblox'}], 'mentions': [{'start': 0, 'end': 11, 'username': 'DziredRBLX', 'id': '1260561495898894336'}]}",,False,,everyone,Twitter for iPad
1525516875962232833,2888025107,"i’ll give everyone who likes this tweet 1,000 robux if this sells out https://t.co/CxCfxhvCzx",2022-05-14 16:42:20+00:00,,130,388,3781,2,en,1525516875962232833,"[{'domain': {'id': '46', 'name': 'Brand Category', 'description': 'Categories within Brand Verticals that narrow down the scope of Brands'}, 'entity': {'id': '781974596752842752', 'name': 'Services'}}, {'domain': {'id': '47', 'name': 'Brand', 'description': 'Brands and Companies'}, 'entity': {'id': '10045225402', 'name': 'Twitter'}}]","{'urls': [{'start': 70, 'end': 93, 'url': 'https://t.co/CxCfxhvCzx', 'expanded_url': 'https://twitter.com/Modern_Chris_/status/1525516875962232833/photo/1', 'display_url': 'pic.twitter.com/CxCfxhvCzx', 'media_key': '3_1525516870173982720'}]}",{'media_keys': ['3_1525516870173982720']},False,,everyone,Twitter for iPhone
1526648845735981056,1343310639654060032,"Help!!
Me : mfr brown bear
Them: 2 nfr girffins,nfr uni,nfr golden rat,nfr goldhorn,nfr guardian lion,nfr shark,nfr dragon,fossil egg?
#adoptmetrading #Adoptmetrade #adoptme #adoptmetrading #royalehightrades #royalehigh #OverLookBay #adoptmetradings #AMTrading #Roblox",2022-05-17 19:40:23+00:00,,5,7,5,1,en,1526648845735981056,"[{'domain': {'id': '71', 'name': 'Video Game', 'description': 'A video game like Overwatch'}, 'entity': {'id': '1088118927580774400', 'name': 'Roblox', 'description': 'Roblox'}}, {'domain': {'id': '71', 'name': 'Video Game', 'description': 'A video game like Overwatch'}, 'entity': {'id': '1229416301245763584', 'name': 'Adopt Me'}}, {'domain': {'id': '71', 'name': 'Video Game', 'description': 'A video game like Overwatch'}, 'entity': {'id': '1230882318224510978', 'name': 'Royale High'}}]","{'hashtags': [{'start': 135, 'end': 150, 'tag': 'adoptmetrading'}, {'start': 151, 'end': 164, 'tag': 'Adoptmetrade'}, {'start': 165, 'end': 173, 'tag': 'adoptme'}, {'start': 174, 'end': 189, 'tag': 'adoptmetrading'}, {'start': 190, 'end': 207, 'tag': 'royalehightrades'}, {'start': 208, 'end': 219, 'tag': 'royalehigh'}, {'start': 220, 'end': 232, 'tag': 'OverLookBay'}, {'start': 233, 'end': 249, 'tag': 'adoptmetradings'}, {'start': 250, 'end': 260, 'tag': 'AMTrading'}, {'start': 261, 'end': 268, 'tag': 'Roblox'}]}",{'poll_ids': ['1526648844712550400']},False,,everyone,Twitter for Android
1526641769844158464,901894986836279296,UPDATE: This change has been reverted.,2022-05-17 19:12:16+00:00,,4,24,253,1,en,1524137611731685376,[],,,False,,everyone,Twitter for Android
1525934175639027712,1260561495898894336,Just got banned from roblox for being a sponge https://t.co/23jcyAaoGn,2022-05-15 20:20:32+00:00,,556,528,8398,37,en,1525934175639027712,"[{'domain': {'id': '71', 'name': 'Video Game', 'description': 'A video game like Overwatch'}, 'entity': {'id': '1088118927580774400', 'name': 'Roblox', 'description': 'Roblox'}}]","{'urls': [{'start': 47, 'end': 70, 'url': 'https://t.co/23jcyAaoGn', 'expanded_url': 'https://twitter.com/DziredRblx/status/1525934175639027712/photo/1', 'display_url': 'pic.twitter.com/23jcyAaoGn', 'media_key': '3_1525934172023533569'}]}",{'media_keys': ['3_1525934172023533569']},False,,everyone,Twitter for iPhone
1526612258645745664,3300594994,What's the one comfort game you keep going back to? 🤔 💭,2022-05-17 17:15:00+00:00,,49,774,1295,58,en,1526612258645745664,"[{'domain': {'id': '165', 'name': 'Technology', 'description': 'for individual and types of technology, e.g., food technology, 3D printing'}, 'entity': {'id': '1196446161223028736', 'name': 'Social media'}}, {'domain': {'id': '46', 'name': 'Brand Category', 'description': 'Categories within Brand Verticals that narrow down the scope of Brands'}, 'entity': {'id': '781974596752842752', 'name': 'Services'}}, {'domain': {'id': '47', 'name': 'Brand', 'description': 'Brands and Companies'}, 'entity': {'id': '10029382357', 'name': 'YouTube'}}]",,,False,,everyone,Sprinklr
1526652815946416128,879821258225057794,"@FloatingGravs @SampleWoomy yep. i remember the hype when a new valk came out.

still to this day, the best valkyrie to exist.",2022-05-17 19:56:09+00:00,,0,2,2,0,en,1526331262453092352,[],"{'mentions': [{'start': 0, 'end': 14, 'username': 'FloatingGravs', 'id': '1304028446406914054'}, {'start': 15, 'end': 27, 'username': 'SampleWoomy', 'id': '984207838837960704'}]}",,False,,everyone,Twitter Web App
1526652442720579585,1353817245357666305,The concert was only created by some of the Roblox Arena Events’ developers. Sorry if it was not what you expected.,2022-05-17 19:54:40+00:00,,6,11,133,0,en,1526652442720579585,"[{'domain': {'id': '71', 'name': 'Video Game', 'description': 'A video game like Overwatch'}, 'entity': {'id': '1088118927580774400', 'name': 'Roblox', 'description': 'Roblox'}}]","{'annotations': [{'start': 44, 'end': 62, 'probability': 0.4677, 'type': 'Other', 'normalized_text': 'Roblox Arena Events'}]}",,False,,everyone,Twitter for iPhone
1526651291367223298,2200549819,I have...everything setup for debut except for my trailer......halp,2022-05-17 19:50:06+00:00,,1,2,20,0,en,1526651291367223298,[],,,False,,everyone,Twitter Web App
1522249430065426433,1065897298784325638,"Hay nuevos Accesorios/Premios del Evento de Sonic en ROBLOX! Cuales serán gratis y se podrán conseguir?
👇
https://t.co/EMCbXMCeLX",2022-05-05 16:18:40+00:00,,10,8,45,0,es,1522249430065426433,"[{'domain': {'id': '71', 'name': 'Video Game', 'description': 'A video game like Overwatch'}, 'entity': {'id': '1088118927580774400', 'name': 'Roblox', 'description': 'Roblox'}}]","{'annotations': [{'start': 53, 'end': 58, 'probability': 0.3964, 'type': 'Product', 'normalized_text': 'ROBLOX'}], 'urls': [{'start': 106, 'end': 129, 'url': 'https://t.co/EMCbXMCeLX', 'expanded_url': 'https://youtu.be/_3vRhePzfxc', 'display_url': 'youtu.be/_3vRhePzfxc'}]}",,False,,everyone,Twitter Web App
1526650190912012289,1186079268805206027,i fw tha mario 64 speedrunning community,2022-05-17 19:45:43+00:00,,0,1,4,0,en,1526650190912012289,"[{'domain': {'id': '67', 'name': 'Interests and Hobbies', 'description': 'Interests, opinions, and behaviors of individuals, groups, or cultures; like Speciality Cooking or Theme Parks'}, 'entity': {'id': '1263237723713724416', 'name': 'Speedrunning'}}, {'domain': {'id': '71', 'name': 'Video Game', 'description': 'A video game like Overwatch'}, 'entity': {'id': '854952148374663168', 'name': 'Super Mario', 'description': 'This entity includes all conversation about the franchise, as well as any individual installments in the series, if applicable.\t\t\t'}}]",,,False,,everyone,Twitter for iPhone
1526463729398796288,1483148983102951424,@digitalcooki3 @saniccle lets be roblox friends but im mostly on xbox servers,2022-05-17 07:24:48+00:00,,0,1,1,0,en,1526239806791065604,"[{'domain': {'id': '71', 'name': 'Video Game', 'description': 'A video game like Overwatch'}, 'entity': {'id': '1088118927580774400', 'name': 'Roblox', 'description': 'Roblox'}}, {'domain': {'id': '45', 'name': 'Brand Vertical', 'description': 'Top level entities that describe a Brands industry'}, 'entity': {'id': '781974597310615553', 'name': 'Entertainment'}}, {'domain': {'id': '46', 'name': 'Brand Category', 'description': 'Categories within Brand Verticals that narrow down the scope of Brands'}, 'entity': {'id': '781974597218340864', 'name': 'Video Games'}}, {'domain': {'id': '47', 'name': 'Brand', 'description': 'Brands and Companies'}, 'entity': {'id': '10027048851', 'name': 'Xbox'}}, {'domain': {'id': '79', 'name': 'Video Game Hardware', 'description': 'Video Game Hardware'}, 'entity': {'id': '10027048851', 'name': 'Xbox'}}]","{'annotations': [{'start': 65, 'end': 68, 'probability': 0.9378, 'type': 'Product', 'normalized_text': 'xbox'}], 'mentions': [{'start': 0, 'end': 14, 'username': 'digitalcooki3', 'id': '1302467941921943557'}, {'start': 15, 'end': 24, 'username': 'saniccle', 'id': '1333801476875948036'}]}",,False,,everyone,Twitter for Android
1526354469134508041,1126969279885258752,@DziredRblx new roblox &gt; old roblox and nobody is changing my opinion LOL,2022-05-17 00:10:38+00:00,,0,18,49,1,en,1526303140873658375,"[{'domain': {'id': '71', 'name': 'Video Game', 'description': 'A video game like Overwatch'}, 'entity': {'id': '1088118927580774400', 'name': 'Roblox', 'description': 'Roblox'}}]","{'mentions': [{'start': 0, 'end': 11, 'username': 'DziredRBLX', 'id': '1260561495898894336'}]}",,False,,everyone,Twitter Web App
1526219060534444033,1359272573364826114,"I'm looking for a Roblox 3D modeler who can model 3 cartoon style plushies, please dm me or comment if you can do this job. If I like your work I can offer you a job in a team.
 #Roblox | #RobloxDev | #3dmodeling",2022-05-16 15:12:34+00:00,,4,1,6,0,en,1526219060534444033,"[{'domain': {'id': '71', 'name': 'Video Game', 'description': 'A video game like Overwatch'}, 'entity': {'id': '1088118927580774400', 'name': 'Roblox', 'description': 'Roblox'}}, {'domain': {'id': '45', 'name': 'Brand Vertical', 'description': 'Top level entities that describe a Brands industry'}, 'entity': {'id': '781972125171060736', 'name': 'Auto'}}, {'domain': {'id': '46', 'name': 'Brand Category', 'description': 'Categories within Brand Verticals that narrow down the scope of Brands'}, 'entity': {'id': '781972125179518977', 'name': 'Auto Manufacturer'}}, {'domain': {'id': '47', 'name': 'Brand', 'description': 'Brands and Companies'}, 'entity': {'id': '10044199219', 'name': 'Tesla Motors'}}, {'domain': {'id': '48', 'name': 'Product', 'description': 'Products created by Brands.  Examples: Ford Explorer, Apple iPhone.'}, 'entity': {'id': '10044387802', 'name': 'Tesla - Model 3'}}]","{'annotations': [{'start': 18, 'end': 26, 'probability': 0.6119, 'type': 'Product', 'normalized_text': 'Roblox 3D'}], 'hashtags': [{'start': 178, 'end': 185, 'tag': 'Roblox'}, {'start': 188, 'end': 198, 'tag': 'RobloxDev'}, {'start': 201, 'end': 212, 'tag': '3dmodeling'}]}",,False,,everyone,Twitter for Android
1526209688383148032,1476678374235979779,"Day 15 of having my roblox account deleted. For this having my favourite number (5), the day is pretty shitty so far. https://t.co/DmCW4SsA2u",2022-05-16 14:35:19+00:00,,0,0,3,1,en,1526209688383148032,"[{'domain': {'id': '71', 'name': 'Video Game', 'description': 'A video game like Overwatch'}, 'entity': {'id': '1088118927580774400', 'name': 'Roblox', 'description': 'Roblox'}}]","{'urls': [{'start': 118, 'end': 141, 'url': 'https://t.co/DmCW4SsA2u', 'expanded_url': 'https://twitter.com/ToppyWasTaken/status/1525893732901572609', 'display_url': 'twitter.com/ToppyWasTaken/…'}]}",,False,,everyone,Twitter Web App
1526627746180476937,30058709,"@pokertrader1 fåglarna o grisarna borde dyka upp mer i cross-sell i andra spel typ skins (spontant inget jag känner igen) - kan man ha ett pumpkinhead i fortnite så borde man också kunna ha en gris/fågel  - tror vi diskuterat det innan iofs, men man vill samtidigt inte devalvera ipet såklart",2022-05-17 18:16:32+00:00,,0,1,0,0,sv,1526543857311162368,"[{'domain': {'id': '71', 'name': 'Video Game', 'description': 'A video game like Overwatch'}, 'entity': {'id': '974285387987169280', 'name': 'Fortnite', 'description': 'This entity includes all conversation about the franchise, as well as any individual installments in the series, if applicable.\t\t\t'}}]","{'mentions': [{'start': 0, 'end': 13, 'username': 'pokertrader1', 'id': '4041233662'}]}",,False,,everyone,Twitter for iPhone
1510238531087892482,1371733718067421188,@z3r0sie https://t.co/8jXLLHL67W,2022-04-02 12:51:39+00:00,,0,1,0,0,qme,1510187659938914312,[],"{'mentions': [{'start': 0, 'end': 8, 'username': 'z3r0sie', 'id': '1508829029402611712'}], 'urls': [{'start': 9, 'end': 32, 'url': 'https://t.co/8jXLLHL67W', 'expanded_url': 'https://web.roblox.com/game-pass/37759469/gamepass', 'display_url': 'web.roblox.com/game-pass/3775…', 'status': 200, 'title': 'gamepass - Roblox', 'description': 'Roblox is a global platform that brings people together through play.', 'unwound_url': 'https://www.roblox.com/game-pass/37759469/gamepass'}]}",,False,,everyone,Twitter for Android
1526634109593784321,1342606428826005504,@AdrianPlays3 @ItsAmmon Bad reasons? People edit there ban with inspect element to avert bans and people blast racist songs on the radios roblox have there reasons.,2022-05-17 18:41:49+00:00,,0,1,0,0,en,1526300073654616064,"[{'domain': {'id': '71', 'name': 'Video Game', 'description': 'A video game like Overwatch'}, 'entity': {'id': '1088118927580774400', 'name': 'Roblox', 'description': 'Roblox'}}]","{'mentions': [{'start': 0, 'end': 13, 'username': 'AdrianPlays3', 'id': '1301510340426043393'}, {'start': 14, 'end': 23, 'username': 'ItsAmmon', 'id': '1102772383071387648'}]}",,False,,everyone,Twitter for Android
1496327457997463554,1412084134634082304,"COMMENT YOUR GAMEPASSES , BUYING 5 GAMEPASSES 

JUST FOLLOW ME + RT AND LIKE",2022-02-23 03:34:01+00:00,,28,28,48,0,en,1496327457997463554,[],,,False,,everyone,Twitter Web App
1507740361149583360,1455951633804931078,"buying your gamepasses right now
just drop your link in the comments

if i like your comment i’ve bought it",2022-03-26 15:24:49+00:00,,133,189,244,0,en,1507740361149583360,[],,,False,,everyone,Twitter for iPhone
1509064563957780484,1406845899616124929,"· Drop ur gamepasses, buying some
Must be following w notifs",2022-03-30 07:06:43+00:00,,17,35,41,0,en,1509064563957780484,[],,,False,,everyone,Twitter for iPad
1526501665788108803,1422163374339727363,"🎵Tate McRae

o Mapa de Tate McRae Abriu! o Show irá acontecer Dia 20 de Maio às 20:00 BRT (4PM PST)

Link:https://t.co/UtjpfEzWFl

#Roblox #RobloxDev #TateMcrae",2022-05-17 09:55:32+00:00,,9,1,29,1,pt,1526501665788108803,"[{'domain': {'id': '71', 'name': 'Video Game', 'description': 'A video game like Overwatch'}, 'entity': {'id': '1088118927580774400', 'name': 'Roblox', 'description': 'Roblox'}}]","{'annotations': [{'start': 2, 'end': 11, 'probability': 0.9696, 'type': 'Person', 'normalized_text': 'Tate McRae'}, {'start': 24, 'end': 33, 'probability': 0.9161, 'type': 'Person', 'normalized_text': 'Tate McRae'}], 'urls': [{'start': 106, 'end': 129, 'url': 'https://t.co/UtjpfEzWFl', 'expanded_url': 'https://roblox.com/games/9604473769/Tate-McRae-Concert-Experience', 'display_url': 'roblox.com/games/96044737…'}], 'hashtags': [{'start': 131, 'end': 138, 'tag': 'Roblox'}, {'start': 139, 'end': 149, 'tag': 'RobloxDev'}, {'start': 150, 'end': 160, 'tag': 'TateMcrae'}]}",,False,,everyone,Twitter for Android
1526646748927631361,1256772546344759296,What is your favorite avatar accessory on Roblox? 🎧🎩🕶 👇,2022-05-17 19:32:03+00:00,,1,6,22,0,en,1526646748927631361,"[{'domain': {'id': '71', 'name': 'Video Game', 'description': 'A video game like Overwatch'}, 'entity': {'id': '1088118927580774400', 'name': 'Roblox', 'description': 'Roblox'}}]","{'annotations': [{'start': 42, 'end': 47, 'probability': 0.6115, 'type': 'Product', 'normalized_text': 'Roblox'}]}",,False,,everyone,Twitter for iPhone
1519462133041229824,1356794881071603712,"BIG SHOPPING SPREE AGAIN
BUYING GAMEPASSES - LIMIT: 35K

please be considerate of others &lt;3
also check my pinned 📌 https://t.co/UirTakI2YO",2022-04-27 23:42:57+00:00,,73,136,175,1,en,1519462133041229824,[],"{'urls': [{'start': 118, 'end': 141, 'url': 'https://t.co/UirTakI2YO', 'expanded_url': 'https://twitter.com/hartpwints/status/1519462133041229824/photo/1', 'display_url': 'pic.twitter.com/UirTakI2YO', 'media_key': '3_1519461935892156417'}]}",{'media_keys': ['3_1519461935892156417']},False,,everyone,Twitter Web App
1521436889126899712,1401851980562063367,"BUYING 2-5 ROBUX GAMEPASSES! 👇

SEND THEM BELOW ❤️ 
If i bought yours, pls vouch in my hashtag #.OfficialGalaxyPlaysWinners or you will not win ever again :))",2022-05-03 10:29:55+00:00,,5,23,29,0,en,1521436889126899712,[],,,False,,everyone,Twitter for iPhone
1446117679534788610,1421544698477309952,"secretly buying few small gamepasses / clothing
drop them below
follow me + rt",2021-10-07 14:18:17+00:00,,24,29,40,1,en,1446117679534788610,"[{'domain': {'id': '65', 'name': 'Interests and Hobbies Vertical', 'description': 'Top level interests and hobbies groupings, like Food or Travel'}, 'entity': {'id': '844603730221707264', 'name': 'Fashion', 'description': 'Fashion'}}, {'domain': {'id': '67', 'name': 'Interests and Hobbies', 'description': 'Interests, opinions, and behaviors of individuals, groups, or cultures; like Speciality Cooking or Theme Parks'}, 'entity': {'id': '1006277139233103872', 'name': 'Behavior around fashion', 'description': 'Behavior around Fashion'}}]",,,False,,everyone,Twitter for Android
1526628755099328512,885522169211621376,it's gone! https://t.co/4fMVhag3cF https://t.co/q2Ps4PGhdI,2022-05-17 18:20:33+00:00,,2,8,43,0,en,1526628755099328512,[],"{'urls': [{'start': 11, 'end': 34, 'url': 'https://t.co/4fMVhag3cF', 'expanded_url': 'https://twitter.com/jmkdev/status/1526628755099328512/photo/1', 'display_url': 'pic.twitter.com/4fMVhag3cF', 'media_key': '3_1526628714036994049'}, {'start': 11, 'end': 34, 'url': 'https://t.co/4fMVhag3cF', 'expanded_url': 'https://twitter.com/jmkdev/status/1526628755099328512/photo/1', 'display_url': 'pic.twitter.com/4fMVhag3cF', 'media_key': '3_1526628737395179520'}, {'start': 35, 'end': 58, 'url': 'https://t.co/q2Ps4PGhdI', 'expanded_url': 'https://twitter.com/Elttob_/status/1524086287791235072', 'display_url': 'twitter.com/Elttob_/status…'}]}","{'media_keys': ['3_1526628714036994049', '3_1526628737395179520']}",False,,everyone,Twitter Web App
