tweetid,author_id,text,created_at,geo,retweets,replies,likes,quote_count,lang,conversation_id,context_annotations,entities,attachments,possibly_sensitive,withheld,reply_settings,source
1515087432592637957,1267993164637523968,my roblox account was hacked but I think I have everything under control😓,2022-04-15 21:59:27+00:00,,0,7,2,0,en,1515087432592637957,"[{'domain': {'id': '71', 'name': 'Video Game', 'description': 'A video game like Overwatch'}, 'entity': {'id': '1088118927580774400', 'name': 'Roblox', 'description': 'Roblox'}}]",,,False,,everyone,Twitter Web App
1514842202433724418,1427600942933811200,I’ll end it randomly,2022-04-15 05:45:00+00:00,,5,28,48,1,en,1514840555112394752,[],,,False,,mentionedUsers,Twitter Web App
1509276333968445447,1407735476006567938,"@tiradodobau Se você parar pra pensar, roblox é o segundo jogo mais velho daí",2022-03-30 21:08:13+00:00,,0,1,0,0,pt,1508979975537541123,"[{'domain': {'id': '71', 'name': 'Video Game', 'description': 'A video game like Overwatch'}, 'entity': {'id': '1088118927580774400', 'name': 'Roblox', 'description': 'Roblox'}}]","{'mentions': [{'start': 0, 'end': 12, 'username': 'tiradodobau', 'id': '1395553137541451785'}]}",,False,,everyone,Twitter for Android
1515074555747999745,137697291,@dimpledeity @almostdo Ale tienes como 15 años todavía eres su público objetivo 😭,2022-04-15 21:08:17+00:00,,0,1,0,0,es,1515064403061841936,[],"{'mentions': [{'start': 0, 'end': 12, 'username': 'dimpledeity', 'id': '902369072058392576'}, {'start': 13, 'end': 22, 'username': 'almostdo', 'id': '113726024'}]}",,False,,everyone,Twitter for Android
1515011598812794883,19609162,"Sonic's officially in @Roblox in Sonic Speed Simulator, and all paid beta players can grab this exclusive Knuckles Chao!

Paid beta ends at 7AM PST on Saturday! https://t.co/T1WnkkntYw",2022-04-15 16:58:07+00:00,,1735,455,15220,319,en,1515011598812794883,"[{'domain': {'id': '71', 'name': 'Video Game', 'description': 'A video game like Overwatch'}, 'entity': {'id': '1088118927580774400', 'name': 'Roblox', 'description': 'Roblox'}}, {'domain': {'id': '130', 'name': 'Multimedia Franchise', 'description': ""Franchises which span multiple forms of media like 'Harry Potter'""}, 'entity': {'id': '993952643209773057', 'name': 'Sonic the Hedgehog', 'description': 'This entity includes all conversation about the franchise, as well as any individual installments in the series, if applicable.\t\t\t\n\nNOTE: Stopped annotating in the Video Game domain (71) on 11/15/19. Moving forward, this entity will annotate to Multimedia Franchise domain (130) only.'}}]","{'mentions': [{'start': 22, 'end': 29, 'username': 'Roblox', 'id': '16745055'}], 'annotations': [{'start': 33, 'end': 53, 'probability': 0.5481, 'type': 'Product', 'normalized_text': 'Sonic Speed Simulator'}, {'start': 106, 'end': 118, 'probability': 0.4147, 'type': 'Product', 'normalized_text': 'Knuckles Chao'}], 'urls': [{'start': 161, 'end': 184, 'url': 'https://t.co/T1WnkkntYw', 'expanded_url': 'https://twitter.com/sonic_hedgehog/status/1515011598812794883/photo/1', 'display_url': 'pic.twitter.com/T1WnkkntYw', 'media_key': '3_1515009384442589188'}]}",{'media_keys': ['3_1515009384442589188']},False,,everyone,Twitter Web App
1468772316377092097,1458728881750351872,"@SpiltSoup_ @Roblox Yeah just quit Roblox already, we don’t need the boyz who’s judging something, if u don’t like it then keep it to urself cus this is about BTS not ur opinion.",2021-12-09 02:39:43+00:00,,0,1,0,0,en,1458989531416317960,"[{'domain': {'id': '71', 'name': 'Video Game', 'description': 'A video game like Overwatch'}, 'entity': {'id': '1088118927580774400', 'name': 'Roblox', 'description': 'Roblox'}}, {'domain': {'id': '10', 'name': 'Person', 'description': 'Named people in the world like Nelson Mandela'}, 'entity': {'id': '844438182523383808', 'name': 'BTS'}}, {'domain': {'id': '54', 'name': 'Musician', 'description': 'A musician in the world, like Adele or Bob Dylan'}, 'entity': {'id': '844438182523383808', 'name': 'BTS'}}, {'domain': {'id': '55', 'name': 'Music Genre', 'description': 'A category for a musical style, like Pop, Rock, or Rap'}, 'entity': {'id': '888105153038958593', 'name': 'K-pop', 'description': 'K-Pop'}}]","{'mentions': [{'start': 12, 'end': 19, 'username': 'Roblox', 'id': '16745055'}], 'annotations': [{'start': 35, 'end': 40, 'probability': 0.3547, 'type': 'Product', 'normalized_text': 'Roblox'}, {'start': 159, 'end': 161, 'probability': 0.606, 'type': 'Organization', 'normalized_text': 'BTS'}]}",,False,,everyone,Twitter Web App
1515061842305064964,4093077509,is roblox getting boring?,2022-04-15 20:17:46+00:00,,114,1651,4378,62,en,1515061842305064964,"[{'domain': {'id': '71', 'name': 'Video Game', 'description': 'A video game like Overwatch'}, 'entity': {'id': '1088118927580774400', 'name': 'Roblox', 'description': 'Roblox'}}]",,,False,,everyone,Twitter Web App
1515087138831933443,1326854083848888320,"its about time i shown this, meet Bad Luck Sonic, he is my Sonic.EXE OC,He Is A Spirit That Can Teleport Through Pirated Games And Games That Were Once Pirated,He Disguises Himself As Sonic Sometimes If Needed,He Has A Child Soul Named Tyler,His Age Was 7.(1) https://t.co/1f0LnPL2TO",2022-04-15 21:58:17+00:00,,0,5,4,1,en,1515087138831933443,"[{'domain': {'id': '130', 'name': 'Multimedia Franchise', 'description': ""Franchises which span multiple forms of media like 'Harry Potter'""}, 'entity': {'id': '993952643209773057', 'name': 'Sonic the Hedgehog', 'description': 'This entity includes all conversation about the franchise, as well as any individual installments in the series, if applicable.\t\t\t\n\nNOTE: Stopped annotating in the Video Game domain (71) on 11/15/19. Moving forward, this entity will annotate to Multimedia Franchise domain (130) only.'}}]","{'annotations': [{'start': 65, 'end': 70, 'probability': 0.5163, 'type': 'Product', 'normalized_text': 'EXE OC'}, {'start': 236, 'end': 240, 'probability': 0.9402, 'type': 'Person', 'normalized_text': 'Tyler'}], 'urls': [{'start': 260, 'end': 283, 'url': 'https://t.co/1f0LnPL2TO', 'expanded_url': 'https://twitter.com/TailsFunni/status/1515087138831933443/photo/1', 'display_url': 'pic.twitter.com/1f0LnPL2TO', 'media_key': '3_1515087117164158978'}]}",{'media_keys': ['3_1515087117164158978']},False,,everyone,Twitter Web App
1515061056925847557,1225113068574777344,I’ve just created the best Roblox avatar https://t.co/NBCVgCPYFt,2022-04-15 20:14:39+00:00,,2,3,15,0,en,1515061056925847557,"[{'domain': {'id': '71', 'name': 'Video Game', 'description': 'A video game like Overwatch'}, 'entity': {'id': '1088118927580774400', 'name': 'Roblox', 'description': 'Roblox'}}]","{'annotations': [{'start': 27, 'end': 32, 'probability': 0.3966, 'type': 'Product', 'normalized_text': 'Roblox'}], 'urls': [{'start': 41, 'end': 64, 'url': 'https://t.co/NBCVgCPYFt', 'expanded_url': 'https://twitter.com/kdiodjfirjkxke/status/1515061056925847557/photo/1', 'display_url': 'pic.twitter.com/NBCVgCPYFt', 'media_key': '3_1515061051259334656'}]}",{'media_keys': ['3_1515061051259334656']},False,,everyone,Twitter for iPhone
1514849597214101504,1377670267917438978,she might be the only 40 year old person to ever cry while saying the word ‘roblox’ https://t.co/R0PuMNBPaM,2022-04-15 06:14:23+00:00,,14740,501,214412,421,en,1514849597214101504,"[{'domain': {'id': '10', 'name': 'Person', 'description': 'Named people in the world like Nelson Mandela'}, 'entity': {'id': '806561823407239169', 'name': 'Kanye West', 'description': 'Kanye West'}}, {'domain': {'id': '10', 'name': 'Person', 'description': 'Named people in the world like Nelson Mandela'}, 'entity': {'id': '806570121959383040', 'name': 'Kim Kardashian', 'description': 'Kim Kardashian'}}, {'domain': {'id': '54', 'name': 'Musician', 'description': 'A musician in the world, like Adele or Bob Dylan'}, 'entity': {'id': '806561823407239169', 'name': 'Kanye West', 'description': 'Kanye West'}}, {'domain': {'id': '55', 'name': 'Music Genre', 'description': 'A category for a musical style, like Pop, Rock, or Rap'}, 'entity': {'id': '810937888334487552', 'name': 'Rap', 'description': 'Hip-Hop/Rap'}}, {'domain': {'id': '58', 'name': 'Entertainment Personality', 'description': 'An entertainment personality in the world, like Anderson Cooper or Miranda Sings'}, 'entity': {'id': '806570121959383040', 'name': 'Kim Kardashian', 'description': 'Kim Kardashian'}}, {'domain': {'id': '71', 'name': 'Video Game', 'description': 'A video game like Overwatch'}, 'entity': {'id': '1088118927580774400', 'name': 'Roblox', 'description': 'Roblox'}}]","{'urls': [{'start': 84, 'end': 107, 'url': 'https://t.co/R0PuMNBPaM', 'expanded_url': 'https://twitter.com/ayedocc/status/1514838191991361544', 'display_url': 'twitter.com/ayedocc/status…'}]}",,False,,everyone,Twitter for iPhone
1515085395037462536,1472480701719187458,"""Roblox is _____"" 

Let your keyboard finishing the word!",2022-04-15 21:51:21+00:00,,0,61,37,0,en,1515085395037462536,"[{'domain': {'id': '71', 'name': 'Video Game', 'description': 'A video game like Overwatch'}, 'entity': {'id': '1088118927580774400', 'name': 'Roblox', 'description': 'Roblox'}}]",,,False,,everyone,Twitter Web App
1515062286305533954,1095171633436712960,@sonic_hedgehog @Roblox HOW DO I GET HIM I ALREADY PAID FOR THE BETA,2022-04-15 20:19:32+00:00,,0,1,0,0,en,1515011598812794883,"[{'domain': {'id': '71', 'name': 'Video Game', 'description': 'A video game like Overwatch'}, 'entity': {'id': '1088118927580774400', 'name': 'Roblox', 'description': 'Roblox'}}, {'domain': {'id': '130', 'name': 'Multimedia Franchise', 'description': ""Franchises which span multiple forms of media like 'Harry Potter'""}, 'entity': {'id': '993952643209773057', 'name': 'Sonic the Hedgehog', 'description': 'This entity includes all conversation about the franchise, as well as any individual installments in the series, if applicable.\t\t\t\n\nNOTE: Stopped annotating in the Video Game domain (71) on 11/15/19. Moving forward, this entity will annotate to Multimedia Franchise domain (130) only.'}}]","{'mentions': [{'start': 0, 'end': 15, 'username': 'sonic_hedgehog', 'id': '19609162'}, {'start': 16, 'end': 23, 'username': 'Roblox', 'id': '16745055'}]}",,False,,everyone,Twitter Web App
1514280013201297408,1162494706066046977,"We have officially partnered with @SEGA to bring @Sonic_Hedgehog to Roblox in our upcoming game Sonic Speed Simulator!

We worked with various sonic developers from the #Roblox community in order to make this possible!
#RobloxDev

Try it here: https://t.co/TFCkRGpuT3 https://t.co/yRAQlIC1Um",2022-04-13 16:31:03+00:00,,3458,657,15737,988,en,1514280013201297408,"[{'domain': {'id': '71', 'name': 'Video Game', 'description': 'A video game like Overwatch'}, 'entity': {'id': '1088118927580774400', 'name': 'Roblox', 'description': 'Roblox'}}, {'domain': {'id': '78', 'name': 'Video Game Publisher', 'description': ""A Video Game Publisher like 'Activision'""}, 'entity': {'id': '943877135894056966', 'name': 'Sega', 'description': 'Sega'}}, {'domain': {'id': '130', 'name': 'Multimedia Franchise', 'description': ""Franchises which span multiple forms of media like 'Harry Potter'""}, 'entity': {'id': '993952643209773057', 'name': 'Sonic the Hedgehog', 'description': 'This entity includes all conversation about the franchise, as well as any individual installments in the series, if applicable.\t\t\t\n\nNOTE: Stopped annotating in the Video Game domain (71) on 11/15/19. Moving forward, this entity will annotate to Multimedia Franchise domain (130) only.'}}]","{'mentions': [{'start': 34, 'end': 39, 'username': 'SEGA', 'id': '17092592'}, {'start': 49, 'end': 64, 'username': 'sonic_hedgehog', 'id': '19609162'}], 'annotations': [{'start': 68, 'end': 73, 'probability': 0.4292, 'type': 'Product', 'normalized_text': 'Roblox'}, {'start': 96, 'end': 116, 'probability': 0.7504, 'type': 'Product', 'normalized_text': 'Sonic Speed Simulator'}], 'hashtags': [{'start': 169, 'end': 176, 'tag': 'Roblox'}, {'start': 219, 'end': 229, 'tag': 'RobloxDev'}], 'urls': [{'start': 244, 'end': 267, 'url': 'https://t.co/TFCkRGpuT3', 'expanded_url': 'https://www.roblox.com/games/9049840490', 'display_url': 'roblox.com/games/90498404…'}, {'start': 268, 'end': 291, 'url': 'https://t.co/yRAQlIC1Um', 'expanded_url': 'https://twitter.com/gamefamstudios/status/1514280013201297408/video/1', 'display_url': 'pic.twitter.com/yRAQlIC1Um', 'media_key': '7_1514279913066573825'}]}",{'media_keys': ['7_1514279913066573825']},False,,everyone,Buffer
1514838191991361544,1470442246294155267,no way this is how kim kardashian called kanye about the sextape on roblox LMAOOO https://t.co/tixxFRzmLC,2022-04-15 05:29:03+00:00,,27353,3618,300154,12819,en,1514838191991361544,"[{'domain': {'id': '10', 'name': 'Person', 'description': 'Named people in the world like Nelson Mandela'}, 'entity': {'id': '806561823407239169', 'name': 'Kanye West', 'description': 'Kanye West'}}, {'domain': {'id': '10', 'name': 'Person', 'description': 'Named people in the world like Nelson Mandela'}, 'entity': {'id': '806570121959383040', 'name': 'Kim Kardashian', 'description': 'Kim Kardashian'}}, {'domain': {'id': '54', 'name': 'Musician', 'description': 'A musician in the world, like Adele or Bob Dylan'}, 'entity': {'id': '806561823407239169', 'name': 'Kanye West', 'description': 'Kanye West'}}, {'domain': {'id': '55', 'name': 'Music Genre', 'description': 'A category for a musical style, like Pop, Rock, or Rap'}, 'entity': {'id': '810937888334487552', 'name': 'Rap', 'description': 'Hip-Hop/Rap'}}, {'domain': {'id': '58', 'name': 'Entertainment Personality', 'description': 'An entertainment personality in the world, like Anderson Cooper or Miranda Sings'}, 'entity': {'id': '806570121959383040', 'name': 'Kim Kardashian', 'description': 'Kim Kardashian'}}, {'domain': {'id': '71', 'name': 'Video Game', 'description': 'A video game like Overwatch'}, 'entity': {'id': '1088118927580774400', 'name': 'Roblox', 'description': 'Roblox'}}]","{'annotations': [{'start': 19, 'end': 32, 'probability': 0.9784, 'type': 'Person', 'normalized_text': 'kim kardashian'}, {'start': 41, 'end': 45, 'probability': 0.9975, 'type': 'Person', 'normalized_text': 'kanye'}], 'urls': [{'start': 82, 'end': 105, 'url': 'https://t.co/tixxFRzmLC', 'expanded_url': 'https://twitter.com/ayedocc/status/1514838191991361544/video/1', 'display_url': 'pic.twitter.com/tixxFRzmLC', 'media_key': '7_1514838163092652034'}]}",{'media_keys': ['7_1514838163092652034']},False,,everyone,Twitter for iPhone
1514683344579174402,3233479363,"brawler (used blender to animate)
#Roblox #RobloxDev #RobloxDevs #blender #animation #robloxanimations https://t.co/C01T9A89HS",2022-04-14 19:13:45+00:00,,19,3,201,0,en,1514683344579174402,"[{'domain': {'id': '48', 'name': 'Product', 'description': 'Products created by Brands.  Examples: Ford Explorer, Apple iPhone.'}, 'entity': {'id': '1471629300579241986', 'name': 'Blender'}}, {'domain': {'id': '65', 'name': 'Interests and Hobbies Vertical', 'description': 'Top level interests and hobbies groupings, like Food or Travel'}, 'entity': {'id': '1280550787207147521', 'name': 'Arts & culture'}}, {'domain': {'id': '30', 'name': 'Entities [Entity Service]', 'description': 'Entity Service top level domain, every item that is in Entity Service should be in this domain'}, 'entity': {'id': '1273386679273807873', 'name': '3D animation'}}, {'domain': {'id': '71', 'name': 'Video Game', 'description': 'A video game like Overwatch'}, 'entity': {'id': '1088118927580774400', 'name': 'Roblox', 'description': 'Roblox'}}, {'domain': {'id': '165', 'name': 'Technology', 'description': 'for individual and types of technology, e.g., food technology, 3D printing'}, 'entity': {'id': '1273386679273807873', 'name': '3D animation'}}, {'domain': {'id': '30', 'name': 'Entities [Entity Service]', 'description': 'Entity Service top level domain, every item that is in Entity Service should be in this domain'}, 'entity': {'id': '848920371311001600', 'name': 'Technology', 'description': 'Technology and computing'}}, {'domain': {'id': '66', 'name': 'Interests and Hobbies Category', 'description': 'A grouping of interests and hobbies entities, like Novelty Food or Destinations'}, 'entity': {'id': '848920448297385989', 'name': 'Animation software', 'description': 'Animation'}}]","{'hashtags': [{'start': 34, 'end': 41, 'tag': 'Roblox'}, {'start': 42, 'end': 52, 'tag': 'RobloxDev'}, {'start': 53, 'end': 64, 'tag': 'RobloxDevs'}, {'start': 65, 'end': 73, 'tag': 'blender'}, {'start': 74, 'end': 84, 'tag': 'animation'}, {'start': 85, 'end': 102, 'tag': 'robloxanimations'}], 'urls': [{'start': 103, 'end': 126, 'url': 'https://t.co/C01T9A89HS', 'expanded_url': 'https://twitter.com/Roblox_ammar104/status/1514683344579174402/video/1', 'display_url': 'pic.twitter.com/C01T9A89HS', 'media_key': '7_1514682949698002953'}]}",{'media_keys': ['7_1514682949698002953']},False,,everyone,Twitter Web App
1515087267714506752,948542567943168002,@EvilArtist_ @Roblox we yassified that zoom call,2022-04-15 21:58:48+00:00,,0,1,2,0,en,1515085834705321993,"[{'domain': {'id': '71', 'name': 'Video Game', 'description': 'A video game like Overwatch'}, 'entity': {'id': '1088118927580774400', 'name': 'Roblox', 'description': 'Roblox'}}, {'domain': {'id': '45', 'name': 'Brand Vertical', 'description': 'Top level entities that describe a Brands industry'}, 'entity': {'id': '781974597226799105', 'name': 'B2B'}}, {'domain': {'id': '46', 'name': 'Brand Category', 'description': 'Categories within Brand Verticals that narrow down the scope of Brands'}, 'entity': {'id': '781974597172203520', 'name': 'Services'}}, {'domain': {'id': '47', 'name': 'Brand', 'description': 'Brands and Companies'}, 'entity': {'id': '10040912121', 'name': 'Zoom'}}]","{'mentions': [{'start': 0, 'end': 12, 'username': 'EvilArtist_', 'id': '3248813666'}, {'start': 13, 'end': 20, 'username': 'Roblox', 'id': '16745055'}]}",,False,,everyone,Twitter Web App
1459083157974573072,1301421792532115456,"@Roblox This is very controversial but I myself love BTS. Choose them over Lil nas x any day. Thats just my opinion, I won't accept any attacks to me. Thanks, Roblox!",2021-11-12 08:58:27+00:00,,1,5,81,2,en,1458989531416317960,"[{'domain': {'id': '10', 'name': 'Person', 'description': 'Named people in the world like Nelson Mandela'}, 'entity': {'id': '1121835842677305344', 'name': 'Lil Nas X'}}, {'domain': {'id': '54', 'name': 'Musician', 'description': 'A musician in the world, like Adele or Bob Dylan'}, 'entity': {'id': '1121835842677305344', 'name': 'Lil Nas X'}}, {'domain': {'id': '55', 'name': 'Music Genre', 'description': 'A category for a musical style, like Pop, Rock, or Rap'}, 'entity': {'id': '810937888334487552', 'name': 'Rap', 'description': 'Hip-Hop/Rap'}}, {'domain': {'id': '71', 'name': 'Video Game', 'description': 'A video game like Overwatch'}, 'entity': {'id': '1088118927580774400', 'name': 'Roblox', 'description': 'Roblox'}}, {'domain': {'id': '10', 'name': 'Person', 'description': 'Named people in the world like Nelson Mandela'}, 'entity': {'id': '844438182523383808', 'name': 'BTS'}}, {'domain': {'id': '54', 'name': 'Musician', 'description': 'A musician in the world, like Adele or Bob Dylan'}, 'entity': {'id': '844438182523383808', 'name': 'BTS'}}, {'domain': {'id': '55', 'name': 'Music Genre', 'description': 'A category for a musical style, like Pop, Rock, or Rap'}, 'entity': {'id': '888105153038958593', 'name': 'K-pop', 'description': 'K-Pop'}}]","{'mentions': [{'start': 0, 'end': 7, 'username': 'Roblox', 'id': '16745055'}], 'annotations': [{'start': 53, 'end': 55, 'probability': 0.5661, 'type': 'Organization', 'normalized_text': 'BTS'}, {'start': 159, 'end': 164, 'probability': 0.2785, 'type': 'Product', 'normalized_text': 'Roblox'}]}",,False,,everyone,Twitter Web App
1515026236241850380,16745055,Anyone got any avatar accessories they'd like to recommend to @sonic_hedgehog? https://t.co/XxBNu7ju0i,2022-04-15 17:56:17+00:00,,167,1036,2785,14,en,1515026236241850380,[],"{'mentions': [{'start': 62, 'end': 77, 'username': 'sonic_hedgehog', 'id': '19609162'}], 'urls': [{'start': 79, 'end': 102, 'url': 'https://t.co/XxBNu7ju0i', 'expanded_url': 'https://twitter.com/VentureBeat/status/1514272343731814403', 'display_url': 'twitter.com/VentureBeat/st…'}]}",,False,,everyone,Twitter Web App
1515084937266933763,1302414106553724931,"@Strivarus Jajaj sii, nos recharazon ese objeto varias veces por configuraciónes tamaño etc y cuando salió tumbo roblox 😨",2022-04-15 21:49:32+00:00,,0,1,1,0,es,1514685626486034434,"[{'domain': {'id': '71', 'name': 'Video Game', 'description': 'A video game like Overwatch'}, 'entity': {'id': '1088118927580774400', 'name': 'Roblox', 'description': 'Roblox'}}]","{'mentions': [{'start': 0, 'end': 10, 'username': 'Strivarus', 'id': '1327818641644130306'}]}",,False,,everyone,Twitter for Android
1515086330614763520,1422163374339727363,"@Roblog_ @Roblox_RTC_BR Sabemos, aham.... MUAHAHAHAAHAHAHAAS (Sério, vem logo editar tweet)",2022-04-15 21:55:04+00:00,,2,2,8,0,pt,1515063121391628292,"[{'domain': {'id': '46', 'name': 'Brand Category', 'description': 'Categories within Brand Verticals that narrow down the scope of Brands'}, 'entity': {'id': '781974596752842752', 'name': 'Services'}}, {'domain': {'id': '47', 'name': 'Brand', 'description': 'Brands and Companies'}, 'entity': {'id': '10045225402', 'name': 'Twitter'}}]","{'mentions': [{'start': 0, 'end': 8, 'username': 'Roblog_', 'id': '1425933854733393926'}, {'start': 9, 'end': 23, 'username': 'Roblox_RTC_BR', 'id': '1417587809502826500'}]}",,False,,everyone,Twitter Web App
1515085834705321993,3248813666,"Today I got to speak about my #RobloxDev experience &amp; transition from player to creator :D 
Spoke to a fancy crowd of over 1000+ staff at @Roblox, and even got to show off something fun I’m releasing mid-May,,, Super thankful to have this supportive platform 🌿❤️

Have a fish https://t.co/mXtqY8gZKt",2022-04-15 21:53:06+00:00,,11,12,236,1,en,1515085834705321993,"[{'domain': {'id': '71', 'name': 'Video Game', 'description': 'A video game like Overwatch'}, 'entity': {'id': '1088118927580774400', 'name': 'Roblox', 'description': 'Roblox'}}]","{'mentions': [{'start': 142, 'end': 149, 'username': 'Roblox', 'id': '16745055'}], 'hashtags': [{'start': 30, 'end': 40, 'tag': 'RobloxDev'}], 'urls': [{'start': 280, 'end': 303, 'url': 'https://t.co/mXtqY8gZKt', 'expanded_url': 'https://twitter.com/EvilArtist_/status/1515085834705321993/photo/1', 'display_url': 'pic.twitter.com/mXtqY8gZKt', 'media_key': '3_1515085829810622464'}]}",{'media_keys': ['3_1515085829810622464']},False,,everyone,Twitter for iPad
1514366060257951751,16745055,You’re already clearing up in Arsenal. Now do it with style. Amazon Prime users can get the @primegaming Virtual Nomad Bundle by @ROLVeStuff here: https://t.co/jUbfif33rM https://t.co/seK5wlQSY7,2022-04-13 22:12:58+00:00,,149,881,2596,26,en,1514366060257951751,"[{'domain': {'id': '71', 'name': 'Video Game', 'description': 'A video game like Overwatch'}, 'entity': {'id': '1088118927580774400', 'name': 'Roblox', 'description': 'Roblox'}}, {'domain': {'id': '45', 'name': 'Brand Vertical', 'description': 'Top level entities that describe a Brands industry'}, 'entity': {'id': '781974596706635776', 'name': 'Retail'}}, {'domain': {'id': '46', 'name': 'Brand Category', 'description': 'Categories within Brand Verticals that narrow down the scope of Brands'}, 'entity': {'id': '783335558466506752', 'name': 'Online'}}, {'domain': {'id': '47', 'name': 'Brand', 'description': 'Brands and Companies'}, 'entity': {'id': '10026792024', 'name': 'Amazon'}}, {'domain': {'id': '48', 'name': 'Product', 'description': 'Products created by Brands.  Examples: Ford Explorer, Apple iPhone.'}, 'entity': {'id': '10046538542', 'name': 'Amazon Prime'}}]","{'mentions': [{'start': 92, 'end': 104, 'username': 'primegaming', 'id': '759027320560627712'}, {'start': 129, 'end': 140, 'username': 'ROLVeStuff', 'id': '2995414579'}], 'annotations': [{'start': 30, 'end': 36, 'probability': 0.6733, 'type': 'Place', 'normalized_text': 'Arsenal'}, {'start': 61, 'end': 72, 'probability': 0.4441, 'type': 'Product', 'normalized_text': 'Amazon Prime'}], 'urls': [{'start': 147, 'end': 170, 'url': 'https://t.co/jUbfif33rM', 'expanded_url': 'https://rblx.co/Virtual-Nomad', 'display_url': 'rblx.co/Virtual-Nomad'}, {'start': 171, 'end': 194, 'url': 'https://t.co/seK5wlQSY7', 'expanded_url': 'https://twitter.com/Roblox/status/1514366060257951751/video/1', 'display_url': 'pic.twitter.com/seK5wlQSY7', 'media_key': '7_1514365737481080835'}]}",{'media_keys': ['7_1514365737481080835']},False,,everyone,Twitter Web App
1514979501314383872,1200823509548707840,"-@ithzGuille 🤍🎉
Mi vida feliz cumple, eres una persona super linda y muy amable con todos, en general eres muy especial para mí &lt;3
Te quiero muchísimo y espero volver a jugar un roblos contigo jeje
De verdad que te mereces todo lo bonito sol 
Bueno, disfruta muchísimo tu día 💞 https://t.co/YearxEd4Jc",2022-04-15 14:50:34+00:00,,0,2,1,0,es,1514979501314383872,[],"{'mentions': [{'start': 1, 'end': 12, 'username': 'ithzGuille', 'id': '1397385181745516546'}], 'urls': [{'start': 281, 'end': 304, 'url': 'https://t.co/YearxEd4Jc', 'expanded_url': 'https://twitter.com/Ivsaxorcus/status/1514979501314383872/photo/1', 'display_url': 'pic.twitter.com/YearxEd4Jc', 'media_key': '3_1514979497975906304'}]}",{'media_keys': ['3_1514979497975906304']},False,,everyone,Twitter for Android
