tweetid,author_id,text,created_at,geo,retweets,replies,likes,quote_count,lang,conversation_id,context_annotations,entities,attachments,possibly_sensitive,withheld,reply_settings,source
1278000258979516419,16745055,Best way to look like a boss? Look like an actual boss. 🌋 https://t.co/tFMdPQF1qo,2020-06-30 16:19:40+00:00,,73,156,1644,6,en,1278000258979516419,"[{'domain': {'id': '71', 'name': 'Video Game', 'description': 'A video game like Overwatch'}, 'entity': {'id': '1088118927580774400', 'name': 'Roblox', 'description': 'Roblox'}}]","{'urls': [{'start': 58, 'end': 81, 'url': 'https://t.co/tFMdPQF1qo', 'expanded_url': 'https://twitter.com/Olicai/status/1276345829079396355', 'display_url': 'twitter.com/Olicai/status/…'}]}",,False,,everyone,Twitter Web App
1519541259160883201,28384755,#WORKOUTWEDNESDAY - it’s time to upgrade your avatar! Make sure to check out our virtual shop: #f21shopcity on @Roblox! https://t.co/1ddvjyCzNj,2022-04-28 04:57:22+00:00,,11,12,75,2,en,1519541259160883201,"[{'domain': {'id': '45', 'name': 'Brand Vertical', 'description': 'Top level entities that describe a Brands industry'}, 'entity': {'id': '781974596706635776', 'name': 'Retail'}}, {'domain': {'id': '46', 'name': 'Brand Category', 'description': 'Categories within Brand Verticals that narrow down the scope of Brands'}, 'entity': {'id': '781974596715024385', 'name': 'Apparel/Accessories'}}, {'domain': {'id': '47', 'name': 'Brand', 'description': 'Brands and Companies'}, 'entity': {'id': '10040780782', 'name': 'Forever 21'}}, {'domain': {'id': '65', 'name': 'Interests and Hobbies Vertical', 'description': 'Top level interests and hobbies groupings, like Food or Travel'}, 'entity': {'id': '844603730221707264', 'name': 'Fashion', 'description': 'Fashion'}}, {'domain': {'id': '66', 'name': 'Interests and Hobbies Category', 'description': 'A grouping of interests and hobbies entities, like Novelty Food or Destinations'}, 'entity': {'id': '846427983237672960', 'name': 'Fashion Brand', 'description': 'Fashion Brand'}}, {'domain': {'id': '71', 'name': 'Video Game', 'description': 'A video game like Overwatch'}, 'entity': {'id': '1088118927580774400', 'name': 'Roblox', 'description': 'Roblox'}}, {'domain': {'id': '45', 'name': 'Brand Vertical', 'description': 'Top level entities that describe a Brands industry'}, 'entity': {'id': '781974596706635776', 'name': 'Retail'}}, {'domain': {'id': '46', 'name': 'Brand Category', 'description': 'Categories within Brand Verticals that narrow down the scope of Brands'}, 'entity': {'id': '781974596715024385', 'name': 'Apparel/Accessories'}}, {'domain': {'id': '47', 'name': 'Brand', 'description': 'Brands and Companies'}, 'entity': {'id': '10040780782', 'name': 'Forever 21'}}]","{'urls': [{'start': 120, 'end': 143, 'url': 'https://t.co/1ddvjyCzNj', 'expanded_url': 'https://twitter.com/Forever21/status/1519541259160883201/photo/1', 'display_url': 'pic.twitter.com/1ddvjyCzNj', 'media_key': '3_1519541252714237952'}], 'mentions': [{'start': 111, 'end': 118, 'username': 'Roblox', 'id': '16745055'}], 'hashtags': [{'start': 0, 'end': 17, 'tag': 'WORKOUTWEDNESDAY'}, {'start': 95, 'end': 107, 'tag': 'f21shopcity'}]}",{'media_keys': ['3_1519541252714237952']},False,,everyone,Twitter for iPhone
1519883485669847040,912748734273921024,"To all my Naruto fans (if... there is any tbh, lol), what was the thing that got you into the series? Be it games or one of the movies or from word of mouth https://t.co/yRk2u4tXFI",2022-04-29 03:37:15+00:00,,1,6,4,0,en,1519883485669847040,"[{'domain': {'id': '130', 'name': 'Multimedia Franchise', 'description': ""Franchises which span multiple forms of media like 'Harry Potter'""}, 'entity': {'id': '1136329838350880768', 'name': 'Naruto', 'description': 'This entity includes all conversation about the franchise, as well as any individual installments in the series, if applicable.\t\t\t'}}]","{'annotations': [{'start': 10, 'end': 15, 'probability': 0.4239, 'type': 'Product', 'normalized_text': 'Naruto'}], 'urls': [{'start': 157, 'end': 180, 'url': 'https://t.co/yRk2u4tXFI', 'expanded_url': 'https://twitter.com/COMICFIRUKO/status/1519883485669847040/photo/1', 'display_url': 'pic.twitter.com/yRk2u4tXFI', 'media_key': '16_1519883479135051777'}]}",{'media_keys': ['16_1519883479135051777']},False,,everyone,Twitter for iPhone
1519666921569882112,1427600942933811200,Only old roblox players remember this menu https://t.co/6PP4JdQWdj,2022-04-28 13:16:42+00:00,,110,241,1761,25,en,1519666921569882112,"[{'domain': {'id': '71', 'name': 'Video Game', 'description': 'A video game like Overwatch'}, 'entity': {'id': '1088118927580774400', 'name': 'Roblox', 'description': 'Roblox'}}]","{'urls': [{'start': 43, 'end': 66, 'url': 'https://t.co/6PP4JdQWdj', 'expanded_url': 'https://twitter.com/JustEdgarDK/status/1519666921569882112/photo/1', 'display_url': 'pic.twitter.com/6PP4JdQWdj', 'media_key': '3_1519666917644333056'}]}",{'media_keys': ['3_1519666917644333056']},False,,everyone,Twitter for Android
1519851860173234177,1056053249470541824,"Ripull - The creator of Ripull’s Minigames - has disappeared off Roblox. It’s likely that he asked Roblox for his account to be deleted. He was going to quit soon, anyways, according to his Twitter. 😞‼️ https://t.co/GPQAJf7URD",2022-04-29 01:31:35+00:00,,103,170,1902,28,en,1519851860173234177,"[{'domain': {'id': '71', 'name': 'Video Game', 'description': 'A video game like Overwatch'}, 'entity': {'id': '1088118927580774400', 'name': 'Roblox', 'description': 'Roblox'}}, {'domain': {'id': '46', 'name': 'Brand Category', 'description': 'Categories within Brand Verticals that narrow down the scope of Brands'}, 'entity': {'id': '781974596752842752', 'name': 'Services'}}, {'domain': {'id': '47', 'name': 'Brand', 'description': 'Brands and Companies'}, 'entity': {'id': '10045225402', 'name': 'Twitter'}}]","{'annotations': [{'start': 24, 'end': 29, 'probability': 0.5223, 'type': 'Person', 'normalized_text': 'Ripull'}, {'start': 99, 'end': 104, 'probability': 0.2923, 'type': 'Person', 'normalized_text': 'Roblox'}, {'start': 190, 'end': 196, 'probability': 0.7147, 'type': 'Product', 'normalized_text': 'Twitter'}], 'urls': [{'start': 203, 'end': 226, 'url': 'https://t.co/GPQAJf7URD', 'expanded_url': 'https://twitter.com/Roblox_RTC/status/1519851860173234177/video/1', 'display_url': 'pic.twitter.com/GPQAJf7URD', 'media_key': '7_1519851830007713794'}]}",{'media_keys': ['7_1519851830007713794']},False,,everyone,Twitter for iPhone
1519886473201438723,1426374208213377029,vou e puxar o ronco Adeus,2022-04-29 03:49:07+00:00,,0,1,0,0,pt,1519886473201438723,[],,,False,,everyone,Twitter for Android
1519542793173098496,1120801797877260288,Ye flew from NY to LA and back to NY overnight to get the remaining unreleased footage of Kim's sex tape from Ray J and give it to her before her SNL appearance: https://t.co/Mv0agCseUE,2022-04-28 05:03:28+00:00,,9277,1888,92467,10273,en,1519542793173098496,[],"{'annotations': [{'start': 13, 'end': 14, 'probability': 0.9448, 'type': 'Place', 'normalized_text': 'NY'}, {'start': 19, 'end': 20, 'probability': 0.911, 'type': 'Place', 'normalized_text': 'LA'}, {'start': 34, 'end': 35, 'probability': 0.8964, 'type': 'Place', 'normalized_text': 'NY'}, {'start': 90, 'end': 92, 'probability': 0.9212, 'type': 'Person', 'normalized_text': 'Kim'}, {'start': 110, 'end': 114, 'probability': 0.9594, 'type': 'Person', 'normalized_text': 'Ray J'}, {'start': 146, 'end': 148, 'probability': 0.3712, 'type': 'Other', 'normalized_text': 'SNL'}], 'urls': [{'start': 162, 'end': 185, 'url': 'https://t.co/Mv0agCseUE', 'expanded_url': 'https://twitter.com/KanyeMedia_/status/1519542793173098496/video/1', 'display_url': 'pic.twitter.com/Mv0agCseUE', 'media_key': '7_1519541132937596930'}]}",{'media_keys': ['7_1519541132937596930']},False,,everyone,Twitter Web App
1519665947207897088,1102772383071387648,Your 3rd @ has to never ever play roblox again or else they’ll cease to exist,2022-04-28 13:12:50+00:00,,13,303,466,1,en,1519665947207897088,"[{'domain': {'id': '71', 'name': 'Video Game', 'description': 'A video game like Overwatch'}, 'entity': {'id': '1088118927580774400', 'name': 'Roblox', 'description': 'Roblox'}}]",,,False,,everyone,Twitter for iPhone
1518746214505844737,1314182615835070466,"because of roblox abusing the copyright system, my channel is going to be terminated from youtube in 7 days, i hope all my haters got the wish they all wanted, probably my last tweet ever again https://t.co/lldvug9U39",2022-04-26 00:18:09+00:00,,6,204,26,14,en,1518746214505844737,"[{'domain': {'id': '71', 'name': 'Video Game', 'description': 'A video game like Overwatch'}, 'entity': {'id': '1088118927580774400', 'name': 'Roblox', 'description': 'Roblox'}}, {'domain': {'id': '165', 'name': 'Technology', 'description': 'for individual and types of technology, e.g., food technology, 3D printing'}, 'entity': {'id': '1196446161223028736', 'name': 'Social media'}}, {'domain': {'id': '46', 'name': 'Brand Category', 'description': 'Categories within Brand Verticals that narrow down the scope of Brands'}, 'entity': {'id': '781974596752842752', 'name': 'Services'}}, {'domain': {'id': '47', 'name': 'Brand', 'description': 'Brands and Companies'}, 'entity': {'id': '10029382357', 'name': 'YouTube'}}, {'domain': {'id': '47', 'name': 'Brand', 'description': 'Brands and Companies'}, 'entity': {'id': '10045225402', 'name': 'Twitter'}}]","{'annotations': [{'start': 90, 'end': 96, 'probability': 0.4156, 'type': 'Organization', 'normalized_text': 'youtube'}], 'urls': [{'start': 194, 'end': 217, 'url': 'https://t.co/lldvug9U39', 'expanded_url': 'https://twitter.com/thegamerkh/status/1518746214505844737/photo/1', 'display_url': 'pic.twitter.com/lldvug9U39', 'media_key': '3_1518745635696123906'}]}",{'media_keys': ['3_1518745635696123906']},False,,everyone,Twitter Web App
1519880245700087809,1411003363936854017,@shrimpisneat Mildly offended you didn’t ask for help /j,2022-04-29 03:24:23+00:00,,0,1,1,0,en,1519808442361204737,[],"{'mentions': [{'start': 0, 'end': 13, 'username': 'shrimpisneat', 'id': '1169627129920622592'}]}",,False,,everyone,Twitter for iPhone
1519670556827668480,994940764730748928,i miss izone,2022-04-28 13:31:09+00:00,,2588,39,6819,166,en,1519670556827668480,"[{'domain': {'id': '10', 'name': 'Person', 'description': 'Named people in the world like Nelson Mandela'}, 'entity': {'id': '1042460886760214529', 'name': 'IZ*ONE', 'description': 'Iz One, stylized as IZONE or IZ*ONE, is a South Korean-Japanese girl group formed by CJ E&M through the 2018 Mnet reality competition television show Produce 48.'}}, {'domain': {'id': '54', 'name': 'Musician', 'description': 'A musician in the world, like Adele or Bob Dylan'}, 'entity': {'id': '1042460886760214529', 'name': 'IZ*ONE', 'description': 'Iz One, stylized as IZONE or IZ*ONE, is a South Korean-Japanese girl group formed by CJ E&M through the 2018 Mnet reality competition television show Produce 48.'}}, {'domain': {'id': '55', 'name': 'Music Genre', 'description': 'A category for a musical style, like Pop, Rock, or Rap'}, 'entity': {'id': '810938095772123136', 'name': 'J-pop', 'description': 'J-POP'}}, {'domain': {'id': '55', 'name': 'Music Genre', 'description': 'A category for a musical style, like Pop, Rock, or Rap'}, 'entity': {'id': '888105153038958593', 'name': 'K-pop', 'description': 'K-Pop'}}]",,,False,,everyone,Twitter for Android
1519506216023699458,1493373512266010630,"The FBI arrive at your door, your Last saved photo is why. https://t.co/QQsfDPaFSG",2022-04-28 02:38:07+00:00,,498,7531,12753,2897,en,1519506216023699458,"[{'domain': {'id': '88', 'name': 'Political Body', 'description': 'A section of a government, like The Supreme Court'}, 'entity': {'id': '937710668706299904', 'name': 'Federal Bureau of Investigation', 'description': 'All conversation about the United States Federal Bureau of Investigation'}}]","{'annotations': [{'start': 4, 'end': 6, 'probability': 0.9689, 'type': 'Organization', 'normalized_text': 'FBI'}], 'urls': [{'start': 59, 'end': 82, 'url': 'https://t.co/QQsfDPaFSG', 'expanded_url': 'https://twitter.com/Toxictrap22/status/1519506216023699458/photo/1', 'display_url': 'pic.twitter.com/QQsfDPaFSG', 'media_key': '3_1519506213402251265'}]}",{'media_keys': ['3_1519506213402251265']},False,,everyone,Twitter for iPhone
1519879302308929537,1107392661198118914,"All these collabs lately from companies with Roblox (Sonic, Hello Kitty, NFL) have me thinking... What if Nintendo decides to Collab with Roblox? If this could ever happen, do you think they could possibly allow Pokemon Brick Bronze on the site again?",2022-04-29 03:20:38+00:00,,6,74,404,0,en,1519879302308929537,"[{'domain': {'id': '3', 'name': 'TV Shows', 'description': 'Television shows from around the world'}, 'entity': {'id': '10000612773', 'name': 'NFL Football', 'description': 'Replays of classic NFL games.'}}, {'domain': {'id': '3', 'name': 'TV Shows', 'description': 'Television shows from around the world'}, 'entity': {'id': '10032425201', 'name': 'NFL Football'}}, {'domain': {'id': '3', 'name': 'TV Shows', 'description': 'Television shows from around the world'}, 'entity': {'id': '10033407327', 'name': 'Futebol NFL'}}, {'domain': {'id': '3', 'name': 'TV Shows', 'description': 'Television shows from around the world'}, 'entity': {'id': '10042261464', 'name': 'Fútbol Americano de la NFL'}}, {'domain': {'id': '10', 'name': 'Person', 'description': 'Named people in the world like Nelson Mandela'}, 'entity': {'id': '1443277565393719296', 'name': 'Hello Kitty'}}, {'domain': {'id': '11', 'name': 'Sport', 'description': 'Types of sports, like soccer and basketball'}, 'entity': {'id': '689566306014617600', 'name': 'American football'}}, {'domain': {'id': '26', 'name': 'Sports League', 'description': ''}, 'entity': {'id': '689566314835259392', 'name': 'NFL'}}, {'domain': {'id': '45', 'name': 'Brand Vertical', 'description': 'Top level entities that describe a Brands industry'}, 'entity': {'id': '781974597310615553', 'name': 'Entertainment'}}, {'domain': {'id': '46', 'name': 'Brand Category', 'description': 'Categories within Brand Verticals that narrow down the scope of Brands'}, 'entity': {'id': '781974597218340864', 'name': 'Video Games'}}, {'domain': {'id': '47', 'name': 'Brand', 'description': 'Brands and Companies'}, 'entity': {'id': '10026713294', 'name': 'Nintendo'}}, {'domain': {'id': '47', 'name': 'Brand', 'description': 'Brands and Companies'}, 'entity': {'id': '1443277565393719296', 'name': 'Hello Kitty'}}, {'domain': {'id': '71', 'name': 'Video Game', 'description': 'A video game like Overwatch'}, 'entity': {'id': '1088118927580774400', 'name': 'Roblox', 'description': 'Roblox'}}, {'domain': {'id': '78', 'name': 'Video Game Publisher', 'description': ""A Video Game Publisher like 'Activision'""}, 'entity': {'id': '10026713294', 'name': 'Nintendo'}}, {'domain': {'id': '122', 'name': 'Fictional Character', 'description': 'A person or other being in a narrative work of art, like Tom Sawyer or Jon Snow'}, 'entity': {'id': '1443277565393719296', 'name': 'Hello Kitty'}}, {'domain': {'id': '130', 'name': 'Multimedia Franchise', 'description': ""Franchises which span multiple forms of media like 'Harry Potter'""}, 'entity': {'id': '10045599546', 'name': 'Pokémon', 'description': 'This entity includes all conversation about the franchise, as well as any individual installments in the series, if applicable. **NOTE: Annotations redirected to domain 130 ONLY on 8/7/18.'}}, {'domain': {'id': '130', 'name': 'Multimedia Franchise', 'description': ""Franchises which span multiple forms of media like 'Harry Potter'""}, 'entity': {'id': '993952643209773057', 'name': 'Sonic the Hedgehog', 'description': 'This entity includes all conversation about the franchise, as well as any individual installments in the series, if applicable.\t\t\t\n\nNOTE: Stopped annotating in the Video Game domain (71) on 11/15/19. Moving forward, this entity will annotate to Multimedia Franchise domain (130) only.'}}, {'domain': {'id': '45', 'name': 'Brand Vertical', 'description': 'Top level entities that describe a Brands industry'}, 'entity': {'id': '781974597310615553', 'name': 'Entertainment'}}, {'domain': {'id': '46', 'name': 'Brand Category', 'description': 'Categories within Brand Verticals that narrow down the scope of Brands'}, 'entity': {'id': '781974597491040257', 'name': 'Sports'}}, {'domain': {'id': '47', 'name': 'Brand', 'description': 'Brands and Companies'}, 'entity': {'id': '10042758256', 'name': 'NFL'}}]","{'annotations': [{'start': 45, 'end': 50, 'probability': 0.5336, 'type': 'Product', 'normalized_text': 'Roblox'}, {'start': 60, 'end': 70, 'probability': 0.3547, 'type': 'Product', 'normalized_text': 'Hello Kitty'}, {'start': 73, 'end': 75, 'probability': 0.7267, 'type': 'Organization', 'normalized_text': 'NFL'}, {'start': 106, 'end': 113, 'probability': 0.4451, 'type': 'Organization', 'normalized_text': 'Nintendo'}, {'start': 138, 'end': 143, 'probability': 0.522, 'type': 'Product', 'normalized_text': 'Roblox'}, {'start': 212, 'end': 231, 'probability': 0.7444, 'type': 'Product', 'normalized_text': 'Pokemon Brick Bronze'}]}",,False,,everyone,Twitter Web App
1519885908115394560,853440633469587456,@brownfrog4 @L4mbdaAntenox non grinder,2022-04-29 03:46:53+00:00,,0,1,0,0,da,1519884428125822979,[],"{'mentions': [{'start': 0, 'end': 11, 'username': 'brownfrog4', 'id': '976945123467591680'}]}",,False,,everyone,Twitter for Android
1519695192336388098,16745055,"Music fans, join us on @Roblox this Saturday for the 2nd annual Song Breaker Awards. The show starring host @bretmanrock and performers @lizzo and @whoisgayle will be live at 10AM PST. See you there! https://t.co/y83wU0644X https://t.co/rnTQm4dqNx",2022-04-28 15:09:03+00:00,,133,616,2057,18,en,1519695192336388098,"[{'domain': {'id': '10', 'name': 'Person', 'description': 'Named people in the world like Nelson Mandela'}, 'entity': {'id': '1117789006916243456', 'name': 'Lizzo', 'description': 'American rapper'}}, {'domain': {'id': '10', 'name': 'Person', 'description': 'Named people in the world like Nelson Mandela'}, 'entity': {'id': '1141044727136940032', 'name': 'Bretman Rock', 'description': 'Bretman Rock'}}, {'domain': {'id': '54', 'name': 'Musician', 'description': 'A musician in the world, like Adele or Bob Dylan'}, 'entity': {'id': '1117789006916243456', 'name': 'Lizzo', 'description': 'American rapper'}}, {'domain': {'id': '55', 'name': 'Music Genre', 'description': 'A category for a musical style, like Pop, Rock, or Rap'}, 'entity': {'id': '810937888334487552', 'name': 'Rap', 'description': 'Hip-Hop/Rap'}}, {'domain': {'id': '71', 'name': 'Video Game', 'description': 'A video game like Overwatch'}, 'entity': {'id': '1088118927580774400', 'name': 'Roblox', 'description': 'Roblox'}}, {'domain': {'id': '120', 'name': 'Digital Creator', 'description': 'Influencers who create content on digital platforms'}, 'entity': {'id': '1141044727136940032', 'name': 'Bretman Rock', 'description': 'Bretman Rock'}}]","{'annotations': [{'start': 64, 'end': 82, 'probability': 0.554, 'type': 'Other', 'normalized_text': 'Song Breaker Awards'}], 'urls': [{'start': 200, 'end': 223, 'url': 'https://t.co/y83wU0644X', 'expanded_url': 'https://rblx.co/songbreakerawards', 'display_url': 'rblx.co/songbreakerawa…', 'status': 200, 'title': 'Explore the Song Breaker World', 'description': 'You’re invited to the Logitech Song Breaker Awards, the first music awards show in the metaverse! Join Bretman Rock, MeganPlays, Shroud and Jaden Smith to celebrate groundbreaking creators like Walker Hayes and Cost n’ Mayor who are shaping pop music today through dance challenges, memes and trends shared on TikTok and YouTube. Watch Lizzo’s debut performance on Roblox with her new song “Special” and get up close with GAYLE, who will be performing her Billboard no. 1 hit “abcde-forget-u.” The award show', 'unwound_url': 'https://www.roblox.com/songbreakerawards'}, {'start': 224, 'end': 247, 'url': 'https://t.co/rnTQm4dqNx', 'expanded_url': 'https://twitter.com/Roblox/status/1519695192336388098/video/1', 'display_url': 'pic.twitter.com/rnTQm4dqNx', 'media_key': '7_1519694782519410689'}], 'mentions': [{'start': 23, 'end': 30, 'username': 'Roblox', 'id': '16745055'}, {'start': 108, 'end': 120, 'username': 'bretmanrock', 'id': '291547392'}, {'start': 136, 'end': 142, 'username': 'lizzo', 'id': '323417384'}, {'start': 147, 'end': 158, 'username': 'whoisgayle', 'id': '1098295826424713216'}]}",{'media_keys': ['7_1519694782519410689']},False,,everyone,Twitter Web App
1519884386467987457,1417465231383609351,@BasedMexx @Dragonogon This is arma 3,2022-04-29 03:40:50+00:00,,0,1,0,0,en,1519872418327810048,[],"{'mentions': [{'start': 0, 'end': 10, 'username': 'BasedMexx', 'id': '702687668346355712'}, {'start': 11, 'end': 22, 'username': 'Dragonogon', 'id': '866762544'}]}",,False,,everyone,Twitter for iPhone
1519864515558522880,1072234131919175680,WHAT WERE U DOING WHEN THE TRACKLIST CAME OUT,2022-04-29 02:21:52+00:00,,178,1989,8451,1459,en,1519864515558522880,[],,,False,,everyone,Twitter for iPhone
1519810521691680768,1401851980562063367,"Guess this Roblox Game &amp; win ROBUX! ⭐️

(Must be following @TheCodedGalaxy or you can’t claim prize!) https://t.co/hAwZmyNjAI",2022-04-28 22:47:19+00:00,,29,451,141,1,en,1519810521691680768,"[{'domain': {'id': '71', 'name': 'Video Game', 'description': 'A video game like Overwatch'}, 'entity': {'id': '1088118927580774400', 'name': 'Roblox', 'description': 'Roblox'}}]","{'annotations': [{'start': 11, 'end': 21, 'probability': 0.4636, 'type': 'Product', 'normalized_text': 'Roblox Game'}], 'urls': [{'start': 106, 'end': 129, 'url': 'https://t.co/hAwZmyNjAI', 'expanded_url': 'https://twitter.com/TheCodedGalaxy/status/1519810521691680768/photo/1', 'display_url': 'pic.twitter.com/hAwZmyNjAI', 'media_key': '3_1519810514397802496'}], 'mentions': [{'start': 63, 'end': 78, 'username': 'TheCodedGalaxy', 'id': '1401851980562063367'}]}",{'media_keys': ['3_1519810514397802496']},False,,everyone,Twitter for iPhone
1519692576118697990,1490829841284747265,"a quick rt have a chance to win some #robux!

rules:
- follow me + @stxxlxght 
- rt

higher chance to be picked in thread",2022-04-28 14:58:39+00:00,,23,21,22,13,en,1519692576118697990,"[{'domain': {'id': '71', 'name': 'Video Game', 'description': 'A video game like Overwatch'}, 'entity': {'id': '1088118927580774400', 'name': 'Roblox', 'description': 'Roblox'}}]","{'mentions': [{'start': 67, 'end': 77, 'username': 'stxxlxght', 'id': '1223478701502812161'}], 'hashtags': [{'start': 37, 'end': 43, 'tag': 'robux'}]}",,False,,mentionedUsers,Twitter for Android
1519873412210036738,1335008972563210240,"@KiwamiFomk @suicidxbladxs Você também nunca sentiu, você é virgem e joga Elden ring 5 horas por dia.",2022-04-29 02:57:14+00:00,,0,1,0,0,pt,1519734408823115782,"[{'domain': {'id': '71', 'name': 'Video Game', 'description': 'A video game like Overwatch'}, 'entity': {'id': '1135979287733948416', 'name': 'Elden Ring'}}]","{'mentions': [{'start': 0, 'end': 11, 'username': 'KiwamiFomk', 'id': '1286903182610911232'}, {'start': 12, 'end': 26, 'username': 'suicidxbladxs', 'id': '1232490477573857281'}]}",,False,,everyone,Twitter for Android
1518653192044564480,1507763221687529475,@RandomlyHere113 @Roblox_RTC @RockPandaGames Just like your dad left to go get some milk and never came back,2022-04-25 18:08:30+00:00,,0,1,0,0,en,1518202797086367744,"[{'domain': {'id': '152', 'name': 'Food', 'description': 'Topics about food, like Donuts or Brunch'}, 'entity': {'id': '850419241790472192', 'name': 'Milk', 'description': 'Milk'}}, {'domain': {'id': '173', 'name': 'Google Product Taxonomy', 'description': 'A product taxonomy created by Google'}, 'entity': {'id': '850419241790472192', 'name': 'Milk', 'description': 'Milk'}}]","{'mentions': [{'start': 0, 'end': 16, 'username': 'RandomlyHere113', 'id': '1451289384943185934'}, {'start': 17, 'end': 28, 'username': 'Roblox_RTC', 'id': '1056053249470541824'}, {'start': 29, 'end': 44, 'username': 'RockPandaGames', 'id': '1327135818390114305'}]}",,False,,everyone,Twitter Web App
1519884750768545793,1493975258856136707,@aobngtn ARI ITS THE ROBLOX GAMES,2022-04-29 03:42:17+00:00,,0,1,1,0,en,1519883647100362752,"[{'domain': {'id': '71', 'name': 'Video Game', 'description': 'A video game like Overwatch'}, 'entity': {'id': '1088118927580774400', 'name': 'Roblox', 'description': 'Roblox'}}]","{'annotations': [{'start': 9, 'end': 11, 'probability': 0.5827, 'type': 'Person', 'normalized_text': 'ARI'}], 'mentions': [{'start': 0, 'end': 8, 'username': 'aobngtn', 'id': '1493981070580383744'}]}",,False,,everyone,Twitter for iPhone
1519884907249422337,3021720798,"@Kittzillaa Oh my gosh I used to have this for a few months straight not too long ago and this tweet just made me realize I hadn't experienced it for a bit

- more water
- more sleep
- less caffeine
- More fruit/veggie
- More screen breaks 

GOOD LUCK I HOPE IT STOPS",2022-04-29 03:42:54+00:00,,0,1,8,0,en,1519872480814501890,"[{'domain': {'id': '46', 'name': 'Brand Category', 'description': 'Categories within Brand Verticals that narrow down the scope of Brands'}, 'entity': {'id': '781974596752842752', 'name': 'Services'}}, {'domain': {'id': '47', 'name': 'Brand', 'description': 'Brands and Companies'}, 'entity': {'id': '10045225402', 'name': 'Twitter'}}]","{'mentions': [{'start': 0, 'end': 11, 'username': 'Kittzillaa', 'id': '3152021005'}]}",,False,,everyone,Twitter Web App
