tweetid,author_id,text,created_at,geo,retweets,replies,likes,quote_count,lang,conversation_id,context_annotations,entities,attachments,possibly_sensitive,withheld,reply_settings,source
1491900795574444034,1460728870991237126,@woman_m0ment We all know this is the worst list to exist like what mfer puts McDonald’s and subway on the same tier? Anyway whoaoaoaoaoaoaoaoa oh oh story of undertale I fell from the light talk or should I fight monster genocide this is my undertale+,2022-02-10 22:24:02+00:00,,0,2,2,0,en,1488395824639918083,"[{'domain': {'id': '45', 'name': 'Brand Vertical', 'description': 'Top level entities that describe a Brands industry'}, 'entity': {'id': '781974596161376261', 'name': 'Dining'}}, {'domain': {'id': '46', 'name': 'Brand Category', 'description': 'Categories within Brand Verticals that narrow down the scope of Brands'}, 'entity': {'id': '781974597017083904', 'name': 'QSR'}}, {'domain': {'id': '47', 'name': 'Brand', 'description': 'Brands and Companies'}, 'entity': {'id': '10026319219', 'name': 'Subway'}}, {'domain': {'id': '30', 'name': 'Entities [Entity Service]', 'description': 'Entity Service top level domain, every item that is in Entity Service should be in this domain'}, 'entity': {'id': '825047692124442624', 'name': 'Food', 'description': 'Food'}}, {'domain': {'id': '71', 'name': 'Video Game', 'description': 'A video game like Overwatch'}, 'entity': {'id': '1057622481396068352', 'name': 'Undertale', 'description': 'Undertale'}}, {'domain': {'id': '152', 'name': 'Food', 'description': 'Topics about food, like Donuts or Brunch'}, 'entity': {'id': '847865239886417922', 'name': 'Fast food Restaurants', 'description': 'Fast food'}}]","{'annotations': [{'start': 78, 'end': 85, 'probability': 0.722, 'type': 'Person', 'normalized_text': 'McDonald'}], 'mentions': [{'start': 0, 'end': 13, 'username': 'woman_m0ment', 'id': '761320523221508096'}]}",,False,,everyone,Twitter for iPhone
1514601491327164435,876953939664678912,#Roblox I got banned PERMANENTLY for mentioning a furry hater raid in a game and I was not part of this (I am furry myself) If there is someone that can help me solve it please do i really don't wanna lose my account I have it since 2017 and i don't want to lose its progress 🙏🙏 https://t.co/wEnhe5Qqep,2022-04-14 13:48:30+00:00,,13,10,13,0,en,1514601491327164435,"[{'domain': {'id': '71', 'name': 'Video Game', 'description': 'A video game like Overwatch'}, 'entity': {'id': '1088118927580774400', 'name': 'Roblox', 'description': 'Roblox'}}]","{'urls': [{'start': 279, 'end': 302, 'url': 'https://t.co/wEnhe5Qqep', 'expanded_url': 'https://twitter.com/Nal_WingsTracks/status/1514601491327164435/photo/1', 'display_url': 'pic.twitter.com/wEnhe5Qqep', 'media_key': '3_1514601110492762124'}], 'hashtags': [{'start': 0, 'end': 7, 'tag': 'Roblox'}]}",{'media_keys': ['3_1514601110492762124']},False,,everyone,Twitter Web App
1515012793031876609,1098681192663212033,@safrzb @sonic_hedgehog @Roblox https://t.co/tOUuaPmDiW,2022-04-15 17:02:52+00:00,,1,3,75,0,qme,1515011598812794883,"[{'domain': {'id': '71', 'name': 'Video Game', 'description': 'A video game like Overwatch'}, 'entity': {'id': '1088118927580774400', 'name': 'Roblox', 'description': 'Roblox'}}, {'domain': {'id': '130', 'name': 'Multimedia Franchise', 'description': ""Franchises which span multiple forms of media like 'Harry Potter'""}, 'entity': {'id': '993952643209773057', 'name': 'Sonic the Hedgehog', 'description': 'This entity includes all conversation about the franchise, as well as any individual installments in the series, if applicable.\t\t\t\n\nNOTE: Stopped annotating in the Video Game domain (71) on 11/15/19. Moving forward, this entity will annotate to Multimedia Franchise domain (130) only.'}}]","{'urls': [{'start': 32, 'end': 55, 'url': 'https://t.co/tOUuaPmDiW', 'expanded_url': 'https://twitter.com/LocalGrimeStan/status/1515012793031876609/photo/1', 'display_url': 'pic.twitter.com/tOUuaPmDiW', 'media_key': '3_1515012789110251520'}], 'mentions': [{'start': 8, 'end': 23, 'username': 'sonic_hedgehog', 'id': '19609162'}, {'start': 24, 'end': 31, 'username': 'Roblox', 'id': '16745055'}]}",{'media_keys': ['3_1515012789110251520']},False,,everyone,Twitter for iPhone
1515030688579428355,1252340795853746176,Vibes https://t.co/rNccXNqkWQ,2022-04-15 18:13:58+00:00,,2,1,4,0,es,1515030688579428355,[],"{'urls': [{'start': 6, 'end': 29, 'url': 'https://t.co/rNccXNqkWQ', 'expanded_url': 'https://twitter.com/GemmaGersbach/status/1515030688579428355/photo/1', 'display_url': 'pic.twitter.com/rNccXNqkWQ', 'media_key': '3_1515030685148405764'}]}",{'media_keys': ['3_1515030685148405764']},False,,everyone,Twitter for Android
1514923802144223243,1354165354872905731,Kim Kardashian finding out Saint saw her Jiggy jiggy video ad on Roblox has me crying 😭🤣😭 https://t.co/MrHx4vLwcJ,2022-04-15 11:09:15+00:00,,122,63,1415,129,en,1514923802144223243,"[{'domain': {'id': '10', 'name': 'Person', 'description': 'Named people in the world like Nelson Mandela'}, 'entity': {'id': '806570121959383040', 'name': 'Kim Kardashian', 'description': 'Kim Kardashian'}}, {'domain': {'id': '58', 'name': 'Entertainment Personality', 'description': 'An entertainment personality in the world, like Anderson Cooper or Miranda Sings'}, 'entity': {'id': '806570121959383040', 'name': 'Kim Kardashian', 'description': 'Kim Kardashian'}}, {'domain': {'id': '71', 'name': 'Video Game', 'description': 'A video game like Overwatch'}, 'entity': {'id': '1088118927580774400', 'name': 'Roblox', 'description': 'Roblox'}}]","{'urls': [{'start': 90, 'end': 113, 'url': 'https://t.co/MrHx4vLwcJ', 'expanded_url': 'https://twitter.com/JustinGLakey/status/1514923802144223243/video/1', 'display_url': 'pic.twitter.com/MrHx4vLwcJ', 'media_key': '7_1514923705088069634'}], 'annotations': [{'start': 0, 'end': 13, 'probability': 0.9894, 'type': 'Person', 'normalized_text': 'Kim Kardashian'}, {'start': 27, 'end': 31, 'probability': 0.8592, 'type': 'Person', 'normalized_text': 'Saint'}, {'start': 65, 'end': 70, 'probability': 0.3888, 'type': 'Product', 'normalized_text': 'Roblox'}]}",{'media_keys': ['7_1514923705088069634']},False,,everyone,Twitter for iPhone
1514635854886719502,759027320560627712,"Time for another #PrimeGaming swag giveaway! Plus this time, we're including a NERF @Roblox Arsenal Pulse Laser Blaster!

Follow + RT to be entered for a chance to win! (ARV: $115)! Ends 5pm PT 4/18. NoPurchNec. US only. 18+. Rules: https://t.co/rDuHTe1PaM. Will DM the winner. https://t.co/pVSVLiFpHf",2022-04-14 16:05:03+00:00,,840,123,963,9,en,1514635854886719502,"[{'domain': {'id': '71', 'name': 'Video Game', 'description': 'A video game like Overwatch'}, 'entity': {'id': '1088118927580774400', 'name': 'Roblox', 'description': 'Roblox'}}]","{'urls': [{'start': 233, 'end': 256, 'url': 'https://t.co/rDuHTe1PaM', 'expanded_url': 'http://amzn.to/Rules', 'display_url': 'amzn.to/Rules', 'status': 200, 'title': 'Amazon.com: Sweepstakes Terms and Conditions', 'description': 'Amazon.com: Sweepstakes Terms and Conditions', 'unwound_url': 'https://www.amazon.com/gp/feature.html?ie=UTF8&docId=1001421081'}, {'start': 278, 'end': 301, 'url': 'https://t.co/pVSVLiFpHf', 'expanded_url': 'https://twitter.com/primegaming/status/1514635854886719502/photo/1', 'display_url': 'pic.twitter.com/pVSVLiFpHf', 'media_key': '3_1514635850943979524'}], 'annotations': [{'start': 92, 'end': 118, 'probability': 0.3725, 'type': 'Product', 'normalized_text': 'Arsenal Pulse Laser Blaster'}], 'mentions': [{'start': 84, 'end': 91, 'username': 'Roblox', 'id': '16745055'}], 'hashtags': [{'start': 17, 'end': 29, 'tag': 'PrimeGaming'}]}",{'media_keys': ['3_1514635850943979524']},False,,everyone,Sprout Social
1514986676397178887,1318848121498075136,Tehe! Download genshin di hp 2/32 prossesor helio p35😅☝ https://t.co/NBIF1iQ2OK,2022-04-15 15:19:05+00:00,,5,76,331,81,en,1514986676397178887,"[{'domain': {'id': '71', 'name': 'Video Game', 'description': 'A video game like Overwatch'}, 'entity': {'id': '1310987643765678083', 'name': 'Genshin Impact'}}]","{'urls': [{'start': 56, 'end': 79, 'url': 'https://t.co/NBIF1iQ2OK', 'expanded_url': 'https://twitter.com/paimonfess/status/1514986676397178887/photo/1', 'display_url': 'pic.twitter.com/NBIF1iQ2OK', 'media_key': '3_1514986673909956614'}]}",{'media_keys': ['3_1514986673909956614']},True,,everyone,Twitter
