tweetid,author_id,text,created_at,geo,retweets,replies,likes,quote_count,lang,conversation_id,context_annotations,entities,attachments,possibly_sensitive,withheld,reply_settings,source
1515115979390472192,1056053249470541824,"🌎The @DoloTonight concert PREMIERED and was a show that was OUT OF THIS WORLD!

It premiered at 7 pm EST. There is also merch for Dolo on the avatar shop! Dolo Tonight's concert was a mocap concert that featured his new EP, Back To Earth. https://t.co/3ogQIRsj8I",2022-04-15 23:52:53+00:00,,35,59,430,3,en,1515115979390472192,[],"{'urls': [{'start': 239, 'end': 262, 'url': 'https://t.co/3ogQIRsj8I', 'expanded_url': 'https://twitter.com/Roblox_RTC/status/1515115979390472192/video/1', 'display_url': 'pic.twitter.com/3ogQIRsj8I', 'media_key': '7_1515115791225659397'}], 'annotations': [{'start': 225, 'end': 237, 'probability': 0.8855, 'type': 'Other', 'normalized_text': 'Back To Earth'}], 'mentions': [{'start': 5, 'end': 17, 'username': 'DoloTonight', 'id': '1154619146015035394'}]}",{'media_keys': ['7_1515115791225659397']},False,,everyone,Twitter Web App
1515116770616614920,1313217407603879938,"@DoloTonight @Roblox_RTC Are… are they just letting any artist have a concert on Roblox? No offense, but never even heard of you or anyone on the platform except for Lil Nas X.
Your music isn’t half bad though, kudos to the effort in your concert too.",2022-04-15 23:56:02+00:00,,0,2,6,0,en,1515115979390472192,"[{'domain': {'id': '10', 'name': 'Person', 'description': 'Named people in the world like Nelson Mandela'}, 'entity': {'id': '1121835842677305344', 'name': 'Lil Nas X'}}, {'domain': {'id': '54', 'name': 'Musician', 'description': 'A musician in the world, like Adele or Bob Dylan'}, 'entity': {'id': '1121835842677305344', 'name': 'Lil Nas X'}}, {'domain': {'id': '55', 'name': 'Music Genre', 'description': 'A category for a musical style, like Pop, Rock, or Rap'}, 'entity': {'id': '810937888334487552', 'name': 'Rap', 'description': 'Hip-Hop/Rap'}}, {'domain': {'id': '71', 'name': 'Video Game', 'description': 'A video game like Overwatch'}, 'entity': {'id': '1088118927580774400', 'name': 'Roblox', 'description': 'Roblox'}}]","{'annotations': [{'start': 81, 'end': 86, 'probability': 0.3844, 'type': 'Product', 'normalized_text': 'Roblox'}, {'start': 166, 'end': 176, 'probability': 0.2485, 'type': 'Person', 'normalized_text': 'Lil Nas X.'}], 'mentions': [{'start': 0, 'end': 12, 'username': 'DoloTonight', 'id': '1154619146015035394'}, {'start': 13, 'end': 24, 'username': 'Roblox_RTC', 'id': '1056053249470541824'}]}",,False,,everyone,Twitter Web App
1515109194004848640,4093077509,What if MrBeast added you on Roblox? https://t.co/HJujdtaOAu,2022-04-15 23:25:55+00:00,,11,68,349,1,en,1515109194004848640,"[{'domain': {'id': '10', 'name': 'Person', 'description': 'Named people in the world like Nelson Mandela'}, 'entity': {'id': '1126559222122942464', 'name': 'MrBeast'}}, {'domain': {'id': '71', 'name': 'Video Game', 'description': 'A video game like Overwatch'}, 'entity': {'id': '1088118927580774400', 'name': 'Roblox', 'description': 'Roblox'}}, {'domain': {'id': '120', 'name': 'Digital Creator', 'description': 'Influencers who create content on digital platforms'}, 'entity': {'id': '1126559222122942464', 'name': 'MrBeast'}}]","{'urls': [{'start': 37, 'end': 60, 'url': 'https://t.co/HJujdtaOAu', 'expanded_url': 'https://twitter.com/ftDerpy/status/1515109194004848640/photo/1', 'display_url': 'pic.twitter.com/HJujdtaOAu', 'media_key': '3_1515108806484795394'}], 'annotations': [{'start': 8, 'end': 14, 'probability': 0.4996, 'type': 'Person', 'normalized_text': 'MrBeast'}, {'start': 29, 'end': 34, 'probability': 0.5388, 'type': 'Product', 'normalized_text': 'Roblox'}]}",{'media_keys': ['3_1515108806484795394']},False,,everyone,Twitter Web App
1515107324842725381,1076839739418918912,no. clue what the kanye kim sextape thing i just rted was abt.. i just saw roblox,2022-04-15 23:18:30+00:00,,0,1,0,0,en,1515107324842725381,"[{'domain': {'id': '10', 'name': 'Person', 'description': 'Named people in the world like Nelson Mandela'}, 'entity': {'id': '806561823407239169', 'name': 'Kanye West', 'description': 'Kanye West'}}, {'domain': {'id': '10', 'name': 'Person', 'description': 'Named people in the world like Nelson Mandela'}, 'entity': {'id': '806570121959383040', 'name': 'Kim Kardashian', 'description': 'Kim Kardashian'}}, {'domain': {'id': '54', 'name': 'Musician', 'description': 'A musician in the world, like Adele or Bob Dylan'}, 'entity': {'id': '806561823407239169', 'name': 'Kanye West', 'description': 'Kanye West'}}, {'domain': {'id': '55', 'name': 'Music Genre', 'description': 'A category for a musical style, like Pop, Rock, or Rap'}, 'entity': {'id': '810937888334487552', 'name': 'Rap', 'description': 'Hip-Hop/Rap'}}, {'domain': {'id': '58', 'name': 'Entertainment Personality', 'description': 'An entertainment personality in the world, like Anderson Cooper or Miranda Sings'}, 'entity': {'id': '806570121959383040', 'name': 'Kim Kardashian', 'description': 'Kim Kardashian'}}, {'domain': {'id': '71', 'name': 'Video Game', 'description': 'A video game like Overwatch'}, 'entity': {'id': '1088118927580774400', 'name': 'Roblox', 'description': 'Roblox'}}]","{'annotations': [{'start': 18, 'end': 26, 'probability': 0.9392, 'type': 'Person', 'normalized_text': 'kanye kim'}]}",,False,,everyone,Twitter for iPhone
1514635854886719502,759027320560627712,"Time for another #PrimeGaming swag giveaway! Plus this time, we're including a NERF @Roblox Arsenal Pulse Laser Blaster!

Follow + RT to be entered for a chance to win! (ARV: $115)! Ends 5pm PT 4/18. NoPurchNec. US only. 18+. Rules: https://t.co/rDuHTe1PaM. Will DM the winner. https://t.co/pVSVLiFpHf",2022-04-14 16:05:03+00:00,,840,123,963,9,en,1514635854886719502,"[{'domain': {'id': '71', 'name': 'Video Game', 'description': 'A video game like Overwatch'}, 'entity': {'id': '1088118927580774400', 'name': 'Roblox', 'description': 'Roblox'}}]","{'urls': [{'start': 233, 'end': 256, 'url': 'https://t.co/rDuHTe1PaM', 'expanded_url': 'http://amzn.to/Rules', 'display_url': 'amzn.to/Rules', 'status': 200, 'title': 'Amazon.com: Sweepstakes Terms and Conditions', 'description': 'Amazon.com: Sweepstakes Terms and Conditions', 'unwound_url': 'https://www.amazon.com/gp/feature.html?ie=UTF8&docId=1001421081'}, {'start': 278, 'end': 301, 'url': 'https://t.co/pVSVLiFpHf', 'expanded_url': 'https://twitter.com/primegaming/status/1514635854886719502/photo/1', 'display_url': 'pic.twitter.com/pVSVLiFpHf', 'media_key': '3_1514635850943979524'}], 'annotations': [{'start': 92, 'end': 118, 'probability': 0.3725, 'type': 'Product', 'normalized_text': 'Arsenal Pulse Laser Blaster'}], 'mentions': [{'start': 84, 'end': 91, 'username': 'Roblox', 'id': '16745055'}], 'hashtags': [{'start': 17, 'end': 29, 'tag': 'PrimeGaming'}]}",{'media_keys': ['3_1514635850943979524']},False,,everyone,Sprout Social
1503906593401819141,1501534261593001987,@emmaros98420153 @Raul02299167 my friend..wtf this?,2022-03-16 01:30:47+00:00,,1,1,2,0,en,1490161816923688960,[],"{'mentions': [{'start': 0, 'end': 16, 'username': 'emmaros98420153', 'id': '1498987576652627970'}, {'start': 17, 'end': 30, 'username': 'Raul02299167', 'id': '1348666095557861385'}]}",,False,,everyone,Twitter Web App
1515093694164213762,1289402736891527170,@Greninjasn @GreedyMirusama @sonic_hedgehog @Roblox They're genesis games. It shouldn't be long to even get a release date.,2022-04-15 22:24:20+00:00,,1,1,4,0,en,1515011598812794883,"[{'domain': {'id': '71', 'name': 'Video Game', 'description': 'A video game like Overwatch'}, 'entity': {'id': '1088118927580774400', 'name': 'Roblox', 'description': 'Roblox'}}, {'domain': {'id': '130', 'name': 'Multimedia Franchise', 'description': ""Franchises which span multiple forms of media like 'Harry Potter'""}, 'entity': {'id': '993952643209773057', 'name': 'Sonic the Hedgehog', 'description': 'This entity includes all conversation about the franchise, as well as any individual installments in the series, if applicable.\t\t\t\n\nNOTE: Stopped annotating in the Video Game domain (71) on 11/15/19. Moving forward, this entity will annotate to Multimedia Franchise domain (130) only.'}}]","{'mentions': [{'start': 0, 'end': 11, 'username': 'Greninjasn', 'id': '1429980099026247685'}, {'start': 12, 'end': 27, 'username': 'GreedyMirusama', 'id': '982405331274928128'}, {'start': 28, 'end': 43, 'username': 'sonic_hedgehog', 'id': '19609162'}, {'start': 44, 'end': 51, 'username': 'Roblox', 'id': '16745055'}]}",,False,,everyone,Twitter Web App
1515097257590333444,2756159360,Spring is in the air. https://t.co/uF9xcoTVIW,2022-04-15 22:38:30+00:00,,2,1,17,0,en,1515097257590333444,[],"{'urls': [{'start': 22, 'end': 45, 'url': 'https://t.co/uF9xcoTVIW', 'expanded_url': 'https://twitter.com/ScrubDaddyLee/status/1515097257590333444/photo/1', 'display_url': 'pic.twitter.com/uF9xcoTVIW', 'media_key': '3_1515097256185192451'}]}",{'media_keys': ['3_1515097256185192451']},False,,everyone,Twitter for Android
1515116968935833602,1503225532938342402,@povpco in the first episode of the kardashians new show on disney plus kim was freaking out cuz her son found out ab her sex tape playing roblox,2022-04-15 23:56:49+00:00,,0,1,2,0,en,1515116374145871879,"[{'domain': {'id': '71', 'name': 'Video Game', 'description': 'A video game like Overwatch'}, 'entity': {'id': '1088118927580774400', 'name': 'Roblox', 'description': 'Roblox'}}, {'domain': {'id': '45', 'name': 'Brand Vertical', 'description': 'Top level entities that describe a Brands industry'}, 'entity': {'id': '781974597310615553', 'name': 'Entertainment'}}, {'domain': {'id': '46', 'name': 'Brand Category', 'description': 'Categories within Brand Verticals that narrow down the scope of Brands'}, 'entity': {'id': '781974597105094656', 'name': 'TV/Movies Related'}}, {'domain': {'id': '47', 'name': 'Brand', 'description': 'Brands and Companies'}, 'entity': {'id': '10037284711', 'name': 'Disney'}}]","{'annotations': [{'start': 60, 'end': 65, 'probability': 0.4782, 'type': 'Organization', 'normalized_text': 'disney'}, {'start': 72, 'end': 74, 'probability': 0.772, 'type': 'Person', 'normalized_text': 'kim'}], 'mentions': [{'start': 0, 'end': 7, 'username': 'povpco', 'id': '1404956982172389383'}]}",,False,,everyone,Twitter Web App
1515026422930280454,16745055,"Great get, @gamefamstudios!",2022-04-15 17:57:01+00:00,,38,257,998,3,en,1515026236241850380,"[{'domain': {'id': '71', 'name': 'Video Game', 'description': 'A video game like Overwatch'}, 'entity': {'id': '1088118927580774400', 'name': 'Roblox', 'description': 'Roblox'}}]","{'mentions': [{'start': 11, 'end': 26, 'username': 'gamefamstudios', 'id': '1162494706066046977'}]}",,False,,everyone,Twitter Web App
1515061842305064964,4093077509,is roblox getting boring?,2022-04-15 20:17:46+00:00,,114,1651,4378,62,en,1515061842305064964,"[{'domain': {'id': '71', 'name': 'Video Game', 'description': 'A video game like Overwatch'}, 'entity': {'id': '1088118927580774400', 'name': 'Roblox', 'description': 'Roblox'}}]",,,False,,everyone,Twitter Web App
1515111378037661701,1345154361626865665,Ok https://t.co/GaQaRc09fZ,2022-04-15 23:34:36+00:00,,3,1,6,1,qst,1515111378037661701,[],"{'urls': [{'start': 3, 'end': 26, 'url': 'https://t.co/GaQaRc09fZ', 'expanded_url': 'https://twitter.com/cosmicitry/status/1515110041007050752', 'display_url': 'twitter.com/cosmicitry/sta…'}]}",,False,,everyone,Twitter Web App
1512541605214965763,1489871903166763010,random sketch and color n stuff idk yall can prolly guess what its based on ig https://t.co/Dbn6PRRQyQ,2022-04-08 21:23:15+00:00,,3,1,6,0,en,1512541605214965763,[],"{'urls': [{'start': 79, 'end': 102, 'url': 'https://t.co/Dbn6PRRQyQ', 'expanded_url': 'https://twitter.com/Thine_Wanderer/status/1512541605214965763/photo/1', 'display_url': 'pic.twitter.com/Dbn6PRRQyQ', 'media_key': '3_1512541381394378755'}]}",{'media_keys': ['3_1512541381394378755']},False,,everyone,Twitter Web App
1515116508191600645,1404956982172389383,@jontrollz SHE FOUND WHAT,2022-04-15 23:54:59+00:00,,0,1,1,0,en,1515116374145871879,[],"{'mentions': [{'start': 0, 'end': 10, 'username': 'jontrollz', 'id': '1503225532938342402'}]}",,False,,everyone,Twitter for iPhone
1515026236241850380,16745055,Anyone got any avatar accessories they'd like to recommend to @sonic_hedgehog? https://t.co/XxBNu7ju0i,2022-04-15 17:56:17+00:00,,167,1036,2785,14,en,1515026236241850380,[],"{'urls': [{'start': 79, 'end': 102, 'url': 'https://t.co/XxBNu7ju0i', 'expanded_url': 'https://twitter.com/VentureBeat/status/1514272343731814403', 'display_url': 'twitter.com/VentureBeat/st…'}], 'mentions': [{'start': 62, 'end': 77, 'username': 'sonic_hedgehog', 'id': '19609162'}]}",,False,,everyone,Twitter Web App
1515114181435006978,1417587809502826500,PROBLEMAS NO ROBLOX: Alguns jogadores estão com problemas em diversos lugares do Roblox.,2022-04-15 23:45:44+00:00,,1,12,29,1,pt,1515114181435006978,"[{'domain': {'id': '71', 'name': 'Video Game', 'description': 'A video game like Overwatch'}, 'entity': {'id': '1088118927580774400', 'name': 'Roblox', 'description': 'Roblox'}}]",,,False,,everyone,Twitter Web App
1515113665833443334,1482398260966928385,@Greninjasn @GreedyMirusama @sonic_hedgehog @Roblox It is being developed by sega,2022-04-15 23:43:42+00:00,,0,3,0,0,en,1515011598812794883,"[{'domain': {'id': '71', 'name': 'Video Game', 'description': 'A video game like Overwatch'}, 'entity': {'id': '1088118927580774400', 'name': 'Roblox', 'description': 'Roblox'}}, {'domain': {'id': '78', 'name': 'Video Game Publisher', 'description': ""A Video Game Publisher like 'Activision'""}, 'entity': {'id': '943877135894056966', 'name': 'Sega', 'description': 'Sega'}}, {'domain': {'id': '130', 'name': 'Multimedia Franchise', 'description': ""Franchises which span multiple forms of media like 'Harry Potter'""}, 'entity': {'id': '993952643209773057', 'name': 'Sonic the Hedgehog', 'description': 'This entity includes all conversation about the franchise, as well as any individual installments in the series, if applicable.\t\t\t\n\nNOTE: Stopped annotating in the Video Game domain (71) on 11/15/19. Moving forward, this entity will annotate to Multimedia Franchise domain (130) only.'}}]","{'mentions': [{'start': 0, 'end': 11, 'username': 'Greninjasn', 'id': '1429980099026247685'}, {'start': 12, 'end': 27, 'username': 'GreedyMirusama', 'id': '982405331274928128'}, {'start': 28, 'end': 43, 'username': 'sonic_hedgehog', 'id': '19609162'}, {'start': 44, 'end': 51, 'username': 'Roblox', 'id': '16745055'}]}",,False,,everyone,Twitter for iPhone
1515116371184521220,1154619146015035394,@Roblox_RTC Thanks for joining! Make sure to pre save my new single at https://t.co/A6QOr9g4ej,2022-04-15 23:54:27+00:00,,3,1,20,0,en,1515115979390472192,[],"{'urls': [{'start': 71, 'end': 94, 'url': 'https://t.co/A6QOr9g4ej', 'expanded_url': 'http://DoloTonight.ffm.to/carridesave', 'display_url': 'DoloTonight.ffm.to/carridesave'}], 'mentions': [{'start': 0, 'end': 11, 'username': 'Roblox_RTC', 'id': '1056053249470541824'}]}",,False,,everyone,Twitter for iPhone
1515011598812794883,19609162,"Sonic's officially in @Roblox in Sonic Speed Simulator, and all paid beta players can grab this exclusive Knuckles Chao!

Paid beta ends at 7AM PST on Saturday! https://t.co/T1WnkkntYw",2022-04-15 16:58:07+00:00,,1735,455,15220,319,en,1515011598812794883,"[{'domain': {'id': '71', 'name': 'Video Game', 'description': 'A video game like Overwatch'}, 'entity': {'id': '1088118927580774400', 'name': 'Roblox', 'description': 'Roblox'}}, {'domain': {'id': '130', 'name': 'Multimedia Franchise', 'description': ""Franchises which span multiple forms of media like 'Harry Potter'""}, 'entity': {'id': '993952643209773057', 'name': 'Sonic the Hedgehog', 'description': 'This entity includes all conversation about the franchise, as well as any individual installments in the series, if applicable.\t\t\t\n\nNOTE: Stopped annotating in the Video Game domain (71) on 11/15/19. Moving forward, this entity will annotate to Multimedia Franchise domain (130) only.'}}]","{'urls': [{'start': 161, 'end': 184, 'url': 'https://t.co/T1WnkkntYw', 'expanded_url': 'https://twitter.com/sonic_hedgehog/status/1515011598812794883/photo/1', 'display_url': 'pic.twitter.com/T1WnkkntYw', 'media_key': '3_1515009384442589188'}], 'annotations': [{'start': 33, 'end': 53, 'probability': 0.5481, 'type': 'Product', 'normalized_text': 'Sonic Speed Simulator'}, {'start': 106, 'end': 118, 'probability': 0.4147, 'type': 'Product', 'normalized_text': 'Knuckles Chao'}], 'mentions': [{'start': 22, 'end': 29, 'username': 'Roblox', 'id': '16745055'}]}",{'media_keys': ['3_1515009384442589188']},False,,everyone,Twitter Web App
1515116528697491466,1447909769206013962,"1 Hour after the Dolo Tonight Concer, what were your guys' thoughts?

I haven't been able to see it ( I missed the first run ) but I'm gonna watch it soon.",2022-04-15 23:55:04+00:00,,2,14,36,0,en,1515116528697491466,[],,,False,,everyone,Twitter Web App
1514838191991361544,1470442246294155267,no way this is how kim kardashian called kanye about the sextape on roblox LMAOOO https://t.co/tixxFRzmLC,2022-04-15 05:29:03+00:00,,27353,3618,300154,12819,en,1514838191991361544,"[{'domain': {'id': '10', 'name': 'Person', 'description': 'Named people in the world like Nelson Mandela'}, 'entity': {'id': '806561823407239169', 'name': 'Kanye West', 'description': 'Kanye West'}}, {'domain': {'id': '10', 'name': 'Person', 'description': 'Named people in the world like Nelson Mandela'}, 'entity': {'id': '806570121959383040', 'name': 'Kim Kardashian', 'description': 'Kim Kardashian'}}, {'domain': {'id': '54', 'name': 'Musician', 'description': 'A musician in the world, like Adele or Bob Dylan'}, 'entity': {'id': '806561823407239169', 'name': 'Kanye West', 'description': 'Kanye West'}}, {'domain': {'id': '55', 'name': 'Music Genre', 'description': 'A category for a musical style, like Pop, Rock, or Rap'}, 'entity': {'id': '810937888334487552', 'name': 'Rap', 'description': 'Hip-Hop/Rap'}}, {'domain': {'id': '58', 'name': 'Entertainment Personality', 'description': 'An entertainment personality in the world, like Anderson Cooper or Miranda Sings'}, 'entity': {'id': '806570121959383040', 'name': 'Kim Kardashian', 'description': 'Kim Kardashian'}}, {'domain': {'id': '71', 'name': 'Video Game', 'description': 'A video game like Overwatch'}, 'entity': {'id': '1088118927580774400', 'name': 'Roblox', 'description': 'Roblox'}}]","{'urls': [{'start': 82, 'end': 105, 'url': 'https://t.co/tixxFRzmLC', 'expanded_url': 'https://twitter.com/ayedocc/status/1514838191991361544/video/1', 'display_url': 'pic.twitter.com/tixxFRzmLC', 'media_key': '7_1514838163092652034'}], 'annotations': [{'start': 19, 'end': 32, 'probability': 0.9784, 'type': 'Person', 'normalized_text': 'kim kardashian'}, {'start': 41, 'end': 45, 'probability': 0.9975, 'type': 'Person', 'normalized_text': 'kanye'}]}",{'media_keys': ['7_1514838163092652034']},False,,everyone,Twitter for iPhone
1515094142182838272,1477131044478328833,"@RoyaleMonday Aaaa i have a roblox acc lvl 203 on rh and 2.4k+ robux spend but sadly on my main acc  still didnt reach trading lvl,do u have other offer if youre still lf?",2022-04-15 22:26:07+00:00,,0,1,0,0,en,1515053980610564096,"[{'domain': {'id': '71', 'name': 'Video Game', 'description': 'A video game like Overwatch'}, 'entity': {'id': '1088118927580774400', 'name': 'Roblox', 'description': 'Roblox'}}]","{'mentions': [{'start': 0, 'end': 13, 'username': 'RoyaleMonday', 'id': '1467182227154898950'}]}",,False,,everyone,Twitter for Android
1515112636668649481,1403786245973721096,@heart1ys A lie,2022-04-15 23:39:36+00:00,,0,1,2,0,en,1515103384348475396,[],"{'mentions': [{'start': 0, 'end': 9, 'username': 'heart1ys', 'id': '1537264571068469249'}]}",,False,,everyone,Twitter for iPhone
1515116213017395201,1157084929865461760,"@yeahitsnooby https://t.co/JpzLmjDso1
So like this but better?",2022-04-15 23:53:49+00:00,,0,1,0,0,en,1515111985461215232,[],"{'urls': [{'start': 14, 'end': 37, 'url': 'https://t.co/JpzLmjDso1', 'expanded_url': 'https://www.roblox.com/games/8170900938/Right-2-Fight-DEMO-V0-2-3', 'display_url': 'roblox.com/games/81709009…', 'status': 200, 'title': 'Right 2 Fight [DEMO] V0.2.3', 'description': ""Check out Right 2 Fight [DEMO] V0.2.3. It’s one of the millions of unique, user-generated 3D experiences created on Roblox. V0.2.0 UPDATE LOG: https://devforum.roblox.com/t/rf/1650614 Co-op beat 'em up game based on the Yakuza series Get in fist fights with the most notorious people in town! This version is just an early demo for public testing to help refine features for the game."", 'unwound_url': 'https://www.roblox.com/games/8170900938/Right-2-Fight-DEMO-V0-2-3'}], 'mentions': [{'start': 0, 'end': 13, 'username': 'yeahitsnooby', 'id': '973948043631452160'}]}",,True,,everyone,Twitter Web App
1513180845854670849,2850532049,i had a dream i was in a YouTube boxing event and they put me up against a much smaller girl,2022-04-10 15:43:21+00:00,,237,406,10680,11,en,1513180845854670849,"[{'domain': {'id': '165', 'name': 'Technology', 'description': 'for individual and types of technology, e.g., food technology, 3D printing'}, 'entity': {'id': '1196446161223028736', 'name': 'Social media'}}, {'domain': {'id': '11', 'name': 'Sport', 'description': 'Types of sports, like soccer and basketball'}, 'entity': {'id': '847900861074292736', 'name': 'Boxing', 'description': 'Boxing'}}, {'domain': {'id': '11', 'name': 'Sport', 'description': 'Types of sports, like soccer and basketball'}, 'entity': {'id': '1047520229192912896', 'name': 'Combat sports', 'description': 'Fighting'}}, {'domain': {'id': '46', 'name': 'Brand Category', 'description': 'Categories within Brand Verticals that narrow down the scope of Brands'}, 'entity': {'id': '781974596752842752', 'name': 'Services'}}, {'domain': {'id': '47', 'name': 'Brand', 'description': 'Brands and Companies'}, 'entity': {'id': '10029382357', 'name': 'YouTube'}}]","{'annotations': [{'start': 25, 'end': 31, 'probability': 0.55, 'type': 'Product', 'normalized_text': 'YouTube'}]}",,False,,everyone,Twitter for iPhone
1515116185670631426,1194595997302870016,c’est quoi roblox https://t.co/INP5iKWL1I,2022-04-15 23:53:42+00:00,,0,2,1,0,fr,1515116185670631426,"[{'domain': {'id': '10', 'name': 'Person', 'description': 'Named people in the world like Nelson Mandela'}, 'entity': {'id': '806561823407239169', 'name': 'Kanye West', 'description': 'Kanye West'}}, {'domain': {'id': '10', 'name': 'Person', 'description': 'Named people in the world like Nelson Mandela'}, 'entity': {'id': '806570121959383040', 'name': 'Kim Kardashian', 'description': 'Kim Kardashian'}}, {'domain': {'id': '54', 'name': 'Musician', 'description': 'A musician in the world, like Adele or Bob Dylan'}, 'entity': {'id': '806561823407239169', 'name': 'Kanye West', 'description': 'Kanye West'}}, {'domain': {'id': '55', 'name': 'Music Genre', 'description': 'A category for a musical style, like Pop, Rock, or Rap'}, 'entity': {'id': '810937888334487552', 'name': 'Rap', 'description': 'Hip-Hop/Rap'}}, {'domain': {'id': '58', 'name': 'Entertainment Personality', 'description': 'An entertainment personality in the world, like Anderson Cooper or Miranda Sings'}, 'entity': {'id': '806570121959383040', 'name': 'Kim Kardashian', 'description': 'Kim Kardashian'}}, {'domain': {'id': '71', 'name': 'Video Game', 'description': 'A video game like Overwatch'}, 'entity': {'id': '1088118927580774400', 'name': 'Roblox', 'description': 'Roblox'}}]","{'urls': [{'start': 18, 'end': 41, 'url': 'https://t.co/INP5iKWL1I', 'expanded_url': 'https://twitter.com/ayedocc/status/1514838191991361544', 'display_url': 'twitter.com/ayedocc/status…'}]}",,False,,everyone,Twitter for iPhone
1515059171074482181,3152021005,"Still getting tons of dms about the images, again if you’ve submitted an image you want changed. We will be giving accepted players a chance to reach out to give us the right image they want to use! https://t.co/Y5ScQuXXsg",2022-04-15 20:07:09+00:00,,6,9,96,2,en,1515059171074482181,[],"{'urls': [{'start': 199, 'end': 222, 'url': 'https://t.co/Y5ScQuXXsg', 'expanded_url': 'https://twitter.com/Kittzillaa/status/1514890923460681728', 'display_url': 'twitter.com/Kittzillaa/sta…'}]}",,False,,everyone,Twitter for iPhone
1514793734830886917,1071938981389045765,Coming soon to Emergency Response: Liberty County! 🚑🚒 #Roblox https://t.co/slXy4ziFbj,2022-04-15 02:32:24+00:00,,77,178,967,7,en,1514793734830886917,"[{'domain': {'id': '71', 'name': 'Video Game', 'description': 'A video game like Overwatch'}, 'entity': {'id': '1088118927580774400', 'name': 'Roblox', 'description': 'Roblox'}}]","{'urls': [{'start': 62, 'end': 85, 'url': 'https://t.co/slXy4ziFbj', 'expanded_url': 'https://twitter.com/PRC_Roblox/status/1514793734830886917/photo/1', 'display_url': 'pic.twitter.com/slXy4ziFbj', 'media_key': '3_1514793464868720641'}], 'annotations': [{'start': 35, 'end': 48, 'probability': 0.8209, 'type': 'Place', 'normalized_text': 'Liberty County'}], 'hashtags': [{'start': 54, 'end': 61, 'tag': 'Roblox'}]}",{'media_keys': ['3_1514793464868720641']},False,,everyone,Twitter Web App
1515116132276981760,1495090045354536960,@guineapigfan99 VIRGIN!!!! VIRGIN!!!!!!!!,2022-04-15 23:53:30+00:00,,0,1,0,0,fi,1515113422517510152,[],"{'mentions': [{'start': 0, 'end': 15, 'username': 'guineapigfan99', 'id': '1491759050132008965'}]}",,False,,everyone,Twitter for Android
