tweetid,author_id,text,created_at,geo,retweets,replies,likes,quote_count,lang,conversation_id,context_annotations,entities,attachments,possibly_sensitive,withheld,reply_settings,source
1539673497714077696,1479282862423638021,@yakuzafan47 @_Am_Dog_ @Roblox_RTC i have a mom 💀,2022-06-22 18:15:42+00:00,,0,2,0,0,en,1539639357392314371,[],"{'mentions': [{'start': 0, 'end': 12, 'username': 'yakuzafan47', 'id': '1434195806538670082'}, {'start': 13, 'end': 22, 'username': '_Am_Dog_', 'id': '1394152300869033984'}, {'start': 23, 'end': 34, 'username': 'Roblox_RTC', 'id': '1056053249470541824'}]}",,False,,everyone,Twitter Web App
1539497758083653632,706190754029375490,"I'm not sure how the Robux currency system works but:

Please don't recreate my schemes and sell them on Roblox as your own work.",2022-06-22 06:37:22+00:00,,7,12,177,0,en,1539497758083653632,"[{'domain': {'id': '71', 'name': 'Video Game', 'description': 'A video game like Overwatch'}, 'entity': {'id': '1088118927580774400', 'name': 'Roblox', 'description': 'Roblox'}}]","{'annotations': [{'start': 105, 'end': 110, 'probability': 0.577, 'type': 'Product', 'normalized_text': 'Roblox'}]}",,False,,everyone,Twitter Web App
1539344168299991040,1292671772941324288,"@PRC_Roblox PRC, I still recommend responding to my tweet asking on why I'm banned from appealing.",2022-06-21 20:27:04+00:00,,0,5,11,0,en,1539343977421348865,"[{'domain': {'id': '46', 'name': 'Brand Category', 'description': 'Categories within Brand Verticals that narrow down the scope of Brands'}, 'entity': {'id': '781974596752842752', 'name': 'Services'}}, {'domain': {'id': '47', 'name': 'Brand', 'description': 'Brands and Companies'}, 'entity': {'id': '10045225402', 'name': 'Twitter'}}]","{'mentions': [{'start': 0, 'end': 11, 'username': 'PRC_Roblox', 'id': '1071938981389045765'}]}",,False,,everyone,Twitter for iPhone
1539766318395793410,1516053426416795655,los otakus de ahora nunca van a entender lo q se sentía esperar una semana entera para un capítulo de naruto shippuden y q termine siendo relleno,2022-06-23 00:24:32+00:00,,0,3,0,0,es,1539766318395793410,"[{'domain': {'id': '3', 'name': 'TV Shows', 'description': 'Television shows from around the world'}, 'entity': {'id': '10002926095', 'name': 'Naruto: Shippuden', 'description': 'More than two years have passed since the most recent adventures in the Hidden Leaf Village, ample time for ninja wannabe Naruto Uzumaki to have developed skills worthy of recognition and respect. The hyperactive youngster has trained extensively with Jiraiya-sama and returned to Konoha to reunite with friends and, perhaps, partake in more pranks than schoolwork. But Naruto is more determined than ever to become the greatest ninja, and his hard-earned improvements are put to the ultimate test against newer, stronger enemies. ""Naruto: Shippuden"" is adapted from Part II of the ""Naruto"" comic book series by Masashi Kishimoto.'}}, {'domain': {'id': '65', 'name': 'Interests and Hobbies Vertical', 'description': 'Top level interests and hobbies groupings, like Food or Travel'}, 'entity': {'id': '839543165002506240', 'name': 'Anime'}}, {'domain': {'id': '130', 'name': 'Multimedia Franchise', 'description': ""Franchises which span multiple forms of media like 'Harry Potter'""}, 'entity': {'id': '1136329838350880768', 'name': 'Naruto', 'description': 'This entity includes all conversation about the franchise, as well as any individual installments in the series, if applicable.\t\t\t'}}]","{'annotations': [{'start': 102, 'end': 117, 'probability': 0.698, 'type': 'Other', 'normalized_text': 'naruto shippuden'}]}",,False,,everyone,Twitter Web App
1539731667270529025,1421045033533313024,cringe https://t.co/eUwjegDj3i,2022-06-22 22:06:50+00:00,,0,1,4,0,en,1539731667270529025,[],"{'urls': [{'start': 7, 'end': 30, 'url': 'https://t.co/eUwjegDj3i', 'expanded_url': 'https://twitter.com/QLiaG/status/1539330713870278656', 'display_url': 'twitter.com/QLiaG/status/1…'}]}",,False,,everyone,Twitter for iPad
1539564102531461120,888867384404176896,"What's your Roblox Display name???

The best one wins 5,000 Robux! Good luck",2022-06-22 11:01:00+00:00,,46,1121,401,2,en,1539564102531461120,"[{'domain': {'id': '71', 'name': 'Video Game', 'description': 'A video game like Overwatch'}, 'entity': {'id': '1088118927580774400', 'name': 'Roblox', 'description': 'Roblox'}}]","{'annotations': [{'start': 12, 'end': 25, 'probability': 0.4806, 'type': 'Product', 'normalized_text': 'Roblox Display'}]}",,False,,everyone,Twitter Web App
1537791019126751233,1493046368390242309,"@Dixzis_qT @blixy472 @Roblox @WonderWorksRB I’m sorry to say this, but did the Roblox have a verification mark, if not you got scammed, because if you get someone to use your code, you get 7,000 on the app, so that means they made a profit out of it, and you kinda did",2022-06-17 13:35:24+00:00,,0,2,0,0,en,1534999186755637248,"[{'domain': {'id': '71', 'name': 'Video Game', 'description': 'A video game like Overwatch'}, 'entity': {'id': '1088118927580774400', 'name': 'Roblox', 'description': 'Roblox'}}]","{'mentions': [{'start': 0, 'end': 10, 'username': 'Dixzis_qT', 'id': '1518771321479516160'}, {'start': 11, 'end': 20, 'username': 'blixy472', 'id': '1405268499618992128'}, {'start': 21, 'end': 28, 'username': 'Roblox', 'id': '16745055'}, {'start': 29, 'end': 43, 'username': 'WonderWorksRB', 'id': '1259271090603536384'}], 'annotations': [{'start': 79, 'end': 84, 'probability': 0.3877, 'type': 'Product', 'normalized_text': 'Roblox'}]}",,False,,everyone,Twitter for iPhone
1539770505468596224,1128369147589603328,una pendeja en roblox me dijo negra soquete 😔,2022-06-23 00:41:10+00:00,,0,1,0,0,es,1539770505468596224,"[{'domain': {'id': '71', 'name': 'Video Game', 'description': 'A video game like Overwatch'}, 'entity': {'id': '1088118927580774400', 'name': 'Roblox', 'description': 'Roblox'}}]","{'annotations': [{'start': 15, 'end': 20, 'probability': 0.4358, 'type': 'Product', 'normalized_text': 'roblox'}]}",,False,,everyone,Twitter for Android
1539711729160134659,1490803592877559814,@carl_szurek @viswagfx @QuackRoblox @Roblox some people dislike swearing :/,2022-06-22 20:47:37+00:00,,0,2,0,0,en,1539603135227826177,"[{'domain': {'id': '71', 'name': 'Video Game', 'description': 'A video game like Overwatch'}, 'entity': {'id': '1088118927580774400', 'name': 'Roblox', 'description': 'Roblox'}}]","{'mentions': [{'start': 0, 'end': 12, 'username': 'carl_szurek', 'id': '1444783018418352130'}, {'start': 13, 'end': 22, 'username': 'viswagfx', 'id': '1300371953044185088'}, {'start': 23, 'end': 35, 'username': 'QuackRoblox', 'id': '1114902201711730694'}, {'start': 36, 'end': 43, 'username': 'Roblox', 'id': '16745055'}]}",,False,,everyone,Twitter Web App
1539756125209460741,1305652842351398913,Now I gotta figure out a way to get back at him since my aunt and uncle could give less of a shit about a video game. So tell me what to do for payback….cause I’m gonna kill this mf,2022-06-22 23:44:02+00:00,,1,29,19,0,en,1539755013354000392,[],,,False,,everyone,Twitter for iPhone
1539629387376631810,1280632147343216641,"5,000 Roblox Robux Card, Like this Tweet to Win! [ENDS TODAY] https://t.co/P6MF1s34EJ",2022-06-22 15:20:25+00:00,,177,498,2054,10,en,1539629387376631810,"[{'domain': {'id': '71', 'name': 'Video Game', 'description': 'A video game like Overwatch'}, 'entity': {'id': '1088118927580774400', 'name': 'Roblox', 'description': 'Roblox'}}, {'domain': {'id': '46', 'name': 'Brand Category', 'description': 'Categories within Brand Verticals that narrow down the scope of Brands'}, 'entity': {'id': '781974596752842752', 'name': 'Services'}}, {'domain': {'id': '47', 'name': 'Brand', 'description': 'Brands and Companies'}, 'entity': {'id': '10045225402', 'name': 'Twitter'}}]","{'annotations': [{'start': 6, 'end': 22, 'probability': 0.3909, 'type': 'Product', 'normalized_text': 'Roblox Robux Card'}], 'urls': [{'start': 62, 'end': 85, 'url': 'https://t.co/P6MF1s34EJ', 'expanded_url': 'https://twitter.com/plebcy/status/1539629387376631810/photo/1', 'display_url': 'pic.twitter.com/P6MF1s34EJ', 'media_key': '3_1539629373929701376'}]}",{'media_keys': ['3_1539629373929701376']},False,,everyone,Twitter Web App
1539687744989003777,1011373425892450305,Roblox are you deadass??? https://t.co/uCHbXBjx3n,2022-06-22 19:12:19+00:00,,436,304,5874,26,en,1539687744989003777,"[{'domain': {'id': '71', 'name': 'Video Game', 'description': 'A video game like Overwatch'}, 'entity': {'id': '1088118927580774400', 'name': 'Roblox', 'description': 'Roblox'}}]","{'urls': [{'start': 26, 'end': 49, 'url': 'https://t.co/uCHbXBjx3n', 'expanded_url': 'https://twitter.com/RetroDubsVA/status/1539687744989003777/photo/1', 'display_url': 'pic.twitter.com/uCHbXBjx3n', 'media_key': '3_1539687741902000128'}]}",{'media_keys': ['3_1539687741902000128']},False,,everyone,Twitter for iPhone
1539039490710306816,1457214183515230211,New Sonic.Exe Leaked Build Dropped !! Cant Wait To See What All The New Songs A- Oh thats my ip address https://t.co/YKQtvOQlIr,2022-06-21 00:16:23+00:00,,43,27,339,2,en,1539039490710306816,[],"{'urls': [{'start': 104, 'end': 127, 'url': 'https://t.co/YKQtvOQlIr', 'expanded_url': 'https://twitter.com/roboticdevelopr/status/1539039490710306816/video/1', 'display_url': 'pic.twitter.com/YKQtvOQlIr', 'media_key': '7_1539039365070049281'}]}",{'media_keys': ['7_1539039365070049281']},False,,everyone,Twitter Web App
1539753715699171328,1310627612927164417,@Fiddleflat @1Iscoming @KreekCraft @Roblox_RTC god fucking damit I was wrong though 💀,2022-06-22 23:34:27+00:00,,0,1,0,0,en,1538907362005860352,[],"{'mentions': [{'start': 0, 'end': 11, 'username': 'Fiddleflat', 'id': '1372110899662651393'}, {'start': 12, 'end': 22, 'username': '1Iscoming', 'id': '1520616825230299138'}, {'start': 23, 'end': 34, 'username': 'KreekCraft', 'id': '3025674465'}, {'start': 35, 'end': 46, 'username': 'Roblox_RTC', 'id': '1056053249470541824'}]}",,False,,everyone,Twitter Web App
1539711265546838016,1490803592877559814,"@DanielZ15909208 @viswagfx @kade_builder @Roblox wow you need to shut the hell up and stop hating on random people for literally no reason, ye look like a 3 year old",2022-06-22 20:45:46+00:00,,0,2,1,0,en,1539603135227826177,"[{'domain': {'id': '71', 'name': 'Video Game', 'description': 'A video game like Overwatch'}, 'entity': {'id': '1088118927580774400', 'name': 'Roblox', 'description': 'Roblox'}}]","{'mentions': [{'start': 0, 'end': 16, 'username': 'DanielZ15909208', 'id': '1454611350253154305'}, {'start': 17, 'end': 26, 'username': 'viswagfx', 'id': '1300371953044185088'}, {'start': 27, 'end': 40, 'username': 'kade_builder', 'id': '1318083200321728515'}, {'start': 41, 'end': 48, 'username': 'Roblox', 'id': '16745055'}]}",,False,,everyone,Twitter Web App
1539641741795414016,1465895908369997829,@viswagfx @Roblox Um 2k is nothing 😭😭,2022-06-22 16:09:31+00:00,,0,12,14,0,en,1539603135227826177,"[{'domain': {'id': '71', 'name': 'Video Game', 'description': 'A video game like Overwatch'}, 'entity': {'id': '1088118927580774400', 'name': 'Roblox', 'description': 'Roblox'}}]","{'mentions': [{'start': 0, 'end': 9, 'username': 'viswagfx', 'id': '1300371953044185088'}, {'start': 10, 'end': 17, 'username': 'Roblox', 'id': '16745055'}]}",,False,,everyone,Twitter for iPhone
1539645816142536707,1538475239272861696,@Smoothie_Roblox im crying tears of joy rn,2022-06-22 16:25:42+00:00,,0,3,0,1,en,1539645239798820864,[],"{'mentions': [{'start': 0, 'end': 16, 'username': 'Smoothie_Roblox', 'id': '1421045033533313024'}]}",,False,,everyone,Twitter for iPhone
1539767334117818368,1203051054792876034,"#UnitedStatesChampionship #UWEReturn #USCGoats

At the UWE Return Show, 7.2.22, all titles are on the line in some way. Recently, we lined up the USC 🐐's to make history known for the next forseeable champion.

Who will get to be apart of these GOATs? https://t.co/iFuMOY2YGK",2022-06-23 00:28:34+00:00,,7,1,13,2,en,1539767334117818368,[],"{'annotations': [{'start': 146, 'end': 148, 'probability': 0.5904, 'type': 'Organization', 'normalized_text': 'USC'}], 'urls': [{'start': 252, 'end': 275, 'url': 'https://t.co/iFuMOY2YGK', 'expanded_url': 'https://twitter.com/uwe_roblox/status/1539767334117818368/photo/1', 'display_url': 'pic.twitter.com/iFuMOY2YGK', 'media_key': '3_1539767149283221504'}], 'hashtags': [{'start': 0, 'end': 25, 'tag': 'UnitedStatesChampionship'}, {'start': 26, 'end': 36, 'tag': 'UWEReturn'}, {'start': 37, 'end': 46, 'tag': 'USCGoats'}]}",{'media_keys': ['3_1539767149283221504']},False,,everyone,Twitter Web App
1539416683366043650,1507749278709657603,I found my twitter account on google images.. Tf did I do to be on google images.. https://t.co/qCv90BPQgS,2022-06-22 01:15:12+00:00,,0,3,4,0,en,1539416683366043650,"[{'domain': {'id': '46', 'name': 'Brand Category', 'description': 'Categories within Brand Verticals that narrow down the scope of Brands'}, 'entity': {'id': '781974596752842752', 'name': 'Services'}}, {'domain': {'id': '47', 'name': 'Brand', 'description': 'Brands and Companies'}, 'entity': {'id': '10026378521', 'name': 'Google '}}, {'domain': {'id': '48', 'name': 'Product', 'description': 'Products created by Brands.  Examples: Ford Explorer, Apple iPhone.'}, 'entity': {'id': '1395474411180892160', 'name': 'Google brand conversation'}}, {'domain': {'id': '46', 'name': 'Brand Category', 'description': 'Categories within Brand Verticals that narrow down the scope of Brands'}, 'entity': {'id': '781974596752842752', 'name': 'Services'}}, {'domain': {'id': '47', 'name': 'Brand', 'description': 'Brands and Companies'}, 'entity': {'id': '10045225402', 'name': 'Twitter'}}]","{'annotations': [{'start': 11, 'end': 17, 'probability': 0.8842, 'type': 'Product', 'normalized_text': 'twitter'}, {'start': 30, 'end': 35, 'probability': 0.7528, 'type': 'Product', 'normalized_text': 'google'}, {'start': 67, 'end': 72, 'probability': 0.7176, 'type': 'Product', 'normalized_text': 'google'}], 'urls': [{'start': 83, 'end': 106, 'url': 'https://t.co/qCv90BPQgS', 'expanded_url': 'https://twitter.com/TangleFNAF/status/1539416683366043650/photo/1', 'display_url': 'pic.twitter.com/qCv90BPQgS', 'media_key': '3_1539416675623309314'}, {'start': 83, 'end': 106, 'url': 'https://t.co/qCv90BPQgS', 'expanded_url': 'https://twitter.com/TangleFNAF/status/1539416683366043650/photo/1', 'display_url': 'pic.twitter.com/qCv90BPQgS', 'media_key': '3_1539416677519073281'}]}","{'media_keys': ['3_1539416675623309314', '3_1539416677519073281']}",False,,everyone,Twitter for Android
1539623717512151040,1300371953044185088,No reply from roblox Im quitting @roblox https://t.co/nTXOqwngni,2022-06-22 14:57:53+00:00,,0,8,2,0,en,1539623717512151040,"[{'domain': {'id': '71', 'name': 'Video Game', 'description': 'A video game like Overwatch'}, 'entity': {'id': '1088118927580774400', 'name': 'Roblox', 'description': 'Roblox'}}]","{'mentions': [{'start': 33, 'end': 40, 'username': 'Roblox', 'id': '16745055'}], 'urls': [{'start': 41, 'end': 64, 'url': 'https://t.co/nTXOqwngni', 'expanded_url': 'https://twitter.com/viswagfx/status/1539603135227826177', 'display_url': 'twitter.com/viswagfx/statu…'}]}",,False,,everyone,Twitter Web App
1536016083165003777,2366012696,Saturday the 25th of June! Be there! @Snartles https://t.co/SNewxitBik,2022-06-12 16:02:26+00:00,,920,159,8889,64,en,1536016083165003777,[],"{'mentions': [{'start': 37, 'end': 46, 'username': 'Snartles', 'id': '4599506952'}], 'urls': [{'start': 47, 'end': 70, 'url': 'https://t.co/SNewxitBik', 'expanded_url': 'https://twitter.com/dawkosgames/status/1536016083165003777/photo/1', 'display_url': 'pic.twitter.com/SNewxitBik', 'media_key': '3_1536016078832390147'}]}",{'media_keys': ['3_1536016078832390147']},False,,everyone,Twitter for iPhone
1539427661809950721,1056053249470541824,"Bill C - 11 has passed and Canadian content creators are in a PANIC! Roblox content creators, are, too. RTC is mostly Canadian as well. 

Bill C - 11 expands the broadcasting act of Canada to cover ALL media such as YouTube, tiktok, etc.

What does this mean? (Thread) https://t.co/WuluLDjAIK",2022-06-22 01:58:50+00:00,,208,279,2119,106,en,1539427661809950721,"[{'domain': {'id': '46', 'name': 'Brand Category', 'description': 'Categories within Brand Verticals that narrow down the scope of Brands'}, 'entity': {'id': '781974596157181956', 'name': 'Online Site'}}, {'domain': {'id': '47', 'name': 'Brand', 'description': 'Brands and Companies'}, 'entity': {'id': '1286296657135468545', 'name': 'TikTok'}}, {'domain': {'id': '71', 'name': 'Video Game', 'description': 'A video game like Overwatch'}, 'entity': {'id': '1088118927580774400', 'name': 'Roblox', 'description': 'Roblox'}}, {'domain': {'id': '165', 'name': 'Technology', 'description': 'for individual and types of technology, e.g., food technology, 3D printing'}, 'entity': {'id': '1196446161223028736', 'name': 'Social media'}}, {'domain': {'id': '46', 'name': 'Brand Category', 'description': 'Categories within Brand Verticals that narrow down the scope of Brands'}, 'entity': {'id': '781974596752842752', 'name': 'Services'}}, {'domain': {'id': '47', 'name': 'Brand', 'description': 'Brands and Companies'}, 'entity': {'id': '10029382357', 'name': 'YouTube'}}]","{'annotations': [{'start': 182, 'end': 187, 'probability': 0.9836, 'type': 'Place', 'normalized_text': 'Canada'}, {'start': 216, 'end': 222, 'probability': 0.5193, 'type': 'Organization', 'normalized_text': 'YouTube'}], 'urls': [{'start': 269, 'end': 292, 'url': 'https://t.co/WuluLDjAIK', 'expanded_url': 'https://twitter.com/Roblox_RTC/status/1539427661809950721/photo/1', 'display_url': 'pic.twitter.com/WuluLDjAIK', 'media_key': '3_1539427658332766220'}]}",{'media_keys': ['3_1539427658332766220']},False,,everyone,Twitter for iPhone
1539734040261132296,1379493576263020544,@SnazzyRBLX @KreekCraft you know you can make a tweet regarding it,2022-06-22 22:16:16+00:00,,0,1,0,0,en,1539077297269100550,"[{'domain': {'id': '46', 'name': 'Brand Category', 'description': 'Categories within Brand Verticals that narrow down the scope of Brands'}, 'entity': {'id': '781974596752842752', 'name': 'Services'}}, {'domain': {'id': '47', 'name': 'Brand', 'description': 'Brands and Companies'}, 'entity': {'id': '10045225402', 'name': 'Twitter'}}]","{'mentions': [{'start': 0, 'end': 11, 'username': 'SnazzyRBLX', 'id': '1089822663583817728'}, {'start': 12, 'end': 23, 'username': 'KreekCraft', 'id': '3025674465'}]}",,False,,everyone,Twitter Web App
1539639357392314371,1056053249470541824,Cereal before or after milk? 🥣Comment below...,2022-06-22 16:00:02+00:00,,28,627,1099,17,en,1539639357392314371,"[{'domain': {'id': '152', 'name': 'Food', 'description': 'Topics about food, like Donuts or Brunch'}, 'entity': {'id': '850419241790472192', 'name': 'Milk', 'description': 'Milk'}}, {'domain': {'id': '173', 'name': 'Google Product Taxonomy', 'description': 'A product taxonomy created by Google'}, 'entity': {'id': '850419241790472192', 'name': 'Milk', 'description': 'Milk'}}]",,,False,,everyone,TweetDeck
1539768557948518401,786309100443348992,"Here is my farewell.

Goodbye, and once again thank you everyone!

❤️❤️❤️",2022-06-23 00:33:26+00:00,,0,3,7,0,en,1539768522645151745,[],,,False,,everyone,Twitter Web App
1539344049227825159,1295786634730975232,@PRC_Roblox HYPE,2022-06-21 20:26:35+00:00,,1,1,6,0,no,1539343977421348865,[],"{'mentions': [{'start': 0, 'end': 11, 'username': 'PRC_Roblox', 'id': '1071938981389045765'}]}",,False,,everyone,Twitter for iPad
1537904144605859840,16745055,"The next step on Charli XCX's CRASH tour? Roblox...today.

Don't miss the virtual concert debut of @charli_xcx in Samsung's Superstar Galaxy. The show starts Friday at 4PM PST: https://t.co/7x21bYAmUj https://t.co/jL8dgD2FOe",2022-06-17 21:04:55+00:00,,170,844,1670,52,en,1537904144605859840,"[{'domain': {'id': '3', 'name': 'TV Shows', 'description': 'Television shows from around the world'}, 'entity': {'id': '10031713489', 'name': 'The Next Step'}}, {'domain': {'id': '47', 'name': 'Brand', 'description': 'Brands and Companies'}, 'entity': {'id': '1174344555111469057', 'name': 'Samsung Indonesia'}}, {'domain': {'id': '71', 'name': 'Video Game', 'description': 'A video game like Overwatch'}, 'entity': {'id': '1088118927580774400', 'name': 'Roblox', 'description': 'Roblox'}}, {'domain': {'id': '10', 'name': 'Person', 'description': 'Named people in the world like Nelson Mandela'}, 'entity': {'id': '885602209618051072', 'name': 'Charli XCX', 'description': 'CHARLI XCX'}}, {'domain': {'id': '47', 'name': 'Brand', 'description': 'Brands and Companies'}, 'entity': {'id': '10026364234', 'name': 'Samsung '}}, {'domain': {'id': '48', 'name': 'Product', 'description': 'Products created by Brands.  Examples: Ford Explorer, Apple iPhone.'}, 'entity': {'id': '10026230384', 'name': 'Samsung Galaxy'}}, {'domain': {'id': '48', 'name': 'Product', 'description': 'Products created by Brands.  Examples: Ford Explorer, Apple iPhone.'}, 'entity': {'id': '10026331316', 'name': 'Samsung Mobile'}}, {'domain': {'id': '48', 'name': 'Product', 'description': 'Products created by Brands.  Examples: Ford Explorer, Apple iPhone.'}, 'entity': {'id': '10045298641', 'name': 'Samsung USA'}}, {'domain': {'id': '49', 'name': 'Product Version', 'description': ""The specific model or version of a product.  Examples: Audi A8, Ben & Jerry's Chocolate Chip Ice Cream""}, 'entity': {'id': '10040464729', 'name': 'Samsung Mobile UK'}}, {'domain': {'id': '49', 'name': 'Product Version', 'description': ""The specific model or version of a product.  Examples: Audi A8, Ben & Jerry's Chocolate Chip Ice Cream""}, 'entity': {'id': '10041364617', 'name': 'Samsung Mobile US'}}, {'domain': {'id': '54', 'name': 'Musician', 'description': 'A musician in the world, like Adele or Bob Dylan'}, 'entity': {'id': '885602209618051072', 'name': 'Charli XCX', 'description': 'CHARLI XCX'}}, {'domain': {'id': '55', 'name': 'Music Genre', 'description': 'A category for a musical style, like Pop, Rock, or Rap'}, 'entity': {'id': '810938279801470977', 'name': 'Pop', 'description': 'Pop'}}, {'domain': {'id': '30', 'name': 'Entities [Entity Service]', 'description': 'Entity Service top level domain, every item that is in Entity Service should be in this domain'}, 'entity': {'id': '848920371311001600', 'name': 'Technology', 'description': 'Technology and computing'}}, {'domain': {'id': '66', 'name': 'Interests and Hobbies Category', 'description': 'A grouping of interests and hobbies entities, like Novelty Food or Destinations'}, 'entity': {'id': '848920700073123840', 'name': 'Cell Phones', 'description': 'Cell phones'}}, {'domain': {'id': '30', 'name': 'Entities [Entity Service]', 'description': 'Entity Service top level domain, every item that is in Entity Service should be in this domain'}, 'entity': {'id': '848985956778561538', 'name': 'Mobile', 'description': 'Mobile'}}]","{'mentions': [{'start': 99, 'end': 110, 'username': 'charli_xcx', 'id': '103012173'}], 'annotations': [{'start': 17, 'end': 26, 'probability': 0.3106, 'type': 'Person', 'normalized_text': 'Charli XCX'}, {'start': 114, 'end': 120, 'probability': 0.6338, 'type': 'Product', 'normalized_text': 'Samsung'}], 'urls': [{'start': 177, 'end': 200, 'url': 'https://t.co/7x21bYAmUj', 'expanded_url': 'https://rblx.co/SuperstarGalaxy', 'display_url': 'rblx.co/SuperstarGalaxy'}, {'start': 201, 'end': 224, 'url': 'https://t.co/jL8dgD2FOe', 'expanded_url': 'https://twitter.com/Roblox/status/1537904144605859840/photo/1', 'display_url': 'pic.twitter.com/jL8dgD2FOe', 'media_key': '3_1537904030067724290'}]}",{'media_keys': ['3_1537904030067724290']},False,,everyone,Twitter Web App
1539724152260726789,1162803746537136128,"wtf is ""gay juice""

roblox pls https://t.co/BkZwbiKZeN",2022-06-22 21:36:59+00:00,,5,23,87,0,en,1539724152260726789,"[{'domain': {'id': '71', 'name': 'Video Game', 'description': 'A video game like Overwatch'}, 'entity': {'id': '1088118927580774400', 'name': 'Roblox', 'description': 'Roblox'}}]","{'urls': [{'start': 31, 'end': 54, 'url': 'https://t.co/BkZwbiKZeN', 'expanded_url': 'https://twitter.com/AmazePlays_/status/1539724152260726789/photo/1', 'display_url': 'pic.twitter.com/BkZwbiKZeN', 'media_key': '3_1539724136091639809'}]}",{'media_keys': ['3_1539724136091639809']},False,,everyone,Twitter Web App
1539768461211357184,1285139136001667072,@Delfino47006463 @Roblox_RTC No https://t.co/LASQEuT4Vs,2022-06-23 00:33:03+00:00,,0,1,0,0,und,1539427661809950721,[],"{'mentions': [{'start': 0, 'end': 16, 'username': 'Delfino47006463', 'id': '1486447046211035140'}, {'start': 17, 'end': 28, 'username': 'Roblox_RTC', 'id': '1056053249470541824'}], 'urls': [{'start': 32, 'end': 55, 'url': 'https://t.co/LASQEuT4Vs', 'expanded_url': 'https://twitter.com/sayonwie/status/1539768461211357184/photo/1', 'display_url': 'pic.twitter.com/LASQEuT4Vs', 'media_key': '3_1539768454311723008'}]}",{'media_keys': ['3_1539768454311723008']},False,,everyone,Twitter for iPhone
1539576040581890050,1339299462603268097,https://t.co/Dgo7nLN7qt,2022-06-22 11:48:26+00:00,,10405,422,138575,543,zxx,1539576040581890050,[],"{'urls': [{'start': 0, 'end': 23, 'url': 'https://t.co/Dgo7nLN7qt', 'expanded_url': 'https://twitter.com/WtfImgvids/status/1539576040581890050/photo/1', 'display_url': 'pic.twitter.com/Dgo7nLN7qt', 'media_key': '3_1539576038203727872'}]}",{'media_keys': ['3_1539576038203727872']},False,,everyone,Twitter for iPhone
