tweetid,author_id,text,created_at,geo,retweets,replies,likes,quote_count,lang,conversation_id,context_annotations,entities,attachments,possibly_sensitive,withheld,reply_settings,source
1518292466331488259,1399657195344744448,What are y'alls roblox names I'm about to download it I'll say mine after I'm logged in,2022-04-24 18:15:07+00:00,,0,1,2,1,en,1518292466331488259,"[{'domain': {'id': '71', 'name': 'Video Game', 'description': 'A video game like Overwatch'}, 'entity': {'id': '1088118927580774400', 'name': 'Roblox', 'description': 'Roblox'}}]",,,False,,everyone,Twitter Web App
1517991432073752579,1056053249470541824,"🚨 YouTuber @AnimaxONI has been HACKED and turned into an etherium channel! Please don’t click on any links mentioned in the videos of his. 

We’ll update you if he gets his channel back. https://t.co/43vF35Zmn3",2022-04-23 22:18:54+00:00,,34,80,612,5,en,1517991432073752579,"[{'domain': {'id': '30', 'name': 'Entities [Entity Service]', 'description': 'Entity Service top level domain, every item that is in Entity Service should be in this domain'}, 'entity': {'id': '1007361429752594432', 'name': 'Ethereum cryptocurrency', 'description': 'Ethereum Cryptocurrency'}}]","{'mentions': [{'start': 11, 'end': 21, 'username': 'AnimaxONI', 'id': '1149867955171340289'}], 'urls': [{'start': 187, 'end': 210, 'url': 'https://t.co/43vF35Zmn3', 'expanded_url': 'https://twitter.com/Roblox_RTC/status/1517991432073752579/photo/1', 'display_url': 'pic.twitter.com/43vF35Zmn3', 'media_key': '3_1517991412465385475'}, {'start': 187, 'end': 210, 'url': 'https://t.co/43vF35Zmn3', 'expanded_url': 'https://twitter.com/Roblox_RTC/status/1517991432073752579/photo/1', 'display_url': 'pic.twitter.com/43vF35Zmn3', 'media_key': '3_1517991412658315266'}]}","{'media_keys': ['3_1517991412465385475', '3_1517991412658315266']}",False,,everyone,Twitter for iPhone
1518254935359508482,1071938981389045765,"🔥 Last Twitter giveaway! 🎉

75k in-game cash to two people! Like, reply with your favorite car in-game, and make sure you are following to enter! 

Head down to https://t.co/9r9mU2foQI as we will be having two $25 Roblox gift card giveaways today! (One hosted by @McSlothYT)",2022-04-24 15:45:59+00:00,,46,345,535,1,en,1518254935359508482,"[{'domain': {'id': '71', 'name': 'Video Game', 'description': 'A video game like Overwatch'}, 'entity': {'id': '1088118927580774400', 'name': 'Roblox', 'description': 'Roblox'}}, {'domain': {'id': '46', 'name': 'Brand Category', 'description': 'Categories within Brand Verticals that narrow down the scope of Brands'}, 'entity': {'id': '781974596752842752', 'name': 'Services'}}, {'domain': {'id': '47', 'name': 'Brand', 'description': 'Brands and Companies'}, 'entity': {'id': '10045225402', 'name': 'Twitter'}}]","{'annotations': [{'start': 8, 'end': 14, 'probability': 0.6723, 'type': 'Product', 'normalized_text': 'Twitter'}], 'mentions': [{'start': 263, 'end': 273, 'username': 'McSlothYT', 'id': '1307365319850291202'}], 'urls': [{'start': 161, 'end': 184, 'url': 'https://t.co/9r9mU2foQI', 'expanded_url': 'http://discord.gg/PRC', 'display_url': 'discord.gg/PRC', 'status': 200, 'title': 'Discord - A New Way to Chat with Friends & Communities', 'description': 'Discord is the easiest way to communicate over voice, video, and text. Chat, hang out, and stay close with your friends and communities.', 'unwound_url': 'https://discord.com/invite/PRC'}]}",,False,,everyone,Twitter for iPhone
1518293619601510402,1415351084026146820,SPARE 2,2022-04-24 18:19:42+00:00,,2,1,6,3,en,1518293619601510402,[],,,False,,everyone,Twitter for iPhone
1517481672471683078,1510596509968044038,@mikasasbtch @Mira_Ducky @Jessthegamer5 unfollow (@wolfgamer2002 ) he fakes gw sends fake links which are pshing links I've made em for scammers before and seen these type of links his gw are all fake the pictures hes using has been used by others the same!,2022-04-22 12:33:18+00:00,,0,4,2,1,en,1517481672471683078,[],"{'mentions': [{'start': 13, 'end': 24, 'username': 'Mira_Ducky', 'id': '1499215307084546050'}, {'start': 25, 'end': 39, 'username': 'Jessthegamer5', 'id': '1372160485693472771'}, {'start': 50, 'end': 64, 'username': 'wolfgamer2002', 'id': '1511062089250574346'}]}",,False,,everyone,Twitter for Android
1518199343437824006,1264060301361795072,can someone tell me the value of a king monkey? compared to pets? i have one and i don’t like it but i wanna trade it for what it’s worth. PLZ RETWEET!!! #adoptme #adoptmege #adoptmegws #adoptmequestion #adoptmetrade #adoptmetrades #adoptmetrading #Adoptmetrade #Adoptme,2022-04-24 12:05:04+00:00,,0,0,0,1,en,1518199343437824006,"[{'domain': {'id': '71', 'name': 'Video Game', 'description': 'A video game like Overwatch'}, 'entity': {'id': '1229416301245763584', 'name': 'Adopt Me'}}]","{'hashtags': [{'start': 154, 'end': 162, 'tag': 'adoptme'}, {'start': 163, 'end': 173, 'tag': 'adoptmege'}, {'start': 174, 'end': 185, 'tag': 'adoptmegws'}, {'start': 186, 'end': 202, 'tag': 'adoptmequestion'}, {'start': 203, 'end': 216, 'tag': 'adoptmetrade'}, {'start': 217, 'end': 231, 'tag': 'adoptmetrades'}, {'start': 232, 'end': 247, 'tag': 'adoptmetrading'}, {'start': 248, 'end': 261, 'tag': 'Adoptmetrade'}, {'start': 262, 'end': 270, 'tag': 'Adoptme'}]}",,False,,everyone,Twitter for iPhone
1517993743567237122,1056053249470541824,"Roblox’s chief business officer, Craig Donato - has said the company MIGHT do NFTS &amp; integrate blockchain technology into the platforms future 📸 https://t.co/VA2mjHncaR",2022-04-23 22:28:06+00:00,,112,732,1937,300,en,1517993743567237122,"[{'domain': {'id': '46', 'name': 'Brand Category', 'description': 'Categories within Brand Verticals that narrow down the scope of Brands'}, 'entity': {'id': '781974596752842752', 'name': 'Services'}}, {'domain': {'id': '48', 'name': 'Product', 'description': 'Products created by Brands.  Examples: Ford Explorer, Apple iPhone.'}, 'entity': {'id': '1412579054855671809', 'name': 'Google Innovation'}}, {'domain': {'id': '30', 'name': 'Entities [Entity Service]', 'description': 'Entity Service top level domain, every item that is in Entity Service should be in this domain'}, 'entity': {'id': '857879456773357569', 'name': 'Technology', 'description': 'Technology'}}, {'domain': {'id': '66', 'name': 'Interests and Hobbies Category', 'description': 'A grouping of interests and hobbies entities, like Novelty Food or Destinations'}, 'entity': {'id': '913142676819648512', 'name': 'Cryptocurrencies', 'description': 'Cryptocurrency'}}, {'domain': {'id': '30', 'name': 'Entities [Entity Service]', 'description': 'Entity Service top level domain, every item that is in Entity Service should be in this domain'}, 'entity': {'id': '1001503516555337728', 'name': 'Blockchain', 'description': 'Blockchain'}}, {'domain': {'id': '71', 'name': 'Video Game', 'description': 'A video game like Overwatch'}, 'entity': {'id': '1088118927580774400', 'name': 'Roblox', 'description': 'Roblox'}}, {'domain': {'id': '30', 'name': 'Entities [Entity Service]', 'description': 'Entity Service top level domain, every item that is in Entity Service should be in this domain'}, 'entity': {'id': '857879456773357569', 'name': 'Technology', 'description': 'Technology'}}]","{'annotations': [{'start': 0, 'end': 5, 'probability': 0.6402, 'type': 'Organization', 'normalized_text': 'Roblox'}, {'start': 33, 'end': 44, 'probability': 0.9823, 'type': 'Person', 'normalized_text': 'Craig Donato'}], 'urls': [{'start': 149, 'end': 172, 'url': 'https://t.co/VA2mjHncaR', 'expanded_url': 'https://twitter.com/Roblox_RTC/status/1517993743567237122/photo/1', 'display_url': 'pic.twitter.com/VA2mjHncaR', 'media_key': '3_1517993740601806850'}, {'start': 149, 'end': 172, 'url': 'https://t.co/VA2mjHncaR', 'expanded_url': 'https://twitter.com/Roblox_RTC/status/1517993743567237122/photo/1', 'display_url': 'pic.twitter.com/VA2mjHncaR', 'media_key': '3_1517993740601806849'}]}","{'media_keys': ['3_1517993740601806850', '3_1517993740601806849']}",False,,everyone,Twitter for iPhone
1518253585649344512,1076634578834653195,HOW DO I REPLY TO ONE OF MY FRIENDS ASKING IF I WANT TO GO TO A STRIP CLUB ????,2022-04-24 15:40:37+00:00,,0,1,2,0,en,1518253585649344512,[],,,False,,everyone,Twitter for Android
1518289891699871744,1284603120027344897,"@VITOLINOBOSS Como ya dije en el tweet de RN, realmente sería intersante ver items de Roblox que solo lo tenga un usuario o tal vez pistolas de Arsenal, cuchillos de MM2, etc. que sean NFT y le pertenezcan a una sola persona",2022-04-24 18:04:53+00:00,,0,1,2,0,es,1518059400656687104,"[{'domain': {'id': '66', 'name': 'Interests and Hobbies Category', 'description': 'A grouping of interests and hobbies entities, like Novelty Food or Destinations'}, 'entity': {'id': '913142676819648512', 'name': 'Cryptocurrencies', 'description': 'Cryptocurrency'}}, {'domain': {'id': '71', 'name': 'Video Game', 'description': 'A video game like Overwatch'}, 'entity': {'id': '1088118927580774400', 'name': 'Roblox', 'description': 'Roblox'}}, {'domain': {'id': '46', 'name': 'Brand Category', 'description': 'Categories within Brand Verticals that narrow down the scope of Brands'}, 'entity': {'id': '781974596752842752', 'name': 'Services'}}, {'domain': {'id': '47', 'name': 'Brand', 'description': 'Brands and Companies'}, 'entity': {'id': '10045225402', 'name': 'Twitter'}}]","{'annotations': [{'start': 86, 'end': 91, 'probability': 0.3895, 'type': 'Organization', 'normalized_text': 'Roblox'}, {'start': 144, 'end': 150, 'probability': 0.6647, 'type': 'Organization', 'normalized_text': 'Arsenal'}], 'mentions': [{'start': 0, 'end': 13, 'username': 'VITOLINOBOSS', 'id': '1080499845733994496'}]}",,False,,everyone,Twitter Web App
1518068774703828993,1330950753507106816,"I don't play #Roblox much anymore, so LINK YOUR GAMEPASS/SHIRT! (1000 Robux Limit, buying 7) https://t.co/9x8qz2RhPs",2022-04-24 03:26:14+00:00,,131,1102,1562,7,en,1518068774703828993,"[{'domain': {'id': '48', 'name': 'Product', 'description': 'Products created by Brands.  Examples: Ford Explorer, Apple iPhone.'}, 'entity': {'id': '1425921713150201858', 'name': 'Xbox Game Pass'}}, {'domain': {'id': '71', 'name': 'Video Game', 'description': 'A video game like Overwatch'}, 'entity': {'id': '1088118927580774400', 'name': 'Roblox', 'description': 'Roblox'}}, {'domain': {'id': '45', 'name': 'Brand Vertical', 'description': 'Top level entities that describe a Brands industry'}, 'entity': {'id': '781974597310615553', 'name': 'Entertainment'}}, {'domain': {'id': '46', 'name': 'Brand Category', 'description': 'Categories within Brand Verticals that narrow down the scope of Brands'}, 'entity': {'id': '781974597218340864', 'name': 'Video Games'}}, {'domain': {'id': '47', 'name': 'Brand', 'description': 'Brands and Companies'}, 'entity': {'id': '10027048851', 'name': 'Xbox'}}, {'domain': {'id': '79', 'name': 'Video Game Hardware', 'description': 'Video Game Hardware'}, 'entity': {'id': '10027048851', 'name': 'Xbox'}}]","{'hashtags': [{'start': 13, 'end': 20, 'tag': 'Roblox'}], 'urls': [{'start': 93, 'end': 116, 'url': 'https://t.co/9x8qz2RhPs', 'expanded_url': 'https://twitter.com/RBXevents_/status/1518068774703828993/photo/1', 'display_url': 'pic.twitter.com/9x8qz2RhPs', 'media_key': '3_1518068313540075520'}]}",{'media_keys': ['3_1518068313540075520']},False,,everyone,Twitter Web App
1517961477008904195,3426162562,ANIME WARRIORS!!! https://t.co/DiWvWJJAAQ,2022-04-23 20:19:53+00:00,,2,6,51,0,en,1517961477008904195,"[{'domain': {'id': '65', 'name': 'Interests and Hobbies Vertical', 'description': 'Top level interests and hobbies groupings, like Food or Travel'}, 'entity': {'id': '839543165002506240', 'name': 'Anime'}}, {'domain': {'id': '65', 'name': 'Interests and Hobbies Vertical', 'description': 'Top level interests and hobbies groupings, like Food or Travel'}, 'entity': {'id': '1280550787207147521', 'name': 'Arts & culture'}}, {'domain': {'id': '71', 'name': 'Video Game', 'description': 'A video game like Overwatch'}, 'entity': {'id': '1088118927580774400', 'name': 'Roblox', 'description': 'Roblox'}}]","{'annotations': [{'start': 0, 'end': 13, 'probability': 0.3805, 'type': 'Organization', 'normalized_text': 'ANIME WARRIORS'}], 'urls': [{'start': 18, 'end': 41, 'url': 'https://t.co/DiWvWJJAAQ', 'expanded_url': 'https://twitter.com/EmkyrieVibes/status/1517961190114213888', 'display_url': 'twitter.com/EmkyrieVibes/s…'}]}",,False,,everyone,Twitter for iPhone
1517544965567614976,59503698,"Y’all don’t miss old Roblox, y’all just miss your early childhoods.

No rent due. No huge assignments. No COVID. Every experience is fresh and new. https://t.co/a0xqC0DCC6",2022-04-22 16:44:49+00:00,,20,26,399,1,en,1517544965567614976,"[{'domain': {'id': '71', 'name': 'Video Game', 'description': 'A video game like Overwatch'}, 'entity': {'id': '1088118927580774400', 'name': 'Roblox', 'description': 'Roblox'}}, {'domain': {'id': '123', 'name': 'Ongoing News Story', 'description': ""Ongoing News Stories like 'Brexit'""}, 'entity': {'id': '1220701888179359745', 'name': 'COVID-19'}}]","{'urls': [{'start': 148, 'end': 171, 'url': 'https://t.co/a0xqC0DCC6', 'expanded_url': 'https://twitter.com/bigwanger12/status/1517212298586181632', 'display_url': 'twitter.com/bigwanger12/st…'}]}",,False,,everyone,Twitter for iPhone
1518287606282395648,1398718043040235520,@MiniToonfan99 @Roblox_RTC “Minitoonfan” wants to speak about investing. Investors love NFTs and the metaverse. Don’t get your vocab from your trendy Roblox YouTuber.,2022-04-24 17:55:48+00:00,,0,2,2,0,en,1517993743567237122,"[{'domain': {'id': '30', 'name': 'Entities [Entity Service]', 'description': 'Entity Service top level domain, every item that is in Entity Service should be in this domain'}, 'entity': {'id': '848920371311001600', 'name': 'Technology', 'description': 'Technology and computing'}}, {'domain': {'id': '66', 'name': 'Interests and Hobbies Category', 'description': 'A grouping of interests and hobbies entities, like Novelty Food or Destinations'}, 'entity': {'id': '913142676819648512', 'name': 'Cryptocurrencies', 'description': 'Cryptocurrency'}}, {'domain': {'id': '71', 'name': 'Video Game', 'description': 'A video game like Overwatch'}, 'entity': {'id': '1088118927580774400', 'name': 'Roblox', 'description': 'Roblox'}}, {'domain': {'id': '165', 'name': 'Technology', 'description': 'for individual and types of technology, e.g., food technology, 3D printing'}, 'entity': {'id': '848920371311001600', 'name': 'Technology', 'description': 'Technology and computing'}}, {'domain': {'id': '65', 'name': 'Interests and Hobbies Vertical', 'description': 'Top level interests and hobbies groupings, like Food or Travel'}, 'entity': {'id': '781974596148793345', 'name': 'Business & finance'}}, {'domain': {'id': '66', 'name': 'Interests and Hobbies Category', 'description': 'A grouping of interests and hobbies entities, like Novelty Food or Destinations'}, 'entity': {'id': '857878402157629440', 'name': 'Investors and patents', 'description': 'Investors and patents'}}]","{'mentions': [{'start': 0, 'end': 14, 'username': 'MiniToonfan99', 'id': '1255963910215172098'}, {'start': 15, 'end': 26, 'username': 'Roblox_RTC', 'id': '1056053249470541824'}]}",,False,,everyone,Twitter for iPhone
1518292232683589633,1479951617332060161,@Roblox_RTC the idea of quitting roblox sounds so good rn :angle: :angle:,2022-04-24 18:14:11+00:00,,0,1,0,0,en,1517993743567237122,"[{'domain': {'id': '71', 'name': 'Video Game', 'description': 'A video game like Overwatch'}, 'entity': {'id': '1088118927580774400', 'name': 'Roblox', 'description': 'Roblox'}}]","{'mentions': [{'start': 0, 'end': 11, 'username': 'Roblox_RTC', 'id': '1056053249470541824'}]}",,False,,everyone,Twitter Web App
1518086675477385216,1505013840458641408,"@FortniteGame @WuTangClan IM CRYING NOW!!! HELP MEE!! NOOO!! NOOO!! My 9years old son just said ""Dad,you have to understand,Fornite is A DEAD GAME and they will not bring back CHAPTER 2"". SHOCKED!!! Thats it Lortnite,Im moving to ROBLOX INSTEAD OF PLAY THIS DEAD GAME!!",2022-04-24 04:37:22+00:00,,0,3,0,0,en,1518016879075332096,"[{'domain': {'id': '71', 'name': 'Video Game', 'description': 'A video game like Overwatch'}, 'entity': {'id': '974285387987169280', 'name': 'Fortnite', 'description': 'This entity includes all conversation about the franchise, as well as any individual installments in the series, if applicable.\t\t\t'}}, {'domain': {'id': '71', 'name': 'Video Game', 'description': 'A video game like Overwatch'}, 'entity': {'id': '1088118927580774400', 'name': 'Roblox', 'description': 'Roblox'}}, {'domain': {'id': '10', 'name': 'Person', 'description': 'Named people in the world like Nelson Mandela'}, 'entity': {'id': '884840656509599744', 'name': 'Wu-Tang Clan', 'description': 'Wu-Tang Clan'}}, {'domain': {'id': '54', 'name': 'Musician', 'description': 'A musician in the world, like Adele or Bob Dylan'}, 'entity': {'id': '884840656509599744', 'name': 'Wu-Tang Clan', 'description': 'Wu-Tang Clan'}}, {'domain': {'id': '55', 'name': 'Music Genre', 'description': 'A category for a musical style, like Pop, Rock, or Rap'}, 'entity': {'id': '810937888334487552', 'name': 'Rap', 'description': 'Hip-Hop/Rap'}}]","{'annotations': [{'start': 124, 'end': 130, 'probability': 0.5108, 'type': 'Person', 'normalized_text': 'Fornite'}], 'mentions': [{'start': 0, 'end': 13, 'username': 'FortniteGame', 'id': '425871040'}, {'start': 14, 'end': 25, 'username': 'WuTangClan', 'id': '26946348'}]}",,False,,everyone,Twitter Web App
1518293665462071296,1090494413481099264,parecia mto um minigame de roblox se parar pra pensar acho que a internet ta estragando minha mente,2022-04-24 18:19:53+00:00,,0,1,1,0,pt,1518293662773526530,"[{'domain': {'id': '71', 'name': 'Video Game', 'description': 'A video game like Overwatch'}, 'entity': {'id': '1088118927580774400', 'name': 'Roblox', 'description': 'Roblox'}}]",,,False,,everyone,Twitter for Android
1518293662773526530,1090494413481099264,mlk pprt eu tive um sonho mto foda que um vulcão qse matava todo mundo,2022-04-24 18:19:52+00:00,,0,1,0,0,pt,1518293662773526530,[],,,False,,everyone,Twitter for Android
1516549432791212045,1438291618617085955,"♡ 100 #robux giveaway 🏵

— follow me + @Axel95840854 with 🔔 on!
— rt + tag a friend

hc in thread https://t.co/3Wt6KSSQVI",2022-04-19 22:48:55+00:00,,60,46,60,13,en,1516549432791212045,"[{'domain': {'id': '71', 'name': 'Video Game', 'description': 'A video game like Overwatch'}, 'entity': {'id': '1088118927580774400', 'name': 'Roblox', 'description': 'Roblox'}}]","{'hashtags': [{'start': 6, 'end': 12, 'tag': 'robux'}], 'mentions': [{'start': 39, 'end': 52, 'username': 'Axel95840854', 'id': '1411931199333875715'}], 'urls': [{'start': 98, 'end': 121, 'url': 'https://t.co/3Wt6KSSQVI', 'expanded_url': 'https://twitter.com/sanriiocoree/status/1516549432791212045/photo/1', 'display_url': 'pic.twitter.com/3Wt6KSSQVI', 'media_key': '3_1516549430291406857'}]}",{'media_keys': ['3_1516549430291406857']},False,,mentionedUsers,Twitter for iPhone
1516810283012210690,1364774803555581952,"3D artist Enchanted Future is putting their talents on full display in their debut PFP drop!

10,000 unique 3D bulls will be getting their groove on 27 Apr 🕺

🐂 Mark the ""Bull Run Crew"" drop in your calendar and sign up to Crypto․com NFT now!",2022-04-20 16:05:27+00:00,,7,41,72,7,en,1516810283012210690,"[{'domain': {'id': '47', 'name': 'Brand', 'description': 'Brands and Companies'}, 'entity': {'id': '1492208421147267075', 'name': 'Crypto.com'}}, {'domain': {'id': '66', 'name': 'Interests and Hobbies Category', 'description': 'A grouping of interests and hobbies entities, like Novelty Food or Destinations'}, 'entity': {'id': '913142676819648512', 'name': 'Cryptocurrencies', 'description': 'Cryptocurrency'}}]","{'annotations': [{'start': 0, 'end': 25, 'probability': 0.5312, 'type': 'Product', 'normalized_text': '3D artist Enchanted Future'}]}",,False,,everyone,Twitter for Advertisers
1501718607407026186,1269459686593572874,"Huge 5 parasol giveaway! ࿐ ˚ . ✦ 🥀

Follow @DaishousLuv, @lvxingashlyn, &amp; @julexq_ w/ 🔔

Retweet w/ 🏷

Like 👍

˚❥Extras In Thread 🪡 
[#royalehighgiveaway] https://t.co/PpzwOgPbo7",2022-03-10 00:36:31+00:00,,175,130,175,96,en,1501718607407026186,[],"{'hashtags': [{'start': 138, 'end': 157, 'tag': 'royalehighgiveaway'}], 'mentions': [{'start': 43, 'end': 55, 'username': 'DaishousLuv', 'id': '1433164915645292550'}, {'start': 57, 'end': 70, 'username': 'lvxingashlyn', 'id': '1447171479750184966'}, {'start': 78, 'end': 86, 'username': 'julexq_', 'id': '1430628384724242433'}], 'urls': [{'start': 159, 'end': 182, 'url': 'https://t.co/PpzwOgPbo7', 'expanded_url': 'https://twitter.com/DaishousLuv/status/1501718607407026186/photo/1', 'display_url': 'pic.twitter.com/PpzwOgPbo7', 'media_key': '3_1501718604135505920'}]}",{'media_keys': ['3_1501718604135505920']},False,,everyone,Twitter for iPhone
1518233052446609408,1183363578474180608,"@RBXNews_ hating nfts just cause “bad for encouragement” is really dumb, not all nft drops are bad for the environment as some projects do their best to make it carbon positive by planting trees, while not being a perfect solution, its better thrn nothing",2022-04-24 14:19:01+00:00,,0,34,25,2,en,1518228265344901120,"[{'domain': {'id': '66', 'name': 'Interests and Hobbies Category', 'description': 'A grouping of interests and hobbies entities, like Novelty Food or Destinations'}, 'entity': {'id': '913142676819648512', 'name': 'Cryptocurrencies', 'description': 'Cryptocurrency'}}]","{'mentions': [{'start': 0, 'end': 9, 'username': 'RBXNews_', 'id': '1199001259904307207'}]}",,False,,everyone,Twitter for iPhone
1518079833577861120,1071938981389045765,"🔥 Like this tweet, reply with your Roblox username, and follow our Twitter for a chance to win 50,000 in-game cash! (3 winners, ends evening of 4/24)",2022-04-24 04:10:11+00:00,,62,559,858,1,en,1518079833577861120,"[{'domain': {'id': '71', 'name': 'Video Game', 'description': 'A video game like Overwatch'}, 'entity': {'id': '1088118927580774400', 'name': 'Roblox', 'description': 'Roblox'}}, {'domain': {'id': '46', 'name': 'Brand Category', 'description': 'Categories within Brand Verticals that narrow down the scope of Brands'}, 'entity': {'id': '781974596752842752', 'name': 'Services'}}, {'domain': {'id': '47', 'name': 'Brand', 'description': 'Brands and Companies'}, 'entity': {'id': '10045225402', 'name': 'Twitter'}}]","{'annotations': [{'start': 36, 'end': 41, 'probability': 0.7098, 'type': 'Product', 'normalized_text': 'Roblox'}, {'start': 68, 'end': 74, 'probability': 0.7998, 'type': 'Product', 'normalized_text': 'Twitter'}]}",,False,,everyone,Twitter for iPhone
1518213808015421440,1441683833934385165,"♡ Adopt me giveaway! ♡

Giving away a neon kangaroo if I hit 850 subs by 1st May! Below is a picture of it!

Rules:
~Follow me, like and Retweet
~Sub to my channel

https://t.co/EyZnALbxHB
 
Goodluck!☺️

#adoptme #roblox #gaming #robloxgiveaway #adoptmegiveaway #Giveaway https://t.co/zPVpncosSD",2022-04-24 13:02:33+00:00,,45,35,56,1,en,1518213808015421440,"[{'domain': {'id': '71', 'name': 'Video Game', 'description': 'A video game like Overwatch'}, 'entity': {'id': '1088118927580774400', 'name': 'Roblox', 'description': 'Roblox'}}, {'domain': {'id': '71', 'name': 'Video Game', 'description': 'A video game like Overwatch'}, 'entity': {'id': '1229416301245763584', 'name': 'Adopt Me'}}]","{'hashtags': [{'start': 204, 'end': 212, 'tag': 'adoptme'}, {'start': 213, 'end': 220, 'tag': 'roblox'}, {'start': 221, 'end': 228, 'tag': 'gaming'}, {'start': 229, 'end': 244, 'tag': 'robloxgiveaway'}, {'start': 245, 'end': 261, 'tag': 'adoptmegiveaway'}, {'start': 262, 'end': 271, 'tag': 'Giveaway'}], 'urls': [{'start': 165, 'end': 188, 'url': 'https://t.co/EyZnALbxHB', 'expanded_url': 'https://youtube.com/c/JazzyPlays', 'display_url': 'youtube.com/c/JazzyPlays', 'images': [{'url': 'https://pbs.twimg.com/news_img/1538058937672822785/sJ-aZnWE?format=jpg&name=orig', 'width': 900, 'height': 900}, {'url': 'https://pbs.twimg.com/news_img/1538058937672822785/sJ-aZnWE?format=jpg&name=150x150', 'width': 150, 'height': 150}], 'status': 200, 'title': 'Jazzy Plays', 'description': '✎ Hi! I\'m Jazzy! 😎😜💖 ╰┈➤ Welcome to my channel! 🌈🎮 ╰┈➤ I mostly do adopt me content, host giveaways on my channel and more! Also, I post once every week! ╰┈➤ Want to check out some Roblox edits made, check out my other channel, awhxjazz!🌹 ╰┈➤ My post schedule! ✨ ╰┈➤ Every Tuesday at 6pm (Time zone: GMT +8) 😇 *ੈ✩‧₊˚ For editing, I use Capcut, Inshot and KineMaster! :))) ੈ✩‧₊˚ ꒰🤗꒱ My roblox username: JKlovescubing 😇 ꒰🙃꒱ My roblox group: Jazzy Plays Squad ✨✨ ✧˚ · . Follow me on roblox because my joins are on and you can join me in game! UwU ༉‧₊˚. Always know that you are YOURSELF and you and WONDERFUL in YOUR OWN WAY! 🍡 Stay positive! 💟 ""Act as if what you\'re doing makes a difference. It does."" ~Willam James ""You are never too old to set another goal or to dream a new dream."" ~C.S. Lewis “The whole secret of a successful life is to find out what is one’s destiny to do, and then do it.” ~Henry Ford Hope you will have a wonderful day ahead! Don’t forgot to subscribe! ✨🌈', 'unwound_url': 'https://www.youtube.com/c/JazzyPlays'}, {'start': 272, 'end': 295, 'url': 'https://t.co/zPVpncosSD', 'expanded_url': 'https://twitter.com/jazzyy_roblox/status/1518213808015421440/photo/1', 'display_url': 'pic.twitter.com/zPVpncosSD', 'media_key': '3_1518213796674048001'}]}",{'media_keys': ['3_1518213796674048001']},False,,everyone,Twitter Web App
1518293073586909184,1407571931226722317,today is such a good day actually,2022-04-24 18:17:31+00:00,,0,1,0,0,en,1518293073586909184,[],,,False,,everyone,Twitter for iPhone
