tweetid,author_id,text,created_at,geo,retweets,replies,likes,quote_count,lang,conversation_id,context_annotations,entities,attachments,possibly_sensitive,withheld,reply_settings,source
1532909011795791873,3290869802,@B9mOrion @Mlickles @SEGA @sonic_hedgehog Come to think of it Sonic Speed Sim on Roblox is kinda like Odyssey with its mini-Sandbox style worlds.,2022-06-04 02:16:03+00:00,,0,0,29,0,en,1532874135499464704,"[{'domain': {'id': '71', 'name': 'Video Game', 'description': 'A video game like Overwatch'}, 'entity': {'id': '1088118927580774400', 'name': 'Roblox', 'description': 'Roblox'}}, {'domain': {'id': '78', 'name': 'Video Game Publisher', 'description': ""A Video Game Publisher like 'Activision'""}, 'entity': {'id': '943877135894056966', 'name': 'Sega', 'description': 'Sega'}}, {'domain': {'id': '130', 'name': 'Multimedia Franchise', 'description': ""Franchises which span multiple forms of media like 'Harry Potter'""}, 'entity': {'id': '993952643209773057', 'name': 'Sonic the Hedgehog', 'description': 'This entity includes all conversation about the franchise, as well as any individual installments in the series, if applicable.\t\t\t\n\nNOTE: Stopped annotating in the Video Game domain (71) on 11/15/19. Moving forward, this entity will annotate to Multimedia Franchise domain (130) only.'}}]","{'annotations': [{'start': 62, 'end': 76, 'probability': 0.8595, 'type': 'Product', 'normalized_text': 'Sonic Speed Sim'}, {'start': 81, 'end': 86, 'probability': 0.5412, 'type': 'Product', 'normalized_text': 'Roblox'}], 'mentions': [{'start': 0, 'end': 9, 'username': 'B9mOrion', 'id': '1410814127703040003'}, {'start': 10, 'end': 19, 'username': 'Mlickles', 'id': '2633054164'}, {'start': 20, 'end': 25, 'username': 'SEGA', 'id': '17092592'}, {'start': 26, 'end': 41, 'username': 'sonic_hedgehog', 'id': '19609162'}]}",,False,,everyone,Twitter Web App
1532908956292726789,1380409971637153792,thoughts of my cousin’s weird roblox avatar ( ps you should play roblox soon ) #ranboospace https://t.co/sDwr046GYy,2022-06-04 02:15:49+00:00,,0,0,2,0,en,1532908956292726789,"[{'domain': {'id': '71', 'name': 'Video Game', 'description': 'A video game like Overwatch'}, 'entity': {'id': '1088118927580774400', 'name': 'Roblox', 'description': 'Roblox'}}]","{'urls': [{'start': 92, 'end': 115, 'url': 'https://t.co/sDwr046GYy', 'expanded_url': 'https://twitter.com/sootsqge/status/1532908956292726789/photo/1', 'display_url': 'pic.twitter.com/sDwr046GYy', 'media_key': '3_1532908951997714432'}], 'hashtags': [{'start': 79, 'end': 91, 'tag': 'ranboospace'}]}",{'media_keys': ['3_1532908951997714432']},False,,everyone,Twitter for iPhone
1532908927779848192,1197893497220685825,@manisbigisman vc quer jogar roblox em 15 minutos,2022-06-04 02:15:43+00:00,,0,1,0,0,pt,1532908927779848192,"[{'domain': {'id': '71', 'name': 'Video Game', 'description': 'A video game like Overwatch'}, 'entity': {'id': '1088118927580774400', 'name': 'Roblox', 'description': 'Roblox'}}]","{'mentions': [{'start': 0, 'end': 14, 'username': 'manisbigisman', 'id': '1442898346570514433'}]}",,False,,everyone,Twitter for iPhone
1532908890748342272,1477137249338810375,@KreekCraft wait so basically. are you going to be streaming for like 7 hours? cuz usually you always stream for like 3 hours or something like that. and also can you add me on roblox so i can join tomorrow to play piggy too!,2022-06-04 02:15:34+00:00,,0,1,2,0,en,1532906666492043269,"[{'domain': {'id': '71', 'name': 'Video Game', 'description': 'A video game like Overwatch'}, 'entity': {'id': '1088118927580774400', 'name': 'Roblox', 'description': 'Roblox'}}]","{'annotations': [{'start': 177, 'end': 182, 'probability': 0.4737, 'type': 'Product', 'normalized_text': 'roblox'}], 'mentions': [{'start': 0, 'end': 11, 'username': 'KreekCraft', 'id': '3025674465'}]}",,False,,everyone,Twitter for iPhone
1532908877838172160,1450867956733333504,"I got banned on roblox because i said ""i dont rember autistic being lgbt"" lmao",2022-06-04 02:15:31+00:00,,1,3,1,0,en,1532908877838172160,"[{'domain': {'id': '71', 'name': 'Video Game', 'description': 'A video game like Overwatch'}, 'entity': {'id': '1088118927580774400', 'name': 'Roblox', 'description': 'Roblox'}}]","{'annotations': [{'start': 16, 'end': 21, 'probability': 0.4031, 'type': 'Product', 'normalized_text': 'roblox'}]}",,False,,everyone,Twitter Web App
1532908864353538048,1494780180170215432,"@MrReincarnated @plasma_node hello, good night, I'm looking to ask for help so I can build a pc for my son who loves playing roblox and if you're interested in me, help I'm grateful. my address. rua A casa 446 new hope messejana guajeru fortress Ceará CEP.60843155 Brazil",2022-06-04 02:15:27+00:00,{'place_id': 'd16815010421ff73'},0,0,0,0,en,1532320357830447104,"[{'domain': {'id': '71', 'name': 'Video Game', 'description': 'A video game like Overwatch'}, 'entity': {'id': '1088118927580774400', 'name': 'Roblox', 'description': 'Roblox'}}]","{'annotations': [{'start': 265, 'end': 270, 'probability': 0.9158, 'type': 'Place', 'normalized_text': 'Brazil'}], 'mentions': [{'start': 0, 'end': 15, 'username': 'MrReincarnated', 'id': '1499031559235522565'}, {'start': 16, 'end': 28, 'username': 'plasma_node', 'id': '3266559582'}]}",,False,,everyone,Twitter for Android
1532908791846535168,1229502695100309504,"one of my most cherished memories is playing roblox in spring 2020. the one thing keeping me grounded. bee swarm simulator, egg simulator, find the doges... man.",2022-06-04 02:15:10+00:00,,0,1,2,0,en,1532908791846535168,"[{'domain': {'id': '71', 'name': 'Video Game', 'description': 'A video game like Overwatch'}, 'entity': {'id': '1088118927580774400', 'name': 'Roblox', 'description': 'Roblox'}}, {'domain': {'id': '71', 'name': 'Video Game', 'description': 'A video game like Overwatch'}, 'entity': {'id': '1292812886599856130', 'name': 'Grounded'}}]",,,False,,everyone,Twitter Web App
1532908788377759745,1475274791221297154,#robuxgiveaway #robux #robuxgw #robuxgws #freerobux #giveaways #robuxgiveaways #robuxtradings #ROBLOXGiveaway #Roblox #robloxgiveaways #robloxgw #robuxgws #robuxgiveaway #ROBUX #robuxoffers #roblox https://t.co/Gn2psw5B33,2022-06-04 02:15:09+00:00,,1,0,0,0,qht,1532908788377759745,"[{'domain': {'id': '71', 'name': 'Video Game', 'description': 'A video game like Overwatch'}, 'entity': {'id': '1088118927580774400', 'name': 'Roblox', 'description': 'Roblox'}}]","{'urls': [{'start': 198, 'end': 221, 'url': 'https://t.co/Gn2psw5B33', 'expanded_url': 'https://twitter.com/Reqi_notfound/status/1532824910761959428', 'display_url': 'twitter.com/Reqi_notfound/…'}], 'hashtags': [{'start': 0, 'end': 14, 'tag': 'robuxgiveaway'}, {'start': 15, 'end': 21, 'tag': 'robux'}, {'start': 22, 'end': 30, 'tag': 'robuxgw'}, {'start': 31, 'end': 40, 'tag': 'robuxgws'}, {'start': 41, 'end': 51, 'tag': 'freerobux'}, {'start': 52, 'end': 62, 'tag': 'giveaways'}, {'start': 63, 'end': 78, 'tag': 'robuxgiveaways'}, {'start': 79, 'end': 93, 'tag': 'robuxtradings'}, {'start': 94, 'end': 109, 'tag': 'ROBLOXGiveaway'}, {'start': 110, 'end': 117, 'tag': 'Roblox'}, {'start': 118, 'end': 134, 'tag': 'robloxgiveaways'}, {'start': 135, 'end': 144, 'tag': 'robloxgw'}, {'start': 145, 'end': 154, 'tag': 'robuxgws'}, {'start': 155, 'end': 169, 'tag': 'robuxgiveaway'}, {'start': 170, 'end': 176, 'tag': 'ROBUX'}, {'start': 177, 'end': 189, 'tag': 'robuxoffers'}, {'start': 190, 'end': 197, 'tag': 'roblox'}]}",,False,,everyone,Twitter for Android
1532908773555294210,1363655051617648641,no pueo juatr roblox con las ulas,2022-06-04 02:15:06+00:00,,0,0,1,0,es,1532908773555294210,"[{'domain': {'id': '71', 'name': 'Video Game', 'description': 'A video game like Overwatch'}, 'entity': {'id': '1088118927580774400', 'name': 'Roblox', 'description': 'Roblox'}}]",,,False,,everyone,Twitter for Android
1532908678071951361,1260447799046475784,@Joeysanford21 @Roblox lol,2022-06-04 02:14:43+00:00,,1,0,0,0,und,1530713259346649093,"[{'domain': {'id': '71', 'name': 'Video Game', 'description': 'A video game like Overwatch'}, 'entity': {'id': '1088118927580774400', 'name': 'Roblox', 'description': 'Roblox'}}]","{'mentions': [{'start': 0, 'end': 14, 'username': 'Joeysanford21', 'id': '1423017816463130624'}, {'start': 15, 'end': 22, 'username': 'Roblox', 'id': '16745055'}]}",,False,,everyone,Twitter for iPhone
1532908675576340481,1294347419044413441,@DeeterPlays Roblox- OP_GOPO                                        Yt- TtopLIVE,2022-06-04 02:14:42+00:00,,0,0,0,0,en,1532777565814808576,"[{'domain': {'id': '71', 'name': 'Video Game', 'description': 'A video game like Overwatch'}, 'entity': {'id': '1088118927580774400', 'name': 'Roblox', 'description': 'Roblox'}}]","{'mentions': [{'start': 0, 'end': 12, 'username': 'DeeterPlays', 'id': '707638716676714496'}]}",,False,,everyone,Twitter for iPhone
1532908604818350084,973999126147977218,"@Roblox Yeah, I meant Captain Barnacle Bones’s Pirate hat. That’s the hat what I want so bad, like this one: https://t.co/6NDPnhufQz",2022-06-04 02:14:26+00:00,,0,0,0,0,en,1532908604818350084,"[{'domain': {'id': '3', 'name': 'TV Shows', 'description': 'Television shows from around the world'}, 'entity': {'id': '10018748894', 'name': 'Octonauts'}}, {'domain': {'id': '71', 'name': 'Video Game', 'description': 'A video game like Overwatch'}, 'entity': {'id': '1088118927580774400', 'name': 'Roblox', 'description': 'Roblox'}}]","{'annotations': [{'start': 22, 'end': 43, 'probability': 0.5095, 'type': 'Product', 'normalized_text': 'Captain Barnacle Bones'}], 'urls': [{'start': 109, 'end': 132, 'url': 'https://t.co/6NDPnhufQz', 'expanded_url': 'https://twitter.com/Joshua39923762/status/1532908604818350084/photo/1', 'display_url': 'pic.twitter.com/6NDPnhufQz', 'media_key': '3_1532908602708705281'}], 'mentions': [{'start': 0, 'end': 7, 'username': 'Roblox', 'id': '16745055'}]}",{'media_keys': ['3_1532908602708705281']},False,,everyone,Twitter for iPhone
1532908587881725953,1407689467771621376,@model8197 Roblox,2022-06-04 02:14:22+00:00,,0,0,0,0,en,1532455410673651712,"[{'domain': {'id': '71', 'name': 'Video Game', 'description': 'A video game like Overwatch'}, 'entity': {'id': '1088118927580774400', 'name': 'Roblox', 'description': 'Roblox'}}]","{'mentions': [{'start': 0, 'end': 10, 'username': 'model8197', 'id': '1251677662810042371'}]}",,False,,everyone,Twitter for Android
1532908576565366784,1350752689680859136,"Bruh why is dawn calling me a femboy on Roblox, stop LMAO",2022-06-04 02:14:19+00:00,,0,0,0,0,en,1532908576565366784,"[{'domain': {'id': '71', 'name': 'Video Game', 'description': 'A video game like Overwatch'}, 'entity': {'id': '1088118927580774400', 'name': 'Roblox', 'description': 'Roblox'}}]","{'annotations': [{'start': 40, 'end': 45, 'probability': 0.3997, 'type': 'Product', 'normalized_text': 'Roblox'}]}",,False,,everyone,"Cheap Bots, Done Quick!"
1532908559989497856,1346899633604329477,"neil cicierega have best dork, suck my dick. that stupid fucking trenchcoat prick stole my roblox account!",2022-06-04 02:14:15+00:00,,0,0,0,0,en,1532908559989497856,"[{'domain': {'id': '10', 'name': 'Person', 'description': 'Named people in the world like Nelson Mandela'}, 'entity': {'id': '1070731967698624512', 'name': 'Neil Cicierega', 'description': 'American musician, comedian and filmmaker'}}, {'domain': {'id': '54', 'name': 'Musician', 'description': 'A musician in the world, like Adele or Bob Dylan'}, 'entity': {'id': '1070731967698624512', 'name': 'Neil Cicierega', 'description': 'American musician, comedian and filmmaker'}}, {'domain': {'id': '55', 'name': 'Music Genre', 'description': 'A category for a musical style, like Pop, Rock, or Rap'}, 'entity': {'id': '810937888334487552', 'name': 'Rap', 'description': 'Hip-Hop/Rap'}}, {'domain': {'id': '71', 'name': 'Video Game', 'description': 'A video game like Overwatch'}, 'entity': {'id': '1088118927580774400', 'name': 'Roblox', 'description': 'Roblox'}}]","{'annotations': [{'start': 0, 'end': 13, 'probability': 0.9195, 'type': 'Person', 'normalized_text': 'neil cicierega'}]}",,False,,everyone,"Cheap Bots, Done Quick!"
1532908553270353921,31137511,@gucci @Roblox Did all the quests for the first bag and it's still locked :( I have all the required badges,2022-06-04 02:14:13+00:00,,0,1,0,0,en,1529770336937562112,"[{'domain': {'id': '46', 'name': 'Brand Category', 'description': 'Categories within Brand Verticals that narrow down the scope of Brands'}, 'entity': {'id': '781974596807299072', 'name': 'Apparel/Accessories'}}, {'domain': {'id': '47', 'name': 'Brand', 'description': 'Brands and Companies'}, 'entity': {'id': '1266401847104827392', 'name': 'Gucci'}}, {'domain': {'id': '65', 'name': 'Interests and Hobbies Vertical', 'description': 'Top level interests and hobbies groupings, like Food or Travel'}, 'entity': {'id': '1256236649253449729', 'name': 'Fashion & beauty'}}, {'domain': {'id': '67', 'name': 'Interests and Hobbies', 'description': 'Interests, opinions, and behaviors of individuals, groups, or cultures; like Speciality Cooking or Theme Parks'}, 'entity': {'id': '839543390668673024', 'name': 'Fashion'}}, {'domain': {'id': '71', 'name': 'Video Game', 'description': 'A video game like Overwatch'}, 'entity': {'id': '1088118927580774400', 'name': 'Roblox', 'description': 'Roblox'}}]","{'mentions': [{'start': 0, 'end': 6, 'username': 'gucci', 'id': '16913418'}, {'start': 7, 'end': 14, 'username': 'Roblox', 'id': '16745055'}]}",,False,,everyone,Twitter Web App
1532908540947464193,2955268068,halos coming now! comment your roblox if you wanna 🔥,2022-06-04 02:14:10+00:00,,96,92,191,2,en,1532908540947464193,"[{'domain': {'id': '71', 'name': 'Video Game', 'description': 'A video game like Overwatch'}, 'entity': {'id': '1088118927580774400', 'name': 'Roblox', 'description': 'Roblox'}}]",,,False,,everyone,Twitter for iPhone
1532908533699715077,1266154281620692998,"@CesarFever_ thar roblox workout session got my bored ass to draw this quick sketch, sorry if its shitty, i fucking suck at anatomy sometimes and have never drawn weights in my life

also fun fact i was that coach avatar that just randomly walked in lmao https://t.co/FD57gLqQ31",2022-06-04 02:14:09+00:00,,0,0,1,1,en,1532908533699715077,"[{'domain': {'id': '71', 'name': 'Video Game', 'description': 'A video game like Overwatch'}, 'entity': {'id': '1088118927580774400', 'name': 'Roblox', 'description': 'Roblox'}}, {'domain': {'id': '65', 'name': 'Interests and Hobbies Vertical', 'description': 'Top level interests and hobbies groupings, like Food or Travel'}, 'entity': {'id': '847868745150119936', 'name': 'Family & relationships', 'description': 'Hobbies and interests'}}, {'domain': {'id': '162', 'name': 'Exercise & fitness', 'description': 'for types of exercises& fitness and moves, e.g., yoga, crunches, squats '}, 'entity': {'id': '872554146750017536', 'name': 'Exercises', 'description': 'Exercises'}}]","{'urls': [{'start': 255, 'end': 278, 'url': 'https://t.co/FD57gLqQ31', 'expanded_url': 'https://twitter.com/Johnnyskywalk12/status/1532908533699715077/photo/1', 'display_url': 'pic.twitter.com/FD57gLqQ31', 'media_key': '3_1532907935524958208'}], 'mentions': [{'start': 0, 'end': 12, 'username': 'CesarFever_', 'id': '2225947382'}]}",{'media_keys': ['3_1532907935524958208']},False,,everyone,Twitter Web App
1532908531464151040,1350858635518365696,"tenho raiva de adultos &gt; 30 no tt pq:
a) sou uma adolescente descontrolada emocionalmente
b) pego justo comentarios de caras defendendo o bolsonaro chamando td mundo de petista, geraçao mimimi e zoando como crianças no roblox
ta dificil saber qual eh",2022-06-04 02:14:08+00:00,,0,0,1,0,pt,1532908531464151040,"[{'domain': {'id': '71', 'name': 'Video Game', 'description': 'A video game like Overwatch'}, 'entity': {'id': '1088118927580774400', 'name': 'Roblox', 'description': 'Roblox'}}]","{'annotations': [{'start': 138, 'end': 146, 'probability': 0.9984, 'type': 'Person', 'normalized_text': 'bolsonaro'}]}",,False,,everyone,Twitter for Android
1532908512929411072,1479010210266050560,"@SharkBloxYT I don't know if this is happening to anyone else, but roblox turned off my 2FA and changed my password, and they're saying they can't get my account back when I went on roblox support.",2022-06-04 02:14:04+00:00,,0,1,1,0,en,1532908512929411072,"[{'domain': {'id': '71', 'name': 'Video Game', 'description': 'A video game like Overwatch'}, 'entity': {'id': '1088118927580774400', 'name': 'Roblox', 'description': 'Roblox'}}]","{'mentions': [{'start': 0, 'end': 12, 'username': 'SharkBloxYT', 'id': '985359254184964096'}]}",,False,,everyone,Twitter Web App
1532908414774435841,1438952615010869254,i wanna buy roblox,2022-06-04 02:13:40+00:00,,0,3,4,0,en,1532908414774435841,"[{'domain': {'id': '71', 'name': 'Video Game', 'description': 'A video game like Overwatch'}, 'entity': {'id': '1088118927580774400', 'name': 'Roblox', 'description': 'Roblox'}}]",,,False,,everyone,Twitter for iPhone
1532908413688102913,1033457065535188993,"[FREE ITEMS] How to get the HERMITUDE BLACK LOGO HAT and HOODIE for FREE | Roblox
Watch Here: https://t.co/8DEkIx2aPB",2022-06-04 02:13:40+00:00,,0,0,1,0,en,1532908413688102913,"[{'domain': {'id': '71', 'name': 'Video Game', 'description': 'A video game like Overwatch'}, 'entity': {'id': '1088118927580774400', 'name': 'Roblox', 'description': 'Roblox'}}]","{'urls': [{'start': 94, 'end': 117, 'url': 'https://t.co/8DEkIx2aPB', 'expanded_url': 'http://youtu.be/NNeWAbBmwa0', 'display_url': 'youtu.be/NNeWAbBmwa0'}]}",,False,,everyone,Twitter for Android
1532908386622361600,1455878375684329477,"Roblox ""Starving Artists"" time lapse tutorial: How to Draw the Clematis Flowers Pixel Arts.
https://t.co/jb25zxAOOZ More flowers on my list 💐🥰 #gardening #pixelart #starvingartistsRBX #Flowers https://t.co/3dhUbgPfec",2022-06-04 02:13:34+00:00,,4,0,15,0,en,1532908386622361600,"[{'domain': {'id': '65', 'name': 'Interests and Hobbies Vertical', 'description': 'Top level interests and hobbies groupings, like Food or Travel'}, 'entity': {'id': '847868745150119936', 'name': 'Family & relationships', 'description': 'Hobbies and interests'}}, {'domain': {'id': '65', 'name': 'Interests and Hobbies Vertical', 'description': 'Top level interests and hobbies groupings, like Food or Travel'}, 'entity': {'id': '864911475436957696', 'name': 'Home and garden', 'description': 'Home and garden'}}, {'domain': {'id': '66', 'name': 'Interests and Hobbies Category', 'description': 'A grouping of interests and hobbies entities, like Novelty Food or Destinations'}, 'entity': {'id': '864913136821784576', 'name': 'Gardening', 'description': 'Gardening'}}, {'domain': {'id': '71', 'name': 'Video Game', 'description': 'A video game like Overwatch'}, 'entity': {'id': '1088118927580774400', 'name': 'Roblox', 'description': 'Roblox'}}, {'domain': {'id': '67', 'name': 'Interests and Hobbies', 'description': 'Interests, opinions, and behaviors of individuals, groups, or cultures; like Speciality Cooking or Theme Parks'}, 'entity': {'id': '847869251595542528', 'name': 'Drawing & illustration', 'description': 'Drawing and sketching'}}]","{'urls': [{'start': 92, 'end': 115, 'url': 'https://t.co/jb25zxAOOZ', 'expanded_url': 'https://youtu.be/7uwmXPaXK9g', 'display_url': 'youtu.be/7uwmXPaXK9g'}, {'start': 193, 'end': 216, 'url': 'https://t.co/3dhUbgPfec', 'expanded_url': 'https://twitter.com/KunQianHu/status/1532908386622361600/photo/1', 'display_url': 'pic.twitter.com/3dhUbgPfec', 'media_key': '3_1532908382142844928'}], 'hashtags': [{'start': 143, 'end': 153, 'tag': 'gardening'}, {'start': 154, 'end': 163, 'tag': 'pixelart'}, {'start': 164, 'end': 183, 'tag': 'starvingartistsRBX'}, {'start': 184, 'end': 192, 'tag': 'Flowers'}]}",{'media_keys': ['3_1532908382142844928']},False,,everyone,Twitter for iPhone
1532908350752497664,1315181774461259776,I should change my carrd and this account. This was supposed to just be a personal account to make friends and to get away from manga work-- but like I'm making so many cool moots and I kinda want to get into roblox twitter べ( ノx _x)ノ,2022-06-04 02:13:25+00:00,,0,0,4,0,en,1532908350752497664,"[{'domain': {'id': '71', 'name': 'Video Game', 'description': 'A video game like Overwatch'}, 'entity': {'id': '1088118927580774400', 'name': 'Roblox', 'description': 'Roblox'}}, {'domain': {'id': '85', 'name': 'Book Genre', 'description': 'A genre for books, like Fiction'}, 'entity': {'id': '1283453704088084480', 'name': 'Manga', 'description': 'Do NOT tune or ship this topic in Japanese. See Comics instead (847521144173350912)'}}, {'domain': {'id': '46', 'name': 'Brand Category', 'description': 'Categories within Brand Verticals that narrow down the scope of Brands'}, 'entity': {'id': '781974596752842752', 'name': 'Services'}}, {'domain': {'id': '47', 'name': 'Brand', 'description': 'Brands and Companies'}, 'entity': {'id': '10045225402', 'name': 'Twitter'}}]",,,False,,everyone,Twitter for Android
1532908336806776832,1441356217071259662,@model8197 Roblox,2022-06-04 02:13:22+00:00,,0,0,1,0,en,1532758388924289024,"[{'domain': {'id': '71', 'name': 'Video Game', 'description': 'A video game like Overwatch'}, 'entity': {'id': '1088118927580774400', 'name': 'Roblox', 'description': 'Roblox'}}]","{'mentions': [{'start': 0, 'end': 10, 'username': 'model8197', 'id': '1251677662810042371'}]}",,False,,everyone,Twitter for iPad
1532908264194809857,1532906876324700167,"I Just Finished My First Ever Roblox Hat Its Call “Orange Tall Hat”

#RobloxDev #RobloxUGC #Roblox https://t.co/tLHrQgwxp0",2022-06-04 02:13:04+00:00,,4,0,2,0,en,1532908264194809857,"[{'domain': {'id': '71', 'name': 'Video Game', 'description': 'A video game like Overwatch'}, 'entity': {'id': '1088118927580774400', 'name': 'Roblox', 'description': 'Roblox'}}]","{'urls': [{'start': 99, 'end': 122, 'url': 'https://t.co/tLHrQgwxp0', 'expanded_url': 'https://twitter.com/Karam52225/status/1532908264194809857/photo/1', 'display_url': 'pic.twitter.com/tLHrQgwxp0', 'media_key': '3_1532908195873804290'}, {'start': 99, 'end': 122, 'url': 'https://t.co/tLHrQgwxp0', 'expanded_url': 'https://twitter.com/Karam52225/status/1532908264194809857/photo/1', 'display_url': 'pic.twitter.com/tLHrQgwxp0', 'media_key': '3_1532908195882090501'}], 'hashtags': [{'start': 69, 'end': 79, 'tag': 'RobloxDev'}, {'start': 80, 'end': 90, 'tag': 'RobloxUGC'}, {'start': 91, 'end': 98, 'tag': 'Roblox'}]}","{'media_keys': ['3_1532908195873804290', '3_1532908195882090501']}",False,,everyone,Twitter for iPad
1532908225892216832,1523679043505487872,"NEWS: New UGC has been released in the catalog!

#SonicSpeedSimulator 
#SonicSpeedSimulatorLeaks
#Sonic 
#SonicTheHedgehog 
#Roblox 
#RobloxSonic
#AmyRose 
#Eggman https://t.co/3mZd9pvuep",2022-06-04 02:12:55+00:00,,5,1,28,0,en,1532908225892216832,"[{'domain': {'id': '71', 'name': 'Video Game', 'description': 'A video game like Overwatch'}, 'entity': {'id': '1088118927580774400', 'name': 'Roblox', 'description': 'Roblox'}}, {'domain': {'id': '130', 'name': 'Multimedia Franchise', 'description': ""Franchises which span multiple forms of media like 'Harry Potter'""}, 'entity': {'id': '993952643209773057', 'name': 'Sonic the Hedgehog', 'description': 'This entity includes all conversation about the franchise, as well as any individual installments in the series, if applicable.\t\t\t\n\nNOTE: Stopped annotating in the Video Game domain (71) on 11/15/19. Moving forward, this entity will annotate to Multimedia Franchise domain (130) only.'}}]","{'urls': [{'start': 164, 'end': 187, 'url': 'https://t.co/3mZd9pvuep', 'expanded_url': 'https://twitter.com/SSSNewsAndLeaks/status/1532908225892216832/photo/1', 'display_url': 'pic.twitter.com/3mZd9pvuep', 'media_key': '3_1532908222709141505'}], 'hashtags': [{'start': 49, 'end': 69, 'tag': 'SonicSpeedSimulator'}, {'start': 71, 'end': 96, 'tag': 'SonicSpeedSimulatorLeaks'}, {'start': 97, 'end': 103, 'tag': 'Sonic'}, {'start': 105, 'end': 122, 'tag': 'SonicTheHedgehog'}, {'start': 124, 'end': 131, 'tag': 'Roblox'}, {'start': 133, 'end': 145, 'tag': 'RobloxSonic'}, {'start': 146, 'end': 154, 'tag': 'AmyRose'}, {'start': 156, 'end': 163, 'tag': 'Eggman'}]}",{'media_keys': ['3_1532908222709141505']},False,,everyone,Twitter for Android
1532908220079288320,1477102707131305984,@prave_enYT my roblox user is Pxpsss,2022-06-04 02:12:54+00:00,,0,0,0,0,en,1532786006470295552,"[{'domain': {'id': '71', 'name': 'Video Game', 'description': 'A video game like Overwatch'}, 'entity': {'id': '1088118927580774400', 'name': 'Roblox', 'description': 'Roblox'}}]","{'mentions': [{'start': 0, 'end': 11, 'username': 'prave_enYT', 'id': '2467900117'}]}",,False,,everyone,Twitter Web App
1532908217390489602,1447274637570846728,@Roblox_RTC I will be banned again while I defend children in Nazism is this fair?,2022-06-04 02:12:53+00:00,,0,0,0,0,en,1532754008409972736,[],"{'mentions': [{'start': 0, 'end': 11, 'username': 'Roblox_RTC', 'id': '1056053249470541824'}]}",,False,,everyone,Twitter Web App
