tweetid,author_id,text,created_at,geo,retweets,replies,likes,quote_count,lang,conversation_id,context_annotations,entities,attachments,possibly_sensitive,withheld,reply_settings,source
1533817495475613696,1449249685147774977,@SharkBloxYT @Amansees Indeed Roblox is kinda getting boring.,2022-06-06 14:26:02+00:00,,0,0,0,0,en,1533269024959713280,"[{'domain': {'id': '71', 'name': 'Video Game', 'description': 'A video game like Overwatch'}, 'entity': {'id': '1088118927580774400', 'name': 'Roblox', 'description': 'Roblox'}}]","{'mentions': [{'start': 0, 'end': 12, 'username': 'SharkBloxYT', 'id': '985359254184964096'}, {'start': 13, 'end': 22, 'username': 'Amansees', 'id': '1424840808381956097'}], 'annotations': [{'start': 30, 'end': 35, 'probability': 0.3045, 'type': 'Product', 'normalized_text': 'Roblox'}]}",,False,,everyone,Twitter Web App
1533817493784961024,1340257022437015553,"@Roblox_RTC been since sunday actually, happens quite often where roblox disappears from youtube gaming if im not wrong",2022-06-06 14:26:02+00:00,,0,1,2,0,en,1533817359525367809,"[{'domain': {'id': '71', 'name': 'Video Game', 'description': 'A video game like Overwatch'}, 'entity': {'id': '1088118927580774400', 'name': 'Roblox', 'description': 'Roblox'}}, {'domain': {'id': '165', 'name': 'Technology', 'description': 'for individual and types of technology, e.g., food technology, 3D printing'}, 'entity': {'id': '1196446161223028736', 'name': 'Social media'}}, {'domain': {'id': '46', 'name': 'Brand Category', 'description': 'Categories within Brand Verticals that narrow down the scope of Brands'}, 'entity': {'id': '781974596752842752', 'name': 'Services'}}, {'domain': {'id': '47', 'name': 'Brand', 'description': 'Brands and Companies'}, 'entity': {'id': '10029382357', 'name': 'YouTube'}}]","{'mentions': [{'start': 0, 'end': 11, 'username': 'Roblox_RTC', 'id': '1056053249470541824'}], 'annotations': [{'start': 89, 'end': 95, 'probability': 0.6068, 'type': 'Product', 'normalized_text': 'youtube'}]}",,False,,everyone,Twitter for iPad
1533817485857902592,1512438135829016577,@Roblox_RTC Mid pfp,2022-06-06 14:26:00+00:00,,0,2,0,0,fr,1533817359525367809,[],"{'mentions': [{'start': 0, 'end': 11, 'username': 'Roblox_RTC', 'id': '1056053249470541824'}]}",,False,,everyone,Twitter Web App
1533817468631785475,969354536560230401,"@SONICstalgia Half of this work you're praising is Sonic Team.
Origins is a compilation of Sonic Team games made by Sonic Team with assistance from Headcanon.
Mania was the reverse, a Headcanon/Pagoda West game with assistance from Sonic Team.
The other is Roblox.
You just want to be angry.",2022-06-06 14:25:56+00:00,,0,0,19,0,en,1533297947131006976,"[{'domain': {'id': '71', 'name': 'Video Game', 'description': 'A video game like Overwatch'}, 'entity': {'id': '1088118927580774400', 'name': 'Roblox', 'description': 'Roblox'}}, {'domain': {'id': '130', 'name': 'Multimedia Franchise', 'description': ""Franchises which span multiple forms of media like 'Harry Potter'""}, 'entity': {'id': '993952643209773057', 'name': 'Sonic the Hedgehog', 'description': 'This entity includes all conversation about the franchise, as well as any individual installments in the series, if applicable.\t\t\t\n\nNOTE: Stopped annotating in the Video Game domain (71) on 11/15/19. Moving forward, this entity will annotate to Multimedia Franchise domain (130) only.'}}]","{'mentions': [{'start': 0, 'end': 13, 'username': 'SONICstalgia', 'id': '1473114908384505856'}], 'annotations': [{'start': 51, 'end': 69, 'probability': 0.1781, 'type': 'Other', 'normalized_text': 'Sonic Team. Origins'}, {'start': 116, 'end': 125, 'probability': 0.6467, 'type': 'Organization', 'normalized_text': 'Sonic Team'}, {'start': 148, 'end': 156, 'probability': 0.4721, 'type': 'Person', 'normalized_text': 'Headcanon'}, {'start': 194, 'end': 204, 'probability': 0.7583, 'type': 'Organization', 'normalized_text': 'Pagoda West'}, {'start': 232, 'end': 241, 'probability': 0.6505, 'type': 'Organization', 'normalized_text': 'Sonic Team'}]}",,False,,everyone,Twitter for Android
1533817445588168705,1499415420750929924,"@model8197 Ye, I started playing Roblox back in 2016",2022-06-06 14:25:50+00:00,,0,0,0,0,en,1533480252239777792,"[{'domain': {'id': '71', 'name': 'Video Game', 'description': 'A video game like Overwatch'}, 'entity': {'id': '1088118927580774400', 'name': 'Roblox', 'description': 'Roblox'}}]","{'mentions': [{'start': 0, 'end': 10, 'username': 'model8197', 'id': '1251677662810042371'}], 'annotations': [{'start': 33, 'end': 38, 'probability': 0.4089, 'type': 'Product', 'normalized_text': 'Roblox'}]}",,False,,everyone,Twitter for Android
1533817359525367809,1056053249470541824,"Some users are reporting users seeing the category “Roblox” on YouTube in YouTube gaming GONE. They can’t find it! ▶️

They claim that this has lessened their views, but many also claimed that the Roblox category needed a clean up due to the spam &amp; low quality videos.",2022-06-06 14:25:30+00:00,,49,72,972,7,en,1533817359525367809,"[{'domain': {'id': '71', 'name': 'Video Game', 'description': 'A video game like Overwatch'}, 'entity': {'id': '1088118927580774400', 'name': 'Roblox', 'description': 'Roblox'}}, {'domain': {'id': '165', 'name': 'Technology', 'description': 'for individual and types of technology, e.g., food technology, 3D printing'}, 'entity': {'id': '1196446161223028736', 'name': 'Social media'}}, {'domain': {'id': '46', 'name': 'Brand Category', 'description': 'Categories within Brand Verticals that narrow down the scope of Brands'}, 'entity': {'id': '781974596752842752', 'name': 'Services'}}, {'domain': {'id': '47', 'name': 'Brand', 'description': 'Brands and Companies'}, 'entity': {'id': '10029382357', 'name': 'YouTube'}}]","{'annotations': [{'start': 63, 'end': 69, 'probability': 0.6551, 'type': 'Product', 'normalized_text': 'YouTube'}, {'start': 74, 'end': 80, 'probability': 0.6874, 'type': 'Product', 'normalized_text': 'YouTube'}, {'start': 197, 'end': 202, 'probability': 0.2926, 'type': 'Other', 'normalized_text': 'Roblox'}]}",,False,,everyone,Twitter for iPhone
1533817337647968256,1507404371205758976,@Legolazz_ Hola 💜legolaz💜 Mi video favorito Cuando suscriptores reaccionaron a tu auto Galaxy ✨🤙                    ID roblox: Canicabitafa,2022-06-06 14:25:24+00:00,,0,0,0,0,es,1533498781609496578,"[{'domain': {'id': '71', 'name': 'Video Game', 'description': 'A video game like Overwatch'}, 'entity': {'id': '1088118927580774400', 'name': 'Roblox', 'description': 'Roblox'}}, {'domain': {'id': '47', 'name': 'Brand', 'description': 'Brands and Companies'}, 'entity': {'id': '10026364234', 'name': 'Samsung '}}, {'domain': {'id': '48', 'name': 'Product', 'description': 'Products created by Brands.  Examples: Ford Explorer, Apple iPhone.'}, 'entity': {'id': '10026230384', 'name': 'Samsung Galaxy'}}, {'domain': {'id': '30', 'name': 'Entities [Entity Service]', 'description': 'Entity Service top level domain, every item that is in Entity Service should be in this domain'}, 'entity': {'id': '848920371311001600', 'name': 'Technology', 'description': 'Technology and computing'}}, {'domain': {'id': '66', 'name': 'Interests and Hobbies Category', 'description': 'A grouping of interests and hobbies entities, like Novelty Food or Destinations'}, 'entity': {'id': '848920700073123840', 'name': 'Cell Phones', 'description': 'Cell phones'}}, {'domain': {'id': '30', 'name': 'Entities [Entity Service]', 'description': 'Entity Service top level domain, every item that is in Entity Service should be in this domain'}, 'entity': {'id': '848985956778561538', 'name': 'Mobile', 'description': 'Mobile'}}]","{'mentions': [{'start': 0, 'end': 10, 'username': 'Legolazz_', 'id': '157028359'}], 'annotations': [{'start': 89, 'end': 94, 'probability': 0.4847, 'type': 'Product', 'normalized_text': 'Galaxy'}]}",,False,,everyone,Twitter for Android
1533817325165608960,1521808324496400384,Growing your influencer career is like building a tycoon on Roblox 🥴,2022-06-06 14:25:21+00:00,,0,0,0,0,en,1533817325165608960,"[{'domain': {'id': '71', 'name': 'Video Game', 'description': 'A video game like Overwatch'}, 'entity': {'id': '1088118927580774400', 'name': 'Roblox', 'description': 'Roblox'}}]","{'annotations': [{'start': 60, 'end': 65, 'probability': 0.5077, 'type': 'Product', 'normalized_text': 'Roblox'}]}",,False,,everyone,Twitter for iPhone
1533817312997806080,1425708798065401856,"@Roblox_RTC its actually true... unfortunately roblox wont even listen to what the community wants,  since they only care about investors and the metaverse. lately, we have been getting many sponsored events, mostly terrible, and metaverse content, just for roblox to please investors",2022-06-06 14:25:19+00:00,,0,1,1,0,en,1533642489390944256,"[{'domain': {'id': '30', 'name': 'Entities [Entity Service]', 'description': 'Entity Service top level domain, every item that is in Entity Service should be in this domain'}, 'entity': {'id': '848920371311001600', 'name': 'Technology', 'description': 'Technology and computing'}}, {'domain': {'id': '71', 'name': 'Video Game', 'description': 'A video game like Overwatch'}, 'entity': {'id': '1088118927580774400', 'name': 'Roblox', 'description': 'Roblox'}}, {'domain': {'id': '165', 'name': 'Technology', 'description': 'for individual and types of technology, e.g., food technology, 3D printing'}, 'entity': {'id': '848920371311001600', 'name': 'Technology', 'description': 'Technology and computing'}}, {'domain': {'id': '65', 'name': 'Interests and Hobbies Vertical', 'description': 'Top level interests and hobbies groupings, like Food or Travel'}, 'entity': {'id': '781974596148793345', 'name': 'Business & finance'}}, {'domain': {'id': '66', 'name': 'Interests and Hobbies Category', 'description': 'A grouping of interests and hobbies entities, like Novelty Food or Destinations'}, 'entity': {'id': '857878402157629440', 'name': 'Investors and patents', 'description': 'Investors and patents'}}]","{'mentions': [{'start': 0, 'end': 11, 'username': 'Roblox_RTC', 'id': '1056053249470541824'}]}",,False,,everyone,Twitter for Android
1533817294358454272,2703266513,"Halo content creator: ""Since I returned to Halo Infinite after playing SplitGate and Destiny 2 back-to-back, I realised now that Halo Infinite wants me to commit despacito on Roblox, but possibly in real life.""

Halo community: YASSS GIRL, SAMSIES, SLAY QUEEN!",2022-06-06 14:25:14+00:00,,0,1,0,0,en,1533436794703958016,"[{'domain': {'id': '45', 'name': 'Brand Vertical', 'description': 'Top level entities that describe a Brands industry'}, 'entity': {'id': '781974597310615553', 'name': 'Entertainment'}}, {'domain': {'id': '46', 'name': 'Brand Category', 'description': 'Categories within Brand Verticals that narrow down the scope of Brands'}, 'entity': {'id': '781974597218340864', 'name': 'Video Games'}}, {'domain': {'id': '71', 'name': 'Video Game', 'description': 'A video game like Overwatch'}, 'entity': {'id': '10024663350', 'name': 'Halo', 'description': 'This entity includes all conversation about the franchise, as well as any individual installments in the series, if applicable.\t\t\t'}}, {'domain': {'id': '71', 'name': 'Video Game', 'description': 'A video game like Overwatch'}, 'entity': {'id': '10041743268', 'name': 'Destiny', 'description': 'This entity includes all conversation about the franchise, as well as any individual installments in the series, if applicable.\t\t\t'}}, {'domain': {'id': '71', 'name': 'Video Game', 'description': 'A video game like Overwatch'}, 'entity': {'id': '1004427599559323648', 'name': 'Halo Infinite', 'description': 'Halo Infinite'}}, {'domain': {'id': '71', 'name': 'Video Game', 'description': 'A video game like Overwatch'}, 'entity': {'id': '1088118927580774400', 'name': 'Roblox', 'description': 'Roblox'}}, {'domain': {'id': '130', 'name': 'Multimedia Franchise', 'description': ""Franchises which span multiple forms of media like 'Harry Potter'""}, 'entity': {'id': '10024663350', 'name': 'Halo', 'description': 'This entity includes all conversation about the franchise, as well as any individual installments in the series, if applicable.\t\t\t'}}]","{'annotations': [{'start': 43, 'end': 55, 'probability': 0.3505, 'type': 'Product', 'normalized_text': 'Halo Infinite'}, {'start': 71, 'end': 93, 'probability': 0.3504, 'type': 'Other', 'normalized_text': 'SplitGate and Destiny 2'}, {'start': 129, 'end': 141, 'probability': 0.5474, 'type': 'Other', 'normalized_text': 'Halo Infinite'}, {'start': 175, 'end': 180, 'probability': 0.4514, 'type': 'Product', 'normalized_text': 'Roblox'}]}",,False,,everyone,Twitter for Android
1533817279112171525,1420307554291396610,Freya here: Nice to meet you everyone: my first Tweet is to present our first merch on the ROBLOX group lavender shirt and pants designed by the amazing @missmudmaam_mmm  https://t.co/i8YWT1d9or please join our group if you did not do before.,2022-06-06 14:25:10+00:00,,2,0,10,0,en,1533817279112171525,"[{'domain': {'id': '71', 'name': 'Video Game', 'description': 'A video game like Overwatch'}, 'entity': {'id': '1088118927580774400', 'name': 'Roblox', 'description': 'Roblox'}}, {'domain': {'id': '46', 'name': 'Brand Category', 'description': 'Categories within Brand Verticals that narrow down the scope of Brands'}, 'entity': {'id': '781974596752842752', 'name': 'Services'}}, {'domain': {'id': '47', 'name': 'Brand', 'description': 'Brands and Companies'}, 'entity': {'id': '10045225402', 'name': 'Twitter'}}]","{'mentions': [{'start': 153, 'end': 169, 'username': 'missmudmaam_mmm', 'id': '984347674534035456'}], 'urls': [{'start': 171, 'end': 194, 'url': 'https://t.co/i8YWT1d9or', 'expanded_url': 'https://www.roblox.com/groups/14386888/Vicky-Mania-Squad-Millennial-level#!/store', 'display_url': 'roblox.com/groups/1438688…'}], 'annotations': [{'start': 0, 'end': 4, 'probability': 0.4798, 'type': 'Person', 'normalized_text': 'Freya'}]}",,False,,everyone,Twitter for iPhone
1533817245767454722,1528318835069227009,"فيديو اليوم تختيم باركور الجزء الأول.
خش على الرابط👇🏻
https://t.co/8pJqNfJ6ws
__________________
#فيديو #Roblox #obby
#ألعاب #gaming #games",2022-06-06 14:25:02+00:00,,1,0,1,0,ar,1533817245767454722,"[{'domain': {'id': '71', 'name': 'Video Game', 'description': 'A video game like Overwatch'}, 'entity': {'id': '1088118927580774400', 'name': 'Roblox', 'description': 'Roblox'}}]","{'hashtags': [{'start': 97, 'end': 103, 'tag': 'فيديو'}, {'start': 104, 'end': 111, 'tag': 'Roblox'}, {'start': 112, 'end': 117, 'tag': 'obby'}, {'start': 118, 'end': 124, 'tag': 'ألعاب'}, {'start': 125, 'end': 132, 'tag': 'gaming'}, {'start': 133, 'end': 139, 'tag': 'games'}], 'urls': [{'start': 54, 'end': 77, 'url': 'https://t.co/8pJqNfJ6ws', 'expanded_url': 'https://youtu.be/blghmPagfBY', 'display_url': 'youtu.be/blghmPagfBY'}]}",,False,,everyone,Twitter for Android
1533817242206580737,707190712803172352,really like this game https://t.co/nWZQqav0z0 a great example of how clean and indepth a roblox game can get if the developers know what they're doing https://t.co/KlhYcVrmJL,2022-06-06 14:25:02+00:00,,0,6,17,0,en,1533817242206580737,"[{'domain': {'id': '71', 'name': 'Video Game', 'description': 'A video game like Overwatch'}, 'entity': {'id': '1088118927580774400', 'name': 'Roblox', 'description': 'Roblox'}}]","{'urls': [{'start': 22, 'end': 45, 'url': 'https://t.co/nWZQqav0z0', 'expanded_url': 'https://www.roblox.com/games/5620237741/Cantermagne', 'display_url': 'roblox.com/games/56202377…'}, {'start': 151, 'end': 174, 'url': 'https://t.co/KlhYcVrmJL', 'expanded_url': 'https://twitter.com/revolveragz/status/1533817242206580737/photo/1', 'display_url': 'pic.twitter.com/KlhYcVrmJL', 'media_key': '3_1533817072181993472'}]}",{'media_keys': ['3_1533817072181993472']},False,,everyone,Twitter Web App
1533817207758757888,1355550463618240514,@Smoothie_Roblox you,2022-06-06 14:24:53+00:00,,0,2,1,0,und,1533816781302771712,[],,,False,,everyone,Twitter for iPhone
1533817107959644160,1486381154731438082,"Ddesy

#robloxart #art #digitalart #Roblox #RTC https://t.co/n4E8EKz93P",2022-06-06 14:24:30+00:00,,2,5,17,0,en,1533817107959644160,"[{'domain': {'id': '65', 'name': 'Interests and Hobbies Vertical', 'description': 'Top level interests and hobbies groupings, like Food or Travel'}, 'entity': {'id': '1280550787207147521', 'name': 'Arts & culture'}}, {'domain': {'id': '66', 'name': 'Interests and Hobbies Category', 'description': 'A grouping of interests and hobbies entities, like Novelty Food or Destinations'}, 'entity': {'id': '1046577790353428480', 'name': 'Visual arts', 'description': 'Visual Arts'}}, {'domain': {'id': '71', 'name': 'Video Game', 'description': 'A video game like Overwatch'}, 'entity': {'id': '1088118927580774400', 'name': 'Roblox', 'description': 'Roblox'}}, {'domain': {'id': '173', 'name': 'Google Product Taxonomy', 'description': 'A product taxonomy created by Google'}, 'entity': {'id': '1462809879609950219', 'name': 'Digital artwork'}}]","{'hashtags': [{'start': 7, 'end': 17, 'tag': 'robloxart'}, {'start': 18, 'end': 22, 'tag': 'art'}, {'start': 23, 'end': 34, 'tag': 'digitalart'}, {'start': 35, 'end': 42, 'tag': 'Roblox'}, {'start': 43, 'end': 47, 'tag': 'RTC'}], 'urls': [{'start': 48, 'end': 71, 'url': 'https://t.co/n4E8EKz93P', 'expanded_url': 'https://twitter.com/JustAkuma_/status/1533817107959644160/photo/1', 'display_url': 'pic.twitter.com/n4E8EKz93P', 'media_key': '3_1533817103727624192'}]}",{'media_keys': ['3_1533817103727624192']},False,,everyone,Twitter for Android
1533817064611250176,1506639930860220425,"@Roblox_RTC_BR não,mas baniram minha conta injustamente",2022-06-06 14:24:19+00:00,,0,1,0,0,pt,1533142152477294592,[],"{'mentions': [{'start': 0, 'end': 14, 'username': 'Roblox_RTC_BR', 'id': '1417587809502826500'}]}",,False,,everyone,Twitter for Android
1533817056281636866,1394480672828321792,playing roblox on bluestacks👀 https://t.co/rgQx9It6hZ,2022-06-06 14:24:17+00:00,,1,2,3,0,en,1533817056281636866,"[{'domain': {'id': '71', 'name': 'Video Game', 'description': 'A video game like Overwatch'}, 'entity': {'id': '1088118927580774400', 'name': 'Roblox', 'description': 'Roblox'}}]","{'urls': [{'start': 30, 'end': 53, 'url': 'https://t.co/rgQx9It6hZ', 'expanded_url': 'https://twitter.com/GenxGod/status/1533817056281636866/photo/1', 'display_url': 'pic.twitter.com/rgQx9It6hZ', 'media_key': '3_1533817018105098240'}], 'annotations': [{'start': 18, 'end': 27, 'probability': 0.5284, 'type': 'Product', 'normalized_text': 'bluestacks'}]}",{'media_keys': ['3_1533817018105098240']},False,,everyone,Twitter Web App
1533817052363780097,1470259471498690561,@Roblox_BRC Incident News: @Besite_TD is blocked and I don't don't who? https://t.co/KYIujn2uVt,2022-06-06 14:24:16+00:00,,1,1,3,0,en,1533817052363780097,[],"{'mentions': [{'start': 0, 'end': 11, 'username': 'Roblox_BRC', 'id': '1469159266259185668'}, {'start': 27, 'end': 37, 'username': 'Besite_TD', 'id': '1498127832152567811'}], 'urls': [{'start': 72, 'end': 95, 'url': 'https://t.co/KYIujn2uVt', 'expanded_url': 'https://twitter.com/Roblox_BRCNews/status/1533817052363780097/photo/1', 'display_url': 'pic.twitter.com/KYIujn2uVt', 'media_key': '3_1533817048689651712'}]}",{'media_keys': ['3_1533817048689651712']},False,,everyone,Twitter for Android
1533817038753280000,1522961288128696320,@7_thvante Roblox,2022-06-06 14:24:13+00:00,,0,1,1,0,en,1533816886936637440,"[{'domain': {'id': '71', 'name': 'Video Game', 'description': 'A video game like Overwatch'}, 'entity': {'id': '1088118927580774400', 'name': 'Roblox', 'description': 'Roblox'}}]","{'mentions': [{'start': 0, 'end': 10, 'username': '7_thvante', 'id': '1513344030318678018'}]}",,False,,mentionedUsers,Twitter for Android
1533817033674088448,1526830944711229441,@CardanoNewsFeed #Arcadeland community join and win $150USDT #NFTs #GameFi #giveaway #Roblox #P2EGAMING #crypto🚀🚀🚀💯✅ https://t.co/ecutrVql3P https://t.co/ZAvyelwDei,2022-06-06 14:24:12+00:00,,0,0,1,0,en,1533803925912096768,"[{'domain': {'id': '66', 'name': 'Interests and Hobbies Category', 'description': 'A grouping of interests and hobbies entities, like Novelty Food or Destinations'}, 'entity': {'id': '913142676819648512', 'name': 'Cryptocurrencies', 'description': 'Cryptocurrency'}}, {'domain': {'id': '71', 'name': 'Video Game', 'description': 'A video game like Overwatch'}, 'entity': {'id': '1088118927580774400', 'name': 'Roblox', 'description': 'Roblox'}}]","{'mentions': [{'start': 0, 'end': 16, 'username': 'CardanoNewsFeed', 'id': '1405131947790290947'}], 'hashtags': [{'start': 17, 'end': 28, 'tag': 'Arcadeland'}, {'start': 61, 'end': 66, 'tag': 'NFTs'}, {'start': 67, 'end': 74, 'tag': 'GameFi'}, {'start': 75, 'end': 84, 'tag': 'giveaway'}, {'start': 85, 'end': 92, 'tag': 'Roblox'}, {'start': 93, 'end': 103, 'tag': 'P2EGAMING'}, {'start': 104, 'end': 111, 'tag': 'crypto'}], 'urls': [{'start': 117, 'end': 140, 'url': 'https://t.co/ecutrVql3P', 'expanded_url': 'https://discord.gg/gDMzMTjg', 'display_url': 'discord.gg/gDMzMTjg'}, {'start': 141, 'end': 164, 'url': 'https://t.co/ZAvyelwDei', 'expanded_url': 'https://twitter.com/MNfona/status/1533817033674088448/photo/1', 'display_url': 'pic.twitter.com/ZAvyelwDei', 'media_key': '3_1533817026011140097'}]}",{'media_keys': ['3_1533817026011140097']},False,,everyone,Twitter for Android
1533817030708670465,1347355278254239750,"do NOT tell springtrap that i took the golf cart on the highway and got a ticket, he'll take away my roblox premium!",2022-06-06 14:24:11+00:00,,0,1,0,0,en,1533817030708670465,"[{'domain': {'id': '71', 'name': 'Video Game', 'description': 'A video game like Overwatch'}, 'entity': {'id': '1088118927580774400', 'name': 'Roblox', 'description': 'Roblox'}}]",,,False,,everyone,"Cheap Bots, Done Quick!"
1533816973821370368,964704271764807681,recomienden juegos en roblox,2022-06-06 14:23:58+00:00,,0,2,0,0,es,1533816973821370368,"[{'domain': {'id': '71', 'name': 'Video Game', 'description': 'A video game like Overwatch'}, 'entity': {'id': '1088118927580774400', 'name': 'Roblox', 'description': 'Roblox'}}]",,,False,,everyone,Twitter for iPhone
1533816961624428545,1305753285370937346,"@RobloxNoobifier Don’t care cuz I quit, roblox sucks these day imo smh",2022-06-06 14:23:55+00:00,,0,2,3,0,en,1533571598254493698,"[{'domain': {'id': '71', 'name': 'Video Game', 'description': 'A video game like Overwatch'}, 'entity': {'id': '1088118927580774400', 'name': 'Roblox', 'description': 'Roblox'}}]","{'mentions': [{'start': 0, 'end': 16, 'username': 'RobloxNoobifier', 'id': '1132099522405044225'}]}",,False,,everyone,Twitter for iPhone
1533816960739606529,1522581638693097472,@7_thvante Roblox,2022-06-06 14:23:55+00:00,,0,1,1,0,en,1533816886936637440,"[{'domain': {'id': '71', 'name': 'Video Game', 'description': 'A video game like Overwatch'}, 'entity': {'id': '1088118927580774400', 'name': 'Roblox', 'description': 'Roblox'}}]","{'mentions': [{'start': 0, 'end': 10, 'username': '7_thvante', 'id': '1513344030318678018'}]}",,False,,mentionedUsers,Twitter for Android
1533816939436457985,1459767167000403969,@7_thvante roblox,2022-06-06 14:23:49+00:00,,0,1,1,0,en,1533816886936637440,"[{'domain': {'id': '71', 'name': 'Video Game', 'description': 'A video game like Overwatch'}, 'entity': {'id': '1088118927580774400', 'name': 'Roblox', 'description': 'Roblox'}}]","{'mentions': [{'start': 0, 'end': 10, 'username': '7_thvante', 'id': '1513344030318678018'}]}",,False,,mentionedUsers,Twitter for iPhone
1533816905920036865,1505034483036463104,@Smoothie_Roblox Myself 😭,2022-06-06 14:23:41+00:00,,0,0,2,0,en,1533816781302771712,[],,,False,,everyone,Twitter Web App
1533816902551801858,1182478119858520064,Would like to see asimo defend ROBLOX on this one https://t.co/86rNHvX938,2022-06-06 14:23:41+00:00,,0,3,18,0,en,1533816902551801858,"[{'domain': {'id': '71', 'name': 'Video Game', 'description': 'A video game like Overwatch'}, 'entity': {'id': '1088118927580774400', 'name': 'Roblox', 'description': 'Roblox'}}, {'domain': {'id': '46', 'name': 'Brand Category', 'description': 'Categories within Brand Verticals that narrow down the scope of Brands'}, 'entity': {'id': '781974596752842752', 'name': 'Services'}}, {'domain': {'id': '47', 'name': 'Brand', 'description': 'Brands and Companies'}, 'entity': {'id': '10045225402', 'name': 'Twitter'}}]","{'urls': [{'start': 50, 'end': 73, 'url': 'https://t.co/86rNHvX938', 'expanded_url': 'https://twitter.com/Roblox_RTC/status/1533642489390944256', 'display_url': 'twitter.com/Roblox_RTC/sta…'}], 'annotations': [{'start': 31, 'end': 36, 'probability': 0.2703, 'type': 'Organization', 'normalized_text': 'ROBLOX'}]}",,False,,everyone,Twitter Web App
