tweetid,author_id,text,created_at,geo,retweets,replies,likes,quote_count,lang,conversation_id,context_annotations,entities,attachments,possibly_sensitive,withheld,reply_settings,source
1515428496545398784,1498431300251885568,"@FishyBlox kittyloverella1235 cover:catrina, i have blonde hair in roblox .",2022-04-16 20:34:43+00:00,,0,0,0,0,en,1515083039805685761,"[{'domain': {'id': '71', 'name': 'Video Game', 'description': 'A video game like Overwatch'}, 'entity': {'id': '1088118927580774400', 'name': 'Roblox', 'description': 'Roblox'}}]","{'mentions': [{'start': 0, 'end': 10, 'username': 'FishyBlox', 'id': '1894642398'}]}",,False,,everyone,Twitter Web App
1515428423136530433,1391199528368230400,nimu parece de roblox,2022-04-16 20:34:26+00:00,,0,0,0,0,et,1515428423136530433,"[{'domain': {'id': '71', 'name': 'Video Game', 'description': 'A video game like Overwatch'}, 'entity': {'id': '1088118927580774400', 'name': 'Roblox', 'description': 'Roblox'}}]",,,False,,everyone,Twitter for iPhone
1515428413900787723,1422163374339727363,"@Roblog_ Lançaram mais um, os Sapos

https://t.co/7MAMqISdmq",2022-04-16 20:34:23+00:00,,1,0,11,0,pt,1515424146028650500,[],"{'mentions': [{'start': 0, 'end': 8, 'username': 'Roblog_', 'id': '1425933854733393926'}], 'urls': [{'start': 37, 'end': 60, 'url': 'https://t.co/7MAMqISdmq', 'expanded_url': 'https://web.roblox.com/catalog?Category=1&CreatorName=Egghunt%202022%20%7C%20UGC&SortType=3&IncludeNotForSale', 'display_url': 'web.roblox.com/catalog?Catego…'}]}",,False,,everyone,Twitter Web App
1515428404421611524,1509476476730724357,@HelloItsVG My name of roblox is hatagogon4,2022-04-16 20:34:21+00:00,,0,0,0,0,en,1515283863030935556,"[{'domain': {'id': '71', 'name': 'Video Game', 'description': 'A video game like Overwatch'}, 'entity': {'id': '1088118927580774400', 'name': 'Roblox', 'description': 'Roblox'}}]","{'mentions': [{'start': 0, 'end': 11, 'username': 'HelloItsVG', 'id': '888867384404176896'}]}",,False,,everyone,Twitter for iPad
1515428392350679040,1198705956827226112,ON ROBLOX 😂😂😂 https://t.co/iaA6BSknjF https://t.co/z3xXxd2a3A,2022-04-16 20:34:18+00:00,,0,0,0,0,en,1515428392350679040,"[{'domain': {'id': '10', 'name': 'Person', 'description': 'Named people in the world like Nelson Mandela'}, 'entity': {'id': '806561823407239169', 'name': 'Kanye West', 'description': 'Kanye West'}}, {'domain': {'id': '10', 'name': 'Person', 'description': 'Named people in the world like Nelson Mandela'}, 'entity': {'id': '806570121959383040', 'name': 'Kim Kardashian', 'description': 'Kim Kardashian'}}, {'domain': {'id': '54', 'name': 'Musician', 'description': 'A musician in the world, like Adele or Bob Dylan'}, 'entity': {'id': '806561823407239169', 'name': 'Kanye West', 'description': 'Kanye West'}}, {'domain': {'id': '55', 'name': 'Music Genre', 'description': 'A category for a musical style, like Pop, Rock, or Rap'}, 'entity': {'id': '810937888334487552', 'name': 'Rap', 'description': 'Hip-Hop/Rap'}}, {'domain': {'id': '58', 'name': 'Entertainment Personality', 'description': 'An entertainment personality in the world, like Anderson Cooper or Miranda Sings'}, 'entity': {'id': '806570121959383040', 'name': 'Kim Kardashian', 'description': 'Kim Kardashian'}}, {'domain': {'id': '71', 'name': 'Video Game', 'description': 'A video game like Overwatch'}, 'entity': {'id': '1088118927580774400', 'name': 'Roblox', 'description': 'Roblox'}}]","{'urls': [{'start': 14, 'end': 37, 'url': 'https://t.co/iaA6BSknjF', 'expanded_url': 'https://twitter.com/FABPman/status/1515428392350679040/photo/1', 'display_url': 'pic.twitter.com/iaA6BSknjF', 'media_key': '16_1515428382242406400'}, {'start': 38, 'end': 61, 'url': 'https://t.co/z3xXxd2a3A', 'expanded_url': 'https://twitter.com/ayedocc/status/1514838191991361544', 'display_url': 'twitter.com/ayedocc/status…'}]}",{'media_keys': ['16_1515428382242406400']},False,,everyone,Twitter for Android
1515428366979018755,968126991751761921,@Rainbow6Mobile Roblox,2022-04-16 20:34:12+00:00,,0,0,0,0,en,1514683915369336838,"[{'domain': {'id': '71', 'name': 'Video Game', 'description': 'A video game like Overwatch'}, 'entity': {'id': '1088118927580774400', 'name': 'Roblox', 'description': 'Roblox'}}]","{'mentions': [{'start': 0, 'end': 15, 'username': 'Rainbow6Mobile', 'id': '1415696662425653250'}]}",,False,,everyone,Twitter for Android
1515428343990083588,1006929835573301250,"Todo reality do Roblox que eu participei eu sai igual a Karol Conka, odiado e brigando com todo mundo https://t.co/N3UxxT2IJo",2022-04-16 20:34:07+00:00,,2,2,17,1,pt,1515428343990083588,"[{'domain': {'id': '71', 'name': 'Video Game', 'description': 'A video game like Overwatch'}, 'entity': {'id': '1088118927580774400', 'name': 'Roblox', 'description': 'Roblox'}}, {'domain': {'id': '10', 'name': 'Person', 'description': 'Named people in the world like Nelson Mandela'}, 'entity': {'id': '889940652728786944', 'name': 'Karol Conka', 'description': 'Karol Conka'}}, {'domain': {'id': '54', 'name': 'Musician', 'description': 'A musician in the world, like Adele or Bob Dylan'}, 'entity': {'id': '889940652728786944', 'name': 'Karol Conka', 'description': 'Karol Conka'}}]","{'annotations': [{'start': 56, 'end': 66, 'probability': 0.9772, 'type': 'Person', 'normalized_text': 'Karol Conka'}], 'urls': [{'start': 102, 'end': 125, 'url': 'https://t.co/N3UxxT2IJo', 'expanded_url': 'https://twitter.com/acervommes/status/1343343136211410944/video/1', 'display_url': 'pic.twitter.com/N3UxxT2IJo', 'media_key': '7_1343342966115590150'}]}",{'media_keys': ['7_1343342966115590150']},False,,everyone,Twitter for iPhone
1515428322423062534,1304028446406914054,@PazeTweets https://t.co/9DSsRka0Ax,2022-04-16 20:34:02+00:00,,0,0,3,0,qme,1515423989727961088,[],"{'mentions': [{'start': 0, 'end': 11, 'username': 'PazeTweets', 'id': '946164003855880192'}], 'urls': [{'start': 12, 'end': 35, 'url': 'https://t.co/9DSsRka0Ax', 'expanded_url': 'https://www.roblox.com/games/7117492592/Realistic-Hand-RP-Without-VR-Egg-Hunt', 'display_url': 'roblox.com/games/71174925…'}]}",,False,,everyone,Twitter for iPhone
1515428304165093376,1346899633604329477,"you has worst dork, suck my dick. that stupid fucking trenchcoat prick stole my roblox account!",2022-04-16 20:33:57+00:00,,0,0,0,0,en,1515428304165093376,"[{'domain': {'id': '71', 'name': 'Video Game', 'description': 'A video game like Overwatch'}, 'entity': {'id': '1088118927580774400', 'name': 'Roblox', 'description': 'Roblox'}}]",,,False,,everyone,"Cheap Bots, Done Quick!"
1515428293805481984,1491368781830307843,"gonna do some grinding for the new season but before i do that
ima play me that new sonic game on roblox",2022-04-16 20:33:55+00:00,,0,0,0,0,en,1515428293805481984,"[{'domain': {'id': '71', 'name': 'Video Game', 'description': 'A video game like Overwatch'}, 'entity': {'id': '1088118927580774400', 'name': 'Roblox', 'description': 'Roblox'}}, {'domain': {'id': '130', 'name': 'Multimedia Franchise', 'description': ""Franchises which span multiple forms of media like 'Harry Potter'""}, 'entity': {'id': '993952643209773057', 'name': 'Sonic the Hedgehog', 'description': 'This entity includes all conversation about the franchise, as well as any individual installments in the series, if applicable.\t\t\t\n\nNOTE: Stopped annotating in the Video Game domain (71) on 11/15/19. Moving forward, this entity will annotate to Multimedia Franchise domain (130) only.'}}]",,,False,,everyone,Twitter Web App
1515428278290558986,1341331712542973952,@keffals Only thing I know about Roblox is there's a huge thing about Child Labour and that game. It's a bit fucked up.,2022-04-16 20:33:51+00:00,,0,0,4,0,en,1515416627378073600,"[{'domain': {'id': '71', 'name': 'Video Game', 'description': 'A video game like Overwatch'}, 'entity': {'id': '1088118927580774400', 'name': 'Roblox', 'description': 'Roblox'}}]","{'annotations': [{'start': 33, 'end': 38, 'probability': 0.3504, 'type': 'Product', 'normalized_text': 'Roblox'}], 'mentions': [{'start': 0, 'end': 8, 'username': 'keffals', 'id': '1341914117599350784'}]}",,False,,everyone,Twitter for Android
1515428257247952897,723314914627059713,"""I am a moderator, and if you want your save back you're going to have to quit ROBLOX for 2 days."" (THIS ACTUALLY WORKED HHHH)",2022-04-16 20:33:46+00:00,,0,0,0,0,en,1515428257247952897,"[{'domain': {'id': '71', 'name': 'Video Game', 'description': 'A video game like Overwatch'}, 'entity': {'id': '1088118927580774400', 'name': 'Roblox', 'description': 'Roblox'}}]",,,False,,everyone,twittbot.net
1515428245990428672,1095357130108952577,"very very very very VERY little doddle.
Skyrix! (do not re upload my art.)
#dragonadventures #Roblox #robloxart 
If the likes are over the 10, I'll draw little aranga doddle next time. https://t.co/O1U2GItrXY",2022-04-16 20:33:43+00:00,,7,0,3,0,en,1515428245990428672,"[{'domain': {'id': '71', 'name': 'Video Game', 'description': 'A video game like Overwatch'}, 'entity': {'id': '1088118927580774400', 'name': 'Roblox', 'description': 'Roblox'}}, {'domain': {'id': '67', 'name': 'Interests and Hobbies', 'description': 'Interests, opinions, and behaviors of individuals, groups, or cultures; like Speciality Cooking or Theme Parks'}, 'entity': {'id': '847869251595542528', 'name': 'Drawing & illustration', 'description': 'Drawing and sketching'}}]","{'urls': [{'start': 185, 'end': 208, 'url': 'https://t.co/O1U2GItrXY', 'expanded_url': 'https://twitter.com/q4P4PwJN6zHvFr1/status/1515428245990428672/photo/1', 'display_url': 'pic.twitter.com/O1U2GItrXY', 'media_key': '3_1515428243998113795'}], 'hashtags': [{'start': 75, 'end': 92, 'tag': 'dragonadventures'}, {'start': 93, 'end': 100, 'tag': 'Roblox'}, {'start': 101, 'end': 111, 'tag': 'robloxart'}]}",{'media_keys': ['3_1515428243998113795']},False,,everyone,Twitter for Android
1515428223475191814,1502034810688217089,@Roblox @sonic_hedgehog hmmm a blue tail blue ears shirt blue blue pants sonic but the 3d ones tho,2022-04-16 20:33:38+00:00,,0,0,0,0,en,1515026236241850380,"[{'domain': {'id': '71', 'name': 'Video Game', 'description': 'A video game like Overwatch'}, 'entity': {'id': '1088118927580774400', 'name': 'Roblox', 'description': 'Roblox'}}, {'domain': {'id': '130', 'name': 'Multimedia Franchise', 'description': ""Franchises which span multiple forms of media like 'Harry Potter'""}, 'entity': {'id': '993952643209773057', 'name': 'Sonic the Hedgehog', 'description': 'This entity includes all conversation about the franchise, as well as any individual installments in the series, if applicable.\t\t\t\n\nNOTE: Stopped annotating in the Video Game domain (71) on 11/15/19. Moving forward, this entity will annotate to Multimedia Franchise domain (130) only.'}}]","{'mentions': [{'start': 0, 'end': 7, 'username': 'Roblox', 'id': '16745055'}, {'start': 8, 'end': 23, 'username': 'sonic_hedgehog', 'id': '19609162'}]}",,False,,everyone,Twitter Web App
1515428156508844032,1278359858194952192,"@darlinqcandy @iiNotJoshXD I'm sorry if I made it sound that I thought it was funny about her child seeing her sex tape, because I 100% agree that it's very wrong. I meant as in Roblox was going to be sued because of this.",2022-04-16 20:33:22+00:00,,0,0,1,0,en,1515158718694182913,"[{'domain': {'id': '71', 'name': 'Video Game', 'description': 'A video game like Overwatch'}, 'entity': {'id': '1088118927580774400', 'name': 'Roblox', 'description': 'Roblox'}}]","{'annotations': [{'start': 178, 'end': 183, 'probability': 0.3895, 'type': 'Other', 'normalized_text': 'Roblox'}], 'mentions': [{'start': 0, 'end': 13, 'username': 'darlinqcandy', 'id': '1305165242947731459'}, {'start': 14, 'end': 26, 'username': 'iiNotJoshXD', 'id': '1276313631601291267'}]}",,False,,everyone,Twitter Web App
1515428145481936896,1336482285265145857,this is worse than my roblox royale high rping days .,2022-04-16 20:33:19+00:00,,1,3,8,0,en,1515428145481936896,"[{'domain': {'id': '71', 'name': 'Video Game', 'description': 'A video game like Overwatch'}, 'entity': {'id': '1088118927580774400', 'name': 'Roblox', 'description': 'Roblox'}}, {'domain': {'id': '71', 'name': 'Video Game', 'description': 'A video game like Overwatch'}, 'entity': {'id': '1230882318224510978', 'name': 'Royale High'}}]",,,False,,everyone,Twitter Web App
1515428127702499332,1488208820937629700,@ViktoriyaBond12 @Roblox @primegaming @ROLVeStuff Sameee this happened to me,2022-04-16 20:33:15+00:00,,0,0,0,0,en,1514366060257951751,"[{'domain': {'id': '71', 'name': 'Video Game', 'description': 'A video game like Overwatch'}, 'entity': {'id': '1088118927580774400', 'name': 'Roblox', 'description': 'Roblox'}}]","{'mentions': [{'start': 0, 'end': 16, 'username': 'ViktoriyaBond12', 'id': '1502152861530013706'}, {'start': 17, 'end': 24, 'username': 'Roblox', 'id': '16745055'}, {'start': 25, 'end': 37, 'username': 'primegaming', 'id': '759027320560627712'}, {'start': 38, 'end': 49, 'username': 'ROLVeStuff', 'id': '2995414579'}]}",,False,,everyone,Twitter for iPhone
1515428020630302729,1478103702821130243,c me ocurrio algo &gt;:) https://t.co/nWKNDFH9HP inviten a amikos zi,2022-04-16 20:32:50+00:00,,0,0,0,0,es,1515428020630302729,[],"{'urls': [{'start': 25, 'end': 48, 'url': 'https://t.co/nWKNDFH9HP', 'expanded_url': 'https://web.roblox.com/games/5721826509?privateServerLinkCode=85624960964296718439195487878653', 'display_url': 'web.roblox.com/games/57218265…'}]}",,False,,everyone,Twitter Web App
1515427980788568068,1484333127497510912,"Trading lvl 75+ roblox acc with these rh items
User: depressed_dva
Email linked, providing linked email
Dm offers, lf giftcards https://t.co/g0OE5ZHk6f",2022-04-16 20:32:40+00:00,,1,1,2,1,en,1515427980788568068,"[{'domain': {'id': '71', 'name': 'Video Game', 'description': 'A video game like Overwatch'}, 'entity': {'id': '1088118927580774400', 'name': 'Roblox', 'description': 'Roblox'}}]","{'urls': [{'start': 128, 'end': 151, 'url': 'https://t.co/g0OE5ZHk6f', 'expanded_url': 'https://twitter.com/mob_loves_milk/status/1515427980788568068/video/1', 'display_url': 'pic.twitter.com/g0OE5ZHk6f', 'media_key': '7_1515427924610068481'}]}",{'media_keys': ['7_1515427924610068481']},False,,everyone,Twitter for iPhone
1515427960009879554,1511553239065407489,"For SHINOBI CLASH HIDAN
#Roblox #RobloxDev #ShinobiClash https://t.co/wXgUiwFUlT",2022-04-16 20:32:35+00:00,,5,1,6,0,en,1515427960009879554,"[{'domain': {'id': '71', 'name': 'Video Game', 'description': 'A video game like Overwatch'}, 'entity': {'id': '1088118927580774400', 'name': 'Roblox', 'description': 'Roblox'}}]","{'urls': [{'start': 57, 'end': 80, 'url': 'https://t.co/wXgUiwFUlT', 'expanded_url': 'https://twitter.com/ManaStudios1/status/1515427960009879554/video/1', 'display_url': 'pic.twitter.com/wXgUiwFUlT', 'media_key': '7_1515427821019025408'}], 'hashtags': [{'start': 24, 'end': 31, 'tag': 'Roblox'}, {'start': 32, 'end': 42, 'tag': 'RobloxDev'}, {'start': 43, 'end': 56, 'tag': 'ShinobiClash'}]}",{'media_keys': ['7_1515427821019025408']},False,,everyone,Twitter Web App
1515427935712333825,1498309479959568393,@ribamarnanet devia ter o filme do sonic no roblox,2022-04-16 20:32:29+00:00,,0,0,0,0,it,1515423565713223681,"[{'domain': {'id': '71', 'name': 'Video Game', 'description': 'A video game like Overwatch'}, 'entity': {'id': '1088118927580774400', 'name': 'Roblox', 'description': 'Roblox'}}, {'domain': {'id': '86', 'name': 'Movie', 'description': 'A film like Rogue One: A Star Wars Story'}, 'entity': {'id': '1123217054088097793', 'name': 'Sonic The Hedgehog', 'description': 'Release on February 14, 2019.\nRelease on March 27, 2020 (Japan)'}}, {'domain': {'id': '87', 'name': 'Movie Genre', 'description': 'A movie genre like Action'}, 'entity': {'id': '856976360337661952', 'name': 'Action & adventure films', 'description': 'Action and adventure'}}, {'domain': {'id': '130', 'name': 'Multimedia Franchise', 'description': ""Franchises which span multiple forms of media like 'Harry Potter'""}, 'entity': {'id': '993952643209773057', 'name': 'Sonic the Hedgehog', 'description': 'This entity includes all conversation about the franchise, as well as any individual installments in the series, if applicable.\t\t\t\n\nNOTE: Stopped annotating in the Video Game domain (71) on 11/15/19. Moving forward, this entity will annotate to Multimedia Franchise domain (130) only.'}}]","{'mentions': [{'start': 0, 'end': 13, 'username': 'ribamarnanet', 'id': '1211855985855197185'}]}",,False,,everyone,Twitter for Android
1515427922676527107,1496155982258450440,@KimKardashian KIM I FEEL SO SORRY FOR YOU FOR YOUR CHILD SEEING YOUR SEX TAPE ON ROBLOX,2022-04-16 20:32:26+00:00,,0,0,0,0,en,1515374717443600384,"[{'domain': {'id': '10', 'name': 'Person', 'description': 'Named people in the world like Nelson Mandela'}, 'entity': {'id': '806570121959383040', 'name': 'Kim Kardashian', 'description': 'Kim Kardashian'}}, {'domain': {'id': '58', 'name': 'Entertainment Personality', 'description': 'An entertainment personality in the world, like Anderson Cooper or Miranda Sings'}, 'entity': {'id': '806570121959383040', 'name': 'Kim Kardashian', 'description': 'Kim Kardashian'}}, {'domain': {'id': '71', 'name': 'Video Game', 'description': 'A video game like Overwatch'}, 'entity': {'id': '1088118927580774400', 'name': 'Roblox', 'description': 'Roblox'}}]","{'annotations': [{'start': 15, 'end': 17, 'probability': 0.6059, 'type': 'Person', 'normalized_text': 'KIM'}], 'mentions': [{'start': 0, 'end': 14, 'username': 'KimKardashian', 'id': '25365536'}]}",,False,,everyone,Twitter Web App
1515427916053635085,1507360712942882820,"@ahmila_ Wait are safe links the roblox, allowed for instance?",2022-04-16 20:32:25+00:00,,0,0,0,0,en,1515422760515870722,"[{'domain': {'id': '71', 'name': 'Video Game', 'description': 'A video game like Overwatch'}, 'entity': {'id': '1088118927580774400', 'name': 'Roblox', 'description': 'Roblox'}}]","{'mentions': [{'start': 0, 'end': 8, 'username': 'ahmila_', 'id': '1272233911108743168'}]}",,False,,everyone,Twitter Web App
1515427898504761351,1242209576843456515,"@Gabriel48566263 @iiNotJoshXD That doesn’t change what I said, 12+ people are still children. They’re minors, and if Roblox can’t monitor their own platforms, and doesn’t do much for minor safety. Then they deserve to be sued 100%.",2022-04-16 20:32:20+00:00,,0,0,0,0,en,1515158718694182913,"[{'domain': {'id': '71', 'name': 'Video Game', 'description': 'A video game like Overwatch'}, 'entity': {'id': '1088118927580774400', 'name': 'Roblox', 'description': 'Roblox'}}]","{'annotations': [{'start': 117, 'end': 122, 'probability': 0.4224, 'type': 'Organization', 'normalized_text': 'Roblox'}], 'mentions': [{'start': 0, 'end': 16, 'username': 'Gabriel48566263', 'id': '1247963232616284162'}, {'start': 17, 'end': 29, 'username': 'iiNotJoshXD', 'id': '1276313631601291267'}]}",,False,,everyone,Twitter for iPhone
1515427890703130625,1482257699454681091,"im back from the dead 

#roblox #robloxdesign #robloxart #robloxdesigner #robloxclothing #rtcdesigners https://t.co/bB8kNWUiFl",2022-04-16 20:32:19+00:00,,6,0,33,0,en,1515427890703130625,"[{'domain': {'id': '71', 'name': 'Video Game', 'description': 'A video game like Overwatch'}, 'entity': {'id': '1088118927580774400', 'name': 'Roblox', 'description': 'Roblox'}}]","{'urls': [{'start': 103, 'end': 126, 'url': 'https://t.co/bB8kNWUiFl', 'expanded_url': 'https://twitter.com/qveenity/status/1515427890703130625/photo/1', 'display_url': 'pic.twitter.com/bB8kNWUiFl', 'media_key': '3_1515427566294732802'}], 'hashtags': [{'start': 24, 'end': 31, 'tag': 'roblox'}, {'start': 32, 'end': 45, 'tag': 'robloxdesign'}, {'start': 46, 'end': 56, 'tag': 'robloxart'}, {'start': 57, 'end': 72, 'tag': 'robloxdesigner'}, {'start': 73, 'end': 88, 'tag': 'robloxclothing'}, {'start': 89, 'end': 102, 'tag': 'rtcdesigners'}]}",{'media_keys': ['3_1515427566294732802']},False,,everyone,Twitter Web App
1515427873368121345,1514497781204930565,"Wenas tardes busco mutuals UWU que jueguen:

Heroes of the Storm(hots)
League of Legends(lol)
Valorant(valorantXD) 
Fornite(fornai)
Minecraft(maincraf)
Roblox(cubitos)

Me adapto en cualquier tipo de juego 🧐🧐 y no soy flamer, y huelo a limón.

Sígueme y te sigo uwu",2022-04-16 20:32:14+00:00,,0,0,0,0,es,1515427873368121345,"[{'domain': {'id': '45', 'name': 'Brand Vertical', 'description': 'Top level entities that describe a Brands industry'}, 'entity': {'id': '781974597310615553', 'name': 'Entertainment'}}, {'domain': {'id': '46', 'name': 'Brand Category', 'description': 'Categories within Brand Verticals that narrow down the scope of Brands'}, 'entity': {'id': '781974597218340864', 'name': 'Video Games'}}, {'domain': {'id': '71', 'name': 'Video Game', 'description': 'A video game like Overwatch'}, 'entity': {'id': '10043689888', 'name': 'Minecraft'}}, {'domain': {'id': '71', 'name': 'Video Game', 'description': 'A video game like Overwatch'}, 'entity': {'id': '10047023521', 'name': 'Heroes of the Storm', 'description': 'This entity includes all conversation about the franchise, as well as any individual installments in the series, if applicable.\t\t\t'}}, {'domain': {'id': '71', 'name': 'Video Game', 'description': 'A video game like Overwatch'}, 'entity': {'id': '1088118927580774400', 'name': 'Roblox', 'description': 'Roblox'}}, {'domain': {'id': '71', 'name': 'Video Game', 'description': 'A video game like Overwatch'}, 'entity': {'id': '1234945774347112448', 'name': 'VALORANT'}}, {'domain': {'id': '130', 'name': 'Multimedia Franchise', 'description': ""Franchises which span multiple forms of media like 'Harry Potter'""}, 'entity': {'id': '10047023523', 'name': 'League of Legends', 'description': 'This entity includes all conversation about the entire League of Legends universe.\n\t\nNOTE: Following the release of Arcane, Video Game (domain 71) annotations were halted on 12/3/2021.'}}]",,,False,,everyone,Twitter for Android
1515427872978178049,979326499017953280,"@TerranceHarken Actually my parents didn’t participate on my adventures discovery. Which is one thing I’m never gonna do with my daughters. They are Roblox fans, and I play with them!",2022-04-16 20:32:14+00:00,,0,0,1,0,en,1515414302085333001,"[{'domain': {'id': '71', 'name': 'Video Game', 'description': 'A video game like Overwatch'}, 'entity': {'id': '1088118927580774400', 'name': 'Roblox', 'description': 'Roblox'}}]","{'annotations': [{'start': 149, 'end': 154, 'probability': 0.3262, 'type': 'Product', 'normalized_text': 'Roblox'}], 'mentions': [{'start': 0, 'end': 15, 'username': 'TerranceHarken', 'id': '757396932390117377'}]}",,False,,everyone,Twitter for iPhone
1515427865818324992,1346028743127654400,just had a roblox argument with my roblox husband on who is taking the kids 😔😔😔😔,2022-04-16 20:32:13+00:00,,0,1,1,0,en,1515427865818324992,"[{'domain': {'id': '71', 'name': 'Video Game', 'description': 'A video game like Overwatch'}, 'entity': {'id': '1088118927580774400', 'name': 'Roblox', 'description': 'Roblox'}}]",,,False,,everyone,Twitter Web App
1515427865290022919,1382686519761252357,GABRIEL COMEU MEU OVINDO DO ROBLOX,2022-04-16 20:32:13+00:00,,0,0,0,1,pt,1515427865290022919,"[{'domain': {'id': '71', 'name': 'Video Game', 'description': 'A video game like Overwatch'}, 'entity': {'id': '1088118927580774400', 'name': 'Roblox', 'description': 'Roblox'}}]","{'annotations': [{'start': 0, 'end': 6, 'probability': 0.94, 'type': 'Person', 'normalized_text': 'GABRIEL'}]}",,False,,everyone,Twitter for iPhone
1515427819622481920,1497664388458811395,Sonic speed sim is on the front page of Roblox! #Sonic https://t.co/35afuyVKV4,2022-04-16 20:32:02+00:00,,0,0,1,0,en,1515427819622481920,"[{'domain': {'id': '71', 'name': 'Video Game', 'description': 'A video game like Overwatch'}, 'entity': {'id': '1088118927580774400', 'name': 'Roblox', 'description': 'Roblox'}}]","{'annotations': [{'start': 0, 'end': 14, 'probability': 0.635, 'type': 'Product', 'normalized_text': 'Sonic speed sim'}, {'start': 40, 'end': 45, 'probability': 0.4359, 'type': 'Product', 'normalized_text': 'Roblox'}], 'urls': [{'start': 55, 'end': 78, 'url': 'https://t.co/35afuyVKV4', 'expanded_url': 'https://twitter.com/Neo_sholi/status/1515427819622481920/photo/1', 'display_url': 'pic.twitter.com/35afuyVKV4', 'media_key': '3_1515427814463393796'}], 'hashtags': [{'start': 48, 'end': 54, 'tag': 'Sonic'}]}",{'media_keys': ['3_1515427814463393796']},False,,everyone,Twitter for iPad
1515427804292292620,1480518697445904384,"Small boss arena i made

What do you guys think?

[#Roblox] [#RobloxDev] [#RBXDev] https://t.co/y9KgcczMhR",2022-04-16 20:31:58+00:00,,1,2,5,0,en,1515427804292292620,"[{'domain': {'id': '71', 'name': 'Video Game', 'description': 'A video game like Overwatch'}, 'entity': {'id': '1088118927580774400', 'name': 'Roblox', 'description': 'Roblox'}}]","{'urls': [{'start': 83, 'end': 106, 'url': 'https://t.co/y9KgcczMhR', 'expanded_url': 'https://twitter.com/BerkoaxxRBX/status/1515427804292292620/photo/1', 'display_url': 'pic.twitter.com/y9KgcczMhR', 'media_key': '3_1515426991935217670'}, {'start': 83, 'end': 106, 'url': 'https://t.co/y9KgcczMhR', 'expanded_url': 'https://twitter.com/BerkoaxxRBX/status/1515427804292292620/photo/1', 'display_url': 'pic.twitter.com/y9KgcczMhR', 'media_key': '3_1515427474888396808'}, {'start': 83, 'end': 106, 'url': 'https://t.co/y9KgcczMhR', 'expanded_url': 'https://twitter.com/BerkoaxxRBX/status/1515427804292292620/photo/1', 'display_url': 'pic.twitter.com/y9KgcczMhR', 'media_key': '3_1515427788286746629'}], 'hashtags': [{'start': 51, 'end': 58, 'tag': 'Roblox'}, {'start': 61, 'end': 71, 'tag': 'RobloxDev'}, {'start': 74, 'end': 81, 'tag': 'RBXDev'}]}","{'media_keys': ['3_1515426991935217670', '3_1515427474888396808', '3_1515427788286746629']}",False,,everyone,Twitter Web App
