tweetid,author_id,text,created_at,geo,retweets,replies,likes,quote_count,lang,conversation_id,context_annotations,entities,attachments,possibly_sensitive,withheld,reply_settings,source
1527150662596710400,1367515311587557384,@boshjosh1918 @Roblox @tatemcrae Or they are preventing players from say how bad the event is lol,2022-05-19 04:54:25+00:00,,1,0,2,0,en,1527053902507540482,"[{'domain': {'id': '3', 'name': 'TV Shows', 'description': 'Television shows from around the world'}, 'entity': {'id': '10002702227', 'name': 'So You Think You Can Dance', 'description': ""Contestants compete in various dance styles to become America's best dancer.\n\nPhoto via TMS""}}, {'domain': {'id': '4', 'name': 'TV Episodes', 'description': 'Television show episodes'}, 'entity': {'id': '1522510099276726272', 'name': 'Dance Is Back! Auditions Show 1', 'description': ""Contestants compete in various dance styles to become America's best dancer.\n\nPhoto via TMS""}}, {'domain': {'id': '29', 'name': 'Events [Entity Service]', 'description': 'Entity Service related Events domain'}, 'entity': {'id': '1522510099276726272', 'name': 'Dance Is Back! Auditions Show 1', 'description': ""Contestants compete in various dance styles to become America's best dancer.\n\nPhoto via TMS""}}, {'domain': {'id': '71', 'name': 'Video Game', 'description': 'A video game like Overwatch'}, 'entity': {'id': '1088118927580774400', 'name': 'Roblox', 'description': 'Roblox'}}]","{'mentions': [{'start': 0, 'end': 13, 'username': 'boshjosh1918', 'id': '1454851601194225665'}, {'start': 14, 'end': 21, 'username': 'Roblox', 'id': '16745055'}, {'start': 22, 'end': 32, 'username': 'tatemcrae', 'id': '2293023840'}]}",,False,,everyone,Twitter for iPhone
1527150649963593731,4017297314,that feeling when you summit Everest with one of your besties 🥲 @beaversoup123 #roblox #Everest https://t.co/z7k5OzAsEH,2022-05-19 04:54:22+00:00,,2,1,3,0,en,1527150649963593731,"[{'domain': {'id': '71', 'name': 'Video Game', 'description': 'A video game like Overwatch'}, 'entity': {'id': '1088118927580774400', 'name': 'Roblox', 'description': 'Roblox'}}]","{'hashtags': [{'start': 79, 'end': 86, 'tag': 'roblox'}, {'start': 87, 'end': 95, 'tag': 'Everest'}], 'mentions': [{'start': 64, 'end': 78, 'username': 'beaversoup123', 'id': '2471936035'}], 'urls': [{'start': 96, 'end': 119, 'url': 'https://t.co/z7k5OzAsEH', 'expanded_url': 'https://twitter.com/valhallagames_/status/1527150649963593731/photo/1', 'display_url': 'pic.twitter.com/z7k5OzAsEH', 'media_key': '3_1527150640434143233'}]}",{'media_keys': ['3_1527150640434143233']},False,,everyone,Twitter for iPhone
1527150563799887873,2846106929,amy achieved (ive had way more fun with this roblox game than most actual games) https://t.co/jRUKyf8cR6,2022-05-19 04:54:02+00:00,,0,0,4,0,en,1527150563799887873,"[{'domain': {'id': '71', 'name': 'Video Game', 'description': 'A video game like Overwatch'}, 'entity': {'id': '1088118927580774400', 'name': 'Roblox', 'description': 'Roblox'}}]","{'annotations': [{'start': 0, 'end': 2, 'probability': 0.897, 'type': 'Person', 'normalized_text': 'amy'}], 'urls': [{'start': 81, 'end': 104, 'url': 'https://t.co/jRUKyf8cR6', 'expanded_url': 'https://twitter.com/alexpandab/status/1527150563799887873/photo/1', 'display_url': 'pic.twitter.com/jRUKyf8cR6', 'media_key': '3_1527150341204025344'}]}",{'media_keys': ['3_1527150341204025344']},False,,everyone,Twitter Web App
1527150505150910464,1442686909986136064,@roblox fix this.,2022-05-19 04:53:48+00:00,,1,0,0,0,en,1527150444790677504,"[{'domain': {'id': '71', 'name': 'Video Game', 'description': 'A video game like Overwatch'}, 'entity': {'id': '1088118927580774400', 'name': 'Roblox', 'description': 'Roblox'}}]","{'mentions': [{'start': 0, 'end': 7, 'username': 'Roblox', 'id': '16745055'}]}",,False,,everyone,Twitter for Android
1527150444790677504,1442686909986136064,WHY ARE THE NEW ROBLOX FACES LIEK THIS 😭 IT'S SO SMALL THEY BETTER FIX THIS BEFORE THEY RELEASE THESE 💀 #Roblox #RobloxR34 #RobloxDev #RobloxUGC #TateMcrae #robloxface https://t.co/LBWX01CaGP,2022-05-19 04:53:33+00:00,,4,3,5,0,en,1527150444790677504,"[{'domain': {'id': '71', 'name': 'Video Game', 'description': 'A video game like Overwatch'}, 'entity': {'id': '1088118927580774400', 'name': 'Roblox', 'description': 'Roblox'}}]","{'hashtags': [{'start': 104, 'end': 111, 'tag': 'Roblox'}, {'start': 112, 'end': 122, 'tag': 'RobloxR34'}, {'start': 123, 'end': 133, 'tag': 'RobloxDev'}, {'start': 134, 'end': 144, 'tag': 'RobloxUGC'}, {'start': 145, 'end': 155, 'tag': 'TateMcrae'}, {'start': 156, 'end': 167, 'tag': 'robloxface'}], 'urls': [{'start': 168, 'end': 191, 'url': 'https://t.co/LBWX01CaGP', 'expanded_url': 'https://twitter.com/acer0tic/status/1527150444790677504/photo/1', 'display_url': 'pic.twitter.com/LBWX01CaGP', 'media_key': '3_1527150432421703680'}, {'start': 168, 'end': 191, 'url': 'https://t.co/LBWX01CaGP', 'expanded_url': 'https://twitter.com/acer0tic/status/1527150444790677504/photo/1', 'display_url': 'pic.twitter.com/LBWX01CaGP', 'media_key': '3_1527150437463252992'}, {'start': 168, 'end': 191, 'url': 'https://t.co/LBWX01CaGP', 'expanded_url': 'https://twitter.com/acer0tic/status/1527150444790677504/photo/1', 'display_url': 'pic.twitter.com/LBWX01CaGP', 'media_key': '3_1527150442114785280'}]}","{'media_keys': ['3_1527150432421703680', '3_1527150437463252992', '3_1527150442114785280']}",False,,everyone,Twitter for Android
1527150302712827905,1449693351649767432,"My main account in Roblox got banned for no specific reason, so no content until i get unbanned or I get back to my normal stats on my alt! 
(Please unban my account roblox..)",2022-05-19 04:52:59+00:00,,0,5,0,0,en,1527150302712827905,"[{'domain': {'id': '71', 'name': 'Video Game', 'description': 'A video game like Overwatch'}, 'entity': {'id': '1088118927580774400', 'name': 'Roblox', 'description': 'Roblox'}}]","{'annotations': [{'start': 19, 'end': 24, 'probability': 0.3857, 'type': 'Product', 'normalized_text': 'Roblox'}]}",,False,,everyone,Twitter Web App
1527150285109571592,24252578,Papacito187 played ROBLOX (Xbox One) in the last 24 hours https://t.co/RPGT8z6oER #exophase,2022-05-19 04:52:55+00:00,,0,0,0,0,en,1527150285109571592,"[{'domain': {'id': '71', 'name': 'Video Game', 'description': 'A video game like Overwatch'}, 'entity': {'id': '1088118927580774400', 'name': 'Roblox', 'description': 'Roblox'}}, {'domain': {'id': '79', 'name': 'Video Game Hardware', 'description': 'Video Game Hardware'}, 'entity': {'id': '10027048851', 'name': 'Xbox'}}, {'domain': {'id': '79', 'name': 'Video Game Hardware', 'description': 'Video Game Hardware'}, 'entity': {'id': '1201627082238742528', 'name': 'Xbox One'}}, {'domain': {'id': '45', 'name': 'Brand Vertical', 'description': 'Top level entities that describe a Brands industry'}, 'entity': {'id': '781974597310615553', 'name': 'Entertainment'}}, {'domain': {'id': '46', 'name': 'Brand Category', 'description': 'Categories within Brand Verticals that narrow down the scope of Brands'}, 'entity': {'id': '781974597218340864', 'name': 'Video Games'}}, {'domain': {'id': '47', 'name': 'Brand', 'description': 'Brands and Companies'}, 'entity': {'id': '10027048851', 'name': 'Xbox'}}, {'domain': {'id': '79', 'name': 'Video Game Hardware', 'description': 'Video Game Hardware'}, 'entity': {'id': '10027048851', 'name': 'Xbox'}}]","{'annotations': [{'start': 0, 'end': 10, 'probability': 0.3462, 'type': 'Person', 'normalized_text': 'Papacito187'}, {'start': 19, 'end': 24, 'probability': 0.4223, 'type': 'Product', 'normalized_text': 'ROBLOX'}, {'start': 27, 'end': 34, 'probability': 0.7407, 'type': 'Product', 'normalized_text': 'Xbox One'}], 'hashtags': [{'start': 82, 'end': 91, 'tag': 'exophase'}], 'urls': [{'start': 58, 'end': 81, 'url': 'https://t.co/RPGT8z6oER', 'expanded_url': 'https://www.exophase.com/user/Papacito187/?1652935975', 'display_url': 'exophase.com/user/Papacito1…'}]}",,False,,everyone,Exophase
1527150186518024192,1431196983486783495,@Taymastar please remove my ban i will not cheat again i am roblox my name is enes8745 :(,2022-05-19 04:52:32+00:00,,0,1,0,0,en,1527150186518024192,"[{'domain': {'id': '71', 'name': 'Video Game', 'description': 'A video game like Overwatch'}, 'entity': {'id': '1088118927580774400', 'name': 'Roblox', 'description': 'Roblox'}}]","{'mentions': [{'start': 0, 'end': 10, 'username': 'Taymastar', 'id': '1468999908'}]}",,False,,everyone,Twitter Web App
1527150146055639040,1422247269630287893,@Roblox @tatemcrae why are you creating people in an underground lab,2022-05-19 04:52:22+00:00,,1,0,0,0,en,1527053902507540482,"[{'domain': {'id': '3', 'name': 'TV Shows', 'description': 'Television shows from around the world'}, 'entity': {'id': '10002702227', 'name': 'So You Think You Can Dance', 'description': ""Contestants compete in various dance styles to become America's best dancer.\n\nPhoto via TMS""}}, {'domain': {'id': '4', 'name': 'TV Episodes', 'description': 'Television show episodes'}, 'entity': {'id': '1522510099276726272', 'name': 'Dance Is Back! Auditions Show 1', 'description': ""Contestants compete in various dance styles to become America's best dancer.\n\nPhoto via TMS""}}, {'domain': {'id': '29', 'name': 'Events [Entity Service]', 'description': 'Entity Service related Events domain'}, 'entity': {'id': '1522510099276726272', 'name': 'Dance Is Back! Auditions Show 1', 'description': ""Contestants compete in various dance styles to become America's best dancer.\n\nPhoto via TMS""}}, {'domain': {'id': '71', 'name': 'Video Game', 'description': 'A video game like Overwatch'}, 'entity': {'id': '1088118927580774400', 'name': 'Roblox', 'description': 'Roblox'}}]","{'mentions': [{'start': 0, 'end': 7, 'username': 'Roblox', 'id': '16745055'}, {'start': 8, 'end': 18, 'username': 'tatemcrae', 'id': '2293023840'}]}",,False,,everyone,Twitter Web App
1527150106994167808,1452621869501321219,@Ninja50Fan full of shit and terrible moderating to the point where the only part of it i like are the roleplay and story games and not roblox itself (or the rest because i’m shit at them),2022-05-19 04:52:13+00:00,,0,0,0,0,en,1526860817832022016,"[{'domain': {'id': '71', 'name': 'Video Game', 'description': 'A video game like Overwatch'}, 'entity': {'id': '1088118927580774400', 'name': 'Roblox', 'description': 'Roblox'}}]","{'mentions': [{'start': 0, 'end': 11, 'username': 'Ninja50Fan', 'id': '1134447600902529024'}]}",,False,,everyone,Twitter for iPad
1527150100522344455,1290340613242724353,"В метавселенной Samsung Superstar Galaxy на платформе Roblox можно выступить на одной сцене с Charli XCX
https://t.co/2RMREjOF04 https://t.co/6sEykHu07Y",2022-05-19 04:52:11+00:00,,0,0,0,0,und,1527150100522344455,"[{'domain': {'id': '47', 'name': 'Brand', 'description': 'Brands and Companies'}, 'entity': {'id': '1174344555111469057', 'name': 'Samsung Indonesia'}}, {'domain': {'id': '71', 'name': 'Video Game', 'description': 'A video game like Overwatch'}, 'entity': {'id': '1088118927580774400', 'name': 'Roblox', 'description': 'Roblox'}}, {'domain': {'id': '10', 'name': 'Person', 'description': 'Named people in the world like Nelson Mandela'}, 'entity': {'id': '885602209618051072', 'name': 'Charli XCX', 'description': 'CHARLI XCX'}}, {'domain': {'id': '47', 'name': 'Brand', 'description': 'Brands and Companies'}, 'entity': {'id': '10026364234', 'name': 'Samsung '}}, {'domain': {'id': '48', 'name': 'Product', 'description': 'Products created by Brands.  Examples: Ford Explorer, Apple iPhone.'}, 'entity': {'id': '10026230384', 'name': 'Samsung Galaxy'}}, {'domain': {'id': '48', 'name': 'Product', 'description': 'Products created by Brands.  Examples: Ford Explorer, Apple iPhone.'}, 'entity': {'id': '10026331316', 'name': 'Samsung Mobile'}}, {'domain': {'id': '48', 'name': 'Product', 'description': 'Products created by Brands.  Examples: Ford Explorer, Apple iPhone.'}, 'entity': {'id': '10045298641', 'name': 'Samsung USA'}}, {'domain': {'id': '49', 'name': 'Product Version', 'description': ""The specific model or version of a product.  Examples: Audi A8, Ben & Jerry's Chocolate Chip Ice Cream""}, 'entity': {'id': '10040464729', 'name': 'Samsung Mobile UK'}}, {'domain': {'id': '49', 'name': 'Product Version', 'description': ""The specific model or version of a product.  Examples: Audi A8, Ben & Jerry's Chocolate Chip Ice Cream""}, 'entity': {'id': '10041364617', 'name': 'Samsung Mobile US'}}, {'domain': {'id': '54', 'name': 'Musician', 'description': 'A musician in the world, like Adele or Bob Dylan'}, 'entity': {'id': '885602209618051072', 'name': 'Charli XCX', 'description': 'CHARLI XCX'}}, {'domain': {'id': '55', 'name': 'Music Genre', 'description': 'A category for a musical style, like Pop, Rock, or Rap'}, 'entity': {'id': '810938279801470977', 'name': 'Pop', 'description': 'Pop'}}, {'domain': {'id': '30', 'name': 'Entities [Entity Service]', 'description': 'Entity Service top level domain, every item that is in Entity Service should be in this domain'}, 'entity': {'id': '848920371311001600', 'name': 'Technology', 'description': 'Technology and computing'}}, {'domain': {'id': '66', 'name': 'Interests and Hobbies Category', 'description': 'A grouping of interests and hobbies entities, like Novelty Food or Destinations'}, 'entity': {'id': '848920700073123840', 'name': 'Cell Phones', 'description': 'Cell phones'}}, {'domain': {'id': '30', 'name': 'Entities [Entity Service]', 'description': 'Entity Service top level domain, every item that is in Entity Service should be in this domain'}, 'entity': {'id': '848985956778561538', 'name': 'Mobile', 'description': 'Mobile'}}]","{'urls': [{'start': 105, 'end': 128, 'url': 'https://t.co/2RMREjOF04', 'expanded_url': 'https://7ooo.ru/group/2022/05/19/931-v-metavselennoy-samsung-superstar-galaxy-na-platforme-roblox-mozhno-vystupit-na-odnoy-scene-s-charli-xcx-grss-108746945.html', 'display_url': '7ooo.ru/group/2022/05/…', 'status': 200, 'title': 'В метавселенной Samsung Superstar Galaxy на платформе Roblox можно выступить на одной сцене с Charli XCX', 'description': 'Хорошие новости для всех поклонников интергалактической поп-музыки! Samsung Superstar Galaxy, созданная на платформе Roblox, представляет уникальную метавселенную с участием певицы Charli XC', 'unwound_url': 'https://7ooo.ru/group/2022/05/19/931-v-metavselennoy-samsung-superstar-galaxy-na-platforme-roblox-mozhno-vystupit-na-odnoy-scene-s-charli-xcx-grss-108746945.html'}, {'start': 129, 'end': 152, 'url': 'https://t.co/6sEykHu07Y', 'expanded_url': 'https://twitter.com/7ooo_ru/status/1527150100522344455/photo/1', 'display_url': 'pic.twitter.com/6sEykHu07Y', 'media_key': '3_1527150096881696768'}]}",{'media_keys': ['3_1527150096881696768']},False,,everyone,SEOLIT Publisher
1527150092729188353,1504272475227664387,Weenie Boy is playing Roblox https://t.co/wMSiMEiyDR,2022-05-19 04:52:09+00:00,,0,0,0,0,en,1527150092729188353,"[{'domain': {'id': '71', 'name': 'Video Game', 'description': 'A video game like Overwatch'}, 'entity': {'id': '1088118927580774400', 'name': 'Roblox', 'description': 'Roblox'}}]","{'annotations': [{'start': 22, 'end': 27, 'probability': 0.3794, 'type': 'Product', 'normalized_text': 'Roblox'}], 'urls': [{'start': 29, 'end': 52, 'url': 'https://t.co/wMSiMEiyDR', 'expanded_url': 'https://twitter.com/StuffBotlmao/status/1527150092729188353/photo/1', 'display_url': 'pic.twitter.com/wMSiMEiyDR', 'media_key': '3_1527150090799878145'}, {'start': 29, 'end': 52, 'url': 'https://t.co/wMSiMEiyDR', 'expanded_url': 'https://twitter.com/StuffBotlmao/status/1527150092729188353/photo/1', 'display_url': 'pic.twitter.com/wMSiMEiyDR', 'media_key': '3_1527150090762145792'}]}","{'media_keys': ['3_1527150090799878145', '3_1527150090762145792']}",False,,everyone,"Cheap Bots, Done Quick!"
1527150077176782848,349937583,@xcatsvgz @Minecraft I keep seeing scandal videos on Youtube about Roblox using child labor &amp; promoting gambling to children.,2022-05-19 04:52:06+00:00,,0,0,1,0,en,1519693236670935041,"[{'domain': {'id': '45', 'name': 'Brand Vertical', 'description': 'Top level entities that describe a Brands industry'}, 'entity': {'id': '781974597310615553', 'name': 'Entertainment'}}, {'domain': {'id': '46', 'name': 'Brand Category', 'description': 'Categories within Brand Verticals that narrow down the scope of Brands'}, 'entity': {'id': '781974597218340864', 'name': 'Video Games'}}, {'domain': {'id': '71', 'name': 'Video Game', 'description': 'A video game like Overwatch'}, 'entity': {'id': '10043689888', 'name': 'Minecraft'}}, {'domain': {'id': '71', 'name': 'Video Game', 'description': 'A video game like Overwatch'}, 'entity': {'id': '1088118927580774400', 'name': 'Roblox', 'description': 'Roblox'}}, {'domain': {'id': '165', 'name': 'Technology', 'description': 'for individual and types of technology, e.g., food technology, 3D printing'}, 'entity': {'id': '1196446161223028736', 'name': 'Social media'}}, {'domain': {'id': '46', 'name': 'Brand Category', 'description': 'Categories within Brand Verticals that narrow down the scope of Brands'}, 'entity': {'id': '781974596752842752', 'name': 'Services'}}, {'domain': {'id': '47', 'name': 'Brand', 'description': 'Brands and Companies'}, 'entity': {'id': '10029382357', 'name': 'YouTube'}}, {'domain': {'id': '66', 'name': 'Interests and Hobbies Category', 'description': 'A grouping of interests and hobbies entities, like Novelty Food or Destinations'}, 'entity': {'id': '847869481888096256', 'name': 'Gambling'}}]","{'annotations': [{'start': 53, 'end': 59, 'probability': 0.6081, 'type': 'Organization', 'normalized_text': 'Youtube'}, {'start': 67, 'end': 72, 'probability': 0.4745, 'type': 'Product', 'normalized_text': 'Roblox'}], 'mentions': [{'start': 0, 'end': 9, 'username': 'xcatsvgz', 'id': '1372641673575075842'}, {'start': 10, 'end': 20, 'username': 'Minecraft', 'id': '64565898'}]}",,False,,everyone,Twitter Web App
1527149992116224000,1107400987377950720,Love the white adrenaline on roblox today 😍. @Roblox https://t.co/EdPmHlkogp,2022-05-19 04:51:45+00:00,,1,1,2,0,en,1527149992116224000,"[{'domain': {'id': '71', 'name': 'Video Game', 'description': 'A video game like Overwatch'}, 'entity': {'id': '1088118927580774400', 'name': 'Roblox', 'description': 'Roblox'}}]","{'mentions': [{'start': 45, 'end': 52, 'username': 'Roblox', 'id': '16745055'}], 'urls': [{'start': 53, 'end': 76, 'url': 'https://t.co/EdPmHlkogp', 'expanded_url': 'https://twitter.com/l3milyl/status/1527149992116224000/photo/1', 'display_url': 'pic.twitter.com/EdPmHlkogp', 'media_key': '3_1527149989171933184'}, {'start': 53, 'end': 76, 'url': 'https://t.co/EdPmHlkogp', 'expanded_url': 'https://twitter.com/l3milyl/status/1527149992116224000/photo/1', 'display_url': 'pic.twitter.com/EdPmHlkogp', 'media_key': '3_1527149989377454081'}]}","{'media_keys': ['3_1527149989171933184', '3_1527149989377454081']}",False,,everyone,Twitter for iPhone
1527149954858647552,1312317411949830144,@plebcy Roblox,2022-05-19 04:51:36+00:00,,0,0,0,0,en,1527071765423439873,"[{'domain': {'id': '71', 'name': 'Video Game', 'description': 'A video game like Overwatch'}, 'entity': {'id': '1088118927580774400', 'name': 'Roblox', 'description': 'Roblox'}}]","{'mentions': [{'start': 0, 'end': 7, 'username': 'plebcy', 'id': '1280632147343216641'}]}",,False,,everyone,Twitter Web App
1527149935002624000,1526043284916797440,"famosos polemicas como doxxear pou carrd calidad fc fcs cómo hacer carrd views vistas hashtags au abro hilo thread cancelado fancam exponiendo voy a exponer copys turbios hots tutorial carrd abro hilo canva gratis carrd pro gratis roblox robux minions
https://t.co/UJ2GlgETf4",2022-05-19 04:51:32+00:00,,0,0,0,0,es,1527149935002624000,"[{'domain': {'id': '71', 'name': 'Video Game', 'description': 'A video game like Overwatch'}, 'entity': {'id': '1088118927580774400', 'name': 'Roblox', 'description': 'Roblox'}}]","{'urls': [{'start': 252, 'end': 275, 'url': 'https://t.co/UJ2GlgETf4', 'expanded_url': 'https://twitter.com/dollzikes/status/1527145763008139264/video/1', 'display_url': 'pic.twitter.com/UJ2GlgETf4', 'media_key': '7_1527145692938088450'}]}",{'media_keys': ['7_1527145692938088450']},False,,everyone,Twitter for iPhone
1527149882607296514,739209038504824832,I'm addicted to gambling at the Roblox Casino! https://t.co/FXn1D0YALy,2022-05-19 04:51:19+00:00,,1,7,3,0,en,1527149882607296514,"[{'domain': {'id': '71', 'name': 'Video Game', 'description': 'A video game like Overwatch'}, 'entity': {'id': '1088118927580774400', 'name': 'Roblox', 'description': 'Roblox'}}, {'domain': {'id': '66', 'name': 'Interests and Hobbies Category', 'description': 'A grouping of interests and hobbies entities, like Novelty Food or Destinations'}, 'entity': {'id': '847869481888096256', 'name': 'Gambling'}}]","{'annotations': [{'start': 32, 'end': 44, 'probability': 0.4335, 'type': 'Organization', 'normalized_text': 'Roblox Casino'}], 'urls': [{'start': 47, 'end': 70, 'url': 'https://t.co/FXn1D0YALy', 'expanded_url': 'https://twitter.com/JuicyJohnXX/status/1527149882607296514/photo/1', 'display_url': 'pic.twitter.com/FXn1D0YALy', 'media_key': '3_1527149796687065093'}]}",{'media_keys': ['3_1527149796687065093']},False,,everyone,Twitter Web App
1527149657578782722,1297565408883613697,@vsxgi_ @ARGGENT3 https://t.co/TOCyL92nPV,2022-05-19 04:50:26+00:00,,0,0,0,0,qme,1476810893350506496,[],"{'mentions': [{'start': 0, 'end': 7, 'username': 'vsxgi_', 'id': '1415934677978861569'}, {'start': 8, 'end': 17, 'username': 'ARGGENT3', 'id': '1217113169509830656'}], 'urls': [{'start': 18, 'end': 41, 'url': 'https://t.co/TOCyL92nPV', 'expanded_url': 'https://www.roblox.com/games/2746687316/Games-Unite-Testing-Place', 'display_url': 'roblox.com/games/27466873…', 'images': [{'url': 'https://pbs.twimg.com/news_img/1540027235515609088/JCm5x7Ij?format=jpg&name=orig', 'width': 498, 'height': 280}, {'url': 'https://pbs.twimg.com/news_img/1540027235515609088/JCm5x7Ij?format=jpg&name=150x150', 'width': 150, 'height': 150}], 'status': 200, 'title': 'Games Unite Testing Place', 'description': 'Check out Games Unite Testing Place . It’s one of the millions of unique, user-generated 3D experiences created on Roblox. !!SHUTDOWN = UPDATE!! Welcome back! The Games Unite Testing Place has officially reopened, version 2.0! This game is still heavily in-development, so please be patient with the content and any potential bugs you might encounter. We intend to continually update this place until it evolves into a full release, but for now, please enjoy testing our framework!', 'unwound_url': 'https://www.roblox.com/games/2746687316/Games-Unite-Testing-Place'}]}",,False,,everyone,Twitter Web App
1527149612661891072,1342912834296954880,@mqx634 @Mrbravegame @Roblox_RTC https://t.co/B2bGOolbKV,2022-05-19 04:50:15+00:00,,0,0,0,0,qme,1524909775644917761,[],"{'mentions': [{'start': 0, 'end': 7, 'username': 'mqx634', 'id': '1520988576325939200'}, {'start': 8, 'end': 20, 'username': 'Mrbravegame', 'id': '1333341130977644547'}, {'start': 21, 'end': 32, 'username': 'Roblox_RTC', 'id': '1056053249470541824'}], 'urls': [{'start': 33, 'end': 56, 'url': 'https://t.co/B2bGOolbKV', 'expanded_url': 'https://twitter.com/Waffles40613416/status/1527149612661891072/photo/1', 'display_url': 'pic.twitter.com/B2bGOolbKV', 'media_key': '16_1527149601966370817'}]}",{'media_keys': ['16_1527149601966370817']},False,,everyone,Twitter for iPhone
1527149545733226496,1258609892673253377,@vryclname @Zachdoe12357 @Roblox @tatemcrae i have my emailed verified but never received the code. i was logged out of my account and i logged back in and they put parental controls on and took all my robux. no one said that i’m not in my account. they’ve also changed my display name.,2022-05-19 04:49:59+00:00,,1,0,0,0,en,1527053902507540482,"[{'domain': {'id': '3', 'name': 'TV Shows', 'description': 'Television shows from around the world'}, 'entity': {'id': '10002702227', 'name': 'So You Think You Can Dance', 'description': ""Contestants compete in various dance styles to become America's best dancer.\n\nPhoto via TMS""}}, {'domain': {'id': '4', 'name': 'TV Episodes', 'description': 'Television show episodes'}, 'entity': {'id': '1522510099276726272', 'name': 'Dance Is Back! Auditions Show 1', 'description': ""Contestants compete in various dance styles to become America's best dancer.\n\nPhoto via TMS""}}, {'domain': {'id': '29', 'name': 'Events [Entity Service]', 'description': 'Entity Service related Events domain'}, 'entity': {'id': '1522510099276726272', 'name': 'Dance Is Back! Auditions Show 1', 'description': ""Contestants compete in various dance styles to become America's best dancer.\n\nPhoto via TMS""}}, {'domain': {'id': '71', 'name': 'Video Game', 'description': 'A video game like Overwatch'}, 'entity': {'id': '1088118927580774400', 'name': 'Roblox', 'description': 'Roblox'}}]","{'mentions': [{'start': 0, 'end': 10, 'username': 'vryclname', 'id': '1516752396168269824'}, {'start': 11, 'end': 24, 'username': 'Zachdoe12357', 'id': '1520074466721771520'}, {'start': 25, 'end': 32, 'username': 'Roblox', 'id': '16745055'}, {'start': 33, 'end': 43, 'username': 'tatemcrae', 'id': '2293023840'}]}",,False,,everyone,Twitter for iPhone
