tweetid,author_id,text,created_at,geo,retweets,replies,likes,quote_count,lang,conversation_id,context_annotations,entities,attachments,possibly_sensitive,withheld,reply_settings,source
1521603943238930432,1506433030763724803,es el gato q tengo en roblox https://t.co/B9msOWPxZA,2022-05-03 21:33:44+00:00,,0,0,0,0,es,1521603943238930432,"[{'domain': {'id': '71', 'name': 'Video Game', 'description': 'A video game like Overwatch'}, 'entity': {'id': '1088118927580774400', 'name': 'Roblox', 'description': 'Roblox'}}]","{'urls': [{'start': 29, 'end': 52, 'url': 'https://t.co/B9msOWPxZA', 'expanded_url': 'https://twitter.com/mischiefanimals/status/1521278365012946944', 'display_url': 'twitter.com/mischiefanimal…'}]}",,False,,everyone,Twitter for iPad
1521603930161303552,1398007406290944002,me voy a hacer otra cuenta d roblox xq no megudta mi user en el ke tengo,2022-05-03 21:33:41+00:00,,0,0,0,1,es,1521603930161303552,"[{'domain': {'id': '29', 'name': 'Events [Entity Service]', 'description': 'Entity Service related Events domain'}, 'entity': {'id': '1517623051860414465', 'name': 'World Environment Day'}}, {'domain': {'id': '71', 'name': 'Video Game', 'description': 'A video game like Overwatch'}, 'entity': {'id': '1088118927580774400', 'name': 'Roblox', 'description': 'Roblox'}}]",,,False,,everyone,Twitter for Android
1521603887244845056,1352684752910888961,"si es q alguien llegara a leer wsto qn para jugar roblox, pasen user 😢",2022-05-03 21:33:31+00:00,,0,2,0,0,es,1521603887244845056,"[{'domain': {'id': '71', 'name': 'Video Game', 'description': 'A video game like Overwatch'}, 'entity': {'id': '1088118927580774400', 'name': 'Roblox', 'description': 'Roblox'}}]",,,False,,everyone,Twitter for Android
1521603883155480576,979479924816924678,mi tl está dividido en SKZ ROBLOX OMGJDOCJSIF y jaja que es un roblox,2022-05-03 21:33:30+00:00,,0,1,4,0,es,1521603883155480576,"[{'domain': {'id': '71', 'name': 'Video Game', 'description': 'A video game like Overwatch'}, 'entity': {'id': '1088118927580774400', 'name': 'Roblox', 'description': 'Roblox'}}]","{'annotations': [{'start': 23, 'end': 44, 'probability': 0.2871, 'type': 'Other', 'normalized_text': 'SKZ ROBLOX OMGJDOCJSIF'}]}",,False,,everyone,Twitter for Android
1521603848351084546,1238260298802438146,Solo están disponible esos juegos en mi grupo de roblox llamado Zeobloxx no habrán más juegos asta que pille el repuesto para el laptop que la batería esté muerta https://t.co/8qucY07QBv,2022-05-03 21:33:22+00:00,,0,0,0,0,es,1521601955428114432,"[{'domain': {'id': '71', 'name': 'Video Game', 'description': 'A video game like Overwatch'}, 'entity': {'id': '1088118927580774400', 'name': 'Roblox', 'description': 'Roblox'}}]","{'annotations': [{'start': 64, 'end': 71, 'probability': 0.2814, 'type': 'Person', 'normalized_text': 'Zeobloxx'}], 'urls': [{'start': 163, 'end': 186, 'url': 'https://t.co/8qucY07QBv', 'expanded_url': 'https://twitter.com/Mr_darkkkkk/status/1521603848351084546/photo/1', 'display_url': 'pic.twitter.com/8qucY07QBv', 'media_key': '3_1521603845461262336'}]}",{'media_keys': ['3_1521603845461262336']},False,,everyone,Twitter for Android
1521603821482389505,1489315219214065670,ME IMPRESIONA LA CANTIDAD DE MUTIS QUE NO HAN JUGADO ROBLOX...,2022-05-03 21:33:15+00:00,,0,6,6,1,es,1521603821482389505,"[{'domain': {'id': '71', 'name': 'Video Game', 'description': 'A video game like Overwatch'}, 'entity': {'id': '1088118927580774400', 'name': 'Roblox', 'description': 'Roblox'}}]",,,False,,everyone,Twitter for Android
1521603817468579854,1457454755190562825,@Roblox_RTC_BR @LeaksEvents @CarBluGStudio vc esta bem me aparece que vc esta bem estressado...,2022-05-03 21:33:14+00:00,,0,1,0,0,pt,1521602586801061889,[],"{'mentions': [{'start': 0, 'end': 14, 'username': 'Roblox_RTC_BR', 'id': '1417587809502826500'}, {'start': 15, 'end': 27, 'username': 'LeaksEvents', 'id': '1422163374339727363'}, {'start': 28, 'end': 42, 'username': 'CarBluGStudio', 'id': '1373009745926307842'}]}",,False,,everyone,Twitter for Android
1521603790272671749,1404914580380340229,"@WoizYT @Roblox @robloxdevrel i think its because its kinda like pet simulator x!, where u collect coins with pets, pet images and robux egg!, but im not to sure, my brother made a fan version of pet sim x but wasnt pet sim x copy, and his got deleted for it!",2022-05-03 21:33:08+00:00,,0,2,33,0,en,1521472403116806146,"[{'domain': {'id': '71', 'name': 'Video Game', 'description': 'A video game like Overwatch'}, 'entity': {'id': '1088118927580774400', 'name': 'Roblox', 'description': 'Roblox'}}]","{'mentions': [{'start': 0, 'end': 7, 'username': 'WoizYT', 'id': '1074000530123472897'}, {'start': 8, 'end': 15, 'username': 'Roblox', 'id': '16745055'}, {'start': 16, 'end': 29, 'username': 'robloxdevrel', 'id': '856650515874172928'}]}",,False,,everyone,Twitter Web App
1521603765886935041,1469345111548960768,Qn para jugar roblox? https://t.co/aEUM1K2i3c,2022-05-03 21:33:02+00:00,,0,0,1,0,it,1521603765886935041,"[{'domain': {'id': '71', 'name': 'Video Game', 'description': 'A video game like Overwatch'}, 'entity': {'id': '1088118927580774400', 'name': 'Roblox', 'description': 'Roblox'}}]","{'urls': [{'start': 22, 'end': 45, 'url': 'https://t.co/aEUM1K2i3c', 'expanded_url': 'https://twitter.com/bchanshoodie/status/1521603765886935041/photo/1', 'display_url': 'pic.twitter.com/aEUM1K2i3c', 'media_key': '3_1521603763299041282'}]}",{'media_keys': ['3_1521603763299041282']},False,,everyone,Twitter for Android
1521603758823682048,1490234051172524042,SKZ COLABORACION CON ROBLOX TOMENLA ANTIS ROBLOKSIANOS ME LA OUEDEN CHUPAR,2022-05-03 21:33:00+00:00,,11,0,15,0,ca,1521603758823682048,"[{'domain': {'id': '71', 'name': 'Video Game', 'description': 'A video game like Overwatch'}, 'entity': {'id': '1088118927580774400', 'name': 'Roblox', 'description': 'Roblox'}}]",,,False,,everyone,Twitter for Android
1521603742445015050,1263012310332903425,a hard reset is the only way for me to truly begin my summer glow up *roblox death sound*,2022-05-03 21:32:56+00:00,,0,0,0,0,en,1521603742445015050,"[{'domain': {'id': '71', 'name': 'Video Game', 'description': 'A video game like Overwatch'}, 'entity': {'id': '1088118927580774400', 'name': 'Roblox', 'description': 'Roblox'}}]",,,False,,everyone,Twitter for iPhone
1521603725139361793,1442386115349004290,"Normal day in Roblox 😃

#killme #fly #baddie #emobaddie #Roblox #HelloKitty #normalhumanbeing #Float https://t.co/DdmCRwYq4b",2022-05-03 21:32:52+00:00,,0,1,3,0,en,1521603725139361793,"[{'domain': {'id': '10', 'name': 'Person', 'description': 'Named people in the world like Nelson Mandela'}, 'entity': {'id': '1443277565393719296', 'name': 'Hello Kitty'}}, {'domain': {'id': '47', 'name': 'Brand', 'description': 'Brands and Companies'}, 'entity': {'id': '1443277565393719296', 'name': 'Hello Kitty'}}, {'domain': {'id': '71', 'name': 'Video Game', 'description': 'A video game like Overwatch'}, 'entity': {'id': '1088118927580774400', 'name': 'Roblox', 'description': 'Roblox'}}, {'domain': {'id': '122', 'name': 'Fictional Character', 'description': 'A person or other being in a narrative work of art, like Tom Sawyer or Jon Snow'}, 'entity': {'id': '1443277565393719296', 'name': 'Hello Kitty'}}]","{'annotations': [{'start': 14, 'end': 19, 'probability': 0.2826, 'type': 'Product', 'normalized_text': 'Roblox'}], 'urls': [{'start': 101, 'end': 124, 'url': 'https://t.co/DdmCRwYq4b', 'expanded_url': 'https://twitter.com/1Candy__Canez1/status/1521603725139361793/video/1', 'display_url': 'pic.twitter.com/DdmCRwYq4b', 'media_key': '7_1521603683942817802'}], 'hashtags': [{'start': 24, 'end': 31, 'tag': 'killme'}, {'start': 32, 'end': 36, 'tag': 'fly'}, {'start': 37, 'end': 44, 'tag': 'baddie'}, {'start': 45, 'end': 55, 'tag': 'emobaddie'}, {'start': 56, 'end': 63, 'tag': 'Roblox'}, {'start': 64, 'end': 75, 'tag': 'HelloKitty'}, {'start': 76, 'end': 93, 'tag': 'normalhumanbeing'}, {'start': 94, 'end': 100, 'tag': 'Float'}]}",{'media_keys': ['7_1521603683942817802']},False,,everyone,Twitter for Android
1521603714989051905,1302467941921943557,"@BANANAAAAAAAASS @tooboredasf Wdym 
My Roblox avatar?",2022-05-03 21:32:50+00:00,,0,1,1,0,pl,1521131399192981504,"[{'domain': {'id': '71', 'name': 'Video Game', 'description': 'A video game like Overwatch'}, 'entity': {'id': '1088118927580774400', 'name': 'Roblox', 'description': 'Roblox'}}]","{'mentions': [{'start': 0, 'end': 16, 'username': 'BANANAAAAAAAASS', 'id': '1474911584124293125'}, {'start': 17, 'end': 29, 'username': 'tooboredasf', 'id': '1381982031383515144'}]}",,False,,everyone,Twitter for iPhone
1521603706168377344,1111279607972618240,"@ErnestoAB2022 Acá tenemos el Toca Life, el Minecraft, el Slime Ranch, el Minecraft Warrior y otros. El Roblox me han dicho q tiene q leer xa entender, asi q lo hemos pospuesto.
Los q me ha hecho gastar son los mas grandes, con el Fortnite y el Dead By Daylight y los packs de esto y aquello 🙄",2022-05-03 21:32:48+00:00,,0,1,2,0,es,1521599740902723584,"[{'domain': {'id': '45', 'name': 'Brand Vertical', 'description': 'Top level entities that describe a Brands industry'}, 'entity': {'id': '781974597310615553', 'name': 'Entertainment'}}, {'domain': {'id': '46', 'name': 'Brand Category', 'description': 'Categories within Brand Verticals that narrow down the scope of Brands'}, 'entity': {'id': '781974597218340864', 'name': 'Video Games'}}, {'domain': {'id': '71', 'name': 'Video Game', 'description': 'A video game like Overwatch'}, 'entity': {'id': '10043689888', 'name': 'Minecraft'}}, {'domain': {'id': '71', 'name': 'Video Game', 'description': 'A video game like Overwatch'}, 'entity': {'id': '974285387987169280', 'name': 'Fortnite', 'description': 'This entity includes all conversation about the franchise, as well as any individual installments in the series, if applicable.\t\t\t'}}, {'domain': {'id': '71', 'name': 'Video Game', 'description': 'A video game like Overwatch'}, 'entity': {'id': '1088118927580774400', 'name': 'Roblox', 'description': 'Roblox'}}, {'domain': {'id': '71', 'name': 'Video Game', 'description': 'A video game like Overwatch'}, 'entity': {'id': '1234625911128936448', 'name': 'Dead by Daylight'}}]","{'annotations': [{'start': 30, 'end': 38, 'probability': 0.9198, 'type': 'Other', 'normalized_text': 'Toca Life'}, {'start': 44, 'end': 52, 'probability': 0.4356, 'type': 'Other', 'normalized_text': 'Minecraft'}, {'start': 58, 'end': 68, 'probability': 0.8979, 'type': 'Other', 'normalized_text': 'Slime Ranch'}, {'start': 74, 'end': 90, 'probability': 0.573, 'type': 'Other', 'normalized_text': 'Minecraft Warrior'}, {'start': 231, 'end': 238, 'probability': 0.2945, 'type': 'Other', 'normalized_text': 'Fortnite'}, {'start': 245, 'end': 260, 'probability': 0.8915, 'type': 'Other', 'normalized_text': 'Dead By Daylight'}], 'mentions': [{'start': 0, 'end': 14, 'username': 'ErnestoAB2022', 'id': '989885427803926529'}]}",,False,,everyone,Twitter for Android
1521603705421893633,1407070978014842882,@Roblox GOD DAMN JUST BRING BACK RAISE A FLOPPA #FreeFloppa,2022-05-03 21:32:48+00:00,,0,0,0,0,en,1521603705421893633,"[{'domain': {'id': '71', 'name': 'Video Game', 'description': 'A video game like Overwatch'}, 'entity': {'id': '1088118927580774400', 'name': 'Roblox', 'description': 'Roblox'}}]","{'annotations': [{'start': 8, 'end': 10, 'probability': 0.5555, 'type': 'Other', 'normalized_text': 'GOD'}], 'mentions': [{'start': 0, 'end': 7, 'username': 'Roblox', 'id': '16745055'}], 'hashtags': [{'start': 48, 'end': 59, 'tag': 'FreeFloppa'}]}",,False,,everyone,Twitter Web App
1521603700795531266,1021606741891592192,since when have i ever even edited roblox tho wtf,2022-05-03 21:32:46+00:00,,0,0,0,0,en,1521603618461437953,"[{'domain': {'id': '71', 'name': 'Video Game', 'description': 'A video game like Overwatch'}, 'entity': {'id': '1088118927580774400', 'name': 'Roblox', 'description': 'Roblox'}}]",,,False,,everyone,Twitter Web App
1521603696102187014,1118475139321094144,@bam_gamestudio I'm trying 🤣 but yeah. It's not just about the tiger. When you save tigers you save a whole ecosystem. And when you save a whole ecosystem you save the villagers inhabiting that ecosystem too... It's a game for kids on Roblox https://t.co/aLYS61nQhC,2022-05-03 21:32:45+00:00,,0,0,1,0,en,1521454523230801920,"[{'domain': {'id': '71', 'name': 'Video Game', 'description': 'A video game like Overwatch'}, 'entity': {'id': '1088118927580774400', 'name': 'Roblox', 'description': 'Roblox'}}]","{'annotations': [{'start': 236, 'end': 241, 'probability': 0.4549, 'type': 'Product', 'normalized_text': 'Roblox'}], 'urls': [{'start': 242, 'end': 265, 'url': 'https://t.co/aLYS61nQhC', 'expanded_url': 'https://ro.blox.com/Ebh5?pid=share&is_retargeting=true&af_dp=roblox%3A%2F%2Fnavigation%2Fgame_details%3FgameId%3D3516581318&af_web_dp=https%3A%2F%2Fwww.roblox.com%2Fgames%2F9418993791', 'display_url': 'ro.blox.com/Ebh5?pid=share…'}], 'mentions': [{'start': 0, 'end': 15, 'username': 'bam_gamestudio', 'id': '1310681002658770945'}]}",,False,,everyone,Twitter for Android
1521603686480367617,1390850484819447811,que pasó con roblox?,2022-05-03 21:32:43+00:00,,0,1,0,0,es,1521603686480367617,"[{'domain': {'id': '71', 'name': 'Video Game', 'description': 'A video game like Overwatch'}, 'entity': {'id': '1088118927580774400', 'name': 'Roblox', 'description': 'Roblox'}}]",,,False,,everyone,Twitter for Android
1521603685783990272,1402402946550218753,yo jugaba roblox con mi casi algo y lo desinstalé x ella &lt;//3 pero ahora lo vuelvo a instalar por skz,2022-05-03 21:32:43+00:00,,0,0,0,0,es,1521603685783990272,"[{'domain': {'id': '71', 'name': 'Video Game', 'description': 'A video game like Overwatch'}, 'entity': {'id': '1088118927580774400', 'name': 'Roblox', 'description': 'Roblox'}}]",,,False,,everyone,Twitter for iPhone
1521603588358905863,1081375216742400000,@realRubenSim Furries shouldn't be aloud to moderate Roblox since they have a soft heart and harmless word will give them a panic attack,2022-05-03 21:32:20+00:00,,0,0,1,0,en,1521343898009751552,"[{'domain': {'id': '66', 'name': 'Interests and Hobbies Category', 'description': 'A grouping of interests and hobbies entities, like Novelty Food or Destinations'}, 'entity': {'id': '1045058369852067840', 'name': 'Furries', 'description': 'This entity tracks all conversation related to furries & furry fandom. For a more heavily-curated, Topic-ready version, see Furry fandom (1514304215165796352). '}}, {'domain': {'id': '71', 'name': 'Video Game', 'description': 'A video game like Overwatch'}, 'entity': {'id': '1088118927580774400', 'name': 'Roblox', 'description': 'Roblox'}}]","{'mentions': [{'start': 0, 'end': 13, 'username': 'realRubenSim', 'id': '1281060695501451265'}]}",,False,,everyone,Twitter Web App
1521603582004449280,1201041113706123264,"@kithstrawbkitty @z0mpup @softkamii @D1zzyTrent @Roblox i use mobile data, i can't connect to anything better and it's the best i have to use sadly",2022-05-03 21:32:18+00:00,,0,0,1,0,en,1457862778530803718,"[{'domain': {'id': '71', 'name': 'Video Game', 'description': 'A video game like Overwatch'}, 'entity': {'id': '1088118927580774400', 'name': 'Roblox', 'description': 'Roblox'}}, {'domain': {'id': '30', 'name': 'Entities [Entity Service]', 'description': 'Entity Service top level domain, every item that is in Entity Service should be in this domain'}, 'entity': {'id': '848920371311001600', 'name': 'Technology', 'description': 'Technology and computing'}}, {'domain': {'id': '30', 'name': 'Entities [Entity Service]', 'description': 'Entity Service top level domain, every item that is in Entity Service should be in this domain'}, 'entity': {'id': '848985956778561538', 'name': 'Mobile', 'description': 'Mobile'}}]","{'mentions': [{'start': 0, 'end': 16, 'username': 'kithstrawbkitty', 'id': '1432473159018717197'}, {'start': 17, 'end': 24, 'username': 'z0mpup', 'id': '1143621093032435713'}, {'start': 25, 'end': 35, 'username': 'softkamii', 'id': '1424477080310501382'}, {'start': 36, 'end': 47, 'username': 'D1zzyTrent', 'id': '1351031574947618824'}, {'start': 48, 'end': 55, 'username': 'Roblox', 'id': '16745055'}]}",,False,,everyone,Twitter Web App
1521603572781109249,1102328249802199040,c0MO Q SKZ Y ROBLOX Q ES ESO??#¿*#¿$*%¿$¿%¿÷,2022-05-03 21:32:16+00:00,,0,4,7,0,es,1521603572781109249,"[{'domain': {'id': '71', 'name': 'Video Game', 'description': 'A video game like Overwatch'}, 'entity': {'id': '1088118927580774400', 'name': 'Roblox', 'description': 'Roblox'}}]",,,False,,everyone,Twitter for Android
1521603535275761667,1190826286681333765,stays siganme en roblox @/linofreza 😉,2022-05-03 21:32:07+00:00,,0,0,0,0,ht,1521603535275761667,"[{'domain': {'id': '71', 'name': 'Video Game', 'description': 'A video game like Overwatch'}, 'entity': {'id': '1088118927580774400', 'name': 'Roblox', 'description': 'Roblox'}}]",,,False,,everyone,Twitter for Android
1521603506892849154,1404914580380340229,@WoizYT @Roblox @robloxdevrel what game is it? pet champion?,2022-05-03 21:32:00+00:00,,0,0,0,0,en,1521472403116806146,"[{'domain': {'id': '71', 'name': 'Video Game', 'description': 'A video game like Overwatch'}, 'entity': {'id': '1088118927580774400', 'name': 'Roblox', 'description': 'Roblox'}}]","{'mentions': [{'start': 0, 'end': 7, 'username': 'WoizYT', 'id': '1074000530123472897'}, {'start': 8, 'end': 15, 'username': 'Roblox', 'id': '16745055'}, {'start': 16, 'end': 29, 'username': 'robloxdevrel', 'id': '856650515874172928'}]}",,False,,everyone,Twitter Web App
1521603496860176385,1415087536318427137,@RuvTheEarrape @Roblox floppa é vida,2022-05-03 21:31:58+00:00,,0,0,1,0,pt,1521159568562147329,"[{'domain': {'id': '71', 'name': 'Video Game', 'description': 'A video game like Overwatch'}, 'entity': {'id': '1088118927580774400', 'name': 'Roblox', 'description': 'Roblox'}}]","{'mentions': [{'start': 0, 'end': 14, 'username': 'RuvTheEarrape', 'id': '1262390250627891203'}, {'start': 15, 'end': 22, 'username': 'Roblox', 'id': '16745055'}]}",,False,,everyone,Twitter Web App
1521603488102457344,1518763129823535105,"Alguien me enseña a jugar ROBLOX o q, yo solo le sé al mc",2022-05-03 21:31:56+00:00,,0,1,3,0,es,1521603488102457344,"[{'domain': {'id': '71', 'name': 'Video Game', 'description': 'A video game like Overwatch'}, 'entity': {'id': '1088118927580774400', 'name': 'Roblox', 'description': 'Roblox'}}]","{'annotations': [{'start': 26, 'end': 31, 'probability': 0.3395, 'type': 'Product', 'normalized_text': 'ROBLOX'}]}",,False,,everyone,Twitter for Android
1521603483547226112,1334076581854150656,@seolarpwr SKZ ON ROBLOX?,2022-05-03 21:31:55+00:00,,0,1,0,0,en,1521585093999210496,"[{'domain': {'id': '71', 'name': 'Video Game', 'description': 'A video game like Overwatch'}, 'entity': {'id': '1088118927580774400', 'name': 'Roblox', 'description': 'Roblox'}}]","{'annotations': [{'start': 18, 'end': 23, 'probability': 0.3045, 'type': 'Product', 'normalized_text': 'ROBLOX'}], 'mentions': [{'start': 0, 'end': 10, 'username': 'seolarpwr', 'id': '1464558426273435653'}]}",,False,,everyone,Twitter for Android
1521603475167096832,1381878424973705216,(roblox death noise),2022-05-03 21:31:53+00:00,,0,0,0,0,en,1521603475167096832,"[{'domain': {'id': '71', 'name': 'Video Game', 'description': 'A video game like Overwatch'}, 'entity': {'id': '1088118927580774400', 'name': 'Roblox', 'description': 'Roblox'}}]",,,False,,everyone,"Cheap Bots, Done Quick!"
1521603433157242880,1428331199362080770,"@Purpleguy8937 @Roblox I still don't know yet

But I believe, if you can open his profile 

Could be because he got banned forever or his account doesn't exist anymore

Because it happens to my old account called SharoneJosephine",2022-05-03 21:31:43+00:00,,0,6,0,0,en,1521159568562147329,"[{'domain': {'id': '71', 'name': 'Video Game', 'description': 'A video game like Overwatch'}, 'entity': {'id': '1088118927580774400', 'name': 'Roblox', 'description': 'Roblox'}}]","{'mentions': [{'start': 0, 'end': 14, 'username': 'Purpleguy8937', 'id': '1406712643839270914'}, {'start': 15, 'end': 22, 'username': 'Roblox', 'id': '16745055'}]}",,False,,everyone,Twitter for Android
1521603384993792001,1452405514730709002,@Roblox_RTC_BR @LeaksEvents Mistakes happen in life.,2022-05-03 21:31:31+00:00,,1,0,2,0,en,1521602586801061889,[],"{'mentions': [{'start': 0, 'end': 14, 'username': 'Roblox_RTC_BR', 'id': '1417587809502826500'}, {'start': 15, 'end': 27, 'username': 'LeaksEvents', 'id': '1422163374339727363'}]}",,False,,everyone,Twitter for Android
1521603381453856772,1516876807290687489,I domt think i should be allowed on roblox https://t.co/EkWUPbwFHt,2022-05-03 21:31:30+00:00,,0,3,8,0,en,1521603381453856772,"[{'domain': {'id': '71', 'name': 'Video Game', 'description': 'A video game like Overwatch'}, 'entity': {'id': '1088118927580774400', 'name': 'Roblox', 'description': 'Roblox'}}]","{'urls': [{'start': 43, 'end': 66, 'url': 'https://t.co/EkWUPbwFHt', 'expanded_url': 'https://twitter.com/kaeisn/status/1521603381453856772/photo/1', 'display_url': 'pic.twitter.com/EkWUPbwFHt', 'media_key': '3_1521603339833778177'}]}",{'media_keys': ['3_1521603339833778177']},False,,everyone,Twitter Web App
1521603366689947649,1484893289308323840,Yea I do it's me Dustsans from Instagram and roblox lol,2022-05-03 21:31:27+00:00,,0,0,0,0,en,1520775899909611523,"[{'domain': {'id': '71', 'name': 'Video Game', 'description': 'A video game like Overwatch'}, 'entity': {'id': '1088118927580774400', 'name': 'Roblox', 'description': 'Roblox'}}]","{'annotations': [{'start': 17, 'end': 24, 'probability': 0.5374, 'type': 'Person', 'normalized_text': 'Dustsans'}, {'start': 31, 'end': 39, 'probability': 0.6788, 'type': 'Product', 'normalized_text': 'Instagram'}]}",,False,,everyone,Twitter Web App
1521603366014566402,1422163374339727363,@Roblox_RTC_BR To percebendo que você está estressado...,2022-05-03 21:31:27+00:00,,1,1,7,0,pt,1521602586801061889,[],"{'mentions': [{'start': 0, 'end': 14, 'username': 'Roblox_RTC_BR', 'id': '1417587809502826500'}]}",,False,,everyone,Twitter Web App
1521603361262342144,1504848755769544711,Am I right? @robloxdevrel? #roblox #RobloxDev https://t.co/wA4TOXaR7z,2022-05-03 21:31:26+00:00,,1,0,2,0,en,1521603361262342144,"[{'domain': {'id': '71', 'name': 'Video Game', 'description': 'A video game like Overwatch'}, 'entity': {'id': '1088118927580774400', 'name': 'Roblox', 'description': 'Roblox'}}]","{'urls': [{'start': 46, 'end': 69, 'url': 'https://t.co/wA4TOXaR7z', 'expanded_url': 'https://twitter.com/TheFroggyGang/status/1521602797556289536', 'display_url': 'twitter.com/TheFroggyGang/…'}], 'mentions': [{'start': 12, 'end': 25, 'username': 'robloxdevrel', 'id': '856650515874172928'}], 'hashtags': [{'start': 27, 'end': 34, 'tag': 'roblox'}, {'start': 35, 'end': 45, 'tag': 'RobloxDev'}]}",,False,,everyone,Twitter for Android
1521603358880108547,1499147560379899910,"Hola cursec
Roblox https://t.co/GTo0cie8m9",2022-05-03 21:31:25+00:00,,0,0,0,0,en,1521603358880108547,"[{'domain': {'id': '71', 'name': 'Video Game', 'description': 'A video game like Overwatch'}, 'entity': {'id': '1088118927580774400', 'name': 'Roblox', 'description': 'Roblox'}}]","{'urls': [{'start': 19, 'end': 42, 'url': 'https://t.co/GTo0cie8m9', 'expanded_url': 'https://twitter.com/tatis_alejandro/status/1521603358880108547/photo/1', 'display_url': 'pic.twitter.com/GTo0cie8m9', 'media_key': '3_1521603327372546048'}, {'start': 19, 'end': 42, 'url': 'https://t.co/GTo0cie8m9', 'expanded_url': 'https://twitter.com/tatis_alejandro/status/1521603358880108547/photo/1', 'display_url': 'pic.twitter.com/GTo0cie8m9', 'media_key': '3_1521603340907462658'}, {'start': 19, 'end': 42, 'url': 'https://t.co/GTo0cie8m9', 'expanded_url': 'https://twitter.com/tatis_alejandro/status/1521603358880108547/photo/1', 'display_url': 'pic.twitter.com/GTo0cie8m9', 'media_key': '3_1521603356338409472'}]}","{'media_keys': ['3_1521603327372546048', '3_1521603340907462658', '3_1521603356338409472']}",False,,everyone,Twitter for Android
1521603329662627846,1325111476999380992,"@ArsworldS All along Sonic was a disguised Roblox game, we've all been fooled!",2022-05-03 21:31:18+00:00,,0,0,3,0,en,1521587974978211840,"[{'domain': {'id': '71', 'name': 'Video Game', 'description': 'A video game like Overwatch'}, 'entity': {'id': '1088118927580774400', 'name': 'Roblox', 'description': 'Roblox'}}, {'domain': {'id': '130', 'name': 'Multimedia Franchise', 'description': ""Franchises which span multiple forms of media like 'Harry Potter'""}, 'entity': {'id': '993952643209773057', 'name': 'Sonic the Hedgehog', 'description': 'This entity includes all conversation about the franchise, as well as any individual installments in the series, if applicable.\t\t\t\n\nNOTE: Stopped annotating in the Video Game domain (71) on 11/15/19. Moving forward, this entity will annotate to Multimedia Franchise domain (130) only.'}}]","{'annotations': [{'start': 21, 'end': 25, 'probability': 0.3091, 'type': 'Other', 'normalized_text': 'Sonic'}, {'start': 43, 'end': 48, 'probability': 0.3799, 'type': 'Product', 'normalized_text': 'Roblox'}], 'mentions': [{'start': 0, 'end': 10, 'username': 'ArsworldS', 'id': '1273479179837689859'}]}",,False,,everyone,Twitter for Android
1521603326424797185,533141190,"@taylorluvation Omggg best of luck! You’ll do well, don’t worry! I’m just chillin, playing Roblox haha",2022-05-03 21:31:17+00:00,,0,0,0,0,en,1521554012583079936,"[{'domain': {'id': '71', 'name': 'Video Game', 'description': 'A video game like Overwatch'}, 'entity': {'id': '1088118927580774400', 'name': 'Roblox', 'description': 'Roblox'}}]","{'annotations': [{'start': 91, 'end': 96, 'probability': 0.324, 'type': 'Product', 'normalized_text': 'Roblox'}], 'mentions': [{'start': 0, 'end': 15, 'username': 'taylorluvation', 'id': '1160816863393116163'}]}",,False,,everyone,Twitter for iPhone
