tweetid,author_id,text,created_at,geo,retweets,replies,likes,quote_count,lang,conversation_id,context_annotations,entities,attachments,possibly_sensitive,withheld,reply_settings,source
1517221648901935104,1099491220579966976,"@TopsterTweets im not specifically talking about just kim, even if it was barely NSFW, im mainly talking about roblox's comments regarding how ""strict"" their moderation is.

i just find it hilarious that they would state that when in reality the moderation has been awful.",2022-04-21 19:20:04+00:00,,0,0,0,0,en,1517121069487837184,"[{'domain': {'id': '71', 'name': 'Video Game', 'description': 'A video game like Overwatch'}, 'entity': {'id': '1088118927580774400', 'name': 'Roblox', 'description': 'Roblox'}}]","{'annotations': [{'start': 54, 'end': 56, 'probability': 0.8646, 'type': 'Person', 'normalized_text': 'kim'}], 'mentions': [{'start': 0, 'end': 14, 'username': 'TopsterTweets', 'id': '1222206335409958914'}]}",,False,,everyone,Twitter Web App
1517221632003264512,1487176656032878594,Hoy tendremos un pequeño evento PVP con unos compañeros streamers de trovo espero que puedan estar  en el Directo dejando sus buenas bibras y predicciones :https://t.co/yjyG4EL5K2 #trovolive  #stream  #bloxfruits  #Roblox https://t.co/BR29fBNwLp,2022-04-21 19:20:00+00:00,,0,0,0,0,es,1517221632003264512,"[{'domain': {'id': '71', 'name': 'Video Game', 'description': 'A video game like Overwatch'}, 'entity': {'id': '1088118927580774400', 'name': 'Roblox', 'description': 'Roblox'}}]","{'urls': [{'start': 156, 'end': 179, 'url': 'https://t.co/yjyG4EL5K2', 'expanded_url': 'https://trovo.live/Go_Makito', 'display_url': 'trovo.live/Go_Makito'}, {'start': 222, 'end': 245, 'url': 'https://t.co/BR29fBNwLp', 'expanded_url': 'https://twitter.com/Dwar32447016/status/1517221632003264512/photo/1', 'display_url': 'pic.twitter.com/BR29fBNwLp', 'media_key': '3_1517221423655358465'}], 'hashtags': [{'start': 180, 'end': 190, 'tag': 'trovolive'}, {'start': 192, 'end': 199, 'tag': 'stream'}, {'start': 201, 'end': 212, 'tag': 'bloxfruits'}, {'start': 214, 'end': 221, 'tag': 'Roblox'}]}",{'media_keys': ['3_1517221423655358465']},False,,everyone,Twitter Web App
1517221615066566663,1230137213129719809,the roblox engine is better than the unity engine,2022-04-21 19:19:56+00:00,,0,1,0,0,en,1517221615066566663,"[{'domain': {'id': '71', 'name': 'Video Game', 'description': 'A video game like Overwatch'}, 'entity': {'id': '1088118927580774400', 'name': 'Roblox', 'description': 'Roblox'}}]",,,False,,everyone,Twitter Web App
1517221607458152449,1468107987680219136,@bigwanger12 now u open roblox and see someone selling an unreleased kim k s** tape,2022-04-21 19:19:54+00:00,,2,3,514,0,en,1517212298586181632,"[{'domain': {'id': '10', 'name': 'Person', 'description': 'Named people in the world like Nelson Mandela'}, 'entity': {'id': '806570121959383040', 'name': 'Kim Kardashian', 'description': 'Kim Kardashian'}}, {'domain': {'id': '58', 'name': 'Entertainment Personality', 'description': 'An entertainment personality in the world, like Anderson Cooper or Miranda Sings'}, 'entity': {'id': '806570121959383040', 'name': 'Kim Kardashian', 'description': 'Kim Kardashian'}}, {'domain': {'id': '71', 'name': 'Video Game', 'description': 'A video game like Overwatch'}, 'entity': {'id': '1088118927580774400', 'name': 'Roblox', 'description': 'Roblox'}}]","{'annotations': [{'start': 69, 'end': 73, 'probability': 0.6685, 'type': 'Person', 'normalized_text': 'kim k'}], 'mentions': [{'start': 0, 'end': 12, 'username': 'bigwanger12', 'id': '719254445448495104'}]}",,False,,everyone,Twitter for iPhone
1517221574054711296,494259903,"@Kiera60221886 @PedM12 @Roblox Welcome to 2022, where that one Family Guy episode quote was right, we MIGHT be living in a post-joke world",2022-04-21 19:19:46+00:00,,0,0,0,0,en,1516910351740067840,"[{'domain': {'id': '3', 'name': 'TV Shows', 'description': 'Television shows from around the world'}, 'entity': {'id': '10000614450', 'name': 'Family Guy', 'description': 'The adventures of an eccentric family living in New England.\n\nPhoto via @FamilyGuyonFOX'}}, {'domain': {'id': '3', 'name': 'TV Shows', 'description': 'Television shows from around the world'}, 'entity': {'id': '10027336708', 'name': 'Family Guy', 'description': 'Sick, twisted and politically incorrect, the animated series features the adventures of the Griffin family. Endearingly ignorant Peter and stay-at-home wife Lois reside in Quahog, R.I., and have three kids. Meg, the eldest child, is a social outcast, and teenage Chris is awkward and clueless when it comes to the opposite sex. The youngest, Stewie, is a genius baby bent on killing his mother and destroying the world. The talking dog, Brian, keeps Stewie in check while sipping martinis and sorting through his own life issues.'}}, {'domain': {'id': '71', 'name': 'Video Game', 'description': 'A video game like Overwatch'}, 'entity': {'id': '1088118927580774400', 'name': 'Roblox', 'description': 'Roblox'}}, {'domain': {'id': '172', 'name': 'Global TV Show', 'description': 'For global/conceptual TV shows without localization.'}, 'entity': {'id': '1255601767376515072', 'name': 'Family Guy'}}]","{'mentions': [{'start': 0, 'end': 14, 'username': 'Kiera60221886', 'id': '1289273700852936705'}, {'start': 15, 'end': 22, 'username': 'PedM12', 'id': '1019785029940137985'}, {'start': 23, 'end': 30, 'username': 'Roblox', 'id': '16745055'}]}",,False,,everyone,Twitter Web App
1517221571529740288,1454848882786152452,quartinho pra jogar roblox https://t.co/5o029nuoeb,2022-04-21 19:19:45+00:00,,0,1,1,0,pt,1517221571529740288,"[{'domain': {'id': '10', 'name': 'Person', 'description': 'Named people in the world like Nelson Mandela'}, 'entity': {'id': '828635393868206080', 'name': 'Anitta', 'description': 'Anitta'}}, {'domain': {'id': '54', 'name': 'Musician', 'description': 'A musician in the world, like Adele or Bob Dylan'}, 'entity': {'id': '828635393868206080', 'name': 'Anitta', 'description': 'Anitta'}}, {'domain': {'id': '55', 'name': 'Music Genre', 'description': 'A category for a musical style, like Pop, Rock, or Rap'}, 'entity': {'id': '810938279801470977', 'name': 'Pop', 'description': 'Pop'}}, {'domain': {'id': '55', 'name': 'Music Genre', 'description': 'A category for a musical style, like Pop, Rock, or Rap'}, 'entity': {'id': '849684576913940480', 'name': 'Latin pop', 'description': 'Latino'}}, {'domain': {'id': '55', 'name': 'Music Genre', 'description': 'A category for a musical style, like Pop, Rock, or Rap'}, 'entity': {'id': '885621256573173760', 'name': 'Brazilian funk', 'description': 'Funk'}}, {'domain': {'id': '71', 'name': 'Video Game', 'description': 'A video game like Overwatch'}, 'entity': {'id': '1088118927580774400', 'name': 'Roblox', 'description': 'Roblox'}}]","{'urls': [{'start': 27, 'end': 50, 'url': 'https://t.co/5o029nuoeb', 'expanded_url': 'https://twitter.com/gossiprpbr/status/1516980212386476032', 'display_url': 'twitter.com/gossiprpbr/sta…'}]}",,False,,everyone,Twitter for Android
1517221566349676544,1512468995215003648,se imaginan jugar roblox con sicheng un sueño,2022-04-21 19:19:44+00:00,,0,0,0,0,es,1517221566349676544,"[{'domain': {'id': '71', 'name': 'Video Game', 'description': 'A video game like Overwatch'}, 'entity': {'id': '1088118927580774400', 'name': 'Roblox', 'description': 'Roblox'}}]",,,False,,everyone,Twitter for iPhone
1517221544271003651,1457090099146104841,@IGN NOOO 😢😢 I NEED ROBLOX,2022-04-21 19:19:39+00:00,,0,0,1,0,en,1516929967669534723,"[{'domain': {'id': '46', 'name': 'Brand Category', 'description': 'Categories within Brand Verticals that narrow down the scope of Brands'}, 'entity': {'id': '781974596157181956', 'name': 'Online Site'}}, {'domain': {'id': '47', 'name': 'Brand', 'description': 'Brands and Companies'}, 'entity': {'id': '1106638172182597632', 'name': 'IGN'}}, {'domain': {'id': '71', 'name': 'Video Game', 'description': 'A video game like Overwatch'}, 'entity': {'id': '1088118927580774400', 'name': 'Roblox', 'description': 'Roblox'}}]","{'mentions': [{'start': 0, 'end': 4, 'username': 'IGN', 'id': '18927441'}]}",,False,,everyone,Twitter for iPhone
1517221534456242176,1432765497485971463,Roblox is my safe space https://t.co/Mcvhz8MXua,2022-04-21 19:19:37+00:00,,0,0,0,0,en,1517221534456242176,"[{'domain': {'id': '71', 'name': 'Video Game', 'description': 'A video game like Overwatch'}, 'entity': {'id': '1088118927580774400', 'name': 'Roblox', 'description': 'Roblox'}}]","{'urls': [{'start': 24, 'end': 47, 'url': 'https://t.co/Mcvhz8MXua', 'expanded_url': 'https://twitter.com/Art_Is_A_Lie/status/1517221534456242176/photo/1', 'display_url': 'pic.twitter.com/Mcvhz8MXua', 'media_key': '3_1517221515384786947'}], 'annotations': [{'start': 0, 'end': 5, 'probability': 0.2848, 'type': 'Organization', 'normalized_text': 'Roblox'}]}",{'media_keys': ['3_1517221515384786947']},False,,everyone,Twitter for iPhone
1517221507361128448,1452902575,Roblox is valued at around $22B https://t.co/Wczd1d2SnT,2022-04-21 19:19:30+00:00,,0,0,0,0,en,1517221507361128448,"[{'domain': {'id': '10', 'name': 'Person', 'description': 'Named people in the world like Nelson Mandela'}, 'entity': {'id': '806570121959383040', 'name': 'Kim Kardashian', 'description': 'Kim Kardashian'}}, {'domain': {'id': '58', 'name': 'Entertainment Personality', 'description': 'An entertainment personality in the world, like Anderson Cooper or Miranda Sings'}, 'entity': {'id': '806570121959383040', 'name': 'Kim Kardashian', 'description': 'Kim Kardashian'}}, {'domain': {'id': '71', 'name': 'Video Game', 'description': 'A video game like Overwatch'}, 'entity': {'id': '1088118927580774400', 'name': 'Roblox', 'description': 'Roblox'}}]","{'urls': [{'start': 32, 'end': 55, 'url': 'https://t.co/Wczd1d2SnT', 'expanded_url': 'https://twitter.com/IGN/status/1516929967669534723', 'display_url': 'twitter.com/IGN/status/151…'}], 'annotations': [{'start': 0, 'end': 5, 'probability': 0.3738, 'type': 'Organization', 'normalized_text': 'Roblox'}]}",,False,,everyone,Twitter for iPhone
1517221484825128960,1454374231400140805,В Roblox состоялся запуск ​​Turning Red https://t.co/0RxWCfq5jh,2022-04-21 19:19:25+00:00,,0,0,0,0,und,1517221484825128960,"[{'domain': {'id': '71', 'name': 'Video Game', 'description': 'A video game like Overwatch'}, 'entity': {'id': '1088118927580774400', 'name': 'Roblox', 'description': 'Roblox'}}]","{'urls': [{'start': 40, 'end': 63, 'url': 'https://t.co/0RxWCfq5jh', 'expanded_url': 'https://xn--90asckcim.xn--p1ai/news/v-roblox-sostoyalsya-zapusk-turning-red', 'display_url': 'роблокс.рф/news/v-roblox-…'}]}",,False,,everyone,Twitter Web App
1517221458992320513,1417951308997398530,"@SexyGamerDoll (1/2) I'm assuming you know nothing about Roblox so I'll explain it the best I can.

User-generated content on Roblox is like YouTube. Once it's up, it's up, but it gets quickly taken down after being verified by a person. He just so happened to see the ad before it was removed. https://t.co/JEknhZyciF",2022-04-21 19:19:19+00:00,,0,2,0,0,en,1517034011964620800,"[{'domain': {'id': '71', 'name': 'Video Game', 'description': 'A video game like Overwatch'}, 'entity': {'id': '1088118927580774400', 'name': 'Roblox', 'description': 'Roblox'}}, {'domain': {'id': '165', 'name': 'Technology', 'description': 'for individual and types of technology, e.g., food technology, 3D printing'}, 'entity': {'id': '1196446161223028736', 'name': 'Social media'}}, {'domain': {'id': '46', 'name': 'Brand Category', 'description': 'Categories within Brand Verticals that narrow down the scope of Brands'}, 'entity': {'id': '781974596752842752', 'name': 'Services'}}, {'domain': {'id': '47', 'name': 'Brand', 'description': 'Brands and Companies'}, 'entity': {'id': '10029382357', 'name': 'YouTube'}}]","{'urls': [{'start': 295, 'end': 318, 'url': 'https://t.co/JEknhZyciF', 'expanded_url': 'https://twitter.com/KnightBikeson/status/1517221458992320513/photo/1', 'display_url': 'pic.twitter.com/JEknhZyciF', 'media_key': '3_1517221451652382720'}], 'annotations': [{'start': 57, 'end': 62, 'probability': 0.3415, 'type': 'Other', 'normalized_text': 'Roblox'}, {'start': 126, 'end': 131, 'probability': 0.5171, 'type': 'Product', 'normalized_text': 'Roblox'}, {'start': 141, 'end': 147, 'probability': 0.703, 'type': 'Product', 'normalized_text': 'YouTube'}], 'mentions': [{'start': 0, 'end': 14, 'username': 'SexyGamerDoll', 'id': '1234940129644621826'}]}",{'media_keys': ['3_1517221451652382720']},False,,everyone,Twitter for iPhone
1517221439258169351,284907513,"130,000 al semestre para tomar clases en Roblox 💀💀 https://t.co/zSXt9eeZ9u",2022-04-21 19:19:14+00:00,,0,0,4,0,ca,1517221439258169351,"[{'domain': {'id': '71', 'name': 'Video Game', 'description': 'A video game like Overwatch'}, 'entity': {'id': '1088118927580774400', 'name': 'Roblox', 'description': 'Roblox'}}]","{'urls': [{'start': 51, 'end': 74, 'url': 'https://t.co/zSXt9eeZ9u', 'expanded_url': 'https://twitter.com/david_garza/status/1516906072640004096', 'display_url': 'twitter.com/david_garza/st…'}]}",,False,,everyone,Twitter for iPhone
1517221410145546243,926909845781078016,Another #Roblox graphic design concept thing. https://t.co/1kxlGcOxX4,2022-04-21 19:19:07+00:00,,3,0,5,0,en,1517221410145546243,"[{'domain': {'id': '66', 'name': 'Interests and Hobbies Category', 'description': 'A grouping of interests and hobbies entities, like Novelty Food or Destinations'}, 'entity': {'id': '1046577790353428480', 'name': 'Visual arts', 'description': 'Visual Arts'}}, {'domain': {'id': '67', 'name': 'Interests and Hobbies', 'description': 'Interests, opinions, and behaviors of individuals, groups, or cultures; like Speciality Cooking or Theme Parks'}, 'entity': {'id': '1046580793848418305', 'name': 'Graphic design', 'description': 'Graphic Design'}}, {'domain': {'id': '71', 'name': 'Video Game', 'description': 'A video game like Overwatch'}, 'entity': {'id': '1088118927580774400', 'name': 'Roblox', 'description': 'Roblox'}}, {'domain': {'id': '66', 'name': 'Interests and Hobbies Category', 'description': 'A grouping of interests and hobbies entities, like Novelty Food or Destinations'}, 'entity': {'id': '847872720331079681', 'name': 'Design', 'description': 'Design'}}]","{'urls': [{'start': 46, 'end': 69, 'url': 'https://t.co/1kxlGcOxX4', 'expanded_url': 'https://twitter.com/404N1KO/status/1517221410145546243/photo/1', 'display_url': 'pic.twitter.com/1kxlGcOxX4', 'media_key': '3_1517221404684558344'}], 'hashtags': [{'start': 8, 'end': 15, 'tag': 'Roblox'}]}",{'media_keys': ['3_1517221404684558344']},False,,everyone,Twitter for Android
1517221398212714497,1467649807607083008,@salu70220788 quero ver rodas roblox com gráfico no maximo,2022-04-21 19:19:04+00:00,,0,0,1,0,pt,1516782991283920897,"[{'domain': {'id': '71', 'name': 'Video Game', 'description': 'A video game like Overwatch'}, 'entity': {'id': '1088118927580774400', 'name': 'Roblox', 'description': 'Roblox'}}]","{'mentions': [{'start': 0, 'end': 13, 'username': 'salu70220788', 'id': '1420506824273432577'}]}",,False,,everyone,Twitter for Android
1517221397038313479,1309799419181764615,@Roblox @chizeled_ @Bloxy_News @ItsAmmon @ftDerpy Thé Price is perfect,2022-04-21 19:19:04+00:00,,0,0,0,0,fr,1516910351740067840,"[{'domain': {'id': '71', 'name': 'Video Game', 'description': 'A video game like Overwatch'}, 'entity': {'id': '1088118927580774400', 'name': 'Roblox', 'description': 'Roblox'}}]","{'mentions': [{'start': 0, 'end': 7, 'username': 'Roblox', 'id': '16745055'}, {'start': 8, 'end': 18, 'username': 'chizeled_', 'id': '1255111848518651904'}, {'start': 19, 'end': 30, 'username': 'Bloxy_News', 'id': '901894986836279296'}, {'start': 31, 'end': 40, 'username': 'ItsAmmon', 'id': '1102772383071387648'}, {'start': 41, 'end': 49, 'username': 'ftDerpy', 'id': '4093077509'}]}",,False,,everyone,Twitter for Android
1517221368160477184,1495083012349992973,@Ella_mhmm @Roblox Can you get a job,2022-04-21 19:18:57+00:00,,0,0,0,0,en,1516910351740067840,"[{'domain': {'id': '71', 'name': 'Video Game', 'description': 'A video game like Overwatch'}, 'entity': {'id': '1088118927580774400', 'name': 'Roblox', 'description': 'Roblox'}}]","{'mentions': [{'start': 0, 'end': 10, 'username': 'Ella_mhmm', 'id': '1497663269414133762'}, {'start': 11, 'end': 18, 'username': 'Roblox', 'id': '16745055'}]}",,False,,everyone,Twitter for iPhone
1517221339345702912,1419376245154975750,"@lightningvirus_ Yo tengo una casa así
pero en roblox, bloxburg jasjakj",2022-04-21 19:18:50+00:00,,0,1,1,0,es,1517183392718147589,"[{'domain': {'id': '71', 'name': 'Video Game', 'description': 'A video game like Overwatch'}, 'entity': {'id': '1088118927580774400', 'name': 'Roblox', 'description': 'Roblox'}}]","{'annotations': [{'start': 47, 'end': 52, 'probability': 0.4306, 'type': 'Product', 'normalized_text': 'roblox'}], 'mentions': [{'start': 0, 'end': 16, 'username': 'lightningvirus_', 'id': '2736240241'}]}",,False,,everyone,Twitter Web App
1517221332198559747,1072429204892016642,Isn't Roblox worth more than the entire Kardashian family? Lmao https://t.co/qz97MA8oXq,2022-04-21 19:18:48+00:00,,0,0,0,0,en,1517221332198559747,"[{'domain': {'id': '10', 'name': 'Person', 'description': 'Named people in the world like Nelson Mandela'}, 'entity': {'id': '806570121959383040', 'name': 'Kim Kardashian', 'description': 'Kim Kardashian'}}, {'domain': {'id': '58', 'name': 'Entertainment Personality', 'description': 'An entertainment personality in the world, like Anderson Cooper or Miranda Sings'}, 'entity': {'id': '806570121959383040', 'name': 'Kim Kardashian', 'description': 'Kim Kardashian'}}, {'domain': {'id': '71', 'name': 'Video Game', 'description': 'A video game like Overwatch'}, 'entity': {'id': '1088118927580774400', 'name': 'Roblox', 'description': 'Roblox'}}]","{'urls': [{'start': 64, 'end': 87, 'url': 'https://t.co/qz97MA8oXq', 'expanded_url': 'https://twitter.com/IGN/status/1516929967669534723', 'display_url': 'twitter.com/IGN/status/151…'}], 'annotations': [{'start': 40, 'end': 49, 'probability': 0.9763, 'type': 'Person', 'normalized_text': 'Kardashian'}]}",,False,,everyone,Twitter for Android
1517221286388416514,1495083012349992973,@NOTe386615376 @Roblox Get a job xd,2022-04-21 19:18:37+00:00,,0,0,0,0,en,1516910351740067840,"[{'domain': {'id': '71', 'name': 'Video Game', 'description': 'A video game like Overwatch'}, 'entity': {'id': '1088118927580774400', 'name': 'Roblox', 'description': 'Roblox'}}]","{'mentions': [{'start': 0, 'end': 14, 'username': 'NOTe386615376', 'id': '1517005092947316736'}, {'start': 15, 'end': 22, 'username': 'Roblox', 'id': '16745055'}]}",,False,,everyone,Twitter for iPhone
1517221264452206594,844333432524210178,@Imrllykindlol @greenlegocats @Roblox my thoughts exactly,2022-04-21 19:18:32+00:00,,0,0,1,0,en,1517211460773974016,"[{'domain': {'id': '71', 'name': 'Video Game', 'description': 'A video game like Overwatch'}, 'entity': {'id': '1088118927580774400', 'name': 'Roblox', 'description': 'Roblox'}}]","{'mentions': [{'start': 0, 'end': 14, 'username': 'Imrllykindlol', 'id': '1503377315891400711'}, {'start': 15, 'end': 29, 'username': 'greenlegocats', 'id': '828495957964656642'}, {'start': 30, 'end': 37, 'username': 'Roblox', 'id': '16745055'}]}",,False,,everyone,Twitter for iPhone
1517221195627864064,1325192965665525761,"@OMBgamingRBLX My favourite moment on roblox, is how i make people happy by playing piano in Roblox Talent show! Game: https://t.co/uiM0p5i6AF",2022-04-21 19:18:16+00:00,,0,0,0,0,en,1517204815503364097,"[{'domain': {'id': '71', 'name': 'Video Game', 'description': 'A video game like Overwatch'}, 'entity': {'id': '1088118927580774400', 'name': 'Roblox', 'description': 'Roblox'}}, {'domain': {'id': '66', 'name': 'Interests and Hobbies Category', 'description': 'A grouping of interests and hobbies entities, like Novelty Food or Destinations'}, 'entity': {'id': '898268092110852096', 'name': 'Piano', 'description': 'Piano'}}, {'domain': {'id': '66', 'name': 'Interests and Hobbies Category', 'description': 'A grouping of interests and hobbies entities, like Novelty Food or Destinations'}, 'entity': {'id': '1131990542198247424', 'name': 'Musical instruments', 'description': 'Musical Instruments'}}, {'domain': {'id': '173', 'name': 'Google Product Taxonomy', 'description': 'A product taxonomy created by Google'}, 'entity': {'id': '898268092110852096', 'name': 'Piano', 'description': 'Piano'}}]","{'urls': [{'start': 119, 'end': 142, 'url': 'https://t.co/uiM0p5i6AF', 'expanded_url': 'https://www.roblox.com/games/10851599/Roblox-Talent-Show', 'display_url': 'roblox.com/games/10851599…', 'images': [{'url': 'https://pbs.twimg.com/news_img/1532130325194756096/rLjEVU1Z?format=jpg&name=orig', 'width': 498, 'height': 280}, {'url': 'https://pbs.twimg.com/news_img/1532130325194756096/rLjEVU1Z?format=jpg&name=150x150', 'width': 150, 'height': 150}], 'status': 200, 'title': 'Roblox Talent Show 🎤', 'description': ""Check out Roblox Talent Show 🎤. It’s one of the millions of unique, user-generated 3D experiences created on Roblox. 🎤 Welcome to Roblox Talent Show, the biggest and most popular talent show game on Roblox! ⭐ Perform as an auditioner and unleash your talent to the Judges & Host, Judge other auditioners' talents as a Judge, or even control the game as a Host by yourself! 📋 Read our official in-game rules here: https://devforum.roblox.com/t/1706902 💕 Join the official group here to verify your Rep! https://www.roblox.com/groups/2794002/Talent-Show-Group#!/about 🛠️ Development Team Credits: Prqcious, slidingseason 🎨 Graphics Team Credits: VeeGFX, AgoraRBLX"", 'unwound_url': 'https://www.roblox.com/games/10851599/Roblox-Talent-Show'}], 'annotations': [{'start': 38, 'end': 43, 'probability': 0.4245, 'type': 'Product', 'normalized_text': 'roblox'}, {'start': 93, 'end': 105, 'probability': 0.5335, 'type': 'Other', 'normalized_text': 'Roblox Talent'}], 'mentions': [{'start': 0, 'end': 14, 'username': 'OMBgamingRBLX', 'id': '1472636885533134858'}]}",,False,,everyone,Twitter Web App
1517221184521359360,1442882188249378820,@IShowSpeed made your art on roblox lol https://t.co/CGifUUrzRp,2022-04-21 19:18:13+00:00,,0,0,1,0,en,1517221184521359360,"[{'domain': {'id': '71', 'name': 'Video Game', 'description': 'A video game like Overwatch'}, 'entity': {'id': '1088118927580774400', 'name': 'Roblox', 'description': 'Roblox'}}]","{'urls': [{'start': 40, 'end': 63, 'url': 'https://t.co/CGifUUrzRp', 'expanded_url': 'https://twitter.com/Gl9Hatsune/status/1517221184521359360/photo/1', 'display_url': 'pic.twitter.com/CGifUUrzRp', 'media_key': '3_1517221179483959297'}], 'mentions': [{'start': 0, 'end': 11, 'username': 'ishowspeed', 'id': '1532852828682715138'}]}",{'media_keys': ['3_1517221179483959297']},False,,everyone,Twitter for iPad
1517221168113090565,862778448279773184,@SmardestGuyEver roblox,2022-04-21 19:18:09+00:00,,0,0,1,0,en,1516949898247168001,"[{'domain': {'id': '71', 'name': 'Video Game', 'description': 'A video game like Overwatch'}, 'entity': {'id': '1088118927580774400', 'name': 'Roblox', 'description': 'Roblox'}}]",,,False,,everyone,Twitter for Android
1517221155152748548,248397960,@GredyThes Your butt is on Roblox.,2022-04-21 19:18:06+00:00,,0,0,0,0,en,1516838869848702983,"[{'domain': {'id': '71', 'name': 'Video Game', 'description': 'A video game like Overwatch'}, 'entity': {'id': '1088118927580774400', 'name': 'Roblox', 'description': 'Roblox'}}]","{'annotations': [{'start': 27, 'end': 32, 'probability': 0.5577, 'type': 'Product', 'normalized_text': 'Roblox'}], 'mentions': [{'start': 0, 'end': 10, 'username': 'GredyThes', 'id': '1462094250607267846'}]}",,False,,everyone,Twitter for iPhone
1517221145136623616,875764524183433216,@glsmai @kirawontmiss She has every right to sue a company for posting porn of her to a childrens game when it’s obvious Roblox moderators did nothing to check if it was breaking their TOS or not 💀 you’re a fuckin clown,2022-04-21 19:18:04+00:00,,0,1,1,0,en,1517034011964620800,[],"{'annotations': [{'start': 121, 'end': 126, 'probability': 0.2754, 'type': 'Organization', 'normalized_text': 'Roblox'}], 'mentions': [{'start': 0, 'end': 7, 'username': 'glsmai', 'id': '1352473250215899136'}, {'start': 8, 'end': 21, 'username': 'kirawontmiss', 'id': '1471414739880189955'}]}",,False,,everyone,Twitter for iPhone
1517221141676539904,990600540273954816,"ad: ONLY $9.49

NERF Roblox MM2: Shark Seeker Dart Blaster 
 
https://t.co/TTe8rDnTFi 
https://t.co/TTe8rDnTFi https://t.co/0yQOsMWY42",2022-04-21 19:18:03+00:00,,0,0,0,0,en,1517221141676539904,"[{'domain': {'id': '66', 'name': 'Interests and Hobbies Category', 'description': 'A grouping of interests and hobbies entities, like Novelty Food or Destinations'}, 'entity': {'id': '1046541612208144385', 'name': 'Darts', 'description': 'Darts'}}, {'domain': {'id': '71', 'name': 'Video Game', 'description': 'A video game like Overwatch'}, 'entity': {'id': '1088118927580774400', 'name': 'Roblox', 'description': 'Roblox'}}]","{'urls': [{'start': 62, 'end': 85, 'url': 'https://t.co/TTe8rDnTFi', 'expanded_url': 'https://amzn.to/38VKQJd', 'display_url': 'amzn.to/38VKQJd'}, {'start': 87, 'end': 110, 'url': 'https://t.co/TTe8rDnTFi', 'expanded_url': 'https://amzn.to/38VKQJd', 'display_url': 'amzn.to/38VKQJd'}, {'start': 111, 'end': 134, 'url': 'https://t.co/0yQOsMWY42', 'expanded_url': 'https://twitter.com/StealsandDeals/status/1517221141676539904/photo/1', 'display_url': 'pic.twitter.com/0yQOsMWY42', 'media_key': '3_1517221138618798085'}], 'annotations': [{'start': 14, 'end': 30, 'probability': 0.3602, 'type': 'Product', 'normalized_text': 'NERF Roblox MM2'}]}",{'media_keys': ['3_1517221138618798085']},False,,everyone,Buffer
