tweetid,author_id,text,created_at,geo,retweets,replies,likes,quote_count,lang,conversation_id,context_annotations,entities,attachments,possibly_sensitive,withheld,reply_settings,source
1515151898256592899,3161984932,"@Roblox @sonic_hedgehog yall saying "" add this add that"" what yall supposed to say is"" fix the goddamn maintenance thing and all the damn bugs in the game instead of adding more items that can lead to even more bug",2022-04-16 02:15:37+00:00,,0,1,1,0,en,1515026236241850380,"[{'domain': {'id': '71', 'name': 'Video Game', 'description': 'A video game like Overwatch'}, 'entity': {'id': '1088118927580774400', 'name': 'Roblox', 'description': 'Roblox'}}, {'domain': {'id': '130', 'name': 'Multimedia Franchise', 'description': ""Franchises which span multiple forms of media like 'Harry Potter'""}, 'entity': {'id': '993952643209773057', 'name': 'Sonic the Hedgehog', 'description': 'This entity includes all conversation about the franchise, as well as any individual installments in the series, if applicable.\t\t\t\n\nNOTE: Stopped annotating in the Video Game domain (71) on 11/15/19. Moving forward, this entity will annotate to Multimedia Franchise domain (130) only.'}}]","{'mentions': [{'start': 0, 'end': 7, 'username': 'Roblox', 'id': '16745055'}, {'start': 8, 'end': 23, 'username': 'sonic_hedgehog', 'id': '19609162'}]}",,False,,everyone,Twitter Web App
1515151886738984960,1276153403501142017,"Y solo tenemos 2 accesorios a la venta. 💰

Dolo Tonight Hat (R$50): https://t.co/wDGj7YSCsW
Dolo Tonight Beani (R$70): https://t.co/2YfW2YgTc9 https://t.co/hbSu0sb8ul",2022-04-16 02:15:34+00:00,,0,0,9,0,es,1515151865968799746,[],"{'urls': [{'start': 68, 'end': 91, 'url': 'https://t.co/wDGj7YSCsW', 'expanded_url': 'https://www.roblox.com/catalog/9127934351/Dolo-Tonight-Hat', 'display_url': 'roblox.com/catalog/912793…'}, {'start': 119, 'end': 142, 'url': 'https://t.co/2YfW2YgTc9', 'expanded_url': 'https://www.roblox.com/catalog/9128065095/Dolo-Tonight-Beanie', 'display_url': 'roblox.com/catalog/912806…', 'status': 200, 'title': 'Dolo Tonight Beanie - Roblox', 'description': 'Roblox is a global platform that brings people together through play.', 'unwound_url': 'https://www.roblox.com/catalog/9128065095/Dolo-Tonight-Beanie'}, {'start': 143, 'end': 166, 'url': 'https://t.co/hbSu0sb8ul', 'expanded_url': 'https://twitter.com/RN_Noticias1/status/1515151886738984960/photo/1', 'display_url': 'pic.twitter.com/hbSu0sb8ul', 'media_key': '3_1515151574988959744'}]}",{'media_keys': ['3_1515151574988959744']},False,,everyone,Twitter Web App
1515151879331889154,1064167337719488518,never thought i be seeing a 40 year old women cry out the word roblox https://t.co/LGkpXlIivg,2022-04-16 02:15:32+00:00,,0,0,2,0,en,1515151879331889154,"[{'domain': {'id': '10', 'name': 'Person', 'description': 'Named people in the world like Nelson Mandela'}, 'entity': {'id': '806561823407239169', 'name': 'Kanye West', 'description': 'Kanye West'}}, {'domain': {'id': '10', 'name': 'Person', 'description': 'Named people in the world like Nelson Mandela'}, 'entity': {'id': '806570121959383040', 'name': 'Kim Kardashian', 'description': 'Kim Kardashian'}}, {'domain': {'id': '54', 'name': 'Musician', 'description': 'A musician in the world, like Adele or Bob Dylan'}, 'entity': {'id': '806561823407239169', 'name': 'Kanye West', 'description': 'Kanye West'}}, {'domain': {'id': '55', 'name': 'Music Genre', 'description': 'A category for a musical style, like Pop, Rock, or Rap'}, 'entity': {'id': '810937888334487552', 'name': 'Rap', 'description': 'Hip-Hop/Rap'}}, {'domain': {'id': '58', 'name': 'Entertainment Personality', 'description': 'An entertainment personality in the world, like Anderson Cooper or Miranda Sings'}, 'entity': {'id': '806570121959383040', 'name': 'Kim Kardashian', 'description': 'Kim Kardashian'}}, {'domain': {'id': '71', 'name': 'Video Game', 'description': 'A video game like Overwatch'}, 'entity': {'id': '1088118927580774400', 'name': 'Roblox', 'description': 'Roblox'}}]","{'urls': [{'start': 70, 'end': 93, 'url': 'https://t.co/LGkpXlIivg', 'expanded_url': 'https://twitter.com/ayedocc/status/1514838191991361544', 'display_url': 'twitter.com/ayedocc/status…'}]}",,False,,everyone,Twitter for Android
1515151865968799746,1276153403501142017,"¡La experiencia musical de @DoloTonight ya esta aquí! 🎵

Podrás visualizar este concierto cada 60 minutos, dentro de la experiencia del concierto. 👀

👉 https://t.co/M68gAiZV0c https://t.co/Pn5OgY2R0T",2022-04-16 02:15:29+00:00,,4,1,50,1,es,1515151865968799746,[],"{'urls': [{'start': 152, 'end': 175, 'url': 'https://t.co/M68gAiZV0c', 'expanded_url': 'https://www.roblox.com/games/6704278765/Dolo-Tonight-Concert-Experience', 'display_url': 'roblox.com/games/67042787…'}, {'start': 176, 'end': 199, 'url': 'https://t.co/Pn5OgY2R0T', 'expanded_url': 'https://twitter.com/RN_Noticias1/status/1515151865968799746/photo/1', 'display_url': 'pic.twitter.com/Pn5OgY2R0T', 'media_key': '16_1515150155720372232'}], 'mentions': [{'start': 27, 'end': 39, 'username': 'DoloTonight', 'id': '1154619146015035394'}]}",{'media_keys': ['16_1515150155720372232']},False,,everyone,Twitter Web App
1515151865016692743,1220519074171707394,hi have my fav roblox drip I made a bit ago https://t.co/hAM7UWhJuy,2022-04-16 02:15:29+00:00,,0,1,1,0,en,1515151865016692743,"[{'domain': {'id': '71', 'name': 'Video Game', 'description': 'A video game like Overwatch'}, 'entity': {'id': '1088118927580774400', 'name': 'Roblox', 'description': 'Roblox'}}]","{'urls': [{'start': 44, 'end': 67, 'url': 'https://t.co/hAM7UWhJuy', 'expanded_url': 'https://twitter.com/CloudburstSapph/status/1515151865016692743/photo/1', 'display_url': 'pic.twitter.com/hAM7UWhJuy', 'media_key': '3_1515151702957117440'}, {'start': 44, 'end': 67, 'url': 'https://t.co/hAM7UWhJuy', 'expanded_url': 'https://twitter.com/CloudburstSapph/status/1515151865016692743/photo/1', 'display_url': 'pic.twitter.com/hAM7UWhJuy', 'media_key': '3_1515151733789442055'}, {'start': 44, 'end': 67, 'url': 'https://t.co/hAM7UWhJuy', 'expanded_url': 'https://twitter.com/CloudburstSapph/status/1515151865016692743/photo/1', 'display_url': 'pic.twitter.com/hAM7UWhJuy', 'media_key': '3_1515151782455951361'}, {'start': 44, 'end': 67, 'url': 'https://t.co/hAM7UWhJuy', 'expanded_url': 'https://twitter.com/CloudburstSapph/status/1515151865016692743/photo/1', 'display_url': 'pic.twitter.com/hAM7UWhJuy', 'media_key': '3_1515151798926991360'}]}","{'media_keys': ['3_1515151702957117440', '3_1515151733789442055', '3_1515151782455951361', '3_1515151798926991360']}",False,,everyone,Twitter Web App
1515151789112410114,164856101,What the fuck is a roblox anyway,2022-04-16 02:15:11+00:00,,0,1,1,0,en,1515151789112410114,"[{'domain': {'id': '71', 'name': 'Video Game', 'description': 'A video game like Overwatch'}, 'entity': {'id': '1088118927580774400', 'name': 'Roblox', 'description': 'Roblox'}}]",,,False,,everyone,Twitter for iPhone
1515151789103886336,1245524250636603392,@plebcy @sonic_hedgehog @Roblox yeah well the enchinas in the new game do not know the way,2022-04-16 02:15:11+00:00,,0,0,1,0,en,1515011598812794883,"[{'domain': {'id': '71', 'name': 'Video Game', 'description': 'A video game like Overwatch'}, 'entity': {'id': '1088118927580774400', 'name': 'Roblox', 'description': 'Roblox'}}, {'domain': {'id': '130', 'name': 'Multimedia Franchise', 'description': ""Franchises which span multiple forms of media like 'Harry Potter'""}, 'entity': {'id': '993952643209773057', 'name': 'Sonic the Hedgehog', 'description': 'This entity includes all conversation about the franchise, as well as any individual installments in the series, if applicable.\t\t\t\n\nNOTE: Stopped annotating in the Video Game domain (71) on 11/15/19. Moving forward, this entity will annotate to Multimedia Franchise domain (130) only.'}}]","{'mentions': [{'start': 0, 'end': 7, 'username': 'plebcy', 'id': '1280632147343216641'}, {'start': 8, 'end': 23, 'username': 'sonic_hedgehog', 'id': '19609162'}, {'start': 24, 'end': 31, 'username': 'Roblox', 'id': '16745055'}]}",,False,,everyone,Twitter Web App
1515151779398361094,1090958155100631040,It’s her crying about her crying face on Roblox 🤣 https://t.co/KEY9smzXLP,2022-04-16 02:15:09+00:00,,0,0,1,0,en,1515151779398361094,"[{'domain': {'id': '10', 'name': 'Person', 'description': 'Named people in the world like Nelson Mandela'}, 'entity': {'id': '806561823407239169', 'name': 'Kanye West', 'description': 'Kanye West'}}, {'domain': {'id': '10', 'name': 'Person', 'description': 'Named people in the world like Nelson Mandela'}, 'entity': {'id': '806570121959383040', 'name': 'Kim Kardashian', 'description': 'Kim Kardashian'}}, {'domain': {'id': '54', 'name': 'Musician', 'description': 'A musician in the world, like Adele or Bob Dylan'}, 'entity': {'id': '806561823407239169', 'name': 'Kanye West', 'description': 'Kanye West'}}, {'domain': {'id': '55', 'name': 'Music Genre', 'description': 'A category for a musical style, like Pop, Rock, or Rap'}, 'entity': {'id': '810937888334487552', 'name': 'Rap', 'description': 'Hip-Hop/Rap'}}, {'domain': {'id': '58', 'name': 'Entertainment Personality', 'description': 'An entertainment personality in the world, like Anderson Cooper or Miranda Sings'}, 'entity': {'id': '806570121959383040', 'name': 'Kim Kardashian', 'description': 'Kim Kardashian'}}, {'domain': {'id': '71', 'name': 'Video Game', 'description': 'A video game like Overwatch'}, 'entity': {'id': '1088118927580774400', 'name': 'Roblox', 'description': 'Roblox'}}]","{'annotations': [{'start': 41, 'end': 46, 'probability': 0.6564, 'type': 'Product', 'normalized_text': 'Roblox'}], 'urls': [{'start': 50, 'end': 73, 'url': 'https://t.co/KEY9smzXLP', 'expanded_url': 'https://twitter.com/ayedocc/status/1514838191991361544', 'display_url': 'twitter.com/ayedocc/status…'}]}",,False,,everyone,Twitter for iPhone
1515151773937418241,1438546959757893637,"Last time I actually had my own oc was when I payed currency from a roblox game to have c0mmissi0ns done of 4 characters
3 of 4 who need an update because I don't love some of their outfits anymore
This was back in 2020 it's been 2 years",2022-04-16 02:15:07+00:00,,0,0,2,0,en,1515151773937418241,"[{'domain': {'id': '71', 'name': 'Video Game', 'description': 'A video game like Overwatch'}, 'entity': {'id': '1088118927580774400', 'name': 'Roblox', 'description': 'Roblox'}}]",,,False,,everyone,Twitter for Android
1515151763749359627,1272804578677882880,@jaytheghoul Roblox ain't doing shit to even ban her for her disgusting actions 💀,2022-04-16 02:15:05+00:00,,0,0,1,0,en,1515137061585657856,"[{'domain': {'id': '71', 'name': 'Video Game', 'description': 'A video game like Overwatch'}, 'entity': {'id': '1088118927580774400', 'name': 'Roblox', 'description': 'Roblox'}}]","{'mentions': [{'start': 0, 'end': 12, 'username': 'jaytheghoul', 'id': '754080014740643840'}]}",,False,,everyone,Twitter Web App
1515151734003445761,1317465680443297793,@okpxar es para lo unico que sirve luego juega roblox pero seguro le va a 2 fps,2022-04-16 02:14:58+00:00,,0,0,0,0,es,1515151203457503240,"[{'domain': {'id': '71', 'name': 'Video Game', 'description': 'A video game like Overwatch'}, 'entity': {'id': '1088118927580774400', 'name': 'Roblox', 'description': 'Roblox'}}]",,,False,,everyone,Twitter Web App
1515151718371454980,366650811,Do you Celebrate Easter?  #Roblox #RobloxDev #Easter #gamingmemes #YouTube,2022-04-16 02:14:54+00:00,,1,0,5,0,en,1515151718371454980,"[{'domain': {'id': '29', 'name': 'Events [Entity Service]', 'description': 'Entity Service related Events domain'}, 'entity': {'id': '1372917575357591554', 'name': 'Easter', 'description': 'this entity for all conversations for Easter all year '}}, {'domain': {'id': '71', 'name': 'Video Game', 'description': 'A video game like Overwatch'}, 'entity': {'id': '1088118927580774400', 'name': 'Roblox', 'description': 'Roblox'}}, {'domain': {'id': '119', 'name': 'Holiday', 'description': 'Holidays like Christmas or Halloween'}, 'entity': {'id': '1372917575357591554', 'name': 'Easter', 'description': 'this entity for all conversations for Easter all year '}}, {'domain': {'id': '165', 'name': 'Technology', 'description': 'for individual and types of technology, e.g., food technology, 3D printing'}, 'entity': {'id': '1196446161223028736', 'name': 'Social media'}}, {'domain': {'id': '46', 'name': 'Brand Category', 'description': 'Categories within Brand Verticals that narrow down the scope of Brands'}, 'entity': {'id': '781974596752842752', 'name': 'Services'}}, {'domain': {'id': '47', 'name': 'Brand', 'description': 'Brands and Companies'}, 'entity': {'id': '10029382357', 'name': 'YouTube'}}]","{'hashtags': [{'start': 26, 'end': 33, 'tag': 'Roblox'}, {'start': 34, 'end': 44, 'tag': 'RobloxDev'}, {'start': 45, 'end': 52, 'tag': 'Easter'}, {'start': 53, 'end': 65, 'tag': 'gamingmemes'}, {'start': 66, 'end': 74, 'tag': 'YouTube'}]}",{'poll_ids': ['1515151717062815745']},False,,everyone,Twitter for Android
1515151659189432322,1515046142127484930,"Okay who can make me a ROBLOX pfp of my avatar for free no charge, I need one for my Youtube channel Branding.",2022-04-16 02:14:40+00:00,,0,0,0,0,en,1515151659189432322,"[{'domain': {'id': '66', 'name': 'Interests and Hobbies Category', 'description': 'A grouping of interests and hobbies entities, like Novelty Food or Destinations'}, 'entity': {'id': '857879016971186177', 'name': 'Marketing', 'description': 'Marketing'}}, {'domain': {'id': '71', 'name': 'Video Game', 'description': 'A video game like Overwatch'}, 'entity': {'id': '1088118927580774400', 'name': 'Roblox', 'description': 'Roblox'}}, {'domain': {'id': '164', 'name': 'Fields of study', 'description': 'for all fields of study, e.g., futurology, microbiology '}, 'entity': {'id': '1278093262406815744', 'name': 'Fields of study'}}, {'domain': {'id': '165', 'name': 'Technology', 'description': 'for individual and types of technology, e.g., food technology, 3D printing'}, 'entity': {'id': '1196446161223028736', 'name': 'Social media'}}, {'domain': {'id': '46', 'name': 'Brand Category', 'description': 'Categories within Brand Verticals that narrow down the scope of Brands'}, 'entity': {'id': '781974596752842752', 'name': 'Services'}}, {'domain': {'id': '47', 'name': 'Brand', 'description': 'Brands and Companies'}, 'entity': {'id': '10029382357', 'name': 'YouTube'}}]","{'annotations': [{'start': 85, 'end': 91, 'probability': 0.8553, 'type': 'Product', 'normalized_text': 'Youtube'}]}",,False,,everyone,Twitter Web App
1515151644249444357,1514996320112717828,@MoSt3phGaming @Roblox Done good luck everyone else https://t.co/7f90txBu0X,2022-04-16 02:14:36+00:00,,0,0,0,0,en,1515000987752099844,"[{'domain': {'id': '71', 'name': 'Video Game', 'description': 'A video game like Overwatch'}, 'entity': {'id': '1088118927580774400', 'name': 'Roblox', 'description': 'Roblox'}}]","{'urls': [{'start': 52, 'end': 75, 'url': 'https://t.co/7f90txBu0X', 'expanded_url': 'https://twitter.com/jelly_dayla/status/1515151644249444357/photo/1', 'display_url': 'pic.twitter.com/7f90txBu0X', 'media_key': '3_1515151640898289677'}, {'start': 52, 'end': 75, 'url': 'https://t.co/7f90txBu0X', 'expanded_url': 'https://twitter.com/jelly_dayla/status/1515151644249444357/photo/1', 'display_url': 'pic.twitter.com/7f90txBu0X', 'media_key': '3_1515151640881504257'}], 'mentions': [{'start': 0, 'end': 14, 'username': 'MoSt3phGaming', 'id': '1246502061019029504'}, {'start': 15, 'end': 22, 'username': 'Roblox', 'id': '16745055'}]}","{'media_keys': ['3_1515151640898289677', '3_1515151640881504257']}",True,,everyone,Twitter for iPhone
1515151634644541445,1319390401820872707,"Giving legs for days? Yes, absolutely. (Featuring VVichelle + crimnaIs) #Roblox #FreesiaCafe https://t.co/ZvYjc3msfO",2022-04-16 02:14:34+00:00,,0,0,0,0,en,1515151634644541445,"[{'domain': {'id': '71', 'name': 'Video Game', 'description': 'A video game like Overwatch'}, 'entity': {'id': '1088118927580774400', 'name': 'Roblox', 'description': 'Roblox'}}]","{'urls': [{'start': 93, 'end': 116, 'url': 'https://t.co/ZvYjc3msfO', 'expanded_url': 'https://twitter.com/FreesiaCafeRBLX/status/1515151634644541445/photo/1', 'display_url': 'pic.twitter.com/ZvYjc3msfO', 'media_key': '3_1515151452536283139'}], 'hashtags': [{'start': 72, 'end': 79, 'tag': 'Roblox'}, {'start': 80, 'end': 92, 'tag': 'FreesiaCafe'}]}",{'media_keys': ['3_1515151452536283139']},False,,everyone,Twitter Web App
1515151631956025345,756956502317936640,@ayedocc Anybody else have a problem with @Roblox  allow ads like that on a kid game ?,2022-04-16 02:14:33+00:00,,0,0,0,0,en,1514838191991361544,"[{'domain': {'id': '71', 'name': 'Video Game', 'description': 'A video game like Overwatch'}, 'entity': {'id': '1088118927580774400', 'name': 'Roblox', 'description': 'Roblox'}}]","{'mentions': [{'start': 0, 'end': 8, 'username': 'ayedocc', 'id': '1470442246294155267'}, {'start': 42, 'end': 49, 'username': 'Roblox', 'id': '16745055'}]}",,False,,everyone,Twitter for iPhone
1515151628709642245,1511503180059791360,"@sukuwhale https://t.co/5DNN3b2AkA this is from dec, but the others on the list with infinite world is facebook, nvidia, nike via Roblox, and Microsoft, we are playing with the big boys all ready and we haven't even stepped on the field.",2022-04-16 02:14:33+00:00,,0,0,1,0,en,1515148137161273347,"[{'domain': {'id': '46', 'name': 'Brand Category', 'description': 'Categories within Brand Verticals that narrow down the scope of Brands'}, 'entity': {'id': '781974596752842752', 'name': 'Services'}}, {'domain': {'id': '47', 'name': 'Brand', 'description': 'Brands and Companies'}, 'entity': {'id': '10029202045', 'name': 'Facebook'}}, {'domain': {'id': '71', 'name': 'Video Game', 'description': 'A video game like Overwatch'}, 'entity': {'id': '1088118927580774400', 'name': 'Roblox', 'description': 'Roblox'}}, {'domain': {'id': '165', 'name': 'Technology', 'description': 'for individual and types of technology, e.g., food technology, 3D printing'}, 'entity': {'id': '1196446161223028736', 'name': 'Social media'}}, {'domain': {'id': '46', 'name': 'Brand Category', 'description': 'Categories within Brand Verticals that narrow down the scope of Brands'}, 'entity': {'id': '781974596752842752', 'name': 'Services'}}, {'domain': {'id': '46', 'name': 'Brand Category', 'description': 'Categories within Brand Verticals that narrow down the scope of Brands'}, 'entity': {'id': '781974597176467456', 'name': 'Sports/Outdoor'}}, {'domain': {'id': '47', 'name': 'Brand', 'description': 'Brands and Companies'}, 'entity': {'id': '10026482869', 'name': 'Nike'}}, {'domain': {'id': '47', 'name': 'Brand', 'description': 'Brands and Companies'}, 'entity': {'id': '10027232467', 'name': 'Microsoft'}}, {'domain': {'id': '47', 'name': 'Brand', 'description': 'Brands and Companies'}, 'entity': {'id': '10041873021', 'name': 'NVIDIA'}}, {'domain': {'id': '67', 'name': 'Interests and Hobbies', 'description': 'Interests, opinions, and behaviors of individuals, groups, or cultures; like Speciality Cooking or Theme Parks'}, 'entity': {'id': '839543390668673024', 'name': 'Fashion'}}, {'domain': {'id': '79', 'name': 'Video Game Hardware', 'description': 'Video Game Hardware'}, 'entity': {'id': '10041873021', 'name': 'NVIDIA'}}]","{'annotations': [{'start': 103, 'end': 110, 'probability': 0.5319, 'type': 'Product', 'normalized_text': 'facebook'}, {'start': 121, 'end': 124, 'probability': 0.6634, 'type': 'Product', 'normalized_text': 'nike'}, {'start': 130, 'end': 135, 'probability': 0.4359, 'type': 'Product', 'normalized_text': 'Roblox'}, {'start': 142, 'end': 150, 'probability': 0.6262, 'type': 'Organization', 'normalized_text': 'Microsoft'}], 'urls': [{'start': 11, 'end': 34, 'url': 'https://t.co/5DNN3b2AkA', 'expanded_url': 'https://www.nasdaq.com/articles/5-metaverse-stocks-to-watch-in-the-stock-market-today', 'display_url': 'nasdaq.com/articles/5-met…'}]}",,False,,everyone,Twitter Web App
1515151615543898112,1446055583547740161,#rh #roblox #royalehigh https://t.co/vNKwUnRd4g,2022-04-16 02:14:29+00:00,,0,0,0,0,qht,1515151615543898112,"[{'domain': {'id': '71', 'name': 'Video Game', 'description': 'A video game like Overwatch'}, 'entity': {'id': '1088118927580774400', 'name': 'Roblox', 'description': 'Roblox'}}, {'domain': {'id': '71', 'name': 'Video Game', 'description': 'A video game like Overwatch'}, 'entity': {'id': '1230882318224510978', 'name': 'Royale High'}}]","{'urls': [{'start': 24, 'end': 47, 'url': 'https://t.co/vNKwUnRd4g', 'expanded_url': 'https://twitter.com/cloudyyamilee/status/1514084223099224075', 'display_url': 'twitter.com/cloudyyamilee/…'}], 'hashtags': [{'start': 0, 'end': 3, 'tag': 'rh'}, {'start': 4, 'end': 11, 'tag': 'roblox'}, {'start': 12, 'end': 23, 'tag': 'royalehigh'}]}",,False,,everyone,Twitter for Android
1515151587081129985,1438223919119470592,@LAgurlzRBLX I Joined the Twitter and I wonder can you give me a better booth because I am trying to make it look better and also I want to verify this twitter account and my Roblox user is Loversman2010,2022-04-16 02:14:23+00:00,,0,0,0,0,en,1500173113933320195,"[{'domain': {'id': '71', 'name': 'Video Game', 'description': 'A video game like Overwatch'}, 'entity': {'id': '1088118927580774400', 'name': 'Roblox', 'description': 'Roblox'}}, {'domain': {'id': '46', 'name': 'Brand Category', 'description': 'Categories within Brand Verticals that narrow down the scope of Brands'}, 'entity': {'id': '781974596752842752', 'name': 'Services'}}, {'domain': {'id': '47', 'name': 'Brand', 'description': 'Brands and Companies'}, 'entity': {'id': '10045225402', 'name': 'Twitter'}}]","{'annotations': [{'start': 26, 'end': 32, 'probability': 0.6179, 'type': 'Product', 'normalized_text': 'Twitter'}, {'start': 152, 'end': 158, 'probability': 0.8369, 'type': 'Product', 'normalized_text': 'twitter'}, {'start': 175, 'end': 180, 'probability': 0.6812, 'type': 'Product', 'normalized_text': 'Roblox'}], 'mentions': [{'start': 0, 'end': 12, 'username': 'LAgurlzRBLX', 'id': '1257985458908299265'}]}",,False,,everyone,Twitter Web App
1515151586510749697,1457611601532571648,"🏆 We have just released our latest Encounters Update! 🏆

⭐ Booster Weekends ⭐
Booster weekends will include x2 Crystals gained, and a FREE TRIAL Champion to try out every weekend.

PLAY NOW!
https://t.co/2HWqdqGmdu https://t.co/aPRn2081il",2022-04-16 02:14:23+00:00,,3,11,58,1,en,1515151586510749697,[],"{'urls': [{'start': 191, 'end': 214, 'url': 'https://t.co/2HWqdqGmdu', 'expanded_url': 'https://www.roblox.com/games/7499189111/Encounters', 'display_url': 'roblox.com/games/74991891…', 'images': [{'url': 'https://pbs.twimg.com/news_img/1528262682180300800/hk9vaB8v?format=jpg&name=orig', 'width': 498, 'height': 280}, {'url': 'https://pbs.twimg.com/news_img/1528262682180300800/hk9vaB8v?format=jpg&name=150x150', 'width': 150, 'height': 150}], 'status': 200, 'title': '[2x 💎] Encounters', 'description': ""Check out [2x 💎] Encounters. It’s one of the millions of unique, user-generated 3D experiences created on Roblox. 👍 NEW CODE releasing at 225K LIKES! 👍 Welcome to Encounters! Do you like Super Smash Bros? On Roblox? Play CASUAL or COMPETITIVE in this Super Smash Bros style fighting game! Face off against enemies in a fast-paced last-man-standing combat arena! With a large amount of champions and infinite combo strategies, there will always be new things to explore. ⚔️ Choose Between 20 CHAMPIONS! 👥 Play with Friends 🏆 Climb the Competitive Ladder 🗝️ Unlock Cool Champions and Skins 💪 Practice Against Bots What's new? - New hub, 2v2s, social rewards Tags: super smash bros, fighting, combat, face off, arena, champions, competitive, casual, tournament Encounters is not affiliated in any way with Super Smash Bros."", 'unwound_url': 'https://www.roblox.com/games/7499189111/Encounters'}, {'start': 215, 'end': 238, 'url': 'https://t.co/aPRn2081il', 'expanded_url': 'https://twitter.com/EncountersGame/status/1515151586510749697/photo/1', 'display_url': 'pic.twitter.com/aPRn2081il', 'media_key': '3_1515151517363417089'}]}",{'media_keys': ['3_1515151517363417089']},False,,everyone,Twitter Web App
1515151538179776516,3161984932,@darkglim @Roblox @sonic_hedgehog i hope they witness ur message. bro they acting like if roblox isnt having the same crisis from october and its been since wednesday i had the maintenance crap,2022-04-16 02:14:11+00:00,,0,1,0,0,en,1515026236241850380,"[{'domain': {'id': '71', 'name': 'Video Game', 'description': 'A video game like Overwatch'}, 'entity': {'id': '1088118927580774400', 'name': 'Roblox', 'description': 'Roblox'}}, {'domain': {'id': '130', 'name': 'Multimedia Franchise', 'description': ""Franchises which span multiple forms of media like 'Harry Potter'""}, 'entity': {'id': '993952643209773057', 'name': 'Sonic the Hedgehog', 'description': 'This entity includes all conversation about the franchise, as well as any individual installments in the series, if applicable.\t\t\t\n\nNOTE: Stopped annotating in the Video Game domain (71) on 11/15/19. Moving forward, this entity will annotate to Multimedia Franchise domain (130) only.'}}]","{'mentions': [{'start': 0, 'end': 9, 'username': 'darkglim', 'id': '1424196341148917762'}, {'start': 10, 'end': 17, 'username': 'Roblox', 'id': '16745055'}, {'start': 18, 'end': 33, 'username': 'sonic_hedgehog', 'id': '19609162'}]}",,False,,everyone,Twitter Web App
1515151427231838209,1489185241767972873,@grego_gh Nice roblox avatar 👍,2022-04-16 02:13:45+00:00,,0,1,1,0,en,1515149893119193090,"[{'domain': {'id': '71', 'name': 'Video Game', 'description': 'A video game like Overwatch'}, 'entity': {'id': '1088118927580774400', 'name': 'Roblox', 'description': 'Roblox'}}]",,,False,,everyone,Twitter for iPhone
