tweetid,author_id,text,created_at,geo,retweets,replies,likes,quote_count,lang,conversation_id,context_annotations,entities,attachments,possibly_sensitive,withheld,reply_settings,source
1531895209881108483,1268947462942625797,"I seem to have some problems. I have basically finished making the #LayeredClothing model, and now it has entered the uv stage. However, I have some problems in making it in the studio, so I may need your help.@Roblox  @RBXNews_",2022-06-01 07:07:33+00:00,,1,3,17,0,en,1531895209881108483,"[{'domain': {'id': '71', 'name': 'Video Game', 'description': 'A video game like Overwatch'}, 'entity': {'id': '1088118927580774400', 'name': 'Roblox', 'description': 'Roblox'}}]","{'mentions': [{'start': 210, 'end': 217, 'username': 'Roblox', 'id': '16745055'}, {'start': 219, 'end': 228, 'username': 'RBXNews_', 'id': '1199001259904307207'}], 'hashtags': [{'start': 67, 'end': 83, 'tag': 'LayeredClothing'}]}",,False,,everyone,Twitter Web App
1531895207339466754,2165227813,"RT @RoboPlaysRoblo1: Who like to do Roblox development? #Roblox #RobloxDev #gamedev #developer IndieDevDog https://t.co/Qw6ZBIEkJ8

RT @RoboPlaysRoblo1: Who like to do Roblox development? #Roblox #RobloxDev #gamedev #developer

— 🐕 IndieDevDog 🐕 (@IndieDevDog) Jun 1, 2022

…",2022-06-01 07:07:33+00:00,,0,0,0,0,en,1531895207339466754,"[{'domain': {'id': '30', 'name': 'Entities [Entity Service]', 'description': 'Entity Service top level domain, every item that is in Entity Service should be in this domain'}, 'entity': {'id': '848920371311001600', 'name': 'Technology', 'description': 'Technology and computing'}}, {'domain': {'id': '66', 'name': 'Interests and Hobbies Category', 'description': 'A grouping of interests and hobbies entities, like Novelty Food or Destinations'}, 'entity': {'id': '848921413196984320', 'name': 'Computer programming', 'description': 'Computer programming'}}, {'domain': {'id': '71', 'name': 'Video Game', 'description': 'A video game like Overwatch'}, 'entity': {'id': '1088118927580774400', 'name': 'Roblox', 'description': 'Roblox'}}]","{'urls': [{'start': 107, 'end': 130, 'url': 'https://t.co/Qw6ZBIEkJ8', 'expanded_url': 'https://twitter.com/IndieDevDog/status/1531885780796334080', 'display_url': 'twitter.com/IndieDevDog/st…'}], 'mentions': [{'start': 247, 'end': 259, 'username': 'IndieDevDog', 'id': '720274838573621249'}], 'hashtags': [{'start': 56, 'end': 63, 'tag': 'Roblox'}, {'start': 64, 'end': 74, 'tag': 'RobloxDev'}, {'start': 75, 'end': 83, 'tag': 'gamedev'}, {'start': 84, 'end': 94, 'tag': 'developer'}, {'start': 188, 'end': 195, 'tag': 'Roblox'}, {'start': 196, 'end': 206, 'tag': 'RobloxDev'}, {'start': 207, 'end': 215, 'tag': 'gamedev'}, {'start': 216, 'end': 226, 'tag': 'developer'}]}",,False,,everyone,IFTTT
1531895140310081541,1396362989867999234,if y’all not gonna play roblox i’m gonna go read steve jarrington alpha omega metaverse nft,2022-06-01 07:07:17+00:00,,0,0,0,0,en,1531895140310081541,"[{'domain': {'id': '30', 'name': 'Entities [Entity Service]', 'description': 'Entity Service top level domain, every item that is in Entity Service should be in this domain'}, 'entity': {'id': '848920371311001600', 'name': 'Technology', 'description': 'Technology and computing'}}, {'domain': {'id': '71', 'name': 'Video Game', 'description': 'A video game like Overwatch'}, 'entity': {'id': '1088118927580774400', 'name': 'Roblox', 'description': 'Roblox'}}, {'domain': {'id': '165', 'name': 'Technology', 'description': 'for individual and types of technology, e.g., food technology, 3D printing'}, 'entity': {'id': '848920371311001600', 'name': 'Technology', 'description': 'Technology and computing'}}]",,,False,,everyone,Twitter for iPhone
1531895133322350592,1674463476,@t2zk_ @cickey1 @DragonPlayZ2233 @RobloxLeakers__ If it's not bad then say it in Roblox.,2022-06-01 07:07:15+00:00,,0,1,1,0,en,1531749028983078913,"[{'domain': {'id': '71', 'name': 'Video Game', 'description': 'A video game like Overwatch'}, 'entity': {'id': '1088118927580774400', 'name': 'Roblox', 'description': 'Roblox'}}]","{'annotations': [{'start': 81, 'end': 86, 'probability': 0.3726, 'type': 'Product', 'normalized_text': 'Roblox'}], 'mentions': [{'start': 0, 'end': 6, 'username': 't2zk_', 'id': '1442315083720232960'}, {'start': 7, 'end': 15, 'username': 'cickey1', 'id': '1354638943921180673'}, {'start': 16, 'end': 32, 'username': 'DragonPlayZ2233', 'id': '1458851500390699012'}, {'start': 33, 'end': 49, 'username': 'RobloxLeakers__', 'id': '1447909769206013962'}]}",,False,,everyone,Twitter for Android
1531895083003428864,1505595277251649550,"Hello everyone! I just opened a new DISCORD server for Emergency Response Liberty County on Roblox! Please join if you can I need more staff!
Link: https://t.co/wVSIZz9yPB",2022-06-01 07:07:03+00:00,,0,0,0,0,en,1531895083003428864,"[{'domain': {'id': '47', 'name': 'Brand', 'description': 'Brands and Companies'}, 'entity': {'id': '1168499224297656321', 'name': 'Discord'}}, {'domain': {'id': '71', 'name': 'Video Game', 'description': 'A video game like Overwatch'}, 'entity': {'id': '1088118927580774400', 'name': 'Roblox', 'description': 'Roblox'}}, {'domain': {'id': '165', 'name': 'Technology', 'description': 'for individual and types of technology, e.g., food technology, 3D printing'}, 'entity': {'id': '1196446161223028736', 'name': 'Social media'}}]","{'annotations': [{'start': 55, 'end': 87, 'probability': 0.4326, 'type': 'Organization', 'normalized_text': 'Emergency Response Liberty County'}, {'start': 92, 'end': 97, 'probability': 0.3077, 'type': 'Product', 'normalized_text': 'Roblox'}], 'urls': [{'start': 148, 'end': 171, 'url': 'https://t.co/wVSIZz9yPB', 'expanded_url': 'https://discord.gg/e3szFvRv', 'display_url': 'discord.gg/e3szFvRv'}]}",,False,,everyone,Twitter Web App
1531895048312606720,1520311788361121792,"@_jazzy_roblox_ Nahhh
You can stop playing it maybe 2-3 months then playing back again🫶🏻",2022-06-01 07:06:55+00:00,,0,0,0,0,en,1531848069062733824,[],"{'mentions': [{'start': 0, 'end': 15, 'username': '_jazzy_roblox_', 'id': '1441683833934385165'}]}",,False,,everyone,Twitter for iPhone
1531895044860706817,1427812520417382412,"Training Course Secret in the new @Roblox Piggy Outbreak Chapter..

#Roblox #RobloxDev @KreekCraft 

You are just like us https://t.co/jhIbjHTbsO",2022-06-01 07:06:54+00:00,,3,1,2,0,en,1531895044860706817,"[{'domain': {'id': '71', 'name': 'Video Game', 'description': 'A video game like Overwatch'}, 'entity': {'id': '1088118927580774400', 'name': 'Roblox', 'description': 'Roblox'}}]","{'urls': [{'start': 122, 'end': 145, 'url': 'https://t.co/jhIbjHTbsO', 'expanded_url': 'https://twitter.com/PlayingRBX/status/1531895044860706817/photo/1', 'display_url': 'pic.twitter.com/jhIbjHTbsO', 'media_key': '3_1531894857333379072'}], 'mentions': [{'start': 34, 'end': 41, 'username': 'Roblox', 'id': '16745055'}, {'start': 87, 'end': 98, 'username': 'KreekCraft', 'id': '3025674465'}], 'hashtags': [{'start': 68, 'end': 75, 'tag': 'Roblox'}, {'start': 76, 'end': 86, 'tag': 'RobloxDev'}]}",{'media_keys': ['3_1531894857333379072']},False,,everyone,Twitter Web App
1531895017396224001,1459811249793867776,"Gucci partners with Roblox to launch ‘Gucci Town’ metaverse world 

#CRYPTOCURRENCY  #DigitalCurrency #Currency #Finance #Bitcoin #Blockchain #Technology #Investing #DistributedLedgerTechnology #Business

https://t.co/zdgHEzpkw7",2022-06-01 07:06:48+00:00,,0,0,0,0,en,1531895017396224001,"[{'domain': {'id': '30', 'name': 'Entities [Entity Service]', 'description': 'Entity Service top level domain, every item that is in Entity Service should be in this domain'}, 'entity': {'id': '1007360414114435072', 'name': 'Bitcoin cryptocurrency', 'description': 'Bitcoin Cryptocurrency'}}, {'domain': {'id': '65', 'name': 'Interests and Hobbies Vertical', 'description': 'Top level interests and hobbies groupings, like Food or Travel'}, 'entity': {'id': '781974596148793345', 'name': 'Business & finance'}}, {'domain': {'id': '65', 'name': 'Interests and Hobbies Vertical', 'description': 'Top level interests and hobbies groupings, like Food or Travel'}, 'entity': {'id': '781974596148793345', 'name': 'Business & finance'}}, {'domain': {'id': '30', 'name': 'Entities [Entity Service]', 'description': 'Entity Service top level domain, every item that is in Entity Service should be in this domain'}, 'entity': {'id': '848920371311001600', 'name': 'Technology', 'description': 'Technology and computing'}}, {'domain': {'id': '66', 'name': 'Interests and Hobbies Category', 'description': 'A grouping of interests and hobbies entities, like Novelty Food or Destinations'}, 'entity': {'id': '847888632711061504', 'name': 'Personal finance', 'description': 'Personal finance'}}, {'domain': {'id': '30', 'name': 'Entities [Entity Service]', 'description': 'Entity Service top level domain, every item that is in Entity Service should be in this domain'}, 'entity': {'id': '857879456773357569', 'name': 'Technology', 'description': 'Technology'}}, {'domain': {'id': '66', 'name': 'Interests and Hobbies Category', 'description': 'A grouping of interests and hobbies entities, like Novelty Food or Destinations'}, 'entity': {'id': '913142676819648512', 'name': 'Cryptocurrencies', 'description': 'Cryptocurrency'}}, {'domain': {'id': '30', 'name': 'Entities [Entity Service]', 'description': 'Entity Service top level domain, every item that is in Entity Service should be in this domain'}, 'entity': {'id': '1001503516555337728', 'name': 'Blockchain', 'description': 'Blockchain'}}, {'domain': {'id': '30', 'name': 'Entities [Entity Service]', 'description': 'Entity Service top level domain, every item that is in Entity Service should be in this domain'}, 'entity': {'id': '847894794080722944', 'name': 'Retirement planning', 'description': 'Retirement planning'}}, {'domain': {'id': '67', 'name': 'Interests and Hobbies', 'description': 'Interests, opinions, and behaviors of individuals, groups, or cultures; like Speciality Cooking or Theme Parks'}, 'entity': {'id': '1037075567227494400', 'name': 'Saving and finance', 'description': 'Saving and Finance'}}, {'domain': {'id': '71', 'name': 'Video Game', 'description': 'A video game like Overwatch'}, 'entity': {'id': '1088118927580774400', 'name': 'Roblox', 'description': 'Roblox'}}, {'domain': {'id': '165', 'name': 'Technology', 'description': 'for individual and types of technology, e.g., food technology, 3D printing'}, 'entity': {'id': '848920371311001600', 'name': 'Technology', 'description': 'Technology and computing'}}, {'domain': {'id': '174', 'name': 'Digital Assets & Crypto', 'description': 'For cryptocurrency entities'}, 'entity': {'id': '1007360414114435072', 'name': 'Bitcoin cryptocurrency', 'description': 'Bitcoin Cryptocurrency'}}, {'domain': {'id': '65', 'name': 'Interests and Hobbies Vertical', 'description': 'Top level interests and hobbies groupings, like Food or Travel'}, 'entity': {'id': '781974596148793345', 'name': 'Business & finance'}}, {'domain': {'id': '66', 'name': 'Interests and Hobbies Category', 'description': 'A grouping of interests and hobbies entities, like Novelty Food or Destinations'}, 'entity': {'id': '847888632711061504', 'name': 'Personal finance', 'description': 'Personal finance'}}, {'domain': {'id': '66', 'name': 'Interests and Hobbies Category', 'description': 'A grouping of interests and hobbies entities, like Novelty Food or Destinations'}, 'entity': {'id': '857878402157629440', 'name': 'Investors and patents', 'description': 'Investors and patents'}}, {'domain': {'id': '30', 'name': 'Entities [Entity Service]', 'description': 'Entity Service top level domain, every item that is in Entity Service should be in this domain'}, 'entity': {'id': '857879456773357569', 'name': 'Technology', 'description': 'Technology'}}, {'domain': {'id': '67', 'name': 'Interests and Hobbies', 'description': 'Interests, opinions, and behaviors of individuals, groups, or cultures; like Speciality Cooking or Theme Parks'}, 'entity': {'id': '847894171268521984', 'name': 'Financial planning', 'description': 'Financial planning'}}, {'domain': {'id': '67', 'name': 'Interests and Hobbies', 'description': 'Interests, opinions, and behaviors of individuals, groups, or cultures; like Speciality Cooking or Theme Parks'}, 'entity': {'id': '847894353708068864', 'name': 'Investing', 'description': 'Investing'}}, {'domain': {'id': '29', 'name': 'Events [Entity Service]', 'description': 'Entity Service related Events domain'}, 'entity': {'id': '1508887104243179521', 'name': 'NYC Salesforce World Tour', 'description': 'Thank you for joining #SalesforceTour NYC! Stream more business-focused content on Salesforce+ for free: https://www.salesforce.com/plus '}}]","{'annotations': [{'start': 0, 'end': 4, 'probability': 0.6807, 'type': 'Organization', 'normalized_text': 'Gucci'}, {'start': 20, 'end': 25, 'probability': 0.3481, 'type': 'Organization', 'normalized_text': 'Roblox'}, {'start': 38, 'end': 47, 'probability': 0.683, 'type': 'Other', 'normalized_text': 'Gucci Town'}], 'urls': [{'start': 205, 'end': 228, 'url': 'https://t.co/zdgHEzpkw7', 'expanded_url': 'https://ift.tt/8GseDYE', 'display_url': 'ift.tt/8GseDYE'}], 'hashtags': [{'start': 68, 'end': 83, 'tag': 'CRYPTOCURRENCY'}, {'start': 85, 'end': 101, 'tag': 'DigitalCurrency'}, {'start': 102, 'end': 111, 'tag': 'Currency'}, {'start': 112, 'end': 120, 'tag': 'Finance'}, {'start': 121, 'end': 129, 'tag': 'Bitcoin'}, {'start': 130, 'end': 141, 'tag': 'Blockchain'}, {'start': 142, 'end': 153, 'tag': 'Technology'}, {'start': 154, 'end': 164, 'tag': 'Investing'}, {'start': 165, 'end': 193, 'tag': 'DistributedLedgerTechnology'}, {'start': 194, 'end': 203, 'tag': 'Business'}]}",,False,,everyone,IFTTT
1531894999805218818,1439984502789529600,AND I ALSO SAW A STUPID GACHA KID REFERENCING THE FUCKING ROBLOX HALLOWEEN VIDEO WITH SKID AND THE HATZGANG. IM SO FUCKING CLOSE TO LEAVING THIS GOD DAMN FANDOM.,2022-06-01 07:06:43+00:00,,0,3,8,0,en,1531894993656455169,"[{'domain': {'id': '29', 'name': 'Events [Entity Service]', 'description': 'Entity Service related Events domain'}, 'entity': {'id': '1301463450099482625', 'name': 'Halloween ', 'description': 'This entity includes all conversations for Halloween for all years'}}, {'domain': {'id': '71', 'name': 'Video Game', 'description': 'A video game like Overwatch'}, 'entity': {'id': '1088118927580774400', 'name': 'Roblox', 'description': 'Roblox'}}, {'domain': {'id': '119', 'name': 'Holiday', 'description': 'Holidays like Christmas or Halloween'}, 'entity': {'id': '1162465817822261248', 'name': 'Halloween 2019'}}]","{'annotations': [{'start': 65, 'end': 73, 'probability': 0.4607, 'type': 'Other', 'normalized_text': 'HALLOWEEN'}]}",,False,,everyone,Twitter for iPad
1531894890606612481,1485398837422342147,AY IF ANYONES SEES THIS AND HAS A ROBLOX ACCOUNT PLEASE USE THIS LINK TO GET ME ROBUX AND U CAN GET SOME AS WELL https://t.co/1HNcl1E9LN,2022-06-01 07:06:17+00:00,,0,0,0,0,en,1531894890606612481,"[{'domain': {'id': '71', 'name': 'Video Game', 'description': 'A video game like Overwatch'}, 'entity': {'id': '1088118927580774400', 'name': 'Roblox', 'description': 'Roblox'}}]","{'urls': [{'start': 113, 'end': 136, 'url': 'https://t.co/1HNcl1E9LN', 'expanded_url': 'https://blox.land/ref/83604133-99d6-a81c-274c-96acd6373f72', 'display_url': 'blox.land/ref/83604133-9…', 'images': [{'url': 'https://pbs.twimg.com/news_img/1538834127176220672/J9h2I-XT?format=png&name=orig', 'width': 420, 'height': 420}, {'url': 'https://pbs.twimg.com/news_img/1538834127176220672/J9h2I-XT?format=png&name=150x150', 'width': 150, 'height': 150}], 'status': 200, 'title': 'Earn R$! - Blox.Land', 'description': 'Earn Free ROBUX with ease!', 'unwound_url': 'https://blox.land/'}]}",,False,,everyone,Twitter Web App
1531894735463297025,903185178,"@hexbugmuse @RobloxTrackers @Bloxy_News Damn it's almost like, they have different people focusing on different parts of Roblox and not just one small team doing it all",2022-06-01 07:05:40+00:00,,0,1,2,0,en,1531763557079056384,"[{'domain': {'id': '71', 'name': 'Video Game', 'description': 'A video game like Overwatch'}, 'entity': {'id': '1088118927580774400', 'name': 'Roblox', 'description': 'Roblox'}}]","{'annotations': [{'start': 121, 'end': 126, 'probability': 0.4536, 'type': 'Product', 'normalized_text': 'Roblox'}], 'mentions': [{'start': 0, 'end': 11, 'username': 'hexbugmuse', 'id': '1369508985800450048'}, {'start': 12, 'end': 27, 'username': 'RobloxTrackers', 'id': '1399890391235694592'}, {'start': 28, 'end': 39, 'username': 'Bloxy_News', 'id': '901894986836279296'}]}",,False,,everyone,Twitter for Android
1531894732296556545,1432251330811219970,MonaLisa #monalisa #pixelart #roblox made with (starving artists (DONATION GAME)) on roblox https://t.co/W1p9YvnQT4,2022-06-01 07:05:40+00:00,,7,1,31,0,en,1531894732296556545,"[{'domain': {'id': '3', 'name': 'TV Shows', 'description': 'Television shows from around the world'}, 'entity': {'id': '10034758160', 'name': 'Hora um', 'description': 'Veja os assuntos mais importantes do Brasil e do mundo durante as primeiras horas da manhã. Voltado para o público que acorda cedo, o telejornal conta ainda com a participação de correspondentes internacionais.'}}, {'domain': {'id': '4', 'name': 'TV Episodes', 'description': 'Television show episodes'}, 'entity': {'id': '1527236528887369728', 'name': 'Hora 1', 'description': 'Veja os assuntos mais importantes do Brasil e do mundo durante as primeiras horas da manhã. Voltado para o público que acorda cedo, o telejornal conta ainda com a participação de correspondentes internacionais.'}}, {'domain': {'id': '29', 'name': 'Events [Entity Service]', 'description': 'Entity Service related Events domain'}, 'entity': {'id': '1527236528887369728', 'name': 'Hora 1', 'description': 'Veja os assuntos mais importantes do Brasil e do mundo durante as primeiras horas da manhã. Voltado para o público que acorda cedo, o telejornal conta ainda com a participação de correspondentes internacionais.'}}, {'domain': {'id': '71', 'name': 'Video Game', 'description': 'A video game like Overwatch'}, 'entity': {'id': '1088118927580774400', 'name': 'Roblox', 'description': 'Roblox'}}]","{'urls': [{'start': 92, 'end': 115, 'url': 'https://t.co/W1p9YvnQT4', 'expanded_url': 'https://twitter.com/Smo1Snai1/status/1531894732296556545/photo/1', 'display_url': 'pic.twitter.com/W1p9YvnQT4', 'media_key': '3_1531894730266513409'}], 'hashtags': [{'start': 9, 'end': 18, 'tag': 'monalisa'}, {'start': 19, 'end': 28, 'tag': 'pixelart'}, {'start': 29, 'end': 36, 'tag': 'roblox'}]}",{'media_keys': ['3_1531894730266513409']},False,,everyone,Twitter for Android
1531894727674843136,15913455,GUCCIがバーチャルスペース「グッチタウン」をオンラインゲームのプラットフォーム「ロブロックス（Roblox）内にオープン。https://t.co/bVZHwaYA1W https://t.co/hW9szMSTOW,2022-06-01 07:05:38+00:00,,5,0,60,0,ja,1531894727674843136,"[{'domain': {'id': '71', 'name': 'Video Game', 'description': 'A video game like Overwatch'}, 'entity': {'id': '1088118927580774400', 'name': 'Roblox', 'description': 'Roblox'}}]","{'annotations': [{'start': 0, 'end': 4, 'probability': 0.5955, 'type': 'Organization', 'normalized_text': 'GUCCI'}, {'start': 16, 'end': 21, 'probability': 0.4379, 'type': 'Product', 'normalized_text': 'グッチタウン'}], 'urls': [{'start': 63, 'end': 86, 'url': 'https://t.co/bVZHwaYA1W', 'expanded_url': 'https://www.fashionsnap.com/article/2022-05-31/guccitown-roblox/', 'display_url': 'fashionsnap.com/article/2022-0…'}, {'start': 87, 'end': 110, 'url': 'https://t.co/hW9szMSTOW', 'expanded_url': 'https://twitter.com/fashionsnap/status/1531894727674843136/photo/1', 'display_url': 'pic.twitter.com/hW9szMSTOW', 'media_key': '3_1531894716601896961'}, {'start': 87, 'end': 110, 'url': 'https://t.co/hW9szMSTOW', 'expanded_url': 'https://twitter.com/fashionsnap/status/1531894727674843136/photo/1', 'display_url': 'pic.twitter.com/hW9szMSTOW', 'media_key': '3_1531894722582937600'}]}","{'media_keys': ['3_1531894716601896961', '3_1531894722582937600']}",False,,everyone,TweetDeck
1531894697039233024,1352288636432072704,"Another one 😀
#roblox #robloxart #robloxgfx #PFP https://t.co/a1A8Nuvo1I",2022-06-01 07:05:31+00:00,,4,0,3,0,en,1531894697039233024,"[{'domain': {'id': '71', 'name': 'Video Game', 'description': 'A video game like Overwatch'}, 'entity': {'id': '1088118927580774400', 'name': 'Roblox', 'description': 'Roblox'}}]","{'urls': [{'start': 49, 'end': 72, 'url': 'https://t.co/a1A8Nuvo1I', 'expanded_url': 'https://twitter.com/FizzledT/status/1531894697039233024/photo/1', 'display_url': 'pic.twitter.com/a1A8Nuvo1I', 'media_key': '3_1531894523441184769'}], 'hashtags': [{'start': 14, 'end': 21, 'tag': 'roblox'}, {'start': 22, 'end': 32, 'tag': 'robloxart'}, {'start': 33, 'end': 43, 'tag': 'robloxgfx'}, {'start': 44, 'end': 48, 'tag': 'PFP'}]}",{'media_keys': ['3_1531894523441184769']},False,,everyone,Twitter Web App
1531894533239279617,713208007522279425,"New back accessory
SharkBite: Web Launcher
https://t.co/j6WBVgrikW",2022-06-01 07:04:52+00:00,,3,14,85,0,en,1531894533239279617,[],"{'urls': [{'start': 43, 'end': 66, 'url': 'https://t.co/j6WBVgrikW', 'expanded_url': 'https://www.roblox.com/catalog/8151825493/SharkBite-Web-Launcher?rbxp=48103520', 'display_url': 'roblox.com/catalog/815182…'}]}",,False,,everyone,Roblox+ Notifier
1531894532501032960,713208007522279425,"New hat
Saguaro Hat
https://t.co/2kS3P6kpZ5",2022-06-01 07:04:52+00:00,,6,19,115,3,en,1531894532501032960,[],"{'urls': [{'start': 20, 'end': 43, 'url': 'https://t.co/2kS3P6kpZ5', 'expanded_url': 'https://www.roblox.com/catalog/9723686413/Saguaro-Hat?rbxp=48103520', 'display_url': 'roblox.com/catalog/972368…'}]}",,False,,everyone,Roblox+ Notifier
1531894501601443842,1497125279503839234,@SharkBloxYT it looks like the roblox studio toolbox has been updated. https://t.co/W8H20Ahgh7,2022-06-01 07:04:45+00:00,,0,1,0,0,en,1531894501601443842,"[{'domain': {'id': '71', 'name': 'Video Game', 'description': 'A video game like Overwatch'}, 'entity': {'id': '1088118927580774400', 'name': 'Roblox', 'description': 'Roblox'}}]","{'urls': [{'start': 71, 'end': 94, 'url': 'https://t.co/W8H20Ahgh7', 'expanded_url': 'https://twitter.com/MPlays1000/status/1531894501601443842/photo/1', 'display_url': 'pic.twitter.com/W8H20Ahgh7', 'media_key': '3_1531894171849457664'}], 'mentions': [{'start': 0, 'end': 12, 'username': 'SharkBloxYT', 'id': '985359254184964096'}]}",{'media_keys': ['3_1531894171849457664']},False,,everyone,Twitter Web App
1531894450766721025,1434188842941173768,Hey if ur @haz3m_  look I’m still confused on which idea ur using if it’s me my user would be The_overlordplays in roblox /The_overlordplays#8132 in discord,2022-06-01 07:04:32+00:00,,0,0,0,0,en,1531894450766721025,"[{'domain': {'id': '47', 'name': 'Brand', 'description': 'Brands and Companies'}, 'entity': {'id': '1168499224297656321', 'name': 'Discord'}}, {'domain': {'id': '71', 'name': 'Video Game', 'description': 'A video game like Overwatch'}, 'entity': {'id': '1088118927580774400', 'name': 'Roblox', 'description': 'Roblox'}}, {'domain': {'id': '165', 'name': 'Technology', 'description': 'for individual and types of technology, e.g., food technology, 3D printing'}, 'entity': {'id': '1196446161223028736', 'name': 'Social media'}}]","{'mentions': [{'start': 10, 'end': 17, 'username': 'haz3m_', 'id': '1201893465795256325'}]}",,False,,everyone,Twitter for iPhone
1531894423046475776,866762544,"roblox ports of it would kick you from the server with the caption ""its morbin time""",2022-06-01 07:04:26+00:00,,0,1,13,0,en,1531893952353382400,"[{'domain': {'id': '71', 'name': 'Video Game', 'description': 'A video game like Overwatch'}, 'entity': {'id': '1088118927580774400', 'name': 'Roblox', 'description': 'Roblox'}}, {'domain': {'id': '86', 'name': 'Movie', 'description': 'A film like Rogue One: A Star Wars Story'}, 'entity': {'id': '1368921194460631044', 'name': 'Morbius', 'description': 'Morbius is scheduled to be released in the United States on January 21, 2022, delayed from an initial July 2020 date due to the COVID-19 pandemic.\nIt will be released on 4/1/22 in Japan.'}}, {'domain': {'id': '130', 'name': 'Multimedia Franchise', 'description': ""Franchises which span multiple forms of media like 'Harry Potter'""}, 'entity': {'id': '1002576732971384832', 'name': 'Marvel Universe', 'description': 'This entity includes all conversation about the franchise, as well as any individual installments in the series, if applicable.\t\t\t'}}, {'domain': {'id': '87', 'name': 'Movie Genre', 'description': 'A movie genre like Action'}, 'entity': {'id': '856977093191647233', 'name': 'Sci-fi & fantasy films', 'description': 'Sci-fi and fantasy'}}]",,,False,,everyone,Twitter Web App
1531894366431846400,1394147143242371074,Have you ever thought about how fun it is to piss off little kids in Roblox or Fortnite? My happy weekdays.,2022-06-01 07:04:12+00:00,,0,0,4,0,en,1531894366431846400,"[{'domain': {'id': '71', 'name': 'Video Game', 'description': 'A video game like Overwatch'}, 'entity': {'id': '974285387987169280', 'name': 'Fortnite', 'description': 'This entity includes all conversation about the franchise, as well as any individual installments in the series, if applicable.\t\t\t'}}, {'domain': {'id': '71', 'name': 'Video Game', 'description': 'A video game like Overwatch'}, 'entity': {'id': '1088118927580774400', 'name': 'Roblox', 'description': 'Roblox'}}]","{'annotations': [{'start': 69, 'end': 74, 'probability': 0.3996, 'type': 'Product', 'normalized_text': 'Roblox'}, {'start': 79, 'end': 86, 'probability': 0.3087, 'type': 'Person', 'normalized_text': 'Fortnite'}]}",,False,,everyone,Twitter for Android
