tweetid,author_id,text,created_at,geo,retweets,replies,likes,quote_count,lang,conversation_id,context_annotations,entities,attachments,possibly_sensitive,withheld,reply_settings,source
1521480820074156034,1477903351165632512,@alllinlife i don't understand this skz roblox thing are they going to be playing on roblox or what,2022-05-03 13:24:29+00:00,,0,1,0,0,en,1521477696840212481,"[{'domain': {'id': '71', 'name': 'Video Game', 'description': 'A video game like Overwatch'}, 'entity': {'id': '1088118927580774400', 'name': 'Roblox', 'description': 'Roblox'}}]","{'mentions': [{'start': 0, 'end': 11, 'username': 'alllinlife', 'id': '1493242654360055809'}]}",,False,,everyone,Twitter for Android
1521480813912674305,1392751646979940354,Spotify Enters the Metaverse with Official Launch of Virtual Presence on Roblox https://t.co/cRKWe0U3zy,2022-05-03 13:24:28+00:00,,0,0,0,0,en,1521480813912674305,"[{'domain': {'id': '45', 'name': 'Brand Vertical', 'description': 'Top level entities that describe a Brands industry'}, 'entity': {'id': '781974597310615553', 'name': 'Entertainment'}}, {'domain': {'id': '46', 'name': 'Brand Category', 'description': 'Categories within Brand Verticals that narrow down the scope of Brands'}, 'entity': {'id': '781974597222535168', 'name': 'Online Services'}}, {'domain': {'id': '47', 'name': 'Brand', 'description': 'Brands and Companies'}, 'entity': {'id': '10040276669', 'name': 'Spotify'}}, {'domain': {'id': '30', 'name': 'Entities [Entity Service]', 'description': 'Entity Service top level domain, every item that is in Entity Service should be in this domain'}, 'entity': {'id': '848920371311001600', 'name': 'Technology', 'description': 'Technology and computing'}}, {'domain': {'id': '67', 'name': 'Interests and Hobbies', 'description': 'Interests, opinions, and behaviors of individuals, groups, or cultures; like Speciality Cooking or Theme Parks'}, 'entity': {'id': '1288826829634035714', 'name': 'Backstage'}}, {'domain': {'id': '71', 'name': 'Video Game', 'description': 'A video game like Overwatch'}, 'entity': {'id': '1088118927580774400', 'name': 'Roblox', 'description': 'Roblox'}}, {'domain': {'id': '165', 'name': 'Technology', 'description': 'for individual and types of technology, e.g., food technology, 3D printing'}, 'entity': {'id': '848920371311001600', 'name': 'Technology', 'description': 'Technology and computing'}}]","{'annotations': [{'start': 0, 'end': 6, 'probability': 0.471, 'type': 'Organization', 'normalized_text': 'Spotify'}, {'start': 73, 'end': 78, 'probability': 0.3211, 'type': 'Product', 'normalized_text': 'Roblox'}], 'urls': [{'start': 80, 'end': 103, 'url': 'https://t.co/cRKWe0U3zy', 'expanded_url': 'https://app.cupidshealth.com/spotify-enters-the-metaverse-with-official-launch-of-virtual-presence-on-roblox/', 'display_url': 'app.cupidshealth.com/spotify-enters…'}]}",,False,,everyone,WordPress.com
1521480804496736256,1467388592859217920,@Elowinixxa UR SHITTING TEARS?!?! SHIT IPHONES AND FREE ROBLOX GIFT CARDS INSTEAD 😇😇,2022-05-03 13:24:26+00:00,,0,1,1,0,en,1521479889613844480,"[{'domain': {'id': '71', 'name': 'Video Game', 'description': 'A video game like Overwatch'}, 'entity': {'id': '1088118927580774400', 'name': 'Roblox', 'description': 'Roblox'}}, {'domain': {'id': '47', 'name': 'Brand', 'description': 'Brands and Companies'}, 'entity': {'id': '10026364281', 'name': 'Apple'}}, {'domain': {'id': '48', 'name': 'Product', 'description': 'Products created by Brands.  Examples: Ford Explorer, Apple iPhone.'}, 'entity': {'id': '10024011738', 'name': 'Apple - iPhone'}}, {'domain': {'id': '30', 'name': 'Entities [Entity Service]', 'description': 'Entity Service top level domain, every item that is in Entity Service should be in this domain'}, 'entity': {'id': '848920371311001600', 'name': 'Technology', 'description': 'Technology and computing'}}, {'domain': {'id': '30', 'name': 'Entities [Entity Service]', 'description': 'Entity Service top level domain, every item that is in Entity Service should be in this domain'}, 'entity': {'id': '848985956778561538', 'name': 'Mobile', 'description': 'Mobile'}}]","{'mentions': [{'start': 0, 'end': 11, 'username': 'Elowinixxa', 'id': '1506713313081794566'}], 'annotations': [{'start': 39, 'end': 45, 'probability': 0.4035, 'type': 'Organization', 'normalized_text': 'IPHONES'}, {'start': 56, 'end': 61, 'probability': 0.5345, 'type': 'Product', 'normalized_text': 'ROBLOX'}]}",,False,,everyone,Twitter for Android
1521480804118892544,1249492971428278273,nunca jugué roblox,2022-05-03 13:24:26+00:00,,0,0,0,0,ca,1521480804118892544,"[{'domain': {'id': '71', 'name': 'Video Game', 'description': 'A video game like Overwatch'}, 'entity': {'id': '1088118927580774400', 'name': 'Roblox', 'description': 'Roblox'}}]",,,False,,everyone,Twitter for Android
1521480802919677953,1345272449831641088,no way i'm going to play roblox i'm half 50 yrs old but skz woooh gonna tell my little sis to attend their concert there https://t.co/utAJiJ8Zeq,2022-05-03 13:24:25+00:00,,0,0,1,0,en,1521480802919677953,"[{'domain': {'id': '10', 'name': 'Person', 'description': 'Named people in the world like Nelson Mandela'}, 'entity': {'id': '1062427352318173185', 'name': 'Stray Kids', 'description': 'Stray Kids (스트레이 키즈)'}}, {'domain': {'id': '45', 'name': 'Brand Vertical', 'description': 'Top level entities that describe a Brands industry'}, 'entity': {'id': '781974597310615553', 'name': 'Entertainment'}}, {'domain': {'id': '46', 'name': 'Brand Category', 'description': 'Categories within Brand Verticals that narrow down the scope of Brands'}, 'entity': {'id': '781974597222535168', 'name': 'Online Services'}}, {'domain': {'id': '47', 'name': 'Brand', 'description': 'Brands and Companies'}, 'entity': {'id': '10040276669', 'name': 'Spotify'}}, {'domain': {'id': '54', 'name': 'Musician', 'description': 'A musician in the world, like Adele or Bob Dylan'}, 'entity': {'id': '1062427352318173185', 'name': 'Stray Kids', 'description': 'Stray Kids (스트레이 키즈)'}}, {'domain': {'id': '55', 'name': 'Music Genre', 'description': 'A category for a musical style, like Pop, Rock, or Rap'}, 'entity': {'id': '888105153038958593', 'name': 'K-pop', 'description': 'K-Pop'}}, {'domain': {'id': '30', 'name': 'Entities [Entity Service]', 'description': 'Entity Service top level domain, every item that is in Entity Service should be in this domain'}, 'entity': {'id': '848920371311001600', 'name': 'Technology', 'description': 'Technology and computing'}}, {'domain': {'id': '67', 'name': 'Interests and Hobbies', 'description': 'Interests, opinions, and behaviors of individuals, groups, or cultures; like Speciality Cooking or Theme Parks'}, 'entity': {'id': '1288826829634035714', 'name': 'Backstage'}}, {'domain': {'id': '71', 'name': 'Video Game', 'description': 'A video game like Overwatch'}, 'entity': {'id': '1088118927580774400', 'name': 'Roblox', 'description': 'Roblox'}}, {'domain': {'id': '165', 'name': 'Technology', 'description': 'for individual and types of technology, e.g., food technology, 3D printing'}, 'entity': {'id': '848920371311001600', 'name': 'Technology', 'description': 'Technology and computing'}}]","{'urls': [{'start': 121, 'end': 144, 'url': 'https://t.co/utAJiJ8Zeq', 'expanded_url': 'https://twitter.com/MusicWeek/status/1521470080462295043', 'display_url': 'twitter.com/MusicWeek/stat…'}]}",,False,,everyone,Twitter for Android
1521480802101772288,1519202766534574080,i want the roblox sword even if it’s sh*t LMAO,2022-05-03 13:24:25+00:00,,0,0,0,0,en,1521480802101772288,"[{'domain': {'id': '71', 'name': 'Video Game', 'description': 'A video game like Overwatch'}, 'entity': {'id': '1088118927580774400', 'name': 'Roblox', 'description': 'Roblox'}}]",,,False,,everyone,Twitter for iPhone
1521480797949210624,1462374446023557126,esco da twitter torno con gli skz su roblox RAGAZZI???,2022-05-03 13:24:24+00:00,,0,0,0,0,it,1521480797949210624,"[{'domain': {'id': '71', 'name': 'Video Game', 'description': 'A video game like Overwatch'}, 'entity': {'id': '1088118927580774400', 'name': 'Roblox', 'description': 'Roblox'}}, {'domain': {'id': '46', 'name': 'Brand Category', 'description': 'Categories within Brand Verticals that narrow down the scope of Brands'}, 'entity': {'id': '781974596752842752', 'name': 'Services'}}, {'domain': {'id': '47', 'name': 'Brand', 'description': 'Brands and Companies'}, 'entity': {'id': '10045225402', 'name': 'Twitter'}}]",,,False,,everyone,Twitter for Android
1521480797601284097,1419363150772670465,bruh lele pons and now roblox STAYVILLE ISNT REAL,2022-05-03 13:24:24+00:00,,0,1,1,0,en,1521480797601284097,"[{'domain': {'id': '10', 'name': 'Person', 'description': 'Named people in the world like Nelson Mandela'}, 'entity': {'id': '885933793323892737', 'name': 'Lele Pons', 'description': 'Lele Pons'}}, {'domain': {'id': '71', 'name': 'Video Game', 'description': 'A video game like Overwatch'}, 'entity': {'id': '1088118927580774400', 'name': 'Roblox', 'description': 'Roblox'}}, {'domain': {'id': '120', 'name': 'Digital Creator', 'description': 'Influencers who create content on digital platforms'}, 'entity': {'id': '885933793323892737', 'name': 'Lele Pons', 'description': 'Lele Pons'}}]","{'annotations': [{'start': 5, 'end': 13, 'probability': 0.8144, 'type': 'Person', 'normalized_text': 'lele pons'}]}",,False,,everyone,Twitter for iPhone
1521480785760559109,1301378045031276544,i love him calling unforged the roblox sword &lt;3 #VoxPopuLIVE,2022-05-03 13:24:21+00:00,,0,0,0,0,en,1521480785760559109,"[{'domain': {'id': '71', 'name': 'Video Game', 'description': 'A video game like Overwatch'}, 'entity': {'id': '1088118927580774400', 'name': 'Roblox', 'description': 'Roblox'}}]","{'hashtags': [{'start': 51, 'end': 63, 'tag': 'VoxPopuLIVE'}]}",,False,,everyone,Twitter Web App
1521480778693107714,1332421690719162369,@movianthe @MusicWeek @Roblox @Stray_Kids @miyaohyeah @SpotifyUK @Spotify I feel you!! Ahhah,2022-05-03 13:24:20+00:00,,0,0,3,0,en,1521470080462295043,"[{'domain': {'id': '10', 'name': 'Person', 'description': 'Named people in the world like Nelson Mandela'}, 'entity': {'id': '1062427352318173185', 'name': 'Stray Kids', 'description': 'Stray Kids (스트레이 키즈)'}}, {'domain': {'id': '45', 'name': 'Brand Vertical', 'description': 'Top level entities that describe a Brands industry'}, 'entity': {'id': '781974597310615553', 'name': 'Entertainment'}}, {'domain': {'id': '46', 'name': 'Brand Category', 'description': 'Categories within Brand Verticals that narrow down the scope of Brands'}, 'entity': {'id': '781974597222535168', 'name': 'Online Services'}}, {'domain': {'id': '47', 'name': 'Brand', 'description': 'Brands and Companies'}, 'entity': {'id': '10040276669', 'name': 'Spotify'}}, {'domain': {'id': '54', 'name': 'Musician', 'description': 'A musician in the world, like Adele or Bob Dylan'}, 'entity': {'id': '1062427352318173185', 'name': 'Stray Kids', 'description': 'Stray Kids (스트레이 키즈)'}}, {'domain': {'id': '55', 'name': 'Music Genre', 'description': 'A category for a musical style, like Pop, Rock, or Rap'}, 'entity': {'id': '888105153038958593', 'name': 'K-pop', 'description': 'K-Pop'}}, {'domain': {'id': '67', 'name': 'Interests and Hobbies', 'description': 'Interests, opinions, and behaviors of individuals, groups, or cultures; like Speciality Cooking or Theme Parks'}, 'entity': {'id': '1288826829634035714', 'name': 'Backstage'}}, {'domain': {'id': '71', 'name': 'Video Game', 'description': 'A video game like Overwatch'}, 'entity': {'id': '1088118927580774400', 'name': 'Roblox', 'description': 'Roblox'}}]","{'mentions': [{'start': 0, 'end': 10, 'username': 'movianthe', 'id': '1167383573348999169'}, {'start': 11, 'end': 21, 'username': 'MusicWeek', 'id': '20234637'}, {'start': 22, 'end': 29, 'username': 'Roblox', 'id': '16745055'}, {'start': 30, 'end': 41, 'username': 'Stray_Kids', 'id': '859297966581891072'}, {'start': 42, 'end': 53, 'username': 'miyaohyeah', 'id': '2347170860'}, {'start': 54, 'end': 64, 'username': 'SpotifyUK', 'id': '479315245'}, {'start': 65, 'end': 73, 'username': 'Spotify', 'id': '17230018'}]}",,False,,everyone,Twitter for Android
1521480776499482624,1254806533541490689,@ICareWoozi @hwangsamericano There's no need to pay for roblox it's entirely free,2022-05-03 13:24:19+00:00,,0,0,0,0,en,1521478117478797319,"[{'domain': {'id': '71', 'name': 'Video Game', 'description': 'A video game like Overwatch'}, 'entity': {'id': '1088118927580774400', 'name': 'Roblox', 'description': 'Roblox'}}]","{'mentions': [{'start': 0, 'end': 11, 'username': 'ICareWoozi', 'id': '1344241664232046595'}, {'start': 12, 'end': 28, 'username': 'hwangsamericano', 'id': '1165585287541428226'}]}",,False,,everyone,Twitter for Android
1521480764982194178,1430231933926051840,@Itz_NotRocky @RobuxRetweeter 300 robux w tax so i can buy bubbly and a hairclip ^_________^ https://t.co/wLzlnn1dPS https://t.co/UW5eMqSkV2,2022-05-03 13:24:16+00:00,,0,0,0,0,en,1520495034797371392,[],"{'mentions': [{'start': 0, 'end': 13, 'username': 'Itz_NotRocky', 'id': '1454582494876119045'}, {'start': 14, 'end': 29, 'username': 'RobuxRetweeter', 'id': '1375133695405867008'}], 'urls': [{'start': 93, 'end': 116, 'url': 'https://t.co/wLzlnn1dPS', 'expanded_url': 'https://www.roblox.com/game-pass/40304714/unnamed', 'display_url': 'roblox.com/game-pass/4030…'}, {'start': 117, 'end': 140, 'url': 'https://t.co/UW5eMqSkV2', 'expanded_url': 'https://twitter.com/poizewn/status/1521480764982194178/photo/1', 'display_url': 'pic.twitter.com/UW5eMqSkV2', 'media_key': '3_1521480762201362432'}]}",{'media_keys': ['3_1521480762201362432']},False,,everyone,Twitter for Android
1521480764336050177,2427464380,"wait what

Spotify becomes first music streamer to launch on Roblox https://t.co/x08oCtzcVO via @techcrunch",2022-05-03 13:24:16+00:00,,0,0,0,0,en,1521480764336050177,"[{'domain': {'id': '45', 'name': 'Brand Vertical', 'description': 'Top level entities that describe a Brands industry'}, 'entity': {'id': '781974597310615553', 'name': 'Entertainment'}}, {'domain': {'id': '46', 'name': 'Brand Category', 'description': 'Categories within Brand Verticals that narrow down the scope of Brands'}, 'entity': {'id': '781974596157181956', 'name': 'Online Site'}}, {'domain': {'id': '46', 'name': 'Brand Category', 'description': 'Categories within Brand Verticals that narrow down the scope of Brands'}, 'entity': {'id': '781974597222535168', 'name': 'Online Services'}}, {'domain': {'id': '47', 'name': 'Brand', 'description': 'Brands and Companies'}, 'entity': {'id': '10040276669', 'name': 'Spotify'}}, {'domain': {'id': '47', 'name': 'Brand', 'description': 'Brands and Companies'}, 'entity': {'id': '1037318002033582080', 'name': 'Techcrunch', 'description': 'Techcrunch'}}, {'domain': {'id': '67', 'name': 'Interests and Hobbies', 'description': 'Interests, opinions, and behaviors of individuals, groups, or cultures; like Speciality Cooking or Theme Parks'}, 'entity': {'id': '1288826829634035714', 'name': 'Backstage'}}, {'domain': {'id': '71', 'name': 'Video Game', 'description': 'A video game like Overwatch'}, 'entity': {'id': '1088118927580774400', 'name': 'Roblox', 'description': 'Roblox'}}]","{'mentions': [{'start': 96, 'end': 107, 'username': 'TechCrunch', 'id': '816653'}], 'annotations': [{'start': 11, 'end': 17, 'probability': 0.3598, 'type': 'Product', 'normalized_text': 'Spotify'}, {'start': 61, 'end': 66, 'probability': 0.5337, 'type': 'Product', 'normalized_text': 'Roblox'}], 'urls': [{'start': 68, 'end': 91, 'url': 'https://t.co/x08oCtzcVO', 'expanded_url': 'https://tcrn.ch/3vXrFXr', 'display_url': 'tcrn.ch/3vXrFXr'}]}",,False,,everyone,Twitter Web App
1521480758543941634,1505475307792347146,"@TheCodedGalaxy sup
Just released a new video go check out my channel https://t.co/3deGhuxZl2

#roblox #lol #cool #bruh #youtube 
#wassup #idk",2022-05-03 13:24:15+00:00,,0,0,0,0,en,1521436334115540992,"[{'domain': {'id': '71', 'name': 'Video Game', 'description': 'A video game like Overwatch'}, 'entity': {'id': '1088118927580774400', 'name': 'Roblox', 'description': 'Roblox'}}]","{'mentions': [{'start': 0, 'end': 15, 'username': 'TheCodedGalaxy', 'id': '1401851980562063367'}], 'urls': [{'start': 70, 'end': 93, 'url': 'https://t.co/3deGhuxZl2', 'expanded_url': 'https://youtube.com/channel/UCnCjNLiPtasklaTcHugTRxQ', 'display_url': 'youtube.com/channel/UCnCjN…'}], 'hashtags': [{'start': 95, 'end': 102, 'tag': 'roblox'}, {'start': 103, 'end': 107, 'tag': 'lol'}, {'start': 108, 'end': 113, 'tag': 'cool'}, {'start': 114, 'end': 119, 'tag': 'bruh'}, {'start': 120, 'end': 128, 'tag': 'youtube'}, {'start': 130, 'end': 137, 'tag': 'wassup'}, {'start': 138, 'end': 142, 'tag': 'idk'}]}",,False,,everyone,Twitter for Android
1521480756031156226,845693973674901504,HOW DOES ROBLOX WORK PLS HELP,2022-05-03 13:24:14+00:00,,0,0,0,0,en,1521480756031156226,"[{'domain': {'id': '71', 'name': 'Video Game', 'description': 'A video game like Overwatch'}, 'entity': {'id': '1088118927580774400', 'name': 'Roblox', 'description': 'Roblox'}}]",,,False,,everyone,Twitter for Android
1521480754412376064,943529169182449669,skz en Roblox ay que gracioso https://t.co/kBkh3L7akr,2022-05-03 13:24:14+00:00,,0,0,2,0,ca,1521480754412376064,"[{'domain': {'id': '10', 'name': 'Person', 'description': 'Named people in the world like Nelson Mandela'}, 'entity': {'id': '1062427352318173185', 'name': 'Stray Kids', 'description': 'Stray Kids (스트레이 키즈)'}}, {'domain': {'id': '45', 'name': 'Brand Vertical', 'description': 'Top level entities that describe a Brands industry'}, 'entity': {'id': '781974597310615553', 'name': 'Entertainment'}}, {'domain': {'id': '46', 'name': 'Brand Category', 'description': 'Categories within Brand Verticals that narrow down the scope of Brands'}, 'entity': {'id': '781974597222535168', 'name': 'Online Services'}}, {'domain': {'id': '47', 'name': 'Brand', 'description': 'Brands and Companies'}, 'entity': {'id': '10040276669', 'name': 'Spotify'}}, {'domain': {'id': '54', 'name': 'Musician', 'description': 'A musician in the world, like Adele or Bob Dylan'}, 'entity': {'id': '1062427352318173185', 'name': 'Stray Kids', 'description': 'Stray Kids (스트레이 키즈)'}}, {'domain': {'id': '55', 'name': 'Music Genre', 'description': 'A category for a musical style, like Pop, Rock, or Rap'}, 'entity': {'id': '888105153038958593', 'name': 'K-pop', 'description': 'K-Pop'}}, {'domain': {'id': '30', 'name': 'Entities [Entity Service]', 'description': 'Entity Service top level domain, every item that is in Entity Service should be in this domain'}, 'entity': {'id': '848920371311001600', 'name': 'Technology', 'description': 'Technology and computing'}}, {'domain': {'id': '67', 'name': 'Interests and Hobbies', 'description': 'Interests, opinions, and behaviors of individuals, groups, or cultures; like Speciality Cooking or Theme Parks'}, 'entity': {'id': '1288826829634035714', 'name': 'Backstage'}}, {'domain': {'id': '71', 'name': 'Video Game', 'description': 'A video game like Overwatch'}, 'entity': {'id': '1088118927580774400', 'name': 'Roblox', 'description': 'Roblox'}}, {'domain': {'id': '165', 'name': 'Technology', 'description': 'for individual and types of technology, e.g., food technology, 3D printing'}, 'entity': {'id': '848920371311001600', 'name': 'Technology', 'description': 'Technology and computing'}}]","{'urls': [{'start': 30, 'end': 53, 'url': 'https://t.co/kBkh3L7akr', 'expanded_url': 'https://twitter.com/MusicWeek/status/1521470080462295043', 'display_url': 'twitter.com/MusicWeek/stat…'}]}",,False,,everyone,Twitter for Android
1521480748628385793,1141974066070458373,#royalehigh #royalehightrade #royalehighcommissions #royalehighconcept #royalehighconcepts #royalehighcrosstrade #royalehighGiveaways #RoyaleHighHalo #royalehighoffers #Roblox #Adoptmetrade #adoptmetradings #Mm2trades #bloxburg #petsimx https://t.co/IVXDI5h2Pc,2022-05-03 13:24:12+00:00,,1,0,0,0,qht,1521480748628385793,"[{'domain': {'id': '29', 'name': 'Events [Entity Service]', 'description': 'Entity Service related Events domain'}, 'entity': {'id': '1372917575357591554', 'name': 'Easter', 'description': 'this entity for all conversations for Easter all year '}}, {'domain': {'id': '71', 'name': 'Video Game', 'description': 'A video game like Overwatch'}, 'entity': {'id': '1088118927580774400', 'name': 'Roblox', 'description': 'Roblox'}}, {'domain': {'id': '71', 'name': 'Video Game', 'description': 'A video game like Overwatch'}, 'entity': {'id': '1229416301245763584', 'name': 'Adopt Me'}}, {'domain': {'id': '71', 'name': 'Video Game', 'description': 'A video game like Overwatch'}, 'entity': {'id': '1230882318224510978', 'name': 'Royale High'}}, {'domain': {'id': '119', 'name': 'Holiday', 'description': 'Holidays like Christmas or Halloween'}, 'entity': {'id': '1372917575357591554', 'name': 'Easter', 'description': 'this entity for all conversations for Easter all year '}}]","{'urls': [{'start': 237, 'end': 260, 'url': 'https://t.co/IVXDI5h2Pc', 'expanded_url': 'https://twitter.com/SlyBalladeer/status/1521291631957200896', 'display_url': 'twitter.com/SlyBalladeer/s…'}], 'hashtags': [{'start': 0, 'end': 11, 'tag': 'royalehigh'}, {'start': 12, 'end': 28, 'tag': 'royalehightrade'}, {'start': 29, 'end': 51, 'tag': 'royalehighcommissions'}, {'start': 52, 'end': 70, 'tag': 'royalehighconcept'}, {'start': 71, 'end': 90, 'tag': 'royalehighconcepts'}, {'start': 91, 'end': 112, 'tag': 'royalehighcrosstrade'}, {'start': 113, 'end': 133, 'tag': 'royalehighGiveaways'}, {'start': 134, 'end': 149, 'tag': 'RoyaleHighHalo'}, {'start': 150, 'end': 167, 'tag': 'royalehighoffers'}, {'start': 168, 'end': 175, 'tag': 'Roblox'}, {'start': 176, 'end': 189, 'tag': 'Adoptmetrade'}, {'start': 190, 'end': 206, 'tag': 'adoptmetradings'}, {'start': 207, 'end': 217, 'tag': 'Mm2trades'}, {'start': 218, 'end': 227, 'tag': 'bloxburg'}, {'start': 228, 'end': 236, 'tag': 'petsimx'}]}",,False,,everyone,Twitter for iPhone
1521480746480934913,812763087849877504,@7OsHYUNJIN SKZ ON ROBLOX,2022-05-03 13:24:12+00:00,,0,1,0,0,en,1521480676293451776,"[{'domain': {'id': '71', 'name': 'Video Game', 'description': 'A video game like Overwatch'}, 'entity': {'id': '1088118927580774400', 'name': 'Roblox', 'description': 'Roblox'}}]","{'mentions': [{'start': 0, 'end': 11, 'username': '7OsHYUNJIN', 'id': '1127710912377278464'}]}",,False,,everyone,Twitter for iPhone
1521480745449136128,1321361192879677440,@headIino how do u play roblox,2022-05-03 13:24:12+00:00,,0,2,0,0,en,1521478223229779968,"[{'domain': {'id': '71', 'name': 'Video Game', 'description': 'A video game like Overwatch'}, 'entity': {'id': '1088118927580774400', 'name': 'Roblox', 'description': 'Roblox'}}]","{'mentions': [{'start': 0, 'end': 9, 'username': 'headIino', 'id': '1415960774317535233'}]}",,False,,everyone,Twitter for iPhone
1521480743825948673,1404494793745571856,ROBLOX??? https://t.co/0EdST0SSwM,2022-05-03 13:24:11+00:00,,0,0,1,0,en,1521480743825948673,"[{'domain': {'id': '10', 'name': 'Person', 'description': 'Named people in the world like Nelson Mandela'}, 'entity': {'id': '1062427352318173185', 'name': 'Stray Kids', 'description': 'Stray Kids (스트레이 키즈)'}}, {'domain': {'id': '45', 'name': 'Brand Vertical', 'description': 'Top level entities that describe a Brands industry'}, 'entity': {'id': '781974597310615553', 'name': 'Entertainment'}}, {'domain': {'id': '46', 'name': 'Brand Category', 'description': 'Categories within Brand Verticals that narrow down the scope of Brands'}, 'entity': {'id': '781974597222535168', 'name': 'Online Services'}}, {'domain': {'id': '47', 'name': 'Brand', 'description': 'Brands and Companies'}, 'entity': {'id': '10040276669', 'name': 'Spotify'}}, {'domain': {'id': '54', 'name': 'Musician', 'description': 'A musician in the world, like Adele or Bob Dylan'}, 'entity': {'id': '1062427352318173185', 'name': 'Stray Kids', 'description': 'Stray Kids (스트레이 키즈)'}}, {'domain': {'id': '55', 'name': 'Music Genre', 'description': 'A category for a musical style, like Pop, Rock, or Rap'}, 'entity': {'id': '888105153038958593', 'name': 'K-pop', 'description': 'K-Pop'}}, {'domain': {'id': '30', 'name': 'Entities [Entity Service]', 'description': 'Entity Service top level domain, every item that is in Entity Service should be in this domain'}, 'entity': {'id': '848920371311001600', 'name': 'Technology', 'description': 'Technology and computing'}}, {'domain': {'id': '67', 'name': 'Interests and Hobbies', 'description': 'Interests, opinions, and behaviors of individuals, groups, or cultures; like Speciality Cooking or Theme Parks'}, 'entity': {'id': '1288826829634035714', 'name': 'Backstage'}}, {'domain': {'id': '71', 'name': 'Video Game', 'description': 'A video game like Overwatch'}, 'entity': {'id': '1088118927580774400', 'name': 'Roblox', 'description': 'Roblox'}}, {'domain': {'id': '165', 'name': 'Technology', 'description': 'for individual and types of technology, e.g., food technology, 3D printing'}, 'entity': {'id': '848920371311001600', 'name': 'Technology', 'description': 'Technology and computing'}}]","{'urls': [{'start': 10, 'end': 33, 'url': 'https://t.co/0EdST0SSwM', 'expanded_url': 'https://twitter.com/MusicWeek/status/1521470080462295043', 'display_url': 'twitter.com/MusicWeek/stat…'}]}",,False,,everyone,Twitter for iPhone
