tweetid,author_id,text,created_at,geo,retweets,replies,likes,quote_count,lang,conversation_id,context_annotations,entities,attachments,possibly_sensitive,withheld,reply_settings,source
1531894358513000449,1405980839268204553,"@KleeKaiETH #KleeGames is coming,imagine any #game can be #hosted on thd #platform and madd #P2E 🤯🤯 #KleeArmy #KleeToken #kleekai @KleeKaiETH @kleekaiespanol #KleeKaiEnterprises #altcoin #altcoins #altcoinseason #Roblox #axieinfinity #Axie #AxieScholarship #AxiePH #crypto #cryptogames #amc https://t.co/pMjJMMBPUS",2022-06-01 07:04:10+00:00,,7,0,7,0,en,1531838595295719425,"[{'domain': {'id': '66', 'name': 'Interests and Hobbies Category', 'description': 'A grouping of interests and hobbies entities, like Novelty Food or Destinations'}, 'entity': {'id': '913142676819648512', 'name': 'Cryptocurrencies', 'description': 'Cryptocurrency'}}, {'domain': {'id': '71', 'name': 'Video Game', 'description': 'A video game like Overwatch'}, 'entity': {'id': '1088118927580774400', 'name': 'Roblox', 'description': 'Roblox'}}, {'domain': {'id': '71', 'name': 'Video Game', 'description': 'A video game like Overwatch'}, 'entity': {'id': '1509325814269022208', 'name': 'Axie Infinity'}}]","{'urls': [{'start': 291, 'end': 314, 'url': 'https://t.co/pMjJMMBPUS', 'expanded_url': 'https://twitter.com/Richard841/status/1531894358513000449/photo/1', 'display_url': 'pic.twitter.com/pMjJMMBPUS', 'media_key': '3_1531894355623018497'}], 'mentions': [{'start': 0, 'end': 11, 'username': 'KleeKaiETH', 'id': '1392211599688142851'}, {'start': 130, 'end': 141, 'username': 'KleeKaiETH', 'id': '1392211599688142851'}, {'start': 142, 'end': 157, 'username': 'kleekaiespanol', 'id': '1507798608082518016'}], 'hashtags': [{'start': 12, 'end': 22, 'tag': 'KleeGames'}, {'start': 45, 'end': 50, 'tag': 'game'}, {'start': 58, 'end': 65, 'tag': 'hosted'}, {'start': 73, 'end': 82, 'tag': 'platform'}, {'start': 92, 'end': 96, 'tag': 'P2E'}, {'start': 100, 'end': 109, 'tag': 'KleeArmy'}, {'start': 110, 'end': 120, 'tag': 'KleeToken'}, {'start': 121, 'end': 129, 'tag': 'kleekai'}, {'start': 158, 'end': 177, 'tag': 'KleeKaiEnterprises'}, {'start': 178, 'end': 186, 'tag': 'altcoin'}, {'start': 187, 'end': 196, 'tag': 'altcoins'}, {'start': 197, 'end': 211, 'tag': 'altcoinseason'}, {'start': 212, 'end': 219, 'tag': 'Roblox'}, {'start': 220, 'end': 233, 'tag': 'axieinfinity'}, {'start': 234, 'end': 239, 'tag': 'Axie'}, {'start': 240, 'end': 256, 'tag': 'AxieScholarship'}, {'start': 257, 'end': 264, 'tag': 'AxiePH'}, {'start': 265, 'end': 272, 'tag': 'crypto'}, {'start': 273, 'end': 285, 'tag': 'cryptogames'}, {'start': 286, 'end': 290, 'tag': 'amc'}]}",{'media_keys': ['3_1531894355623018497']},False,,everyone,Twitter for Android
1531894332835643393,1361670455162101762,Gandang ganda ka sa sarili mo ulol mukha kang roblox.🤮,2022-06-01 07:04:04+00:00,,0,0,0,0,tl,1531894332835643393,"[{'domain': {'id': '71', 'name': 'Video Game', 'description': 'A video game like Overwatch'}, 'entity': {'id': '1088118927580774400', 'name': 'Roblox', 'description': 'Roblox'}}]",,,False,,everyone,Twitter for Android
1531894319141072897,1409067471890534403,"Looking for gamers to join an esports! We host COD,Apex,Siege,Gta,Minecraft,Roblox,rocket league,forza,battlefield. https://t.co/Si6FtfPLRb",2022-06-01 07:04:01+00:00,,0,0,0,0,en,1531894319141072897,"[{'domain': {'id': '45', 'name': 'Brand Vertical', 'description': 'Top level entities that describe a Brands industry'}, 'entity': {'id': '781974597310615553', 'name': 'Entertainment'}}, {'domain': {'id': '46', 'name': 'Brand Category', 'description': 'Categories within Brand Verticals that narrow down the scope of Brands'}, 'entity': {'id': '781974597218340864', 'name': 'Video Games'}}, {'domain': {'id': '71', 'name': 'Video Game', 'description': 'A video game like Overwatch'}, 'entity': {'id': '10027933222', 'name': 'Call of Duty', 'description': 'This entity includes all conversation about the franchise, as well as any individual installments in the series, if applicable.\t\t\t'}}, {'domain': {'id': '71', 'name': 'Video Game', 'description': 'A video game like Overwatch'}, 'entity': {'id': '10027963394', 'name': 'Battlefield', 'description': 'This entity includes all conversation about the franchise, as well as any individual installments in the series, if applicable.\t\t\t'}}, {'domain': {'id': '71', 'name': 'Video Game', 'description': 'A video game like Overwatch'}, 'entity': {'id': '10041743196', 'name': 'Forza', 'description': 'This entity includes all conversation about the franchise, as well as any individual installments in the series, if applicable.\t\t\t'}}, {'domain': {'id': '71', 'name': 'Video Game', 'description': 'A video game like Overwatch'}, 'entity': {'id': '10043689888', 'name': 'Minecraft'}}, {'domain': {'id': '71', 'name': 'Video Game', 'description': 'A video game like Overwatch'}, 'entity': {'id': '856568905648578560', 'name': 'Grand Theft Auto', 'description': 'This entity includes all conversation about the franchise, as well as any individual installments in the series, if applicable.\t\t\t'}}, {'domain': {'id': '71', 'name': 'Video Game', 'description': 'A video game like Overwatch'}, 'entity': {'id': '1088118927580774400', 'name': 'Roblox', 'description': 'Roblox'}}, {'domain': {'id': '71', 'name': 'Video Game', 'description': 'A video game like Overwatch'}, 'entity': {'id': '1095327230433972227', 'name': 'Apex Legends', 'description': 'This entity includes all conversation about the franchise, as well as any individual installments in the series, if applicable.\t\t\t'}}, {'domain': {'id': '71', 'name': 'Video Game', 'description': 'A video game like Overwatch'}, 'entity': {'id': '1135913559727067136', 'name': 'Rocket League', 'description': 'This entity includes all conversation about the franchise, as well as any individual installments in the series, if applicable.\t\t\t'}}]","{'annotations': [{'start': 47, 'end': 49, 'probability': 0.4702, 'type': 'Product', 'normalized_text': 'COD'}, {'start': 56, 'end': 60, 'probability': 0.352, 'type': 'Product', 'normalized_text': 'Siege'}, {'start': 62, 'end': 64, 'probability': 0.7971, 'type': 'Product', 'normalized_text': 'Gta'}, {'start': 66, 'end': 74, 'probability': 0.8607, 'type': 'Product', 'normalized_text': 'Minecraft'}, {'start': 76, 'end': 81, 'probability': 0.6345, 'type': 'Product', 'normalized_text': 'Roblox'}], 'urls': [{'start': 116, 'end': 139, 'url': 'https://t.co/Si6FtfPLRb', 'expanded_url': 'https://twitter.com/5IVELXVE/status/1531894319141072897/photo/1', 'display_url': 'pic.twitter.com/Si6FtfPLRb', 'media_key': '3_1531894317744369664'}]}",{'media_keys': ['3_1531894317744369664']},False,,everyone,"eFuse, Inc"
1531894318159515648,1355206747582050305,"Making roblox game trailer
A little robux pay (negotiable)
Its going to be the first thing what players see when they go on game page
Its going to be uploaded on my channel 300-500 robux is what would be a great amount for a trailer
#robloxtrailer #maker #roblox #youtube",2022-06-01 07:04:01+00:00,,1,1,1,0,en,1531894318159515648,"[{'domain': {'id': '71', 'name': 'Video Game', 'description': 'A video game like Overwatch'}, 'entity': {'id': '1088118927580774400', 'name': 'Roblox', 'description': 'Roblox'}}, {'domain': {'id': '165', 'name': 'Technology', 'description': 'for individual and types of technology, e.g., food technology, 3D printing'}, 'entity': {'id': '1196446161223028736', 'name': 'Social media'}}, {'domain': {'id': '46', 'name': 'Brand Category', 'description': 'Categories within Brand Verticals that narrow down the scope of Brands'}, 'entity': {'id': '781974596752842752', 'name': 'Services'}}, {'domain': {'id': '47', 'name': 'Brand', 'description': 'Brands and Companies'}, 'entity': {'id': '10029382357', 'name': 'YouTube'}}]","{'hashtags': [{'start': 233, 'end': 247, 'tag': 'robloxtrailer'}, {'start': 248, 'end': 254, 'tag': 'maker'}, {'start': 255, 'end': 262, 'tag': 'roblox'}, {'start': 263, 'end': 271, 'tag': 'youtube'}]}",,False,,everyone,Twitter for iPhone
1531894305341657088,1346899633604329477,"sollux has worst mr. dick suck, pain and suffering. that stupid fucking trenchcoat prick stole my roblox account.",2022-06-01 07:03:58+00:00,,0,0,0,0,en,1531894305341657088,[],,,False,,everyone,"Cheap Bots, Done Quick!"
1531894236223791106,1076604906717499393,@HiddenNoto does the 2017 roblox visor count,2022-06-01 07:03:41+00:00,,0,1,1,0,en,1531819945461522435,"[{'domain': {'id': '71', 'name': 'Video Game', 'description': 'A video game like Overwatch'}, 'entity': {'id': '1088118927580774400', 'name': 'Roblox', 'description': 'Roblox'}}]","{'mentions': [{'start': 0, 'end': 11, 'username': 'HiddenNoto', 'id': '1503406967229927426'}]}",,False,,everyone,Twitter for Android
1531894175968337920,1494637000372240385,"Happy pride month everyone!🏳️‍🌈
I'm so happy to hear communities are finally becoming welcoming to EVERYONE, wether that be in Roblox or not.
Things have come a long way since it was first introduced and I am so pleased to know people are finally feeling comfortable to talk out. https://t.co/UFqTxYqjyU",2022-06-01 07:03:27+00:00,,0,0,4,0,en,1531894175968337920,"[{'domain': {'id': '71', 'name': 'Video Game', 'description': 'A video game like Overwatch'}, 'entity': {'id': '1088118927580774400', 'name': 'Roblox', 'description': 'Roblox'}}]","{'annotations': [{'start': 129, 'end': 134, 'probability': 0.3856, 'type': 'Other', 'normalized_text': 'Roblox'}], 'urls': [{'start': 280, 'end': 303, 'url': 'https://t.co/UFqTxYqjyU', 'expanded_url': 'https://twitter.com/MadameDistingui/status/1531894175968337920/photo/1', 'display_url': 'pic.twitter.com/UFqTxYqjyU', 'media_key': '3_1531894173913305089'}]}",{'media_keys': ['3_1531894173913305089']},False,,everyone,Twitter for Android
1531894162282450945,1426038943594827778,TRADEAMOS LA CABRA MONTÉS MEGA NEON | ADOPT ME ROBLOX https://t.co/hy8525rKZo a través de @YouTube,2022-06-01 07:03:24+00:00,,0,0,0,0,es,1531894162282450945,"[{'domain': {'id': '71', 'name': 'Video Game', 'description': 'A video game like Overwatch'}, 'entity': {'id': '1088118927580774400', 'name': 'Roblox', 'description': 'Roblox'}}, {'domain': {'id': '71', 'name': 'Video Game', 'description': 'A video game like Overwatch'}, 'entity': {'id': '1229416301245763584', 'name': 'Adopt Me'}}]","{'annotations': [{'start': 19, 'end': 34, 'probability': 0.1767, 'type': 'Product', 'normalized_text': 'MONTÉS MEGA NEON'}], 'urls': [{'start': 54, 'end': 77, 'url': 'https://t.co/hy8525rKZo', 'expanded_url': 'https://youtu.be/EyjNtzzkn60', 'display_url': 'youtu.be/EyjNtzzkn60'}], 'mentions': [{'start': 90, 'end': 98, 'username': 'YouTube', 'id': '10228272'}]}",,False,,everyone,Twitter Web App
1531894124944687104,1238928167106162690,so what if i thought about making a yippie roblox game,2022-06-01 07:03:15+00:00,,0,0,1,0,en,1531894124944687104,"[{'domain': {'id': '71', 'name': 'Video Game', 'description': 'A video game like Overwatch'}, 'entity': {'id': '1088118927580774400', 'name': 'Roblox', 'description': 'Roblox'}}]",,,False,,everyone,Twitter Web App
1531894024902266880,1464080702136274945,@RobloxLeakers__ I'm scared for the future of roblox if this is real,2022-06-01 07:02:51+00:00,,0,0,0,0,en,1531749028983078913,"[{'domain': {'id': '71', 'name': 'Video Game', 'description': 'A video game like Overwatch'}, 'entity': {'id': '1088118927580774400', 'name': 'Roblox', 'description': 'Roblox'}}]","{'mentions': [{'start': 0, 'end': 16, 'username': 'RobloxLeakers__', 'id': '1447909769206013962'}]}",,False,,everyone,Twitter Web App
1531894023140556801,1228007171339755521,@IANlKU @RobloxLeakers__ I know and Roblox will be in trouble if it goes into the news,2022-06-01 07:02:50+00:00,,0,1,0,0,en,1531749028983078913,"[{'domain': {'id': '71', 'name': 'Video Game', 'description': 'A video game like Overwatch'}, 'entity': {'id': '1088118927580774400', 'name': 'Roblox', 'description': 'Roblox'}}]","{'annotations': [{'start': 36, 'end': 41, 'probability': 0.3611, 'type': 'Product', 'normalized_text': 'Roblox'}], 'mentions': [{'start': 0, 'end': 7, 'username': 'IANlKU', 'id': '1429809876998533130'}, {'start': 8, 'end': 24, 'username': 'RobloxLeakers__', 'id': '1447909769206013962'}]}",,False,,everyone,Twitter for Android
1531894014445854721,1531893097159852032,@RELLGames Subscribe to RELL GAMES HE IS ONE OF THE FAMOUSE PEOPLE IN ROBLOX,2022-06-01 07:02:48+00:00,,0,1,1,0,en,1530713972843872256,"[{'domain': {'id': '71', 'name': 'Video Game', 'description': 'A video game like Overwatch'}, 'entity': {'id': '1088118927580774400', 'name': 'Roblox', 'description': 'Roblox'}}]","{'mentions': [{'start': 0, 'end': 10, 'username': 'RELLGames', 'id': '1059865610530754561'}]}",,False,,everyone,Twitter Web App
1531893993159770112,1262121914996326401,"https://t.co/oENAytA1ql
https://t.co/n4tDVZ243o",2022-06-01 07:02:43+00:00,,0,0,0,0,zxx,1531893993159770112,[],"{'urls': [{'start': 0, 'end': 23, 'url': 'https://t.co/oENAytA1ql', 'expanded_url': 'https://www.roblox.com/catalog/8151825493/SharkBite-Web-Launcher', 'display_url': 'roblox.com/catalog/815182…', 'status': 200, 'title': 'SharkBite: Web Launcher - Roblox', 'description': 'Roblox is a global platform that brings people together through play.', 'unwound_url': 'https://www.roblox.com/catalog/8151825493/SharkBite-Web-Launcher'}, {'start': 24, 'end': 47, 'url': 'https://t.co/n4tDVZ243o', 'expanded_url': 'https://www.roblox.com/catalog/9723686413/Saguaro-Hat', 'display_url': 'roblox.com/catalog/972368…'}]}",,False,,everyone,Twitter Web App
1531893937820008448,880912197924335617,"@Simbuilder @SSGBLOX Thanks to him I really was able to pursue being a software developer and eventually became one, now I do Roblox full-time after leaving corporate.",2022-06-01 07:02:30+00:00,,0,0,3,0,en,1531886723847729152,"[{'domain': {'id': '71', 'name': 'Video Game', 'description': 'A video game like Overwatch'}, 'entity': {'id': '1088118927580774400', 'name': 'Roblox', 'description': 'Roblox'}}]","{'annotations': [{'start': 126, 'end': 131, 'probability': 0.3423, 'type': 'Product', 'normalized_text': 'Roblox'}], 'mentions': [{'start': 0, 'end': 11, 'username': 'Simbuilder', 'id': '324584160'}, {'start': 12, 'end': 20, 'username': 'SSGBLOX', 'id': '1318727596616470528'}]}",,False,,everyone,Twitter for Android
1531893923714846720,1414290346012336128,"Happy to hear that you feel relaxed and calm watching my comfy streams a big thank you for those who came and stayed throughout. 
I will be adding a few more games into my list. Unpacking, Mobile Legends and Roblox.

Yes I will make a comeback in Mobile Legends, stay tuned!",2022-06-01 07:02:27+00:00,,0,0,3,0,en,1531893923714846720,"[{'domain': {'id': '71', 'name': 'Video Game', 'description': 'A video game like Overwatch'}, 'entity': {'id': '1088118927580774400', 'name': 'Roblox', 'description': 'Roblox'}}, {'domain': {'id': '71', 'name': 'Video Game', 'description': 'A video game like Overwatch'}, 'entity': {'id': '1178803760472064000', 'name': 'Mobile Legends', 'description': 'This entity includes all conversation about the franchise, as well as any individual installments in the series, if applicable.\t\t\t'}}, {'domain': {'id': '30', 'name': 'Entities [Entity Service]', 'description': 'Entity Service top level domain, every item that is in Entity Service should be in this domain'}, 'entity': {'id': '847527946864607232', 'name': 'Mobile gaming', 'description': 'Mobile gaming'}}, {'domain': {'id': '79', 'name': 'Video Game Hardware', 'description': 'Video Game Hardware'}, 'entity': {'id': '847527946864607232', 'name': 'Mobile gaming', 'description': 'Mobile gaming'}}]","{'annotations': [{'start': 189, 'end': 202, 'probability': 0.4136, 'type': 'Product', 'normalized_text': 'Mobile Legends'}, {'start': 208, 'end': 213, 'probability': 0.5573, 'type': 'Product', 'normalized_text': 'Roblox'}, {'start': 247, 'end': 260, 'probability': 0.4099, 'type': 'Product', 'normalized_text': 'Mobile Legends'}]}",,False,,everyone,Twitter for iPhone
1531893899605975040,1501731761394696194,"Sun-shroom :D
#Roblox #RobloxDev #Commission #Modeling #LowPoly https://t.co/o0UJXo2q6P",2022-06-01 07:02:21+00:00,,11,0,9,0,et,1531893899605975040,"[{'domain': {'id': '71', 'name': 'Video Game', 'description': 'A video game like Overwatch'}, 'entity': {'id': '1088118927580774400', 'name': 'Roblox', 'description': 'Roblox'}}]","{'urls': [{'start': 64, 'end': 87, 'url': 'https://t.co/o0UJXo2q6P', 'expanded_url': 'https://twitter.com/HardonTheBacon/status/1531893899605975040/photo/1', 'display_url': 'pic.twitter.com/o0UJXo2q6P', 'media_key': '3_1531893834984325121'}, {'start': 64, 'end': 87, 'url': 'https://t.co/o0UJXo2q6P', 'expanded_url': 'https://twitter.com/HardonTheBacon/status/1531893899605975040/photo/1', 'display_url': 'pic.twitter.com/o0UJXo2q6P', 'media_key': '3_1531893834980143104'}], 'hashtags': [{'start': 14, 'end': 21, 'tag': 'Roblox'}, {'start': 22, 'end': 32, 'tag': 'RobloxDev'}, {'start': 33, 'end': 44, 'tag': 'Commission'}, {'start': 45, 'end': 54, 'tag': 'Modeling'}, {'start': 55, 'end': 63, 'tag': 'LowPoly'}]}","{'media_keys': ['3_1531893834984325121', '3_1531893834980143104']}",False,,everyone,Twitter Web App
1531893891963752449,1520095333174456323,"mikey except he's from an au of mine inspired by the mimic (roblox)! he's gone through a lot ;;
#artistsontwitter #art #tmnt #tmnt2012 #tmntau #tmnt2012au #au https://t.co/9FpuIXkjj4",2022-06-01 07:02:19+00:00,,0,0,5,0,en,1531893891963752449,"[{'domain': {'id': '65', 'name': 'Interests and Hobbies Vertical', 'description': 'Top level interests and hobbies groupings, like Food or Travel'}, 'entity': {'id': '1280550787207147521', 'name': 'Arts & culture'}}, {'domain': {'id': '66', 'name': 'Interests and Hobbies Category', 'description': 'A grouping of interests and hobbies entities, like Novelty Food or Destinations'}, 'entity': {'id': '1046577790353428480', 'name': 'Visual arts', 'description': 'Visual Arts'}}, {'domain': {'id': '71', 'name': 'Video Game', 'description': 'A video game like Overwatch'}, 'entity': {'id': '1088118927580774400', 'name': 'Roblox', 'description': 'Roblox'}}, {'domain': {'id': '130', 'name': 'Multimedia Franchise', 'description': ""Franchises which span multiple forms of media like 'Harry Potter'""}, 'entity': {'id': '1268833161288413185', 'name': 'Teenage Mutant Ninja Turtles'}}]","{'annotations': [{'start': 0, 'end': 4, 'probability': 0.5026, 'type': 'Person', 'normalized_text': 'mikey'}], 'urls': [{'start': 159, 'end': 182, 'url': 'https://t.co/9FpuIXkjj4', 'expanded_url': 'https://twitter.com/extravag_ann_t/status/1531893891963752449/photo/1', 'display_url': 'pic.twitter.com/9FpuIXkjj4', 'media_key': '3_1531893886175662080'}], 'hashtags': [{'start': 96, 'end': 113, 'tag': 'artistsontwitter'}, {'start': 114, 'end': 118, 'tag': 'art'}, {'start': 119, 'end': 124, 'tag': 'tmnt'}, {'start': 125, 'end': 134, 'tag': 'tmnt2012'}, {'start': 135, 'end': 142, 'tag': 'tmntau'}, {'start': 143, 'end': 154, 'tag': 'tmnt2012au'}, {'start': 155, 'end': 158, 'tag': 'au'}]}",{'media_keys': ['3_1531893886175662080']},False,,everyone,Twitter Web App
1531893840256573440,1512326675178012676,@kiriseun why r u speaking in roblox tags,2022-06-01 07:02:07+00:00,,0,0,0,0,en,1531571701645197312,"[{'domain': {'id': '71', 'name': 'Video Game', 'description': 'A video game like Overwatch'}, 'entity': {'id': '1088118927580774400', 'name': 'Roblox', 'description': 'Roblox'}}]",,,False,,everyone,Twitter for iPhone
1531893809822547968,1228007171339755521,@IANlKU @RobloxLeakers__ In my opinion. It is a human body but use it in a roblox game I don't know what could be in people minds by using it.,2022-06-01 07:02:00+00:00,,0,0,0,0,en,1531749028983078913,"[{'domain': {'id': '71', 'name': 'Video Game', 'description': 'A video game like Overwatch'}, 'entity': {'id': '1088118927580774400', 'name': 'Roblox', 'description': 'Roblox'}}]","{'mentions': [{'start': 0, 'end': 7, 'username': 'IANlKU', 'id': '1429809876998533130'}, {'start': 8, 'end': 24, 'username': 'RobloxLeakers__', 'id': '1447909769206013962'}]}",,False,,everyone,Twitter for Android
1531893772522496000,1284599993534345216,Gucci Town Codes (June 2022) https://t.co/l8iqEJkISH,2022-06-01 07:01:51+00:00,,0,0,0,0,en,1531893772522496000,[],"{'annotations': [{'start': 0, 'end': 15, 'probability': 0.4024, 'type': 'Organization', 'normalized_text': 'Gucci Town Codes'}], 'urls': [{'start': 29, 'end': 52, 'url': 'https://t.co/l8iqEJkISH', 'expanded_url': 'https://progameguides.com/roblox/gucci-town-codes/?utm_source=Facebook', 'display_url': 'progameguides.com/roblox/gucci-t…'}]}",,False,,everyone,SocialBee.io v2
1531893727194587136,1438678681040261133,neta que en la secundaria me daba mucha vergüenza que se enteraran que jugaba roblox porq se iban a burlar de mi en mal plan y en la prepa encontré amigas con quien jugar roblox danilox y sophia si ven esto las quiero mucho,2022-06-01 07:01:40+00:00,,0,1,5,0,es,1531893727194587136,"[{'domain': {'id': '71', 'name': 'Video Game', 'description': 'A video game like Overwatch'}, 'entity': {'id': '1088118927580774400', 'name': 'Roblox', 'description': 'Roblox'}}]","{'annotations': [{'start': 188, 'end': 193, 'probability': 0.9044, 'type': 'Person', 'normalized_text': 'sophia'}]}",,False,,everyone,Twitter for iPhone
1531893630570569728,1470652439921631234,Ya tenemos casita en roblox aggg🙈🙈🙈,2022-06-01 07:01:17+00:00,,0,0,1,0,es,1531893630570569728,"[{'domain': {'id': '71', 'name': 'Video Game', 'description': 'A video game like Overwatch'}, 'entity': {'id': '1088118927580774400', 'name': 'Roblox', 'description': 'Roblox'}}]",,,False,,everyone,Twitter for iPhone
1531893567186259968,1477641247661637633,"Item: Perfectly Legitimate Business Hat
Deal: 38%
Price: 6200

Rap: 7105
Value: 10000

https://t.co/OlPqRE6919

#roblox #robloxtrading",2022-06-01 07:01:02+00:00,,1,0,0,0,en,1531893567186259968,"[{'domain': {'id': '71', 'name': 'Video Game', 'description': 'A video game like Overwatch'}, 'entity': {'id': '1088118927580774400', 'name': 'Roblox', 'description': 'Roblox'}}]","{'urls': [{'start': 87, 'end': 110, 'url': 'https://t.co/OlPqRE6919', 'expanded_url': 'https://www.roblox.com/catalog/19027209/Perfectly-Legitimate-Business-Hat', 'display_url': 'roblox.com/catalog/190272…'}], 'hashtags': [{'start': 112, 'end': 119, 'tag': 'roblox'}, {'start': 120, 'end': 134, 'tag': 'robloxtrading'}]}",,False,,everyone,Watchfox Roblox Limited Deals
1531893543287066625,1183593886926757891,Found on YouTube: PROJECT BAKI 2 - AIZEN GAMEPASS SHOWCASE (UNFINISHED STYLE?) - ROBLOX https://t.co/aUBb6CnS3B,2022-06-01 07:00:56+00:00,,0,0,0,0,en,1531893543287066625,"[{'domain': {'id': '3', 'name': 'TV Shows', 'description': 'Television shows from around the world'}, 'entity': {'id': '10053936152', 'name': 'バキ'}}, {'domain': {'id': '48', 'name': 'Product', 'description': 'Products created by Brands.  Examples: Ford Explorer, Apple iPhone.'}, 'entity': {'id': '1425921713150201858', 'name': 'Xbox Game Pass'}}, {'domain': {'id': '71', 'name': 'Video Game', 'description': 'A video game like Overwatch'}, 'entity': {'id': '1088118927580774400', 'name': 'Roblox', 'description': 'Roblox'}}, {'domain': {'id': '45', 'name': 'Brand Vertical', 'description': 'Top level entities that describe a Brands industry'}, 'entity': {'id': '781974597310615553', 'name': 'Entertainment'}}, {'domain': {'id': '46', 'name': 'Brand Category', 'description': 'Categories within Brand Verticals that narrow down the scope of Brands'}, 'entity': {'id': '781974597218340864', 'name': 'Video Games'}}, {'domain': {'id': '47', 'name': 'Brand', 'description': 'Brands and Companies'}, 'entity': {'id': '10027048851', 'name': 'Xbox'}}, {'domain': {'id': '79', 'name': 'Video Game Hardware', 'description': 'Video Game Hardware'}, 'entity': {'id': '10027048851', 'name': 'Xbox'}}]","{'annotations': [{'start': 9, 'end': 15, 'probability': 0.4622, 'type': 'Product', 'normalized_text': 'YouTube'}], 'urls': [{'start': 88, 'end': 111, 'url': 'https://t.co/aUBb6CnS3B', 'expanded_url': 'https://www.youtube.com/watch?v=HUs6kVX3MGo', 'display_url': 'youtube.com/watch?v=HUs6kV…'}]}",,False,,everyone,IFTTT
1531893537855655936,4473724636,DID YOU KNOW THAT ROBLOX THEY HAND ATLEAST 100 TIX A SECOUND!,2022-06-01 07:00:55+00:00,,0,0,0,0,en,1531893537855655936,"[{'domain': {'id': '71', 'name': 'Video Game', 'description': 'A video game like Overwatch'}, 'entity': {'id': '1088118927580774400', 'name': 'Roblox', 'description': 'Roblox'}}]",,,False,,everyone,twittbot.net
1531893529861054464,1183593886926757891,Found on YouTube: Project Baki 2 - Dead Souls Majima Style Showcase - ROBLOX https://t.co/cFfQ8SRN6W,2022-06-01 07:00:53+00:00,,0,0,0,0,en,1531893529861054464,"[{'domain': {'id': '3', 'name': 'TV Shows', 'description': 'Television shows from around the world'}, 'entity': {'id': '10053936152', 'name': 'バキ'}}, {'domain': {'id': '71', 'name': 'Video Game', 'description': 'A video game like Overwatch'}, 'entity': {'id': '1088118927580774400', 'name': 'Roblox', 'description': 'Roblox'}}]","{'annotations': [{'start': 9, 'end': 15, 'probability': 0.4063, 'type': 'Product', 'normalized_text': 'YouTube'}, {'start': 35, 'end': 66, 'probability': 0.608, 'type': 'Other', 'normalized_text': 'Dead Souls Majima Style Showcase'}], 'urls': [{'start': 77, 'end': 100, 'url': 'https://t.co/cFfQ8SRN6W', 'expanded_url': 'https://www.youtube.com/watch?v=UUE5Z12NU6U', 'display_url': 'youtube.com/watch?v=UUE5Z1…'}]}",,False,,everyone,IFTTT
