tweetid,author_id,text,created_at,geo,retweets,replies,likes,quote_count,lang,conversation_id,context_annotations,entities,attachments,possibly_sensitive,withheld,reply_settings,source
1521480738235125760,1505475307792347146,"@PlayAdoptMe sup
Just released a new video go check out my channel https://t.co/3deGhuxZl2

#roblox #lol #cool #bruh #youtube 
#wassup #idk",2022-05-03 13:24:10+00:00,,0,0,0,0,en,1521237750170755073,"[{'domain': {'id': '71', 'name': 'Video Game', 'description': 'A video game like Overwatch'}, 'entity': {'id': '1088118927580774400', 'name': 'Roblox', 'description': 'Roblox'}}, {'domain': {'id': '71', 'name': 'Video Game', 'description': 'A video game like Overwatch'}, 'entity': {'id': '1229416301245763584', 'name': 'Adopt Me'}}]","{'mentions': [{'start': 0, 'end': 12, 'username': 'PlayAdoptMe', 'id': '1145825695941222400'}], 'urls': [{'start': 67, 'end': 90, 'url': 'https://t.co/3deGhuxZl2', 'expanded_url': 'https://youtube.com/channel/UCnCjNLiPtasklaTcHugTRxQ', 'display_url': 'youtube.com/channel/UCnCjN…'}], 'hashtags': [{'start': 92, 'end': 99, 'tag': 'roblox'}, {'start': 100, 'end': 104, 'tag': 'lol'}, {'start': 105, 'end': 110, 'tag': 'cool'}, {'start': 111, 'end': 116, 'tag': 'bruh'}, {'start': 117, 'end': 125, 'tag': 'youtube'}, {'start': 127, 'end': 134, 'tag': 'wassup'}, {'start': 135, 'end': 139, 'tag': 'idk'}]}",,False,,everyone,Twitter for Android
1521480727174520832,1442121999531212806,skz and roblox huh,2022-05-03 13:24:07+00:00,,0,1,0,0,en,1521480727174520832,"[{'domain': {'id': '71', 'name': 'Video Game', 'description': 'A video game like Overwatch'}, 'entity': {'id': '1088118927580774400', 'name': 'Roblox', 'description': 'Roblox'}}]",,,False,,everyone,Twitter for iPhone
1521480723378900992,1122887161101991936,I already have a roblox bcs of my younger brother 😭😭 https://t.co/Zd6oaOWkDO,2022-05-03 13:24:06+00:00,,0,0,0,0,en,1521480723378900992,"[{'domain': {'id': '10', 'name': 'Person', 'description': 'Named people in the world like Nelson Mandela'}, 'entity': {'id': '1062427352318173185', 'name': 'Stray Kids', 'description': 'Stray Kids (스트레이 키즈)'}}, {'domain': {'id': '45', 'name': 'Brand Vertical', 'description': 'Top level entities that describe a Brands industry'}, 'entity': {'id': '781974597310615553', 'name': 'Entertainment'}}, {'domain': {'id': '46', 'name': 'Brand Category', 'description': 'Categories within Brand Verticals that narrow down the scope of Brands'}, 'entity': {'id': '781974597222535168', 'name': 'Online Services'}}, {'domain': {'id': '47', 'name': 'Brand', 'description': 'Brands and Companies'}, 'entity': {'id': '10040276669', 'name': 'Spotify'}}, {'domain': {'id': '54', 'name': 'Musician', 'description': 'A musician in the world, like Adele or Bob Dylan'}, 'entity': {'id': '1062427352318173185', 'name': 'Stray Kids', 'description': 'Stray Kids (스트레이 키즈)'}}, {'domain': {'id': '55', 'name': 'Music Genre', 'description': 'A category for a musical style, like Pop, Rock, or Rap'}, 'entity': {'id': '888105153038958593', 'name': 'K-pop', 'description': 'K-Pop'}}, {'domain': {'id': '30', 'name': 'Entities [Entity Service]', 'description': 'Entity Service top level domain, every item that is in Entity Service should be in this domain'}, 'entity': {'id': '848920371311001600', 'name': 'Technology', 'description': 'Technology and computing'}}, {'domain': {'id': '67', 'name': 'Interests and Hobbies', 'description': 'Interests, opinions, and behaviors of individuals, groups, or cultures; like Speciality Cooking or Theme Parks'}, 'entity': {'id': '1288826829634035714', 'name': 'Backstage'}}, {'domain': {'id': '71', 'name': 'Video Game', 'description': 'A video game like Overwatch'}, 'entity': {'id': '1088118927580774400', 'name': 'Roblox', 'description': 'Roblox'}}, {'domain': {'id': '165', 'name': 'Technology', 'description': 'for individual and types of technology, e.g., food technology, 3D printing'}, 'entity': {'id': '848920371311001600', 'name': 'Technology', 'description': 'Technology and computing'}}]","{'urls': [{'start': 53, 'end': 76, 'url': 'https://t.co/Zd6oaOWkDO', 'expanded_url': 'https://twitter.com/MusicWeek/status/1521470080462295043', 'display_url': 'twitter.com/MusicWeek/stat…'}]}",,False,,everyone,Twitter for Android
1521480710745468928,1414218080650153986,how tf do u meet skz on roblox,2022-05-03 13:24:03+00:00,,0,1,3,0,en,1521480710745468928,"[{'domain': {'id': '71', 'name': 'Video Game', 'description': 'A video game like Overwatch'}, 'entity': {'id': '1088118927580774400', 'name': 'Roblox', 'description': 'Roblox'}}]",,,False,,everyone,Twitter for iPhone
1521480701908070401,1330249173808140289,am i the only one who borderline has no clue what roblox is https://t.co/zQjghyhLZd,2022-05-03 13:24:01+00:00,,0,3,0,0,en,1521480701908070401,"[{'domain': {'id': '71', 'name': 'Video Game', 'description': 'A video game like Overwatch'}, 'entity': {'id': '1088118927580774400', 'name': 'Roblox', 'description': 'Roblox'}}]","{'urls': [{'start': 60, 'end': 83, 'url': 'https://t.co/zQjghyhLZd', 'expanded_url': 'https://twitter.com/hotgirlhwang/status/1521480701908070401/photo/1', 'display_url': 'pic.twitter.com/zQjghyhLZd', 'media_key': '16_1521480691556524032'}]}",{'media_keys': ['16_1521480691556524032']},False,,everyone,Twitter for iPhone
1521480699500548099,314958109,What is Roblox? https://t.co/J8pnDUQHN5,2022-05-03 13:24:01+00:00,,0,1,1,0,en,1521480699500548099,"[{'domain': {'id': '10', 'name': 'Person', 'description': 'Named people in the world like Nelson Mandela'}, 'entity': {'id': '1062427352318173185', 'name': 'Stray Kids', 'description': 'Stray Kids (스트레이 키즈)'}}, {'domain': {'id': '45', 'name': 'Brand Vertical', 'description': 'Top level entities that describe a Brands industry'}, 'entity': {'id': '781974597310615553', 'name': 'Entertainment'}}, {'domain': {'id': '46', 'name': 'Brand Category', 'description': 'Categories within Brand Verticals that narrow down the scope of Brands'}, 'entity': {'id': '781974597222535168', 'name': 'Online Services'}}, {'domain': {'id': '47', 'name': 'Brand', 'description': 'Brands and Companies'}, 'entity': {'id': '10040276669', 'name': 'Spotify'}}, {'domain': {'id': '54', 'name': 'Musician', 'description': 'A musician in the world, like Adele or Bob Dylan'}, 'entity': {'id': '1062427352318173185', 'name': 'Stray Kids', 'description': 'Stray Kids (스트레이 키즈)'}}, {'domain': {'id': '55', 'name': 'Music Genre', 'description': 'A category for a musical style, like Pop, Rock, or Rap'}, 'entity': {'id': '888105153038958593', 'name': 'K-pop', 'description': 'K-Pop'}}, {'domain': {'id': '30', 'name': 'Entities [Entity Service]', 'description': 'Entity Service top level domain, every item that is in Entity Service should be in this domain'}, 'entity': {'id': '848920371311001600', 'name': 'Technology', 'description': 'Technology and computing'}}, {'domain': {'id': '67', 'name': 'Interests and Hobbies', 'description': 'Interests, opinions, and behaviors of individuals, groups, or cultures; like Speciality Cooking or Theme Parks'}, 'entity': {'id': '1288826829634035714', 'name': 'Backstage'}}, {'domain': {'id': '71', 'name': 'Video Game', 'description': 'A video game like Overwatch'}, 'entity': {'id': '1088118927580774400', 'name': 'Roblox', 'description': 'Roblox'}}, {'domain': {'id': '165', 'name': 'Technology', 'description': 'for individual and types of technology, e.g., food technology, 3D printing'}, 'entity': {'id': '848920371311001600', 'name': 'Technology', 'description': 'Technology and computing'}}]","{'annotations': [{'start': 8, 'end': 13, 'probability': 0.4232, 'type': 'Product', 'normalized_text': 'Roblox'}], 'urls': [{'start': 16, 'end': 39, 'url': 'https://t.co/J8pnDUQHN5', 'expanded_url': 'https://twitter.com/MusicWeek/status/1521470080462295043', 'display_url': 'twitter.com/MusicWeek/stat…'}]}",,False,,everyone,Twitter for iPhone
1521480696350617601,1122152552538177536,"BUSCO GENTE QUE ME AYUDE JUGAR ROBLOX DESDE CERO POR FAVOR, VEAN LOS OJOS DE ESTA POBRE ALMA PIDIENDO AYUDA https://t.co/c5eY1Rh7uJ",2022-05-03 13:24:00+00:00,,0,0,0,0,es,1521480696350617601,"[{'domain': {'id': '10', 'name': 'Person', 'description': 'Named people in the world like Nelson Mandela'}, 'entity': {'id': '1062427352318173185', 'name': 'Stray Kids', 'description': 'Stray Kids (스트레이 키즈)'}}, {'domain': {'id': '45', 'name': 'Brand Vertical', 'description': 'Top level entities that describe a Brands industry'}, 'entity': {'id': '781974597310615553', 'name': 'Entertainment'}}, {'domain': {'id': '46', 'name': 'Brand Category', 'description': 'Categories within Brand Verticals that narrow down the scope of Brands'}, 'entity': {'id': '781974597222535168', 'name': 'Online Services'}}, {'domain': {'id': '47', 'name': 'Brand', 'description': 'Brands and Companies'}, 'entity': {'id': '10040276669', 'name': 'Spotify'}}, {'domain': {'id': '54', 'name': 'Musician', 'description': 'A musician in the world, like Adele or Bob Dylan'}, 'entity': {'id': '1062427352318173185', 'name': 'Stray Kids', 'description': 'Stray Kids (스트레이 키즈)'}}, {'domain': {'id': '55', 'name': 'Music Genre', 'description': 'A category for a musical style, like Pop, Rock, or Rap'}, 'entity': {'id': '888105153038958593', 'name': 'K-pop', 'description': 'K-Pop'}}, {'domain': {'id': '30', 'name': 'Entities [Entity Service]', 'description': 'Entity Service top level domain, every item that is in Entity Service should be in this domain'}, 'entity': {'id': '848920371311001600', 'name': 'Technology', 'description': 'Technology and computing'}}, {'domain': {'id': '67', 'name': 'Interests and Hobbies', 'description': 'Interests, opinions, and behaviors of individuals, groups, or cultures; like Speciality Cooking or Theme Parks'}, 'entity': {'id': '1288826829634035714', 'name': 'Backstage'}}, {'domain': {'id': '71', 'name': 'Video Game', 'description': 'A video game like Overwatch'}, 'entity': {'id': '1088118927580774400', 'name': 'Roblox', 'description': 'Roblox'}}, {'domain': {'id': '165', 'name': 'Technology', 'description': 'for individual and types of technology, e.g., food technology, 3D printing'}, 'entity': {'id': '848920371311001600', 'name': 'Technology', 'description': 'Technology and computing'}}]","{'urls': [{'start': 108, 'end': 131, 'url': 'https://t.co/c5eY1Rh7uJ', 'expanded_url': 'https://twitter.com/MusicWeek/status/1521470080462295043', 'display_url': 'twitter.com/MusicWeek/stat…'}]}",,False,,everyone,Twitter Web App
1521480695767519232,1451089705630531586,@S_AshelJKT48 Mabar roblox yuu,2022-05-03 13:24:00+00:00,,0,0,0,0,tl,1521475699873583104,"[{'domain': {'id': '71', 'name': 'Video Game', 'description': 'A video game like Overwatch'}, 'entity': {'id': '1088118927580774400', 'name': 'Roblox', 'description': 'Roblox'}}]","{'mentions': [{'start': 0, 'end': 13, 'username': 'S_AshelJKT48', 'id': '1222024629511811072'}]}",,False,,everyone,Twitter for Android
1521480679145549824,1419352308253667328,@hyunelost Roblox,2022-05-03 13:23:56+00:00,,0,0,0,0,en,1521480556957302784,"[{'domain': {'id': '71', 'name': 'Video Game', 'description': 'A video game like Overwatch'}, 'entity': {'id': '1088118927580774400', 'name': 'Roblox', 'description': 'Roblox'}}]","{'mentions': [{'start': 0, 'end': 10, 'username': 'hyunelost', 'id': '1380839083564498947'}]}",,False,,everyone,Twitter for iPhone
1521480677367156810,1385657161510842372,Want to earn FREE R$? Join RBLX Land through my link to earn R$ for completing EASY tasks or inviting your friends! - https://t.co/NyNzKoVD2r #robux #roblox #freerobux via @RBLXdotLand,2022-05-03 13:23:55+00:00,,0,0,0,0,en,1521480677367156810,"[{'domain': {'id': '71', 'name': 'Video Game', 'description': 'A video game like Overwatch'}, 'entity': {'id': '1088118927580774400', 'name': 'Roblox', 'description': 'Roblox'}}]","{'mentions': [{'start': 172, 'end': 184, 'username': 'RBLXdotLand', 'id': '909551034556706816'}], 'urls': [{'start': 118, 'end': 141, 'url': 'https://t.co/NyNzKoVD2r', 'expanded_url': 'https://rblx.land/r/3468832312', 'display_url': 'rblx.land/r/3468832312'}], 'hashtags': [{'start': 142, 'end': 148, 'tag': 'robux'}, {'start': 149, 'end': 156, 'tag': 'roblox'}, {'start': 157, 'end': 167, 'tag': 'freerobux'}]}",,False,,everyone,Twitter Web App
1521480671596003328,1502160989575282690,NOT THE ROBLOX SWORD MIL0RD,2022-05-03 13:23:54+00:00,,0,0,0,0,en,1521480671596003328,"[{'domain': {'id': '71', 'name': 'Video Game', 'description': 'A video game like Overwatch'}, 'entity': {'id': '1088118927580774400', 'name': 'Roblox', 'description': 'Roblox'}}]",,,False,,everyone,Twitter for iPhone
1521480667988742151,936659294359040001,THE ROBLOX SWORD KKKKKKK,2022-05-03 13:23:53+00:00,,0,0,0,0,en,1521480667988742151,"[{'domain': {'id': '71', 'name': 'Video Game', 'description': 'A video game like Overwatch'}, 'entity': {'id': '1088118927580774400', 'name': 'Roblox', 'description': 'Roblox'}}]",,,False,,everyone,Twitter for Android
1521480659050852352,1365151872231874567,Friend with me everyone roblox username : google4nti,2022-05-03 13:23:51+00:00,,0,0,0,0,en,1521480659050852352,"[{'domain': {'id': '71', 'name': 'Video Game', 'description': 'A video game like Overwatch'}, 'entity': {'id': '1088118927580774400', 'name': 'Roblox', 'description': 'Roblox'}}]",,,False,,everyone,Twitter for Android
1521480654260772866,1407468736903364611,@noeasyluv basically skz r gonna be on roblox holding like a meet and greet ?? like they’ll  interact w players there n all ?? that’s how i got it at least,2022-05-03 13:23:50+00:00,,0,1,1,0,en,1521478058011672580,"[{'domain': {'id': '71', 'name': 'Video Game', 'description': 'A video game like Overwatch'}, 'entity': {'id': '1088118927580774400', 'name': 'Roblox', 'description': 'Roblox'}}]","{'mentions': [{'start': 0, 'end': 10, 'username': 'noeasyluv', 'id': '1381642162127839241'}], 'annotations': [{'start': 39, 'end': 44, 'probability': 0.4557, 'type': 'Product', 'normalized_text': 'roblox'}]}",,False,,everyone,Twitter for iPhone
1521480652142841856,1275430048363737089,@irfxn_hrh @IamPiggyGod234 @Parlo_ROBLOX did i say i didn't have any moron?,2022-05-03 13:23:49+00:00,,0,0,0,0,en,1520863712906821632,[],"{'mentions': [{'start': 0, 'end': 10, 'username': 'irfxn_hrh', 'id': '1248826216951377921'}, {'start': 11, 'end': 26, 'username': 'IamPiggyGod234', 'id': '1420457893657300996'}, {'start': 27, 'end': 40, 'username': 'Parlo_ROBLOX', 'id': '1310688804441817088'}]}",,False,,everyone,Twitter Web App
1521480640558170114,1441994242469945347,ano ba tawag dun sa sweater sa roblox na parang damit sa zep7,2022-05-03 13:23:47+00:00,,0,1,0,0,tl,1521480640558170114,"[{'domain': {'id': '71', 'name': 'Video Game', 'description': 'A video game like Overwatch'}, 'entity': {'id': '1088118927580774400', 'name': 'Roblox', 'description': 'Roblox'}}, {'domain': {'id': '65', 'name': 'Interests and Hobbies Vertical', 'description': 'Top level interests and hobbies groupings, like Food or Travel'}, 'entity': {'id': '844603730221707264', 'name': 'Fashion', 'description': 'Fashion'}}, {'domain': {'id': '66', 'name': 'Interests and Hobbies Category', 'description': 'A grouping of interests and hobbies entities, like Novelty Food or Destinations'}, 'entity': {'id': '844604232737087488', 'name': 'General Fashion', 'description': 'General Fashion'}}, {'domain': {'id': '67', 'name': 'Interests and Hobbies', 'description': 'Interests, opinions, and behaviors of individuals, groups, or cultures; like Speciality Cooking or Theme Parks'}, 'entity': {'id': '849641708258074624', 'name': 'Tops', 'description': 'Tops'}}]",,,False,,everyone,Twitter for Android
1521480638804762624,1417587809502826500,"NOVO ITEM GRÁTIS: Complete o tutorial do Spotify Island seguindo as setas verdes.

➤ https://t.co/CevcTqyaYG https://t.co/v14lRp4dFr",2022-05-03 13:23:46+00:00,,0,0,20,0,pt,1521480638804762624,"[{'domain': {'id': '45', 'name': 'Brand Vertical', 'description': 'Top level entities that describe a Brands industry'}, 'entity': {'id': '781974597310615553', 'name': 'Entertainment'}}, {'domain': {'id': '46', 'name': 'Brand Category', 'description': 'Categories within Brand Verticals that narrow down the scope of Brands'}, 'entity': {'id': '781974597222535168', 'name': 'Online Services'}}, {'domain': {'id': '47', 'name': 'Brand', 'description': 'Brands and Companies'}, 'entity': {'id': '10040276669', 'name': 'Spotify'}}, {'domain': {'id': '67', 'name': 'Interests and Hobbies', 'description': 'Interests, opinions, and behaviors of individuals, groups, or cultures; like Speciality Cooking or Theme Parks'}, 'entity': {'id': '1288826829634035714', 'name': 'Backstage'}}]","{'annotations': [{'start': 41, 'end': 54, 'probability': 0.5201, 'type': 'Product', 'normalized_text': 'Spotify Island'}], 'urls': [{'start': 85, 'end': 108, 'url': 'https://t.co/CevcTqyaYG', 'expanded_url': 'http://roblox.com/spotify', 'display_url': 'roblox.com/spotify'}, {'start': 109, 'end': 132, 'url': 'https://t.co/v14lRp4dFr', 'expanded_url': 'https://twitter.com/Roblox_RTC_BR/status/1521480638804762624/photo/1', 'display_url': 'pic.twitter.com/v14lRp4dFr', 'media_key': '3_1521480635927441408'}]}",{'media_keys': ['3_1521480635927441408']},False,,everyone,Twitter for Android
1521480633050361856,1304686725055221760,WDYM SKZ IN ROBLOX 😭😭😭😭😭😭😭😭😭,2022-05-03 13:23:45+00:00,,0,1,0,0,en,1521480633050361856,"[{'domain': {'id': '71', 'name': 'Video Game', 'description': 'A video game like Overwatch'}, 'entity': {'id': '1088118927580774400', 'name': 'Roblox', 'description': 'Roblox'}}]",,,False,,everyone,Twitter for Android
1521480631607250946,1274546387380822017,I TOOK A NAP AND SKAYZ AND ROBLOX ARE IN THE SAME CKING SENTENCE NOW ??,2022-05-03 13:23:44+00:00,,0,0,0,0,en,1521480631607250946,"[{'domain': {'id': '71', 'name': 'Video Game', 'description': 'A video game like Overwatch'}, 'entity': {'id': '1088118927580774400', 'name': 'Roblox', 'description': 'Roblox'}}]",,,False,,everyone,Twitter for Android
1521480618474975237,1119149199524634625,i remember dropping minecraft for roblox,2022-05-03 13:23:41+00:00,,0,0,0,0,en,1521480070942302210,"[{'domain': {'id': '45', 'name': 'Brand Vertical', 'description': 'Top level entities that describe a Brands industry'}, 'entity': {'id': '781974597310615553', 'name': 'Entertainment'}}, {'domain': {'id': '46', 'name': 'Brand Category', 'description': 'Categories within Brand Verticals that narrow down the scope of Brands'}, 'entity': {'id': '781974597218340864', 'name': 'Video Games'}}, {'domain': {'id': '71', 'name': 'Video Game', 'description': 'A video game like Overwatch'}, 'entity': {'id': '10043689888', 'name': 'Minecraft'}}, {'domain': {'id': '71', 'name': 'Video Game', 'description': 'A video game like Overwatch'}, 'entity': {'id': '1088118927580774400', 'name': 'Roblox', 'description': 'Roblox'}}]","{'annotations': [{'start': 20, 'end': 28, 'probability': 0.4661, 'type': 'Product', 'normalized_text': 'minecraft'}]}",,False,,everyone,Twitter for iPhone
1521480616335708161,1506043903190863874,Anyone plays bedwars on roblox? I’ll be giving away a kit maybe after tomorrow 👀,2022-05-03 13:23:41+00:00,,0,0,0,0,en,1521480616335708161,"[{'domain': {'id': '71', 'name': 'Video Game', 'description': 'A video game like Overwatch'}, 'entity': {'id': '1088118927580774400', 'name': 'Roblox', 'description': 'Roblox'}}]","{'annotations': [{'start': 24, 'end': 29, 'probability': 0.4343, 'type': 'Product', 'normalized_text': 'roblox'}]}",,False,,everyone,Twitter for iPad
1521480616042446848,1505475307792347146,"sup
Just released a new video go check out my channel https://t.co/3deGhuxZl2

#roblox #lol #cool #bruh #youtube 
#wassup #idk",2022-05-03 13:23:41+00:00,,0,0,0,0,en,1521480616042446848,"[{'domain': {'id': '71', 'name': 'Video Game', 'description': 'A video game like Overwatch'}, 'entity': {'id': '1088118927580774400', 'name': 'Roblox', 'description': 'Roblox'}}]","{'urls': [{'start': 54, 'end': 77, 'url': 'https://t.co/3deGhuxZl2', 'expanded_url': 'https://youtube.com/channel/UCnCjNLiPtasklaTcHugTRxQ', 'display_url': 'youtube.com/channel/UCnCjN…'}], 'hashtags': [{'start': 79, 'end': 86, 'tag': 'roblox'}, {'start': 87, 'end': 91, 'tag': 'lol'}, {'start': 92, 'end': 97, 'tag': 'cool'}, {'start': 98, 'end': 103, 'tag': 'bruh'}, {'start': 104, 'end': 112, 'tag': 'youtube'}, {'start': 114, 'end': 121, 'tag': 'wassup'}, {'start': 122, 'end': 126, 'tag': 'idk'}]}",,False,,everyone,Twitter for Android
1521480615811502086,1195095959388114944,"oooo that's why may urge ako maglaro ng roblox last month,,, noice may acc na q https://t.co/6OjNJe9jt9",2022-05-03 13:23:41+00:00,,0,0,0,0,tl,1521480615811502086,"[{'domain': {'id': '10', 'name': 'Person', 'description': 'Named people in the world like Nelson Mandela'}, 'entity': {'id': '1062427352318173185', 'name': 'Stray Kids', 'description': 'Stray Kids (스트레이 키즈)'}}, {'domain': {'id': '45', 'name': 'Brand Vertical', 'description': 'Top level entities that describe a Brands industry'}, 'entity': {'id': '781974597310615553', 'name': 'Entertainment'}}, {'domain': {'id': '46', 'name': 'Brand Category', 'description': 'Categories within Brand Verticals that narrow down the scope of Brands'}, 'entity': {'id': '781974597222535168', 'name': 'Online Services'}}, {'domain': {'id': '47', 'name': 'Brand', 'description': 'Brands and Companies'}, 'entity': {'id': '10040276669', 'name': 'Spotify'}}, {'domain': {'id': '54', 'name': 'Musician', 'description': 'A musician in the world, like Adele or Bob Dylan'}, 'entity': {'id': '1062427352318173185', 'name': 'Stray Kids', 'description': 'Stray Kids (스트레이 키즈)'}}, {'domain': {'id': '55', 'name': 'Music Genre', 'description': 'A category for a musical style, like Pop, Rock, or Rap'}, 'entity': {'id': '888105153038958593', 'name': 'K-pop', 'description': 'K-Pop'}}, {'domain': {'id': '30', 'name': 'Entities [Entity Service]', 'description': 'Entity Service top level domain, every item that is in Entity Service should be in this domain'}, 'entity': {'id': '848920371311001600', 'name': 'Technology', 'description': 'Technology and computing'}}, {'domain': {'id': '67', 'name': 'Interests and Hobbies', 'description': 'Interests, opinions, and behaviors of individuals, groups, or cultures; like Speciality Cooking or Theme Parks'}, 'entity': {'id': '1288826829634035714', 'name': 'Backstage'}}, {'domain': {'id': '71', 'name': 'Video Game', 'description': 'A video game like Overwatch'}, 'entity': {'id': '1088118927580774400', 'name': 'Roblox', 'description': 'Roblox'}}, {'domain': {'id': '165', 'name': 'Technology', 'description': 'for individual and types of technology, e.g., food technology, 3D printing'}, 'entity': {'id': '848920371311001600', 'name': 'Technology', 'description': 'Technology and computing'}}]","{'urls': [{'start': 80, 'end': 103, 'url': 'https://t.co/6OjNJe9jt9', 'expanded_url': 'https://twitter.com/MusicWeek/status/1521470080462295043', 'display_url': 'twitter.com/MusicWeek/stat…'}]}",,False,,everyone,Twitter for Android
1521480614167203840,1340995674834268160,not even stray kidz can make me download roblox,2022-05-03 13:23:40+00:00,,0,0,1,0,en,1521480614167203840,"[{'domain': {'id': '71', 'name': 'Video Game', 'description': 'A video game like Overwatch'}, 'entity': {'id': '1088118927580774400', 'name': 'Roblox', 'description': 'Roblox'}}]",,,False,,everyone,Twitter for iPhone
1521480600560934912,1445304993402142728,Ha anonh roblox nalingat lang ako ah https://t.co/FgaVBh5HiE,2022-05-03 13:23:37+00:00,,0,0,0,0,tl,1521480600560934912,"[{'domain': {'id': '71', 'name': 'Video Game', 'description': 'A video game like Overwatch'}, 'entity': {'id': '1088118927580774400', 'name': 'Roblox', 'description': 'Roblox'}}]","{'urls': [{'start': 37, 'end': 60, 'url': 'https://t.co/FgaVBh5HiE', 'expanded_url': 'https://twitter.com/goIfIefleur/status/1521475562807738375', 'display_url': 'twitter.com/goIfIefleur/st…'}]}",,False,,everyone,Twitter for Android
1521480599302774786,1387770281305980947,"man idk anything about roblox and i genuinely dont wanna know , so ill just watch you all play , im supporting you guys https://t.co/3IeS01t73x",2022-05-03 13:23:37+00:00,,0,0,0,0,en,1521480599302774786,"[{'domain': {'id': '71', 'name': 'Video Game', 'description': 'A video game like Overwatch'}, 'entity': {'id': '1088118927580774400', 'name': 'Roblox', 'description': 'Roblox'}}]","{'urls': [{'start': 120, 'end': 143, 'url': 'https://t.co/3IeS01t73x', 'expanded_url': 'https://twitter.com/3rdeyedefender/status/1521480599302774786/photo/1', 'display_url': 'pic.twitter.com/3IeS01t73x', 'media_key': '16_1521480591358763009'}]}",{'media_keys': ['16_1521480591358763009']},False,,everyone,Twitter for Android
1521480596891090947,1372858356793102340,skz really made me make a roblox account... the things i do for them,2022-05-03 13:23:36+00:00,,0,0,0,0,en,1521480596891090947,"[{'domain': {'id': '71', 'name': 'Video Game', 'description': 'A video game like Overwatch'}, 'entity': {'id': '1088118927580774400', 'name': 'Roblox', 'description': 'Roblox'}}]",,,False,,everyone,Twitter for Android
